"I think it's crazy to consider not getting a top 25 player, or two top 50 guys back for Kyrie, especially when you can get a decent defense by just filling out the roster. Getting Javale and Ariza or someone like that would make a good difference. Andre Drummond would help a lot. Just casually giving away one of the game's great players just feels like such a miss, especially when they're at their absolute peak ."
Nets need a center. Waiting for that Andre Drummond buyout
"Ehh yes and no. Weve definitely won games this year just because no one else could bang with drummond (pistons game, Knicks game and 2nd nets game) I think at his best there is very few centers who can rebound with him or handle him down low. Hes in a weird spot right now because the cavs have such a young team that we are trying to develop so it's an odd mix of trying to put Drummond and love into this young teams offense because theres only so many touches to go around . Where Andre gets in trouble is when we let him handle the ball for long stretches. I think that's a bickerstaff issue though and not a drummond issue. Make no mistake, coming from someone who has watched every cavs game, he is a definite upgrade over DeAndre Jordan and I think if he played with durant harden and Irving he would accept his role and be the inside presence you guys are missing. Hes also a way better defender than people  realize (top ten in steals). I dont see how he wouldnt make the nets better. They have such a glaring hole that he can help mend"
"I honestly don't see a buyout happening either, but it's been reported by 2 sources now (Zach harper and Kevin o'connor).   Now the only way I see this happening is andre requests a buyout and leaves a ton of money on the table. His agent is also kevin love. Management likes to be on good sides with agents now. As we know, we are in the player empowerment era of the league. Players usually get what they want.   And also this would give more minutes to allen. He's due for a new contract and this move will help evaluate him better without drummond there.  Again I don't see it happening but being a nets fan. I hope it will lol."
"This is crazy. Luka is averaging 27/9/9 carrying his team. Ayton is what, the third or fourth best on his team depending how high on bridges you are. Swap those 2 and see what happens. Mavs become one of the bottom 3 teams in the league and the Suns would be much better. It blows me away anyone thinks Ayton should’ve been drafted first. Y’all really think when there’s a minute left  and ayton has to make a play on AD or Embiid he’s gonna go from “afraid with the ball” to killer when he’s shown a passivity for shooting and nothing more than 10 ft range. Basically, I’m saying is Luka is a future MVP and multi-time champion and Deandre is a younger, cooler Andre Drummond."
"What would the package be?  James Johnson, WCS/Dwight Powell and a pick for Andre Drummond? I have no clue, just spitballin here"
The difference between Jarrett Allen and Drummond is literally night and day. holy shit i don't ever want andre to start
"Do we actually look like a basketball team today, or is it the Andre Drummond show again? Just turned on the game."
"To be fair there are ""empty stats"" but people just give that label to any player putting up good numbers on a bad team. It should just be reserved for players with low efficiency, high volume stats like Dennis Smith jr who averaged 15/4/5 on a woeful 47%TS or Andre Drummond who is averaging 18/15/3 on 50%TS which for a guy who should just be catching lobs/dunking is awful. Those are truly empty stats because neither player is actually making a meaningful contribution to winning."
Andre Drummond - Karl Anthony Towns
"Tells you a lot more about how valuable it is to accrue 15ppg and 15 rpg in today's game than it does about andre drummond.  All that said, the Hornies should try to snap drummond up for nothing.  Give him biyombo's minutes--thats gotta have a nice impact right?"
"DBPM is especially bad (box-score only).  On/off-based advanced defensive metrics are much lower on him.  [Pure RAPM has him 410th in the league](http://nbashotcharts.com/rapm?id=1509949181)   [RPM has him 367th](http://www.espn.com/nba/statistics/rpm/_/page/10/sort/DRPM)   RAPTOR has him 199th    The one RAPM-based thing that really likes him on defense is [EPM](https://dunksandthrees.com/epm), but it also really likes Andre Drummond (also hated by pure RAPM), so I'm guessing that EPM is leaning pretty hard on the box numbers while the RAPM sample is small."
  **Cavaliers @ Timberwolves**  [](/CLE) **104 -  109** [](/MIN)  **Box Scores: [NBA](http://www.nba.com/games/20210131/CLEMIN#/boxscore) &amp; [Yahoo](http://sports.yahoo.com/nba/cleveland-cavaliers-minnesota-timberwolves-2021013116)**  |**Team**|**Q1**|**Q2**|**Q3**|**Q4**|**Total**| |:---|:--|:--|:--|:--|:--| |Cleveland Cavaliers|35|26|25|18|104| |Minnesota Timberwolves|30|25|33|21|109|  **TEAM STATS**  |**Team**|**PTS**|**FG**|**FG%**|**3P**|**3P%**|**FT**|**FT%**|**OREB**|**TREB**|**AST**|**PF**|**STL**|**TO**|**BLK**| |:--|:--|:--|:--|:--|:--|:--|:--|:--|:--|:--|:--|:--|:--|:--| |Cleveland Cavaliers|104|41-84|48.8%|4-16|25.0%|18-23|78.3%|10|55|20|14|3|19|3| |Minnesota Timberwolves|109|41-91|45.1%|16-40|40.0%|11-15|73.3%|7|34|24|25|10|8|11|  **TEAM LEADERS**  |**Team**|**Points**|**Rebounds**|**Assists**| |:--|:--|:--|:--| |Cleveland Cavaliers|**25** Andre Drummond|**22** Andre Drummond|**5** Darius Garland| |Minnesota Timberwolves|**23** Anthony Edwards|**8** Jarred Vanderbilt|**8** Ricky Rubio|
"Andre is still our starting C and they’re playing Allen w/ backup minutes, 15-20 per game. Allen is the future; most of us are convinced they’re letting Drummond put up stats before the deadline so he can get traded."
Sexton had no legs and someone made the inexplicable decision to allow Andre Drummond on the court
The day Andre Drummond is no longer on the Cavs will be the happiest day of my life as a fan since June 19th 2016. I can't stand watching this bum stat pad anymore.
"Andre Drummond makes my blood boil man. Great looking stats, awful everywhere that matters. Watching him trying to hero ball there was pathetic"
"Yeah when it comes to double doubles, Wilt holds all the records. I remember earlier this season Andre Drummond posted his 44th (I could be wrong) 20 point 20 rebound double double but yet isn’t even 1/4th of the way to Wilt."
That's Andre Drummond.
"Wait wait, did you say you'd rather force Nance to shoot instead of *Drummond*?  You want Nance, a guy who shot 35% from three last year and is currently shooting 38% and has an average shot distance of 14.3 feet, to shoot.  A guy with a 57.3% TS%.  You'd rather have your defense make him shoot, rather than let renowned sharpshooter Andre Drummond, who is a career 13.6% shooter from three and currently has an average shot distance of 3.6 feet and a TS% of 49.7%, take a shot.  My man, what is wrong with you?  EVERYONE on our team should be shooting more often than Drummond.  You also mentioned Windler and Cedi, which is weird because if they're open they absolutely *should* be taking the shot every time.  Windler is an excellent shooter!  Cedi's okay!  Both are FAR better than Drummond!"
  **Cavaliers @ Knicks**  [](/CLE) **81 -  102** [](/NYK)  **Box Scores: [NBA](http://www.nba.com/games/20210129/CLENYK#/boxscore) &amp; [Yahoo](http://sports.yahoo.com/nba/cleveland-cavaliers-new-york-knicks-2021012918)**  |**Team**|**Q1**|**Q2**|**Q3**|**Q4**|**Total**| |:---|:--|:--|:--|:--|:--| |Cleveland Cavaliers|17|16|22|26|81| |New York Knicks|19|28|25|30|102|  **TEAM STATS**  |**Team**|**PTS**|**FG**|**FG%**|**3P**|**3P%**|**FT**|**FT%**|**OREB**|**TREB**|**AST**|**PF**|**STL**|**TO**|**BLK**| |:--|:--|:--|:--|:--|:--|:--|:--|:--|:--|:--|:--|:--|:--|:--| |Cleveland Cavaliers|81|29-84|34.5%|8-26|30.8%|15-18|83.3%|14|43|15|20|8|14|5| |New York Knicks|102|39-80|48.8%|10-27|37.0%|14-16|87.5%|8|41|20|24|8|13|6|  **TEAM LEADERS**  |**Team**|**Points**|**Rebounds**|**Assists**| |:--|:--|:--|:--| |Cleveland Cavaliers|**24** Darius Garland|**15** Andre Drummond|**5** Collin Sexton| |New York Knicks|**25** Immanuel Quickley|**8** Julius Randle|**6** Julius Randle|
"I don't know about Andre Drummond. I know his raw numbers are very impressive but 50.1% true shooting from a center is crazy bad. Like, *astoundingly* bad. How can a man be THAT big and THAT athletic and shoot 52.6% at the rim?!? Just dunk it for 60% FG like every other center!"
1st Team:   Stephen Curry Luka Doncic  Lebron James Kevin Durant  Joel Embiid  2nd Team:   Damian Lillard Bradley Beal Kawhi Leonard Giannis Antetekounmpo Nikola Jokic  3rd Team:   Kyrie Irving Jaylen Brown Paul George  Anthony Davis Andre Drummond
And Andre Drummond 'fore him
"So nobody is gonna talk about Andre Drummond, the disrespect is real for my man"
Andre Drummond by a long shot
Andre Drummond
"Andre Drummond is in buyout rumors, and I can't think of many players who'd be a better fit for us than him"
Easily Andre Drummond
Andre Drummond will shoot a perplexed look to the ref no matter the situation.
"Something people forget about Andre Drummond...  Kyle Lowry was not always Kyle Lowry. Kawhi was not always Kawhi. Hell, LeBron and Jason Kidd were not the shooters they later became when they were early in their career. It takes time to develop.   How do we know he’s even THAT bad of a shooter? Granted, his shooting is poor right now, but we’ve seen him take so few shots that we can’t say for sure that he’s really any worse than a guy like Giannis."
"Why would they re-sign him? He's going to want a max deal or something close to a max deal and there are teams out there stupid enough to do that. So now the Cavs are going to hamstring themselves by loading up the same situation they have now except with a more untradeable contract? Who is going to want to give up valuable assets for Andre Drummond on a long-term, overpriced deal?      If they can get picks or a bad contract that can fit their team, more power to them. But anything outside of an NBA2k trade finder, I don't see it. There's a reason Detroit gave him up for nothing."
  **Pistons @ Cavaliers**  [](/DET) **107 -  122** [](/CLE)  **Box Scores: [NBA](http://www.nba.com/games/20210127/DETCLE#/boxscore) &amp; [Yahoo](http://sports.yahoo.com/nba/detroit-pistons-cleveland-cavaliers-2021012705)**  |**Team**|**Q1**|**Q2**|**Q3**|**Q4**|**Total**| |:---|:--|:--|:--|:--|:--| |Detroit Pistons|28|28|26|25|107| |Cleveland Cavaliers|32|22|36|32|122|  **TEAM STATS**  |**Team**|**PTS**|**FG**|**FG%**|**3P**|**3P%**|**FT**|**FT%**|**OREB**|**TREB**|**AST**|**PF**|**STL**|**TO**|**BLK**| |:--|:--|:--|:--|:--|:--|:--|:--|:--|:--|:--|:--|:--|:--|:--| |Detroit Pistons|107|37-82|45.1%|11-27|40.7%|22-29|75.9%|13|40|29|21|7|22|5| |Cleveland Cavaliers|122|47-87|54.0%|11-21|52.4%|17-23|73.9%|8|37|24|22|14|16|7|  **TEAM LEADERS**  |**Team**|**Points**|**Rebounds**|**Assists**| |:--|:--|:--|:--| |Detroit Pistons|**26** Jerami Grant|**12** Mason Plumlee|**7** Delon Wright| |Cleveland Cavaliers|**29** Collin Sexton|**16** Andre Drummond|**6** Isaac Okoro|
Those are terrible comparisons. Andre Drummond is nowhere near that level and has an expiring contract. His only value to the Cavs in terms of their ability to compete in the future is as trade bait.
Yea plus when Andre Drummond gets bought out and ends up a Net  🙄
"lol this is just proof that the stats will live forever, there will probably be some ""damn andre drummond was so underrated"" posts in 20 yrs"
"It's not so much he's washed, he's a good player and still athletic, he just doesn't play winning basketball (see also demar derozan, andre drummond)."
at this point just give me andre drummond
Andre Drummond will be one of the most overrated of all time. The King of empty stats.
"In 2k I had always found it unrealistic that players could miss that many easy layups, and then I watched Andre Drummond"
Andre Drummond
Andre Drummond
Who wants to send $29 million in salary for Andre Drummond?
"Defensive Rebounding on a team that should have been a contender in those Lob City Clippers.  I seriously wonder if that's why 2k has Andre Drummond win DPOY a bunch because they overrate rebounding as a defensive metric.  And he had a few years of pretty great block totals, but he'd more often than not put himself out of position chasing blocks and give up an easy basket."
Recently it's been Andre Drummond.
https://cavaliersnation.com/2021/01/27/its-matter-time-until-andre-drummond-secures-buyout-joins-brooklyn-nets/
"Makes sense for the Cavs if they’re trying to save money.   Makes sense for Drummond. He’s already starting to share hella minutes with JA and JA often closing out games. Drummonds contract is huge at $29millie and championship caliber teams that could use him don’t have the space to trade for him.  With JA eating up more and more of Drummonds minutes the less of a chance he has at showcasing his skills for another contract in the offseason. If he gives up a few million he can start for the Nets, have a good playoff showing, maybe win a chip and be a highly coveted free agent.  As of now if Drummond stays on the Cavs I don’t see him getting a big long term contract. The Cavs aren’t gonna sign him to anything big now with JA and he really hasn’t shown anything other than empty stats.  If Andre wants to play and have the best chance of getting another good contract the buyout makes the most sense."
"Please make it happen. I need to see Andre Drummond shooting 15 times a game on a team with KD, Harden, and Irving. Plus Embiid is his father."
I'm surprised Andre Drummond hasn't accomplish this feat. /s
Andre Drummond has been doing something similar for a while now...
This sounds a little risky but go for a defensive PF/ Center and have Towns move to PF. You will have to take somebody that’s going to be going at the deadline and outbid the Nets. So I’m totally biased but Andre Drummond would give a huge boost (when motivated to play defense which JB somehow pulled off on the Cavs).  Notice how the Cavs had the worst defensive players last year for guards but this year with good schemes and Effort from the players we are grit and grinding our way to the play offs. So a defensive minded coach would help too.
What do you got for Andre Drummond?
**Stars with a good shot**  AD/Giannis/Joker/Luka/Simmons/Sabonis  **Very good players with a shot**  Draymond Green/LaMelo Ball/Lonzo Ball/Clint Capela/Andre Drummond/Dejounte Murray/Myles Turner  **Maybe somehow if they get play time (even if it is extremely unlikely)**  Elfrid Payton/Rajon Rondo
  **Nets @ Cavaliers**  [](/BKN) **113 -  125** [](/CLE)  **Box Scores: [NBA](http://www.nba.com/games/20210122/BKNCLE#/boxscore) &amp; [Yahoo](http://sports.yahoo.com/nba/brooklyn-nets-cleveland-cavaliers-2021012205)**  |**Team**|**Q1**|**Q2**|**Q3**|**Q4**|**Total**| |:---|:--|:--|:--|:--|:--| |Brooklyn Nets|33|27|24|29|113| |Cleveland Cavaliers|34|27|37|27|125|  **TEAM STATS**  |**Team**|**PTS**|**FG**|**FG%**|**3P**|**3P%**|**FT**|**FT%**|**OREB**|**TREB**|**AST**|**PF**|**STL**|**TO**|**BLK**| |:--|:--|:--|:--|:--|:--|:--|:--|:--|:--|:--|:--|:--|:--|:--| |Brooklyn Nets|113|42-87|48.3%|14-43|32.6%|15-17|88.2%|6|29|23|25|5|11|8| |Cleveland Cavaliers|125|45-87|51.7%|8-25|32.0%|27-32|84.4%|13|50|24|18|7|12|3|  **TEAM LEADERS**  |**Team**|**Points**|**Rebounds**|**Assists**| |:--|:--|:--|:--| |Brooklyn Nets|**38** Kyrie Irving|**7** Joe Harris|**11** James Harden| |Cleveland Cavaliers|**25** Collin Sexton|**16** Andre Drummond|**9** Collin Sexton|
You mean like a rotation? Andre Drummond is definitely a starting caliber player.
Cavs really got Jarrett Allen for a late first and Andre Drummond for a second. Cavs front office is playing chess while some of these guys are playing checkers.
Is anyone else surprised by how mobile Andre Drummond is for a big guy?
Andre Drummond has the worst body language in the league
**WE NEED ANDRE DRUMMOND FOR MALIK MONK AND ZELLER**
Andre Drummond literally wrecks the cavs offense
"Andre Drummond is playing like he’s scared for his job.  Forcing shots, calling for passes, not passing"
"Would shaq be Andre Drummond? Plenty of rebounds but useless at floor spacing,"
"if i truly believed stats = value, then i would've said andre drummond deserves a supermax"
Andre Drummond being only 27 years old was my biggest takeaway from this post. Thought for sure this dude was around 30.
Andre drummond
Andre Drummond
"4/18 is always a bad shooting game. But shooting != scoring, necessarily.   If Harden also hit 20/20 FTs then he had an efficient scoring game, which is what his TS% will reflect. Likewise, if DeAndre Jordan makes 5/5 dunks then he had an efficient scoring night even though he can't shoot a lick.   FTAs are naturally more efficient than FGAs, with a few exceptions (Andre Drummond, etc). So if you're trying to measure scoring efficiency, of course FTs need to be factored in. A point from a FT is still a point scored."
"Clint Capela, Jarrett Allen, Andre Drummond, Nikola Vucevic  How would you rank those players"
Embiid draws extra fouls from big men all the time through talk. Andre Drummond notably has blown up on him. Also Embiid seems to keep momentum flowing when he’s jawing
Andre Drummond is so awful it’s amazing how he sees time on the floor
"Andre Drummond, too! And Corny Thompson, both from Middletown. John Pinone, who coaches boys hoops (or did he retire?) at Cromwell. And RIP ""Soup"" Campbell, who never made it to the NBA, but was a superstar at Providence.  Edit: I guess Drummond was born in NY."
"That's really fucking bad. You can't have a guard shooting like Andre Drummond  Like his shooting would be okay if he could drive and finish but when fouling costs for so little, it's gonna hurt your chances"
imagine being tackled by andre drummond lmao he’s huge
Andre Drummond has tree trunk legs
"If the Nets can beat Andre Drummond and Cedi Osman, who else in the East has a chance of stopping them? The answer is no one."
why is clevelands offense entirely andre drummond post ups.
Yea the issue is where someone was born vs. where they grew up. Andre Drummond was born in NY but grew up in CT and calls the state home. But he wouldn't be included for CT.
"I looked up KZ Okpala the other day and Wikipedia had this:  &gt; In 2021, Maxwell Stone rated him as the 97th Greatest Basketball Player of All time, directly behind Andre Drummond in his all time rankings."
"# [Yesterday's Game Thread Index](https://www.reddit.com/r/nba/comments/l0jd38/trade_talk_tuesday_game_thread_index/)  # Top Highlights:  0. [[Highlight] Better angle of Mitchell’s unreal pass to Bogdanovic](https://streamable.com/m9b2y8) | [(Comments)](/r/nba/comments/l10ggo/highlight_better_angle_of_mitchells_unreal_pass/)  0. [[Highlight] Victor Oladipo and Thad Young share a moment](https://streamable.com/nj1v3v) | [(Comments)](/r/nba/comments/l0r2d7/highlight_victor_oladipo_and_thad_young_share_a/)  0. [[Highlight] Mitchell with an incredible dime to Bojan, who drills the 3](https://streamable.com/1twrk2) | [(Comments)](/r/nba/comments/l108s2/highlight_mitchell_with_an_incredible_dime_to/)  0. [[Highlight] Facu Campazzo gets the steal and completes a backwards pass between the defenders legs to Monte Morris, who lays it in.](https://streamable.com/c77mrp) | [(Comments)](/r/nba/comments/l103h3/highlight_facu_campazzo_gets_the_steal_and/)  0. [[Highlight] Rudy Gobert rejects Zion at the rim](https://streamable.com/k6dkhx) | [(Comments)](/r/nba/comments/l10anb/highlight_rudy_gobert_rejects_zion_at_the_rim/)  # Day in the history:  ### Monday, January 20, 2020  Damian Lillard of the Portland Trail Blazers scored 61 points in a 129-124 win over the Golden State Warriors.  ### Saturday, January 20, 2018  Lou Williams of the Los Angeles Clippers recorded 10 steals in a 125-113 loss to the Utah Jazz.  ### Wednesday, January 20, 2016  Andre Drummond sets a record for most free throw attempts in a half with 28, in a win over the Rockets  Daily Discussion Thread : [Rules](https://www.reddit.com/r/nba/wiki/rules#wiki_daily_discussion_thread)"
Because the Knicks are average and the Cavs are terrible. It’s not complicated. The Cavs best player is Andre Drummond. Idk why you wanna argue in circles but the Cavs fucking suck and nothing you say can change that.
Sources tell me that the Cavs are signing Len to play PG.      Cavs starting lineup:  PG: Alex Len  SG: Kevin Love  SF: Jarrett Allen  PF: Javale Mcgee  C: Andre Drummond
You want Andre Drummond?
"A trade I'd be a big fan of is:  **Cavs trade:** Andre Drummond.   **Hornets trade:** Miles Bridges, Malik Monk, Cody Zeller.   Monk is out of favour there, Bridges has lost his starting job to Hayward, and Zeller expires at the end of this season just like Drummond.   Cavs get another wing in Bridges and the chance to take a swing on Monk."
"Alex Len isn't good.  For real, if the Raptors are still trying to contend this year, I'd like to see the Raptors acquire Nikola Vucevic.  Not sure how though, since I imagine FVV and OG are untouchable.  The alternative could be Andre Drummond, but he doesn't fit the Raptors style-of-play at all."
"The Wizards are in DC and probably preoccupied with that mess, right? So not aware of recent developments?  We have a SLIGHTLY used and VERY talented Kevin Porter Jr along with a 20 and 20 player in Andre Drummond to sweeten the deal"
"Yep, now he gets to fight with Andre Drummond and JaVale McGee for minutes in Cleveland. Much better."
What’s the price of Jarrett Allen or Andre Drummond?
okay yeah youre right andre drummond isos are way better
"&gt; Pistons: plays him after trading Drummond and balls out  I've been wrong about a lot of Pistons things in my life (thought we got too little for Stackhouse, thought Chauncey would just be Super Atkins, thought Darko was the final piece) but I'm proud to say I was all about Christian Wood from the moment I saw him in the 2019 preseason.   Granted, at first it was mostly just because I loved that he dunked like he was angry at the rim but over time, he really seemed to have a positive effect on the action whenever he was out there. I swear the Pistons were better with him on the floor than Andre even before he started eating up playing time post-Andre.   I'm pretty bummed Detroit couldn't hang onto him. Glad Jerami's doing well at least though."
"I mean he's right.     Ben Simmons (much like Andre Drummond &amp; a few other guys) basically have to get paid that much because they're elite at a few things on the court, you just don't want it to be your team that does it."
"If Andre Drummond ends up on a contender / championship team towards the end of his career, people will look back with more respect for the numbers he put up."
Myles Turner &amp; Andre Drummond snubs
Andre Drummond
Wonder if they could get Andre Drummond since he’s on an expiring and I assume Jarrett Allen is their center of the future?
""" try to use some semblance of logic. ""  Ignores half my argument and tells me to use some logic... it would be logical to not nit pick individual pieces and frame them to sound like something i didn't say.  ""So the idea that you've watched him play so he's not underrated is flat out idiotic""  Perfect example of you putting words in my mouth. Because i say i've seen him play and know how good he is you assume that's my whole argument. Great logic  ""media never talks about him"" not anymore after 2 first round exits lol, he was talked about in the 2018-2019 season but maybe you weren't watching basketball then.  Is Andre Drummond talked about anymore? Rarely. Is that because he's ""underrated"". No it's because he was the best player on his team until Blake showed up and we realized he's not that good.  Was Kemba the best player on Charlotte, yes... But ever since he got to Boston, he doesn't look like that player anymore? Weird... i think not.  &amp;#x200B;  ""Vuc is underrated because the casual fan wouldn't even know who he is, because no one talks about him. That's why he's underrated.""  If this is just about casual fans (lol) then sure but i really don't care who the casuals think is the most underrated player..."
"Andre Drummond for example, I'm having a tough time finding a team that would want him AND has the disposable contracts to send Cleveland's way. I could see them waiving him, and him signing with the Nets."
Where is Andre Drummond
"Assists &gt;&gt;&gt; Rebounds  I take the best floor general over Andre Drummond for sure. So many players can't really create their own shot against the best defenses, they absolutely need their teammates."
Andre Drummond
"I can’t remember if it was him or Andre Drummond, but iirc one player used VR to simulate a game setting to improve their free throws"
"Chris Paul denies player option, signs with BKN on vet min. BKN signs Drummond to vet min, Dinwiddies returns from injury. Imagine that   James Harden  Kyrie Irving  Joe Harris  Kevin Durant  Andre Drummond  Bench mob:  CP3  Dinwiddie  Bruce Brown  Blake Griffin  Claxton     the dankest timeline"
Nah u right it’d be so much better to have Boogie and Andre fucking Drummond demanding post touches and clogging up the paint for LeBron and AD on dogshit efficiency
"Huh, Blake Griffin isn’t Andre Drummond... big yikes when it comes to our centre’s."
Damn imagine being told you’re the backup choice for Andre Drummond
"Andre Drummond getting that cavs buyout, jus saying"
