"For what it’s worth, the defensive metrics weren’t super kind to AD as a rookie defender. Idk what that means and don’t have enough memory of rookie AD to put context to it, but watching Mobley, I highly highly doubt that is the case for him.   Stop here unless you want to read my fan boy take.   I’ve seen a ton of Jarret Allen, Larry Nance jr, Javale McGee and Andre Drummond the past year. Maybe it’s bias, maybe it’s wishful thinking, or something else. The most impactful defender today might be Mobley. Allen is more steady and fundamental,  Javale is longer, Nance is stronger and has fewer lapses, and Drummond may fill up the stat sheet more, but none of them have his combo of skill, athleticism, versatility and iq and he occasionally flashes that elite elite Gobert, Draymond, Kawhi and etc level of just knowing almost exactly what’s going to happen and just beating guys to the spot."
"We’ve seen regular season Rondo, Danny Green try to dribble the ball, Avery Bradley initiate an offense, Javale McGee post ups, Kyle Kuzma, and Andre Drummond play 25 minutes a night. Russ’s turnovers are coming from him being too unselfish, so I’m not worried at all about the preseason."
"lol no, 6MOY players are normally 6”2 guards that play no defense and scores 20 off the bench      Andre Drummond is a fat 6”10 big man who does nothing but clog the lane and ruins his teams offensive flow by bricking 5 putbacks per possession"
andre drummond 6th man of the year
Andre Drummond: causing injuries in sports since Super Mario 64
"No normal person would read this tweet and think “oh Drummond injured Shake, Fuck Drummond…”   It obviously reads that Shake injured himself, and Andre was involved in the play.   Some people are so sensitive Jesus Christ. Ben has turned everyone into pansies stg."
This is fueling my Andre Drummond hate wagon
"Poole averaged 12ppg in 20mpg last season and he didnt even get any momentum for first half of the season bcs of Wanamaker. No reason to not believe he cant average 18ppg in 30+mins.  Nemanja has always been a solid stretch big just that he didnt get any playing time on the Heat. Iggy is old but his perimeter defense was still good last season with the heat. Agree with the OPJ injury issue which is why I said assuming everyone is healthy bcs if you want to take into account injury theres a high chance Porzingis will be out this season as well. Reggie Bullock is the only good addition. Isnt Bruce Brown with the Nets lol? And Moses Brown is only good if you look at the box score, hes basically Andre Drummond Jr, if you watched enough Thunder games last season you will understand, or maybe you can ask any Thunder fans"
"At the time, the general consensus was that DeAndre Ayton had an incredible body and and phenomenal athleticism, but didn't have the best feel for the game. Like Andre Drummond. There was a solid chance that he'd flame out; it was a high risk/high reward pick"
Hahahah fuck man don’t let me think of Andre Drummond demanding the ball in the post
"PER isn’t adding any contribution to player evaluations. It ironically undervalues efficiency and assists, ignores non-box defense, and overvalues scoring, rebounding and steals. PER has a fetish for offensive rebounding. It has JV 67th, Greg Monroe 77th, Enes Kanter 60th and Andre Drummond 38th all time. The margin of error is just so high. It’s worthless."
I block Book's shit all day.  As Andre Drummond in 2K.  As close to real life as you can get
Sixers legends Greg Monroe and Andre Drummond
Andre gets some serious hate (and some deservedly so) but his situation was terrible. Never forget the Greg Monroe/Drummond pairing!
Andre Drummond. Pistons wasted damn near a decade trying to win with him and never making it out of the first round.
andre drummond
Dwight 'Andre Drummond' Howard 😂
"For those who don't know, he's a 20yo 6'6 200lb forward that's so good at rebounding he's been getting most of his minutes at centre. He was competing for boards with Andre fucking Drummond, and has a really nice touch around the rim"
Lakers fans are not the only fan base that share that sentiment about Andre Drummond. You getting excited over a couple of preseason games lol.
Kinda hard to make that argument when Lakers fans will hate on solid players like Danny Green and still act like they are no bonafide scrubs despite having good seasons elsewhere.  And even now the consensus is that Andre Drummond barely even deserves a roster spot after one underwhelming season with LA
"Andre Drummond and I don't think it is close. He has left fans of three franchises scratching there heads thinking, ""what the fuck is that? I didn't know we signed up to watch that."""
"Then he whines to everyone when you don't accept.   ""Jager said he wanted blocks yet he keeps rejecting fair trades nobody trade with him""  /resends trade offer Dwight Howard and Andre Drummond for Damian Lillard"
Andre Drummond being a great rebounder. He sucks otherwise on your team
"If health/availability is a valid metric for this then Kyrie Irving is the obvious answer for me, if we're just talking from an on court ability perspective I'd go with Andre Drummond"
  **Raptors @ 76ers**  [](/TOR) **113 -  125** [](/PHI)  **Box Scores: [NBA](http://www.nba.com/games/20211007/TORPHI#/boxscore) &amp; [Yahoo](http://sports.yahoo.com/nba/toronto-raptors-philadelphia-76ers-2021100720)**  |**Team**|**Q1**|**Q2**|**Q3**|**Q4**|**Total**| |:---|:--|:--|:--|:--|:--| |Toronto Raptors|22|33|25|33|113| |Philadelphia 76ers|27|44|27|27|125|  **TEAM STATS**  |**Team**|**PTS**|**FG**|**FG%**|**3P**|**3P%**|**FT**|**FT%**|**OREB**|**TREB**|**AST**|**PF**|**STL**|**TO**|**BLK**| |:--|:--|:--|:--|:--|:--|:--|:--|:--|:--|:--|:--|:--|:--|:--| |Toronto Raptors|113|42-87|48.3%|11-37|29.7%|18-21|85.7%|13|33|21|19|12|18|5| |Philadelphia 76ers|125|47-87|54.0%|18-37|48.6%|13-17|76.5%|11|37|28|25|14|20|5|  **TEAM LEADERS**  |**Team**|**Points**|**Rebounds**|**Assists**| |:--|:--|:--|:--| |Toronto Raptors|**22** OG Anunoby|**8** Precious Achiuwa|**5** Scottie Barnes| |Philadelphia 76ers|**16** Georges Niang|**7** Andre Drummond|**5** Tyrese Maxey|
Did somebody say Andre Drummond yet lol?
Andre Drummond &amp; D'Angelo Russell
Andre Drummond. People that just look at box scores think he’s amazing until they actually watch him play.
Lakers chose Anthony Davis over Andre Drummond? 🤮🤮🤮🤮
Andre Drummond
"Don’t laugh, but Andre Drummond has an awesome second jump."
Andre Drummond with the brick and blow by combo to lose the game
Andre Drummond is so dumb
Watching Andre Drummond play basketball is a painful experience.
Andre. Drummond.
"The simple counting math may not technically lie, but the problem is **what is measured** isn't always a good reflection of what happened:  - Like some players (Ben Simmons seems one) who may get assists without really doing anything other than handing it off to another player for a ""not great quality"" shot... but the 76ers have a lot of good shooters, so they may still make the shot, and Simmons gets a useless assist.  - Or players like Andre Drummond who may get a lot of rebounds, but aren't necessarily helping their team (I saw a post a few weeks ago that mentioned he even elbows teammates in the face for taking ""his"" rebounds).   And **what isn't measured** is important too:  - Blocks get measured, but causing a shot to be badly altered is just as useful.   I'm still big on analytics, but teams should measure more factors... and probably do, just privately."
  **Bucks @ 76ers**  [](/MIL) **118 -  109** [](/PHI)  **Box Scores: [NBA](http://www.nba.com/games/20211109/MILPHI#/boxscore) &amp; [Yahoo](http://sports.yahoo.com/nba/milwaukee-bucks-philadelphia-76ers-2021110920)**  |**Team**|**Q1**|**Q2**|**Q3**|**Q4**|**Total**| |:---|:--|:--|:--|:--|:--| |Milwaukee Bucks|30|31|30|27|118| |Philadelphia 76ers|39|19|35|16|109|  **TEAM STATS**  |**Team**|**PTS**|**FG**|**FG%**|**3P**|**3P%**|**FT**|**FT%**|**OREB**|**TREB**|**AST**|**PF**|**STL**|**TO**|**BLK**| |:--|:--|:--|:--|:--|:--|:--|:--|:--|:--|:--|:--|:--|:--|:--| |Milwaukee Bucks|118|44-95|46.3%|15-39|38.5%|15-21|71.4%|12|52|21|10|5|8|6| |Philadelphia 76ers|109|42-103|40.8%|14-43|32.6%|11-12|91.7%|13|46|21|20|7|7|7|  **TEAM LEADERS**  |**Team**|**Points**|**Rebounds**|**Assists**| |:--|:--|:--|:--| |Milwaukee Bucks|**31** Giannis Antetokounmpo|**16** Giannis Antetokounmpo|**6** Jrue Holiday| |Philadelphia 76ers|**31** Tyrese Maxey|**20** Andre Drummond|**6** Shake Milton|
insert Andre Drummond imitating Lebron pic
The only thing a stat line like this means from Andre Drummond is a Sixers loss.
Mostly Capela.  Dude was integral to the defensive foundation and also as an outlet for Trae in the PNR.  He’s been looking worse than Andre Drummond tbh.
"Another 45 Rebounds, starring Andre Drummond and Dave Joerger"
"andre drummond grabbin 25 bounds and people sit on they ass on they keyboard and say he trash, screw yall reddit clowns who always funny stuffin on a tru playa like my big boy Dre, Big Penguin aint perfect but who is? dude been ballin out, nothin but props for him and maxey too steppin up in the absence of simmons wth that mental health crisis, well crisis averted bc we got Maxey &amp; Drummond &amp; Niang &amp; Kormaz &amp; Seth Curry &amp; Thybulle &amp; future commentator and beloved tv personality OG automatic 3 Danny Grizzle &amp; of course King Embiid, Joel the top dog perennial runner up MVP . . . in life there always be ups &amp; downs , similar like to peaks and valleys of the mountains of the great adirondacks, but yoo, when those lows feel lowww af, so low that you may doubt yourself or think the future aint bright just look up to that sunshine starring bright in the sky, nourishing all of life on earth and realize that we all human and we all equal and we all have a shared experience of ups &amp; downs, pain and sorrow and joy and euphoria and remember one thing . . . TRUST THE PROCESS"
45 rebounds in 24 hours: the Andre Drummond story
"Who would be better, 5’8” Andre Drummond or 7’0 IT?   They get no time to figure out their new bodies"
Andre “The Waiter” Drummond with the tips
"andre drummond grabbin 25 bounds and people sit on they ass on they keyboard and say he trash, screw yall reddit clowns who always funny stuffin on a tru playa like my big boy Dre, Big Penguin aint perfect but who is? dude been ballin out, nothin but props for him and maxey too steppin up in the absence of simmons wth that mental health crisis, well crisis averted bc we got Maxey &amp; Drummond &amp; Niang &amp; Kormaz &amp; Seth Curry &amp; Thybulle &amp; future commentator OG automatic 3 &amp; of course King Embiid, Joel the top dog perennial runner up MVP . . . in life there always will be ups &amp; downs , similar like to peaks and valleys of the mountains of the great adirondacks, but yoo, when those lows feel lowww af, so low that you may doubt yourself or think the future aint bright just look up to that sunshine starring bright in the sky, nourishing all of life on earth and realize that we all human and we all equal and we all have a shared experience of ups &amp; downs, pain and sorrow and joy and euphoria and remember one thing . . . TRUST THE PROCESS"
Andre Drummond has 42 rebounds in the last 24 hours
"And if Andre Drummond had a 60 inch vertical, he'd score every once in a while."
Ohhhh you don't understand how excited I am to face Andre Drummond with Giannis. Giannis practically hates the man the way he destroys him every.single.matchup
Andre Drummond. Hands down!!
"Andre Drummond personally bakes a pecan pie for my family every Thanksgiving, and it gets better every year."
  **Knicks @ 76ers**  [](/NYK) **103 -  96** [](/PHI)  **Box Scores: [NBA](http://www.nba.com/games/20211108/NYKPHI#/boxscore) &amp; [Yahoo](http://sports.yahoo.com/nba/new-york-knicks-philadelphia-76ers-2021110820)**  |**Team**|**Q1**|**Q2**|**Q3**|**Q4**|**Total**| |:---|:--|:--|:--|:--|:--| |New York Knicks|28|30|14|31|103| |Philadelphia 76ers|21|23|25|27|96|  **TEAM STATS**  |**Team**|**PTS**|**FG**|**FG%**|**3P**|**3P%**|**FT**|**FT%**|**OREB**|**TREB**|**AST**|**PF**|**STL**|**TO**|**BLK**| |:--|:--|:--|:--|:--|:--|:--|:--|:--|:--|:--|:--|:--|:--|:--| |New York Knicks|103|40-91|44.0%|13-40|32.5%|10-13|76.9%|14|55|25|18|4|13|4| |Philadelphia 76ers|96|35-91|38.5%|13-40|32.5%|13-16|81.2%|12|47|20|13|7|8|6|  **TEAM LEADERS**  |**Team**|**Points**|**Rebounds**|**Assists**| |:--|:--|:--|:--| |New York Knicks|**31** Julius Randle|**12** Julius Randle|**5** Kemba Walker| |Philadelphia 76ers|**19** Furkan Korkmaz|**25** Andre Drummond|**6** Seth Curry|
Bruh people be talking ab him like he's Andre Drummond lol  It do be rough being a Harden and AD stan on this sub. Atleast my next 2 favorite players Jokic and Steph are well liked
Winning is important but not rebounding is more important for Andre Drummond
My main take away from this is that Andre Drummond is still in the NBA
Well if there is one thing we can rely Andre Drummond to do its rebound
Andre Drummond collecting every rebound and losing the game is as iconic as it gets.
"8 offensive rebounds, and they couldn't have all been from his own missed shots because he made 5 out of 9 FGA? This is a new Andre Drummond we've never seen before."
find you something to love as much as andre drummond loves rebounds
Wilt Chamberlain wishes he was Andre Drummond
Prime andre drummond with 25 boards
" Andre Drummond’s Last 7 Games against the Knicks Today (76ers) – 14 Points 25 Rebounds (37 Minutes) May 18, 2021 (Lakers) – 16 Points 18 Rebounds 3 Assists (35 Minutes) April 12, 2021 (Lakers) – 4 Points 4 Rebounds (25 Minutes) January 29, 2021 (Cavaliers) – 4 Points 15 Rebounds 2 Assists (24 Minutes) ; During the time where Andre Drummond would get decreased minutes that eventually transitioned into a buyout January 15, 2021 (Cavaliers) – 33 Points 23 Rebounds 3 Assists (39 Minutes) December 29, 2020 (Cavaliers) – 18 Points 17 Rebounds 2 Assists 6 Blocks (33 Minutes) November 6, 2019 (Pistons) – 27 Points 12 Rebounds 7 Assists (35 Minutes)"
"Ha, Andre Drummond with 25 rebounds."
Andre Drummond begs to differ
Most empty stats player?  Can I interest you in one Andre Drummond?
he should’ve played better to boost his trade value. He’s not getting the Andre Drummond treatment from us we’re not one of those organizations.
Now that Andre Drummond is actually real good it’s Russ now for the empty stats king
Just wait til he does dumbshit in the Playoffs like playing Paul Reed and Andre Drummond on the floor at the same time with Thybulle or something
He has the touch of Andre Drummond. He somehow only shoots about 50% within 5 feet
"Wasn't David Lee like Andre Drummond, a 20/10 machine but didn't exactly win you games?    Vs Draymond who's thr opposite, doesn't stuff the stat sheets every night but WILL win you the game with his defensive/offensive plays"
"and the sixers are probably fucked if embiid gets a substantial injury. behind him they have, what, andre drummond? there's a chance that curry, thybulle, maxey, green, can carry that team to a 5-8 spot, but i think without embiid or simmons, they'd be struggling."
"https://www.theringer.com/nba/2017/12/1/16722538/detroit-pistons-andre-drummond  They went on a 7 game losing streak starting the night this was published lol. Finished the year with 33 wins, obviously missing the playoffs."
That doesn’t mean it doesn’t over-value rebounding though. When Andre Drummond and Clint Capela are finishing top 15-20 consistently in any all in one stat it’s probably time  to find a better one
&gt;Dennis Schroder &gt;Andre Drummond  That's very surprising
  **76ers @ Pistons**  [](/PHI) **109 -  98** [](/DET)  **Box Scores: [NBA](http://www.nba.com/games/20211104/PHIDET#/boxscore) &amp; [Yahoo](http://sports.yahoo.com/nba/philadelphia-76ers-detroit-pistons-2021110408)**  |**Team**|**Q1**|**Q2**|**Q3**|**Q4**|**Total**| |:---|:--|:--|:--|:--|:--| |Philadelphia 76ers|31|32|23|23|109| |Detroit Pistons|32|34|16|16|98|  **TEAM STATS**  |**Team**|**PTS**|**FG**|**FG%**|**3P**|**3P%**|**FT**|**FT%**|**OREB**|**TREB**|**AST**|**PF**|**STL**|**TO**|**BLK**| |:--|:--|:--|:--|:--|:--|:--|:--|:--|:--|:--|:--|:--|:--|:--| |Philadelphia 76ers|109|41-83|49.4%|12-32|37.5%|15-22|68.2%|15|49|22|17|8|12|3| |Detroit Pistons|98|35-87|40.2%|11-36|30.6%|17-19|89.5%|12|41|21|18|6|11|2|  **TEAM LEADERS**  |**Team**|**Points**|**Rebounds**|**Assists**| |:--|:--|:--|:--| |Philadelphia 76ers|**23** Seth Curry|**10** Andre Drummond|**5** Shake Milton| |Detroit Pistons|**27** Jerami Grant|**10** Cade Cunningham|**5** Cory Joseph|
"He was playing quite well &amp; had developed some fun chemistry with Andre Drummond (please don't laugh), before doing his Achilies, and was never the same after that."
"I love how Andre Drummond plays like he's 38, but is actually younger than Anthony Davis."
Andre Drummond is a poor man's DeAndre Jordan.
Was Andre Drummond being poorly utilized by his past coaches?  Something about the Philly system seems to keep him locked in and focused.
On the other hand he doesn't have to spend a big chunk of his play time getting tackled by Andre Drummond or some equally big dude.
He is the Andre Drummond of guards
Lmao they thought Andre Drummond could carry the team while Bron and AD were injured cause they saw his box score stats from Detroit
Andre Drummond becoming a guy who makes some really good passes and embracing his role for Philly is really good for them and really frustrating for opponents.
"He's a 20/10 guy on a sub 20 win team. Andre Drummond was also a 20/10 guy on a trash team. When you're a center getting 25+ usg% on a trash team, you'll get counting stats."
"You guys are hating on DJ, but I’ll take him over the Andre Drummond experience we just went through"
"yeah, i think he's working with what he can get though, so it's always going to look shit. like he got JV when he could have gotten andre drummond. seems like a win, right?"
Because he hasn’t played next to Durant and actually cares about playing team first basketball?  And recently he hasn’t been traded around like sloppy seconds to end up where is now so he can officially put the nail in the coffin of LeBron ever winning a championship again.   He’s Andre Drummond in point guard form.  Yes he has lots of triple doubles. He’s also singlehandedly devalued the triple double.
Pretty good honesty. Tyrese Maxey and Andre Drummond have both been very good. Georges Niang has suddenly been god. A little worried about Embiid’s health and the sixers letting him play through injury tho
"[Here's a video of Andre Drummond drilling corner 3s in practice.](https://m.youtube.com/watch?v=B45gixnxnaU)  Obviously he doesn't take them in game because shooting 3s during an NBA game while exhausted, sweaty, with crowd noise, NBA defense, etc etc is much different than in a gym, but I would be surprised if there are more than like 2 NBA players who can't shoot 50% from three in practice"
Andre Drummond. Who knew?!
Agreed. And that's why I'd trade suggs for Andre Drummond based on their current performance and our understanding of ceilings
That's also an organizational failure. Hold the guy accountable. This is looking like Ben Simmons 2.0/Detroit Andre Drummond pt 3
"When you have to watch him night in and night out on your team you start to get it. I was initially excited to take a dice roll on him for cheap and hope he could work it out in Cleveland. He had a solid start to the year for the Cavs last year albeit inefficient. But as the weeks went on the inefficiency never improved as he continued to force himself as a focal point of the offense and the defensive effort and impact became less and less. By the time he was done in Cleveland he had averaged the most field goal attempts per game while also averaging his worst shooting percentage (~48%) of his career for the stint.  I think Andre Drummond is an undeniably talented player, much more talented than an average vet minimum center. But I am also under the impression that Andre thinks he is much better than he really is. And that attitude and belief does not benefit the team nor himself as he tends not to always play towards his strengths. If Andre played within himself and his skill set he would definitely have been looking at better contract offers last summer."
yeah pretty much interchangeable with embiid.  trade that always injured loser for the great andre drummond.  hes on a vet min.  he will lead them to the promised i mean processed land.  what a lad.  certified legend. epic!
"Andre Drummond, Greg Monroe, and Josh Smith walked so Embiid, Simmons, and Drummond could FLY !"
  **Trail Blazers @ 76ers**  [](/POR) **103 -  113** [](/PHI)  **Box Scores: [NBA](http://www.nba.com/games/20211101/PORPHI#/boxscore) &amp; [Yahoo](http://sports.yahoo.com/nba/portland-trail-blazers-philadelphia-76ers-2021110120)**  |**Team**|**Q1**|**Q2**|**Q3**|**Q4**|**Total**| |:---|:--|:--|:--|:--|:--| |Portland Trail Blazers|21|32|28|22|103| |Philadelphia 76ers|27|27|32|27|113|  **TEAM STATS**  |**Team**|**PTS**|**FG**|**FG%**|**3P**|**3P%**|**FT**|**FT%**|**OREB**|**TREB**|**AST**|**PF**|**STL**|**TO**|**BLK**| |:--|:--|:--|:--|:--|:--|:--|:--|:--|:--|:--|:--|:--|:--|:--| |Portland Trail Blazers|103|40-84|47.6%|12-34|35.3%|11-18|61.1%|13|45|21|15|5|14|2| |Philadelphia 76ers|113|43-83|51.8%|13-36|36.1%|14-16|87.5%|7|34|34|18|11|10|6|  **TEAM LEADERS**  |**Team**|**Points**|**Rebounds**|**Assists**| |:--|:--|:--|:--| |Portland Trail Blazers|**22** Norman Powell|**9** Jusuf Nurkic|**10** Damian Lillard| |Philadelphia 76ers|**23** Seth Curry|**15** Andre Drummond|**7** Andre Drummond|
Is Andre Drummond ALREADY the best passing big man in the east?
Russ being a 6’3 Andre Drummond is worse tbh
Andre Drummond
His starting lineup:  PG: Jeremy Lin  SG: Louis Williams  SF: Kelly Oubre Jr  PF: Montrezl Harrell  C: Andre Drummond
"rebounding isnt as important as it used to be. if it was, then andre drummond would be a full time starter on a contender and not making the vet min as a backup"
"I advocate for a tanking team to put together an all goofball team and see how they do.  My contribution to the starting lineup is Kelly Oubre, Andre Drummond, and Eric Bledsoe."
"They probably would've if they could  &gt; The Lakers promised Drummond a starting role to secure his commitment in free agency, according to two people familiar with the situation who were not authorized to discuss it publicly.  https://www.silverscreenandroll.com/2021/6/9/22525651/lakers-rumors-andre-drummond-promised-starting-job-in-buyout-free-agency"
So you're saying that andre drummond is about to be like Hakeem as he starts the second half of his career?!
Generational talent Andre Drummond
Thx for the reminder. I'll let it slide cuz Andre Drummond just decimated you guys. Call it a wash
"Joel ""Jusuf Nurkic"" Embiid and Andre ""Big Honey Penguin"" Drummond"
andre drummond with the sauce
They ran into a motherfucking surprise in Andre Drummond
PRIME ANDRE DRUMMOND
Andre Drummond triple double watch
Andre Drummond today (as of right now):  - 6 PTS  - 8 REB  - 3 AST  - 3 STL  - 0 TO
Sixers lose 125 - 104  Andre Drummond broke Wilts scoring record tho
"I dont think being all NBA is that big of an accomplishment during those years, there was no other big men worthy of those awards. His contemporaries around that time were Andre Drummond, DeAndre Jordan, Karl Anthony-Towns. Not exactly other future first ballot hall of famers. Getting voted to the all star game is the same thing, who cares about the center all star spot, his competition at the time was Rudy Gobert, someones whose entire future legacy will be based around covid.  Statistical leader doesnt mean anything either, Chris Kaman was a 20/10 player not to long ago, stats are easy on non-playoff teams.  Also I never said he was a bad player, only that his accomplishments rang really hollow because NO sucked, and the one time he did do something in the playoffs, it was off the back of Jrue playing at an incredible level."
"I didn't really follow Moses Brown all that much but a lot of OKC fans were suggesting he's a second coming of Andre Drummond. I'm not a fan of Josh Richardson by any means, but the contract he signed was very obviously for salary matching purposes in the future."
Andre Drummond?
"Andre Drummond must be one of the best big men in the league then. You can’t debate that, it’s just stats"
"There's a thousand Buddy Hield age threads, but the one that really trips me up is that he's older than Andre Drummond."
That killed me lol   Even if you’re not a fan of Derozan how tf is he worth less than Andre Drummond???
"This is your reminder that John Hollinger had DeMar DeRozan as the 12th most valuable free agent this year, valued less then 500k more per year then Andre Drummond and Bruce Brown, 4 mill a year less then Danny Green, and 8 million less a year then Duncan Robinson.  Thank you for your time, good night."
Andre Drummond really answers the question what would happen if you put a very tall oak tree into a NBA basketball game.
"His overall point is right. If you dropped George Mikan into today's NBA a guy like Andre Drummond would shit all over him. You can't really do a 1:1 comparison like that though because you'd have to assume Mikan would have access to modern training, coaching, etc and who knows how things would turn out."
