"Do not watch Andre Drummond! But definitely watch KD, he just plays perfect basketball"
"It's easy to be a draft savant when you have hindsight on your side.  I am looking at the drafts now in fact. Look at the top 5's:  2013: Bennett, Oladipo, Otto Porter Jr, Cody Zeller, Alex Len   2014: Wiggins, Jabari, Embiid, Gordon, Dante Exum   2 out of 10 players ended up being great. If anything it makes the Cavs look better for trading while the guys still had high value.  The guys still available when they drafted Waiters were Thomas Robinson, Lillard, Harrison Barnes, Terrence Ross, Andre Drummond, Austin Rivers, Meyers Leonard, Jeremy Lamb, Kendall Marshall, John Henson, etc. So in all these scenarios there's one really great player that they missed (and 4-5 other teams passed on as well). If they took Giannis #1 in 2013 the GM would've been fired on the spot.   The Bennett pick is bad and one of the worst of all-time. But even that the likely alternative would've still been considered one of the biggest busts ever (unless they took Oladipo). I remember the hype leading up to the draft Alex Len was the most common projected #1. The other picks range from average to pretty good. They took TT over Jan Vesely, Biyombo, Knight, etc. Kyrie over Derrick Williams."
"Not to mention that when Embiid sits out games, Andre Drummond will be starting in his place."
"&gt; All legends for a reason  Ah yes, the 11th best player of all time, Neil Johnston.  I also always knew Anthony Davis was the 3rd greatest player in NBA history.  Andre Drummond over John Stockton? Who wouldn't think that?"
andre drummond &gt; kareem  my opinion
Playing with Andre Drummond lol
Andre Drummond and last years Lakers.
Andre Drummond must clearly be a better defender.
What’s surprising to me about this is that Andre Drummond has more blocks than LeBron
He saw Andre Drummond working and lost it
https://www.sbnation.com/2018/2/25/17051044/andre-drummond-dribble-highlights-video-pistons-kemba-walker
He saw Andre Drummond working on his handle and lost it
"Andre Drummond averages &gt;17 rebounds, 13.2 of them offensive rebounds"
"“I miss what you miss in 10 years, in 1 day”   -Andre “Chris Brown” Drummond"
They were talking about andre drummond
[Here’s an article about this if you’re interested](https://www.espn.com/nba/story/_/id/21332122/nba-andre-drummond-dramatic-free-throw-improvement-driven-back-basics-approach)
"Dwight's the only guy within 2500 of the ORB record and if Andre Drummond is going to be a backup from here on out, he's not getting anywhere near it (he has just over 3000 for his career and would be the one that could come closest to it)."
Andre Drummond averaging 15+ rebounding and the defensive wall for the team. He should play in starting 5 for atleast 25min on court to show his full potential
"Yeah like I know the Andre Drummond hate is now kinda circlejerk around here nowadays (rightfully so), but cmon that was a solid stat line and no one was upset about that back then. That was when he was having like 20 boards semi consistently, not bad for a third team."
"25 15 no impact, Andre Drummond."
&gt;I don’t understand why people have a problem with the 2nd best player in the league joining the team he lost to. The team that should’ve repeated if it weren’t for bullshit suspensions and injuries  And in another thread &gt;Andre Drummond is a good player   Lmao
"Andre Drummond had better numbers across the board in both his all star seasons, including defensively."
You literally just signed at his prime all star andre drummond for the minimum. Thats honestly absurd
"cant think of one, maybe andre drummond?"
Being benched for Andre Drummond is far from perfectly and probably not the way he thought his career would end in the NBA.
"There’s players who are more effective than comparably athletic counterparts. Like Trae Young, Jokic, or even Luka. Then there’s players who underperform based on their build and athleticism. Like Andre Drummond.   Then there’s Giannis, who is a top 3 basketball athlete of all time and performs about how you’d expect a guy with that much physical gifts to perform. He’s not particularly skilled, but he’s not unskilled either. He physically overmatches his opponent and dominates. He’s not crafty or an elite shooter or something, but he’s the best player in the league despite his lack of an elite skill set. There’s no reason to take it personal, nobody is saying anything negative about him."
"He can hang out with his friend, Andre Drummond"
"&gt; Like Harden is at the strip club A LOT, but what do people think he does when he isn’t there?   Depends on their agenda. The people that just hate his guts will say he doesn't practice, which is obviously BS.  &gt; You can easily tell when someone isn’t putting in the work, they’re either out of the league or they just stagnate and eventually end up out the league anyway.  Andre Drummond"
"With recent buyouts like Andre Drummond, Blake Griffin and now this, I wonder if teams will start to be more weary about offering those sorts of deals in the first place."
You probably think Andre Drummond is good too
Did you google “Andre Drummond is a jerk”
"I'm not gonna lie, I've never been anywhere close to an NBA level player but I'd still be a little bitter about my spot being given to Andre Drummond."
I'm sure you can. But you can also find guys on rosters who are worse like Andre Drummond. There is value in knowing your role and playing within it.
&gt;Andre Drummond Admits He Intentionally Elbows Teammates in the Face for Taking His Rebounds  https://old.reddit.com/r/nba/comments/oxmxb4/andre_drummond_admits_he_intentionally_elbows/
I’m out of the loop. Why do people dislike Andre Drummond ?
yea it sucks for guys like that who are incredibly skilled at the game but just can’t stay on the floor in this era. We watched Roy Hibbert/Al Jefferson/Joakim Noah/Andre Drummond/Greg Monroe go from stars at the end of the low post days to cast out/almost cast out of the league entirely.
Can't wait for Andre Drummond to tweet out 3 laughing emojis when this list goes up.
&gt; for some reason nobody stops them from trying to post up and doing all the shit  In an interview last season JB Bickerstaff said he was encouraging Drummond to bring the ball up and initiate the offense more. I thought for sure we were going to get the Colangelos sicced on us for such obvious tanking. Hopefully some day we can publicly thank Andre for getting us Mobley.
So like Andre Drummond
So is Tobias Harris and Andre Drummond.
"Why is he still pretending he’s 28. He’s old, and it seems he doesn’t have the athleticism he once did. Even if he did, leagues different now; you can’t afford defensive liabilities on the perimeter at the 5 anymore unless they’re transcendental talents elsewhere (Gobert with interior D, Jokic with offense).  Btw, this is why I pray for all the people of Philadelphia. They have Andre Drummond, the nightmare. He’s their bench center. I hope they are prepared for the 10 game stretch where he starts due to injury, and all the minutes he sets his woddling webbed feet upon the court. The sheer lack of skill in his finishing, shooting, passing, defending, or personality ensures his fate there, and thus yet another year in the 76ers championship window would be squandered"
Andre Drummond is that guy. Minimal effort and calls foul every time he gets the ball.
Grandpa Mark Gasol is slightly superior to Big Penguin Andre Drummond
"Things to take away:  \- Collin Sexton had a few nice drive &amp; dishes, look for him to improve his playmaking abilities this season. He's always been a tank but he looks even... tankier in this video? Not sure if it's just the tank top maybe Cavs fans can chip in.   \- Scottie Barnes' 1v1 defense is insane considering he was able to shut down THJ &amp; Mitchell on two isolation plays. Obviously the NBA is going to be much faster, but this is a good sign for Scottie/Raptors fans.   \- Andre Drummond is absolute garbage lmao"
It’s 100 years to early to be benching Marc Gasol in favor of Andre “Daniel Jones” Drummond
Andre Drummond
Hassan Whiteside and Andre Drummond
"Russell Westbrook because I can't believe that someone with his athletic gifts can be so dumb with his shot selection.      Ben Simmons because I can't believe that someone with his athletic gifts can be so Inconsistent with when he chooses to be assertive, since when he chooses to be he's dominant.      Andre Drummond and Hassan Whiteside because I can't believe how someone with his size and strength can be so brain dead defensively and so dumb with their shot selection on offence."
"Andre Drummond. The dude is goofy as fuck, but maybe if he focused a bit on improving some new aspects of his game, he could be playable. Especially in Detroit it just seemed like he was just happy to be there but never elevated himself. The dude is has the tools to be far more dominant."
Went through the comments and couldn’t believe I didn’t see Andre Drummond. Dude had crazy potential and talent but cannot for the life of him get motivated enough. Even on the court… Pretty much sure Embiid ruined his psyche too.
"I was thinking Andre Drummond, but it works for Simmons too."
Andre Drummond
Andre Drummond on the Pistons is the epitome of empty stats.
"Chris Paul, Andre Drummond, Draymond Green, Isiah Thomas, Jeremy Lin."
Overall it’s a different game as time goes on. I don’t know if this is proof he would average 40… who’s know he could just be a Andre Drummond in today’s game and Andre could have average 50 back then but we wouldn’t ever be able to prove that
The Andre Drummond Experience has taught me that you are probably right.
"I think as usual with these questions, the Lakers would be one of the favorites. Lakers would have  PG Gary Payton  SG Mitch Richmond  SF Dennis Rodman (he came into the league as a SF, won his first DPOY with the Pistons as a SF and that was arguably his best overall season in his career)  PF Karl Malone  C Maurice Lucas (or Spencer Haywood who’s a HOFer or Tyson Chandler or Andre Drummond just for laughs)  That’s 5 HOFers and there are plenty of guys you can put off the bench who were solid like a Haywood/Chandler, Caron Butler, Danny Green   Adrian Dantley played 1.5 years, otherwise he would be on there too."
"People really thought Andre Drummond was the missing piece  I know AD was hurt and Bron might not have been 100% either, but Drummond just sucks lol"
"&gt; Like Andre Drummond, he is good value at a vet min as a backup big.   Nets fans heavily disagree"
Is he worse than Andre Drummond?
We’re watching Andre Drummond become one right now.
Andre drummond genuinely has the worst bball iq in a nba player i have ever watched. The moment his athleticism dips he is gonna b gone from the league. He genuinely is bad at everything except rebounding. Ive never seen a worse offensive center. On defense hes a lazy motherfucker with no iq. When it comes to basketball he has a fucking brick for brains. Everytime he got on the court I knew he was either gonna put up a terrible shot or turn the ball over at least once trying something he cant even do in practice. Id rather have DJ cuz at least he doesnt think hes fucking hakeem olajuwan. Drummond is a lazy mf who thinks hes better than is while DJ is jus a lazy mf.
Andre Drummond tier?
"Like Andre Drummond, he is good value at a vet min as a backup big.   But if he demands to be a starter like Drummond, best to let him go."
Where would gs get stops?  Hack a Shaq.  Then they’d hit a three at the other end.  No way to quantify “face up game”?  Does Andre Drummond have a face-up game?  Did Patrick Ewing?   You can’t objectively tell?   LOL
The sequel to Andre Drummond!
Can't be worse than Andre Drummond.
I’m praying this doesn’t turn into another Andre Drummond situation for us again
"If Andre Drummond can be what Andre Drummond was in 2019 while being an all star, then Ben Simmons can be what Ben Simmons is."
Players in the 80s would have developed a 3 point shot cause Ben Simmons and Andre Drummond clearly have miraculously developed the same skill.  They also would have developed a cross over.   Just trust me.
"Andre Drummond has multiple All Star selections, has been named to an All NBA team, has led the league in rebounding several times and was a top 10 pick"
The Andre Drummond strategy
Oh you mean 11 minutes and 34 seconds of Andre Drummond crashing offensive rebounds
"I don't know that best of his ability is the right phrase. His problem on the court is that his productivity doesn't match his ability. He's not anywhere near as bad as Andre Drummond, but he has the same problem of being very talented and capable but he plays stupidly below his ability. The difference between the two is that at least Simmons' effort and production match his ability on one end of the court."
Awesome. Now do 11 minutes and 34 seconds of Andre Drummond hook shots.
"See, I don't even think there's solid proof he wouldn't be Tristan Thompson today. Where's that video of Mitchell Robinson or Andre Drummond maybe playing against guys in pickup and he legitimately looks better than prime Lebron. You become SO much better against worse players and SO much worse against good players.   It's literally impossible to tell. I'm not saying that would be true, I'm just saying it's literally impossible to know because all of these NBA players can really fucking hoop and the only reason they look bad is because they're against other NBA players."
"REPORT: the Cavaliers have traded Kevin Pangos, Colin Sexton, and Darius Garland for Ben Simmons and Andre Drummond"
Or even this [Andre Drummond Pickup Game](https://www.youtube.com/watch?v=nG3YFUG2DQA)
"Yes, but the point is that there was a point in time where Andre Drummond was an All-Star candidate, while scalabrine never came close"
"lmao what? he usually shot 45% from the field, 36% from three, and 87% from the line. those are all respectable numbers when a ton of them are threes off isolation, and his free throws as well. His EFG% as well as his TS% are both great.   Educate myself on averages and usage rates? Good players get the ball. Whats your point lol?  He doesnt have chips because he kept losing to super teams. He underperformed at times but he never really had enough help.  Detroit is trash, you guys are literally the black hole of the NBA, andre drummond ran your franchise for a decade. The rockets won in 94 in 95, im not sure why you're still pounding your chest over a title from 2004"
Brian Cardinal was The Janitor. Andre Drummond is The Butler.
He's the Andre Drummond of guards
"Ontario income tax is similar to California.   I mean, it would have to be SUBSTANTIALLY more than the max to get people to travel halfway around the world to play. Leonard gave up two huge contracts to get back to Cali. And I suspect his feelings on the matter are more in line with other players. So, unless you want to pay like Andre Drummond a super duper max (which would be crazy), I don't think you will attract superstars that way."
andre drummond could be a damn rhodes scholar off the court for all I care but that mother fucker is the dumbest basketball player of all time
You ever seen Andre Drummond play?
"It would've been quite the thing to see him on any other team, especially one without an all time facilitator like Paul. DJ could've maybe ended up being Andre Drummond or worse without Paul."
"Last year they gave up, the front office shut it down fast. There is currently a good mix of experience on this team. Rubio and Garland running point gives us outstanding ball movement and unselfish basketball, something impossible with Andre Drummond or Sexton running PG."
Or Andre Drummond
"Also in the 20216-17 season:  Andre Drummond, Hassan Whiteside and DeAndre Jordan were starters who led the league in rebounds and were near the top in blocks.  Isaiah Thomas was the league's 3rd leading scorer.  John Wall led the league in steals and was 3rd in assists (edging out Ricky Rubio for his spot).  Kyle Korver, Allen Crabbe, Joe Ingles and Otto Porter were top 4 in 3pt accuracy.  DeMarcus Cousins set the high water mark for personal fouls.  Westbrook is the 4th oldest guy out of all the players I mentioned here."
"Nah, that's Andre Drummond."
Whiteside was never even close to actually being an all star level player in terms of positive impact.  He is the classic case of huge stats but actually kind of sucks if you watch him play much like Andre Drummond. Its no surprise guys like them never put up those numbers on actual good teams
He was never as good as Rudy tbh  He was like halfway between Rudy and Andre Drummond
"if they let Andre Drummond start, they're not going to ask Russell Westbrook to come off the bench that's absurd"
Man bringing Dwight back was one of the best decisions in the offseason. I shudder to think how bad we'd be if Andre Drummond was still our center.
Andre Drummond would like a word
I would support Andre Drummond if he chose not to get vaccinated
Andre Drummond out here being a problemmm.   For his own team.
How good would Andre Drummond be in the 90s? Serious question
[Andre Drummond](https://cdn.vox-cdn.com/thumbor/XYeVe9edJNWsOZgPZgfRibAE7oM=/0x66:680x422/fit-in/1200x630/cdn.vox-cdn.com/uploads/chorus_asset/file/22546054/drummond_lebron.jpeg)
The Andre Drummond special.
Here's the list from 2019-2020. A lot of the same guys show up on both.   Ante Žižić  Cody Zeller   Moritz Wagner  Nikola Vučević  Noah Vonleh     Omari Spellman    Dwight Powell        Kelly Olynyk         Nicolò Melli       Kevon Looney      Frank Kaminsky    Nikola Jokić      Willy Hernangómez  Dewan Hernandez       Harry Giles     Cristiano Felício      Andre Drummond    Ed Davis            Marques Bolden  Jonah Bolden         Ryan Anderson
Here's the list from last season.  DeMarcus Cousins  Andre Drummond  Gorgui Dieng  Andre Drummond  DeMarcus Cousins  Gorgui Dieng  Cristiano Felício    Gorgui Dieng  Andre Drummond   DeMarcus Cousins  Dewayne Dedmon   Nikola Jokić  Kelly Olynyk  Bam Adebayo   Steven Adams  Khem Birch    Kelly Olynyk                                   Jeff Green            Bruno Fernando  Jahlil Okafor
&gt;one of the best interior scorers in the league  That's better than Andre Drummond👀
Andre Drummond and Brook Lopez
"A few things:  First, it's hard to know whether Detroit wins their championships without Rodman, but I feel quite comfortable saying Chicago wins with a more traditional All Star type power forward because they did exactly that with Horace Grant. Obviously Rodman replacing Grant wasn't the only difference there. Rodman as a third star may have played a large part in lifting the team to their 72-10 heights, but I don't think he was the difference between a 3peat and zero titles. We're talking about a deep squad with MJ/Pippen/Kukoc here, the GOAT and a top 5-10 player of his era surrounded by great role players.  Furthermore, if the hypothesis is that Rodman's rebounding was his big impact skill, it doesn't really apply to Rodman while Detroit was making the Finals. During their 3 year run, Rodman never even averaged 10 rpg. He didn't have game breaking rebounding numbers really until the 91-92 season when Detroit was a first round out, their run effectively over. That squad was, again, extremely deep and I just don't believe Rodman with his good but not game breaking numbers was the difference between a near 3peat (had IT remained healthy) and no titles at all.  And again, at the peak of his video game rebounding numbers, Rodman was helping San Antonio implode in the playoffs. A first round out in 94, and the embarrassing 95 upset to the 6th seed Rockets. It's popular to pin that on Robinson, or attribute it to Hakeem putting in one of the all time playoff performances, but if Rodman is supposedly this all time impact guy, the Spurs should have had more than enough to at least push that series to 7 games.  I want to take a second to bring up another all time rebounder with an otherwise limited skillset: Andre Drummond. Here is a guy who hasn't \*quite\* rivaled Rodman's numbers, but has come pretty close. His peak of 16 rpg with 5 orpg is not far off Rodman's numbers, but it is very easy to see that Drummond really \*negatively\* impacts winning. Even as a role player in LA last season where you'd expect this central theme of The Case to be applied, it was clear that Drummond was not having any sort of positive impact. And LA eventually lost in the first round.  As for the whole ""in the modern game he'd have the team psychiatrist..."" thing, that's maybe true. But maybe not. It's pretty speculative, and in my view it sort of reduces Rodman's personality to something that can be ""fixed"". That's also ignoring the fact that guys still have issues in the locker room, and still quit on their teams sometimes. We've seen this with guys like Josh Jackson, Kevin Porter, and even with the Ben Simmons situation. Rodman's issues were incredibly deep rooted.  I think Rodman is extremely interesting as a player. He had a very unique impact. But I also think it's easy to misjudge impact simply because he is so unique and interesting. The fact is that Rodman really only ever played on great teams with pantheon level star players. It's tempting to give him a lot of credit for that, but to me that's almost akin to crediting Robert Horry for his 7 championships when really he just played with Hakeem, Shaq, and Tim Duncan."
Since Andre Drummond did [this](https://imgur.com/a/56ppP9K) the Lakers hadn't won a game
Trillionaire’s Andre Drummond but yes
"He did have one Andre Drummond  trait, missing easy ones and getting it back even people then noticed the statpadding and that's where the comparision stops, he was a brilliant player otherwise"
Thats cause there's not much about his game worth talking about. Rich man's Andre Drummond.
Bruh stfu. Yall talk about Russ as if hes Andre Drummond or some shit
Andre Drummond Sixth man LOOOOOOOOOL.
The opposite would be Andre Drummond in the post
Andre Drummond is statistically one of the greatest rebounders of all time. There’s so much more to the game than shooting efficiency.
Having Andre Drummond and Carmelo for the minimum is absolutely a good deal
Considering LeBron wanted Andre Drummond and Carmelo Anthony on his team I'm not sure LeBron knows what's best for LeBron
I got blasted on here when Drummond signed with the 76ers and my point is simple. He (Andre) is way better than that clown of a man Howard. Have fun because he is literally the dumbest basketball player I’ve ever watched. Also he is 38 year old man with purple hair.  TFK.  Technical foul king!
"a few weeks ago my answer would have been Andre Drummond lol. like just looking at him on/off the court made me angry, I audibly gagged when I got the Woj notification that he signed w the Sixers"
Jamaal Crawford and Andre Drummond.
  **Nets @ 76ers**  [](/BKN) **114 -  109** [](/PHI)  **Box Scores: [NBA](http://www.nba.com/games/20211022/BKNPHI#/boxscore) &amp; [Yahoo](http://sports.yahoo.com/nba/brooklyn-nets-philadelphia-76ers-2021102220)**  |**Team**|**Q1**|**Q2**|**Q3**|**Q4**|**Total**| |:---|:--|:--|:--|:--|:--| |Brooklyn Nets|28|27|30|29|114| |Philadelphia 76ers|34|28|29|18|109|  **TEAM STATS**  |**Team**|**PTS**|**FG**|**FG%**|**3P**|**3P%**|**FT**|**FT%**|**OREB**|**TREB**|**AST**|**PF**|**STL**|**TO**|**BLK**| |:--|:--|:--|:--|:--|:--|:--|:--|:--|:--|:--|:--|:--|:--|:--| |Brooklyn Nets|114|41-88|46.6%|12-38|31.6%|20-24|83.3%|11|47|26|16|6|12|6| |Philadelphia 76ers|109|43-91|47.3%|14-36|38.9%|9-11|81.8%|5|35|17|21|8|8|9|  **TEAM LEADERS**  |**Team**|**Points**|**Rebounds**|**Assists**| |:--|:--|:--|:--| |Brooklyn Nets|**29** Kevin Durant|**15** Kevin Durant|**12** Kevin Durant| |Philadelphia 76ers|**23** Tobias Harris|**10** Andre Drummond|**4** Tobias Harris|
"I think the complaint is not so much as the lack of a foul call but rather the lack of a goaltending call against Deandre Ayton.  On a similar trajectory shot, Andre Drummond gets called for goaltending ( https://www.youtube.com/watch?v=syOWS5yUYpM ) even though he caught the ball at almost the exact same spot Deandre Ayton caught it.  Personally, it doesn't matter to me if it's technically goal tending or not; I would just like the refs to be consistent in their calls."
Lakers are now 0-11 since Andre Drummond did the thing
"No, he's been a very pro FO/Player coach. Any other coach would have said no to Andre Drummond but Vogel played him because of his stars and FO. He's a good company man."
"Anthony ""Andre Drummond"" Davis with that statline"
"If Masai listened to the fans we would have traded Lowry for Kemba after 2015, traded JV for Andre Drummond, never traded DeMar, and built around Norman Powell"
"How long before Andre Drummond pulls a ""Drummond?"""
"2021 6ers led by Andre ""Magic Jonhson"" Drummond"
Andre Drummond led lineups being able to compete with the Nets bruh
Andre Drummond is playing good. And Korkmaz is a Turkish Jordan ???
"Bruh, who the fuck is THIS Andre Drummond?"
Andre Drummond styling on these bitches
The Andre Drummond experience has a lot of good stuff so far
Drummond such a push and pull dude lmao  Edit:  Andre “The Human Highlight Reel” Drummond is a great man
Andre Drummond has bricks for hands. Legit can’t hold on to the ball
Lakers legend Andre Drummond
And Andre Drummond is 38th all time in PER. These stats have important context and shouldn't be used in a vacuum.
"There was the andre drummond and blippi thread, must’ve missed that? Plenty of hate for stevie"
