"2019 Draft Class sorted by Points Per Game, Top Ten.  2019 Draft Class||||||||||||| :--|:--|:--|:--|:--|:--|:--|:--|:--|:--|:--|:--|:--| Name|Pick|g|m/g|p/g|3/g|r/g|a/g|s/g|b/g|fg%|ft%|to/g Zion Williamson|2019(Pick 1)|18|32.8|23.5|0.2|7.6|2.3|1.1|0.7|.581|.677|2.7 Ja Morant|2019(Pick 2)|7|27.9|20.7|0.9|2.1|7.7|1.0|0.4|.539|.806|3.3	 R.J. Barrett|2019(Pick 3)|22|36.0|17.8|1.0|6.5|3.3|0.8|0.2|.430|.758|2.0 De'Andre Hunter|2019(Pick 4)|18|32.2|17.2|1.7|5.4|2.2|0.9|0.5|.509|.877|1.4 Tyler Herro|2019(Pick 13)|13|34.0|17.0|1.7|6.5|4.2|0.5|0.2|.446|.786|2.9 Darius Garland|2019(Pick 5)|13|32.0|15.6|1.8|2.6|5.5|1.0|0.2|.444|.905|2.8 Coby White|2019(Pick 7)|19|33.9|15.4|2.3|4.8|5.7|0.4|0.1|.407|.867|2.7 Keldon Johnson|2019(Pick 29)|21|30.7|15.0|1.0|7.5|2.2|0.9|0.6|.483|.788|1.5 Brandon Clarke|2019(Pick 21)|15|28.6|13.6|0.6|6.1|1.7|1.1|0.7|.489|.567|0.7 Luguentz Dort|2019(Pick 20)|19|28.8|12.4|2.2|3.3|1.2|0.8|0.3|.433|.780|1.2"
"Coby White, real name no gimmicks."
"Zach's on-ball defense is actually decent (in spurts) this season. However, Coby White is the 4th worst defender among guards in the NBA - only worse are Lillard, DLo, and LouWill based on Defensive RAPTOR.   Meanwhile, Garrett Temple is the best-rated defender on our team. He should be starting over Coby in order to complement Zach's game. Coby can still play more minutes, but it's not a good idea to play Coby and Zach together"
"Coby White, Garrett Temple, Patrick Williams or Otto Porter Jr, Thaddeus Young, Wendell Carter Jr. Not the worst pretty good."
"This has gotten ridiculous.  The worst offender are Coby White, Luka, Trae Young and Harden. Those guy stop the ball with their hand underneath ten plus times a game then continuation dribble....that is not a hesitation dribble, that is a travel."
You say you hate Coby White or Lauri in Bulls subreddit guys are saying “imagine thinking this about 20 and 23 year old players.  You say you want Oladipo to pair with Lavine.    “Why are you like this?”  Dudes like players who score.  Even if they are not winning players you may not point out that the offense does not make up for the lack of defense with certain players.  Haters gonna hate.
Harrison Barnes or Coby White for UNC.
Coby White for UNC
"I think Coby White may be a bigger problem than Bulls fans want to admit right now. Not terribly efficient as a scorer, not a good defender... seems like the recipe for a Sixth Man."
"Bulls fan here, and I’m really high on Coby White. This seems a little unpopular with our online fan base right now, but I’m excited to see him grow into a starting PG."
coby white
Coby white
Coby White is my dudeee
Coby White
"I'm still convinced the Bulls should have drafted this kid instead of Wendell Carter Jr at the #7 pick during that draft year.  The Bulls were just starting their rebuild having blown up the roster the season before, so taking a chance on an injured former consensus #1 overall draft pick was a very low risk, high reward move for them.  They would have had to redshirt him his first year like Denver did, but that would have netted them a better draft pick the subsequent year (it was #7 again, Coby White) and they could have rolled in to last year with Dunn, Markkanen, LaVine, Porter, and a top 5 pick from 2019 heading in to last year."
"So, one more caveat here is that for somebody to negatively impact your team, there has to be a demonstrable negative to playing them...  If you're absolute shit, like the Pistons or Wizards or Wolves, replacing one terrible player with an average guy doesn't really change the outcome of your season.  Secondly, if you're just some minimum-salary scrub pressed into service, there was no opportunity cost to your acquisition. Draft capital, trade capital, or financial capital outlay matters.    With that in mind, some possibilities:  Kelly Oubre. Expensive as fuck because of the tax, cost something to acquire via trade, totally awful.  Coby White. Absolutely terrible on both ends, two years in a row, after being a high lottery pick. Plays a ton of minutes, and they're all bad.  Marvin Bagley. Not only has he been completely fucking terrible, picking him over Luka, Trae, Sexton, Shai, Bridges, MPJ, JJJ...fucking unbelievable.  Tristan Thompson...man does he totally blow. The Celts used their one FA asset on a guy who's been awful."
"That's the thing, Shamet was a huge exception.  Top 3 3PM for rookies in 17-18:  1. Donovan Mitchell  2. Kyle Kuzma  3. Lauri Markkanen  18-19:  1. Luka Doncic  2. Landry Shamet  3. Trae Young  19-20:  1. Coby White  2. Kendrick Nunn  They're all volume shooter iso players besides Shamet. 3pt specialists just don't get that many shots as rookies."
"Everyone is allowed to have creative differences.   Here is mine. No one wants to play with a ball hog.  Having 5 assists and 7 turnovers one game then 8 turnovers and 6 assists and then 10 assists and 5 turnovers does not mean you are not a ball hog.   Creative difference number 2. Trae Young puts his hand under the ball, the ball stops and then he continues dribbling almost every time he has the ball.  That was a travel, is a travel in the rulebooks, and was supposed to be a focus of being called the last few years.  Luka is also bad with it.  Coby White packs a suitcase and does it."
"We all know Zach can ball, where's the Coby White highlights"
I’d say above as well. What about Coby White in a year or two?
"This is super unpopular with the fanbase but I wouldn't mind trading him now for a great return. His value will never be higher and I still don't believe him and Coby White can be success at a high level in the long run  To be fair to him he's improved a lot and his stats this year are insane, but I do believe he's closer to ""empty calories"" than Bulls fans would ever admit. I'm not saying he can't be a winning player or anything in the right situation, but his BBIQ is still really questionable. I kinda hope AK is the ruthless type that isn't afraid to make an unpopular move, if the price is right of course"
You'll take Coby white and Lauri Markennen and like it
"i feel like not enough people talking about my man coby “crabman” white tho  i swear i can’t watch him play without my mind telling me he’s a future star, his game is so fluid and clean, reminds me of jamal murray a lot"
Coby White and Zach Lavine
"Every Dubs game and good national TV matchups. Also some random Bulls and Hornets games bc my fantasy team has Lavine, Coby White, Lamelo, and PJ (+ they’re actually pretty fun teams to watch this year)"
"Brown benefits from playing alongside Smart and Tatum - two guys who can be primary ballhandlers and let him play off-ball. Lavine plays with a 20-yr old Coby White who isn't a great facilitator (..yet) and a bottom 5 defender in the NBA. Lavine is the better scorer and facilitator so far this season, while Brown is a better defender. Brown still deserves to be an allstar, but it's hard to say he's better than Lavine, who balled out against elite teams like Lakers and Clippers"
"&gt;lauded for it's depth  It's not as deep as 2018 or 2019.  2019 had Zion, Ja, De'andre Hunter, Coby White, Hachimura, Garland, Reddish, Cam Johnson, Herro, NAW, Brandon Clarke, Paschall, THT, Matisse, PJ Washington, Kevin Porter Jr"
It's zach Levine followed by coby white
"From what I've noticed:   Coby White up to 6-5 from 6-4.  Wendell Carter up to 6-10 from 6-9.  BI up to 6-8 from 6-7.  DMitch down to 6-0 from 6-1.  De'Andre Hunter is now 6-8,   Dwight is back to 6-10,   Ben Simmons up to 6-11.   Shai gained an inch (6-6).    Melo down to 6-7.   Derrick Favors down to 6-8 from 6-9.  Surprisingly, Shaq Harrison stayed at 6-7. Mentioning bc he said that he was 6-4 when asked last year.  Kuzma now at 6-10 from 6-8.  Again, possible that I missed people, I only checked the ones that sounded different to me."
Coby white dribbles like he’s manifested himself into a sidewinder and I love every moment of it
Coby White
Coby White
Coby White. I believe in Lavine more than White and struggle to see a future with both of them
If someone told you that :  -Luka would drop 36/16/15  -Lavine and Coby White would have a COMBINED 10 points  -Porzingis would get 20 points  and still the Bulls win..... I would say this is STILL more likely than the Knicks blowing out Boston by 30 points.
this was a bad game to pick coby white over points
Coby White isn’t good at that?
"Evaluation year for Coby White to see if he can be our point guard of the future and part of the core. It’s been a hit or miss (mostly miss) because he’s a scoring guard through and through, but he’s also only 12 games into his new role. Growing pains I guess."
"the thing about minnesota drafting is that in 2019 when they traded up for culver, i knew coby white was going to be pretty good."
"Zach Lavine, Coby White, Otto Porter Jr, Wendell Carter Junior, Denzel Valentine, Tomas Satoransky, Patrick William, Gafford (idk his first name)"
&gt; Coby white is a role player that should come off the bench.  Damn. I don't watch Bulls games so what changed so suddenly because I've seen this become a prevailing opinion as of late.
In theory coby white is the exact type of pg youd want ben to play with
Coby white is a role player that should come off the bench.
Lauri Markannen and Coby White need to be traded yesterday.
And Coby White is playing winning basketball?
Kyle Lowry over Coby White 😂 😂 😂. Can't take this seriously.
Yeah he was pretty good defending Shai but then Shai started abusing Coby White
Tell me why Coby White is averaging less of literally every stat known to man on worse efficiencies then
Coby White has been better than Kyle Lowry this year lol
Are coby White or Tyler Herro’s arms more Trex?
Having Coby White as his point guard is not helping him.
"AD isn’t the 2nd best player in the NBA lmao. My point is if you’re not gonna enough to be the 2nd option next to the best player in the world, you clearly are t a true 2nd option for a contender. Why are the Bulls one of the worst teams in the league if Lavine is as good as you think he is? They’re a very talented team. They’re playing Otto Porter Jr off the bench. Coby White is for real, Carter and Markannen are having bounce back seasons. Williams is going to make an all rookie team. Young and Temple are real NBA vets."
Coby white food I just wish he was more consistent
Bulls. They’re playing some great bball. Coby White is super fun to watch
| Player                   | TEAM | GP | eFG% | TS%  | FGA  | Pts/FG |  |--------------------------|------|----|------|------|------|--------|  | Damian Lillard           | POR  | 12 | 54.2 | 61.7 | 18.7 | 1.4    |  | De'Andre Hunter          | ATL  | 11 | 59.3 | 63.7 | 11.2 | 1.4    |  | Shai Gilgeous-Alexander  | OKC  | 12 | 56.9 | 61.4 | 15.1 | 1.4    |  | Zach LaVine              | CHI  | 12 | 59.1 | 63.4 | 19.8 | 1.4    |  | John Collins             | ATL  | 11 | 59.1 | 62.9 | 11.5 | 1.4    |  | Bradley Beal             | WAS  | 10 | 54.3 | 60.8 | 24.5 | 1.4    |  | Shake Milton             | PHI  | 10 | 55.9 | 61.4 | 11.1 | 1.4    |  | Goran Dragic             | MIA  | 8  | 59.0 | 63.4 | 10.4 | 1.4    |  | Khris Middleton          | MIL  | 13 | 62.0 | 65.5 | 15.4 | 1.4    |  | Jaylen Brown             | BOS  | 11 | 60.1 | 63.1 | 18.5 | 1.4    |  | Anthony Davis            | LAL  | 12 | 58.0 | 61.3 | 15.6 | 1.4    |  | DeMar DeRozan            | SAS  | 10 | 50.7 | 58.4 | 14.7 | 1.4    |  | Domantas Sabonis         | IND  | 12 | 57.9 | 60.6 | 15.8 | 1.4    |  | Devin Booker             | PHX  | 11 | 54.9 | 59.9 | 16.6 | 1.4    |  | Stephen Curry            | GSW  | 12 | 54.9 | 61.0 | 20.5 | 1.4    |  | Duncan Robinson          | MIA  | 10 | 61.5 | 63.7 | 10.0 | 1.4    |  | Trae Young               | ATL  | 11 | 44.3 | 55.2 | 16.7 | 1.4    |  | Zion Williamson          | NOP  | 10 | 54.7 | 57.2 | 15.9 | 1.4    |  | Jonas Valanciunas        | MEM  | 11 | 55.0 | 59.2 | 10.9 | 1.4    |  | Julius Randle            | NYK  | 13 | 54.3 | 58.9 | 17.0 | 1.4    |  | Collin Sexton            | CLE  | 8  | 58.5 | 61.9 | 18.4 | 1.4    |  | Luguentz Dort            | OKC  | 12 | 58.4 | 61.4 | 9.4  | 1.4    |  | Rui Hachimura            | WAS  | 7  | 52.9 | 57.7 | 10.0 | 1.4    |  | Terry Rozier             | CHA  | 13 | 58.8 | 61.5 | 14.5 | 1.4    |  | Kawhi Leonard            | LAC  | 11 | 53.7 | 59.4 | 18.5 | 1.4    |  | Kyrie Irving             | BKN  | 7  | 59.6 | 63.0 | 20.1 | 1.3    |  | Ben Simmons              | PHI  | 11 | 52.0 | 55.3 | 9.2  | 1.3    |  | LeBron James             | LAL  | 14 | 55.4 | 58.8 | 17.9 | 1.3    |  | Joe Harris               | BKN  | 13 | 65.7 | 65.5 | 10.8 | 1.3    |  | Jerami Grant             | DET  | 11 | 52.9 | 58.6 | 18.5 | 1.3    |  | Kyle Lowry               | TOR  | 10 | 52.9 | 58.5 | 14.0 | 1.3    |  | Brandon Ingram           | NOP  | 11 | 51.5 | 57.6 | 17.6 | 1.3    |  | Gordon Hayward           | CHA  | 12 | 55.6 | 60.2 | 16.5 | 1.3    |  | Cameron Johnson          | PHX  | 11 | 60.8 | 62.9 | 9.3  | 1.3    |  | Patty Mills              | SAS  | 12 | 60.3 | 62.8 | 10.9 | 1.3    |  | CJ McCollum              | POR  | 12 | 58.8 | 61.6 | 20.8 | 1.3    |  | OG Anunoby               | TOR  | 11 | 54.8 | 58.2 | 9.5  | 1.3    |  | Otto Porter Jr.          | CHI  | 11 | 54.4 | 59.2 | 9.4  | 1.3    |  | Mike Conley              | UTA  | 12 | 57.1 | 59.8 | 13.0 | 1.3    |  | Christian Wood           | HOU  | 9  | 57.9 | 59.5 | 17.6 | 1.3    |  | Eric Gordon              | HOU  | 7  | 53.9 | 59.0 | 10.9 | 1.3    |  | Tim Hardaway Jr.         | DAL  | 11 | 59.9 | 60.8 | 14.3 | 1.3    |  | Aaron Gordon             | ORL  | 11 | 54.8 | 56.4 | 11.5 | 1.3    |  | Luka Doncic              | DAL  | 10 | 51.4 | 56.0 | 21.1 | 1.3    |  | Deandre Ayton            | PHX  | 11 | 57.1 | 58.5 | 9.6  | 1.3    |  | Carmelo Anthony          | POR  | 11 | 50.0 | 56.6 | 9.3  | 1.3    |  | Keldon Johnson           | SAS  | 12 | 53.6 | 57.7 | 11.4 | 1.3    |  | De'Aaron Fox             | SAC  | 13 | 49.7 | 54.4 | 14.6 | 1.3    |  | Tobias Harris            | PHI  | 10 | 58.8 | 60.8 | 14.7 | 1.3    |  | Malcolm Brogdon          | IND  | 12 | 56.8 | 59.6 | 17.8 | 1.3    |  | Jordan Clarkson          | UTA  | 12 | 59.3 | 61.2 | 13.4 | 1.3    |  | Davis Bertans            | WAS  | 11 | 52.5 | 56.9 | 9.3  | 1.3    |  | Jamal Murray             | DEN  | 11 | 53.6 | 56.8 | 15.4 | 1.3    |  | Myles Turner             | IND  | 12 | 53.4 | 56.8 | 9.8  | 1.3    |  | Jayson Tatum             | BOS  | 10 | 55.6 | 58.8 | 21.3 | 1.3    |  | Serge Ibaka              | LAC  | 13 | 57.0 | 58.9 | 9.4  | 1.3    |  | Jrue Holiday             | MIL  | 13 | 55.7 | 58.4 | 12.2 | 1.2    |  | Terrence Ross            | ORL  | 11 | 51.1 | 56.3 | 12.5 | 1.2    |  | Malik Beasley            | MIN  | 11 | 53.9 | 57.4 | 16.3 | 1.2    |  | Nikola Vucevic           | ORL  | 12 | 56.8 | 58.6 | 17.7 | 1.2    |  | Kelly Olynyk             | MIA  | 9  | 59.2 | 59.7 | 9.7  | 1.2    |  | Jimmy Butler             | MIA  | 6  | 44.2 | 52.9 | 12.8 | 1.2    |  | Nickeil Alexander-Walker | NOP  | 9  | 56.5 | 58.7 | 9.4  | 1.2    |  | P.J. Washington          | CHA  | 13 | 48.1 | 53.2 | 10.4 | 1.2    |  | Tyler Herro              | MIA  | 10 | 52.4 | 55.7 | 14.3 | 1.2    |  | Marcus Smart             | BOS  | 10 | 46.0 | 52.3 | 10.1 | 1.2    |  | Pascal Siakam            | TOR  | 10 | 50.3 | 54.1 | 16.4 | 1.2    |  | John Wall                | HOU  | 7  | 50.0 | 54.4 | 15.4 | 1.2    |  | Eric Bledsoe             | NOP  | 10 | 53.2 | 55.4 | 9.4  | 1.2    |  | Chris Paul               | PHX  | 11 | 46.7 | 53.5 | 11.1 | 1.2    |  | Donovan Mitchell         | UTA  | 12 | 51.5 | 54.6 | 19.8 | 1.2    |  | Victor Oladipo           | IND  | 9  | 50.3 | 53.5 | 16.9 | 1.2    |  | Lonnie Walker IV         | SAS  | 12 | 52.1 | 54.7 | 12.1 | 1.2    |  | Marvin Bagley III        | SAC  | 13 | 49.3 | 51.3 | 10.9 | 1.2    |  | Fred VanVleet            | TOR  | 11 | 53.9 | 55.8 | 17.5 | 1.2    |  | Darius Garland           | CLE  | 6  | 54.0 | 56.0 | 14.7 | 1.2    |  | Andre Drummond           | CLE  | 12 | 47.5 | 49.8 | 16.5 | 1.2    |  | D'Angelo Russell         | MIN  | 11 | 51.5 | 53.7 | 17.7 | 1.2    |  | James Wiseman            | GSW  | 12 | 50.9 | 52.4 | 9.7  | 1.2    |  | Gary Harris              | DEN  | 10 | 52.2 | 54.3 | 9.1  | 1.2    |  | Andrew Wiggins           | GSW  | 12 | 49.7 | 52.9 | 15.3 | 1.2    |  | Josh Richardson          | DAL  | 8  | 49.5 | 53.7 | 11.9 | 1.2    |  | Coby White               | CHI  | 12 | 50.3 | 53.5 | 15.3 | 1.2    |  | Austin Rivers            | NYK  | 9  | 58.0 | 58.0 | 9.0  | 1.2    |  | Blake Griffin            | DET  | 8  | 47.9 | 51.3 | 11.8 | 1.2    |
Cuz Coby White has 1/4 the wingspan of SGA.
"The TNT guys are one thing, but it drives me up a wall when the actual analysts and play-by-play guys get names wrong, whether it's pronunciation or just simply not knowing the right name. I watched some of a Pacers game the other day, and I'm pretty sure the away team commentator kept calling Edmond Sumner ""Edwin."" Sure, he's not a star player, but he's been in the league four years and your job is to know this stuff. I hear Coby White get called Colby a lot too."
Here are the players Lebron has primarily guarded this season:  DeMar DeRozan  Derrick Jones Jr.  Kyle Anderson  Keldon Johnson  Brandon Clarke  Tim Hardaway Jr.  Lonnie Walker IV  Rudy Gay  Eric Gordon  Devin Vassell  Coby White  Wendell Carter Jr.
This is almost certainly due to types of players LeBron guards and the types of shots they take: 48% of the shots against him have been 3PA.  Here are all the players who have taken 3+ shots against LeBron this year:  * DeMar DeRozan * Derrick Jones Jr. * Kyle Anderson * Keldon Johnson * Brandon Clarke * Tim Hardaway Jr. * Lonnie Walker IV * Rudy Gay * Eric Gordon * Devin Vassell * Coby White * Wendell Carter Jr.
What if we threw in Coby White? You would also have to pick up Otto Porter to make the cap work out. Last year of the deal and has been pretty good when healthy
"Lol. Looks at Mitch Trubisky, one of the bottom 10 QBs in the league. That's like Coby White making it last year."
"Even a committed Kyrie doesn’t really do much for the Bulls. They’re fully rebuilding. Kyrie, while clearly better, plays extremely similarly to Coby White, who the bulls obviously want to develop."
"Thats the difference a playmaker and a scorer has on the team. There are plenty of roles in basketball and can you honestly name a scenario where an out and out scorer has ever improved his team more than a team who has a playmaker who's on exactly the same level. For every LaVine you get a Kemba Walker, Kemba walker is more important to winning and can affect the whole team more through his plays, but LaVine's role isn't an uneeded one, I've never seen a team thats come close to contending that hasn't had a 25+ PPG scorer a night on their team. Undoutbedly the Bulls will need someone better than LaVine to be in automatic contention for a ring but LaVine fills a gap we need and we'd be stupid if we think there's anyone in the league we could realistically replace him with.  Coby White has the potential to be a scorer as good as LaVine IMHO but you'd be literally throwing away Zach on the hopes that White is just as good, that doesn't make sense to me. Zach needs to improve his playmaking and defence a slight more and he could definitely be on a contending team, however it would take a stupid offer to even get talks going, we won't be able to replicate what LaVine brings to the table so easily."
Im somewhat surprised that Coby White is top 10.
"Coby White is only one of the lot who has shown anything substantial, the rest are full of question marks.    Pat-Will is still small sample sizes (although I do like what I see), I'm not 100% sold on WCJ even though I'm quite high on him &amp; I'm not convinced that maxing Lauri would be a good move  Idk about you, while I like the young Bulls that isn't exactly a core that screams high ceiling and everyone should be on their timeline."
  **Bulls @ Clippers**  [](/CHI) **127 -  130** [](/LAC)  **Box Scores: [NBA](http://www.nba.com/games/20210110/CHILAC#/boxscore) &amp; [Yahoo](http://sports.yahoo.com/nba/chicago-bulls-los-angeles-clippers-2021011012)**  |**Team**|**Q1**|**Q2**|**Q3**|**Q4**|**Total**| |:---|:--|:--|:--|:--|:--| |Chicago Bulls|31|28|35|33|127| |Los Angeles Clippers|22|30|42|36|130|  **TEAM STATS**  |**Team**|**PTS**|**FG**|**FG%**|**3P**|**3P%**|**FT**|**FT%**|**OREB**|**TREB**|**AST**|**PF**|**STL**|**TO**|**BLK**| |:--|:--|:--|:--|:--|:--|:--|:--|:--|:--|:--|:--|:--|:--|:--| |Chicago Bulls|127|47-77|61.0%|18-33|54.5%|15-17|88.2%|3|38|30|19|6|22|2| |Los Angeles Clippers|130|45-92|48.9%|20-38|52.6%|20-25|80.0%|12|35|28|19|13|10|5|  **TEAM LEADERS**  |**Team**|**Points**|**Rebounds**|**Assists**| |:--|:--|:--|:--| |Chicago Bulls|**45** Zach LaVine|**8** Coby White|**13** Coby White| |Los Angeles Clippers|**35** Kawhi Leonard|**7** Paul George|**9** Paul George|
Coby White and Shaquille Harrison
"Stats doesnt show the whole picture. Coby has been playing better off the ball and he gets a good portion of assist off hockey assist, right now I thinks he is shooting great off ball.   White isnt a great playmaker, but recently Donavon has been splitting playmaking skills between Lavine and Valentine too. This let's coby play to his strengths off shooting and develop pg skills"
"Coby White isn't a pg, he's a sg. Our team is pushing his playmaking development to go along with his offensive skills, so far he's shown to be a great scorer but now a playmaker."
We don’t do ourselves any favors with turnovers. Also refs fucking hate us for some reason. Zubac nearly killed Coby White and they swallowed their whistles. Our guys are putting their bodies on the line just to get nothing from the officials.
Coby White are you seriously lol
Westbrook isn’t better than any teammate Lavine has.  Why do you keep saying that?  Coby White is very easily a better player than Westbrook
Coby White is the worst rated defender in the league rn
They looked pretty good against the Clippers. Almost pulled out the win. I really like COBY White.
"Do you think the Bulls are one superstar away from seriously contending? Or should we give them 2 more years for the younger players to learn? I honestly believe in the Bulls, really wish for them to go back to the playoffs again. I'm very excited about Coby White and Zach, and is watching Patrick Williams."
"Dang, I like Coby White."
The refs are not the reason Bulls gonna lose this game. Coby White being unable to handle a basketball  on the other hand.
I NEED THAT ZU REPLAY. HUGE BLOCK ERASED COBY WHITE THEN THUNDERED DOWN FOR THE DUNK
Coby White MIP?
"I wanted us to draft Rui, but I'm happy with Coby White and Pat Will (both who will be better than Rui, Coby already is). I just like his old school playstyle because I'm old school,  call that a ""hive"" all you want idc."
Oof Coby White worst defender in the game
Coby White deserves a shoutout as well
Coby White
Coby white looks like andrew wiggins mom told you have from home
Coby white looks like andrew wiggins mom told you have from home
Now Coby White has Scoreiasis! He caught it from Lavine! Woooo! Someone call up the doctor and get them a prescription for Cosentyx!
Coby White that was incredible lmao
Can’t convince me that Coby White and Tyron Woodley aren’t long lost brothers
Ducking Coby White smh
"Lol what are you talking about? You’re delusional if you think the hawks have exceptionally better young talent. WCJ is only 21, Coby White is 20, Markkannen is 23, hell even Zach LaVine is only 25. Good job losing to the knicks with your “exceptionally” better young talent"
"Coby white for sure has that potential, as does Williams.  That franchise needs more athletes in the front court though"
"His shot is weird, he can’t get to the rim.   Before the fourth quarter last night he had 2 points and Coby White and Zach Lavine were torching the Kings.  He will be a solid pro for years.   Upside, Idk, he might never average 20 a game.   He reminds me of Mark Jackson."
Coby White played a hell of a game
  **Bulls @ Kings**  [](/CHI) **124 -  128** [](/SAC)  **Box Scores: [NBA](http://www.nba.com/games/20210106/CHISAC#/boxscore) &amp; [Yahoo](http://sports.yahoo.com/nba/chicago-bulls-sacramento-kings-2021010623)**  |**Team**|**Q1**|**Q2**|**Q3**|**Q4**|**Total**| |:---|:--|:--|:--|:--|:--| |Chicago Bulls|25|34|34|31|124| |Sacramento Kings|28|34|31|35|128|  **TEAM STATS**  |**Team**|**PTS**|**FG**|**FG%**|**3P**|**3P%**|**FT**|**FT%**|**OREB**|**TREB**|**AST**|**PF**|**STL**|**TO**|**BLK**| |:--|:--|:--|:--|:--|:--|:--|:--|:--|:--|:--|:--|:--|:--|:--| |Chicago Bulls|124|49-93|52.7%|14-40|35.0%|12-15|80.0%|10|43|27|21|3|14|2| |Sacramento Kings|128|47-91|51.6%|14-37|37.8%|20-27|74.1%|12|39|30|16|8|7|3|  **TEAM LEADERS**  |**Team**|**Points**|**Rebounds**|**Assists**| |:--|:--|:--|:--| |Chicago Bulls|**36** Coby White|**17** Wendell Carter Jr.|**7** Coby White| |Sacramento Kings|**24** Richaun Holmes|**12** Marvin Bagley III|**6** Tyrese Haliburton|
"Coby White, Derrick White, Royce White, DJ White, Hassan Whiteside"
"Coby White, Isaiah Whitehead, Derrick White, Okaro White, Hassan Whiteside"
Dude was randomly crying in the Coby White thread too. Some real dedication to the grift
Coby White is the man. GG
Patrick Williams and Coby White are studs. Chicago has a bright future.
"So happy that Tyrese fell to us. Just hope for health for him and Fox for a lonnnggg time. Also, Bulls fans, Coby White can ball. He was fantastic this game!"
Bagley finally playing well along with Haliburton going off. The Kings need this. Good win but holy shit Coby White. I dig it.
