"the Suns have Cam Payne and Cam Johnson the Pacers have two TJs and two Holidays Bucks have DJ Augustin and DJ Wilson Hornets have the Martin twins, Wizards have Tony Brown and Troy Brown, Mavs have Hardaway and Burke both went to Michigan,  Pels have Zion Ingram  and Redick from Duke, Bulls drafted Markkanen WCJ and Coby White 7th, Pistons have two young French players, Celtics have Jeff Teague and Jason Tatum Grizzlies have Winslow Jones and Grayson Allen from the 2015 Duke team."
"How is it any more special than last years’s draft or the year before’s?  Last year’s draft had Zion, Ja, RJ, Hunter, Garland, Coby White, Cam Reddish, Cam Johnson, PJ Washington, Tyler Herro  And that’s all just the lottery guys. Lot of other gems outside of it too"
"Coby white has been disappointing. His defence really hurts us and when his shots aren't falling in, he starts commiting turnovers, drops his shoulders and it's game over.    I really thought he'd be an MIP candidate after he averaged 30ppg over a stretch of 6 games as a starter at the end of last season. He picked it up in his last 2 games tho."
"Coby White, still see a lot of potential in the guy, but makes lots of mistakes."
We are talking about stats and how they don’t always mean what they say.   Coby White is putting up respectable counting stats this year because he was playing with the ball in his hands the whole time the first twenty games.  Meanwhile he was also the worst player in the league
the bulls shouldn't trade lavine imo. he and coby white are looking like a great backcourt. now they just need a wing
Coby white is a certified bucket
Ooh boy Coby White can go upstairs now too?
"“Not a winning player” is a bad take. The rest of the team is the problem, not Zach. OPJ, WCJ, and Lauri may as well have a hospital wing named after them at this point and Coby white makes more turnovers than a New York bakery."
"One of the few guys where it looks to be a carry that might actually not.   Hand is on the midline of the ball and he keeps it moving throughout.   Coby White, Trae Young, Luka.....hand under the ball stop, eat snack, resume dribble."
"This is facts. Coby White is gonna be good, probably. The thing is he doesn’t really do well at point and most importantly his fit with Zach is not exactly the best. Turnovers and defense are the factors for him, but who’s to say he isn’t going to get better at it?"
"I say this with all due respect, but fuck Zach Lavine and Coby White"
"Is the OP drunk. Why on earth would the bulls or in fact anyone trade for kemba who has 2yrs + Player option which he'll pick up for sure and his contract also has a 15% trade kicker making it the even worse.  Celtics's picks are gonna be high 20s and no team is gonna trade for kemba and give up assets especially with his health issues.   Coming to the bulls, Coby white has had a rough stretch of games but no way are we trading him before the end of his rookie contract. And Otto's an expiring contract which makes this trade even more delusional."
"/r/nba coming to back us this year is just the best.  In the words of Coby White, ""That's love man"" :)"
"If they ever do a Black remake of Knocked Up, they should get Coby White to play Seth Rogen’s character."
Even Coby White?
Coby White is all of us thinking we can beat the g-leaguer.
"Or, if you are Coby White, 5 times in 1 game"
"38% from three and 45% from the field for a 20 year old 2nd option on a playoff team that doesn’t have much spacing with Elfrid Payton and Mitchell Robinson being 40% of the starting lineup is actually rather efficient and in fact, he has a higher FG% and 3pt% than Ja Morant, Coby White, and Tyler Herro while playing much better defense than they are as well. Given his situation offensively being lesser than stellar I would actually say he’s been pretty efficient."
"Dude c'mon. Patience doesn't turn a score-first, awful defender like Coby White into an elite assist-giver and defensive stopper. Neither of those things are even remotely likely for Coby.  For a realistic answer to your question, the Bulls need Patrick Williams to be a legitimate elite defender, a true point guard who can efficiently distribute while adding 15 ppg (like a CP3-lite), Coby White needs to develop into an *efficient* 6th man who scores without hurting the team. All that plus they need a top 10 player. The contenders right now all have at least 1, the top teams commonly 2 (Lakers have 2, Nets have 3) top 10 players, or are built with insane depth/skill (Jazz).  Either PWill turns into prime Kawhi in the next 2 years, another top player wants out and we somehow trade for him, or Lavine becomes James Harden"
"Denzel Valentine makes the most boneheaded plays sometimes and if he can't make a 3 is essentially useless on the court. Coby White in the same vein, but he probably has a little more upside on offense. He's just not a good pg right now. Also both these guys play terrible defense"
Coby white or denzel valentine cuz they can't play basketball well
"Killian was the 7th overall pick in what many considered a weak draft.  If he ends up being a guy who averages 15/5/5 on 39% shooting and is a great passer with the ability to defend I am happy with it.  You can't ask for much more out of the 7th pick. You can see the list of 7th overall picks below:     * 2019: Coby White, Bulls. * 2018: Wendell Carter Jr., Bulls. * 2017: Lauri Markkanen, Timberwolves. * 2016: Jamal Murray, Nuggets. * 2015: Emmanuel Mudiay, Nuggets. * 2014: Julius Randle, Lakers. * 2013: Ben McLemore, Kings. * 2012: Harrison Barnes, Warriors"
Terrence Davis and Coby white imo could be debated
"lol, he is better than Coby White.   but he still won't be a star"
"Coby White. No handle, no passing vision, no passing ability, dies immediately on every screen that is set on him. Pretty much everyone sees Lauri for what he is now but most people still seem to think that Coby is a viable NBA player. He is not."
"It was Wendell Carter Jr. imo, most of us saw very little promise in his play but during that Vucevic trade, the media is acting like Orlando got a stud rising player, which is good for them I guess.  Now, I guess it's probably Coby White based on Reddit gamethreads. Lots of other teams' fans say stuff about how explosive he can be as a scorer and his bright future, but a lot of Bulls fans cannot stand his defense and decision making. In my opinion, he's a 6th man at best"
Yea I mean anyone who watches the bulls knows that lauri is pretty bad. Coby White gets shit on so much but I still think people overrate him lol
"All of these proposed trades are garbage. If the Mavs trade Luka, they need offensive firepower in return. There's really no one better than Coby White for that"
Lol tf are you on about? Is Coby White the Hitler of Asians or something and I didn't get the memo?
Troy Brown instead of Coby White was the difference.  And 30-7 free throws.
Coby White sits...we win  We should try this more often
So   a) Tank a season when LaVine is due an extension relatively soon where no matter what happens there's a decent chance you cant keep the pick   b) Piss off LaVine   c) Sell LaVine on some rookie that he nor any NBA star gives a shit about the way NBA twitter does   d) Pretend like Coby White is the one on that team who should be the 6th man of the year  What could possibly go wrong.
Coby white
"since 2000 Nene, Kirk Hinrich, Luol Deng, Corey Brewer, Steph Curry, Greg Monroe, Bismack Biyombo, Harrison Barnes, Ben McLemore, Julius Randle, Emmanuel Mudiay, Lauri Markennen, and Coby White have all been picked at 7. Of that group Murray is one of the better players, but ""well above expected value,"" seems like a stretch."
They are closer than you think. They seem confident they have a future star in Patrick Williams. Add one big free agent signing and they will have 3-4 all star caliber players.   If Lauri or Coby White develop into anything worthy than they  are likely contending for 3 years starting 2 years from now
"Williams &gt; Quickley, Williams has a higher ceiling and also fills a position of need for us (3 and D wing). Quickley is more of a combo guard than a true PG, which we already have in Coby White."
Coby White is overrated as fuck
I still think it's possible Coby White turns into a real good player too
"let's go bulls! i love zach and vuc and, uh, coby white (unless i don't love him? not clear on that one yet)"
"I love coby white, but that may be because his hairstyle has made him the most easily recognizable player for me. Plus, i think there's real potential in him as a Clarkson-esque guy who is a live wire off the bench behind LaVine. He's still in his second year"
Overrated.   Coby White.   A lot of people think he is the worst defender in the league.  He is so much worse than that.   Underrated FVV.
"OKC is not getting hot lmao.   Lonzo Ball is interested.  McConnell and Caruso are interested.  Williams will improve.  Lauri will be gone so we might have someone to guard someone on the bench.  Get a point guard and no reason this team cant be a four seed the next two years. Or we can keep getting seven picks and drafting Lauri Markkanen, Coby White, Wendell Carter Junior for the next 10 years.  They had to do something.  This is better than standing pat."
"Picks are overrated bozo. We still have our 2nds and that’s where Karnisovas strikes gold. Lmao the last two teams to win an NBA championship both won by trading for star players. Sad to see this shit coming from a Bulls fan too when our last three lOtTeRry PiCkS have been - Lauri Markannen, Wendell Carter Jr, and Coby White lol."
It allows us to move on from all of GarPax previous blunders and keep the one (Lavine) or two (Thad) that ended up being valuable.  It allowed us to also put Lauri in the second unit which was a LONG time coming.  Williams has looked much better in only two games with him.  Bulls might lose a bunch of games still this year.   Badly need a TJ McConnell or Alex Caruso type in the starting lineup instead of Sato or Coby White. The hardnosed defender who can do a little of everything without turning the ball over.  Also we are giving up a pick around 11 this year and hopefully 20 or worse in two years.  Also got off the last half year of Otto Porter.  The trade was necessary for a team that needs an identity.  Thibs is the Knicks identity.
And Kyrie is getting fed by James Harden. Zach is getting fed by... Thad Young? Coby White?
I don’t think anyone has ever questioned his IQ...maybe getting that confused with Coby White criticism
"Tier of his own: Luka  Tier 2: Trae, Shai, Ja  Tier 3: Lamelo, Sexton  Tier 4: Haliburton, Lonzo, Garland  Tier 5: KPJ, Quickley, Fultz (pre injury), Coby White,  Need to see a lot more from: THT, Theo Maledon, Cole Anthony, Jordan Poole, Kira Lewis,"
"i thought about it and i felt like Herro really is a 2 Guard, i think some players here will probably spend their careers playing the 2 guard aswell but for now it makes sense to have them on this list (Maledon, Quickley, Kira Lewis, Sexton, Poole, Coby White &amp; Cole Anthony, potentially Haliburton &amp; Lonzo too but these 2 are pretty much well rounded guards that probably aren’t your no.1 ball handler"
"thing is with THT is he is at his best with the ball in his hands, whereas players like Jordan Poole, Sexton and Coby White are SG’s in a PG’s body, arguably cole anthony and Immanuel Quickley too"
"that’s just to speak to how many good young point guards there are right now, i know some of them don’t exactly fit the PG role specifically Coby White, Sexton and THT, but those are the positions i see them playing for their career"
Luka  Trae  Shai  LaMelo  Ja  Sexton  Lonzo  Halliburton  KPJ  Garland  Fultz  Maledon  Quickley  Coby White  Cole Anthony  THT  Poole  Kira Lewis Jr
"For me, it goes (in order):  Luka, Ja, Lamelo, Trae , Shai, Lonzo, Kira Lewis, Quickley, Kevin Porter Jr, Coby White, Poole, Fultz, Sexton, Garland, Cole Anthony, Talen Horton Tucker, Haliburton &amp; Theo Maledon"
Can I interest you in a trade for Coby White and Lauri Markannen?
"What a disaster your drafting has been recently. Carter out the door, Markinaen soon to follow and Coby White not exactly lighting the world on fire. Kris Dunn was a swing and a miss as well."
markannen or coby white?
You’re all gonna look mad foolish after Coby White wins MVP
"[Here’s an article from June 2019](https://www.si.com/nba/2019/06/20/most-nba-players-produced-by-colleges-kentucky-statistics), since then UNC had Coby White, Nas Little, Cam Johnson, and Cole Anthony drafted. That’s still less than UCLA"
Yeah I was expecting us to pick Coby White on draft night so I was kinda shocked when we took him.  Yeah it's like he can't really find his rhythm. And to be honest it's quite possible that he just needs a change in scenery. There is a good player in there with fantastic work ethic. He just doesn't fit us and never did
"I am loving it as well.   Last year was hard to watch. I will admit I did not watch a lot of Bulls games.   But I'm loving this team. Everyone.   Lauri needs to stay healthy but when he is, he's been good. He's not the superstar I thought he would become, but he is good.    Lavine is a legit player and his defense has gotten much better, from terrible to average, especially one on one.    Pat Williams is gonna be a star in this league. He can do it all and all he needs is confidence and that will come in the coming years.   Coby White is one of my favorite players in the NBA currently. Sure, he has his flaws, but the dude is fire on offense and is slowly learning how to be a point guard. It's only his second year.    Wendell is another one that needs to stay healthy, but I do enjoy him as a player.    ""Thadgic"" Young is a God-send to this team. Always been a big fan of his, but he really is a catalyst for this team and he's our glue guy.   Been surprised with Valentine as well.    Overall. This team is FINALLY on the right path and I am excited to see where we go!    See Red!"
Coby White
"Kpj, keldon Johnson, coby white"
"Ik this is definitely a bit of a homer take, but Thybulle has to be included on this list. While he has basically 0 offensive game, he is legitimately one of the best perimeter defenders in the league already. I think at the minimum he should be included and take Coby White off, he's too inconsistent."
Coby white too high
How do Bulls fans feel about Coby White lately?
"Coby White, him and LaVine will kill NBA backcourts for years to come."
"For a 7th overall pick he's a bit disappointing. You expect a guy at 7th to be at the very least an alright starter.  2019: Coby White, Bulls.  2018: Wendell Carter Jr., Bulls.  2017: Lauri Markkanen, Timberwolves.  2016: Jamal Murray, Nuggets.  2015: Emmanuel Mudiay, Nuggets.  2014: Julius Randle, Lakers.  2013: Ben McLemore, Kings.  2012: Harrison Barnes, Warriors."
"&gt; But this team just desperately needs a pass first point guard to run the offense.  Coby White is playing out of position and not terribly good at it. Yes, he scores but not efficiently at it.  It's nothing against White as a player but he really needs to be 6th man or at the 2.   The Wolves did the same shit with LaVine as a rookie and once he was moved permanently to the 2 he became a better player. Once White is moved out of point and to the 2, he'll be a better player."
"Coby White isn't a point guard, he's an awful fit with Lavine, he's basically a (way) worse Lavine"
"Good. Coby White is a better,more selfish Jaylen Nowell, he can't run an offence."
"The Bulls arent well rounded enough forvthe Playoffs but too good and competitive for a deeper Lottery Look.    So, work on your weakness and the young core.  Don't touch: LaVine, Williams, Thad Young, Temple.   Bring in a Center who protects the the rim, sets screens and stretches the floor - Myles Turner for WCJ, Chandler Hutchinson and a 2nd Round Pick.  Lonzo Ball should provide pass first and more defense than you get with Coby White. Let him go off the bench as 2 Guard (with Satoransky for example as the PG) . Get Lonzo either for a 2nd rounder plus Denzel Valentine or see if he wants to come in the FA (he is a RFA)   With that you strengthen the bright side: Good tempo, good bench - but work on the efficiency and turnovers in that.  Lauri will have troubles finding his money wish in the contract offers. He's hurt so often and inconsistent. Healthy and ready, he is a cornerstone of the Franchise but more as Tony Kukoc than as Pippen to our Jordan!  Get a SF that gives you 10pts and defense. Get rid off (trade away, or let go): Felicio, Kornet, Hutchinson, WCJ, Arcidiacono, Gafford.   Get a more balanced team with better roleplayers to provide a 2nd Star enough money and Space to go join next to LaVine."
Trade some of the younger talent (aside from Coby White) and picks to SA for Derozan and to Indiana for Turner.  Let Otto Porter Jr.‘a contract ride out and extend Derozan on a max deal.   Move forward with White/Lavine/Derozan/Young/Turner in a chase to become a playoff team/establish a winning culture around Lavine as he enters his prime.
Perhaps swap coby white for lonzo ball
1.Lauri Markannen  2.Coby White  3. WCJ
Coby white/Wendell Carter jr
Is Coby White the worst defender in the league?
"not the guy/girl you were responding to but uhhh let me try for fun.   **Yes/fairly certain are better than Curry:**.  Simmons   Schroder   Conley   Nunn   Holiday   Lowry   Doncic   Ball/Bledsoe   Beverely/Jackson   CP3   Fox   Brogdon   Shai   Dejounte Murray   Westbrook   Harden   Wall    **Maybe:**   Rose (this one I'm not sure about)   Curry (is Curry &gt; Curry or is Curry &lt; Curry on D? idk)   Coby White   Whoever tf is the Magic's starting guard, is it MCW?   Murray   Morant    **No:**   Trae   Garland   Dennis Smith Jr   Rozier   Dame"
Having Paul will make you more efficient. Zach has Coby White and I Love Markkanen.
"How is coby white so high, I don’t watch many bulls games but wow"
No Coby White? Then I'm not playing.
"He played with Towns years ago and he has gotten way better since then. Im talking about the Lavine we've seen for the past 2ish years.  *It’s not like Lavine has no good players on his team*  Who? TBH I like the Bulls' future, but they absolutely do not have any ""good"" players besides Lavine.  Markkhannen has been out for over half their games and he is **barely** a ""good"" player.  Coby White is averaging 16/5 on terrible efficiency and average/below average defense  Wendell Carter Jr with his 12/8 is average at best but he's also missed close to half their games.  After that, their next best players are Thad Young, Patrick Williams, and Garrett Temple.  Again, I like the Bulls' future. I think Coby, Wendell Carter, Patrick Williams, and Markkhanan are all going to be really good players. But they are definitely not there yet. I don't know how you can look at this roster and think that is even a halfway decent roster. Even with all that though, the Bulls are half a game from the 7th seed. I truly think they are several games worse if you replace Lavine with Mitchell because while Mitchell would very slightly improve their defense, he doesn't improve anything else and the Bulls would score way less points because he isn't anywhere near as efficient as Lavine."
"Lavine is literally still being called an empty stats player, idk where that he gets a pass shit from. Lavine, Trae Toung, and Booker were. You can literally go to any previous season and check our postgame threads.  And Kenna Walker is a better player than Lavine? Something that isn’t even disputed. Your point?  Also, that team that should get us 8th Seed, you do know that Porter Jr, and Markannen have been out the vast majority of this season to injury right? So... a team of Lavine, Thaddeus Young, Coby White is supposed to get us to the playoffs.   Zach and Stephen Curry’s current numbers are nearly identical. Outside of literally turning into Lebron or 2018-2019 Harden, he can only do so much."
"Idk if your purposely being obtuse but even in the East, you need decent teammates.   Bro 2nd best player is Thaddeus Young, with the next being 2nd Year Coby White.  You can scream out it’s the East but at the end of day, when your next best player averages 12 POINTS, getting wins is hard unless you’re a superstar."
Marvin Bagley   Josh Okogie   Lauri Markennen    Coby White
Then you didn’t know anything about Coby White Cocks.
  **Raptors @ Bulls**  [](/TOR) **102 -  114** [](/CHI)  **Box Scores: [NBA](http://www.nba.com/games/20210513/TORCHI#/boxscore) &amp; [Yahoo](http://sports.yahoo.com/nba/toronto-raptors-chicago-bulls-2021051304)**  |**Team**|**Q1**|**Q2**|**Q3**|**Q4**|**Total**| |:---|:--|:--|:--|:--|:--| |Toronto Raptors|27|20|29|26|102| |Chicago Bulls|30|36|22|26|114|  **TEAM STATS**  |**Team**|**PTS**|**FG**|**FG%**|**3P**|**3P%**|**FT**|**FT%**|**OREB**|**TREB**|**AST**|**PF**|**STL**|**TO**|**BLK**| |:--|:--|:--|:--|:--|:--|:--|:--|:--|:--|:--|:--|:--|:--|:--| |Toronto Raptors|102|40-90|44.4%|12-36|33.3%|10-18|55.6%|7|33|24|14|15|9|1| |Chicago Bulls|114|45-83|54.2%|17-36|47.2%|7-10|70.0%|7|50|31|15|4|17|4|  **TEAM LEADERS**  |**Team**|**Points**|**Rebounds**|**Assists**| |:--|:--|:--|:--| |Toronto Raptors|**35** Stanley Johnson|**10** Stanley Johnson|**7** Malachi Flynn| |Chicago Bulls|**24** Zach LaVine|**16** Nikola Vucevic|**10** Coby White|
Did you not get the memo?? Coby white can go upstairs!!
"Lavine, Vucevic, Thad, Temple, Theis, Williams, Sato. Coby White is somewhere in between where if he’s having a good game he’ll be included in the circle, if not though then he’ll be kept out of it. Recently he’s been moving more and more into it, but he’s still on the cusp."
"He had 9 blocks that game, 5 of them were on Coby White. I just don’t get how someone can fail to realize that what they’re doing clearly is failing miserably and that they should attempt something else instead of doing the exact same thing the exact same way over and over again."
Coby White
"Remember the bulls game when he blocked Coby white like, 6 times? Good times"
"Haven’t watched any Bulls games this year, but judging from that game, the Bulls should just pass the ball to Coby White anywhere on the court and have him throw up a shot."
RJ has a worse career 3p% than all of those players except Coby White.  RJ has made less 3 pointers than all of those players  RJ: 175/478 for .366  Coby: 279/786 for .355  Fair to say Coby is also a better shooter than RJ. RJ is a worse 3p shooter than these guys in every way.  What are you smoking?
"He's been amazing, but this prob isn't true  Garland, Coby White, Cam Johnson, Herro, then other borderline guys like Goga, KPJ, Deandre Hunter, Reddish, PJ Washington who Barrett is prob beating out but not by that much"
"Coby White. He’s been struggling all season, but seems to have found a rhythm when Lavine was out, and he’s been playing well the past few games with Lavine back too."
Coby white
Coby White always looks like a stranger just yelled at him in a grocery store for talking too loud.
"I wouldn’t say that, Coby White, Markkanen, Pat Williams and WCJ can all carve out decent careers in the league. Plus this last years draft was our first under the new management"
"They are going to decide whether they want to rebuild or win now this offseason by doing one of the following  1. Trade lavine/vucevic for draft picks/young players (possibly with golden state) 2. Trade Patrick Williams/Coby White for win now players and/or sign free agents such as Lonzo Ball.  Regardless, Artūras Karnišovas track record is pretty good considering how he helped the Denver Nuggests so I think questioning his moves this early in his tenure with the Bulls (aka thinking you know more than he does) is misguided at this point."
...Coby White
Suite life of Zach (Lavine) and Coby (White)  Anthony Davis is a Chicago Native  I think he is coming to Toronto
That’s not exactly lighting the world on fire. Coby white did that. Every team has someone putting up those numbers. It isn’t really super standout numbers
they said anthony edwards' main comp is coby white
  **76ers @ Bulls**  [](/PHI) **106 -  94** [](/CHI)  **Box Scores: [NBA](http://www.nba.com/games/20210503/PHICHI#/boxscore) &amp; [Yahoo](http://sports.yahoo.com/nba/philadelphia-76ers-chicago-bulls-2021050304)**  |**Team**|**Q1**|**Q2**|**Q3**|**Q4**|**Total**| |:---|:--|:--|:--|:--|:--| |Philadelphia 76ers|34|26|23|23|106| |Chicago Bulls|20|23|20|31|94|  **TEAM STATS**  |**Team**|**PTS**|**FG**|**FG%**|**3P**|**3P%**|**FT**|**FT%**|**OREB**|**TREB**|**AST**|**PF**|**STL**|**TO**|**BLK**| |:--|:--|:--|:--|:--|:--|:--|:--|:--|:--|:--|:--|:--|:--|:--| |Philadelphia 76ers|106|40-75|53.3%|11-28|39.3%|15-21|71.4%|7|44|23|13|11|16|6| |Chicago Bulls|94|36-87|41.4%|11-34|32.4%|11-14|78.6%|12|40|25|15|7|15|2|  **TEAM LEADERS**  |**Team**|**Points**|**Rebounds**|**Assists**| |:--|:--|:--|:--| |Philadelphia 76ers|**21** Tobias Harris|**10** Joel Embiid|**5** Ben Simmons| |Chicago Bulls|**23** Coby White|**8** Daniel Theis|**6** Tomas Satoransky|
"sato currently, the Coby white experiment did not pass the vibe check"
