"I think they can do a lot better, even in that scenario, than trading for 2 years of Vucevic, coby white, and a Portland non-lottery first, which is the only pick the Bulls can trade because all their first rounders after 2022 are subject to being traded.   Coby does nothing for them, they don't need him with Cam Johnson, Chris Paul, Devin Booker, and Cameron Payne on the team already. His role will be very small. Vuc is in no way valuable enough to make that trade work."
"Think about it from the Suns' perspective, Ayton is their best young non-Booker talent and the Bulls can't offer anything in the draft other than a non-lottery Portland 1st and 2nds.   Vucevic is a nice starting point, but Coby white wouldn't even have a large role on their team. I don't think they would make the trade without Patrick Williams involved and at that point the Bulls are out because there's no way they're trading Patrick Williams."
"PF is Patrick Williams (currently injured), sixth man would be Caruso, but I think he meant Coby White(injured)"
And they’re missing Pat Will and Coby White!
They definitely are but it’s nice to get a little taste of what the Bulls will look like offensively. This is also without Patrick Williams and Coby White.
"I didn’t say WE would be top 2 but yes our offense should jump to at least top 7 not just because we got Demar, Lonzo and Caruso but because they’re replacing Satoransky Coby White,Thaddeus Young as our primary ball handlers. You know it infuriating watching Coby White “run the offense” last year? Lonzo,Demar and Caruso are ridiculous upgrades over what we had last year. Zach had to try and create everything for us last year and he tried but it’s not his strong suit, having him play off ball will make him even more lethal offensively. Same with Vooch no point guard to actually utilize him so we were just running horrible pick and pops with him every possession."
"Derozan isn't replacing Thad, he was coming off the bench. He will be replacing Markkanen.   Losing Thad hurts us but our bench also gained a lot this offseason with Caruso and moving Coby White there.  Lonzo is also a good defender that replaces a bad defender in the starting lineup."
"We had the 12th best defense last year and Lonzo will be replacing Coby White, Derozan will be replacing Markkanen. Its possible to defend as a unit even without top defenders."
No he wants to play with Coby white
"Caruso, coby white, Derrick Jones jr are all solid?"
"I say this as a Bulls fan:  The Bulls are completely and utterly unproven which is the biggest reason nobody is talking about them. They have a bunch of high caliber players who have not had playoff success. Both Vooch and Zach are stars on non-playoff teams and its been awhile since Derozan has done much in the playoffs.   The reality is that we haven't seen a roster construction like this before and it is really hard to know what to expect. IMO they will surprise a lot of people and be in the 4-5 seed region.   I agree with you that on paper this team seems really really good for flying this low under the radar. The starting 5 is extremely solid from 1-5 with a great mix of veteran and young players. They have to have one of the most athletic rosters in the whole league, and the bench has some really nice pieces in Coby White and Caruso.   The only way I see this team playing poorly is if Vucevic gets hurt. The center depth is not good and having to depend on Tony Bradley is a recipe for disaster. The guard and wing depth is really good though. I also think that we will se Patrick Williams playing a decent amount of small ball center. He is really strong and has great rim protection instincts."
"Believe me, we’ve watched Coby White die on them for an entire season. We’re very well aware."
They should be atrocious defensively but I'm excited to see how they look probably more than almost any other team. Lonzo Ball is a good on ball defender but they'll still be really really bad defensively  Edit: I'm also a big Coby White fan but I feel like that's me just liking him more than thinking he will develop a ton
I’d feel lost too watching Coby White and Lauri play defense
"Lonzo is pretty good with a stretch big like Vooch. And hopefully still improving. Lavine is the closer, and Coby White was a fine bench option. Caruso is actually a competent secondary playmaker.   I just don’t like the DeRozan move. A lineup of Lonzo - Lavine - Caruso - Williams - Vooch is better than one with DeRozan."
2016: Kris Dunn to Buddy Hield  2017: Lauri Maurkennen to Frank Ntilikina   2018: None  2019: Jarrett Culver to Coby White  2020: Anthony Edwards to James Wiseman
How about Coby White?  The white ball sack itch?
2016: Denzel Valentine to Juancho Hernangomez  2017: Lauri Markkanen to Frank Ntilikina  2018: Wendell Carter Jr to Collin Sexton  2019: Coby White to Jaxson Hayes  2020: Patrick Williams to Isaac Okoro.
"Kris Dunn -&gt; Buddy Hield   Justin Patton -&gt; D.J. Wilson   Josh Okogie -&gt; Grayson Allen   Jarrett Culver -&gt; Coby White   Anthony Edwards -&gt; James Wisemen   Our draft lineup looks real rough… seems like 4 out of the 5 picked one after us were upgrades.  Though, I’d say Ant over Wiseman offsets the difference since he’s already shown flashes of being a franchise player, especially during the second half of his rookie season."
"yes, Zach scored about 4 less points per game than Beal on much better efficiency, and has Beal beat in practically every single advanced stat possible  if you look at adjusted shooting too, the difference is MASSIVE, Zach’s stats being much much much much better. In fact, his adjusted shooting is by FAR better than Mitchell and Booker’s too.  This is all while having COBY WHITE as his point guard, while Mitchell has Conley, Booker has CP3, and Beal has Westbrook.  it’s insane how he’s almost always seen as easily the worst out of that group"
"Come to papa, may I interest you in a slightly used coby white"
"Vucevic had a great game. I hope he can build on this because he's been MIA all season. He had a slow start and was just starting to warm up when he got COVID, sat out a few games, and was cold again when he returned. It's amazing the Bulls have done so well essentially without his help. They will be so much better with his help.  Another Bulls player who started the season late and still isn't in his groove is Coby White. A lot of Bulls fans are calling for rookie Ayo Dosunmu to get more of Coby's minutes, but Coby has played much better than this in the past and it looks like the coaches want to give him minutes so he can get back to form. Even if they ultimately trade him, as some fans are saying they should, they need him to be playing well or no one will want him.  And Ayo, for all his great plays, also makes a lot of rookie mistakes. With the Bulls playing as well as they are, there's nothing wrong with bringing Ayo along a little more slowly.  Alex Caruso has been wonderful on defense but not as wonderful on offense.  He, too, can play better, and his last two games -- really three of his last four games -- have been good offensive games. He needs to keep that going, because it's harder to play him long minutes if he isn't offering much on offense.  It's annoying that the Hornets went on a 19-4 run at the beginning of the fourth quarter to make the game close again, but at least the Bulls responded well and won handily in the end. The Hornets are a good team and this was a great win."
We have Coby White a frp and Troy brown jr available
"Y'all made it scary. I don't know if he's normally way better, but it felt like if you had anyone on the court except for Coby White for those 20 minutes, you probably would have won."
Coby White is way too inconsistent to be the spark plug off the bench type of guy that I was hoping he'd be. For every game where he'll get 20 points he'll have 2 games where he barely scores at all and gets like 5 TOs.
"Chicago fans, what's up with Coby white? I thought kid had potential and seems like he hasn't played that much this year. How do y'all feel about him?"
Coby White is just awful this season. I don't know if that's the effect of injury or other reason. Caruso definitely eat most of his minutes
Javonte green Tony Bradley Ayo dosunmu Derrick jones jr Coby white   Checkmate
"Coby White on 9/11 shooting, +39. Damn."
"Most of the roster is new for the Bulls, so it's tough to get an answer. Vuc got some hate for his slow start but when he was out with COVID and had to start Tony Bradley... All the Vuc love came back.  I'd say the most polarising is Coby White, included in trade talks all the time, but there's probably no actual good answer yet with the Bulls."
Soooooo much Coby White slander
Because he's just straight up not that good right now lol. Also I'm pretty sure Coby white had like 7 threes in a quarter his rookie year or something
I want to say current would be Coby White. Not sure why but there’s always been people low on him since he was drafted. He’s breaths the wrong way and fans are calling for his head. Vooch may also qualify but it’s hard to tell if a lot of the fan base really doesn’t like him or if it’s just because of how he’s played as of late.
Bulls will give you a Portland protected pick and Coby White for him.
how is Dosunmu looking this season? i was always surprised to see him falling into the 2nd round in mocks and was even more surprised to see him selected at 38. Always seemed to have more ability than that.  Also is there any point in playing coby white anymore when u have Ayo?
Coby White as the off the bench volume scorer a la the Jamal Crawford/Lou Williams mold
"Too bad the Kings didn’t listen to KOC they could’ve had a stacked roster with Killian Hayes, Poku, Coby White and Jarrett Culver"
"Most Bulls fans are aware of his flaws. He’s not there for scoring. We have Zach, Demar, Vuc and Coby White for scoring. His biggest asset for the team is defense. Him and Caruso set the tone for defense for us and are simply disruptive perimeter defenders who keep the team defense consistently rated top 10."
Lavine   Lonzo  Derozen  Vuc  Patrick Williams  Alex Caruso  Coby White  Ayo Dosunmu
"If you have some playmaking instincts then sure, but if you have none at all like KPJ then you can’t. We tried this experiment with Coby White last season, it turned out as you would expect, he just isn’t a point guard"
"The Bulls pulled out another kind of ugly win with no true center on the floor. Coby White scored ten in the 4th quarter, breaking out of his post-injury slump. His teammates were really happy for him, doused him with water during his post game interview.  The Bulls can definitely play better, but I'm holding them to high standards these days. The Knicks tried to shut down LaVine and DeRozan and force other players to beat them and for most of the game, until Coby got hot, the strategy kept them close. White needs to keep it going, Caruso needs to break out of his scoring slump, and Vucevic needs to come back and start hitting threes, which may take a while.  I have December 16 marked on my calendar because it's the Bulls' 29th game. Right now the Bulls are unexpectedly on pace to be a real contender by Phil Jackson's definition -- winning 60 before losing 40. If they can win 20 before losing 10, I think they have to be taken seriously in the East. They really haven't reached their full potential yet, and are still winning."
"Gonna be interesting to see how/when Coby White gets his minutes as the year goes on.  Lonzo played 35, Zach 36, Demar 37, Caruso 30, so I guess it's just a matter of being smart with the rotations.  Don't think Vuc coming back should complicate it too much, since none of those 5 dudes can play his role."
"Coby White, Nikola Vucevic and Patrick Williams missed significant time in this stretch too."
Actually they should trade him to The Bulls for Coby White &amp; the Portland pick.
"Coby white looks either lost or outmatched. Hoping for the former, but watching him go from starter to struggling to get minutes is at least a sign of how much better the bulls have gotten.  The bulls are playing better defense for longer stretches than before and its really great to watch.  Derrick Jones played his ass off last night. Energy energy energy"
when healthy Coby White is extremely consistently inconsistent
Coby White is ass
Coby White to New York for Nerlens Noel and a protected pick?
"Derrick Jones Jr, Pat Williams, Coby White, and Tony Brown Jr for pascal? Lol"
"coby white is a boring name but something about ""Darius Bazley"" is just off-putting to me. dont like the way it sounds or how it feels off the tongue."
coby white &gt;&gt;&gt;&gt;&gt;&gt;&gt;  pls don’t look at my flair
Ranked by Best Names  1.	Bones Hyland 2.	Talen Horton-Tucker 3.	James Bouknight 4.	Tyrese Haliburton 5.	Darius Bazley 6.	Jaxson Hayes 7.	Tyrese Maxey 8.	Deni Avdija 9.	Kevin Porter Jr 10. Coby White 11. RJ Barrett 12. Cole Anthony
"I think I remember some UNC guys going back to the school and just training and messing around with the guys who play there now.   Think it was Coby White and Theo Pinson. It was posted on the Tarheels IG page, so It wasnt like they were trying to hide it."
Coby White???
Coby White for KD?
coby white.
"Move aside bitches, LA has a new owner.  We are so good that we didn't even need Coby White."
"Patrick Williams going down, vooch getting COVID, and Coby White just coming backreally doesn't help the depth.  Vooch will be back soon and Coby will start to get reaclamated should help. He'll be dangerous AF off the bench. Then they could definitely get a backup vet 4."
Coby white kinda sucks
Just getting Coby White back too.. Instant offense off the bench. Bulls best 6 players are up there with any team in the league. My boy Troy! Go Ducks
"&gt;Chicago is without Patrick Williams and Coby White, which is a far more impactful loss than Morris, Winslow, Johnson and Preston, so yeah, I think it's reasonable to say that both squads were pretty shorthanded.  Sir you are delusional if you think patrick williams and coby white are more impactful loss than morris and ibaka"
I'll take 1-2 first and Coby White
"&gt; Are we comparing kawhi to vooch now?  I'm not saying Vooch is *as good as* Kawhi, but he's a two time all-star, a career 17/10/3 guy and a legit player. He costs $24m for a reason and missing him is a big deal.  &gt; Vooch has been struggling all year lol  Vooch had a stretch of 10 bad games. I'm not going to blow smoke and claim he wasn't struggling, but it's 10 games to start the season, relax. He's an 11 year vet, he'll come good, he didn't suddenly go from all-star to washed up over the 4 month offseason break.  What's more, I wasn't just referring to Vooch. Chicago is without Patrick Williams and Coby White, which is a far more impactful loss than Morris, Winslow, Johnson and Preston, so yeah, I think it's reasonable to say that both squads were pretty shorthanded."
&gt;Billy Donovan said Coby White is cleared to make his season debut vs. the Lakers.  Damn good info thank you
Coby White MIP campaign starts now 😤
Coby White!
"my guy Coby White on any given night can either look like a cerebral scorer capable of averaging 30 ppg, or a scrub that would ride the bench in the gleague"
Basically coby white
"Attended the game and it was awesome! It felt like there were almost as many Bulls fans as Clippers fans — as a Bulls fan myself, it was a great feeling.  DeMarvelous DeRozan was so dominant all game, but in the first half he was automatic. I’m starting to see comments here and there about him being a dark horse MVP candidate, and while that’s an optimistic take IMO, his impact for this team cannot be understated. He keeps the offense afloat when the bench is in (bench mob has a lot of high energy guys but no real playmakers while Coby White is out), and he’s a real calming presence with the starters which really showed on nights like this. Every time the Clippers pushed to within 5 or so down the stretch, the Bulls answered. When we just needed a bucket, DeMar got one for us. The team was poised under pressure and pulled off a solid win on the road. This sort of thing never happened in the last few years. Usually, it’s just Zach playing hero ball (out of necessity), and when his shot wasn’t falling (as it wasn’t in the first half tonight) we’d fall apart. But with DeMar, Zach doesn’t need to force as much and can focus on hitting the big shots he’s now proving he can hit.   Then add in Lonzo looking like a bonafide sniper and Caruso locking down everyone. Plus high motor guys in Javonte Green and Ayo Dosunmu off the bench. This team is so much fun to watch.   I’M HYPE, NEIL FUNK!"
"They both bring different things to the table.  Zach is the more talented scorer given his ability to score at all 3 levels. But due to his hand injury (and tunnel vision that pops up from time to time) his ball handling and passing is suspect when under pressure.  Demar is a more consistent, well polished scoring presence given his ability to calmly get to his spots and score and draw fouls. His superior playmaking ability also allows him to be played alone alongside the offensively challenged Bulls bench unit and get them going offensively.  Once Zach gets healthy and the Bulls get Coby White and Vooch back, Demar's offensive load will lighten up a bit."
Coby White is the answer and you will find that out soon
"With Lebron out right now, THT. But overall it’s tough because coby white hasn’t played all season. I’ll wait until he gets a few games under his belt. But I like coby"
Holy shit let’s go.  Gonna grab him from the waiver wire.  THT or Derrick White or Coby White?
"No Vuc, no Pat Williams, no Coby White. Nice adjustments with the lineups to hold this team to 90."
Coby White I miss you
especially with the return of Coby White 😍  pumped
"The Clippers scare me. They're red hot and Reggie Jackson has been fantastic. It's also going to tough to pull it off without so many core players in Vuch, PWill and Coby White"
And Coby White.
That defense was crazy. That is the most frustrated I've seen Zach in like a year and a half. Your team is the only team that has thrown us completely off our game. Hopefully when Vooch and Coby White come back we will be much more competitive. We had an awful shooting night outside of Zach but alot of that had to do with the defense.
"I mean so far since we’ve barely lost not really but I’m sure this game might start some talk of it   Vuc is a stretch big and Demar has been putting up a few per game, Lonzo is mostly a catch and shoot guy and LaVine obviously does his thing but off then bench we don’t have much shooting or scoring, which is why we’re looking forward to having Coby White back"
"It's been like that all season even with Vooch. He's had a rough start. Once Vooch gets his rhythm (he was starting to and then got covid) and Coby White returns, they should have a lot of options for scoring"
"Pat Williams, Coby White, DJJ, the Portland pick &amp; our 2027 1st."
"Yeah basically since the All Star break last year and the first week of free agency the new regime jettisoned everyone drafted by Gar Pax not named Coby White, and I get the impression if he was healthier during their fire sale he may have been included in a deal during that time period."
Coby White is coming back and see him thriving off the bench playing shooting guard instead of point.
"The Bulls really only have their most recent picks. Coby White from 2 years, Pat Williams and Marko Siminovic from last year, and Ayo Donsummu from this year's draft."
If we are counting 2019 klay out can include Coby white too then lol
Chicago. Pat Will n Coby White for Ben.
It's scary that we still have Coby White coming back from injury and we don't really have a place to put him.
So do we. Pat Williams and Coby White might not be Klay Thompson but that’s more defense and offense we have off the table. This while LaVine is playing with a torn thumb.   Fully healthy we’re probably not contenders but again don’t start crowning shit 12 games into the season.
"Its crazy cuz our defense is legit better than our offense rn. Once vuc gets it going even more, lavine gets fully healthy, and coby white comes back, our team will be unstoppable"
Who is homegrown on the bulls? Coby white?
"Coby is needed, he can create his own shot and help with our 3pt issues. There are still plenty of minutes to give white."
"if the only thing you're elite at is blocking you're not worth more than that IMO, a lot of the rest ain't great, be real.  especially on a team with elite team steals/blocks. And you wonder why you're not getting calls for 3 years my guy  you're overvaluing MT as much as bulls overvalue coby white fr"
The Coby White primary ball handler experience is not one I enjoy.  Though I will say this team has been playing smart and I've always thought Coby did not have that in his game. so this will be a good test.
"And what is he worth? More than Coby White + DJJ? Turner's issue is consistency, always has been. Hence why this is his third year being shopped to no avail. White is about our only worthy trade piece, and your backcourt is either unsuccessful or crowded depending on who you ask. And our concerns (as Bulls fans) is spacing with Vooch, a problem you guys have seemingly always faced with Sabonis. Makes it hard to give up anything more than what I said imo"
"Ayo is good but ideally not someone you want to rely on for offense. He’s a killer in transition, but will probably struggle in the half court and more so when teams start planning for him.  But Coby White can go nuclear when he gets rolling. Very inconsistent and one of the worst perimeter defenders in the league, but we need his ability to get point off the bench. If we had his production we could be undefeated. Our losses have been that close."
"I just don’t think Coby has ever proven himself to be that consistent himself. It’s not like he’s some tenured 6th man  If you need a scoring punch, you could probably acquire someone better than Coby White in that role"
Bulls fans saying they need Coby White when he just gonna take away minutes from this dude smh
Bulls won't even need Coby White much at all if Ayo Dosunmu keeps going off goddamn
I'm a Coby White fan after he dropped 35 on us just games before we entered this crazy Covid era.
Alec Jacoby “Coby” White  Obadiah “Obi” Toppin
"Are you really gonna do the Great White Hope, Coby White like that? But yeah, once Harris comes back, the Sixers are a lock for home court if healthy."
Patrick Williams and Coby White but alrighty
Y’all should trade coby white and some other pieces for Simmons so he can start at center for you 💀
Well ur missing that Zach has a hurt finger and obviously steph curry no wait coby white Apperantly equals three starters and a dpoy guy. This my friend is called delusional
"Zach with hurt finger, coby white and low usage pat =\= Simmons, Tobi, green, thybulle, joe hurt knee, and Isiah. Sorry bud take the L move on"
"We're not fully healthy though. Zach is playing with injury, patrick williams and coby white are both out"
I’d say he’s at least as good as coby white right now!
"That 2019 draft, all indication pointed to the Bulls drafting Coby White at #7. I was dead set on wanting to trade back with Boston to grab their late lottery pick and one of their late 1st rounders and grab Poole as I thought he was just as good, if not better. Sometimes it’s nice to be right."
"Ya definitely agreed. Long term this team was built to be around Zach esp. with his ceiling/playoffs potential unknown I just mean right now (esp. w DeMar starting hot) I see them leaning more into DeMar being the main option given Zach's hand. Honestly I'm surprised he's still playing given how rough he looks out there. Clear he had to change his game n stuff but last night man was legit playing with one hand and rebounding a couple times solely with his right hand which I've never seen him do lol, guy looked so uncomfortable I feel it's just a matter of time before he sits out n gets the surgery.   Just a rough situation cause I know sitting out for any period of time is the last thing he wants to do rn finally having a decent team around him. Not to mention we'd be kinda dead in the water without him this month with Coby White still out &amp; the schedule as it is.   Hopefully the plan is just for him to make it thru this stretch &amp; he can get some rest when Coby's back to replace some of the production cause if not I feel it could get real ugly if he intends to play thru it all season."
"You don’t have to be a hall of famer to be a good point guard or a guard that compliments the future of your franchise.  Bledsoe was a really good point guard  averaging 18ppg and 6apg. His tpg was over 3, which isn’t really a great ratio, but he was able to take the heat of Booker on offense and defense and let him grow as a player.  Those below average rookies were brought in to compliment Lavine, not compete with him like KPJ is doing with Green right now. You forgot sotaransky with the bulls as well. The bulls kept trying to find a point guard who could fit with lavine. They didn’t just take a wait and see approach to it. Coby white was drafted 7th and they have already bailed on him after 1 season because they saw he didn’t fit with lavine.  The rockets should do the same thing and move on from KPJ at point guard and have a veteran point guard come in and run the offense to help Green succeed.  KPJ isn’t that promising of a prospect. His ceiling is JR Smith. Pretty good wing role player that was as dumb as a box of rocks."
