"The reason why I think the Lakers are a good example is because I knew people would look only at Lebron joining.  I'll admit, that was a product of our city and the team's legacy.  But Lebron isn't the product of tanking, AD is.  And its not that AD wanted to join our team, the reason tanking worked is because *we wouldn't have had the assets to trade for AD if we didn't tank*.  That's why tanking is a success story for the Lakers.  Even if you accept everything else about the Lakers drawing power for free agents, we still wouldn't have been able to get AD if we didn't get that #4 pick, or the consecutive years of #2's.  Had we actually tried, we would have been worse off even if Lebron did decide to join us.  As for the Timberwolves, I think you're doing what I said people are doing and making the wrong comparison.  The wrong thing to compare isn't tanking and non-tanking teams.  Ask yourself how good would the Timberwolves be vs. themselves if they didn't suck.  A Timberwolves team that didn't have KAT and had a bunch of middle first round picks.  They couldn't pair that up with Jimmy Butler and go to the playoffs, we've seen them suck for like 10 straight years, there's no reason to think they wouldn't have missed the playoffs for another decade like that.    Same thing with Philly.  Imagine they didn't have Embiid and Simmons and didn't go to the playoffs, but became Kings East.  They could have languished in the #10-15 seed like Detroit has with no future.  Speaking of Detroit, imagine they kept Blake and tried to make the playoffs every year.  We all know he's way past his prime, but could maybe give you a good game once a week.  Instead of Cade, they'd get some random pick in the #11-20 range because they were able to ride Blake and some other vet they traded for to the #9 seed.  And they decided to keep those guys together and try again next year with.  They would be worse off than they'd be sucking for the last few years and getting Cade.  I'll speak on the Lakers again since I know them the most.  In those years, we got guys like D'Angelo Russell, Julius Randle, and a bunch of random players like Robert Sacre, Chris Kaman, Tarik Black, Lou Williams, Josh Hart, David Nwaba, Jordan Clarkson, Marcelo Huertas, Ivica Zubac, Brook Lopez, etc.  Some of these guys are pretty good role players, Brook just showed he isn't dead and helped to win a championship, even played a pivotal role in one of the Finals games.  As pieces, a lot of them can fit into a good team.  Clarkson was just 6th man of the year, Lou Williams has won that a couple of times, Julius Randle just posted a great season and lead the Knicks to the playoffs, D'Angelo Russell has become a more consistent shooter and fun player to watch, Zubac is probably an above average center on a team with championship aspirations.  But is that a championship team?  Can any of those guys realistically even now lead you to a championship?  Remember, without tanking we don't get Brandon Ingram, or Lonzo.  We'd get maybe Thon Maker, or Georgios Papagiannis (the wrong Giannis!), or TJ Leaf, or Frank Ntilikina, or Coby White, Trey Lyles, etc.  Pelicans don't want those guys for AD.  We're not trading Stanley Johnson as the centerpiece in an Anthony Davis trade, we'd be luck to get Ed Davis in a trade!  Yeah, it was pretty brutal to watch for a while, but so what?  The owners are almost all billionaires, I don't shed any tears for them, they'll never be homeless or miss a meal.  Let the arena be empty, let them lose money, this is a long term plan and when you win, the fans will come back, guaranteed.  Or they could mismanage the team for decades and have what the Kings, Wolves, and Magic have right now.  I doubt Philly or the Lakers would trade their team for those players."
"Exactly, even Coby White cooked us."
How about a package centered around Coby White and a Lauri sign and trade?
"The Bulls come to mind. TBF they started horrifically defensively last year then got pretty ok after Vuc. No, seriously. Coby White was the worst defensive player I've ever seen to start last season but he played with more effort later. Still not good, but not worst I've ever seen"
"They're obviously talking about Caruso, Ball and Coby White"
"To be fair, at the time he or coby white were the consensus next pick. It probably should’ve been Coby anyways since we wanted a pg, but even he hasn’t been great.   turns out we should’ve just held at 11 and got cam johnson but hindsight and all that."
"I know it's not great, but we will give Coby White, Troy Brown Jr, Lauri Markkanen, and 2 pick swaps for Ben Simmons. Thanks!"
Culver was mocked in the top 10 so it wasn't a reach also Cam Reddish and Coby White are 2 very broken players also. We need players who can contribute now not project picks.
"You could’ve had someone like Cam Reddish, Coby White, Keldon Johnson or Kevin Porter Jr and went with Culver thats hilarious LMFAO"
"I think they’re being slept on idc if I get downvoted. Vuc, derozan, Lavine, are all near-all star level players, derozan is coming off his best seasons, then throw in one of the best passers in the league (Lonzo) and Pwill. 6man coby white. Super solid team, I really only see their problem being defense but the offense should in theory be nasty as fuck of it all clicks together."
"Just LaVine. Even since 2019, just LaVine and Coby White"
"Nah, a lot of the same issues they've always had, it's just now they're more experienced.    If they do become that, it might hinge on Patrick Williams becoming a legitimate stopper to combine with Lonzo.  That type of high level perimeter defense (if they get it) can be a foundation to build on.  Might also need to use a Coby white trade to buttress their offensive stars with more 3nD and rebounding.  White could be a microwave 6th man scorer, but i just think his organizational role is too confused after being drafted as a foundational piece and getting kicked around in a few different regimes.  Prolly best to restart somewhere else."
"Patrick Williams, Michael Porter Jr, and this one may be controversial but if Coby White goes to a place where he can be a first option and primary ball handler he can be VERY good. once his develops his playmaking and consistency shooting the ball he could be a Trae Young type player"
What makes you think Coby White could be top 5 or top 10 in the future
Imagine making this list and leaving Coby White off it. Please watch basketball man
Coby White
In every player highlight video that’s against the Bulls you’ll see Coby White doing a weak ass layup that gets blasted
Coby White
"Keldon Johnson (not sure if that counts with his USA team status now), Coby White, Cam Reddish"
"Coby White, last chance to get your tickets to Coby Island boys"
Coby White aka Sub Zero
"Coby White, he will win MIP or 6MOTY this year, and will win finals mvp when the bulls go 16-0 sweeping every round in the playoffs"
The Bulls fit is better than people realize.  Pretty much every player in our starting 5 has never played with talent on this level and will flourish now that teams cannot focus their game-plans on them individually.  Bulls finish with the best offensive rating in the league and reach the ECF.    Derozan and Lonzo both average career high in assists.  Lavine and Vucevic average 25+ ppg. Lavine takes the next step in the playoffs and is in the Superstar conversation.    Coby White is in the 6moty conversation.    Donovan gets COTY for making the fit work.
"I’m super curious too lol. He’s either putting Patrick Williams, Lauri Markennan, Coby White, or Alex Caruso ahead of Lonzo, which seems wrong until proven otherwise."
Coby White
Coby White
"Of course they should have.   Instead of Butler they have an empty calories Lavine who has them over a barrell for 5 years 205 million contract next summer and busts like WCJ, Markannen and Coby White.   The Bulls will be better with Lavine on the bench next season as all his teams have been for the majority of his career."
"Of course he won't, what the hell?  There is Lonzo Ball and Coby White ahead of him for the PG position while SG is locked by Lavine. He'll most likely come from the bench as a PG with Coby finally being SG. But he is a great defender and playmaker off the bench and he can make points when needed."
Coby White is recovering from shoulder surgery and won't be available to start the year. Ayo will play.
"I could see that happening, but yeah we’re definitely making the playoffs. 3 20ppg scorers in the starting line up and  DeRozan &amp; Lonzo brings us the playmaking we desperately needed. Coby White will finally have a role that imo fits his game perfectly, I could see him having a breakout season when he gets back. So much talent, we improved immensely.   Hopefully they do end up signing some defensive from court depth because Thad and Theis are big losses."
God damn Wizards fan are haters. How were Lavine and Vucevic terrible together? And our third option went from Coby White to DeMar DeRozan. You think we’re going to get worse?
"No one's put the context for this clip yet, and that's surprising, considering how much funnier it makes it. The box score you see onscreen is *deceptive* -- this game was NOT competitive. Miami was up 15 practically the entire time. Chicago couldn't get anything rolling, and it looked like it was due to Miami finally digging themselves out of the .500 COVID-inspired slump they'd been in. The whole 101-96 thing comes from a **ridiculous** 4th quarter behind Coby White and Vooch. It was beautiful; and this is coming from a Heat fan. It was this storybook 4th quarter, and I remember being insanely upset that Miami would choke a game as easy as this before Denzel Valentine pulled up and essentially inked a 10-second contract with the Miami Heat with that shot. It was **deflating**. It was glorious. It's a historical 30-footer.  edit: also, denzel valentine is an ELITE basketball name. not a great basketball player though"
Coby White is the point guard of the future for the Chicago Bulls.
To bulls for Coby White
Bulls have Coby white and Caruso that’s enough.
"Probably not the best, but the Bulls have basically 3 guys who could be 6th man types in White, Caruso, and Lauri if he sticks around. There are probably a dozen teams Coby and Lauri would start on - like, ya know, the 20-21 Bulls."
"Lavine is the new Booker. He was an empty stats guy until he wasn't. And people will claim that Lavine has expanded his game if/when the Bulls make the playoffs. Which could be true, due to his constant improvement, but he was already a much improved player last year. The Bulls really struggled in the second half, part due to Lavine's covid absence, part due to injuries, and part due to a new team not completely getting used to playing with each other. People forget that the Bulls second half defense wasn't a catastrophe like the first half of the season was. You as a Bucks fan, who at least should admit that without the nets injuries you wouldn't even sniff the finals let alone the championship should know, that anything can happen. Especially in the playoffs. If Pat Williams or Coby White makes a significant leap, Bulls could be a complete team with veterans as well as young bloods. Don't forget that the heat made the finals (after killing your team) and I don't think Butler is a superstar or MVP caliber player. Whether or not this team gets stuck in mediocrity is yet to be seen. It's quite possible. But now this team has leverage for potential moves, which is what any GM worth their salt needs"
"The 8th pick... So what, they miss out on the next Laurri Markkanen or Coby White and instead be in a better spot to re-sign a 26 year old All Star. Seems fine to me."
"And more….  Biggest gambler: the wheelin', dealin' Chicago Bulls  I discussed the Bulls on last week's Lowe Post podcast, so I'll be brief. I am somewhere in the middle on their raucous offseason. I see a slightly higher ceiling than those cementing them in the play-in tournament in the beefed-up East. Their offense should be really good. Don't overthink the DeMar DeRozan fit just because he shoots long 2s and won't provide pitch-perfect spacing for Zach LaVine, Nikola Vucevic, and Lonzo Ball.  DeRozan has become a good passer; he'll get Vucevic and LaVine easy buckets. Redirecting about 10% of LaVine's game from on-ball creation to off-ball marauding is healthy. DeRozan can create for Chicago's shooters -- including Vucevic -- out of the post too.  DeRozan has more gravity away from the ball than a typical non-threat from deep; he's a cagey mover who can play second-side basketball, and defenses respect his long 2s.  But I wonder if the Bulls can grow into a strong top-four playoff seed over the rest of LaVine's prime, assuming the Bulls re-sign him next summer.  2021 NBA offseason  The NBA's 2021 free-agent signing period has begun, just days after the 2021 NBA draft.  • Latest free agency and trade news and buzz • Pelton: Analyzing every offseason move • Lowe: How the Heat keep doing this • NBA experts: Big surprises and what's next • Grades and details for every trade Building an average defense around LaVine, Vucevic, and DeRozan will be tough. Chicago's under-25 core now consists of Ball, Patrick Williams, and Coby White -- whose role going forward is a little murky. Chicago whiffed on a bunch of swings at young talent before the Jimmy Butler trade, and as part of that deal. (Lauri Markkanen, one of the key players in that trade, hangs in restricted free agency. He doesn't seem long for the Bulls, but maybe they can salvage something in a sign-and-trade.)  Chicago then traded away Wendell Carter Jr. and three future first-round picks for Vucevic and DeRozan -- two of the NBA's ultimate floor-raisers. (The Bulls are kinda Team Raised Floor.)  I like Ball, and I'm super-high long-term on Williams. You'd just like to have a little more in the young-player cupboard after one megatrade and years in purgatory.  That said, LaVine and Alex Caruso are just entering their primes; DeRozan and Vucevic are still in theirs. The Bulls have a nice age-range mix, which should give them at least some wiggle room to change direction if need be.  Winner: the prudent Charlotte Hornets  Charlotte is quietly building a solid team with future flexibility. The Hornets are probably one really good young player from a high-level long-term nucleus -- depending on the development of Miles Bridges and P.J. Washington -- but they are giving themselves avenues to get there.  Acquiring Mason Plumlee and the 37th pick -- JT Thor, signed to a richer version of the ol' Hinkie Special -- in a salary dump was a nice start. Plumlee is not the lob threat the Hornets dream of pairing with LaMelo Ball, but he's a ball mover who will be in the right place on defense (unless he's defending a buzzer-beater against the Lakers.) His $8.5 million deal for 2022-23 is only half guaranteed.  Plumlee is a stopgap, and that's fine. Snaring him prevented any irrationally aggressive trade. Charlotte has kicked the tires on basically every young center -- including Myles Turner of the Indiana Pacers, sources have said -- and they can continue sniffing around from a position of strength.  They jumped into the first round for Kai Jones, and were careful to protect the future pick they sent the Knicks to do so. They gobbled up another future first-round pick for Devonte' Graham, a player they didn't really need with Ball's emergence and Terry Rozier's central role.  (That move does create pressure to re-sign Rozier next summer, which could wipe out near-term cap space. Rozier had a really good season, redeeming Charlotte's decision -- pilloried at the time, including here -- to effectively swap Kemba Walker for him. He's only 27, and the cap space landscape next summer does not look player friendly.)  Kelly Oubre Jr. -- whose $12.6 million salary for 2022-23 is only 40% guaranteed -- should function better in Charlotte than he did in Golden State's motion offense. He provides insurance against another Gordon Hayward injury.  The next big decision is a potential extension for Bridges. He showed last season he is so much more than a dunker: a switchable forward blossoming as a playmaker and 3-point shooter (including off the dribble.) He has a lot to prove before you can pen him in as a high-level starter on a conference finals team, and pending Bridges' ask, the Hornets would be smart to let things play out in restricted free agency.  Washington's extension follows a year later. Ball looks like a future star. The Hornets have to remain nimble around him.   The Pelicans missed on free agent Kyle Lowry, who would've been perfect next to Zion Williamson. That happens. But it's hard to justify the moves made in the aftermath when New Orleans could've just ... kept Lonzo Ball. AP Photo/Gerald Herbert Loser: the New Orleans Pelicans  You can talk me into next season's Pelicans being better with Graham, Tomas Satoransky, Jonas Valanciunas, and Garrett Temple in place of Lonzo Ball, Eric Bledsoe, and Steven Adams. I'm not sure I'd really buy it, and if it ends up true, it'll likely be driven by improvement from holdovers -- including Zion Williamson and Brandon Ingram.  But I doubt New Orleans makes any short-term leap worth moving down 10 spots in the draft to open space for Lowry (whoops!); flinging away two other first-round picks; and losing Ball before his 24th birthday.  Lowry would have been a hand-in-glove fit, and it was not unreasonable for the Pelicans to believe they were one All-Star-level point guard from making a big leap up the standings -- and then one or two lucky breaks from a long playoff run. That was not the most likely outcome, but it was not outlandish. They didn't get Lowry. I'm not privy to their intel, but it clearly was not firm enough.  We know Ball's limitations as a half-court orchestrator. Graham corrects for some of them. He's a more willing off-the-bounce 3-point shooter on the pick-and-roll, though he hit just 29% on pull-up 3s last season and 34% in 2019-20. (Ball has been around 30% on lower volume.) The threat of that shot might open rim runs for Williamson, and steady New Orleans' horrid late-game offense.  Graham has hit 42.5% of his catch-and-shoot 3s over the past two seasons, a few ticks above Ball's mark. A knockdown catch-and-shoot guard is a boon for Point Zion, Post Zion, and every other Zion known to man.  ESPN Daily podcast  Monday through Friday, host Pablo Torre brings you an inside look at the most interesting stories at ESPN, as told by the top reporters and insiders on the planet. Listen Valanciunas is a nominal perimeter threat in a way Adams has never been. But let's not go wild. Valanciunas is not, like, Dirk Nowitzki. He attempted 0.9 3s per game last season. His defender can leave the court, order a beer, and chug half of it in the time it takes Valanciunas to hoist. Valanciunas at heart is a post-up fiend who will clog the lane a lot.  He is a slight step down on defense from Adams. The gap on that end between Ball and Graham -- a very small lead guard -- is pretty big. Graham is a sixth or seventh man on a good team. The Pelicans were bad last year because their defense was bad, without any consistent identity, and they've done little to repair that. (Satoransky and Temple are decent, but they are 15-minute reserves on good teams. The Pelicans did open a big trade exception for use later.)   Satoransky and Valanciunas are free agents after next season. Valanciunas will turn 30 then. Are the Pelicans excited to pay full freight? One potential benefit of these transactions is the Pelicans carrying a large chunk of cap room into next offseason -- the final summer before Williamson's salary balloons. Paying Valanciunas would jeopardize that.  The Pelicans had picks to play with; burning two isn't catastrophic. But it's two fewer to wield in trade talks -- or have leftover after some megadeal -- and it's hard to justify all this rigmarole when the alternative of just keeping Ball was sitting right there.  Winner: the Detroit Pistons  Ditching the 37th pick to dump Plumlee compounded the Pistons sending four (!) second-rounders to the LA Clippers in last season's Luke Kennard/Bruce Brown/Landry Shamet trade -- which netted Detroit Saddiq Bey.  But the rest of this offseason went well. Cade Cunningham might be a franchise player. Three years and $37 million for Kelly Olynyk -- with only $3 million guaranteed in Year 3 -- is fair and movable. Olynyk killed it in his half season in Houston, and was likely getting the midlevel exception from someone. Detroit outbidding that by a couple million is fine. A shooting center opens the floor for Cunningham, Killian Hayes, and the rest of Detroit's young attacking perimeter players -- making every decision easier as they adapt to the NBA."
I think the bench would look nice with Lauri.   Clear offensive focal points with White and Markkanen and three defense first guys.   Alex Caruso Coby White Troy Brown Jr Lauri Markkanen Tony Bradley
"Pretty much, those are generally the kind of ideal mold they grow into, assuming they can’t really develop those supplementary skills.   There’s always a chance that they can grow beyond that and do just enough outside of scoring to more than a bench spark 6th man, but it happens less often.   I think Coby White is a good example of when that doesn’t happen, and you’re more destined to a 6th man role, and maybe Colin Sexton is a good look at the upside? He’s a little too good to be a 6th man on most teams, but he’s still a tough fit as a starter on a really good team due to the passing/defense shortcomings. But he’s definitely a starter level player, just needs the right fit (probably a team with a bigger initiator that lets him be the smallest player in your lineup, and doesn’t need a nominal PG next to him).   Rozier is an interesting case too, seemed destined for a 6th man career, but he developed his off-ball play and movement shooting enough that he’s a legit starter."
"DDR is not redundant at all on our roster. We were last in the league in FTA and had basically no half court creation all year (Coby White is not a PG whatsoever, Sato is firmly a backup). DDR addresses both of those issues. Even Lonzo is more of a transition creator than a half court creator. I think people will be surprised to see how much DDR will be handling the ball in the half court"
You get Brunson who is a pure scorer at the 1. You throw in Coby White so we get depth at the 1. We would probably have to give you Powell and/or WCS to match salary.
Coby White could have a chance
"I can’t see DLo winning MIP after having already been an All Star. I don’t think Caruso will be at a high enough volume even if he improves his shot, he’s behind Lavine, DDR, Vucevic, Coby White, and Lonzo."
So take a current role player and basically make them the star on a bad team surrounded by young or iffy help a la Jerami Grant this last year?   Malik Monk is a pretty good pick but is probably at least this year with the Lakers away from really being able to explode in that situation.  THT on the same team is a possibility.   Coby White with the Bulls is a likely choice I think. The team would lose but the stats would be good.  Immanuel Quickley would probably put up Colin Sexton like stats on a bad team.
Coby White would be nice in a Celtics uniform now that Lonzo will be the starting PG for the Bulls.  Coby can score and has size so he’d be a perfect fit for our offense which is sometimes lackluster and too reliant on the Jays.
"No, he's not. He's at 35.6% on 6.8 pull-up 3s per game. That puts him 36th in efficiency out of players that take at least 1.5 per game. Just ahead of people like Will Bsrton and Coby White."
"That’s one of the middle cases. As a peak? Idk man, they have 3 guys who have been all stars plus super nice players like Lonzo, PatWill, Tony Bradley, Coby White and Caruso. They could really do well if they put it together."
"75% of comments are “don’t get the hype” so I don’t think there is much. Especially Wiz fans. Lol. No one has us, not even our fans, going to the ECF.   Our 3rd best player went from Coby White to DeRozan. That’s a huge upgrade. And everyone is talking about defense but look at our lineups last season. We’ve gotten better on paper, especially since it’s likely we’re not done. (And we were ranked 12th, Donovan is underrated in this instance.)   Regarding Vucevic, he needed time to transition but he played well. Then Lavine got Covid.   Your comments on Derozan is just bullshit. Inefficient? Bad shots?"
"Not sure what the consensus is but I'm really low on the Bulls' offseason. Derozan seemed like a massive overpay (+ they gave up a 1st round pick), and now they just seem to have a huge glut of scoring guards and defensive liabilities that'll peak in the next 2 years, ready for another poorly managed rebuild. Like, they might as well just trade Coby White now before the fact that he gets hardly any touches or playing time just tanks his value."
Lauri and Coby White
"They are a little similar, I agree. I think the Bulls differentiated themselves a bit with their FA moves though. They acquired more perimeter defense (Lonzo) and PoA defense (Caruso) which should help alleviate some of the issues our guards had last year with both of those areas (Zach is still not a positive but trended upwards; Coby White was the biggest weakness in our perimeter defense). I'm not sure exactly what the problem is for the Blazers is defensively as on paper they have some interesting defenders (Norm, DJJ, Covington). Maybe they need someone who's more committed to playing guard defense?"
"Idk man, can he give us the scoring that Coby White gives us?"
