"&gt; In other words, they wanted 2019 first-round pick Rui Hachimura or 2020 first-rounder Deni Avdija, a request that inspired a swift “no” in response from the Wizards.  Oof. Well, can't blame a team for shooting their shot."
"I want people to know that Justin Kutcher calls Deni Avdija the ""Wizraeli"" because that nickname sucks and I hate Kutcher"
They have Deni Avdija too
"I'm going to go with two guys who I loved going into the draft, but had somewhat disappointing seasons partly due to some stuff not entirely within their control: Deni Avdija and Tyrell Terry."
Killian Hayes and Deni Avdija I think
"Deni Avdija, Payton Pritchard, and Isaiah Stewart could also be borderline Allstars down the line"
"So you’re including teams where the player hadn’t won MVP yet?   Then the 2021 Washington Wizards, with future MVPs Bradley Beal, Deni Avdija and Daniel Gafford."
"Shortly after the Washington Wizards’ season ended with a first-round playoff loss, general manager Tommy Sheppard dropped a hint of what was to come.  “This is not a run-it-back team,” he said.  Now, it’s official. Changes are arriving. Big ones.  Just before Thursday’s NBA Draft, the Wizards and Lakers agreed to a deal that will send Russell Westbrook to Los Angeles for Kyle Kuzma, Kentavious Caldwell-Pope, Montrezl Harrell and the No. 22 pick, sources told The Athletic. Washington also will route a 2024 and a 2028 second-round pick to L.A. The swap won’t become official until the start of free agency on Aug. 6.  As Bradley Beal spent the last few weeks mulling his future with the organization, as The Athletic previously reported, Westbrook also was deciding his own. The former MVP, who is from the L.A. area, spent parts of the offseason discussing the possibility of teaming up with four-time champion LeBron James and eight-time All-Star Anthony Davis. Westbrook had a growing desire to join James and Davis in Los Angeles to compete for a championship, sources said. He formally informed the Wizards of his desires recently, according to sources: if they could find a trade that works, Westbrook wanted to go to the Lakers.  They landed on one.  Washington executed the deal with no issues from Beal, per sources. The three-time All-Star, who is entering the final season of his contract, has expressed no desire to leave the Wizards, according to sources. As speculation about his future has swirled, the team remains confident it can keep him for the long term. The Wizards can offer him a four-year, $180 million extension in October, but if he waits until 2022 free agency, he can sign a five-year contract for an estimated $235 million to return to Washington.  One of the main reasons Westbrook wanted to come to D.C. when the Wizards traded John Wall for him in December was the presence of head coach Scott Brooks, who coached the former MVP from 2008-15 in Oklahoma City. But the Wizards did not retain Brooks when his contract expired at the end of the 2020-21 season despite Westbrook’s outspoken recommendation that they should.  Westbrook preferred a more established coach to replace Brooks, according to sources. The Wizards eventually hired former Nuggets assistant Wes Unseld Jr., whose résumé includes 16 years as an NBA assistant and eight more as an advance scout.  The Lakers set an offseason goal to acquire an elite playmaker next to James and Davis. They deemed Westbrook worthy. He averaged a triple-double during his one season in D.C., the fourth time in five years he’s done so. Many in the Wizards organization praised him for how he changed the team’s culture and work ethic. He will turn 33 years old at the start of next season and has two years and $91 million remaining on his contract.  The Wizards believe the package from the Lakers improves their depth. They view Caldwell-Pope, one of Beal’s closest friends in the league and the type of player they have sought after for years, as their next starting small forward. Washington went into the offseason hoping to improve its defense and long-range shooting. Caldwell-Pope can guard the perimeter physically and is versatile. He sank 41 percent of his 3-point attempts last year.  He will reposition 2020 first-round pick Deni Avdija to the bench, the Wizards’ preferred spot for the 20-year-old as he returns from a fractured fibula.  The trade gives Washington more roster flexibility, too. Westbrook has a couple of seasons remaining on a supermax contract. Breaking his deal into three middling ones could make it easier for the Wizards to pull off trades for more reasonable salaries.  Harrell is only one year removed from winning NBA Sixth Man of the Year and averaged 13.5 points per game for the Lakers last season, but he fell out of their rotation during the playoffs. Kuzma has improved as a defender and shot 36 percent from beyond the 3-point arc in 2020-21. Both create redundancies on what’s now an imbalanced roster.  Renovations are coming — especially at point guard, where the team has an obvious, Westbrook-sized hole.  Sources say to keep an eye on 28-year-old free agent Spencer Dinwiddie, who missed most of last season with a torn ACL but averaged 20.6 points per game in 2019-20. The Wizards are above the salary cap but could try to negotiate a sign-and-trade with Dinwiddie’s incumbent team, the Nets. The other pieces from the Westbrook trade, Harrell and Kuzma alone, would not be enough for Brooklyn to accept a Dinwiddie deal, according to a source. Dinwiddie is expected to receive interest from several teams, including the Nets, Knicks, Heat and Raptors, sources said.  The Wizards made a smaller move for a point guard Thursday, flipping the No. 22 pick, which they received in the Westbrook trade, to the Pacers for fourth-year guard Aaron Holiday and No. 31, which netted them 19-year-old stretch 4 Isaiah Todd. Washington grew enamored with Holiday when he worked out for them before the 2018 draft and actually tried to trade for him a year ago.  That wasn’t all. The Wizards’ Thursday night also included selecting 22-year-old sharpshooter Corey Kispert with the No. 15 pick, which gives them another 3-point threat. Kispert, who made 44 percent of his long-range attempts last season at Gonzaga, was the top shooter on the Wizards’ list and No. 10 on their draft big board, a source said. Sheppard mentioned in a news conference that the Wizards explored trading up for him before taking him 15th.  Washington is now capable of loading lineups with shooters, something it seriously struggled with in 2020-21 when it neither made nor took many 3-pointers. It finished 23rd in 3-point percentage and 29th in 3-point rate (the percentage of their field-goal attempts that came from beyond the arc). Now, it can piece together units with Beal, Kispert, Davis Bertans, Thomas Bryant and whomever it has at point guard. Caldwell-Pope will fit in there, too. The Wizards now have 3-point menaces.  If Dinwiddie does not end up in D.C., options remain. This summer’s free agency class is rich with capable point guards — from top-flight ones (who are not realistic for Washington), like Chris Paul, Mike Conley and Kyle Lowry to more reasonably-priced ones, like Reggie Jackson, Patty Mills, Cameron Payne and Devonte’ Graham, amongst others. A reunion with free-agent Raul Neto, who spot-started for the Wizards last season, is a possibility, sources say.  They can use the mid-level exception, worth up to $9.5 million, to sign free agents. The Westbrook and Holiday trades, which shave more than $5 million from their payroll, give them extra room to operate below the luxury tax line. They also created an $8.5 million trade exception in the Westbrook deal, which they can use to trade for a player who makes up to $8.6 million (yes, it’s confusing, but that’s not a typo) without having to match salaries in the exchange.  For now, the roster is unbalanced. But moves are coming. Teams can begin speaking to free agents on Aug. 2.  The Wizards have 15 players under contract. But with Westbrook gone and both Neto and Ish Smith hitting free agency, they have only one point guard in Holiday, a 24-year-old who was a backup in Indiana last season and projects to hold a similar role in 2021-22.  They have a logjam of 3/4 types. Rui Hachimura, Avdija, Bertans, Kuzma and Chandler Hutchison all overlap in some way or another. Kispert could fit into this player type, too. They’re adding the second-rounder Todd to the mix too. Power forward Anthony Gill and wing Caleb Homesley are under contract but are non-guaranteed for 2021-22.  They have another crowd at center with three players who warrant playing time: Bryant, Harrell and Daniel Gafford — though Bryant will miss the beginning of the season as he continues to recover from the ACL he ruptured in January. The Wizards hope he can return by December, according to a source, though it’s difficult to lock in a specific return time this far out.  But this is not what the roster will look like at the start of the season. The Wizards, after all, were not a run-it-back team. And now, they are officially not running it back."
IT'S BECAUSE YOU NEED TO SHOOT BASKETS TO GET POINTS. BEAL COULD ONLY TAKE SO MANY SHOTS AND MY BOIS RUI HACHIMURA AND DENI AVDIJA AREN'T PRIMED TO TAKE OVER THE LEAGUE JUST YET. WESTBROOK'S VOLUME WILL GO DOWN BUT SHOT PERCENTAGE WILL GO UP. AD AND LEBRON ARE GOING TO BE ON THREE POINT LINES LEAVING CLEAR LANES FOR RUSSELL TO HIT THE PAINT. OR IMAGINE AD OR LEBRON CUTTING TO THE RIM? IMAGINE WB CUTTING TO THE RIM FROM A LB PASS? LEAGUES DONE.
"With Deni Avdija on the Wizards, that ain’t looking too good for him"
"I think the Deni Avdija, Alex Len, Rui Hachimura frontcourt from the wizards was comparable"
"their best package involves punting their draft picks for the next few years and some team being very high on Deni Avdija or Rui.   They can easily throw together something like what Milwaukee gave for Jrue- but it requires unprotecting their 2023 1st owed to Houston. If Houston agrees to do that (no reason for them not to)   #15, 2025 1st, swap in 2024, along with Bertans (negative value), plus one of Deni or Rui, and Bryant (positive value) should easily be enough to get a 3rd banana quasi-star to run with Russ and Beal, preferably a frontcourt guy. Will they win a title like that? Probably not, but it makes them good, at a minimum. They will be pretty desperate for depth though."
Ready for Rui Hachimura to take the next step as a scorer and for Deni Avdija to show his skills with the ball.
"If it is, it's because the media led people to believe that players aren't shit unless they get rings, and fans followed. So now, surprise surprise, you can't just be a good or great player.  I'm a Wizards fan (your condolences, I'm sure) and it's nonstop ""Beal should leave! We should trade Beal!"" meanwhile the guy has gotten better and better every year and is adamant about staying in DC and building the team and making it better.    And all you get is people clamoring for him to leave, clamoring for the Wizards to trade him from outside or inside, and even beating their chest about how they wanted to trade the franchise's best player years ago.  Media pushed this narrative and fans have swallowed it hook, line and sinker.    So what do players want to do? Go to a team and win a title, because all fans are doing is pushing their team's best players out the door for some unknown future with 'draft picks' and capital.    Like the Wizards have a budding young star, Beal in his prime, a talented point guard coming from a contender in DinWiddie, and other pieces in Kuzma, Trezz &amp; last year's #9 pick Deni Avdija, and you see Wizards fans pointing to like the damn Orlando Magic and OKC as teams that are in a better position.    Fans did this shit.  Media started it, fans gobbled it up, and here we are. Fans would rather have a trash roster and win 3 games because then they'll get a high draft pick who they then think maybe can find a way to sit out again and tank some more, and waste another year, and get another high pick.  It's the dumbest shit ever. That's the real joke."
[Highlight] Deni Avdija with the dagger to eliminate the 1st seed Nets in the first round
Deni Avdija baby! Given we make up .2% of the world population I think we actually are adequately represented in the NBA
"This season Marcus Smart is averaging 7 3PA a game and is making them at....(wait for it..) 23.5%  Why in gods name is Smart taking so many threes. Also if Tatum is awful the Celtics suck.   This game was a difference in depth. Tatum and Beal were both trash but the Wiz have too much depth. JB was also really bad this game.   The Celtics last guy on the rotation is a washed Jabari Parker, Grant Williams, Josh Richardson compared to the Wiz who are running the rookie Corey Kispert who actually looks really solid so far on both ends of the court, Deni Avdija who also plays solid D and can ball handle, Aaron Holiday who is looking like a steal of a pick-up for PG depth and Bertans who is still capable of being a good NBA player even though he's been pretty bad at doing what he's paid to do which is shoot the ball. Juancho needs to work his way into the rotation for Boston, he's a solid player."
I thought Josh Giddey would just be a Deni Avdija. Oops. Could be a legit star
"contending teams no, lottery teams yes. The wizards with deni avdija come to mind."
"I don't know if you know this, but Deni Avdija and Daniel Gafford have been seen as the greatest duo in NBA history by those of us smart enough to see it"
Same thing is happening to Deni Avdija in Washington
Deni avdija too right?
"Gafford and Avdija should provide some good defense. And Gafford is better than Harrell offensively imo.   But yeah, even with positive defensive contributors (Gaff, Deni, KCP, Kuz, Rui), defense will still be a major issue for us. Hopefully a defensive minded coach in Wes Unseld Jr can help turn things around. Lord knows Scott Brooks wasn't helping one bit in improving the defense"
Deni Avdija -- his team just got Kuzma
"Yes, Deni Avdija. Grabbed his coffee and told me have a nice day—Sweetheart."
"It’s unbelievable, but this happens every year. I remember Deni Avdija (nothing against the guy) had a good preseason debut last year, and all of the comments were calling him the ROTY and lamenting how stupid everyone was for not taking him in the top 5"
"Maybe 12 of us.  But since you asked, here goes  While Russ did do a drag job last season, him and Beal alone with basically no depth can’t get us past the first round.  Especially not from the play-in.  So we got out of Russ contract and got KCP, Kuz, and Trez back.  Plus with other moves In this same deal, we turned the 22nd pick and a 2024 second round pick into Aaron Holiday and Dinwiddie.  Which is a solid haul for one getting out of that contract which made no sense for our team right now, and getting some young talent or trade filler later depending how this coming season goes.   So if we boil that down, we got out of the Wall contract from 2 years ago, and turned it into what I list.  We fired Scott Brooks and hired Wes Unseld Jr.  Who is a great young first time coach ready to get to work.  Had a pretty decent draft and We are getting Thomas Bryant and Deni Avdija back from injury plus re-signed Raul Neto.  We still have Beals decision hanging out there but something will happen with that soon.   So yea I’d say the Wizards got better this off season."
| |Starters|Reserves| |:-:|:-|:-| |**C**|Daniel Gafford|Montrezl Harrell| |**F**|Davis Bertans|Kyle Kuzma| |**F**|Rui Hachimura|Deni Avdija| |**G**|Bradley Beal|Kentavious Caldwell-Pope| |**G**|Spencer Dinwiddie|Raul Neto|
Deni avdija on the wizards
"I think Deni Avdija has the potential to be top 5. The Westbrook trade will help him, Brooks completely misused him last season. His potential is super high"
"I'm kind of invested in Deni Avdija because he's the only Jewish player in the NBA, to my knowledge. I hope he succeeds."
Frank-Dennis Smith  Knox-Mikal Bridges  RJ-De'Andre Hunter  Obi-Deni Avdija  Wash on 2017. Both guys underpreform as Knicks  Bridges&gt;&gt;Knox RJ&gt;Hunter Obi&gt;Deni  So about the same.
"Israel: Omri Casspi, Gal Mekel, Gal Gadot, Deni Avdija  Palestine: ??????"
"I just gotta say, Deni Avdija is one handsome dude"
"Deni avdija does it alot. He lets the offensive player run into  supposedly ""open lane"" only to meet his body at the end of the run, when it's already too late, forcing the opponent to either pass out or take a bad fade way. It's a pretty neat technique, kinda like the defensive version of a pump fake"
One of the statistically best individual defenders in the League.  Deni Avdija
Deni Avdija
"I think Draymond is amazing and does a lot that doesn't show up in either the stat sheet or the advanced stat sheet. When he's motivated, he does such a great job covering for all his teammates, it's insane.  To supplement this, I looked at players with at least 100 DFGA. That comes out to approx. 5 shots defended per game in the 17-19 games so far this season.  https://www.nba.com/stats/players/defense-dash-overall/?Season=2021-22&amp;SeasonType=Regular%20Season&amp;PerMode=Totals&amp;sort=PCT_PLUSMINUS&amp;dir=1&amp;CF=D_FGA*GE*100  Rudy's also been amazing, if I may say so myself. He's defended the most shots so far this season, with 330 DFGA and holding opponents to 38.2%, with an expected FG% of 46.2%, an 8% difference. You have to go all the way down to Deni Avdija's 203 DFGA to find a player who has a bigger absolute margin (35.0% - 43.8% = 8.8%). Draymond's at 180 shots defended with (40.6% - 45.3% = -4.8%, rounding presumably).  (Bold: Outliers, Italics: OP mentioned)  Other effective players include:  * **Rudy Gobert: 330 shots defended, DFG% - FG% = -8%** * Mo Bamba: 300 DFGA, -5.4% * Myles Turner: 280 DFGA, -4.3% * John Collins: 279 DFGA, -5.2% * *Giannis Antetokounmpo: 249 DFGA, -2.2%* * Jaren Jackson Jr.: 222 DFGA, -6.0% * *Paul George: 220 DFGA, -0.4%* * Kevin Durant: 212 DFGA, -3.9% * Devin Booker: 208 DFGA, -3.4% * Isaiah Stewart: 204 DFGA, -5.5% * **Deni Avdija**: 203 DFGA, -8.8% * *Deandre Ayton: 198 DFGA, -0.5%* * Bobby Portis: 194 DFGA, -5.9% * Luguentz Dort: 192 DFGA, -4.4% * LaMelo Ball: 190 DFGA, -6.3% * Davion Mitchell: 188 DFGA, -6.4% * Isaiah Hartenstein: 184 DFGA, -6.5% * *Draymond Green: 180 DFGA, -4.8%* * Bam Adebayo: 176 DFGA, -8.6% * **Derrick Rose**: 146 DFGA, -12.8%, with a DFG% of 30.8%! * Joel Embiid: 146 DFGA, -6.8% * Luke Kennard: 138 DFGA, -7.6% * **Patrick Beverley**: 122 DFGA, -11.9% * **Matisse Thybulle**: 114 DFGA, -11.3% * **Eric Gordon**: 115 DFGA, -10.5% * Austin Reaves: 106 DFGA, -7.6%  More players if the DFGA threshold is lowered to 75 include Mike Muscala (-14.8%!), Taj Gibson, DeAndre' Bembry, Tony Bradley, Jaxson Hayes, Landry Shamet(?), ...  Ineffective players include:  * **Kyle Lowry: 216 DFGA, +8.8%** (wtf) * **Dejounte Murray: 205 DFGA, +8.3%** (he was in the conversation of all-D) * Kemba Walker: 188 DFGA, +6.9% * Ja Morant: 179 DFGA, +7.1% * Luka Doncic: 178 DFGA, +6.1% * Darius Garland: 170 DFGA, +7.5% * Saddiq Bey: 159 DFGA, +7.4% * Cade Cunningham: 153 DFGA, +6.2% * **Bojan Bogdanovic**: 148 DFGA, +10.1% (ugh this lines up with the eye test) * Kyle Anderson: 135 DFGA, +11.2% * Donovan Mitchell: 129 DFGA, +8.7% (this one too) * Cody Zeller: 104 DFGA, +12.0% * Facundo Campazzo: 100 DFGA, +11.2%  A lot more players pop up if the DFGA threshold is lowered to 75, including Xavier Tillman, Gary Harris, Chuma Okeke, Kira Lewis Jr., Chimezie Metu, ...   Disclaimer: DFG% can be unfair, especially if you're a player who's always asked to defend the opposing team's best player. Royce O'Neale gets screwed by the difficulty of his defensive assignments, so I find it really impressive his DFG% difference is -0.6%, despite getting put on everyone from KD to DeRozan to Booker to Tatum to Ja."
Weird way to spell Deni Avdija
"Deni ""Off Day"" Avdija just sounds better in my unbiased opinion"
"Deni Avdija. I don’t think he will ever be a super star, but he will be a really good player who everyone in the league would love to have.   Granted, he is also still only 20. So a leap on offense isn’t out of the question, and that would put him at all star level"
"Deni Avdija allows 0.54 points per isolation possession. It's the best result in the league by wide gap among all players which defended  at least 20 iso possessions (2nd place allows 0.68 pts). And he almost always defends the best scorer of the other team on the floor e.g guys like KD, Harden, Giannis, Butler, when needed he also defends against bigs like JJJ or Bam Adebayo, and also against guards like VanVleet or Rozier... (look https://www.nba.com/stats/players/isolation/?SeasonType=Regular%20Season&amp;TypeGrouping=defensive&amp;sort=PPP&amp;dir=-1&amp;PerMode=Totals&amp;CF=POSS\*G\*25)  He also was 6th in DFG% among all players with at least 100 DFGA at 36.9% before the last game... and in the last game against Charlotte opponents were something like  1 FG on 13 FGA with 2 blocks so now his DFG% is even better (look https://www.nba.com/stats/players/defense-dash-overall/?CF=D\_FGA\*G\*100&amp;Season=2021-22&amp;SeasonType=Regular%20Season&amp;PerMode=Totals&amp;sort=D\_FG\_PCT&amp;dir=-1)  He also ranks 9th (and 27th overall) in the Defensive RAPTOR  metric (look https://projects.fivethirtyeight.com/nba-player-ratings/ )   And also 11th in   ( look [https://www.basketball-reference.com/leagues/NBA\_2022\_advanced.html#advanced\_stats::dbpm](https://www.basketball-reference.com/leagues/NBA_2022_advanced.html#advanced_stats::dbpm))  So if Wizards continue to be play-off team and his minutes continue to go up (more about it in a minute) he can be seriously considered for maybe... 2nd all-NBA defensive team  &amp;#x200B;  Now. The other fact people forget is that he was back from rather significant injury just before start of the season (started ramp-up full activity only in pre-season camp and even missed first pre-season game)  So in October his production was 4.7 pts (44.8 TS%) , 5.3 reb, 1.2 ast - 20.0 minutes  per game  And in November it is 6.9pts (57.3 TS%) , 5.7 reb, 1.5 ast  - 22.8 minutes  per game  Still not great but I think that it's clearly positive tendency"
"Obi Toppin, Deni Avdija, Isaac Okoro, Killian Hayes"
Deni Avdija catching strays!
Deni Avdija. His defense is elite and his offense is coming along.
"I don't really watch the Wizards much since they aren't on national TV. Would there be interest in Jerami Grant and if so, what would you guys give? Like theoretically would something like Thomas Bryant, Deni Avdija, and a protected first work in your mind? Not sure that works with the cap."
Deni Avdija.
"Any wizards fan would tell you either rui hachimura, who has been playing outstandingly in his first 2 years, and we can’t wait to get him back, or deni avdija, who is emerging as a crazy good defender for us"
"Deni Avdija…no path required, he already is **The Denitentiary**  Just add **GOAT** to his name."
Deni Avdija has just received the nickname “The Denitentiary” for his lockdown defense and I am **all for it**  Something more obscure though that I’ve seen is Mount Gillimanjaro for Anthony Gill lol
Ranked by Best Names  1.	Bones Hyland 2.	Talen Horton-Tucker 3.	James Bouknight 4.	Tyrese Haliburton 5.	Darius Bazley 6.	Jaxson Hayes 7.	Tyrese Maxey 8.	Deni Avdija 9.	Kevin Porter Jr 10. Coby White 11. RJ Barrett 12. Cole Anthony
  **Wizards @ Hornets**  [](/WAS) **87 -  97** [](/CHA)  **Box Scores: [NBA](http://www.nba.com/games/20211117/WASCHA#/boxscore) &amp; [Yahoo](http://sports.yahoo.com/nba/washington-wizards-charlotte-hornets-2021111730)**  |**Team**|**Q1**|**Q2**|**Q3**|**Q4**|**Total**| |:---|:--|:--|:--|:--|:--| |Washington Wizards|29|22|14|22|87| |Charlotte Hornets|24|21|30|22|97|  **TEAM STATS**  |**Team**|**PTS**|**FG**|**FG%**|**3P**|**3P%**|**FT**|**FT%**|**OREB**|**TREB**|**AST**|**PF**|**STL**|**TO**|**BLK**| |:--|:--|:--|:--|:--|:--|:--|:--|:--|:--|:--|:--|:--|:--|:--| |Washington Wizards|87|33-90|36.7%|8-42|19.0%|13-16|81.2%|11|48|23|12|7|10|5| |Charlotte Hornets|97|42-96|43.8%|10-32|31.2%|3-6|50.0%|16|59|30|16|6|11|8|  **TEAM LEADERS**  |**Team**|**Points**|**Rebounds**|**Assists**| |:--|:--|:--|:--| |Washington Wizards|**24** Bradley Beal|**11** Deni Avdija|**7** Bradley Beal| |Charlotte Hornets|**19** Terry Rozier|**13** Mason Plumlee|**14** LaMelo Ball|
"I'm not sure if you are sarcastic or not, but I'll answer seriously - Deni Avdija is one of the best defenders in the league right now. Certainly top 5.  His team is absolutely CRUSHING when he is on court. Have they even lost when he was on court? Can someone check that?"
Deni Avdija has been better for the Wizards this year than Rui Hachimiura has ever been.
Deni “The X Man” Avdija aka The Denitentiary
Deni Avdija
Apparently Deni Avdija's defense is the key to our season sooooo I pick specifically Deni Avdija
Take a shot every time Deni Avdija leads the Wizards in +/-
Deni Avdija watches no Netflix and only two minutes of game film a day /s
Deni is typically defending against the best wing or forward of the opposite team.  While doing so according to nba.com his  DFG% is 32.6% which is 2nd best in the league among all players with DFGA &gt; 100  Also per ISO possession Avdija allow just 0.5 pts which is the best in the league (and by large difference best) among all players with over 20 defensive ISO possessions  No one knows whether he's able to continue with this level of defense but right now it is more or less definition of incredible
