"guess we have a different understanding of a word *incredible*, that's it.          I wouldn't argue Jrue Holiday is an incredible defender, but Deni Avdija being called *incredible* defender is (in my opinion) a reactionary take partly caused by those recent comments from Unseld Jr. about his defense."
PUT SOME FUCKIN RESPECT ON DENI AVDIJA. HALF THESE MUTHAFUCKAS THAT COVER THE LEAGUE AS THEIR FUCKIN JOB CANT EVEN SAY HIS NAME PROPERLY
  **Pelicans @ Wizards**  [](/NOP) **100 -  105** [](/WAS)  **Box Scores: [NBA](http://www.nba.com/games/20211115/NOPWAS#/boxscore) &amp; [Yahoo](http://sports.yahoo.com/nba/new-orleans-pelicans-washington-wizards-2021111527)**  |**Team**|**Q1**|**Q2**|**Q3**|**Q4**|**Total**| |:---|:--|:--|:--|:--|:--| |New Orleans Pelicans|25|33|22|20|100| |Washington Wizards|25|16|32|32|105|  **TEAM STATS**  |**Team**|**PTS**|**FG**|**FG%**|**3P**|**3P%**|**FT**|**FT%**|**OREB**|**TREB**|**AST**|**PF**|**STL**|**TO**|**BLK**| |:--|:--|:--|:--|:--|:--|:--|:--|:--|:--|:--|:--|:--|:--|:--| |New Orleans Pelicans|100|30-74|40.5%|11-21|52.4%|29-34|85.3%|7|45|20|25|2|12|3| |Washington Wizards|105|39-84|46.4%|10-28|35.7%|17-25|68.0%|6|42|23|22|9|5|4|  **TEAM LEADERS**  |**Team**|**Points**|**Rebounds**|**Assists**| |:--|:--|:--|:--| |New Orleans Pelicans|**31** Brandon Ingram|**12** Josh Hart|**5** Josh Hart| |Washington Wizards|**27** Spencer Dinwiddie|**10** Deni Avdija|**9** Spencer Dinwiddie|
BI got introduced to Deni Avdija who is currently one of the league leaders in defensive rating.
Deni Avdija
Deni Avdija is a menace… +18 wow
"Russ was doing too much, but let's go over what he was working with outside of Beal:  Bryant: played 10 games  Rui: credited Russ with improving, literally your third best player as a second year player that isn't playing at all this year  Bertans: injured and played awful, was meant to be one of your key pieces  Deni Avdija: was one of your better players even though he didn't get much playing time. This is sad, he was a rookie that mostly brought defensive help.  Ish Smith: Ish is a solid backup PG, isn't meant to be more.  Alex Len: god awful  Robin Lopez: He's washed at this stage  Garrison Matthews: Started 24 games, played in 64, and is now in the G-league.   Gafford came in late into the year and they were winning.   Covid and injuries were not the cherry on top, your team was garbage.  https://www.basketball-reference.com/teams/WAS/2021.html  You can go through your own team and tell me how I'm wrong.  Outside of Beal you guys basically have none of your core players from last year and the majority of your core players from last year sucked. You replaced Russ with quality depth, adding in 3 new players, Gafford became a starter, you signed Dinwiddie, and Bertans isn't expected to be one of your best players anymore opposed to a damn 10th man even though he's being paid 17 million.  Russ and beal both played hero ball as your team was trash, quite literally.  Lakers this year, without Lebron, are again not really the best team because we went in on 3 guys and old players and the inconsistency to start the season is massive. Russ isn't a superstar anymore, but the problems go far deeper than him."
"1. They are playing great defense. No it’s not other teams just missing shots. They are defending the perimeter tightly and rotating to prevent paint points.  2. They are moving the ball/themselves and making the right play on offense. It’s not the Brad Beal/Russell Westbrook iso show anymore. Kuz, Gafford, KCP and of course Beal are hitting daggers late in games.  3. The bench mob is the best in the NBA. 6 man of the year (sorry Tyler Hero) Trez Harrell, Raul Neto and the Deni Avdija come in and pound other teams’ benches into oblivion."
"Trezz playing like an All-Star, Deni Avdija has developed into an elite defender, Kuz and Dinwiddie making buckets on consistent basis, Beal have a high evel supporting cast."
1. Ja Morant 2. Zion Williamson 3. Evan Mobley 4. Lamelo Ball 5. Anthony Edwards 6. Scottie Barnes 7. Cade Cunningham 8. RJ Barrett 9. Jalen Green 10. Darius Garland 11. Tyler Herro 12. DeAndre Hunter 13. Jalen Suggs 14. Tyrese Maxey 15. Josh Giddey 16. James Wiseman 17. Patrick Williams 18. Cole Anthony 19. Franz Wagner 20. Jordan Poole 21. Jonathan Kuminga 22. Cam Reddish 23. Alperen Sengun 24. Matisse Thybulle 25. Tyrese Haliburton 26. Rui Hachimura 27. Chris Duarte 28. Deni Avdija 29. Immanuel Quickley 30. Davion Mitchell  Kevin Porter Jr. has to be one of the most overrated assets in the entire league.
Deni Avdija all defense
I like Deni Avdija
"Honestly too much to even fit in one post. Kuzma is really shining as a 3rd scoring option behind Beal and Dinwiddie, hell one could even argue he could be the 2nd scoring option. His defense is shining. We'll see if Bertans wakes up anytime soon and starts making 3s again, although I feel like we've seen some improvements with his off ball movement  So much development to keep track of too with a lot of young players to be excited about. Daniel Gaffords only 23, and when he got traded from the Bulls last season, that's when the Wizards defense really started honing in on a defensive presence in the paint. He plays super hard every minute too. Deni Avdija has been a huge surprise defensively as well, almost becoming our go to defender that can guard positions 1-5. He still has some work on the offensive side but I'm sure it'll come eventually, given his record in Tel Aviv.    And we still have Rui Hachimura who was also amazing last season on the defensive end, runs hard to finish at the rim, and developing a deadly mid-range game that can buy a bucket when we need it.   All of this new defense really opens it up for Thomas Bryant to bring his return too. A big knock on him has always been his defense, but if you have quality defenders in the 3 and 4 positions, and a long and tall Spencer Dinwiddie at PG, they can cover his gaps while he shoots from downtown and brings back his passion to the team.  Honestly there's just so much to be excited about with them this season."
Deni Avdija checking in
https://youtu.be/SPaqpkyKFH0 Deni Avdija Highlights
"Ricky Rubio, Deni Avdija, Bradley Beal, Kuzma, Raul Neto, and Kevin Love? Nah this gotta be the cutest game of all time."
"In his defense it’s hard to be good on defense flanked by Deni avdija, rui hachimura, and Westbrook"
Deni avdija
Deni Avdija is an elite defender and yall cant convince me otherwise
"Deni ""All Defense"" Avdija is here"
Deni Avdija might be the best defender of all time. No I do not need to explain.
Deni “Draymond Green” Avdija
Deni Avdija is turning into a fantastic defender
clearly someone needs to save Jayson from this.   The wizards will offer the celtics bertans and deni avdija... who says no?  can't believe anyone would try to stop Tatum from coming to the wizards... he's desperate to join his best friend in DC
"No Avdija?  Agree with the first four but would probably protect Deni over Kuzma.  We’d def lose some guys with all the former Lakers (KCP, Harrell, Bryant and Kuzma) exposed."
"Like the Heat and Knicks the best out of that group, and like the Wizards the least. I'd like the Wizards more if they played Deni Avdija more, why he isn't getting more of Kuzma/Bertans minutes is beyond me."
