"You do know we havent had a full squsd until like this week right?  Im concerned but I wouldnt cross off last season as a fluke based on like 8 games we had everyone actually play. If they are still bad by mid Feb, thags when I will freak out.  We were playing Gabe Vincent and Okpala till last week week lol."
"Gabe ""Steph Curry"" Vincent"
And having to play fucking gabe vincent
Looks like Gabe Vincent was limping off the court too.
Gabe Vincent
gabe Vincent looking like a smol Jarrett Allen
"More K-Nunn, less Gabe Vincent please.  He’s earned those minutes back"
Reading is that hard ? IT DEPENDS IF THEY CAN BACK THEIR WHOLE TEAM BACK QUICKLY ENOUGH.  Yeah if your team continue to have to play Gabe Vincent you could be in the play in
"I really like Gabe Vincent and Precious on the Heat, and that Strus kid's a shooter I wouldn't have noticed otherwise."
"No, but currently they are running Gabe Vincent at PG lmao. If it's Dragic, they stay put."
The amount of players Heat fans claim played these games decreases every day. Pretty soon I'm gonna hear you saying it was just Gabe Vincent vs. a healthy sixers team
"I don’t know, aside from Maxey being good, I’m having fun watching my team get crushed but having players like Herro, Duncan, and random third stringers like Gabe Vincent just get to do whatever for 35 minutes."
You clearly didn’t see Shake lock down Gabe Vincent last night
  **Heat @ 76ers**  [](/MIA) **108 -  125** [](/PHI)  **Box Scores: [NBA](http://www.nba.com/games/20210114/MIAPHI#/boxscore) &amp; [Yahoo](http://sports.yahoo.com/nba/miami-heat-philadelphia-76ers-2021011420)**  |**Team**|**Q1**|**Q2**|**Q3**|**Q4**|**Total**| |:---|:--|:--|:--|:--|:--| |Miami Heat|30|28|20|30|108| |Philadelphia 76ers|38|35|25|27|125|  **TEAM STATS**  |**Team**|**PTS**|**FG**|**FG%**|**3P**|**3P%**|**FT**|**FT%**|**OREB**|**TREB**|**AST**|**PF**|**STL**|**TO**|**BLK**| |:--|:--|:--|:--|:--|:--|:--|:--|:--|:--|:--|:--|:--|:--|:--| |Miami Heat|108|40-81|49.4%|12-34|35.3%|16-26|61.5%|9|41|28|19|4|20|1| |Philadelphia 76ers|125|44-82|53.7%|17-37|45.9%|20-24|83.3%|5|35|27|22|15|18|3|  **TEAM LEADERS**  |**Team**|**Points**|**Rebounds**|**Assists**| |:--|:--|:--|:--| |Miami Heat|**22** Duncan Robinson|**11** Precious Achiuwa|**8** Gabe Vincent| |Philadelphia 76ers|**31** Shake Milton|**10** Ben Simmons|**12** Ben Simmons|
Wait so you’re telling me that Gabe Vincent doesn’t normally start for the Heat?
Gabe Vincent man. How do the heat keep pulling guys out of nowhere and making them good.
Who the hell is gabe vincent and how the hell is he averaging 16 ppg
gabe vincent night?
Yes Gabe Vincent and Tyler Herro who are both half a foot shorter than him created an impenetrable wall
"Idk man. It's just not. Why mention per 36? We're literally talking about one game. 5 points and 2 steals. In 32 minutes. Right up there with defensive stalwarts gabe Vincent, Kelly olynyk and Danny green"
In fairness Gabe Vincent is prime Ray Allen
Tbf gabe Vincent versus Isaiah Joe is a fucking delight
Gabe Vincent probably just took all of Nunn's minutes for the year
Gabe ‘Ray Allen’ Vincent
We played gabe Vincent 30
"If you don't like Dakota Mathias vs. Gabe Vincent, you hate competitive basketball. GG - hopefully we both can get a few more guys cleared next game Thursday."
"The Miami Heat have added these players to the OUT/Health and Safety Protocols list, following the completion of contact tracing:  Jimmy Butler  Goran Dragic  Kendrick Nunn  Bam Adebayo  Moe Harkless  Udonis Haslem  KZ Okpala  This is in addition to Avery Bradley, on the list Sunday.  ADDITIONALLY: Meyers Leonard (shoulder) is questionable, Kelly Olynyk (groin) is probable and Gabe Vincent (knee) is probable."
"This is a gross oversimplification of Bam's defense lol. Dude guards all 5 positions every night, switching every pick and roll, covering for defensive mistakes made by putrid defenders like Olynyk, Duncan, Herro, Dragic, etc. He regularly bottles up perimeter stars into passing away from that matchup. Numbers don't equate for this shit lol.   Bam is a top 5 defender in the NBA. Miami has a top 5-6 defense with 3 positive defenders on it and 10 horrendous ones on it. Like, worst in the league bad. Orlando has a below average defense. 18th in drtg and 22nd in field goal % against. There is a grand canyon gap between Bam's defense and Vucevic's. The gap between them defensively is probably 5x the difference between them offensively.   Bam is close to Gobert defensively, if not certainly more useful come playoff time. Utah somehow has a worse defensive field goal % against than we do despite the fact that Duncan Robinson, Tyler Herro, Goran Dragic, Kelly Olynyk, Gabe Vincent, Max Strus are arguably bottom 20 defensive players of anyone getting minutes in the NBA."
All stars Gabe Vincent and Max Strus just had an off night.
Miami was missing this guy for 9 straight games forced to play absolute fucking dogshit bums like Gabe Vincent heavy minutes.
"When Herro comes back and the Heat don't have to give Gabe Vincent or KZ Okpala extensive minutes, the Heat are going ro be scary."
"For some reason I always think KZ Okpala should be like 6'2"" and Gabe Vincent should be like 6'9"". I don't know why, just something about their names"
"Gabe fuckin Vincent adult man, how are things down at the ole dunk factory?   Good... I did a midrange"
Gabe Fuckin Vincent Adult
Shoutout to Gabe Vincent also. Needs to get those fouls under control but 11 points in as many minutes was very good offensive production
Just wait until we are playing Herro or Avery Bradley rather than Gabe fuckin Vincent
Gabe Vincent looking like Lionel Richie at the YMCA pick up games
It is kinda devastating because that’s the Heats entire guard depth forcing them to play 2-way contract guys like Strus and Gabe Vincent. Have you ever even heard of those dudes?
"Really went 0-7 while the commentators kept on saying ""shooters shoot"". I honestly just can't believe that Gabe Vincent and fucking Max Strus are two guys in our rotation this season"
I can’t believe Gabe Vincent managed to convince a teammate to vote for him
"Yeah true, I deleted my initial comment because it wasn't accurate and I realised that. I was just trying to make a point that Harden also needs talent around him, which is why I threw KD in the list and I wasn't only referring to Russ in OKC. And in this Heat scenario I know that talent includes Butler and Bam but I really think you need to have more than that.  As inconsistent as they are playing right now you are essentially trading half of your finals run team for one player. Go look at what Houston wanted, it's pretty much the whole Bench. Herro, Duncan, Achiwua, Nunn and salary filler which would've been Leonard but he's gone for the whole year. 2 first round picks and 4 pick swaps.   I get that Harden plays well with role players but the fact that you are sending ALL of the roleplayers plus more for him leaves you with literal G Leaguers. Gabe Vincent and KZ okapala ain't gonna cut even if you have Harden.   Besides, Miami have a fuck tonne of problems other than scoring right now that get worse with that trade."
Gabe Vincent just isn't the all star he was in the bubble. What a letdown.
Idiots don’t realize that the heat would have easily traded herro for harden it was the fact rockets the whole damn team since the heat didn’t have picks. You would have 40 year old haslem playing back up center and g league gabe Vincent off your bench
"Yeah, remember Gabe Vincent and Max Strus in the bubble? They were all stars in the bubble."
"Bam is 58x the defender Sabonis is while being comparable offensively lol. I mean Bam somehow anchored a top 16 defense while Jimmy and AB were out while we played Herro, Dragic, Duncan, Kelly, Nunn, Precious, Gabe Vincent, and Max Strus. These are all negative as FUCK defenders."
Damn no Gabe Vincent
"I heard of Gabe Vincent 10 minutes before the Sixers played the Heat, so if that counts, him"
"I think you mean Gabe Vincent, Nunn is alright."
"For real. In a game against the sixers this season the heat started herro, ollynyk, precious, gabe Vincent, and Duncan Robinson. They all played for close to 40 minutes each. Oh, and how can I forget about six man of the year, max strus. He really carried our offense this season. Can’t imagine how hard it must be for kyrie and James harden."
Kelly Olynyk and Gabe Vincent is the best i can do for Harden  Who says no?
I’m a big fan of everybody on my team... most the time. But sometimes Gabe Vincent drives me fucking crazy.
Gabe Vincent
"&gt; PLEASE NO MORE GABE VINCENT, PLEASE SPO  Oh don't worry. When Oladipo comes Gabe will never play a single minutes again"
"If you hate good NBA offense - watch this. That final 4th Q stretch was brick after brick after brick. It was stuck at 87-82 for the longest time. After Sabonis' dorky ass celebration on the over-turned challenge call they didn't score for like 3 minutes straight.  * We played like dogshit for most of the 1st half, went down 58-43 in the 3rd, and somehow won * Duncan had a phenomenal game tonight * Precious is officially getting on my nerves. I know he's a rookie, but goddamn * PLEASE NO MORE GABE VINCENT, PLEASE SPO * Bally sports... FIX YOUR GODDAMN FONT FOR THE SHOT CLOCK AND QUARTER TIME  But forreal - good ass win vs Indy. 'specially after they swept the last back-to-back against us."
Beal type? They should trade us Korkmaz for Gabe Vincent.
Is that the play that ended with a Gabe Vincent tip in?
"that steal by Gabe Vincent after the Noel block on Iguodala was the back breaker for us tbh, we were about to make a comeback down 8 (and about to be 6 or less) and then they got a few offensive rebounds (all game) and got a tip-in from Vincent after a missed shot"
olynyk would be replaced by meyers bc salary filler but yeah it would have been harden-bradley-jimmy-bam-meyers with dragic-gabe vincent-kz okpala-chris silva + buyouts off the bench  i think pat riley underestimated the free agency pull of ring chasing as well as harden's superhuman ability to carry teams but i understand why he didn't do it at the time
That's just because our point differential is still recovering from our 47 point loss to the bucks and all the big losses from when our whole team had covid and Duncan Robinson and Gabe Vincent were our #1 and #2 options. It was a dark time to be a heat fan.
"This is where I’m at. The only team that scares me is the Nets and that’s only if they have KD balling out. You get rid of Duncan and Herro, the perimeter shooting disappears. Shots that would have gone to them now go to...Strus and Gabe Vincent? Fuck that. I’d rather roll with the team we have now and take our chances in the most random season of my lifetime."
Gabe Vincent has definitely been terrible against every team not named Philadelphia. But at least he is a two way player.
"Max strus played well enough for people to readily add Drob to trades for a couple weeks. And Gabe Vincent has had games where you realize why he gets minutes, and then games where you realize there’s a reason why he’s only a 2 way player."
"They've had a lot of injuries/Covid issues.   I think at one point, they played the Sixers twice in a row starting guys like Max Strus and Gabe Vincent."
12-5 in games since Jimmy came back from weeks of being out due to Covid plus a revolving door of our important players out due to health and safety protocols. The team isn’t bad; they just aren’t playing. Just look at the amount of minutes Gabe Vincent has played. That’s not ok.
That’s probably the contingent that’s pissed at Jimmy for leaving. It is what it is. I got nothing against the Heat beyond friendly rivalry. And I won’t judge that roster based on games where Gabe Vincent had to play like 28 minutes.
"&gt; TF they were thinking playing no name ass dudes heavy minutes like Gabe Vincent and Max Strauss. Where these dudes came from??!? You won't win in playoffs playing them boys 15 minutes a night.  To be fair, Duncan Robinson and Kendrick Nunn came out from absolutely nowhere and have been great for us the past two seasons. Heat are great at finding undiscovered gems.  That said, Vincent and Strauss haven't shown themselves to be in that class. But the Heat are good at finding ""no name ass dudes"" to ball out."
"Now this is the Heat at their best, a true playoff rotation with proven veterans like Iguodala and Dedmon. Idk what TF they were thinking playing no name ass dudes heavy minutes like Gabe Vincent and Max Strauss. Where these dudes came from??!? You won't win in playoffs playing them boys 15 minutes a night."
"They didn't start that way, but in the later half of the season it's been Precious Achiuwa and Gabe Vincent.  Since we acquired Bjelica he's played like 3 games then disappeared, doesn't even get garbage time."
"Goran Dragic and Gabe Vincent, but that's my final offer. 👀"
AND Gabe Vincent (who already plays for y’all). That’s more than a third of our roster. 😂
"I posted this elsewhere here, but here are your lowest 20 per 36 Marvel Point accumulators (min 500 MP).   |Player|MHP per 36| :--|--:| |Wesley Matthews|8.5| |Rodney Hood|8.5| |Isaac Okoro|9.6| |Gary Clark|9.6| |Chasson Randle|9.7| |P.J. Tucker|9.9| |Solomon Hill|9.9| |Avery Bradley|10.0| |Sekou Doumbouya|10.1| |Gabe Vincent|10.1| |Maurice Harkless|10.3| |Mike Scott|10.7| |Gary Harris|10.9| |Semi Ojeleye|11.2| |Timothé Luwawu-Cabarrot|11.2| |Grant Williams|11.3| |Tyler Johnson|11.3| |Austin Rivers|11.5| |Ben McLemore|11.7| |Damyean Dotson|11.7|"
"If one more Heat fan held the disdain I have for Gabe Vincent, two of us could’ve made him the most hated alone. I don’t think anybody does though."
Gabe Vincent anyone?
Cool? There's a strong chance we dont make the playoffs considering Harden/Butler/Bam/Dragic have together missed most of the season. We'd be relying on Gabe Vincent to carry the load and he's been injured often too. I don't even think we'd roster a team half the time
Ummmm.... Yes. Gabe Vincent was somehow worse though.
Gabe Vincent had more fouls than minutes
"Gabe Vincent would've if he wasn't pulled in 3 minutes for being a complete disaster. Us getting in the bonus with like 10:00 left in the 4th quarter, in large part because of Vincent, was pretty much the key to winning this game."
The Heat have a good squad. They won 40 games playing half the season with guys like Gabe Vincent and Okpala soaking up heavy minutes. They just have very obvious flaws that can be exploited by the right team: the Bucks are just bigger than them. How many teams have a seven footer guarding wings and another seven footer guarding the paint? This was their Kryptonite.
You know it's bad when Gabe Vincent gets some burn
"Jimmy about to demand another trade, and will take KZ Okpala and Gabe Vincent in a 3 v 5 against the starters"
Gabe Vincent LMFAOOO
Marv called Middleton Gabe Vincent.
"I mean, that's kinda over-looking the small detail that EVERYBODY on the Heat was out while Jimmy was out. So was Dragic. We were playing the likes of Gabe Vincent and Max Strus gigantic minutes. It's harsh to just fault Bam, as I don't think Simmons would have won a lot if Tobias Harris and Seth were also out.   I don't think Bam will ever be a superstar OR capable of leading an offense. But he can be a DPOY-caliber player who can get you 18-20PPG with the right offense. We don't have that offense at the moment."
"No, they didn't. Sources came out with Houston's asking price.  - Herro, Duncan, Precious &amp; Nunn (combined salary: $9,732,122) - Salary Filler ($31,522,798 worth) - Two 1st-Round Picks (miami only has their 2022/2024) - 4 Pick Swaps (legitimately did not have enough picks to swap)  That means mortgaging the future in two ways: the young players **and** the pick economy for 2-and-a-half years of James Harden. Not to mention that Miami's only way to create the filler would've been to trade Olynyk &amp; Iguodala for Harden at the last minute.  But fuck it, because *Oh please...* came so easily to you, here's what the roster makeup would've looked like fresh out of the trade, completely ignoring that we didn't have the picks or the swaps for Houston.  PG: Goran Dragic/Gabe Vincent (2-Way)  SG: James Harden/Max Strus (2-Way)  SF: Jimmy Butler/Trevor Ariza (who was acquired with a 2027 SRP + meyers)  PF: Nemanja Bjelica/KZ Okpala   C: Bam Adebayo/Dewayne Dedmon (f/a signing)  If you think **that** 10-man rotation does any better against the Milwaukee Bucks than the one we've pushed out there twice, you're completely out of your mind. Go Hornets."
"B.  We managed to recover well enough from a really bad start affected by Covid resulting in Gabe Vincent and Max Struss getting major minutes.  Still dropped plenty of winnable games though and could have been in a better matchup situation if we had done better there.  Precious is going to take a while to become properly affective, but that’s fine,  it was going to be difficult to match the absolute fun of last year’s run but I really like the team all the same and am curious to see how the playoffs affect what we do in the offseason."
"Not really. Nigeria’s leading scorer, Gabe Vincent, averages 12 minutes a game in the NBA. Josh Okogie averages 5 ppg in the NBA. Chimezie Metu averages 6 ppg.    Mills and Ingles are legit NBA players, but they’re role players. This whole thread is full of jokes about Keldon Johnson, and he’s better than anybody on either Australia or Nigeria. Team USA played 7 NBA All Stars."
"Just about. Bam, and maybe Duncan on USA. And precious, KZ, and Gabe Vincent on Nigeria. Herro on the select team.   Butler and Dragic are really the two other guys who could have played these olympics if they wanted to."
You forgot Gabe Nnamdi Vincent. Almost half of the list were on the Heat last season and Gabe.
You forgetting about the GOAT Gabe Vincent?
"I mean, they still should have destroyed Nigeria   Gabe Vincent is like a 3rd stringer who lit them up"
"I don't know if Zeller is necessarily the answer, but I also don't know why people would assume NBA All Stars would be necessary to compete internationally if bench players like Patty Mills, Gabe Vincent, and the skeleton of Luis Scola are smoking teams."
"&gt;“[To lose to] some dude Gabe Nnamdi, who goes by Gabe Vincent for the Miami Heat. Or Caleb Agada. Or Nma…however the hell you pronounce his name.  Jesus if a white guy said this it would be a fucking scandal. You really gonna make fun of peoples' names? Like the difficulty of an English speaker in pronouncing your name makes any degree of difference in the quality of their game and whether we should respect them as players?"
"The massive disrespect to the new Heatles Big 3 - KZ, Precious and Gabe Vincent"
"Nah, those are three chuckers. Don’t get me wrong, I’ll take any one of them on the Heat tomorrow, but not team USA. They already got Draymond, Middleton, Grant. Those are like the cavi cones of the 3 and D, not the Good Days or Berzerker though (that’s Kawhi and PG). No need to have Crowder throw up a couple 1/10s to sandwich his one 6/7 game.  Keep in mind that these dudes generally don’t need to defend elite NBA talent, they’ll be guarding Gabe Vincent, god bless his soul, and Euro stars. A streaky shooter is a streaky shooter though, regardless of who they’re playing.  If I had to guess, I would just say it’s a combination of fatigue and apathy. I don’t think replacing the talent makes much of a difference."
KD lost to Gabe Vincent. His tier is sub-olympic.
"&gt; gabe Vincent 6/8 3fg, is that going to happen often?  Maybe not 6/8 but I know he's a shooter."
"Three Nigerian starters in this game -- Precious Achiuwa, KZ Okpala, and Gabe Vincent -- are all Heat bench players"
"\&gt; Most of these guys on the roster were helping their NBA squad try to get into the playoffs a few months ago  Team USA has like 5 guys that average more ppg INDIVIDUALLY than Josh Okogie, KZ Okpala, Gabe Vincent, Ekpe Udoh, Michael Gbinije, Chimezie Metu in the NBA combined. Combined.  Granted smaller roles and less overall playing time, these guys aren't even in the same stratosphere at least yet. They are all bench players / rotational players. I mean Gabe Vincent is averaging 4.8ppg and .38 fg%.  You acting like you're some kind of basketball savant that saw this coming is incredibly disingenuous.  The reality is 7 guys shooting between 50-100% from 3 is highly unlikely (understatement) to be sustained and USA will adjust."
"Gabe vincent - born in modesto Jordan Nwora - born in buffalo Okpala - born in anaheim nwamu - born in LA Udoh - born in oklahoma Agada- born in Canada Okoye - born in North Carolina Iroegbu - born in Sacramento okafor - born in Arkansas Okogie - moved to US at 3, is an American Citizen  Would've been easier just to name the players from Nigeria"
Saint Mary’s High School legend Gabe Vincent
Currently its Gabe Vincent but maybe it changes tomorrow
Gabe **Nnamdi** Vincent
I need a god damn Gabe Michael Vincent!
My boy Gabe Vincent showed up!!
Gabe Vincent is gonna be the new international Patty Mills
"Yup, would rather here than later. But still, gabe Vincent 6/8 3fg, is that going to happen often? And obviously Nigeria is not their only opponent but will it be common for other countries to have these types of sharpshooters?"
Gabe Vincent turned to Steph curry.
Sign Gabe Vincent.
Gabe Vincent needs to be brought out of the G-League. He can shoot the 3!
"dawg still. if you told me our starting lineup was the first team all-nba team next year, I'd believe it. no fucking way we should be getting smoked by Gabe Vincent &amp; Caleb Agada."
Gabe Vincent &gt; KD don’t @ me
Gabe Vincent
Imagine forming a super team just to lose to heat legend Gabe Vincent
We wouldn’t have gotten swept if we played Gabe Vincent
That Nigeria team didn’t have Gabe Vincent
Give credit to Nigeria. They made 20 threes. They was cooking out there especially Agada and gabe Vincent.
Precious Achiuwa and Gabe Vincent for Kevin Durant. Who says no?
Gabe Vincent better than all of them combined tonight
"no shame in losing to the 2022 mvp gabe vincent, the 2022 DPOY kz okpala, and the 2022 MIP and finals MVP precious Achuiwa"
Gabe Vincent
That’s MIAMIS Gabe Vincent sir
Gabe Vincent instantly goated
Ima tell my kids Gabe Vincent is Steph Curry
Kd and draymond gonna fight over recruiting gabe Vincent
Gabe “Steph Curry” Vincent
They also said Gabe Vincent can be a good piece for the Heat. Dude doesn't sniff the floor in playoff rotations.
Gabe Vincent
"Gabe Vincent, KZ Okpala and Precious Achiuwa."
Don't sleep on my boi Gabe Vincent.
"Precious Achiuwa, Miami Heat   KZ Okpala, Miami Heat   Miye Oni, Utah Jazz    Josh Okogie, Minnesota Timberwolves   Jordan Nwora, Milwaukee Bucks   Chimezie Metu, Sacramento Kings   Jahlil Okafor, Detroit Pistons   Gabe Vincent, Miami Heat  Alzo Michael Gbinije and Ekpe Udoh have experience in the NBA."
"NBA players on their roster include:  Precious Achiuwa, Kezie Okpala, Miye Oni, Josh Okogie, Jordan Nwora, Chimezie Metu, Ekpe Udoh, Jahlil Okafor, Gabe Vincent."
"I actually heard the above news from someone I know who’s kinda close to the Nigerian team, but I also saw this on Twitter (see link below) since I wanted to make sure I wasn’t misleading anyone. That’s the official Nigerian Olympic Basketball team Twitter page (you can see it has a lot of info/photos from the training camp).   I was told guys like Gabe Vincent, Precious Achiuwa, and Jahlil Okafor would be some important pieces. Also Ike Diogu is their veteran leader (he’s played overseas a lot but was a former 1st round pick). Also I believe Jordan Nwora (who’s currently with the Bucks) might be able to make the team if he chooses to play after the Finals is over (his dad is associated with the team so my guess is he doesn’t need as many contractual stipulations).   Nigeria’s group is super balanced but I would say a team like Australia which has a core who’s played together a long time is probably better at this point, but we’ll see what happens. I am rooting for Nigeria over Australia.   https://mobile.twitter.com/NigeriaBasket/status/1409722941005258752"
Jimmy Butler  Bam Adebayo  Duncan Robinson  Max Strus  Omer Yurtseven  Gabe Vincent
"I agree with their take on the Heat. It’s not an incredibly big issue (considering Bam, Jimmy, and Lowry are all ball handlers to some extent) but Gabe Vincent is nowhere near good enough to be a quality backup PG. The only problem close to backup PG is backup C, since Dedmon will not be good enough sometimes. But, Morris and Tucker can shift down a position if needed."
I saw a little bit of Jarreau for the Heat and I hope he gets some minutes. People are talking about Gabe Vincent as our backup point in local newspapers. I never really saw much from him last year.
