"&gt;Please point out to me where I ever said that any team was offering multiple firsts for Lowry.  Some of the links you provided as evidence of the existence of offers for Lowry say exactly that.  I thought you read them, but perhaps not.  Next time, I would advise reading your citations.  &gt;You said teams wasn’t willing to pay Lowry $30 million a year.  Well, he didn't get $30M, he got $28.3M.  And they needed to pay him at least $\~23M just to match salaries.  Apparently the extra was to create a TPE for Toronto, so I'm not sure one can conclude that $28.3M was Lowry's value on the open market.  &gt;Funny enough, Dragic, the player who you thought he is a better player than Lowry, and a player who you thought shouldn’t get paid as much, ended up getting traded in a package for him.  And I still think that Dragic + Nunn for $\~24M makes Miami a better team than Lowry for $28M.  Who is Miami's backup point now, Gabe Vincent?  That's the only other point on their roster.  Are they going to run Lowry 40+ minutes at his age?  Not for long they aren't.  &gt;You also thought he would walk for free, which was wrong.  Yeah, this was a terrible trade by Miami -- maybe unless Dragic is still more injured than we know -- but it was still a far smaller return than you claimed Toronto was offered at the deadline.  So that's a lose/lose deal."
A young kid trying to make it in the league better be more valuable than Max Strus or Gabe Vincent.
"The others years didn't really matter but this year  1. Oladipo is out most of the season 2. guys like Gabe Vincent, Max Struss, Kz Okpala, Omer Yurtseven are projects/unplayable 3. Miami actually is opting not to use the 15th spot to stay under the luxury tax leaving them with only 14 spots  including UD thats 6 unplayable pieces right there leaving only a (playable) 8 man rotation for the season. This team went through tons of injuries and if you include the possibility of covid protocols thats a very short rotation to go through a season. On top of that they need decent a backup PG and SF. So some heat fans are angry that instead of being able to sign one of these veterans that are still on the market that can be a rotational piece they are giving the spot to UD when he could just stay on the bench in some coach type role."
I'd take him in Miami. Gabe Vincent sucks
Considering we needed a stretch big that's also a 7fter he solves more problems for Miami. Plus you have gabe vincent as a young PG
1. Dion Waiters  2. Tyler Johnson  3. Wayne Ellington  4. Rodney McGruder  5. Gabe Vincent  6. KZ Okpala  7. Max Strus  8. James Johnson  9. Justise Winslow  10. Greg Oden
Gabe Vincent being our backup pg until Dipo returns.
Gabe Vincent is our backup point guard Rn tho
Jimmy missed a ton of time. Dragic. Herro. Nunn missed time. Dipo only ended up playing 4 games for us. Even Bam missed time. Avery Bradley was hurt all year. The Heat were playing straight bum gleaguers Max Strus and Gabe Vincent significant time lol
Here’s a list of the signings so far sorted by team for convenience:  |Player|Team|Details| :--|:--|:--| |Solomon Hill|ATL|1 year| |Gorgui Dieng|ATL|1 year/4 million| |Blake Griffin|BKN|1 year/minimum| |Bruce Brown|BKN|1 year/4.7 million| |James Johnson|BKN|1 year| |Patty Mills|BKN|2 year/12 million| |Ish Smith|CHA|1 year| |Alex Caruso|CHI|4 year/37 million| |Lonzo Ball|CHI|4 year/85 million| |Demar Derozan|CHI|3 year/85 million| |Jarrett Allen|CLE|5 year/100 million| |Tim Hardaway Jr.|DAL|4 year/74 million| |Boban Marjanovic|DAL|1 year| |Sterling Brown|DAL|2 year/6.2 million| |Reggie Bullock|DAL|3 year/30.5 million| |Will Barton|DEN|2 year/35 million| |Jamychal Green|DEN|2 year/17 million| |Jeff Green|DEN|2 year/10 million| |Austin Rivers|DEN|1 year| |Kelly Olynyk|DET|3 year/37 million| |Cory Joseph|DET|2 year/10 million| |Trey Lyles|DET|1 year/5 million| |Otto Porter Jr.|GSW|1 year/minimum| |Nemanja Bjelica|GSW|1 year| |David Nwaba|HOU|3 year/15 million| |Daniel Theis|HOU|4 year/36 million| |TJ McConnell|IND|4 year/35 million| |Torrey Craig|IND|2 year/10 million| |Nicolas Batum|LAC|2 year| |Trevor Ariza|LAL|1 year| |Wayne Ellington|LAL|1 year| |Dwight Howard|LAL|| |Kent Bazemore|LAL|1 year| |Carmelo Anthony|LAL|1 year| |Malik Monk|LAL|| |Talen Horton-Tucker|LAL|3 year/32 million| |Kendrick Nunn|LAL|2 year/10 million| |Duncan Robinson|MIA|5 year/90 million| |PJ Tucker|MIA|2 year/15 million| |Dewayne Dedmon|MIA|1 year| |Max Strus|MIA|2 year/3.5 million| |Gabe Vincent|MIA|2 year/3.5 million| |Markieff Morris|MIA|1 year| |Kyle Lowry|MIA|3 year/90 million| |Bobby Portis|MIL|2 year/9 million| |Semi Ojeleye|MIL|1 year| |Rodney Hood|MIL|1 year| |Nathan Knight|MIN|Two-way| |Didi Louzada|NOP|4 year| |Garrett Temple|NOP|2 year/5 million| |Devonte Graham|NOP|4 year/47 million| |Alec Burks|NYK|3 year/30 million| |Nerlens Noel|NYK|3 year/32 million| |Evan Fournier|NYK|4 year/~78 million| |Derrick Rose|NYK|3 year/43 million| |Taj Gibson|NYK|1 year/2.7 million| |Mike Muscala|OKC|2 year/7 million| |Robin Lopez|ORL|1 year/5 million| |Furkan Korkmaz|PHI|3 year/15 million| |Andre Drummond|PHI|1 year/minimum| |Cameron Payne|PHX|3 year/19 million| |Chris Paul|PHX|4 year/120 million| |Javale McGee|PHX|1 year/5 million| |Abdel Nader|PHX|2 year/4.2 million| |Cody Zeller|POR|1 year| |Norman Powell|POR|5 year/90 million| |Ben McLemore|POR|| |Tony Snell|POR|1 year| |Maurice Harkless|SAC|2 year/9 million| |Alex Len|SAC|2 year| |Richaun Holmes|SAC|4 year/~55 million| |Doug McDermott|SAS|3 year/42 million| |Zach Collins|SAS|3 year/22 million| |Gary Trent Jr.|TOR|3 year/54 million| |Sam Dekker|TOR|| |Mike Conley Jr.|UTA|3 year/72.5 million| |Rudy Gay|UTA|2 year/12.1 million​|
"So far,      PG            C               SF                PF                SG     Kyle Lowry    Bam Adebayo     Jimmy Butler      PJ Tucker         Duncan Robinson     Gabe Vincent  Dewayne Dedmon  KZ Okpala (??)    Markieff Morris   Tyler Herro                                                                       Max Strus  KZ might be going in the Dragic+Achiuwa trade in which case I'm curious who'd fit into that spot. Second unit is looking a bit directionless."
Nigerian legend Gabe Vincent.
"Not really KZ is 22, Gabe Vincent is 25, Strus is 25, Bam is 24, Herro is 21 and Duncan is 26. We have like 3 old players in Butler, Tucker and Lowry."
Some dude Gabe…..Nnamdi?!? The one who goes by Gabe Vincent?
Dude Gabe Vincent is torturing the team USA basketball team but doesn’t get on this list?
"&gt;Like I said, all of us would die for our country.  *looks over at Gabe Vincent and Jahlil*"
Going to have to throw in Gabe Vincent too while they’re at it
What was gabe Vincent thinking with all those 3s ? He is 30 % shooter in the NBA
"right the difference between luka and the 40th best basketball player in the world is gigantic.  but the difference between the 380th and 423th isn't as much.    Italy its actually a good test of this theory  fontechio and polanaro are two top 30 players in Europe. Plus they have galo who might be the best player between italy and nigeria.  but nigeria has more nba players.  gabe vincent, kz opkala, precous achuiwa, josh okogie, miyi oni , chemezie Metu, jordan nwora.  almost their whole rotation besides agada and emegano"
How the fuck is a team of KD Dame Tatum Bam etc crappy?  The Nigerians have a team led by Ekpe Udoh and Gabe Vincent and beat us
"""Man I know Gabe Vincent aint nice like that over here"""
Gabe Vincent the Nigerian Curry 1/7 today lmao
Gabe Vincent is balling
"Thanks for including the /s, if you hadn't included that I totally would have thought you actually think Gabe Vincent and Bradley Beal are equal!"
Ok somebody’s feeling greedy… Gabe Vincent straight up swap is more than fair   /s
Gabe Vincent though
"**Team Africa**  C: Joel Embiid, Precious Achiuwa.  PF: Pascal Siakam, Chimezie Metu, KZ Okpala.   SF: Josh Okogie, Luc Mbah a Moute.  SG: Victor Oladipo, DJ Strawberry.  PG: Miye Oni, Gabe Vincent."
Has been for awhile. Unless Spo plays Bam and Dedmon together and has Bam play some 4 this year.  Our depth in general is pretty concerning. Really counting on guys like Gabe Vincent and Max Struss to give us production off the bench. I have more faith in Max tbh. They were also really hoping KZ Okpala would show something by now but dude just looked straight up terrible offensively in summer league (his defense is alright tho)
Gabe Vincent
"He was good for us when he played. He just couldn't stay healthy, so it was easier to ship him out for Oladipo and, although Oladipo got injured too. Oladipo at full healthy is more impactful for us than Avery Bradley at full health. I'd personally wrlcome him back to Miami. I'd rather have him over Gabe Vincent."
"I think we will need a player to take an unexpected leap to have a chance. Our main guys log a lot of miles and we don’t have a lot of proven bench players. If Okpala can hit threes consistently to be a good 3 and D guy or Gabe Vincent could earn real minutes at the backup pg role, I feel good. If they don’t earn it, I don’t feel so good as I think we are like 7-8 deep or so max."
"We lost a lot. People talk about us gaining Lowry and that’s great, but he is much older than he was even when he won a championship.   Beyond that, from our 2020 Finals run, we lost, Dragic, Crowder, Olynyk, Iguodala, Derrick Jones Jr., Nunn and Meyers Leonard.   We’ve added old Lowry, old PJ Tucker, Markief Morris and Dewayne Dedmon.   Really and truly, I don’t expect too much production out of Morris and Dedmon and even with them we lost 7 rotation guys and added 4. The ones we added are older and our bench is shorter. We went from being 11 deep to about 7 deep unless Okpala and Gabe Vincent to actually earn more minutes which they really haven’t as of yet.   It’s hard to win a championship without solid bench production and nobody on our bench really pops, scares a team, or does really anything so well as to be incredibly positive for us."
Gabe Vincent
Bismarck biymbo and gabe vincent So literally no one. They are uncrowned co-MVP
"Considering that  1. We have our PG in Lowry 2. Our top two stars don’t stretch the floor 3. Simmons doesn’t address our potential needs at the 5 (big body to go against the AD and Embiid of this world but who can also protect the rim and shoot 3s)  There is nothing that we can offer that makes sense for any team.   But to play your game, I’d give up KZ Okpala, Oladipo, and Gabe Vincent + a first and two second rounders."
"Really? I don’t think we need wing depth, we just need one more wing.  Lowry | Dipo Duncan | Herro Butler | Strus for now, also KZ is available PJ | Keef Bam | Dedmon  We don’t need depth, just one more would be enough to complete the puzzle. I’m worried about the Gabe Vincent minutes till Dipo comes back more than anything lol. Marcus Garrett could also be used"
Very nice. Did you get to watch Gabe Vincent in person?
"Great question. u/rkpeagle1013 had a great [breakdown](https://www.reddit.com/r/nba/comments/pbig8z/sbj_espn_takes_rachel_nichols_off_nba_programming/hac6faj/?utm_source=reddit&amp;utm_medium=web2x&amp;context=3) elsewhere in the thread:    &gt;1. SAS on Ohtani being the face of baseball: *But when you talk about an audience gravitating to the tube or to the ballpark to actually watch you, I don’t think it helps that the No. 1 face is a dude that needs an interpreter so you can understand what the hell he’s saying, in this country.*    &gt;   &gt;   &gt;   &gt;Ohtani speaks English fwiw.    &gt;   &gt;   &gt;   &gt;2. SAS on Nigeria: *There’s no excuse to lose to Nigeria,” Smith said on ESPN before tweeting the clip out himself. “\[To lose to\] some dude Gabe Nnamdi, who goes by Gabe Vincent for the Miami Heat. Or Caleb Agada. Or Nma ... however the hell you pronounce his name.*  I've argued elsewhere i the comments that these are both very bad things to say. You can look up commentary about both. And I guess, for me, it was magnified by the fact that they came back to back and that, still, nothing seemed to happen.   Another commenter, u/doc_birdman, pointed out [SAS said](https://www.reddit.com/r/nba/comments/pbig8z/sbj_espn_takes_rachel_nichols_off_nba_programming/haczgul/?context=3) some weird stuff about Jeremy Lin, too, [and about](https://www.reddit.com/r/nba/comments/pbig8z/sbj_espn_takes_rachel_nichols_off_nba_programming/hac9nmz/?context=3) women fighting MMA... Oh yeah, and then there were the domestic violence stories from the Ray Rice thing that u/PantsNotQuite (what a username!) just reminded [us about](https://www.reddit.com/r/nba/comments/pbig8z/sbj_espn_takes_rachel_nichols_off_nba_programming/hacjkvo/?utm_source=reddit&amp;utm_medium=web2x&amp;context=3). Damn."
"SAS on Ohtani being the face of baseball: *“But when you talk about an audience gravitating to the tube or to the ballpark to actually watch you, I don’t think it helps that the No. 1 face is a dude that needs an interpreter so you can understand what the hell he’s saying, in this country.*  Ohtani speaks English fwiw.  SAS on Nigeria: *“There’s no excuse to lose to Nigeria,” Smith said on ESPN before tweeting the clip out himself. “\[To lose to\] some dude Gabe Nnamdi, who goes by Gabe Vincent for the Miami Heat. Or Caleb Agada. Or Nma ... however the hell you pronounce his name.”*"
"I don’t get it either, but we will see. Adding PJ Tucker was pretty big. I love that. Our backup point is Gabe Vincent though and I have zero faith in him."
"5 games don't mean anything over a stretch of 82 — 5 out of 5 games **do** mean something, no matter how you want to spin it. he had tangible effects on both ends of the floor, and even if he comes back with low athleticism, he's a better option as a backup ball handler than our current one (Gabe Vincent was a two-way player last year and should, ideally, still be in the G League right now)."
This is why its important to watch the games bot just look at a box score.  PJ played 30+ min and had 0 points. Lowry out and Gabe Vincent started at point and had 0. Dedmon 15 min 0 points. Jimmy struggling.  Herro was literally being doubled and the only one able to keep the offense afloat. No one who actually watched that game would think he was chucking or had a bad offensive game.
This is why its important to watch the games bot just look at a box score.  PJ played 30+ min and had 0 points. Lowry out and Gabe Vincent started at point and had 0. Dedmon 15 min 0 points. Jimmy struggling.  Herro was literally being doubled and the only one able to keep the offense afloat. No one who actually watched that game would think he was chucking or had a bad offensive game.
"I know a lot of fans want KZ gone but at least he's a body on defense, instead of Gabe ""road cone"" Vincent.  Doubt Gabe will start ever again, but ig he got it tonight over Strus cause experience? I dunno."
"Yeah with no Dragic we have to run bum ass Gabe Vincent out there. He may be the worst player in the league and I don’t think I’m joking, he has zero offensive game and he can’t defend for shit."
"Possibly, I don't think we'd start Gabe Vincent. But if Lowry's out we probably have Jimmy be the primary handler and he could share point time with Herro.  In our first preseason game Butler was out and Herro started at the 3 alongside the other regular starters, and it looked fine."
  **Heat @ Hawks**  [](/MIA) **92 -  127** [](/ATL)  **Box Scores: [NBA](http://www.nba.com/games/20211014/MIAATL#/boxscore) &amp; [Yahoo](http://sports.yahoo.com/nba/miami-heat-atlanta-hawks-2021101401)**  |**Team**|**Q1**|**Q2**|**Q3**|**Q4**|**Total**| |:---|:--|:--|:--|:--|:--| |Miami Heat|17|26|29|20|92| |Atlanta Hawks|33|34|30|30|127|  **TEAM STATS**  |**Team**|**PTS**|**FG**|**FG%**|**3P**|**3P%**|**FT**|**FT%**|**OREB**|**TREB**|**AST**|**PF**|**STL**|**TO**|**BLK**| |:--|:--|:--|:--|:--|:--|:--|:--|:--|:--|:--|:--|:--|:--|:--| |Miami Heat|92|35-91|38.5%|13-38|34.2%|9-12|75.0%|13|51|23|20|5|18|4| |Atlanta Hawks|127|49-101|48.5%|19-46|41.3%|10-13|76.9%|13|51|33|17|10|11|8|  **TEAM LEADERS**  |**Team**|**Points**|**Rebounds**|**Assists**| |:--|:--|:--|:--| |Miami Heat|**20** Javonte Smart|**16** Micah Potter|**10** Gabe Vincent| |Atlanta Hawks|**27** Trae Young|**11** John Collins|**15** Trae Young|
Thought Gabe Vincent played well for Nigeria
"ATL going with their likely starting 5 while MIA is starting UD, Strus, Gabe Vincent, KZ and a Martin twin."
"Most of them born in Nigeria. They all played college ball in the US, and many played HS as well. But they're still Nigerians, I think only Jahlil Okafor and Gabe Vincent were born in the US and grew up there from a young age"
"Max is untested and it is still up in the air if he will earn solid minutes. Same with Yetzen to an even greater degree, although I’d be really excited to see him. Morris is really solid on the bench. Same with Gabe Vincent. He and Max are pretty untested to this point, even if they’ve shown some flashes."
That's true. I think Oladipo will actually be the backup PG and replace Gabe Vincent
"So many takeaways. Not just what Lowry does for us, but it feels like all our young core players got better.  * Bam, Tyler, and Duncan all got bigger and faster * PJ feels like Ariza and Iggy combined into one person * Probably too early to judge but it seemed like Max Strus and Gabe Vincent (and maybe even KZ) took steps, though Gabe still needs to rein in those turnovers  And these two impressed:  * Caleb Martin. I didn't even know we had this dude, apparently we two-way'd him in mid-September. I don't know if his game tonight is representative of what he can usually do, but he showed out * Omer Yurtseven. He played his first NBA minutes tonight. In just 14 minutes he got a team-leading 8 rebounds. He's still green and made all the typical rookie mistakes like too many fouls and low shot clock awareness, but he absolutely did his job and filled his role"
Why did the Heat sign Lowry when they already have Gabe Vincent
"I’ve got a pretty random list. Off the top of my head:  Felicio, Vonleh, TJ warren, Mitch McGary, Jakarr Sampson, Semaj Christian, Wiggins, Stanley Johnson, Olynyk, Sabonis, Gabe Vincent, Tyler Johnson, Robert Swift  Between college ball, prep school, and the aau circuit I’m sure I’m missing more"
I agree. They should trade Embiid to the Heat for Gabe Vincent straight up and build around Ben!
He really sets the tone in practice and camp. It’s different having someone on the same level as the players who is out there working with you that has the respect of all your superiors but still allows himself to be coached like any rookie. It shows what the team is about. If UD is giving it everything as a senior citizen then Gabe fucking Vincent better run those sprints.
"Herro off the bench helps balance their lineups better. It essentially allows Spoelstra to always have 2 of Lowry, Herro, Jimmy, and Bam in the game at all times when healthy.  I’d imagine Gabe Vincent or Morris would get the starting spot if Duncan gets demoted."
Aaron Gordon vs the ghost of Gabe Vincent lol.
"He really isn’t a point guard that’s why Miami got Lowry, Wall would help a lot and completely eliminate players like Gabe Vincent and Max Strus and also probably take time from Duncan Robinson who honestly needs to get his shooting together before Oladipo comes back or he will be losing minutes to him as well. If Miami got Wall and Oladipo comes back healthy I don’t think anyone can beat Miami"
"I mean, I like Gabe Vincent too but he's not the best backup yet"
Yeah wasn’t really bad defense either. They doubled Jimmy to deny him the ball which they should do on that situation. I’d rather Gabe Vincent shoot last second free throws than Jimmy if I’m an opposing team. It was really just a great play call though. Spo gambled on them potentially doubling Jimmy and it worked.
22 turnovers and letting a dude named Gabe Vincent torch you on the second night of a back2back doesn’t usually translate to a W if you ask me
  **Heat @ Bulls**  [](/MIA) **107 -  104** [](/CHI)  **Box Scores: [NBA](http://www.nba.com/games/20211127/MIACHI#/boxscore) &amp; [Yahoo](http://sports.yahoo.com/nba/miami-heat-chicago-bulls-2021112704)**  |**Team**|**Q1**|**Q2**|**Q3**|**Q4**|**Total**| |:---|:--|:--|:--|:--|:--| |Miami Heat|27|22|23|35|107| |Chicago Bulls|20|26|28|30|104|  **TEAM STATS**  |**Team**|**PTS**|**FG**|**FG%**|**3P**|**3P%**|**FT**|**FT%**|**OREB**|**TREB**|**AST**|**PF**|**STL**|**TO**|**BLK**| |:--|:--|:--|:--|:--|:--|:--|:--|:--|:--|:--|:--|:--|:--|:--| |Miami Heat|107|37-86|43.0%|14-40|35.0%|19-22|86.4%|9|36|23|19|13|10|1| |Chicago Bulls|104|38-81|46.9%|11-39|28.2%|17-21|81.0%|10|47|22|20|6|22|4|  **TEAM LEADERS**  |**Team**|**Points**|**Rebounds**|**Assists**| |:--|:--|:--|:--| |Miami Heat|**20** Gabe Vincent|**7** Bam Adebayo|**6** Bam Adebayo| |Chicago Bulls|**28** DeMar DeRozan|**13** Nikola Vucevic|**6** Lonzo Ball|
"Great game defensively, for both teams. But of course congratulations and deep respects to the Heat, their defence was better and they didn't give Zach a room to breathe.  Also shoutout to Gabe Vincent, that man was the decider in the 4th quarter."
Gabe Vincent vs Alex Caruso is why people turn on that game right?
"Gabe ""Modern Day Jesus"" Vincent only has to wait until the next game to go off after being crucified."
Idk it reminds me of Heat fans furiously typing how much they hated Gabe Vincent and hated that Spo played him. Sometimes you gotta give guys minutes and live with it if they struggle. Coby is important to their season so I’m not surprised he’s getting minutes.  Like you really can’t just bench a shooter cause their shots not falling. You’ll just end up mentally breaking all your shooters. Just like Spo playing Duncan through his slumps
Enter: the Gabe Vincent era
Gabe Vincent revenge tour starts now
The Heat really shouldn't have won this given the circumstances but Gabe Vincent and and Kyle Lowry said NAH
"Honestly, he is an energy guy. Brings the energy up, plays hard. Good glue guy. Unfortunately he played against Gabe Vincent going super saiyan."
Gabe Vincent is the new Undertaker
He was up against Gabe Vincent. /s
&gt; Gabe Vincent became Klay Thompson in that 4th quarter  RSBK
Heat leading scorer Gabe Vincent is what I expected before the game started.
Tyler herro who? Gabe Vincent is my new best friend
"As we all expected, Gabe Vincent was the best player in the fourth quarter"
Thank you Miami Heat legend Gabe Vincent.
Gabe Vincent is just too good I guess
Gabe “Duncan Robinson” “Tyler Herro”” Vincent
"Gabe Vincent became Klay Thompson in that 4th quarter. If I'm a Bulls fan, I'd be furious lmao  Felt like we were gonna crap our pants with another bad 4th Q just like we did vs Minnesota and then Gabe/Lowry went to another stratosphere. Hell of a win vs a damn good team."
Thank you gabe Vincent and SPO
Kz Okpala and Gabe Vincent but the Gabe hate has lessened recently.
Gabe Vincent
May i interest you in one Gabe Vincent
May i interest you in one Gabe Vincent
"Gabe Vincent is the main punching bag.  However, both Bam and Duncan have been getting rough treatment lately.  More Duncan than Bam, really."
RIP Gabe Vincent [sauce](https://twitter.com/bennnyboom/status/1463708731674406914?s=21). You really hate to see the league reward that bullshit late/weak rotation.
Did you WATCH the video? Edwards made Gabe Vincent a maneater by putting his nuts down his throat…
"Anyone else notice that they're allowing way more taunting this season? The way Ant stood over and looked at Gabe Vincent woulda been an easy tech until recently. I'm definitely not complaining, just something I've noticed."
Gonna come back as Vincent Gabe and hope no one remembers he's the same person.
"&gt; He was already airborne when vincent got there lmao. Awful call.  it's the right call. It may not be the popular call, but Gabe beat him to the spot. Call me a no-fun guy, but being cool doesn't earn extra points from me."
On the same day the refs bail out Gabe Vincent from an equally monstrous Ant dunk no less
"Gabe Vincent does clear the bubble, but his right foot is way off the ground when they collided.  Rule of cool &amp; the Rulebook agree on this case."
im ngl as a heat fan this hurt but it was on gabe vincent so i felt a little less bad
Gabe Vincent 🤝 Riley Reid  Having videos of them getting facefucked on the internet.
Nope Nope Nope. That was a murdering. Gabe Vincent is no more.
