"  # Top Highlights:  0. [[Highlight] Anthony Edwards murders Gabe Vincent but is called for an offensive foul](https://streamable.com/c6b53h) | [(Comments)](/r/nba/comments/r1mjm4/highlight_anthony_edwards_murders_gabe_vincent/)  0. [[Highlight] Lakers try to run their offense](https://streamable.com/td40o6) | [(Comments)](/r/nba/comments/r1klac/highlight_lakers_try_to_run_their_offense/)  0. [[Highlight] LeBron hits a clutch 3 and does an interesting celebration](https://streamable.com/yqmn30) | [(Comments)](/r/nba/comments/r1lu9t/highlight_lebron_hits_a_clutch_3_and_does_an/)  0. [[Highlight] LaMelo Ball attempts a self-oop!](https://streamable.com/tnqdun) | [(Comments)](/r/nba/comments/r1k0bw/highlight_lamelo_ball_attempts_a_selfoop/)  0. [[Highlight] LeBron James Celebrates in Front Of Indy Crowd After Big 3](https://streamable.com/y2nzk4) | [(Comments)](/r/nba/comments/r1m2qt/highlight_lebron_james_celebrates_in_front_of/)  # Day in the history:  ### Monday, November 25, 2019  Giannis Antetokounmpo of the Milwaukee Bucks scored 50 points in a 122-118 win over the Utah Jazz.  ### Friday, November 25, 1983  Magic Johnson of the Los Angeles Lakers dished out 20 assists in a 147-123 win over the New Jersey Nets.  ### Sunday, November 25, 1979  Kareem Abdul-Jabbar of the Los Angeles Lakers blocked 11 shots in a 111-110 win over the Kansas City Kings.  Daily Discussion Thread : [Rules](https://www.reddit.com/r/nba/wiki/rules#wiki_daily_discussion_thread)"
So Jimmy got Gabe Vincent murdered.
"GABE FUCKING VINCENT , MY CONDOLENCES!"
"Gabe Vincent was playing well, and then gave his life so the Heat might have a chance.  A noble sacrifice, but all in vain."
damn he sucked the soul out of gabe vincent
"I remember how much flack everyone gave MIN for drafting this guy number 1 after there were all those rumours about how he wanted to play football and how lax he is about his legacy but cmon… THIS GUY IS A MANEATER, I couldn’t care less about Melo’s rookie season, this man is the TRUTH.  Side note: you love to see Gabe Vincent put his body on the line to draw a foul like that, a lot of other blokes out there getting 12 mins a game that make make a business decision there, a true reflection of the culture the in Miami."
Anthony Edwards:  - Showed up  - Dunked Gabe Vincent into he shadow realm  - Refused to elaborate further  - ~~Left~~ Ejected  Woulda been some GOAT shit
call anthony edwards a priest.  He just baptized Gabe Vincent.
Day? Ant murdered his career. Gabe Vincent is gonna be the guy that got dunked on now
"i thought this was title gore, but he's right. gabe vincent is dead."
TIL there ~~is~~ was a Gabe Vincent in the NBA.
[Gabe Vincent passed away violently tonight.](https://streamable.com/c6b53h)  He will be missed.
Well I mean he literally murdered Gabe Vincent.
[Gabe Vincent passed away violently tonight.](https://streamable.com/c6b53h)  He will be missed.
Refs just didn't want Gabe Vincent to have to retire in shame.
Gabe Vincent is a brave soul because I would have moved tf out of the way.
"I DONT CARE HOW IN POSITION GABE VINCENT WAS, IF YOURE WOLVES HC YOU FUCKING CHALLENGE THAT 100/100 TIMES.   LET THE PEOPLE IN THE STADIUM GO NUTS OVER THAT REPLAY. SMH. ROBBED OF GREAT THEATER."
"tbh your players are instigating shit not ours.  gabe vincent judo takedown, butler now"
I mean it’s fine. Tyler plays the most minutes each night anyways.   You want Gabe Vincent and KZ for Cory Bc I will drive them to Michigan right now
why did Gabe Vincent not play? he killed us last game but he got a DNP today. is he injured or something?
gabe vincent redemption arc
It’s gonna be Gabe Vincent
"Gabe Vincent, wtf. I hope this is a turning point for him. He looked great defensively, but offensive was lackjng"
Lotta people Googling Gabe Vincent rn  Edit: Oh my god the Spoelstra table leap
Fucking Gabe Vincent lmao
holy shit Gabe Vincent playing great tonight
The Gabe Vincent game
"Good 2nd half from butler, unlike him in the 1st. Bench did really well and hope Gabe Vincent continues this run of his. Even if it's against 500~ teams"
UD so mad he had to play minutes that he put extra spice on that block. That 3 from Gabe Vincent was clean as hell
Gabe Vincent minutes give me trauma
"It's funny you'd say that...  I opened the game late and was unaware Adebayo was also out.  So here I am wondering wtf why is Yurtseven playing in the first half? Wait KZ Okpala is in the game??? Hey, Gabe Vincent isn't being awful. Oh this must be the G-League... Wait why is Duncan Robinson here? Did they send him back to the G-League???  Had quite the trip until Tyler Herro checked back in. Then some Lowry action."
"Whatever Spo decides to go with, I just hope we never see KZ Okpala and Gabe Vincent on the court at the same time again"
"KZ AND Gabe Vincent, this is the stuff of nightmares"
"AD to the Raptors, Dragic back to us, Gabe Vincent to the Lakers."
Hopefully Gabe Vincent gets bullied into being a better player.
It should be illegal for Gabe Vincent to play basketball
"Out of all the things we could have done, we chose to keep Gabe Vincent 🤦🏾‍♂️"
Gabe Vincent is a frustrating guy at times
"While I understand this take, I don't agree with it.  It isn't UD's responsibility to make room for the young player. At the end of the day rosters are built by evaluating the value a player brings to the team. The Heat FO clearly believe the value UD brings to the team on/off the court is higher than any other young player they could sign. I would rather cut(or send him down to the G league) Gabe Vincent before losing UD."
  **Heat @ Clippers**  [](/MIA) **109 -  112** [](/LAC)  **Box Scores: [NBA](http://www.nba.com/games/20211111/MIALAC#/boxscore) &amp; [Yahoo](http://sports.yahoo.com/nba/miami-heat-los-angeles-clippers-2021111112)**  |**Team**|**Q1**|**Q2**|**Q3**|**Q4**|**Total**| |:---|:--|:--|:--|:--|:--| |Miami Heat|40|18|20|31|109| |Los Angeles Clippers|25|31|30|26|112|  **TEAM STATS**  |**Team**|**PTS**|**FG**|**FG%**|**3P**|**3P%**|**FT**|**FT%**|**OREB**|**TREB**|**AST**|**PF**|**STL**|**TO**|**BLK**| |:--|:--|:--|:--|:--|:--|:--|:--|:--|:--|:--|:--|:--|:--|:--| |Miami Heat|109|43-97|44.3%|9-41|22.0%|14-17|82.4%|18|50|18|21|9|15|4| |Los Angeles Clippers|112|43-91|47.3%|11-37|29.7%|15-17|88.2%|9|42|20|14|9|12|9|  **TEAM LEADERS**  |**Team**|**Points**|**Rebounds**|**Assists**| |:--|:--|:--|:--| |Miami Heat|**30** Bam Adebayo|**11** Bam Adebayo|**6** Gabe Vincent| |Los Angeles Clippers|**27** Paul George|**11** Ivica Zubac|**5** Paul George|
"It is.  Markieff and Strus were out, Jimmy left the game early, then Bam and Dedmon both got in foul trouble.  Having Haslem, Martin, and Gabe Vincent all playing is not what the Heat want to do."
He shouldn’t but I want it to happen for my own selfish reasons lol. I’m tired of seeing gabe Vincent get playing time dude
Butler was injured. Struss was injured. Apparently Spo didn’t trust Caleb Martin and Gabe Vincent has issues. I think the Heat were forced to play Duncan when they clearly don’t like closing with him. I also think Spo made some rotation choices on principle. Like leaving UD in for 5 mins in the 2nd
We deserve half a win for having to play Gabe Vincent outside of garbage time
"We can’t really get deeper without getting new guys. Oladipo doesn’t count, he’s more like a potential pipe dream bonus, kind of like Oden was when we had him, a low risk rehabilitation project. It’s not like Strus or Gabe Vincent or KZ will make sudden leaps.  We’re already losing steam the past three games, getting crushed by a supposedly bad team amidst inter-team drama, blowing a 19-point lead with a few minutes left against Utah (still won thankfully), then getting crushed by Denver missing 2/3 of their top guys."
Gabe Vincent
Who gives a shit it’s probably just be another KZ or Gabe Vincent on the bench instead of him who suck ass anyways
"I remember the flashes, though they were mostly on D.  Not as frustrating as Gabe Vincent was"
Gabe Vincent and kz okpala
Take Gabe Vincent instead
Gabe vincent is awful. I’ll take that trade 100/100 times
"Miami can have the dragon back, I'll take Gabe Vincent and a 2nd"
"It's not that you would take a guy who can't stay on the court over a Gabe Vincent, it's that so many Heat fans are treating Oladipo like he's surely coming back and will be reliably available to play, when he's rarely ever been."
What about Gabe Vincent and KZ Okpala?
Or if we wanna rest Lowry. Dipo+Herro is much better than having to watch Gabe Vincent or Caleb Martin.
"yeah, a good way to put it in short is that you can either have Gabe Vincent and Caleb Martin playing NBA basketball in a Miami Heat jersey, or you can try out a fully rehabilitated Victor Oladipo and whatever that may entail.  it's not a fucking question"
"&gt; “I repaired the quad tendon and did it a little differently than [he had] it done before,” Dr. Glashow told ESPN. “The quad wasn’t really hooked up. It was torn, and I reattached it. I was amazed he was playing with what he had. I’m very optimistic that I could clear him in six months, by November. I think he’s going to play really well again… [The surgery] went extremely well, and it’s healing beautifully. I’m confident he’ll play next year.”  Now, why Oladipo's surgeon didn't really **fix** the issue the first time is a puzzling question, but Oladipo's said that he's felt unbalanced ever since and didn't realize that that wasn't just a product of having a repaired quad. He's since said that he feels balanced for the first time in a while (and you can take it with a grain of salt, because he's a player rehabilitating his image).  What we **need** from VO isn't much (if we keep this up, because we're 6-1 as the best defensive team in the NBA) but I will take an ""infamously chronically injured player"" over potential Gabe Vincent minutes every single day of the week. Having VO off our bench fortifies that lineup **and** produces the 5-headed Clamp Monster lineup of Lowry/VO/Butler/Tucker/Adebayo.   He'd be a gamble if we absorbed a legitimate contract from him -- right now, the gamble we're taking on Oladipo is like shooting craps with weighted dice. If he sucks, whatever, we're fine without him."
The score is nice and everything but the real story is that we got 1:28 of Gabe Vincent vs. JaQuori McLaughlin. I don’t even know if two UCSB players have ever shared the floor together
I'll take Oladipo on one leg over KZ Okpala and Gabe Vincent right now TBH.
idk id still rather have him than gabe vincent
"Gabe Vincent for Smart, who says no?"
"ariza was, iirc, the 2nd most negative player on the heat last year (gabe vincent).  like he was one of the worst players in the league in net rating. he looked gassed on every possession, he was genuinely awful. if ur looking for him to play any amount of minutes ur in big trouble imo."
KZ and Gabe Vincent. You can have them for free.
Oh are we counting Gabe Vincent as a player now too? I thought he was just keeping that slot warm.
Gabe Vincent  Omer Yurtseven  Caleb Martin  KZ Okpala
As a fellow Warriors fan I agree. We should trade him for a real talent like Gabe Vincent.
fuck you gabe Vincent
"Ah, now I need to watch Gabe Vincent.  Worth it for the shooting display."
"Yeah they couldn’t get open and were taking contested jumpers. Last year we also had Nunn and dragic to at least drive and her bam and jimmy open we don’t anymore, so when Lowry goes down we start bum ass Gabe Vincent. Watch the fucking games he’s insanely valuable that herro buzzer beater only happened because of Lowry, if you watched you’d see Lowry yelling at Tyler to stay in the back court with him. If you watch these games you’d see Lowry all the time doing this and setting up our offense which is why it was so bad when he was out. You can say poor shooting which it was but you’re leaving out the context that jimmy and bam were constantly shooting jumpers."
Herro made that game look close. We had to start Gabe Vincent. It was painful.
