"I mean you can yeah, look at the process Sixers, someone HAD to up points, so MCW, Wroten, later Ish Smith were those guys.  But I don't think you can apply that to any top scorer of a bad team"
"I can believe it on teams like the process Sixers when you suddenly had guys like Spencer Hawes, Ish Smith or Tony Wroten putting up numbers, or with guys like Monta or K-Mart who were playing no defense, while their team wasn't even better with them on the court"
Nah man. Ish Smith was blowing by him
"DC as a big city should have winning on it's radar. Every big city wants to have a winning sports team. Fortunately DC already has winning sports teams, just not in Basketball lol. But the annoying thing is that DC has the potential to have a great basketball team. Clearly two cornerstone players are here but right now the whole roster is a mixture of being a rebuilding project with pieces that want to contend. It's not right. It's a shame Atlanta absorbed such a high amount of FA last off season. Maybe someone changes their mind and decides to play in the nation's capital but really why bother when there are warmer cities that have cap space and the other north east cities are clearly contenders while DC just bumbles along with some of the best offensive players in the league.  Some of this has to do with just a bad FO though, like yes some of the young guys drafted have potential and some of them not showing their full ability falls on the coaching staff but good lord the supporting pieces, like could DC have made a better decision around what makes sense when you have a great offensive weapon already? Like yes bringing in Robin Lopez is supposed to boost defense a little bit but would it have been better to have taken Matisse Thybulle instead of Rui where Matisse looks like a defensive beast. Of course Rui still has potential and all that but man what is a guy like Raul Neto supposed to bring? A plug and play offensive player that is undersized and cannot do much else? Like is having him in addition to Ish Smith. Oh man and of course the year after we extend him Bertans the ""Latvian Laser"" is now shooting 32% from 3. Like wow if his production stays down low this long then that's an awful contract for a player that no longer has any upside."
Love the little man ish smith
"Ish Smith is just 2 teams away from the NBA record of most different teams played for over the course of a single career. He's already the first person to play for over 10 NBA teams in fewer than 10 seasons. Part of me wants him to break the record, but another part is pretty happy that he seems to have found a home in Washington. Man's been living out of a suitcase for the better part of a decade."
I'm assuming even through quarantine Ish Smith remained a point guard. Man's a professional.
Love Ish Smith
Ish Smith: I jerked off
"I'm not here to hype up Beals defense, but if you watched the game and watched Beal, the guy was easily having one of the worst games of career until that 4th quarter. After the Nets got up big in the first, he looked like he was out the door for not only the game but the team in general. Westbrook and even Ish Smith and Mo Wagner putting in the energy literally reenergized him. We'll see what happens if Westbrook can remain healthy"
Westbrook defense was top notch wow. Also lost count on how many times he and Ish Smith burned kyrie on offense.
"I know Brad and Russ are gonna get a lot of attention for this, and rightfully so, but let’s not forget how good Moe Wagner, Ish Smith, and Garrison Matthews played tonight too. They absolutely killed it."
"i think splitting the votes 3 ways between Russ, Brad, and Ish Smith will hurt all of their MVP chances. might end up being some scrub like Joel since the 3 best players in the league are all on the same team"
Yeah I had to resort to Google to make sure there wasn't a new Ish Smith I didn't know about lol.
Ish Smith really carried the wizards with his +16
"I feel like they've been pretty entertaining, although I was laughing my ass off at the amount of hype they were giving Ish Smith"
Why did Brooks put out Bertans. Almost rather have Ish Smith out there
"If someone who never watched a game saw this one, they would think ish Smith is the goat  Lmao the wizards announcers just said it too"
Ish Smith is a fucking Point Guard.
ish smith is a basketball player
It feels like ish smith has 30
"even when I am wearing glasses, ish smith is a blur"
Ish Smith is chaotic af lmao
ish smith is Kevin Durant from mid range and Russell Westbrook from 3
If a couple of 7 foot white boys and Ish Smith kill the last leg of my parley I’m gonna lose my shit
"I swear, Ish Smith turns into an all-star every time we play him"
"If Ish Smith was 6’4-6’7, he’d be the greatest player of all time"
"Ish ""Kyrie Irving"" smith"
Why are we getting beat by ish Smith 😐😐😐😐😐😐
"I think I've focused too much time on Westbrook's decline (he suddenly looks a bit athletic again btw for some reason) as being one of the main reason for Washington horrible start, but man what do they actually do in practice ? They don't have any idea of what to do on any screen actions, don't rotate, don't rebound, nothing, 5'8 Ish Smith is the only guy playing hard defensively"
Get Westbrook and Ish Smith some help? Idk what this wizards team is lol
This is the first time I've seen the wizards play. I like the way this ish smith guy balls. What's his story?
Ish Smith cooking
"Joel never played with Ish Smith, what the fuck are you talking about"
There is one Ish “Is a Point Guard” Smith for you
"To be fair, are there any point guards better than ish Smith?"
"Brad Wanamaker, Ish smith, tj McConnell, Tristan Thompson, dj Wilson"
"tbh the only 'bad' losses have been to Chicago/Orlando and maybe yesterday with the hawks.    12 losses  - 5 were there ones mentioned above ... 3 of them were very close games though.  - Losses to NOP/HOU/SAS .. we were missing half our roster.  - Loss to MIA we were missing Westbrook/Beal and Bryant tore his ACL a couple minutes in.  - 2 Losses to 76ers were close ... Embiid became unstoppable .. and some bad offensive execution  - Loss to Celtics ... was kinda bad too since they were missing some bigs  ---  Overall a few key issues  - Scott Brooks is a moron.  - Offensive system consists of give the ball to Beal or Westbrook and watch them do something.  - Defense sucks to, players aren't great ... but coaching is pretty weak here.  - Rotations seems pretty bad. Brooks insists on playing 2-3 PG lineups. He also often decides to play Westbrook with Ish Smith, Robin Lopez, and Jerome Robinson for some reason.   - Lacking a good defensive big. Bryant was good offensively .. but clueless on defense. We actually looked better on defense with Lopez.  - Bad defenders in general.  - Westbrook is bad, focuses too much on rebounding and doubling  - Beal is AVG in my opinion, but sometimes looks disinterested in defense when the team is doing bad.  - Hachimura is a bit clueless on defense at times.   - Advija has good instincts, but he's still a rookie .. and slow at times.   - Bryant is just bad at defense, makes a highlight play every now and then.   - Most of our bench players are just bad at defense too ... Bertans (can only shoot 3s), Ish Smith / Raul Neto  (just too small), Matthews ( good effort, but a bit frantic)   - Lopez is good at times, but isn't athletic so ... can be a problem.   - Bonga is a decent defender ... but doesn't get playing time, fouls too much though"
Ish smith
"you said he isnt efficient when he has been the most efficient at it in the league.  I never brought up PNR at all, Embiid isnt a pick and roll player but the best guard he has ever played with is Ish Smith as well.  Why are we comparing the PNR with post ups?  Posting up is much closer to an isolation play, Embiid isnt getting any easy lobs when he posts up.  Harden was at 1.12 ppp in iso last year with by far the most attempts.  Embiid at 1.1 under more comparable circumstances is an incredibly valuable play, would you say a Harden iso is inefficient?"
"I thought Ish Smith would be a solid starter in the league after he averaged 14.7 and 7 with the Sixers in 2015. To be fair, that was one of the worst teams in history."
"I agree with a lot of what you're saying, but the blame shouldn't be on Beal. They're a bad team. Westbrook has looked awful (I believe he will figure out though) and injured. Bryant is their third best player (where would he rank in the league? Maybe top 100) is hurt.  Ish Smith, Jerome Robinson, and Garrison Matthews are in their top 10 for minutes, How many teams would have these guys in their top MPG? 19 players have stepped onto the court for them already this season. What is Beal supposed to do? He is surrounded by a struggling Westbrook, injured players, and a bunch of 10-13th men. Do you want Westbrook, Jerome Robinson, Bertans, and Alex Len taking more shots? You think that solves the problem?   I agree Beal's 35/5/5 (on great efficiency) is inflated, but that's like all-time great season. He's putting up runaway MVP numbers. If Beal was putting up Lavine numbers then your overall point has some legs, but he's putting up insane numbers. Very few players can have a season that Beal is having no matter how bad their team is. So no, he isn't ""35/5/5 good"" but he's a top 15 player and shouldn't even be questioned for all-star/All NBA."
"Can’t pin these losses on Beal. Of course his numbers are going to be inflated if you’re missing Rui Hachimura, Troy Brown Jr, Thomas Bryant, Davis Bertans, Russell Westbrook and Ish Smith"
"half our team is missing ...  although for some reason brooks played the other starters with Beal ... left our better offensive players on the bench    ... and played Ish Smith, Raul Neto, and Robin Lopez with Russ ...  not sure how he hasn't been fired yet ..."
"No, even right now.  Westbrook is taking 18 shots a game and he's shooting the lowest from the field outside of Bertrans and has the worst TS% than everyone on the team that plays minutes besides Ish Smith.  Russ has been absolutely abysmal when it comes to scoring."
Ish Smith
Jeremy Lamb and Ish Smith
"People will say the Wizards, but we really should have expected with Scott Brooks as the coach.  We've been close down the stretch in pretty much all of our losses, if Brooks didn't put out brain dead lineups through the game it would help. Somehow thinks Westbrook will be good with Ish Smith, Raul Neto, and Robin Lopez on the floor.    and TBH only the 2 losses to the magic/bulls each have been bad early in the season, were even unexpected. We've played a lot better since then.    Having close losses to the 76ers (2x), Celtics, and Heat (w/o Beal, Westbrook) .. aren't really bad losses."
Are we gonna do the thing where we pretend Ish Smith isn’t the clear cut favorite
"What’s weird is that wizards backup PG Ish Smith has 27,000 rebounds already this year."
"Yeah, it’s looking more and more like we should have kept Payton. I said it at the time and I’m still saying it. If you’re looking at a PG and going “Man I miss Tim Frazier. Why’d we let Ish Smith go again?” Theorems a problem."
Ish smith is the GOAT
"Deservingly so. He was quickly on his way of becoming Jamaal, or even worse, ish smith. Lonely life on the road."
"don’t forget salary cap too.  steph for ish smith and a second, who says no?"
fun fact... Ish Smith is a point guard
"Most of Ish Smith teams were garbage. Yes, a starting lineup would be a contending team but it wouldn’t be as good as this"
Maybe Ish Smith ?
Ish Smith  Bruce Brown  Issac Bonga  Tony Snell  Felicio
"&gt; so depending on your stance on Russ, that will either be good or bad for the wizards  Second games of b2bs and games where we have missed our starting players have surprisingly been our best the past few seasons. Garrison Matthews and Ish Smith will pop off with random 30 point games lol"
"bro Ish smith is the one that whenever I tune in, he looks like what people think Lou Will is lol"
Ish Smith
"Westbrook doesn't qualify because he's not shooting enough 3's (this is actually a good thing, considering he shoots 30%).   But comparing him to them doesn't do them right. When it comes to TS% Westbrook is #180 out of 185, with an astonishingly low 44.9 TS%; It's really unusual for a player that has such a high usage to have this low efficiency. The other players around him are players like Ish Smith, Devonte' Graham, Kelly Oubre, etc. that use a lot less possessions than he does, so the total effect of their inefficiency is much smaller.  To have a player use star-level number of possessions with scrub level efficiency is practically unheard of."
"Booker has a history of stat padding and runs his stats up whenever hes down 20+.   Lavines teammates are always injured and hes the only reliable ball handler/shot creator on the team. He can be argued either way, so its a maybe for me.  beal is on the worst constructed roster in the league and he needs to score 35+ a game to for them to have a chance to win. His best teammate since Walls first injury has been Ish Smith..."
"So who's failing the running portion? SlowMo? Boban? Conversely, who's setting records? Fox? Ish Smith? Wall?"
The Ish Smith fan club won't like that
"Welp they were the same age (harden 26 in 2016, Beal 26 last year). Literally Beal’s PG was IT who’s not in the league and ish Smith. He also had like Issac bonga at SF and rookie Rui at PF. Keep lying to yourself"
He's better than or comparable to:      DJ Augustin   Reggie Jackson     Tre Jones   Yogi Ferrell   Tim Frazier   Dellavedova   Quinn Cook   Chris Clemons   MCW   Brad Wannamaker   Jeff Teague   Dennis Smith Jr   Ish Smith  Cameron Payne   Frank Ntilikina   Raul Neto      go fuck yasself
Ish Smith would like a word
Playing ish Smith with Westbrook is unforgivable.
"SAS is full of ish! If this was a white player he would only be saying how the player needs to be fined for missing work but because it’s Kyrie and SAS has been harassing Kyrie since he stood up for everyone before the bubble, it’s all this other bs.  Disney’s Stephen A. Smith needs to stfu!"
If we just gave an mvp award to ish smith that doesn't make him mvp caliber. Westbrook does not have an mvp caliber impact on winning
Too 5 of all ball handlers named “Ish Smith” for sure
I don't think Ish Smith is top 5 anything in the league
Too much Ish Smith rn you need the right amount of Ish
Ish smith is soooooo fast....
"To me, the move would be trading Ish Smith for a wing defender and then having Neto fill in those 12-15 minutes when Russ is off the floor. They have more than enough ball handlers that having 3 PGs is redundant"
They'd rather play players that have a real future with the team. Like 32-year-old sub-40% FG Ish Smith.
"For some reason they kept running Ish Smith l/Westbrook/Beal lineups when they had NO reason to. Don't get cute with it, Troy Brown/Avdija/Bonga aren't amazing but they're reason enough not to play Ish Smith in an awful defensive lineup scheme. Why would you play Ish next to Westbrook.."
"Ideally, you can at least construct an offensive roster with the team.  Starters: Russ / Beal / Deni / Rui / Thomas Bryant (I know he tore his ACL) - In a perfect world that's 4 shooters around Russ.  Bench: Ish Smith / Troy Brown / Mo Wagner / Issac Bonga / Robin Lopez - It's not a fantastic bench but whatever  I could have seen the argument that they could fight for the play-in but things have just fallen off a cliff."
  **Heat @ Wizards**  [](/MIA) **128 -  124** [](/WAS)  **Box Scores: [NBA](http://www.nba.com/games/20210109/MIAWAS#/boxscore) &amp; [Yahoo](http://sports.yahoo.com/nba/miami-heat-washington-wizards-2021010927)**  |**Team**|**Q1**|**Q2**|**Q3**|**Q4**|**Total**| |:---|:--|:--|:--|:--|:--| |Miami Heat|47|28|28|25|128| |Washington Wizards|44|27|15|38|124|  **TEAM STATS**  |**Team**|**PTS**|**FG**|**FG%**|**3P**|**3P%**|**FT**|**FT%**|**OREB**|**TREB**|**AST**|**PF**|**STL**|**TO**|**BLK**| |:--|:--|:--|:--|:--|:--|:--|:--|:--|:--|:--|:--|:--|:--|:--| |Miami Heat|128|46-93|49.5%|16-43|37.2%|20-26|76.9%|10|61|32|24|3|16|5| |Washington Wizards|124|44-99|44.4%|15-40|37.5%|21-28|75.0%|7|39|25|24|9|6|2|  **TEAM LEADERS**  |**Team**|**Points**|**Rebounds**|**Assists**| |:--|:--|:--|:--| |Miami Heat|**31** Tyler Herro|**16** Bam Adebayo|**9** Jimmy Butler| |Washington Wizards|**22** Garrison Mathews|**7** Moritz Wagner|**7** Ish Smith|
Dude I just saw Ish Smith drop 9 against the heat.   But seriously Jerami Grant is nice. Add is RoCo and Christian Wood and they probably pull it off.
Ish Smith is all about questionable layup attempts.
"Brooks closed the Philly game with Ish Smith too, imagine your team is struggling because of defense and a point guard who can't score and then thinking the solution is to put a 5'10 guy who needs the ball"
Not with that Coach lol. Would probably sub Kobe for Ish Smith 😂😂
"No. He deals with doubles and is an elite scorer from every level, plus he’s efficient, so other guys wouldn’t necessarily be able to do what he does. What makes him elite is obviously his ability to score at an efficient rate, but just as much so is his ability to put the ball on the floor and move with the ball, drive to the rim, and get to his spots and create his own shots consistently. There’s not too many in the league that can do it on his level, especially when dealing with doubles and having nobody else on the team to go to unless you like Ish Smith as your 2nd option."
"That's not the point, back in the days he was a ""great when he tries, meh overall"" defender and his teams could leave with it because he played with great defenders, now he's mostly a ""meh the one possession per game he tries, horrendous overall"" and he no longer plays with Paul George, Roberson and Steven Adams but with Thomas Bryant, Ish Smith and Rui Hachimura."
trade backsies? i’ll even throw in one lightly used ish smith
The embiid post up led to an and 1 layup on ish smith. An embiid post up against bryant is more likely to be an and 1 opportunity than a ben simmons layup against smith.
"Bro, no matter how much you may dislike Westbrook, how are you gonna tag this as “serious” then suggest Ish Smith and Raul Neto are better than him lmfao. This is next level shitposting"
"If only Scott Brooks didn't play him with Ish Smith and Robin Lopez, which would have definitely prevented him from chucking up contested threes, 18 footers and trying to dunk on Theis and Tacko"
"Man Pritchard and Ish Smith were the only serviceable PGs this game. Also, I love watching Bradley Beal play basketball."
"What bothers me about our defense is the overhelp. I mean, I get the concept. But you really don't need to help if Giannis is the primary defender around the rim and give away an open 3.  Like it feels like you could have Ish Smith driving on Giannis and the whole team collapses. We need to be smarter about this, good teams can abuse it so easy with players that couldn't finish around the rim anyway."
Brooks would try to go even smaller than you and put Ish Smith at the 5
(before tonight's games)  Player | FGA | PTS ------------|---|--- Caris LeVert | 120 | 116 Dillon Brooks | 119 | 118 Markelle Fultz | 104 | 103 Kelly Oubre Jr. | 101 | 84 Devonte' Graham | 99 | 80 Bojan Bogdanović | 94 | 94 Cole Anthony | 76 | 69 Gary Harris | 61 | 56 J.J. Redick | 55 | 49 LaMarcus Aldridge | 54 | 50 Tyus Jones | 54 | 50 Al Horford | 53 | 53 Aaron Holiday | 51 | 46 Tyrese Maxey | 49 | 46 Killian Hayes | 47 | 32 Ish Smith | 46 | 42 Aron Baynes | 45 | 37 Michael Carter-Williams | 44 | 36 Juan Hernangómez | 44 | 44 Derrick Jones Jr. | 44 | 42 Sekou Doumbouya | 39 | 38 Markieff Morris | 31 | 31 James Johnson | 29 | 26 Kendrick Nunn | 29 | 26 Jevon Carter | 28 | 22 Grayson Allen | 27 | 25 Brandon Goodwin | 27 | 26 Anfernee Simons | 27 | 26 Dante Exum | 26 | 23 DeMarcus Cousins | 24 | 23 Furkan Korkmaz | 24 | 18 Aleksej Pokusevski | 21 | 5 Mike Scott | 21 | 21 Terance Mann | 20 | 12 Matisse Thybulle | 19 | 18 Frank Kaminsky | 18 | 17 Lamar Stevens | 18 | 18 Kenrich Williams | 18 | 15 Ed Davis | 17 | 13 Jordan McLaughlin | 17 | 16 Chris Chiozza | 16 | 15 Chandler Hutchison | 16 | 13 Dean Wade | 16 | 12 Gary Clark | 15 | 12 Carsen Edwards | 15 | 13 Jerome Robinson | 15 | 15 Marquese Chriss | 14 | 13 Rodney Hood | 14 | 11 Drew Eubanks | 13 | 9 Nicolò Melli | 13 | 11 Amir Coffey | 12 | 12 De'Anthony Melton | 12 | 8 Aaron Nesmith | 12 | 8 Obi Toppin | 12 | 9 Malachi Flynn | 11 | 0 Draymond Green | 11 | 10 Stanley Johnson | 11 | 7 Adam Mokoka | 11 | 8 Georges Niang | 11 | 8 Bruno Caboclo | 10 | 6 Tremont Waters | 10 | 9 Mfiondu Kabengele | 9 | 5 Derrick White | 9 | 9 Josh Hall | 8 | 3 Elijah Hughes | 8 | 8 Kelan Martin | 8 | 2 Reggie Perry | 8 | 7 Robert Woodard | 8 | 6 Tony Bradley | 7 | 4 Kira Lewis Jr. | 7 | 4 Sean McDermott | 7 | 7 Yuta Watanabe | 7 | 6 Keljin Blevins | 6 | 2 Maurice Harkless | 6 | 3 Trey Lyles | 6 | 5 KZ Okpala | 6 | 5 Cody Zeller | 6 | 6 CJ Elleby | 5 | 4 Isaiah Joe | 5 | 2 Saben Lee | 5 | 4 Miye Oni | 5 | 3 Luka Šamanić | 5 | 4 Dennis Smith Jr. | 5 | 4 Jalen Smith | 5 | 4 Tyrell Terry | 5 | 2 Brodric Thomas | 5 | 5 Dylan Windler | 5 | 3 Bol Bol | 4 | 0 Devon Dotson | 4 | 4 Karim Mané | 4 | 2 Garrison Mathews | 4 | 3 Ty-Shon Alexander | 3 | 0 Terrance Ferguson | 3 | 0 Damian Jones | 3 | 2 Rodions Kurucs | 3 | 3 Darius Miller | 3 | 3 Theo Pinson | 3 | 0 Kostas Antetokounmpo | 2 | 0 Mo Bamba | 2 | 0 DeAndre' Bembry | 2 | 2 Vernon Carey Jr. | 2 | 0 R.J. Hampton | 2 | 2 Luke Kornet | 2 | 2 Nico Mannion | 2 | 0 Sindarius Thornwell | 2 | 2 Jaylen Adams | 1 | 0 Vlatko Čančar | 1 | 0 Torrey Craig | 1 | 0 Cristiano Felício | 1 | 0 Willy Hernangómez | 1 | 1 Nate Hinton | 1 | 0 Markus Howard | 1 | 0 Skylar Mays | 1 | 0 Malik Monk | 1 | 1 E'Twaun Moore | 1 | 0 Juwan Morgan | 1 | 0 Zeke Nnaji | 1 | 0 Anžejs Pasečņiks | 1 | 0 Paul Watson | 1 | 0 Keita Bates-Diop | 0 | 0 Deividas Sirvydis | 0 | 0 Edmond Sumner | 0 | 0
Using a 40 attempt qualifier:  Caris LeVert 138 from 145  Aron Baynes 37 from 45  Aaron Holiday 46 from 51  Cedi Osman 106 from 105  **Killian Hayes 32 from 47**  Markelle Fultz 103 from 104  Cole Anthony 69 from 76  Michael Carter-Williams 36 from 44  Devonte Graham 80 from 99  Ish Smith 42 from 46  Gary Harris 56 from 61  Kelly Oubre 84 from 101  JJ Redick 49 from 55  Dillon Brooks 129 from 132  Tyus Jones 59 from 63  So Killian Hayes at 0.68ppa is the least efficient shooter in the league so far this season
"He was barely handling the ball, Ish Smith had more plays in the 4th quarter."
"We need an above average IQ coach and our roster would be fine. We’ve got one of the best distributing point guard in the league and enough shooters to fill out the rest of the lineup. The problem isn’t any of the players, it’s the dude who plays Russ with Raul Neto and Ish Smith, the dude who sits Beal for a long stretch while he’s got 57 points in 3 quarters, the dude who loses us games is Scott brooks"
Ish Smith looked better in the 4th than Beal lmao
"The Wizards actually came back from 10 down in the 4th without Beal and as soon as Beal came back, their offense fell off a cliff. He was definitely forcing shots and Embiid was literally eating them.   It was a little annoying to then see Twitter say ""Free Beal"" as if his team let him down. Ish Smith had one hell of a fourth quarter."
Ben Simmons was getting lit up by ish smith
"DSJ can really turn out as a great back up point guard. He is lightning quick, can push the tempo, I want him to be a bit more aggressive going to the rim, and clean up some of the forced 3pt shots. I think he can become something like Ish Smith with better playmaking skills, but if he figures out his 3pt shot, he can be a legit starting point guard.(his defence is actually ok)"
That's a pretty harsh assessment. He wasn't an NBA point guard yet but he was the closest thing that squad had to one. Until the Ish Smith trade he was playing too many minutes against starters but still only turning the ball over twice a game. If Tony Wroten or Kendall Marshall had been able to make it back from injury then TJ could have slid into the backup role sooner.
