"💖 Facts I love about Trae 🥵💖 :   2017: He's way to short he's never gonna be good in the NBA. Just because he plays like Curry doesn't mean he should be a lottery pick. We're watching the next bust of the NBA everyone.  2018 (Trae Young gets drafted): Nice so every small point guard that can shoot 3s is automatically Steph Curry? So glad my team didn't draft him. Don't cry if he's a bust when I told you so.  2018-19 season 1st half: He can't shoot he's just a confident shooter. His efficiency is so bad and he's not a good scorer. 2018-19 season 2nd half: He's a ball hawk he should pass more to his teammates. And he's also playing bad teams right now. He's gonna be out of the league soon, never gonna be an all-star  2019-20 season 1st half: He's putting up empty stats he can't play defense. He's can't carry his team to wins. His defense is gonna be a problem. Hawks should trade him for my team for a few picks and a mediocre player because he can't play defense and his efficiency is garbage. 2019-20 season 2nd half: He shouldn't have been an All-Star with one of the worst records in the East. He hasn't even proven he can win. He's only proven that he can lose.  2020-21 season currently: He needs to stop foul baiting. It's not fun to watch and he is ruining the game with it. He can't win without shooting free throws. Once he's in the playoffs he's gonna average 19 points. He can't score on hard defense. Beal should be an All-Star starter over him because he clearly isn't averaging empty stats and also #FreeBeal even though he chose to be on that bad Wizards team and plays to win not to score.  How many times does Trae have to prove you guys wrong again? It's always been popular to hate on him. People are so mad that he isn't a bust that they find every way to hate on him.  Of Course he's not gonna be able to win in his second season. You're drafted into a rebuilding team. Almost no one can carry their team to winning in his first or second season. The Hawks literally had a g-league roster. John was out for 25 games so Jabari Parker was their second player for 25 games. Cam, Huerter, Hunter were all too young to be impactful. Alex Len isn't a starting caliber center and wouldn't even get minutes on most teams. Of Course he can't win with that team. Even Luka can't.  Also people who used empty stats last year have clearly died or something. I hear absolutely no one calling Beal Mr. Empty stats. Even though he is in his 8th season and still can't win. His usage% is also the highest in the league right now and he doesn't pass a lot. #FreeBeal is stupid and idiotic. He chose to be on a bad team and score a lot. Keep the same energy with Beal as you all did with Lavine, Young, Booker and every young guy. And he just said he want to stay with the wizards. Beal is clearly doing it to break scoring records. He doesn't want to win he just wants to score.   Steve Nash: ""That's not basketball"". Also Steve Nash 2 years ago: We're as similar as players from different eras can be."
Jabari Parker really is a bummer. I was really hyped about him and I thought he was coming around before the injuries
"Dude I'm done with you after you called fucking Jabari Parker a defensive Stalwart. Travis only signed players on EXPIRING CONTRACTS, that wouldn't eat at our cap space or require us to cut any of our young core. You expected him to do something stupid like signing Al Horford to a 4 year extension and letting Reddish walk because he had a rough rookie year? They cannot run a offense with Trae and Collins, you have to be a moron or a manchild laughing to himself over this weak troll attempt. What has Luka accomplished other than losing out of the first round? We're handing out participation trophies, I can gloat how Luka's team is 11th place and most likely gonna miss the playoffs if they don't make a trade soon while Trae's is in 6 and only has the Cavs, Magic, Heat, and Knicks to worry about. Gallo been more productive than a 7'3 big that gets murked by Cousins."
lol are you serious? Last years mavs were *slightly* better? Feel free to hop off luka’s dick. Imagine comparing post injury Jabari Parker to Porzingis lulz
lol how do PPG and APG not matter for a PG? Trae’s second option for 25 games was post injury Jabari Parker that year. It’s hilarious when Luka stans point to the hawks record that year and act like Luka and Trae had identical or even similar supporting casts. Now trae has more weapons and magically the hawks are winning... hmm
Jabari Parker in 16-17. Though you could say it's injuries that prevented him from continuing his progression. That season I remember I thought he should've been an All Star until the ACL injury.
"The worst I have ever seen was Jabari Parker when he was on the Bulls, he just couldn't be arsed at all. Thank fuck we managed to trade him away."
"No chance he would’ve been the first pick if Embiid was healthy. Even with Embiid’s back injury which was known at the time, (and made him miss the Big 12 and NCAA tournaments,) he was the consensus #1 pick. It was only when his foot injury became known right before the draft that he slid.   Wiggins was actually projected to go third bc Milwaukee really liked Jabari Parker"
The Bucks were one pick away from having him and Giannis  They picked Jabari Parker (who to be fair was good before his ACL injuries)
Imagine if the Bucks built a time machine and picked Embiid instead of Jabari Parker
"Pretty much their entire team? Hawks had to run VC at PF for significant minutes lmao. Jabari Parker was our 2nd best player, and Alex Len was our best C over the entire year, and he *just* found a job.   But anyways I’m not gonna argue this point with you anymore cuz your either trolling or you just don’t get it lol"
"Wym bruh everyone knows the refs are biased af in favor of the face of the league, Jabari Parker"
"I mean it can also have a lot of truth. For all the guys you listed there were also guys like Monta Ellis, Andrea Bargnani, Antoine Walker. In the current era you would point to guys like Hassan Whiteside, Enes Kanter, Jabari Parker. The reason we forget about them is that teams eventually see how little they impact winning and they wash out of the league."
Jabari Parker before the injuries with defense?
"Coming into the league, Zion, Andrew Wiggins, Jabari Parker, Anthony Davis, Kevin Durant, and Greg Oden all had more hype than Luka."
and then lost to Jabari Parker and OJ Mayo
"Unless Oladipo resigns which is unlikely in my opinion, the rockets are going to end up trading Harden for essentially 4 FRP (3 unprotected) and 4 FRPS. That sounds good on paper but why take the unknown over the known? The pick could turn out to be a Fultz, or Wiggin, or Jabari Parker, or Anthony Bennett, all of whom were top 2 picks. I think this was partially a salary dump, the rockets didn’t want to take back long contracts and they elected to take chances on low cost high picks."
I could swear I was told Wiggins and Jabari Parker would be the next legendary rivalry
"Expectations are different though. At some point, yall gotta throw the #1 pick expectations out.  Will he ever live up to his draft expectations? Probably not. Can he still become a good player? Absolutely. And before you bring up his contract, what would you do if you were Wiggins and were offered that contract? Say no? Lol.   Like, I don't see people shitting on guys like Marvin Williams, Evan Turner, and Jabari Parker anymore. 3 guys all picked #2 who have become okay role players."
"He's not slow-footed at all. He's like Jabari Parker. Big skill, very little team contribution. He just sucks"
"That's what was terrifying about being a fan of the Process.  They could do everything right and just have bad luck in the draft. If the Sixers get Wiggins or even Jabari Parker in that draft instead of Embiid, the process would've pretty much failed and been routinely mocked even though the thinking was, imo, correct."
A long time ago I said Gianis would be a good second option to jabari Parker so I don’t judge people for bad takes lol.
"And all these years later, still outplaying Jabari Parker"
I remember watching him outplay Jabari Parker in the Illinois high school state tournament and thought wow why doesn’t anyone talk about this Sterling Brown kid. Pretty cool that he’s made it in the NBA as a solid rotation player
"Here are some things that were going on in that season just to put into perspective how long he was a rocket  ____ Kobe was somehow willing the Lakers into the playoffs  _____ Melo was a legitimate MVP candidate  _____ KD had just won his 2nd of 4 scoring titles ____ Paul Pierce and Kevin Garnett were in the midst of their last season as Celtics before being traded to the nets ____ Kyrie Irving was coming off of a very strong ROTY season _____ Giannis Antetokumpo was averaging 9 points, 5 rebounds, 1 assist, and 1 block per game for Filathlitikos in the Greek League. He was a Greek League all star that season _____ Jabari Parker, Aaron Harrison, and Julius Randle were the 3 highest ranked high school recruits (MaxPreps) _____ There's a lot more and if you think of anything else please add it"
"BPA&gt;Fit has backfired too.   ATL drafted ""BPA"" Marvin Williams when they already had Joe Johnson, Josh Smith, Al Harrington, and Josh Childress as wings. In doing so, they passed up ""better fit"" prospects like Chris Paul and Deron Williams, even though they badly needed a PG.   Then the next year they drafted another ""BPA"" forward, Shelden Williams, instead of ""better fit"" Brandon Roy. By the time they realized their mistake, they had to trade Shelden Williams for a washed, overpaid Mike Bibby.   Or how about MIN drafting 2 ""BPA"" PGs in a row (Rubio, Johnny Flynn)? Or the Clippers drafting 2 PFs in a row (Chris Wilcox, Melvin Ely), when they already had Elton Brand and Chris Kaman?   DET drafted BPA Darko when they already had Ben Wallace at C, instead of better fit Chris Bosh to replace Elden Campbell (though they eventually traded for Sheed to fill the PF spot).   PHI went BPA Fultz when they already had Simmons at PG, instead of better fit Tatum to replace Robert Covington/Dario Saric.   MIL chose BPA Jabari Parker when they already had Giannis at PF, instead of better fit Embiid to replace Zaza Pachulia.   NY picked Jordan Hill when they already had David Lee at PF, instead of better fit Demar Derozan to replace Jared Jeffries.   UTA picked BPA Trey Lyles when they already had Gordon Hayward and Derrick Favors at forward, instead of better fit Devin Booker to replace Rodney Hood.   ORL drafted BPA Mo Bamba when they already had Vucevic at C, instead of better fit Collin Sexton to replace DJ Augustin.  You can find examples to support either approach. There's no single correct way."
"That's because we now have an NBA center in Capela and (had) possibly the best backup 4 in the NBA in Gallo. Last year John was getting minutes over the corpse of Vince Carter, Damion Jones, Jabari Parker and Bruno Fernando. He absolutely should be getting less minutes now that we have a better roster to feed."
Ben Simmons is the Jabari Parker of defense... he doesn't get paid to play offense /s
Jabari Parker
Next AD looking more like next Jabari Parker tonight
"""They dont pay players to play defense"" -Jabari Parker"
Jabari Parker was so good until he had that ACL tear. His career went over a cliff along with his knee.
Jabari Parker (Although I think some of that is due to injury)   Tyler Ennis- Loved him at Syracuse and although he didn’t have great shooting mechanics I thought he could become a franchise PG
"Granted some of these guys are still respectable NBA players, but I thought they all had All-Star/All-Defense upside at the very least:  Jabari Parker  Nik Stauskas  Nerlens Noel  Kris Dunn  Frank Ntilikina  Terrence Ross  Evan Turner  Perry Jones III"
"Fox,Hield,Bagley,Barnes,Haliburton,Jabari Parker,Whiteside."
"I really wanna see Randle make an all star appearance. I was a big fan of the very hyped 2014 Draft where the 5 biggest names were Wiggins, Jabari Parker, Embiid, Aaron Gordon, and Julius Randle and outside of Embiid all of those guys have underwhelmed to some extent for what we thought they would be. Randle is playing like the guy I thought the Lakers drafted in 2014 and I hope he keeps it up"
After Jabari Parker came back from his first ACL he honestly looked more explosive than before.
Jabari Parker. Thought he was better than Wiggins and was a great team player... oof
Jabari Parker.....legit thought he could be a great scorer.  Glad I don't evaluate talent for a living
Andrew Wiggins and Jabari Parker
He's such a hater! Completely ignores the fact that Utah has built their entire defense around Gobert and he's a top 2 or 3 rim-defender since being drafted.  This is why Jabari Parker said points get you paid as a No.2 pick and is currently struggling to get in the rotation in Sacramento. Such a bad example for young players.
"You must have forgot that you have Jabari Parker on your team.  Literally all the issues you just listed, but add two ACL tears and devout adherence to his personal mantra ""They don't pay me to play defense""."
Jabari Parker?
lol if you swap Trae and Luka both teams have the same results. Mavs in playoffs and hawks missing. Luka’s second option was KP. Trae’s second option was post injury Jabari Parker for the first 25 games
"More importantly, look at who they replaced from the course of last season. Evan Turner straight up retired afterwards, Parsons might as well retire too, Dedmon was waived and stretched by the Pistons, Vince Carter, Jabari Parker and many more got big minutes at some point last season."
"&gt;Well Giannis needs numerous shooters around him to be effective  This is like saying ""AD needs to be playing with LeBron to be effective."" Just a totally asinine, reductive statement.  Giannis' career didn't start two years ago. He put up 27/10/5 starting alongside guys like Thon Maker/John Henson/Jabari Parker/Eric Bledsoe, under a coach that literally discouraged shooting 3s.   Even after Bud came aboard, it's not like he's been playing with a murderer's row of elite shooting talent. It's just that they went from literally putting the worst possible team/coaching around him to saying ""hey, maybe we should try to surround him with some shooters"" and they turned into a 60-win team basically overnight with Giannis as the undisputed best player.   AD *HAS* played with ""a playmaker"" before LA. He's also played with ""numerous shooters."" I'll gladly admit that the Bucks supporting cast was better than the Pels' at their peak (although the gap is nowhere near as big as people make it sound) but giving a player the benefit of the doubt for doing less with less is not a compelling argument."
Giannis for sure. He was 19 years old his rookie year and doesn’t have a concerning history with injuries. The only one with an MVP and the only one with a DPOY.  Giannis also doesn’t have a positive correlation to winning his rookie year so you have the option to tank his first season. Just make sure you pick Embiid instead of Jabari Parker then boom. Now you’ve got both of them.  Second pick would be Davis. AD was a 19 year old rookie whereas Joel was 22 and needed severe minute restrictions right from the start. Davis’ career in whole looks better at this point. If I’m able to go full process in this scenario and plan to tank then maybe I go Embiid though.
"I remember watching that team early in the year play Duke who had Jabari Parker, Rodney Hood and Quinn Cook and although it wasn’t a blowout, if you watched the game you could tell how far apart those two were and Duke was considered a title contending team that year but it wasn’t even close"
"Why can’t this logic be used every time a team drafted a player, and a better player was drafted after him? In 2014 the Bucks picked Jabari Parker, are they crazy for not picking Jokic then? He was apart of that draft class. Sometimes when NBA players get drafted, they turn out better or worse than expected. To answer your question, yes, NBA GM’a do understand basketball, but I’m hesitant to say you do."
I thought Jabari Parker would run the league.
The was posted by Jabari Parker
Jabari Parker did
"You said ""at this age"" though. Hunter is impressive for a 2nd year player for sure, he's a damn good player, but 23 isn't super young by NBA standards. Jabari Parker is 2 years older than him."
"The 1-and-done players seem to stay young for an unreasonable amount of time lol. Jabari Parker is 25, etc"
"I can't believe Jabari Parker fell so far, I thought he was gonna be at least diet Melo when he was a rookie."
"For the uninitiated, the Kings roster. (Positions could be debated)  PG: De'Aaron Fox | Tyrese Haliburton | Jahmi'us Ramsey  SG: Buddy Hield | Cory Joseph | Kyle Guy | Justin James  SF: Harrison Barnes | DaQuan Jeffries  PF: Marvin Bagley III | Jabari Parker | Nemanja Bjelica  C: Richaun Holmes | Hassan Whiteside (Out) | Norvel Pelle  Whiteside's out for Health and Safety Protocols. Luke Walton's not a good coach, but how the heck is he supposed to win games with that roster? Fox is good, Hield will get his, Barnes is solid, and Bagley/Holmes are not terrible but they're below-average starters. Somehow though, their bench is even more dire. How many of these guys would even start on a good team? I think it's a bit extreme, but only Fox and Hield/Barnes could start for certain teams. I don't think anyone past Bagley/Holmes/Haliburton would crack a rotation, and some of those (like Bagley) would even be questionable."
There's no universe where I sign Jabari Parker without planning to play him.
Could’ve easily happened too if the bucks just picked him over jabari Parker
I think the Bucks had their heart set on Jabari Parker.  That's what I read at the time.
Not enough Jabari Parker
https://www.youtube.com/watch?v=Bo2Wl4AChq0&amp;ab_channel=NiTringoNBA  https://www.basketball-reference.com/boxscores/pbp/201601290MIL.html  pretty sure this is the box score for that play/game  it shows that it's a turnover on Jabari Parker for offensive goaltending
"I love Lowry but Embiid is 26 and Simmons is 24 we could be in contention for the next 6-7 years if we continue to build depth around these guys. To do that though you need to retain and develop our picks.   I just can't give up Shake, Maxey, or Thybulle for a 34 year old Lowry. Like Thybulle could easily replace Danny Green as a starter next year. Maxey's statistical profile ironically mirrors a young Lowry. Maxey isn't quite ready for the rotation yet but I'm projecting him to be a starter in this league and I think like lowry he has the tools to become a good 3 pt shooter and for a guard he doesn't really have any other holes in his game. I think he'd be playing better if we didn't have Dwight packing the paint.   Shake is actually already valuable for us. He's also hit a wall but how many combo guards with 7 foot wingspans and all around skill set are actually out there? Not many. Shake has also been defending at a high level and whereas in the past he's excelled shooting it and struggled getting to the rim, this year he's been excelling getting to the rim and struggling shooting it. So the best version of Shake probably hasn't been seen yet.   I think we should bring in a stretch 5 maybe Demarcus Cousins and trade for Jabari Parker. High end stuff, Otto Porter and Evan Fournier.   The most disappointing part of our roster has been the dead weight we're carrying in Tony Bradley, Poirier, and Terrance Ferguson. Those guys just bring nothing to the table. It makes no sense we're just keeping them when there's no chance of them playing or ever being useful."
The combination of Giannis gravity and jabari Parker decision making in pick and roll defense creates quite the driving lanes
Jabari and Giannis played the same position for the same team which would have stunted Giannis' development. Parker and Wiggins were seen as generational talents heading into the draft
Blows my mind like Jabari Parker is 25.. like wtf?
"How is he a “nobody”? You know who he is, We know who he is. Jabari Parker was and is a known name. The guy isn’t a nobody lol"
Doubtful. I know the bucks liked Jabari but Wiggins would have gone 2nd at the time for sure.  We would have picked Parker or Exum probably. Which is arguably worse
I love MyTeam cause so much of it doesn't make sense. My 85 overall Jabari Parker is the greatest player of all time.
"I'll take your example further! The Warriors make it to NBA Championship!!!  Wiggins turns 2013 POTENTIAL into a REALITY and becomes MAPLE JORDAN  Lakers try and sign Jabari ""Carmelo Anthony"" Parker to stop Wiggins but it's no use. They also sign Noah ""Chris Bosh"" Vonleh but he never leaves the bench."
I read Kareem Abdul Jabbar as Jabari Parker at 1st and I was left speechless until I re read the post 😂
That Jabari Parker trade gotta be up there as well
"Jabari Parker, if he's still in the league"
Jabari Parker.
"Jabari Parker had some highlights. I mean, he was never an impactful player, but he did some fun stuff on the court"
Wiggins and Jabari Parker. I thought they'd be this generations Lebron and Carmelo by now.
"Sacramento please.  Take Cory Joseph, Jabari Parker, and Nemanja Bjelica."
Jabari Parker was my favorite college basketball player ever. I was convinced he was going to at least be a 25 and 8 guy on that Bucks team. I'm also a huge Giannis fan so my expectations for that team fell apart soon after. Nice to see the Bucks having some success but man I feel bad for Jabari
I had so much faith in Jabari Parker becoming the next Melo man :(
"Even crazier, his ACL's never rehealed properly after the injury--- so he basically didnt have any.   Jabari Parker has also torn both of his ACL's, but I think his healed correctly."
"Through 21 games they're 1 win better than the Hawks were last year with their best player being the worst defender in the league, 2nd best player being Jabari Parker, playing 2 rookies who stunk at the time heavy minutes, and a 40-year-old Vince Carter."
"I remember this   &gt; Three years later, Middleton channeled that same competitive rage into a higher-end roster battle: against Antetokounmpo, for alpha status in Milwaukee. In the winter of 2015, Kidd sensed an unspoken tension as Middleton, Antetokounmpo, Monroe, and Jabari Parker felt out a hierarchy. He wanted it in the open. He interrupted a film session and asked every player on the roster, one by one, who was best among them.  ""It was awkward,"" Middleton says. Most nominated Middleton. Antetokounmpo refused to go along. ""He was stubborn,"" Monroe says"
Jabari Parker
"Yeah I’ve been watching basketball for over 15 years the 76ers are in the position they are in because teams incorrectly scouted Wiggins and Jabari Parker as better players than Embiid because of his injuries. They got lucky he fell to them.   What if he didn’t fall to 3 and was correctly evaluated as the best prospect and picked one.  Again it’s all luck.  And even still the 76ers aren’t winning a title with him and Simmons because you need a top 5 player to win a title and he’s not that.  So, yeah I guess I’d killed for Philly success but also the Magic have made it to the finals more recently than Philly and it looks like that’s not changing anytime soon so really splitting hairs."
