"I looked up the roster changes just out of curiosity (roughly organized by minutes played)  -  **Atlanta Hawks:**  * Out: DeAndre Bembry, Damian Jones, Vince Carter, Jabari Parker, Alex Len, Allen Crabbe, Jeff Teague (not a roster subtraction but Hunter/Reddish have played less time this season due to injuries)  * In: Clint Capela, Solomon Hill, Danilo Gallinari, Bogdan Bogdanovic, Tony Snell, Rondo/Lou  -  **Mavericks:**  * Out: Seth Curry, Delon Wright, Justin Jackson, JJ Barea, Courtney Lee  * In: Josh Richardson, James Johnson, Wes Iwundu, Nicolo Melli, a pu pu platter of bad rookies (Green, Bey, Terry, Hinton)  -  Amazing how the Hawks basically replaced 7 bums with ~6 genuine rotation players ranging from solid to great. The Mavs definitely downgraded, and Josh Richardson gets worse every day he's away from Miami."
"As a Jokic fan I have some bias but I’ve always had a negative attitude Embiid, and I think a big part of that is the Hulu ads and how everyone has just treated him like a god since he’s come into the league. Also bitter that the bucks took freakin jabari Parker over him"
The jabari parker special
Should've gave an honourable mention to Jabari Parker
"I see where you’re coming from, but Idk if stamina is always the issue. Some guys just don’t take pride in playing defense. Jabari Parker legit said “They don’t pay players to play defense.”  I’m sure he’s not the only one to think like that, he’s just dumb enough to come out and say it"
"&gt; Two superstars went head to head pretty much equally and it just came down to which secondary guys delivered down the stretch.  Curry narrowly outmatched Tatum, and Kemba narrowly outmatched Wiggins. I think it came down to the rest of the supporting cast. The biggest difference came down to Marcus Smart vs Kent ""Not Smart"" Bazemore, and Jabari Parker being a pleasant surprise for y'all. Didn't think a Jabari vs. Wiggs duel would take place in this manner."
"Totally ignoring that Philadelphia went out and got shooters (Seth Curry, Danny Green, George Hill).  Thompson is a fine Kanter replacement comparison but Robert Williams and Daniel Theis are 2 totally different players where the offense is run differently and have different defensive styles.  We also don’t have Hayward and we have yet to see what Fournier (and Jabari Parker if you want to include him) can bring to the team at full strength.  This is also ignoring the context that Simmons was injured and didn’t play in the series last year, and Embiid is dominating way more this season than he has in the past. Plus Jaylen Brown has emerged more as a ball handler (with Hayward’s departure).  Both teams are totally different."
"Well he did put Parker in, and it paid off.  Never thought Jabari Parker would be the difference maker in a close game where we had a duel between Tatum &amp; Kemba vs Wiggins &amp; Curry."
I wonder if Tatum thinks about Parker not wearing a mask after being COVID positive   https://www.cbssports.com/nba/news/kings-aware-of-reports-jabari-parker-was-spotted-playing-tennis-without-a-mask-after-positive-covid/
"Isn't it though? You were originally offended by a shitpost reference to the Jokic/Embiid debate. The big post here yesterday about the Windhorst podcast and whatnot.  Being MVP-level efficient day-in, day-out while also carrying an otherwise-mediocre team in a tough conference is a ridiculous feat. Efficiency and stats like that happening over such a long stretch is so much harder than doing it with long rests. Just by the law of averages, Jokic should be regressing *but so far isn't*. Every NBA-level player has it in them to be great over shorter periods.  Again, your question is irrelevant to anything and overly-reductive. Pretending that anyone was comparing Lebron James to Jabari Parker is dishonest and not worth responding to."
"And also guys tend to up their defensive game under Brad. If he can turn Kyrie into a decent defender, a long guy like Jabari should worst case be serviceable in the system. Having proven scorers on the bench (Fournier &amp; Parker) is going to be huge down the stretch."
Jabari Parker was absolutely a factor in the win which Was a pleasant surprise.
 Luke Walton made us believe Jabari Parker wasn’t a NBA caliber player  He’s fat and slow but he still got buckets out there
All abooooooard the irrational Jabari Parker hype train CHOO CHOOOOOOOOOOOO
Glad to see Jabari Parker on the court. Was never a fan of him but sucks when injuries effect careers.   I think hell be a good pick up for the C's.
"He's being paid to defend and playmake, Jabari Parker once said NBA players aren't paid to play defense. Draymond is being paid to play defense not score"
"What an awesome game! I thought tonight may be the best Kemba's movement has looked this season. He just looked different. Huge performance from him. Tatum showed why I think he'll be competing for some MVPs down the road. Fantastic game by him. Jabari Parker was really big offensively. Excited to see him with Timelord, Fournier, and JB back.  Hope Juan is good and didn't suffer a concussion. Fantastic hustle by him. Curry is insane to watch, from the circus shots to those tough 3s like that one from the corner at the end. Hope he avoided any longer term injury on his ankle. Super fun to watch him as always.  Just a great win and it's nice seeing the win streak continue."
"I can’t believe that Jabari Parker has made a positive imapact immediately, but I’m not complaining. This is a candidate for game of the year for sure. Hope JTA is okay."
JABARI PARKER IRRATIONAL HYPE TRAIN NOW BOARDING CHOO CHOOOOOOO
2. Jabari Parker the closer 😈
Didn't Jabari Parker have a ton of hype around him? Like he was supposed to be a superstar. What happened
It's feel good to watch Jabari Parker on a good team. Injuries can rob you of athleticism but he can't take away your game. He's a baller!
Listen man Jabari Parker has a lot of issues but we need bench buckets and he's clearly giving them to us
"I just got out of prison, is Jabari Parker 1st or only 2nd team all-nba?"
beautiful series of fakes by Jabari Parker
Signing Jabari Parker off the scrap heap was the 2nd best move Ainge has made this year (after trading away Jeff Teague of course)
"Your Celtics are in 5th place, with only 2.5 games separating you from the 8th spot and a play in.   And your idea of bringing in help was Jabari Parker, who hasn't been a NBA factor in years.  Good luck, those footsteps are getting louder.    And yes, I'm old enough to have seen the Sixers win their title,  as well as Boston win theirs.  The only guy on your team with the same mentality as your title winning players is Smart.  Tatum is soft and Brown is crazy inconsistent.   Kemba is a black hole and you have no interior defense or presence.   The team is soft as hell.   The Knicks, Heat and Hornets are gaining fast.  Imagine falling behind the damn Knicks in the standings but still being cocky?   LOL"
We will see your LaMarcus Aldridge and raise you a Jabari parker
Would you rather have 60 games of lebron or 82 of Jabari Parker?
oh boy can't wait to see jabari parker
Mo Wagner was cut for Jabari Parker. He was the Celtic’s 5th string center.
Oh god no. Jabari Parker plays worse defense than IT4.
Has Jabari Parker changed his mind?  Will he agree to defend after all? ...
"I just love the development of Julius, at UK I was so high on him and thought he’d be a great pro, no questions asked.   I was watching the draft with my college roommates, and at that point it was pretty damn close to a sure thing that Wiggins was the first pick and the Bucks were taking Jabari.   I wanted Embiid so badly over Jabari. I was so adamant that Jabari was not going to be the player he was billed up to be. He was a great scorer in college because of his size and shooting ability for that size. College players that are 6’9” with any semblance of shooting and handling naturally dominate at that level, but I saw that Jabari was slow(er compared to NBA wings) and didn’t have the strength or defensive chops to play the 4.   They all thought Jabari was going to be the god that saved our franchise, and they basically laughed me out of the room because I said if they pass on Embiid, I’d much rather have Julius Randle than Jabari, because he at least has the strength and post scoring to make an impact, and I saw Jabari as Derrick Williams 2.0 (which, I was extremely wrong on that one and thought Williams was going to be better than Kyrie, so this story isn’t to make it seem like I’m NBA Todd McShay).   But anyways; they basically called me stupid because I thought Embiid and Randle would be better than Jabari.  Randle broke his leg his rookie year, and then averaged 11 ppg on 43% shooting in his 2nd year, while Jabari averaged 14 ppg on 50% shooting, the next year Jabari averaged 20ppg (top option on shit team) near the same splits, while Randle was at 13ppg.  They gave me shit after shit after shit like backed up sewers about how dumb I was that I still thought Randle was better. Admittedly, though I still believed in him, I’m stubborn as fuck and wouldn’t change my view that Parker was better.   Even though he just had his 1st 20 point season in what they thought was one of many, and lowly Julius was better at beyblades than basketball.  However, slowly but surely Randle developed while Jabari got hurt, stagnated, and ultimately regressed.   Who knows how Jabari’s career would’ve gone had he not gotten hurt. I, for one, (maybe due to my irrationality and stubbornness of thinking Julius was always better) don’t think Jabari would’ve even been an all-star. He was okay at mid-range, which has now been phased out, and every other aspect of his game was “meh” at best (his finishing ability) to ultimate dog shit tier (his defense).   He would’ve never been strong or quick enough to be a starting 4, even though offensively he wasn’t horrible in that role, but on defense he was worse than syphillis before antibiotics.  Randle on the other hand, is such a graceful spinner that they show his video to teach washing machines how to operate. The rest of his game did a 180° spin and caught up with his spin cycle.  Anyways long story short, fuck you Chris, Wyatt, and Keane. Julius is now an NBA GOD and Jabari got cut by the fucking Sacramento Kings, which Randle would never.  Also moral of the story 2.0 besides sticking it to my roommates, any player that seems like Derrick Williams 2.0 who scores because he’s 6’9” with good but not elite tier athleticism for his height and not many other skills will probably be NBA bench fodder, because he’s no longer the most athletic player on the court, he’s now 10th in that category. Those players just don’t translate.  I know I’m high and wrote a ton for a draft day anecdote, but it’s worth it because now I can proudly yell in my Captain Holt voice “VINDICATION!!!”"
Is this how far Boston has fallen? They signed Jabari Parker?
"You're very generous putting Romeo and Grant Williams in that first tier. Romeo needs a lot more run until I feel comfortable calling him ""solid"", and Grant needs a very specific defense-only assignment against a bigger player that's not very quick, otherwise he's useless. I think they are overplaying Romeo right now to try to jumpstart him getting re-acclimated and also because Fournier is out. I expect to see some DNP for Romeo over the next few weeks. Not a knock on him but I don't know if he's ready to be a major piece yet.   Nesmith has to go down a tier as well, he's just not making any progress. He has flashes of NBA level play, but really he's just running around out there and hasn't demonstrated the lights out shooting he allegedly can do any more than Carsen.   In any case, Jabari Parker has lost more basketball ability than Wagner ever had, so I'm sure it can't be any worse."
"Lol calm down dude you don’t need to get that emotional about a comment that was designed to be informative. But just for you, below is a quick list of major injuries dating back to 2015. I'm not even bothering to include every single one just because that would take too much time and this is enough to illustrate the point.   &amp;#x200B;  **2015**  * Kevin Durant foot Jones fracture * Jrue Holiday fractured tibia * Carmelo Anthony knee surgery, patellar tendon * Russell Westbrook surgery broken hand * Chris Bosh blood clots * Dwight Howard knee surgery knee edema * Derrick Rose surgery torn meniscus * Jusuf Nurkic ankle sprain, missed 37 games * Brandon Jennings achilles * Wes Matthews achilles * Julius Randle broken leg * Kemba Walker torn meniscus * Jabari Parker ACL * Paul George broken leg (olympics, missed NBA season)  &amp;#x200B;  **2016**  * Anthony Davis surgery for torn labrum and knee surgery for patellar tendon * Jrue Holiday orbital fracture, surgery * Mike Conley lower back fracture and achilles tendinitis  * Marc Gasol foot fracture, surgery * Eric Bledsoe torn meniscus * Manu Ginobli TESTICULAR SURGERY due to impact * Michael Kidd-Gilchrist shoulder surgery * Blake Griffin torn quad and broken hand * Al Jefferson torn meniscus * Jarrett Jack torn ACL * TJ Warren fracture foot * Eric Gordon surgery broken finger * Joakim Noah dislocated shoulder  &amp;#x200B;  **2017**  * [Fuck it, I'm getting tired of summarizing all this - just watch this video.](https://www.youtube.com/watch?v=I9EVSvRofOk)  &amp;#x200B;  **2018**  * Hayward broken foot * Cousins achilles * John Wall achilles * Kyrie knee surgery * OG Anunoby torn ACL * Jabari torn ACL * Porzingis torn ACL * Sefolosha torn MCL * Mike Conley left heel surgery * Jeremy Lin ruptured patellar * Dion Waiters severe ankle sprain * Roberson torn patellar * Reggie Jackson severe ankle sprain  Alright I'm stopping there, this became a tired exercise and I don't have it in me to keep going. At this point this should just be a main post."
"I remember the hype around Wiggins n Jabari Parker as the best draft class since '03. And they were compared to LeBron and Melo respectively. God damn, it sounds blasphemous in hindsight."
I forgot Jabari Parker existed
Jeff Teague for Jabari Parker. Exchanging legends.
Simple: The end of Boston's bench is worse than Jabari Parker.
I feel like I haven’t seen or heard the name Jabari Parker in a long time and the last time was probably in that Gambino song
Jabari Parker couldn't hang in a single lineup on the absolute shittiest of Hawks teams and he publicly whined while doing it I don't comprehend how he is still landing places
TIL: Jabari Parker was a free agent
"What the fuck! I? have a sleep in today (Saturday morning in Aus) and I come online to read this, my Celtics have signed Jabari Parker, DWade has an ownership in fucking Utah!??  Seriously though, I hope Mitchell is alright. Really want them to do well this post season."
Well unfortunately you picked up Jabari Parker instead.
Have you seen Jabari Parker
"It's when they fix your ACL with a surgery then you tear the graft. Jabari Parker had an ACL revision. Basically, anyone who does it twice in the same knee. The first ACL surgery is called ""primary ACL surgery."""
"The first names that come to mind are Jabari Parker, Greg Oden, Brandon Roy, Joel Embiid"
"You undoubtedly have a point. I think the reason it's particularly frustrating with Simmons is he's so incredibly talented in so many ways, and it seems so simple to go from being very terrible at one aspect of his game to being simply passable (rather than going from good to an all time great). It seems so eminently doable with just SOME effort, as opposed to needing to put in Kobe-levels of effort and drive, which is definitely a level that very few operate at (and those that don't probably shouldn't force themselves to that extent either)  We're probably not giving proper credit to how hard it is to succeed in in-game situations in the NBA. I was at a game one time watching some of the pregame warmups, and Jabari Parker was out on the court getting some shots in before other players because he was banged up at the time. Jabari was an average-ish 3-pt shooter and I knew that, but the guy was draining 3 after 3 from a couple feet behind the arc. I don't even remember how many in a row he hit at one point, but I would guess he hit something like 80% of the 3s he was hoisting from several feet behind the line and it looked effortless. It was so jarring I pulled out my phone and looked him up on bb ref and sure enough the guy was shooting something like 33% from 3.   Definitely not fair to expect someone to reinvent themselves, it's just so hard to understand an NBA allstar caliber player not being able to shoot better than 60% from the line, or develop a half assed midrange game when it would do SO much for them."
Jabari parker
Isn't Jabari Parker a mormon?
Yeah but nobody knew how bad they were. Embiid had injury concerns too. That's why he didn't go number 1. Bet those other teams are happy as fuck  they picked Wiggins and Jabari parker over him huh?  You take risks for good players. Sometimes they pan out. Sometimes they don't.
Don’t forget Jabari Parker on the Celts.
"Amazing, guy held 2021 mvp Jabari Parker to 0 points."
"you and every basketball person at that time believed in okafor. before the 2015 draft everyone was saying that kat and okafor was very close to each other and either could be #1 pick but kat was slightly ahead. lakers skipped on him cause they needed a pg more than a center. ofc with hindsight it's easy to say ""lol that guy sucks people were stupid"". everybody believed in potentials of guys like okafor, jabari parker, fultz etc. and none of them were surprise picks."
Depends on what your definition is but Wiggins and Jabari Parker both essentially busted and were surpassed by later picks.  Brandon Ingram might count.
You guys always saying shit like this.   Jabari Parker was getting paid long after most people knew he sucked.  Guys who can get buckets get paid
"Mavs fans loved to say Trae couldn’t play winning basketball when he had Jabari Parker, 2 rookies, and Alex Len as his supporting cast. So I guess it has a little to do with that. Apparently supporting casts only matter for one of them."
"Last year he had two rookies on the floor and Collins was suspended for 20 games in a shortened season.  The other players were Charlie Brown (no I'm not kidding), Jabari Parker, Brembry and Damian Jones.  The reason why he's doing so well is that he's been doing this the entire time."
Jabari Parker would end up being top 10 in the league. LOL
"Evan Fournier, Jabari Parker, Tristan Thompson, Marcus Smart and Semi Ojeleye are the only celtics that have been in the league for more than 2 years. The rest are late 1st and 2nd round picks from the last 2 years. That is the Celtics team without Tatum in the playoffs this year. That team wins 20 games in a season in the East. It is probably a worse version of that Cavs team in 2018-2019 that won 19 games.  Kristaps Porzingas, Tim Hardaway Jr, Dorian Finney-Smith, Boban Marjanović, Josh Richardson, Maxi Kleber, hell, the entire Mavs roster is NBA veterans. A lot of them + veterans. They'd probably win 35 games in the East.   Luka is a fantastic player, but his supporting cast was clearly better than Tatum's this year's playoffs. It's just a fact."
You're just wrong:  https://www.basketball-reference.com/teams/DAL/2021.html  Mavs without Luka had 3 players with a VORP above 1 available in their series. 4 players with a positive BPM.  https://www.basketball-reference.com/teams/BOS/2021.html  Celtics without Tatum had 0 players with a VROP above 1 available in the last several games of their series. 2 with a positive BPM (one of which was Jabari Parker).  Kemba and Rob Williams being available would make Celtics Mavs close. Without them? It's a joke.
"Hawks FO sabotaged the he'll out of the team in Trae's sophomore year to make sure they could get more help on the right timeline. You moved decent players like Tauren Prince for a pick, let go of useful vets like Len and Dedmon who was really good in Trae's first season and rolled out guys like Chandler Parsons, Jabari Parker, Evan Turner, Jeff Teague and the corpse of Vince Carter and that landed you Deandre Hunter who's a perfect fit and on the right timeline. Okwongu was also a result of it this season even if he's a work in progress. Patience and cap space meant you got Clint Capela for pennies, the Trae trade got you Cam Reddish and all those salary dumps absorbed gave you space for the offseason signings. There's intentionality and patience in the Hawks strategy even if there's been one or two misses along the way even if it looks like luck from the outside."
"And Jaylen and Timelord were injured. And THJ ~ Fournier. Also Celtics were playing large minute Romeo Langford, Grant Williams, Jabari Parker, Aaron Nesmith. I have hopes for their future but compared to  DFS, KP, Kleber etc they are definitely a tier below."
The guy with Damion Jones and Jabari Parker as his starting frontcourt
"&gt; In the nba today I’m taking the 6ft 8 pg over the center everytime.  This same reasoning was a big reason why Jabari parker and Wiggins were drafted over Embiid. In today's NBA, I am taking who can eventually be the better player regardless of position, and the better player may not become better until after their rookie contract.  &gt;Luka is already a top 5 player in the league arguably.  I just disagree so much. All the criticisms I always had of Luka are still apparent and people give such a pass to him. I have never seen someone who gets credit for carrying a team and with such mediocre [on/off numbers](https://cleaningtheglass.com/stats/player/4432/onoff#tab-team_efficiency) 3 years in a row. That is just 1 of the many many reasons I can rant about (and I have) on why I think Luka is severely overrated which you probably don't want to hear more about. I think a big reason why Porzingis is underperforming is because he isn't getting the ball in his hands and playing with Luka is a part of that. Everyone talks about Luka's 42 points but much fewer talk about the 37 shots to get those points. I disagree with you that he is a top 5 player in the league. Maybe top 5 offensive player but I would personally have him in the top 20 range for player overall.  &gt;My Luka and lillard comparison also wasn’t comparing them as players now. It was comparing their career trajectory and Luka already beat Dame’s peak form as a 3rd year player  Luka will have a lot closer of a career to Lillard than he will with MJ in terms of wins/losses and helping his team rather than closer to MJ. In terms of all-nba stuff or MVP voting Luka will have more of that than Lillard, but I don't care about those accolades as much as I care about how good the player is."
"Those Bucks teams were pretty garbage. Their third best player was an often injured Jabari Parker. Behind young AF Giannis and Middleton, who didn’t debut until February in Brogdan’s rookie year, Kidds y3 iirc."
Hawks fans have no issue with mavericks fans. Hawks fans have issues with luka stans who have constantly be invading subs and talking shit about trae since the day he was drafted. What luka has done is impressive but he gets no where near the criticisms trae gets. Prior to the knicks series people had trae as the 16th best player under 25 and spouted the foul baiting narrative. Luka Stan’s have been saying for years shit like trae is not a winning player when his roster employed Alex Len Jabari Parker and Evan turner
"He was manipulative with the players, ran a stupid defensive scheme, tried to become gm, and also he didn't let Giannis or Jabari Parker shoot threes in games which is definitely part of the reason for Giannis' shooting struggles"
"""Jabari Parker""  ""Justise Winslow""  ""Jahlil Okafor""  oh man"
Jabari Parker doesn’t believe in Defense but we love him anyway
Jabari Parker was on my team. Blessed to join your bandwagon this series as well.  Deer noises and fuck Mike Dunleavy
"Paul George, Derrick Rose, Robert Covington, Markell Fultz, Tim Hardaway Jr., DeMar DeRozan, Mike Conley, TJ McConnell, Russell Westbrook, Jabari Parker, Jaylen Brown, Bryn Forbes, Julius Randle, Kelly Oubre, and many others can't name off the top of my head."
"lol marginally worse? Trae’s second option last year post injury Jabari Parker... just stop lol. This year when healthy, sure. The issue is the hawks haven’t been healthy until now. Trae is the first player in nba history to have 145+ points and 45+ assists in his first 5 playoff games. Where’s Luka? The fact you act like Trae would be bad on the mavs is hilarious. Dude averages 25 and 9. Was what? Second or third in ppg last year and top 3 in assists as well. But ya, definitely wouldn’t help the mavs get booted from the bubble lol"
"Luka has had the better team every year. Last year Trae had post injury Jabari Parker as his second option and a bunch of rookies. You’re lying to yourself if you think that team was better than the mavs. I also don’t see Luka included here  In Game 1 of the Hawks’ first-round series against the New York Knicks, Young had 32 points and 10 assists, becoming the fourth player alongside Derrick Rose, Chris Paul and LeBron James to record at least 30 points and 10 assists in their playoff debut. Young and James are the only two players to have at least 30 points, 10 assists and five rebound in their first playoff game."
This is the first year the squads have even been close. Last year the hawks number 2 option was Jabari Parker for the first 25 games. Pretty sure KP has been an allstar. What allstar does Trae have to work with?
Jason Kidd and Jabari Parker reunion!
Id give Jabari Parker and Moe Wagner a shot too they just fit the playtype
well he was being guarded by Jabari Parker
