"Of the draft lottery picks only 3 have become All-Stars - 2 for the first time last season.  1. Andrew Wiggins   2. Jabari Parker   3. Joel Embiid   4. Aaron Gordon   5. Dante Exum   6. Marcus Smart   7. Julius Randle   8. Nik Stauskas   9. Noah Vonleh   10. Elfrid Payton   11. Doug McDermott   12. Dario Šarić   13. Zach LaVine   14. T. J. Warren  Of that lottery draft class who do you put above him? Obviously Embiid, LaVine, and Randle but thats pretty much it. Maybe a case could be made for Marcus Smart ... realistically I can't be consider him a bust if he is the 4th most successful player in the lottery."
 My birthday is  on March 15 and the best player born on March 15 is bulls  legend Jabari Parker with Lakers legend Xavier Henry behind him and like 5 other unknown role players end of the bench guys possibly from around the 90s or 80s
Stop it right now. Jabari Parker only got to play 13 games this year because he’s that bad Damian Jones played for three teams this year because he’s that bad and Deandre Bembrey is a worse three point shooter than Russ at 23.1%. I don’t see why you are fighting this so hard it’s ok for Trae to be better than Luka in something stop being so soft lol. Not to mention the two dudes you mentioned played less games then Deandre bembry did and the season was longer.
Barely. Also his starters. That stretch was Jabari Parker and Damian Jones and Deandre Bembry who are all significantly worse then who Luka is currently playing with.
It's the latter. He was extremely convinced guys like Jabari Parker and Malcolm Brogdon would never leave the team. He couldn't fathom it when they wanted out.
"Atlanta is a poor example here. Capela did elevate us from last year and the year before when we had the likes of jabari Parker and Alex Len playing in the middle, but to say that our wing defense was soft is not that accurate. Deandre Hunter, until he got hurt against Philly, was shaping up to be one of the premier wing defenders in the league. He’s a guy you can put on the other team’s best player and forget about it. Same with cam reddish, except he was out the second half of the year and only played ECF last few games. Bogi and K’von both solid team wing defenders. The biggest weak spots on the hawks D are Trae Young against the opposing ball handler, and John Collins against bigger PF and Cs."
"It's best to consider the opinions of Greg Foster and Jason Kidd whom coached both of them at the same time.  Beasley had the best full court sprint times in camp and regarding offensive acumen and talent, the coaching staff by and large saw Parker, Giannis and Beasley as mostly equal (As Jason Kidd put it in an interview anyway).  They just all happened to play essentially the same position then.    It's interesting that Beasley actually had his best offensive efficiency that year in his three year spell after his second spell in China.  That was when the likes of Craig Robinson, Jason Terry and Jabari Parker made great effort to let the world know that Beasley had changed and he was a great team mate and a better player for it.    Beasley's best season as far as his personal growth in basketball acumen comes when he played for the Knicks."
"Ya. Crazy Trae didn’t carry a team of jabari Parker, Alex Len, and 2 rookies to the playoffs. lol what a take.  To be fair, Tatum had brown and Kemba and he carried the Celtics to the bubble lulz"
Had Jabari Parker already been written off by 2015? Him and Wiggins were hyped up to be the future of the league when they were coming out of high school lol
"Yeah I was gonna say that, it's an incredible argument to treat Bucks' successes as somehow related to Jabari Parker when they were just better without him. He literally didn't play at all in the span of the season that made them a playoff team at all, really such a strong proof of his genius play that Buck were a playoff team.  He was a decent player that year, though, offensively. It's just a rather bizarre angle to describe him in terms of ""playing better within the system"", ""contributing to wins"", ""better passer"" etc."
"Except Jabari was doing it for a 42 win playoff team on 53% eFG%, Beasley was doing it for a 17 win team on 46% eFG%.   Parker was way more efficient, a better passer (nearly 3 APG, and in less MPG), and contributed more to winning. He was also turning the ball over less and played better within the Bucks system. Beasley was a chucker and played lazily."
"Aaron Holiday looked solid. I had forgotten that the Wizards ended up with him. Harrell and Dinwiddie were great as well.  Schroeder looked good despite being abused in the paint by Dinwiddie a few times and seemed to be the only Celtic with consistent effort tonight.  Tatum got to the hoop and made it look easy at times. I feel like he should've done that more, especially in the first half.  JB did not look good at all in the first half and started like 1-8. He started hitting a few shots in the second half. Maybe the shoe change at halftime helped a bit lol.  There were some questionable calls on that hurt the Celtics near the end of the game, but those would be non-factors if they they didn't start off so slow and let Harrell feast in the paint.  Would've liked to see Pritchard play or maybe even more Jabari Parker over Richardson."
"This season Marcus Smart is averaging 7 3PA a game and is making them at....(wait for it..) 23.5%  Why in gods name is Smart taking so many threes. Also if Tatum is awful the Celtics suck.   This game was a difference in depth. Tatum and Beal were both trash but the Wiz have too much depth. JB was also really bad this game.   The Celtics last guy on the rotation is a washed Jabari Parker, Grant Williams, Josh Richardson compared to the Wiz who are running the rookie Corey Kispert who actually looks really solid so far on both ends of the court, Deni Avdija who also plays solid D and can ball handle, Aaron Holiday who is looking like a steal of a pick-up for PG depth and Bertans who is still capable of being a good NBA player even though he's been pretty bad at doing what he's paid to do which is shoot the ball. Juancho needs to work his way into the rotation for Boston, he's a solid player."
"Jabari Parker, DeMar DeRozan, Melo, Felicio when he was in the league, Drummond,"
"Bucks could have had Embiid and Giannis. At the time, we needed a center too. Picked Jabari Parker instead.  It all worked out in the end though. No complaints here."
I read it as Jabari Parker and I only realized it wasn’t him after the stat line
"I was all in on Jabari Parker. To be fair, it was injuries more than anything else that derailed him."
"Mike Budenholzer is the epitome of failing upward. Yes the Bucks won, but look at how many fuckups happened on the way there under his watch. Bringing in Eric Bledsoe? Wasting money on a mid Jabari Parker? Anyone remember Malcolm Brogdon? His obsession with bargain players that were once great? This guy either the world’s smartest idiot or dumbest genius."
Jabari Parker could have been one of the best without injuries
Wasn't this fresh off the season where Trae dropped 30 and 10 assists passing to Vince Carter and Jabari Parker 😭
Wiggins had a weak draft class some obvious highs but a lot of lows. In fact a lot of his draft class are barely in the league anymore. Embiid was injured and Wiggins was the clear cut favorite since he was in High School. Obviously he was the wrong choice but it was either him or Jabari Parker and you know how that’s going....
Just wanna say shoutout Jabari Parker. Helped us keep up in the beginning.
"Jabari Parker, at this stage of his career, is easily one of the worst players in the league"
I'm really happy for Jabari Parker having such a good first half. Hopefully he can keep up that sort of production throughout this season!
JABARI PARKER
I don't think it's hyperbole to suggest that Jabari Parker is Karl Malone 2.0.
"Somehow, Jabari Parker is leading all scorers after the first quarter."
Jabari Parker&gt;&gt;&gt;&gt;&gt;Zion Williamson
THIS IS THE BEST JABARI PARKER HAS LOOKED SINCE DUKE
I thought jabari parker got waived huh
ESPN Gamecast said we subbed in Jabari Parker.  Didn't we waive him?
As a bucks fan your saying pick 15 giannas that avg less than 8 points per game his rookie year had more upside than Jabari Parker pick 2 the next year. When he and Wiggins were the most talked about prospects.   If it wasn't for Jabari getting hurt 25 games into his rookie year. You think giannas would of still been the bucks main focus after dropping 8pts per game...  That's kind of cap because nobody saw giannas becoming giannas. He was two inches shorter. Smaller frame and had kd like promises hence why kd is his favorite player.
"The key word is the bucks.   They don't end up with alot of players coming in willing, so they develop what they can. Jason kidd saw giannas and basically told him what his strengths were and the rest is history.   Best of luck moving forward. If it wasn't for Jabari Parker two acl tears. Giannas would of never got the chance to step onto a bigger role. He also grew to add to his frame made him the Greek freak.   If this was the lakers, knicks, pelicans, t wolves  Magic . Guaranteed would of fucked up giannas."
"That was 14 years ago.. after him, the second overall picks were Beasley, Thabeet, Evan Turner, Derrick Williams, MKG, Oladipo and Jabari Parker.  Not inspiring, I know."
"I believe Trae and the hawks also beat the #1 seed sixers, right? The sixers had 3 all nba defensive selections compared to the Clippers 1. Luka stans said roster talent didn’t matter when Trae’s squad was Alex Len, Jabari Parker, and 2 rookies. Weird how it’s the only thing that matters once Trae gets a comparable roster."
He is long and athletic and has the full potential but he’s also disinterested in it and it shows. It’s not jabari Parker level and he can get away with it more now that they have Aaron Gordon but c’mon are you gonna sit there and pretend he isn’t hunted on defense in close games?
Yeah! How is Jabari Parker not in the top 75?
"+- is shorthand for plus minus. it is a stat that is used to measure the point differential when they are on the court. so while Westbrook was on the court the lakers scored 25 less points than the Warriors.  this is generally regarded as a bad stat for measuring individual value except for in very large sample sizes (1+ year) because it can be influenced so much by other players on the court, I.e if the 76ers lose to the Celtics  by 30 and Joel Embiid plays every minute and plays at his usual MVP level he would have a +- of -30. If Jabari Parker also plays all 48 minutes he would have a +- of 30, despite being a much worse player, his +- would be misleadingly inflated by his team playing well. it is useful in large sample sizes as a rough indicator of him much value a player provides to his team, such as Tim duncan having one of the highest career +- ratings ever, because he consistently helped his team be better than the other team."
He will be out of the league in a few years. He’s following the same arc as Jabari Parker. He will sign a few one year deals and teams will realize he isn’t worth it.
Jabari Parker signed with the Celtics again after being released. He cleared waivers before signing of course.
"Jabari Parker: ""SIKE"""
"He was drafted #3, mainly due to injury history. If he didn’t have the injury history and people thinking he might be Greg Oden 2.0, the 76ers would probably have ended up with Wiggins or Jabari Parker. They kind of lucked into Embiid in that sense. While Embiid has battled injuries, it hasn’t been as bad as people thought."
Jabari Parker 2.0
Jabari Parker
"As mentioned in the thread about Boston waiving Jabari Parker, the ""I don't get paid to play defence"" press conference. In retrospect, probably one of the stupidest NBA quotes of all time"
What about the thread questioning if Jabari Parker had any friends?
"Damn I remember seeing Jabari Parker clips on “Ball Is Life” YouTube channel when he was in HS, and everyone was so high on his athleticism."
"Random stat:  Jabari Parker (2.5) has a higher VORP than Wiggins (1.0), despite Wiggins playing over 225 more career games."
"Lavine was a tiny fraction of what he is now in Minnesota. You’re purely speculating that his time there played any role in what he became.  I’ll give you the benefit of the doubt regarding Lavines playmaking but that’s probably the worst aspect of his game outside of his defence so it doesn’t influence how good he is for the most part. His playmaking is also largely just passing out of doubles.  The issue is basically every athletic fringe rotational player is a good defender. Defence is largely based on effort and players who are fighting for minutes will often provide the most effort. What makes defenders stand out is impact and okogie is not an impactful defender. Wings and guards are less impactful as is, so you generally have to be like an all defence guy, or have some offence too.  Fair point with wiggins, I thought I saw him in your list of names.  Your last point however is complete nonsense. For starters i wouldn’t consider him a quality player. I’d consider him a 9th man on most teams. I’d just consider him better than Jabari Parker. Denver traded him along with Malik Beasley, by your logic Malik was nothing resembling a quality player. Minnesota didn’t keep him cause they got Patrick Beverley who is much better and a perfect fit for the team in every way. Memphis traded him cause they have a log jam at his position and got a second or 2 for him. And I have nothing against the Wolves. In fact this year I’m one of the highest on them, and think they have a legit shot at a lower playoff seed. I’ve also been an avid defender of them when people talk about how they should be relocated, or how KAT should demand a trade. It’s just a fact that more often than not their player development is very lacklustre and that a player shouldn’t be completely written off based on how they played in those conditions"
Sure. The chance of getting the good version is more valuable than a player like Jabari Parker
"""Balling like Jabari Parker"" -Childish Gambino"
somehow Juancho Hernangomez of all people managed to survive the last few days of training camp/preseason purge over Jabari Parker X_X
[The legacy of Jabari Parker will be this legendary thread](https://www.reddit.com/r/nba/comments/1ulxb4/mormon_faith_more_important_to_jabari_parker_than/cejpqf8/?context=4)
Zion Williamson will be a starter throughout his career since his playstyle is very injury-prone and he will suffer the same career as Jabari Parker.
Lol ok If you think smart and AL make no difference. Also Robert Williams who is a massive difference. Plus PP who’s a decent piece.   I’m just sayin lol it was grant Williams and jabari Parker out there lol
Jabari Parker is still on the Celtics wow
"Jabari ""they don't pay players to play defense"" Parker"
Jabari Parker sounds like a forgotten 70s/80s goat
"That draft had the coolest names in the lottery. Dante Exum, Marcus Smart, Jabari Parker, Joel Embiid, Julius Randle, etc etc. Any one of those names could have been a superstar's name. The next LeBron James or Kevin Durant. Hardest draft to pick in imo. Just high potential names all around."
Ayton needs to ask Jabari Parker for his advice on how to get paid
"Pretty much. The can’t miss guys are usually the exception but for the rest of the guys its pretty much true. Andrew Wiggins or Jabari Parker are pretty decent examples of this. It takes a lot of luck, skill and insane work ethic to become a good NBA player."
"In no particular order based on draft class and whatever comes to mind that I remember having a strong opinion on -   High - Zion Williamson, Jayson Tatum, Trae Young, Ja Morant, Lonzo Ball, De’Aaron Fox, Victor Oladipo, TJ Warren, Kyrie Irving, John Wall, DeMarcus Cousins  High but missed the mark - Wendell Carter Jr, Ben McLemore, Kevin Knox, Lauri Markkanen, Dennis Smith Jr, Malik Monk, Jabari Parker, Dante Exum, Anthony Bennet, Dion Waiters, Evan Turner"
OP how tf were you high on Giannis? Nobody knew who he was and he had no film lol.  I was very right about Jamal Murray and Booker. I was very wrong about Ben McLemore and Jabari Parker (partly due to injury).
I was finally right about Randle.  Wrong about Exum and Jabari Parker.
"Cade:  * Ceiling: Luka * Floor: Kyle Anderson  Green:  * Ceiling: Kobe * Floor: Jamal Crawford  Mobley:   * Ceiling: KG / Giannis with a jump shot * Floor: Larry Sanders with better offense  Barnes:  * Ceiling: Ben Simmons / Andre Iguodala / more athletic Draymond * Floor: Having some trouble with this one... He's going to be a solid defender no matter what, and he's got point forward skills. Jabari Parker who I saw mentioned in another comment isn't a terrible comparison.  Suggs:  * Ceiling: Deron Williams / not fat Baron Davis * Floor: Rodney Stuckey"
"Jabari Parker with D is an all star, its not floor lol"
Jabari Parker for Barnes??? How’d u come to that conclusion
Unbiased but  Cade: Luka  Green: MJ without the defense  Mobley: AD  Barnes: Draymond Green with a jumper/handle  Suggs: Jrue Holiday   Floor  Cade: Kyle Anderson  Green: Malik Monk  Mobley: Jabari Parker with D  Barnes:   Suggs: Cory Joseph
"The bucks kinda tanked and got a high pick for Jabari Parker, but they were just bad bad those years. Once they realized what they had in Giannis, they started trying to build competitive teams. This op is a clown tho."
Jabari Parker :/
"in the end we could not withstand the onslaught of *checks notes* Jabari Parker  Great game, though it felt like two separate games: a real NBA game lasting until halfway through the third quarter, and a G-league game with extra hype in the last few minutes."
holy shit is that jabari parker playing garbage time in preseason?? damn
His point is right though… that tank got you guys Jabari Parker so it really didn’t add anything to the eventual title squad.
"Just because some teams hit the powerball later in the draft doesn’t mean they didn’t tank at some point. Tanking Assets: this century       Utah - Deron Williams 3rd, Kanter 3rd, Hayward 9th,  Exum 5th       Denver - Tskitishvili  5th, Carmelo 3rd, Mudiay 7th,  Murray 7th        Bucks - TJ Ford - 8th, Bogut - 1st, Yi - 6th, Joe Alexander - 8th , Brandon Jennings - 10th,  Jabari Parker - 2nd,  Thon Maker - 10th.        Heat - Caron Butler 10th, Dwayne Wade - 5th (Responsible for all their championships) , Michael Beasley - 2nd , Winslow - 10th       Indiana hasn’t had a pick in the single digits since ‘89, (Picked Paul George was picked 10th). Indiana is the only team that I can think of that legitimately “never tanks”."
"You don't have to climb to the top, Bucks drafted Jabari Parker with the #2 pick and got lucky with Giannis. The more picks the better, improves your odds of landing a star. How does it not realistically improve their chances?"
"I’m only using the same metric Luka stans used the year prior. When Trae was surrounded by 2 rookies, Alex Len, and Jabari Parker winning basketball was the only thing that mattered and they propped up Luka’s playoff appearance. Trae then gets a comparable supporting cast and goes to the ECF and now all of a sudden it’s all about team talent."
"It’s hilarious how much Luka stans have flip flopped. Weird how team talent meant nothing when Trae had Alex Len, 2 rookies, and Jabari Parker to meaning everything as soon as trae took a comparable squad to the conference finals."
"Well I think it's because a lot of nba players are the children of former nba players, or are related to former nba players.  Examples being Curry, Klay, Dlee, Wiggins, Gary Payton 2 on just the warriors.  Other examples are Kevin Porter Jr, Cole Anthony, Bol Bol, Booker, Jalen Brunson, Jae Crowder, Darius Garland, Jerami and Jerian Grant, Tim Hardaway Jr., Al Horford, Jaren Jackson Jr, Kevin Love, Kenyon Martin Jr., Wesley Matthews, Larry Nance Jr., Jabari Parker, Austin Rivers, GR3, Sabonis, Garrett Temple, Gary Trent Jr, Justise Winslow, Seth Curry, Marvin Bagley 3 (grandad was in the league)   That's 32 players who all probably had pretty good lives. A bunch probably come from parents who were coaches or well off as well like Michael Porter Jr."
"besides from Jabari ""not paid to play defense"" Parker"
"Enes Kanter says hello. He'd just be a sixth man if he's a good scorer and a terrible defender. It's enough to make a career but perhaps not the one everyone expects right now. We're talking about a Jabari Parker with the ability to pass. Or Michael Beasley. Not terrible, not great."
"Nah not the pacers man, he’s going to Boston, BREAKING: Simmons to Boston in exchange for Peyton Pritchard, Jabari Parker, Al Horford’s bath water, and a bowl of spoiled clam chowder"
I see your point but plenty of players get injured and are still considered busts. Jabari Parker is a good example of that. Generally people use the term bust just to refer to a draft pick that doesn’t pan out/
"Here’s a brief rundown of some of the current defending champions’ moves since they drafted their franchise player -   - Traded JJ Redick for two seconds because he was going to leave.   - Traded Ish Smith for Caron Butler. Ish has been a capable backup PG ever since, Butler played half a season off the bench and dipped.   - Drafted Jabari Parker over Embiid.   - Brought in Jason Kidd as coach. Even traded two 2nds for the privilege (fun fact: one of those 2nds later became Pat Connaughton).   - Traded for Caron Butler *again*, this time giving up capable backup Ersan Ilyasova. Immediately waived him.   - Drafted Rashad Vaughn in the first round.   - Same draft, traded a just-drafted Norman Powell and a future first that became OG Anunoby for Greivis Vasquez.   - Paid Greg Monroe $34m to be mediocre for two years.   - Shipped his ass to the Suns with a first rounder attached for HOF choke artist Eric Bledsoe.   - Drafted Thon Maker in the first round.   - Handed out terrible contracts to Delly, Tony Snell, John Henson *and* Miles Plumlee all in the space of two years.   - Got out of jail by managing to shift the Plumlee contract for scraps and sending Delly back to Cleveland along with Henson as salary filler but did have to give up a first to move Snell’s deal. That first became Kevin Porter Jr.   - Drafted DJ Wilson in the first round.   - Let Christian Wood leave for nothing.   - Traded four second rounders and Thon Maker for Nikola Mirotic, who proceeded to make playoff Bledsoe look like prime LeBron then dipped to Spain.   - Traded Malcolm Brogdon for a first and second because they didn’t want to pay him $80m.   - Traded every first round pick they could to the Pelicans to get a playable guard because the one they’d just given $50m to was awful and they traded the other one away.    You’d be surprised how much you can fuck things up and still contend. We only sucked for one year through all of that and we sure as hell weren’t gaining assets for it."
Chris Boucher is 2 years older than Jabari Parker.
"I think that's s disingenuous way of ranking them. First of all, if you are going to shit on teams for bad drafting, Cleveland had the #1 pick 2 years in a row and took Wiggins and Anthony Bennet. THAT is putrid drafting.   I agree that Boston and the Lakers did well in the draft, I think they are probably the two most talented front offices in the league.  So really you are bring rough on the 76ers for drafting Okafor and Fultz when they turned out to be busts. But there are a lot of other busts in the draft as well. Not every pick can be a winner. I think a 50% hit rate is acceptable and as others have said, Hinkie also picked up a lot of other players with lower draft picks who are now recognised as being the sorts of key role players on championship teams that you want to have. Robert Covington etc etc.  &gt; And they have the two worst busts up there.  Anthony Bennet as a #1 pick is criminal. Minnesota took Derrick Williams 2nd in '11. The Bucks took Jabari Parker 2nd in '14."
Jrue Holiday. Giannis is Ari and Jabari Parker is Sang Woo
Jabari Parker
Jabari Parker
"Sounds like we played in the same era lol.  Jabari and cliff we just so much bigger/athletic than everybody. It was crazy.   Now when I played in a tournament against Caleb Swanigan, that dude was skilled and big. Haha.   A couple of guys I played with ended up playing overseas and one of em actually transferred to Simeon and played with Parker. He had a crazy run in March madness too."
From Chicago   Played Vs Max Strus and Jalen Brunson   Saw Jabari Parker/Jahlil Okafor sectional games @ my school every year   Almost Played Cliff Alexander in Playoffs but his team was using Ineligible Players lol  And my brother got Dunked on By Iman Shumpert
"Christian Wood  Jabari Parker, as a 6th Man, but, he's got to keep working on his outside shot"
"Giannis has still proved himself with lacklustre shooting around him. He played like an all nba player with like Jabari Parker and John Henson in the same lineup as him. He played like an mvp with Eric Bledsoe there. Ben has 4 shooters around him, including the most dominant post player since Shaq who’s altered his game for bens benefit to take like 8 jumpers per game"
Dude you’re so right. Jabari Parker could probably do the exact same shit in the Nuggets system. /s
"Milwaukee basically had a one year rebuild after we dealt Monta Ellis and Brandon Jennings. We picked Jabari Parker the next year, who was supposed to be the franchise saviour, but instead we just hit 2 home runs by getting Giannis at 14 and getting Middleton as a throw in asset in the Jennings trade"
"There's a world where Jabari Parker has 5 MVPs and 6 rings, what's your point"
