"&gt;You might not know it given the Minnesota Timberwolves' thirst for potentially available power forwards, but Jaden McDaniels is pretty darn good.  The Wolves are looking for Power Forwards because McDaniels is (likely) going to be the starting Small Forward."
"Detroit rookies were playing great for their draft pick number. Saddiq Bey as the 19th pick had the same amount of triples per game as Luka and Lillard in their rookie years with better percentage and more attempts (crazy when the season was shorter). And Isaiah Stewart as the 16th pick was the rookie who had more rebounds and blocks and it's not even close - Stew had 86 blocks, while Jaden McDaniels had 60 as the second rookie with most blocks; and he had 453 rebounds while the second best rebounder Jae'Sean Tate had 374.  Not knowing these guys doesn't make you a casual, but you're definitely not invested on how the rookies are doing. It's not even your fault because regarding rookies the media only cared about Lamelo and don't give a shit about Detroit."
Let the jazz throw in Joe Ingles and get Jaden McDaniels+ in return
sga donovan rj jaden mcdaniels mitchell robinson
Except for Anthony Edwards and Jaden McDaniels.
"What is the wolves best package for another star?   Bev, Beasley, Jaden McDaniels, Naz Reid, Okogie?   Who does that get that the Sixers want? And then the wolves roster is shallow as fuck it just doesn’t make sense to me"
I read it as Jaden McDaniels and was really confused for a sec
Bro jaden mcdaniels
Jaden McDaniels got snubbed
"The argument about the franchise being shitty and it affecting development of young players usually comes from people who know nothing about Timberwolves. Yes, we are perennial suckers and yes, we frequently draft busts in the lottery. However, with the new management (since 2019) we have drafted (or signed as undrafted FA) and played Naz Reid, Jaylen Nowell, Jaden McDaniels, Anthony Edwards, and Jarrett Culver. [We also drafted Bolmaro but we are yet to see his development in the team]. ALL of them have shown a development to some extend and all of them are way better players/assets than Culver.   Culver was given all the chances in the world. We even started him at PG during the rookie season. He was below average in his first season, however with some promise. He worked hard over the summer and came to the training camp in a decent shape, impressed the fans during the preseason games. He started last season as 6-7 man in the rotation. The team started to suck right away after KAT got injured, and Culver even started for some games. He has shown NOTHING. He cannot shoot, cannot be a playmaker, cannot finish with contact. His defense is mediocre at best, Okogie is a way better defender than him.   Culver reminds me of a poor man version of Josh Hart who has a similar skillset but does everything worse. I feel like Josh Hart is his ceiling if he really works hard and figures it out. At this point, Im very glad Timberwolves dont have to make a decision about picking up his option for the next year - paying 14+ mil to Culver in the next 2 years could have been a problem. I hopes he at least can play in the summer league, but he got injured at the end of the last season and did not recover. Wish him all the best, but not in Timberwolves uniform."
"Even KAT has more than half his three’s classified as uncontested. For guys like Lopez and Embiid it’s under 1/4 threes that are being contested. You’re right I didn’t think about cross-matching but even if you put your 4 in the corner that leaves Zion with single coverage against a center in the paint which is a quickness mismatch and would result in a bucket more than 62% of the time.   I’m saying if nobody is coming out to contest KAT half the time already when they’ve got Jaden McDaniels in the paint, they’re going to leave him open much much more often if Zion is in the paint. That will result in good offense 100% but solely in terms of spacing I really don’t think there’s more than a few centers in the league that would create a significant increase in open looks/single coverage for Zion in the paint. Certainly not ones that NOLA could trade for."
"Add Patrick Beverly and Tauren Prince that when mixed with ANT +(DLO, KAT, and Jaden McDaniels) creates a talented mix of offense, spacing and defense.. depending on lineup (plus Okogie, Vanderbilt, and Knight who are high energy D guys too)"
Culver is more of a 3 tbf. But he was behind Okogie and then Jaden McDaniels/Ant Edwards
Na his defence is still fine. And he can playmake a bit. But he was a black hole on offence.  At the end of the day he was completely redundant to us when Josh Okogie and to an extent Jarred Vanderbilt do the exact same things as Culver but better. We couldnt have 4 bench guys all incapable of scoring. And thats why Jaden McDaniels and Jaylen Nowell both got chances ahead of him
"&gt;Philadelphia gets:  &gt;Anthony Edwards &gt;Malik Beasley &gt;Jaden McDaniels  This has to be trolling, right? Nobody is this dumb."
I’m not even a twolves fan. But jaden mcdaniels has a special place in my heart.
I don't think this is the kind of stuff you're looking for but....  KAT isn't the tallest player on the Wolves. (According to one of our reporters). It's Jaden McDaniels.
Ant and Jaden McDaniels would like a word
Atleast you guys have jaden McDaniels.
"No team hits on all their picks. Rosas drafted Culver, Jaylen Nowell, ANT, Leandro Balmaro, and Jaden McDaniels. picked up Naz Reid as a rookie FA signing. Only 1 of those players looks like a wasted pick so far. Jaden is out playing his draft position and ANT is everything that could be expected of a #1 pick."
Jaden McDaniels is a very good defender and Josh Okogie is pretty good outside of they they don’t have any defenders KAT the last couple years has improved and after their coaching change KAT was guarding the perimeter more and looked pretty good but still wouldn’t trust him to be an above average defender
"I really couldn’t care less about Cade, Mobley or Green I’m most excited to watch Bones (hopefully he gets pt) and Jalen Suggs  A couple guys from the 2020 draft are Tre Jones and Jaden McDaniels"
You'd really give up Naz Reid and Jaden McDaniels like that?
Anthony edwards patrick williams jaden mcdaniels zion cade luka trae tatum  shai
"Just to prove exactly how stupid you are being right now, I searched through literally every NBA team sub for their top Simmons related post in the last month.  Here are my findings:   Mavs - Ben Simmons is a disaster  Den - all comments talked about how it made no sense to trade for him  GSW - lol no  Rox - laughing at Morey and Philly fans  LAC - might be interested if they could get him for 2nd rounders  LAL - at least Westbrook isn’t as bad a shooter as Simmons  Mem - literally haven’t talked about him in the last 30 days  Timberwolves - he wouldn’t be worth Jaden Mcdaniels  Pels - for some reason they have a crusade going on against Bill Simmons which confused the results, but most people agreed Ben Simmons would ruin their team  OKC - pretty much just memeing him for being a socialite  PHO - lol no  POR - thinks the Sixers are insane, both for thinking they could move Simmons for a haul and for thinking they could trade him for Lillard  Kings - they want him. 1 for 13 so far  Spurs - already turned down a Simmons trade because Morey went full crackhead on them  Jazz - literally have not discussed Simmons in the last month  Hawks - memeing Daryl Morey for being insane  Celtics - meme about Simmons being useless  Nets - have not discussed him in the last month  Hornets - have not discussed him in the last month  Bulls - asking price too high, not worth moving Lavine  Cavs - not worth their pick this year (who is now Mobley)  Det - maybe if some other team bites on Simmons, they could pick up some assets as the third team.  No interest on getting Simmons themselves  Pacers - laughing at Philly imploding  Heat - laughing at the idea of moving Butler for Ben  Bucks - no interest, and they’re mad that Simmons was picked as All-NBA over Middleton  Knicks - laughing at the fact that Sixers gave a max contract to Simmons  Magic - no trade discussion for the last month  Sixers - somehow the same meme that the Celtics sub had of Simmons being useless.  Geez.   Raptors - again the same meme of Simmons being useless.   Wizards - they’re interested.  2 for 30.   So hats off to the Wizards and Kings, but literally every other team in the NBA *including the fucking Sixers* are laughing at the very notion of paying Simmons 30 million dollars to miss easy buckets.    He has no trade value."
Jaden Mcdaniels will be an allstar
Jalen and Jaden McDaniels
JADEN MCDANIELS IS KD BUT BETTER AT D
Jaden mcdaniels is sooooooo goooooood
"Jaden McDaniels. A legit 6'10"" wing who can already hit open threes and play great D. He's shown some flashes of creativity as well."
"As a wolves fan all I hear Ant Ant Ant. Give me Fucking Jaden McDaniels, this kid has as much upside as anyone from this his draft class"
Jaden McDaniels
I truly believe in Keldon Johnson.  I a little bit believe in Jaden McDaniels
Jaden McDaniels
Ngl. I enjoyed jaden mcdaniels game. I only found about him because of 2k 😂. But I started to watch his highlights and I can definitely see what you guys are talking about.
Jaden McDaniels will become a serious shutdown defender in this league.
Jaden McDaniels. Let him bulk up a little and tighten his handle.
"Jaden mcdaniels is a future allstar, and Ant will be an allstar this season"
"Charlotte has Jalen McDaniels on the roster, brother of Jaden"
"Charlotte has Jalen McDaniels on the main roster, brother of Minnesota's Jaden McDaniels"
Anthony Edwards for MVP and MIP. Jaden McDaniels for DPOY.  No bias
"“Attitude problems” always have GMs skiddish. KPJ, Jaden McDaniels, JJ, etc, all get drafted much later than they should’ve, mainly because GMs don’t just draft for the best likely outcome, but also to keep their own jobs."
I have always liked Jaden McDaniels game. Thought he was too slept on in the draft. Great pickup
"I'd definitely be willing to part ways with DLo, but I don't think that's what KAT wants since they're buds. But he's also friends with Simmons, so who knows.  I think the only offer we would make is Beasley, Jaden McDaniels (who looks very promising as a good 3&amp;D),  whoever else + picks.  I don't think it's enough, unless we get a 3rd team involved. Which is why nothing has happened."
"Jaden McDaniels, learn his name."
"Jaden McDaniels is going to establish himself as one of the more coveted 3 and D players in the league this season. Wolves making it to the playoffs with help from his improvement, Edwards taking a big step up with efficiency and leadership, Balmaro being more useful than most expect, and Taurean Prince fitting in as a bench 3 point sniper to go along with Malik"
"In one half, this dude called Jaden McDaniels, Patrick. He called him Jaden Daniels. He said he was trying to get in the rotation (already a starter). He said Jaden was a third year player who was undrafted out of Holy Cross, (he’s a second year player who was drafted 28th out of Washington).  Ya they’re just summer league dudes but it’s pathetic."
"Pistons PR official twitter posted a random Jaden McDaniels gif  Twolves fans, are you ready for RODNEY MCGRUDER TAKEOVER???????!!"
Jaden mcdaniels is extremely good
Jaden McDaniels no bias
"Or Jaden McDaniels. Dude put the absolute clamps on Williams for the Bulls last game, has been one of the best defenders in summer league while also being the best player on the Wolves 2-0 team and he wasn't mentioned once. Doesn't really surprise me though. Dude should've gotten 1st team all rookie last year and didn't even make 2nd team."
Jaden and jalen mcdaniels. Juancho and willy hernangomez.
Jaden Mcdaniels would go top 7 in a redraft easily.
Summer league Jaden mcdaniels = kd with better defense
"This is the problem. The Wolves aren’t willing to give up much of what it would take. I think Jaden McDaniels has a ton of value around the league, but the Wolves value him even more. It would probably be an offer of Beasley, Layman, Vanderbilt and a couple picks. The Sixers have their sights set sky high which is making it super tough to see anything lining up between these teams. And if the Sixers sights stay this high, it’s hard to imagine anything happening. Feels like we’re trending towards a Harden/Butler-like situation more than a Kobe one."
Kelly Olynyk IF they start him Kevin Porter and KJ Martin Oshae Brissett Jaden McDaniels Nic Claxton Tyrese Haliburton and Chimezu Metu Devin Vassell  Nickeil Walker Alexander Robert Williams
Here is what I'd be willing to give up but idk about other Wolves fans. I'd give up:  Malik Beasley Jaden Mcdaniels Juancho Hernangomez 2 first round picks.  That would be the highest I'd probably go.
"Jaden Mcdaniels, firsts (Not sure if Minnesota has them to trade, but they'd have to in this scenario). Jaden looks like a stud"
"Minnesota is not giving up KAT or Ant in any deal for at least 2 more seasons. It only works if Portland is ready to go in a full on rebuild with picks. The ""stars"" of the deal for Portland would be Jaden McDaniels and probably Leandro Bolmaro, then probably Malik Beasley and Juancho and whatever else to make the numbers work. From there, they'd get a metric ton of picks and I'm sure they could demand one of the better prospects from the 76ers as well. The team giving away the best player almost never wins, unfortunately."
"The assets from the Wolves would be picks and Jaden McDaniels I think, not DLo"
Jaden McDaniels
"&gt; Jaden McDaniels is the one big bright spot from the last year of mediocrity.  Hmm, I remember another pretty big (almost ROTY sized) bright spot last year"
"Jaden McDaniels is the one big bright spot from the last year of mediocrity. The emergence of Nowell is nice too, I really liked him when he first got drafted and he's made huge strides since then"
"This is the market that holds the record for the most tickets sold in a single season. Yes, the stadium we played in was massive but I still don't know how many cities would be that engaged to sell THAT many tickets even for a first season.   When we are good, we instantly shoot up to about 15th-20th in attendance, even without a playoff guarantee (see the Butler year).   Minnesota loves basketball. We just had 9,000+ people come attend an in-person practice with Jaden McDaniels being the best player."
"Dame to Philly, a shit ton of picks from MN to Portland, picks and some combo of Maxey/Milton/Thybulle to Portland, Simmons to MN? Throw in Jaden McDaniels to Portland if need be. Am I wrong for thinking that's a pretty solid deal for all parties? It's always a shitty situation to have to trade a star like Dame, but getting a king's ransom of picks might be the best route if they have to trade him."
"Had a great year in Phx. Building to something really great in the bubble. Traded for Chris Paul.  The year before that he was finding his place with the Jazz. Started his Ricky Rubio Foundation there. Was replaced by Mike Conley.  Getting replaced by older vets while you're in your prime and looking to be a vital part of a team has to be doing things to your head. Ricky is all about mental health and head space. He obviously wasn't in the right place when he came back to Minny. By the time he settled in, it was clear that the Wolves weren't looking for a playoff spot and focused on building younger talent like Ant and Jaden McDaniels. So that's what Ricky's role came to be. He was shooting much better during the 2nd half of the season. Ant had been speaking highly of him as a vet."
"I remember that run fondly, he also outdueled giannis toward the end of the year. The thing with that sixers team though, we had ersan and Dario. Those are the kinda bigs that work with Simmons. I think twolves are the best fit for him because Kat is such a good shooter and Ben could really cover kats shortcomings on D. I don’t know what going but I’d be trying to do a Ben for dLo and jaden mcdaniels based deal."
Good to know. If he does end up on the move I’d take him with open arms. As I originally said I don’t know if there’s a better fit than next to KAT and lord knows the Wolves need to start winning. I hope if the opportunity comes Rosas puts together a competitive offer.   He’s also alluded to being willing to move a guy like Jaden McDaniels if it meant getting back a premium player.
Jaden mcdaniels
Jaden McDaniels is gonna be running our offense and asked to be more of a creator on offense.  I think hes got alot of potential at it and happy to see it.  Last year he was almost exclusively used in catch and shoot because we prioritized Ants development (the right choice obviously)  so im excited to see Jaden get to develop that aspect of his game.
Isn't Jaden McDaniels a 4 and one of the best defensive players on your team?
Oh I love Jaden Mcdaniels he was definitely one of the biggest steals of the draft. His 3&amp;d potential is through the roof
Thats probably fair value on our end for simmons but i just don't think Minnesota can trade both as we would have so little spacing for either simmons or Ant to do their work.  Minnesotas path to getting simmons has always been with a third team getting a bunch of picks and swaps and players like Jaden Mcdaniels and Naz Reid and other young non anthony edwards players going to the third team who are trading you guys the vets you want and Beasley probably also going to Philly which just isn't happening at the current moment.
They get Jaden mcdaniels and a shot w culver!
"DeAnthony Melton, Thad Young(he's probably too good for this title), Cameron Johnson, Jaden McDaniels, Reggie Bullock"
Isn't that Jaden McDaniels or are you all running him at the 3?
Big Mac for Jaden McDaniels. Because we already have Jordan McLaughlin on the roster who we refered to as JMac already. So Jaden became Big Mag and Jordan Lil Mac.
"&gt;Why did you trade for him in the first place exactly?   To mentor Anthony Edwards and have a high quality backup PG, he was also part of the Jaden McDaniels trade which was very valuable.   Rosas also wanted to keep his money on the books for one more year since James Johnson was an expiring."
Realistically a shit ton of picks and Beasley/culver/other wing guy we traded Ricky for. That's basically all we got. Maybe Jaden McDaniels too actually.
Likely because they asked for Jaden McDaniels or picks. Not because we didnt want Kuzma
I can probably agree with that tbh. I’m not saying McDaniels is some far superior player to Kuzma but fit and cap hit wise I’d rather stick with Jaden.
Gallo is much better than Lauri.   Jaden McDaniels would play over Lauri if both are with the Bulls.
"He said he's looking, but what we got right now... Taurean Prince is a smallball 4, Jaden McDaniels is a smallball 4, ect."
Jaden McDaniels is a promising weak side rim protector too.
"RJ Barrett. Jaden McDaniels.   Anthony Edwards will be a legitimate all star and the Wolves will fight for a play-in where nobody wants to play them.   Also not star, but as a role player Aaron Nesmith is going to surprise a lot of people. Think Danny Green esque role player."
Jaden McDaniels
Jaden McDaniels is primed to be that next 3nD guy people always talk.
Jaden McDaniels bout to be Brandon Ingram next season
Our rook Jaden McDaniels comp has been Issac and he has looked super promising so there's a lot of hope he's our 3/4 of the future.
I believe we got Jaden McDaniels out of that deal. So from that perspective it was well worth jt
Ben Simmons for Jaden McDaniels who says no
How do you feel about  Rubio + Jaden McDaniels for Danilo + Huerter or Reddish
"I’m a wolves fan as well, so I’m fully aware. It’s just that Okogie’s offense is so bad, he’s too much of a liability to play big minutes. Beasley is a great shooter, but a weak defender. Nowell can score, but isn’t much of a defender either. With D’Lo and Ant being sub-par defenders, they need somebody to balance the lineup. KCP fits that role better than any of those guys. (That said, it’s possible Jaden McDaniels starts at the 3 this year)"
So many weird things in this tweet   He capitalized “Big Superior”   He put a “:” before Jaden McDaniels when he didn’t  have to   Then I guess he kinda used the colon right to end the tweet but its still weird to me
&gt;I think the Wolves are much better off trying to develop Jaden McDaniels tbh   You really think we were gonna give up Jaden for Kyle fucking Kuzma? lmao  Also Kuz is a PF and Jaden is a natural SF so they don't overlap.
"I agree. I honestly think Jaden McDaniels is a future DPOY. Having that level of a defender on a team with KAT and D'Lo is incredibly important. Plus he can shoot the three, which means you can actually use him in a modern offense unlike most defensive minded players."
I think the Wolves are much better off trying to develop Jaden McDaniels tbh
how much do you think Jaden McDaniels is valued in the market? prob not enough to move the needle in this case but i feel like he's shown some flashes
Jaden McDaniels.
"Lakers, Jazz, Nuggets, Suns, Clippers.    I might be a homer but if Minnesota stays healthy they should be contending for a 7 or 8 seed this yr. When KAT and DLO have played together they have done well. And Ant is going to be a beast if he stays on track. I think with DLO, Ant, Kat and Jaden McDaniels we are sitting okay. If we can somehow land Ben Simmons without giving up that core we should absolutely be a lock for the playoffs."
This is Jaden McDaniels erasure.
"""Tell me you know without telling me blah blah blah""  Ben Simmons is worth more than Malik Beasley and Jaden McDaniels. Feel free to be the GM tho, you guys would be super content with going 23-49 every year."
"Beasley, Jaden McDaniels and a few picks. One of the few offers out there."
"No way we can offer Shake Milton, he’s completely untouchable.  Wolves fans get what I’m talking about with Jaden McDaniels.  When a young guy scores over 7 ppg, you can’t give that up in any circumstance"
"Malik Beasley,Jaden McDaniels,Pat Bev and 2-3 1sts."
Absolutely. Especially if they end up keeping Jaden McDaniels.  I think it would actually take more draft assets than that.
"If there is a trade, the package would most likely be something like  Ben Simmons to Timberwolves  Malik Beasley, Jaden McDaniels, and either Patrick Beverley or Taurean Prince, and 2-3 first round picks (with some initial protections) to Sixers  Salaries match. No way Sixers do this unless they are desperate. I don’t think Sixers are that desperate. I think they are actually hopeful to give Maxes/Thybulle/Reed some of Simmons playing time to see how they do, even if he sits out."
Bruh Jaden McDaniels is a quality starter.
1. Suggs  2. Fourier  3. Pokusevski  4. Jaden McDaniels  5. Khem Birtch
Jaden McDaniels. I've seen plenty of Sixers fans mock the idea of getting Jaden or dismissing him as some 5-6 ppg player but as a rookie he showed that he was a quality 3&amp;D wing who could hit open 3's and had the length to guard anyone (not the muscle though). It's up to him if he can bulk up and live up to his potential though but definitely an Ariza type player.
Jaden McDaniels is just a prospect but Vanderbilt is an up and comer...I'd have to disagree lol
"No Jaden McDaniels slander allowed. He's unironically an incredible value player for a young guy.  You can have your beef with Ant, KAT, even DLo. We don't take McDaniels slander here."
I'll try for real: your starting PF is Jaden McDaniels
"Starting 5: Jokic, Jerami Grant Middleton, Smart, Steph. Bench: Ingles, Patty Mills, Seth Curry, Caruso, Marcus Morris, Naz Reid, PJ Tucker, Jaden McDaniels"
"Trade Machines tell me that it's possible if Houston gets a contract dump of a bunch of players - Malik Beasley, Taurean Prince, Danny Green, Shake Milton, Naz Reid, Paul Reed and Isaiah Joe would work, with two or three first round picks as sweetener.   So many players means that a 4th team might be needed (OKC or Memphis or San Antonio?).  Basically:   Philadelphia: John Wall and Jaden McDaniels, some 2nd rounders?  Minessota: Ben Simmons, some 2nd rounders?   Houston: Malik Beasley, Taurean Prince, Danny Green, Shake Milton, Naz Reid, Paul Reed and Isaiah Joe + 2 first round picks.  http://www.espn.com/nba/tradeMachine"
TWolves' Jaden McDaniels
"Talen Horton Tucker, Jaden McDaniels, or Jaren Jackson Jr."
"If Jaden McDaniels isn’t involved, then count me in"
"If the best trade offer on the table is Malik Beasley and Jaden McDaniels, then yes lol. It's all background noise because there's nothing else happening. Once the season starts, if he's still here and the Sixers start the season fine, it will be pushed to the backburner."
lol yeah because I'm sure Embiid would be over the moon if Morey traded Simmons for Malik Beasley and Jaden Mcdaniels.
