"Sixers are well poised for Ben to stay home.  They have Tyrese Maxey and Shake Milton competing for minutes already, and then drafted Jaden Springer.  Milton is a legit nba player, and Maxey looks to be even better.    This is a Khawi Leonard-San Antonio holdout/injury situation.  Both sided need to call it a mental health break, like Simone Biles and Naomi Osaka did.    Considering Philly's bench also includes prospects they are high on and want to showcase for potential trades, like Matisse Thybulle, Furkan Korkmaz, Bball Paul Reed and Isaiah Joe, seems to me the Sixers can win on the court and develop at the same time Ben sits out.    If any of Chicago, Portland or Minnesota gets off to a poor start while the Sixers and Embiid chug along, philly's chances of getting Lillard, Lavine, or Edwards increases.    Edwards most likely, because KAT, Malik Beasley and Dangelo Russell and Jaden McDaniels all fit around Ben Simmons  better than Edwards if the Wolves were to trade for him.  Plus, Morey built a team lat year suited for James Harden, stands to reason the next best thing would be a prospect with Harden's skillset like Anthony Edwards.  ."
Yeah but trading away our biggest trade asset at rock bottom value because we're afraid of a holdout is the quickest way to become mediocre. We're better on the court with Simmons than with anything that was offered for him. So let him hold out but don't trade him for Wiggins or Jaden Mcdaniels.
"Jaden McDaniels not from my team but I gotta bring him up. Probably Jordan Poole feom us, he showed a ton of improvement over the year"
"Anthony edwards, Jaden mcdaniels.  Timberwolves circa 2020."
Jaden McDaniels and Anthony Edwards
"I hope we don't get him. We gave up our draft pick last year to get rid of a max player who didn't give a shit. Please don't get another one.  Also, I like Jaden McDaniels and think he could be really good. I don't like DLo actually but at least he is a good shooter. Simmons refuses to shoot, why why why why why no no no no no. Although I want Edwards shooting any big shots, so maybe a DLo (or DLol) swap would be ok.  I also didn't want them to pick Ant so ok I'm wrong often."
"&gt;The main packages that exist are a D'lo package that the 76ers are lukewarm on or a Jaden McDaniels,Malik Beasley + filler + picks although Gersson Rosas is reluctant to move D'lo. He believes the 2nd offer is a lot more enticing because those picks could be used later down the line to trade for Dame or Beal, since GM's saw this year how valuable unprotected Minnesota picks are.  If the Wolves get Simmons without giving up any of their best players those picks won't be nearly as valuable."
"They are close, and that's likely why Minnesota will need a third team who really loves Jaden McDaniels if they want to add Simmons if the reports are true.  More likely though is that they miss out on Simmons entirely if they really won't part with D-Lo. And that's where it becomes stupid from an asset management perspective.    Edwards being untouchable makes sense. Beyond that, if you take the reports at face value (which, again, i do not, Gerson doesn't strike me as a moron), this reeks of same ol' Minnesota"
"I think this trade makes sense, but tell why this trade DOESN’T make sense.  MN gets: Simmons Philly gets: Siakim Toronto gets: Jaden McDaniels, Beverly, Prince, 3 MN first rounders.  Rationale: Philly gets an all star level player who plays good defense and is an improved shooter to replace Simmons. Toronto commits to a rebuild rather than being stuck in no man’s land. They get a nice young piece in McDaniels, a lot of draft picks that could be valuable. And they replace Siakim’s monstrous contract with ~$30 million in expiring contracts. Minnesota mortgages their future but improves a lot in the present and has a potent starting lineup of DLo, Beasley, Ant, Simmons, KAT."
"Wiggins, Gobert, Simmons (prior to the playoffs), Jaden McDaniels, James Wiseman, Matisse Thybulle, Draymond Green, Bradley Beal, Butler, Myles Turner, DeAndre Ayton, Westbrook,"
"&gt;I don't think they're incompetent, because I view the reports as posturing, not as fact. But yes, they're incompetent if they're considering Jaden McDaniels as too good to include in the package, or if they turn down D-Lo for Simmons.   You are aware there is a particular reason they traded for D'lo in the first place? Roster construction is not all about how many ppp this guy creates or what his TS% is..."
"I don't think they're incompetent, because I view the reports as posturing, not as fact. But yes, they're incompetent if they're considering Jaden McDaniels as too good to include in the package, or if they turn down D-Lo for Simmons."
&gt;What do you mean so? thats clear character issues and lowers his value whether you like it or not.  Ironic considering the same shit is lowering Ben's value.  &gt;Lmao 6th man on a wcf team is meaningless. He cant even stay on the court and hes not good. His value is a mid 2nd rounder and you know it. If he was worth anything you wouldnt have got him for what you traded.  Look at Booker's or Mitchell's FG % when guarded by Bev and not. His only bad series was against Dallas because Luka is the size of a SF and Bev couldn't do anything against him.   &gt;Do you know anything about my team? If ya do care to explain why we'd give a shit about a 2nd year player like McDaniels while we are trying to contend with our MVP candidate? Or why we'd want your picks that will suck when you win 40+ games with Ben?  The goal is to accumulate assets and ship them off the moment another star becomes available because you are not trading for one atm. I'm very well aware of the needs and wants of the 76ers.  And again Jaden is a very good defender and a decent spot up shooter and he's on a rookie contract. He's a player that is needed on every championship contender and there lies his value. But you don't know anything about him beyond what bbref tells you.
"Malik Beasley,Patrick Beverley and Jaden McDaniels are worthless?   Okay chief ✌"
&gt;They are peak delusion right now. They've won 42 games the last 2 seasons combined but apparently half their roster is untouchable.   Delusion? I just said that its harder to get Jaden McDaniels from us than Malik Beasley and if you have a problem with that send an email to the Minnesota Timberwolves and not argue with me since they are the ones who decided that not me.
Lmfao is there seriously both a Jalen McDaniels and a Jaden McDaniels in the league?
"The most realistic to me for the Wolves requires a 3rd team. I think the Wizards makes sense, with it going:  Simmons to Minnesota  Beal to Philadelphia  Patrick Beverly (sorry for the 1000000th trade), Taurean Prince, Jaden McDaniels, and two 1sts to Washington.   I could also see Washington getting a 1st out of Philly to get it done. Beverly and Prince are expiring contracts so they get cap flexibility going forward.  McDaniels looks like he could develop into a very good player, probably not an all star, but one of those guys that you love starting for you under a cheap contract for 3 years. They also get 2 or 3 extra firsts, and Minnesota firsts hit different.   I'd be interested to get the perspective of a Wizards fan because from the outside your team looks like a prime candidate to blow it up and see what can happen in a few years."
"Wolves are the only team of the three I think is clearly better this year than last, and that's mostly because I think Anthony Edwards, Jaden McDaniels and Naz Reid are good and getting better rapidly.  If Malik Beasley, D'Angelo Russell and Patrick Beverley play 65 games or more apiece, the Wolves will be saying something.  And let me also say Malik Beasley's shooting fits around Ben Simmons better than Anthony Edwards.  If the Wolves put four above average 3pt shooters like KAT, Russell, Beverly and Beasley around Ben Simmons, its bombs away!    Sacramento, meh.  I like Davion Mitchell, but dont understand how four guards (mitchell, fox, haliburton, hield) are going to make that much of a difference on defense when you're still relying on Barnes, Bagley and Holmes in the front court.    David Griffen should be arrested for what he's doing to the Pelicans.  What the hell do they have to show for trading away Jrue Holiday and the Lonzo Ball?  Totally unexcited about Kira Lewis, Alexander Walker.   Zion Williamson needs to play with a big who can stretch the floor, and the Pelicans got Steven Adams last year, and Jonas Valenciunas this year?  Trey Murphy was a good pick.  That's about it.  Got lucky there, because the Wizards were smoking crack when they let him slide past."
"Malik Beasley,Pat Bev,Jaden McDaniels and 2 lightly protected 1sts."
"Minus defender? So you personally watched Jaden McDaniels play defense a good amount and came to that conclusion that he is a bad defender? He's insanely long, athletic, has quick feet, switchable, has good hands and a good defensive awareness. I really don't see how you think he is a bad defender. Defense is a lot more about scheme, matchups etc so the defensive rating of course is going to be poor bc the TWolves as a whole had a defensive rating of 114.5, 27th in the league."
Jaden McDaniels exists.
"I’m betting on San Antonio.   I think it’ll eventually come down to CJ or a package of rotational players and picks. I think Philly will opt for the package of players to try and recoup possible future assets for a bigger trade. When it gets to that point the 3 teams I see bidding against each other are Minnesota, Sacramento, and San Antonio.   When comparing deals for these teams I’m going to assume a few guys are just off limits so those being De’Aaron Fox, Tyrese Haliburton, Karl-Anthony Towns, D’Angelo Russell, Anthony Edwards, and Dejounte Murray.   To keep everything fair for hypothetical reasons I’ll say each team trades a unprotected pick, protected pick and a swap along a starter level player, rotational player, and a player on a rookie deal. So deals of something like;  Malik Beasley, Jaden McDaniels, Taurean Prince, 2022 top 5 1st, 2024 pick, 2025 swap   Derrick White, Devin Vassell, Thaddeus Young, 2022 top 5 1st, 2024 1st, 2025 swap   Buddy Hield, Davion Mitchell, Marvin Bagley?, 2022 top 5 1st, 2024 1st, 2025 swap.  Looking at it like this I would instantly rule out Minnesota. I think they have the worst collection of players here (outside of McDaniels I’d probably take him over Mitchell and Vassell but it’s not a large gap at all) and when it comes to future value of those picks I think they’d be a playoff team and those picks would project to be late teens to mid 20 picks. Along side that Minnesota virtually has nothing of value to add to compete against other offers other than picks, and their whole team is just consisted of 4 players.   That leaves it between Sacramento and San Antonio. To me both teams add something of value to Philly SAS gives them a Swiss Army knife half court ball handler, SAC gives them a high level floor spacer, and to me Mitchell and Vassell are equal in value and have similar skillsets despite playing different positions. I think the main swing factor here is if Sacramento throws in Harrison Barnes or not. If Harrison banes is replaced with Bagley I’ll go Sacramento without a doubt, but if not I don’t see what other quality rotational or player with value sac can really add to entice Morey (I wouldn’t take Bagley or TT over Thaddeus Young). Unlike Minnesota I think despite adding Simmons both teams could still realistically miss the playoffs which makes those draft picks more valuable, and I think both teams can take the depth hit when trading Quantity for Quality. I think even more so San Antonio can with how many players they have still on rookie deals, and if needed to they could probably throw in even more players like Walker IV or more picks like the bulls one they just got.   Did I just damn near write an essay on Ben Simmons trade destinations? Yes. Is it flawed? Probably am I bored? Also yes"
Minnesota: Beasley bev Jaden McDaniels 2 unprotected first round picks
"No, they wouldn’t. The rumors are that the Timberwolves are offering draft picks, Malik Beasley ($14 M), Jaden McDaniels ($2 M), Naz Reid ($1.7 M), and one of Patrick Beverley ($14.3 M) or Taureen Prince ($13 M). Those contracts combined match Simmons’s contract of $33 M.   Neither of those trades can be completed today though, so we don’t know if the 76ers would accept that offer. Taureen Prince can’t be traded till September 27th and Patrick Beverly can’t be traded till October. As a result, we won’t see any deal accepted until then at the earliest."
Jaden McDaniels lowkey
I’m gonna high jack your comment to put forth a hot take trade proposal:  Minnesota gets: Ben Simmons  Philly gets: Cam Reddish Bogdon  Beasley 2025 first Pick swaps  ATL gets: Jaden McDaniels 2023 first  2027 first Pat Bev  Idk this actually looks bad lol
"Anthony Edwards, Malik Beasley, Jaden McDaniels and it's a done deal. No additional picks.  Big 3 of KAT, DLo and Ben looks $p00ky"
Jaden mcdaniels &gt; jrue holidays D.
"Damn sixers about to end up with Malik Beasley, Taurean Prince, Jaden McDaniels and like 3 firsts"
I was equally if not more excited about Jaden McDaniels last year than I was about Ant. I honestly don't want this trade to happen. I watched those playoffs last year. I saw that bunny ass pass by Simmons under the hoop and all the free throw clunks. Pulling one of your max contract guys off the floor in crunch time because he can't shoot a free throw? Nah no thanks.
"&gt; Detroit: Jaden Mcdaniels, Taurean Prince, Danny Green  Bruh"
"It’s all about matching, Ben Simmons leaving is a given and they’re not gonna get an equal return that’s already known. But for example let’s say next year a star requests a trade and the team wants to kickstart its rebuild   Philly has 3 first round picks from Minnesota, young assets in Jaden Mcdaniels, maxey, and thybull, and expiring contracts they can toss in or maybe even get off Tobias’s contract as the money filler. Who can outbid Philly with a package of 4-5 frps, young stars, and expiring contracts? If dame or Beal leave they’re not retooling they’re going for a rebuild, no other team can match what Philly could offer to pair a star with Embiid"
It's funny to see people thinking Jaden McDaniels is a scrub. Dude would be the centerpiece the Wolves offer. He's better than Beasley.
It seems recently we have done well. You could add Jaden McDaniels and Malik Beasley to that as well. Now if we could somehow run a league average defense that would be cool.
"Yes, I rather go for Timberwolves   We would get assets for a trade like Jaden McDaniels and a few picks"
If only it was Jaden McDaniels instead
"Timberwolves flip their backup PG/ SG duo for the perfect PF fit next to KAT and D'Lo  Blazers fix their backcourt issue and introduce size. Instead of a starting line-up of Dame/ CJ/ Powell they now run Dame/ Powell/ Jerami Grant and they also get a sixth man combo guard off the bench in Malik Beasley.  Sixers snag CJ who is a much better fit next to Embiid, they also snag a backup PF in Jaden McDaniels who should improve on his respectable rookie numbers, and they also get a future 1st from Minnesota that they can flip for a vet at the trade deadline to shore up any gaps they have.  Pistons get two first round picks for Jerami Grant who doesn't really fit their timeline."
76ers also get wolves 2nd   Timberwolves get Myles Turner  Indiana gets Malik Beasely or Jaden McDaniels
"Sixers get: Bev, Beasley and Dejountae Murray  Twolves get: Simmons  Spurs get: Maxey, Jaden McDaniels, Okogie  Maybe add some picks and swaps from Twolves.   The money works, Sixers improve upon the guard rotation and get rid of Simmons. Twolves get Simmons in a win-now move. Spurs get young assets and maybe some picks in return for their biggest asset."
"Someone else mentioned that the Sixers should package Tyrese Maxey and Simmons in a three team trade involving the Timberwolves.   Third Team Receives: Maxey, Timberwolves 2022 FRP, Timberwolves 2026 FRP, Jaden McDaniels, and Two Timberwolves FRP Swaps.   Timberwolves Receive: Ben Simmons  76ers Receive: Third Team star player.   I'm not sure which team makes up that third trading partner. Wizards (Beal) or Trailblazers (Lillard). I don't know, man."
"Yeah, I get why people are saying the Kings as a landing spot for Simmons, but that's pretty much the only package that might get it done (aside from ones including Fox, but that should obviously be a nonstarter for the Kings), and it leaves the Kings with essentially no shooters. Don't see it happening without a third team involved.  Maybe there's a framework to be had around Hield and Beverley, with the Wolves getting Simmons and the Kings getting Jaden McDaniels (who would be a great fit for a young team that needs defense) and salary filler? I dunno, the Sixers definitely want more than that (plus picks) for Simmons, but I feel like there's something there."
"I'll start,  Philly:  Malik Beasley   Wolves 1st 2024  Collin Sexton  Ricky Rubio  Cavaliers:  Jaden McDaniels  Patrick Beverley   Philly 1st 2022  Wolves 1st 2022  Minnesota  Ben Simmons"
"The trade would likely be Beasley, Beverly, jaden mcdaniels and picks"
"Who says no?   Sixers get:   * Jerami Grant  * Malik Beasley  * Patrick Beverley  Wolves get:   * Ben Simmons  * Seth Curry  Pistons get:   * Jaden McDaniels  * Naz Reid  * Matisse Thybulle  * Tyrese Maxey  * 2023, 2025 Sixers 1sts  * 2023, 2025 Wolves 1sts   * 2022, 2024, 2026, 2028 Sixers pick swap options  Sixers get a championship roster top to bottom. Beverley/Green/Grant/Harris/Embiid with Beasley as sixth man is FILTHY.   Wolves get Ben without giving up D'Lo, Ant, or KAT. D'Lo/Curry/Ant/Simmons/KAT is a good ass team  Pistons flip their star to launch their rebuild forward. They get four great prospects, four 1sts, and four pick swaps (two of which will probably be really valuable down the line once Embiid and Harris are old)."
Sixers get:   * CJ McCollum  * Patrick Beverley  * Naz Reid  * Wolves 2023 1st   Wolves get:   * Ben Simmons  * Seth Curry  Blazers get:   * Matisse Thybulle  * Malik Beasley  * Jaden McDaniels  * Jake Layman
"If Jaden McDaniels was on the Lakers, he’d be talked about like OG was during the peak of his value, IMO."
Enjoy Malik Beasley and Jaden McDaniels
"&gt;Some combination of Malik Beasley, Jaden McDaniels, Naz Ried, multiple big expiring contracts (Taurean Prince or Patrick Beverley), and/or multiple future 1sts.  LOL"
"jaden mcdaniels, naz reid"
"Some combination of Malik Beasley, Jaden McDaniels, Naz Ried, multiple big expiring contracts (Taurean Prince or Patrick Beverley), and/or multiple future 1sts."
"Philly won’t get any player they want, they’re better off getting assets they can use in a future trade for a star asking out. I don’t think kings are giving up fox, warriors fit with draymond and Ben is kinda sus especially considering they have interesting rookies and giving up Wiggins who has been a great defender and can actually shoot seems like a waste of assets for them, clippers have no legit assets outside of PG and kawhi, literally no picks, lakers have no contracts to match Ben. Minnesota makes the most sense fit wise and Jaden Mcdaniels is still a great trade chip on top of the picks"
"This is what the article said  ""The Timberwolves have been motivated to find a deal for Simmons but would likely require a third team given their asset pool of Malik Beasley, Jaden McDaniels and D’Angelo Russell might not entice the 76ers.""  It never said they offered all 3"
"&gt; The Timberwolves have been motivated to find a deal for Simmons but would likely require a third team given their asset pool of Malik Beasley, Jaden McDaniels and D’Angelo Russell might not entice the 76ers.  Jesus that's way to much for Simmons. Guy can't fucking shoot. Not worth those three."
"""The Timberwolves have been motivated to find a deal for Simmons but would likely require a third team given their asset pool of Malik Beasley, Jaden McDaniels and D’Angelo Russell might not entice the 76ers""  Am I the only one who doesn't think this is a bad package? Obviously doesn't make them better as a Dame would but that it's not that bad"
Nope Beasley for sure and the wolves would hate to do it but prolly include Jaden McDaniels
"Comparing players outside of Ja and JJJ vs Kat, DLo, and Ant.. this is what we have  Memphis: Dillon Brooks, Steven Adams, Kyle Anderson, Tyus Jones, Desmond Bane, Xavier Tilman, Brandon Clarke, DeAnthony Melton.  Minnesota: Patrick Beverley, Malik Beasley, Tauren Prince, Naz Reid, Jaden McDaniels, Josh Okogie  While I 100% agree that Memphis has more playable guys, we really only have a couple starting-good bench quality players on each. Memphis definitely has more lower bench guys that are still playable, but I focus more on the few that are starter quality players, like: Dillon Brooks, Steven Adams, Kyle Anderson, Patrick Beverley, Malik Beasley.  I think Brandon Clarke and Naz Reid are both close to that level, and everyone else is just decent in a bench role or shouldn't be getting minutes, on both teams..  So the big factor is 3 all star potential players versus 2, though I argue JJJ is by far the biggest stretch to hit that point this season. Also KAT is the best of those 5, then Ja really isn't ahead of DLo and Ant by that much when everyone is healthy. Imo"
Must've been having a good night. Jaden McDaniels is a bum
Jaden McDaniels
He’s a few years away. Had the pleasure of watching Jaden McDaniels absolutely lock him down at SL. Every possession he’d run around screens to get switched of Jaden.   He’s got a lot of tools but he needs to learn how to keep dribbling in traffic and he has to play through contact better.
Jaden McDaniels Brandon Ingram KD
I mean yea they are interested in fleecing philly. Why wouldn’t they? But no trade is gonna happen between these two teams philly wants someone that will help them win now or a package that will help them trade for someone who can help them win now. While the twolves don’t want to give up any of their actual valuable pieces in dlo or ant and instead want to offer something like Malik Beasley(who just got out of jail I should add) and Jaden McDaniels(cool 3 and D prospect but nothing crazy to be fair) and a couple of first which if they get Ben shouldn’t even be that good. Trade makes 0 sense for philly so it will never happen they’d be better off taking Cj and a pick or so from Portland.
"I think it depends on how this year goes honestly. If we only win 30-35 games this year it might be time to consider resetting and building around Edwards/Jaden McDaniels.   A boatload of value for KAT could help us start off right and maybe in a year or two be where the grizzlies are currently with room to grow  Of course if Ant looks bad this year then I dunno, blow it up and relocate to the moon?"
KAT  Ant  Jaden McDaniels  Malik Beasley  Naz Reid
Jaden McDaniels
"to an extent, Jaden McDaniels, he's known for having a bit of a toxic streak on the court (Called James Wiseman ""sewer trash"" during a high school game, got T'd up a ton in college), meanwhile he's very soft spoken and shy during interviews, ending some of his summer league ones with ""thanks, have a nice day,"" prompting aww's from the broadcast team"
"If we’re considering players 25 and younger, I think the Wolves could be a part of the conversation. Not saying they are THE best young core, but KAT (25), DLo (25), Beasley (24), Ant (20), Jaden McDaniels (20), Naz Reid (21) is a pretty nice core. Two all-stars, one of the best three point shooters in the NBA, a potential future all-NBA player (Ant), a future all-defensive player (Jaden), and an offensively versatile backup center that could probably be a starter on a handful of other teams."
Jaden McDaniels is part of the core. He’s a good defender. I think you’d be surprised if you checked him out
Anthony Edwards  Jaden McDaniels  Naz Reid  McKinley Wright  Patrick Beverly
Jaden McDaniels. Probably our best defender and shows flashes of offensive ability. Hope to see him and Ant together in Minnesota for a long time.
"If Sixers want to win in Embiid's window, they shouldn't look for 3 1sts. Two solid role players ie Malik Beasley and Jaden McDaniels is what they need.  The Big 3 of DLo, KAT and Ben looks solid. Three all-stars at the age of 25, sheesh. The wolves are gonna be a problem in the West for years to come"
Jaden McDaniels effect
Bucks have no center and it’s showing…also how the hell did Kat get out-rebounded by Jaden McDaniels and Jarred Vanderbilt? Sad.
There’s a jaden and a Jalen mcdaniels
Uh isn’t it Jaden McDaniels?
Jaden McDaniels is going to be a top 5 defender in the league after this year.
"Yeah, but I feel like it's the same discussion all the ""interested teams"" fans are having.   We should trade for him, *if we can get a great deal.*  The other problem the Sixers are going to run into is what constitutes a *great deal* is going to change night-to-night for a lot of teams. Jaden McDaniels is a great example. All summer, Wolves fans were ready to throw him in a deal, but he played incredible defense in the first two games of the season and now they're a bit more hesitant. Front offices are having the exact same conversations every day now."
If getting rid of D.lo and a few protected picks or Jaden McDaniels gets me Simmons I do it in a heartbeat. No team is getting far with D.lo at PG
