"I believe they do. ANT, KAT, DLo, and Jaden McDaniels are the future of this organization. Couple that with Beasley, a proven 20 PPG scorer who can either be a lethal 6th man or a trade piece for an athletic defensively sound rim protector, and Leandro Bolmaro, our third first rounder this last year who shows promise, and you have something there. Not to mention Finch has show real promise as a savvy X’s and O’s guy who’s got a good coaching background and a capacity for leadership."
Why don’t we admit it’s too close and give it to someone else. Someone totally random. Why don’t we just give it to that Jaden Mcdaniels guy
"i was taking mainly the best 2 players because if i start nickel and diming every injury you got the fact that beasley has missed over 30 games now, and its much easier to see the impact when you stay looking at the top of the team's pecking order. I can argue that ""of the games jaden mcdaniels missed we probably win 2 more with him there"" but thats not nearly as arguable or important as ""the team plays better with their 2 best players healthy""       Like i said before, i have 0 problem with Lamelo and think if he stayed healthy and stayed consistent or even improved somewhat he'd have it locked up, i just take exception with the ""efficiency"" and ""contributes to winning more"" arguments since the game tape of edwards directly contradicts them"
"Fine, we'll settle for Jalen Suggs. He'd fit on our team extremely well considering we have:  Jaden McDaniels,Jaylen Nowell,Jordan McLaughlin,Juancho Hernangomez,Jake Layman,Josh Okogie,Jarret Culver and Jarred Vanderbilt"
"Who is he replacing on this list: Ball, Edwards, Haliburton, Patrick Williams, JaeSean Tate, Saddiq Bey, Quickley, Okoro, Bane, Cole Anthony, Campazzo, Stewart, Jaden McDaniels, Wiseman. He’s gotta be better than 4 people to make it"
"All offense no defense? Aren't they 25th in offense?  Looking into it I guess they are 11th post AS break, that's pretty solid. Lots of shootouts.  Big fan of Jaden McDaniels so far though, dude has all the tools to become an elite defender. And I love watching Jarred Vanderbilt on defense too -- if only he was able to hit more than... \*checks*... one three in his entire career holy shit"
They aren’t wrong either lol it’s just been terrible decisions after terrible decisions. Just this last decade they had a bright future then flip died and they gave thibs the job and he traded half their future for a rental in Jimmy and then Jimmy tanks his value and trashes the franchise on his way out and they don’t get proper value for what he was worth. In the end it kind of worked out because they were able to turn Jimmy into Roco who turned into Beasley Juancho and Jaden mcdaniels who’s looking very promising and they ended up getting Anthony Edwards. This might be the beginning of something new for the Timberwolves
1: Anthony Edwards 2: Naz Reid 3: Jaden McDaniels   ...then burn the list
It's Jaden over DLo as an asset.  30/30 teams would take McDaniels on a rookie deal.  Can't say the same about DLo contract.
All of the teams in your top 5 would rather have Jaden McDaniels.
"It really is absurd.  Starting with the 2016 class, wroten, thybulle, Isaiah Stewart, jaden mcdaniels, jalen nowell, Markell fultz, marquese chriss..."
"We are already the youngest team in the league, and have promising players on the roster already. Having a big 3 of Kat, Dlo, and Edward's is a great core to move forward with. Throw in guys like Beasley, McDaniels, Naz Reid, and potentially a Mobley in the draft and were cooking. Rebuilding the right way takes time, and with our play recently on the court, you cant say the Timberwolves are an easy win right now. I'm looking forward to next year with the improvement of Edward's and Jaden."
"Put some respect on Jaden McDaniels my man, he’s one of the best defenders in the class and already becoming one of the better defenders in the league. KOC was hyping him as a top 30 defender just last week."
TIL: Jaden McDaniels and Jalen McDaniels are two different people
Jaden McDaniels 1 through 5
Jaden McDaniels
All this applies to Jaden McDaniels as well.
Jaden mcdaniels
"I’m sorry, Jaden McDaniels is unbeatable"
Jaden McDaniels and Josh Okogie have been very nice in that role.
That settles it. Jaden Mcdaniels ROTY
Jaden McDaniels should 100% be on that list. 36.7% from 3 on just over 3 attempts a game and is by far our best defensive player.
My guy Jaden McDaniels about to be on this list once we go undefeated next year
Here's a couple ok rosters  &amp;#x200B;  JM  PG - Ja Morant  SG - Jamaal Murray  SF - Jalen McDaniels  PF - Jaden McDaniels  C   - Javale McGee  &amp;#x200B;  DG  PG - Darius Garland  SF - Danny Green  SF - Danilo Galinari  PF - Draymond Green  C -  Daniel Gafford
"Team “JM”:  Ja Morant, Jamal Murray, Jalen McDaniels, Jaden McDaniels, JaVale McGee  Team “RH”:  R.J. Hampton, Rodney Hood, Rondae Hollis-Jefferson, Rui Hachimura, Richaun Holmes    Team “JC”: Jevon Carter, Jordan Clarkson, Jarrett Culver, Jae Crowder, John Collins   Team “LD”:  Luka Doncic, Lu Dort, no other players needed."
Jaden McDaniels is the steal of the draft. Idc what anybody else says. Only one you could argue with is Saddiq Bey
"that's a lot of money and value for a bench piece. Probably best to trade him for a great PF.  If everything works out the ideal starting lineup is:  D'Lo, Ant, Jaden McDaniels, PF, KAT.  Tho keeping him could work too if there isn't equivalent value for the PF"
Jaden McDaniels 2025
Jaden McDaniels for 2025
"Two Jaden McDaniels, one starting and one off the bench and we're a playoff team."
Jaden McDaniels is going to be a star in this league. Mark my words.  No hyperbole. No cap. STAR.
Jaden McDaniels but in the 2nd half
...Jaden mcdaniels
JADEN MCDANIELS IS AN AMAZING DEFENDER AND I LOVE HIM
"Jaden ""Kevin Durant"" McDaniels"
JADEN MCDANIELS
There arent many for us. I guess the Vandolorian for Jarred Vanderbilt.  And then we have The Big Mac for Jaden McDaniels because JMac was taken
"&gt;VIII) The easy fixes for Anthony Edwards  I continue to be bullish on Edwards. His growing chemistry with Karl-Anthony Towns has been one of the joys of the past two months -- how they bob and weave in concert, faking a handoff one way before flipping it the other direction. The return of D'Angelo Russell has interrupted that development a tad, but talent is talent, and the Wolves need all they can get.  Minnesota is 6-6 with Russell and Towns available. Josh Okogie rediscovered his confidence from deep, though we know how that movie usually ends. Jaden McDaniels is legit; the Okogie/McDaniels pairing is the type of defensive bulwark the Russell/Edwards/Towns nucleus needs, though I'm skeptical it brings enough shooting.  Meanwhile, Malik Beasley and his 20 points per game are missing; the Russell/Beasley/Towns/Edwards quartet has logged just 13 minutes. Such bad luck could only befall the Wolves.  Minus his nightly steal, Edwards has been bad on defense -- as expected for a teenager. It takes time for score-first guys to learn the complexities of NBA schemes. Barring some lack of will, Edwards should become at least an average defender.  He can start with the low-hanging fruit of transition defense. Minnesota is as bad there as the Kings, and way worse with Edwards on the floor -- in both volume of transition chances and opponent efficiency, per Cleaning The Glass data.  Edwards can be slow to realize when he should ditch his matchup and take the closest opposing player:  He sometimes meanders toward the offensive glass -- too halfhearted to count as ""crashing"" -- when he has little chance at a rebound. Edwards has 47 offensive rebounds in 60 games, so the risk-reward is not working.  Ambling cuts to nowhere can undo Minnesota's floor balance:  Edwards has good intentions: making himself available for the corner-to-corner pass. But Naz Reid -- having a very nice season! -- is already there, with two other Wolves under the basket.  This is fixable with experience and care. If we are having this same discussion in two years, it's a problem."
"Jarred Vanderbilt and Jaden Mcdaniels those two got a lot to improve. I just don't know why your defense sucks. But I'm sure next season you will be in the playoffs.  Towns,Edwards,Rubio,Russel and Beasley wow"
What about “timberwolves’ small forward Jaden Mcdaniels has a great defensive prowess” ?
Jaden mcdaniels looks like he could be really really really good
"As a husky fan I can add to this - the huskies were coming off a surprising NCAA tournament appearance the season prior and despite losing Matisse Thybulle among others from that team, they were bringing in arguably their greatest freshman class ever highlighted by Isaiah Stewart and Jaden McDaniels, and expectations were high.  They ended up having no chemistry whatsoever the whole season and while Isaiah Stewart put up numbers (he was first team freshman all Pac 12) the huskies finished 5-13 in the conference.  Despite averaging 17 and 8 as a freshman, I think there was a realization amongst scouts that he probably wasn’t gonna be the type of mercurial talent to carry a college let alone nba level team to success as the best player, which I would honestly agree with.  What he can be though is an extremely valuable part of an nba roster that could easily start on a playoff caliber team."
Maybe something with the Washington program because Jaden McDaniels stock fell a ton as well
"Naz Reid, Jaylen Nowell, and Jaden McDaniels are three guys who are regular staples of the rotation now that really only got their run because of injuries (Naz probably would've gotten some regardless, but the other 2 only got some because of injury/absences), and have kind of proven to us how disposable some of these middle of the rotation guys (Juancho, Layman, Vanderbilt, Culver) will be in the offseason"
"I don’t know about the whole NBA, but on the Timberwolves it’s Jaden McDaniels.  After a slow rookie start, he shot .383 from 3 with a .600 TS%.  He was the best defensive player on our team, and that’s saying something with Josh Okogie.     He was a top 5 rookie post all star and is going to be a 3&amp;D menace for the next 15 years and people are acting like he’s a nothing bench prospect.  Every Wolves fan has him pencilled in as our long term starter without any hesitation."
"Offense: D'Angelo Russell, Malik Beasley, Anthony Edwards, Juancho Hernangomez, KAT.  Defense: Ricky Rubio, Jarrett Culver, Josh Okogie, Jaden McDaniels, Jarred Vanderbilt."
"Most Wolves fans are realistic that there's no Simmons deal straight up. It will need to be a three team deal, where we send Beasley to Philly,  future assets +/- young prospects like Jaden McDaniels or Naz Reid to the third team, and the third team sends another good player to Philly.   The raptors, sending Lowry to Philly via sign and trade, is the most realistic possibility.   Philly gets an all star level point guard and another high level movement shooter to put around Embiid, Toronto gets assets for Lowry (who may be leaving either way), and Wolves get Simmons."
"1. Beasley is not in jail  2. Jaden McDaniels and Naz Reid are both really good players on rookie contracts, both are guys who can be in the rotation of a championship winning team (McDaniels is honestly good enough to start on a championship team)  3. The team has every pick besides the one this year. Considering you can offer picks up until 2028 right now, the team could offer a max of 4 unprotected first round picks and three pick swaps right now (although that'd be a massive, massive overpay for Ben lol)"
you forgot jaden mcdaniels
"I and most Timberwolves fans are expecting a big jump next season. If they're not at least competing for the 10 seed, I'll be disappointed.   When KAT and DLo were finally healthy post ASB, they were above .500 (I don't remember the exact record). They finished the season 7-5, with two wins against the Jazz and one against the Warriors. Ant averaged 27-5-5 on 40% 3pt shooting the last month of the season, KAT looked as good as ever, and DLo looked muuuuuch better after his surgery.   If they stay healthy, I really see no reason they can't go .500 on the season. And if Ant and/or Jaden McDaniels take a big step forward, that could elevate them even further."
Lakers:  Russell Westbrook/Klay Thompson/James Harden/Kawhi Leonard/DeMar DeRozan  Clippers:  Dejounte Murray/Kevin Porter Jr./Zach LaVine/Joe Harris/Jaden McDaniels
"Since Siakam seems to be on the table for the right deal, how would this look for all involved?   Sixers get:   * Pascal Siakam  * Malik Beasley  Timberwolves get:   * Ben Simmons  Raptors get:   * Jaden McDaniels  * Ricky Rubio  * Matisse Thybulle  * Tyrese Maxey  * Some number of Sixers 1sts (1-4). Maybe two of them?   Sixers get a star wing who can score plus a microwave 20ppg scoring guard.   Timberwolves turn their backup guards and a young prospect into Ben Simmons, who fills all the holes in their starting lineup. DLo/Ant/Simmons/KAT is a damn solid core.   Raptors flip Pascal for a haul - a great prospect (McDaniels), two good prospects Thybulle, Maxey), a veteran PG who can replace Lowry or come off the bench (Rubio), and some pick(s) from the Sixers."
Jaden mcdaniels doesnt have the hype nor is he playing at the level of a consensus number one pick tho.   Obviously chet will more than likely be a plus defender. Whether or not he can use his frame to dominate the same way he does in high school is another question.
"i think i heard this rationale about jaden mcdaniels last year after we drafted him.   ""too skinny, is just gonna get pushed around""  All he does is come in and be a high level impact defender from his first game in the nba."
Oh yes I'll take one Jaden McDaniels pls
"I know the Ben Simmons rumours have been non-stop, but what do you think a fair trade package would be?  I reckon Malik Beasley, Jaden McDaniels, Ricky Rubio, 2022 2nd (via either 76ers or Nuggets) and 2023 lottery protected 1st would be more than reasonable. Philly get their pass first point guard, a scoring wing and a combo of prospects and picks.  Starting line-up of Towns, Simmons, Okogie/Culver, Edwards and Russell is pretty decent and a low seed playoff squad for sure."
"&gt;What do you think they're depth chart is right now? For me it would be: Towns/Reid Vanderbilt/Juancho/McDaniels Beasley/McDaniels/Culver Edwards/Russell/Beasley Rubio/Russell  * C: KAT/Naz/Vanderbilt  * PF: Vanderbilt/Jaden McDaniels  * SF: Jaden McDaniels/ Okogie / Culver  * SG: Anthony Edwards / Beasley / Nowell  * PG: D'Lo / Rubio / Bolmaro  As the roster is now probably this.   &gt;I'd be pretty keen to either get off Russell (more than Beasley or Rubio), but I'm not sure he's destined to be a starter in Minnesota  Won't happen because of KAT and the optics of trading him now."
"lmfao you’re writing off injuries completely because they lost one game to a team with injuries? guess the utah jazz were shit then since they lost all 3 games to the wolves.   kat and dlo played like 5 games together out of a possible half a season after the wolves traded for dlo. kat then had to deal with another long term injury this season, as did dlo, and kat also lost 6 family members to covid. you think the wolves were in a position to perform at their best when one of their best two players are constantly hurt and even when their best player was healthy, was struggling with grief and depression? he even said he wasn’t focusing on basketball at all. also love how you cherrypicked the ant+kat/ant+dlo minutes because ant was actually healthy all season. can’t do that with dlo+kat, their two best players, so you had to pick someone else.   a healthy wolves team can make quite a bit of noise next year. dlo, ant, kat, beasley, jaden mcdaniels, naz reid, rubio are all quality rotation players and the first six all have room and time to grow, plus they have a competent coach and gm for the first time in ages. actually watch them play next year, you’ll be surprised"
"There were a lot of issues and that was definitely the biggest one. Next year, it’s time to show up or trade everyone but Ant and Jaden McDaniels."
Jaden McDaniels (hopefully the Timberchickens will trade him to a team who will develop him)
"Off topic, but its getting so hard for me to keep track of these younger players and prospects who have similar names. There are so many guys in recent drafts or in the upcoming drafts (especially some of the higher rated prospects) that have names like Jalen, Jaylen, Jaden, Jaren etc that I keep mixing them up. In this case there literally was a guy named Jalen McDaniels the year before Jaden McDaniels which is what caused me to go down this rabbit hole   2018: Jaren Jackson Jr, Jalen Brunson  2019: Jaylen Norwell, Jaylen Hands, Jalen McDaniels  2020: Jalen Smith, Jaden McDaniels, Jalen Harris,  2021: Jalen Green, Jalen Suggs, Jalen Johnson, Jaden Springer, Jared Butler  2022: Jaden Hardy, Jaden Ivey  2023-24: Jalen Duran, Jalen Washington, Jaden Bradley, Jalen Lewis, Jaylen Clark, Jayden Nicholson  Thank you for listening to my Ted Talk"
May I introduce to you one Jaden McDaniels
"Saddiq Bey. No Homer either. He’s going to be a 20 ppg scorer easily at some point. Has one of the best three balls in the league. Also, has defensive potential.   Other two picks are Poku and Isaiah Stewart. Jaden McDaniels could interesting down the road too.   Last year’s draft was good man.  Don’t feel slighted if I didn’t list your rookie here. I like Quickley, Maxey, Hampton too. Just a deep all around class."
Big fan of Isaiah Stewart and Jaden McDaniels. McDaniels in particular has a lot of skills that could keep him in the league for a long time
Jaden McDaniels
"&gt; Snyder joined most of the Jazz’s front office in being frustrated by the selection of Udoka Azubuike with the team’s first-round pick in 2020.   Anyone know who the Jazz wanted instead? The players picked after him were Jaden McDaniels, Malachi Flynn, &amp; Desmond Bane. Xavier Tillman in the 2nd round would have been nice next to Gobert or as a small-ball center, as well."
Pretty much because we dont HAVE a decent PF. Jaden McDaniels is more a 3 which leaves Juancho and Vanderbilt at the 4 at the moment
Jaden McDaniels.
jaden mcdaniels underrated
"Maybe Beasely, Rubio, Jaden McDaniels and picks ?  What those picks are would be the question mark to be negotiated over."
PG: Simmons  SG: DLO  SF: ANT Man  PF: Jaden McDaniels  C: KAT
"I’d take him on the Wolves as long as it doesn’t involve KAT, Ant, or Jaden McDaniels. We have plenty of offense, but we need some defense."
"I think the Wolves absolutely would. We need a 4. We also dont need him to score for us. Our play this year has seen all defence no offence from Vanderbilt and Jaden McDaniels at the 4.  And if we manage to trade Rubio, Beasley and a protected pick for Simmons we can slide McDaniels to the 3"
Jaden McDaniels you just don't know it yet
Jaden McDaniels please? Thanks
"That pick already happened, it was Jaden McDaniels."
Jaden McDaniels had a great 2nd half to the season too. So the question is.... why wasn't that Washington team better? I don't watch Pac10 at all to know...
"So the third team is Facu, Peyton Pritchard, Cole Anthony, Jaden McDaniels, James Wiseman, pretty much"
Jaden Mcdaniels robbed unironically
Man jaden mcdaniels was so good dude. I'm not overestimating when I say he was legit locking up guys like luka and harden. And he was hitting shots too
Definitely up there. I’m a homer but I’ll throw the wolves out there as well; Ant could be a star and Jaden McDaniels is looking like a good 3 and D guy at least. We still have Bolmaro coming over from Barcelona too.
"Wouldn't give up KAT, Ant, or Jaden McDaniels for him.   After that, sure I guess."
Jaden McDaniels will be a high end 3&amp;D combo forward and the type to make an ASG as an injury replacement.
"We keep:  * KAT * Anthony Edwards * DLo * Jaden McDaniels * Malik Beasley * Naz Reid * Rubio * Juancho  Honestly, any 2 of Rubio, Juancho, Vando, and Okogie can be kept, I just chose these 2 out of price."
"There are quite a few Seattle area guys in the league.  George Karl helped create the high level AAU scene in the early 90s, and the area has been creating NBA guys regularly ever since.  Murray, Zach Lavine, Avery Bradley, Kevin Porter, Matisse Thybulle, Jaden McDaniels."
"Jaden McDaniels, already the best defender in his 2020 draft and his instincts are unmatched. This guy was ranked as a Top 10 Prospect in his 2019 HS Class.   I really believe he could have a chance to just explode onto the seen as one of the most elite 2-Way players in the league."
"You forgot Jaden McDaniels, Leandro Bolmaro, and our savior who will lead us to the promised land, Naz Reid."
"Excluding the Knicks... I'd say Dillon Brooks, Shai, Jaden McDaniels"
Jaden McDaniels has been considered the steal of the 2020 draft
To be fair Jaden McDaniels is p solid / good
"Leandro Balmaro, jaden mcdaniels, and anthony edwards will form the next super team in the west"
Patrick Williams is like Jaden McDaniels. Which is okay expect one went fourth and the other went twenty eight.
**Staying tier:**  KAT  D'lo   Ant   Jaden McDaniels   Naz Reid   **Maybe tier:**  Malik Beasley  Josh Okogie  Jarred Vanderbilt  Jaylen Nowell  Juancho Hernangomez  **Leaving tier:**  Rubio  Culver  Jake Layman  Ed Davis  Jordan McLaughlin
Jaden McDaniels is playing but I wonder if Anthony Edwards will? I don't think he's going to get much benefit from playing against rookies and G league guys.
Here's my top 5 protected when taking contracts into consideration.  1. Karl Anthony Towns  2. Anthony Edwards  3. D'Angelo Russell  4. Jaden McDaniels  5. Malik Beasley
This man thinks we wouldn't protect jaden mcdaniels
Jaden and Jalen mcdaniels are gonna be defensive forces for a while
"Jaden McDaniels probably the least represented rookie in the league and he puts up some really solid numbers sometimes.   ""PF Jaden McDaniels: vs Pelicans - 20 pts, 4 reb, 2 stl, 3 blk, 8/9 fg, 4/5 3pt in 26 minutes""  He's got a bright future on defense and offense."
"Indiana may be without Brogdon, Sumner, and Aaron Holiday--three strong guards with different skillsets. If they do play, they may be rusty with the time off. Charlotte will be without a Martin, but Jaden McDaniels is a solid defensive wing who won't be asked to do much more than contest shots and rebound.   Without Myles Turner, the Indiana defense is absolute dog doo-doo. This game will be close. Sabonis is too much for PJ Washington, and if PJ isn't making Sabonis work on the defensive end, Sabonis could be in for a big game. The Hornets enter this game on a losing slide, but they've been playing teams better than the Pacers. I expect the Hornets to win this game. If they don't, Caris LeVert or Sabonis shoot over 60% and Charlotte turns the ball over too much."
"This is a horrible list and I can tell u haven't watched most of these rookies. Like wtf is Jaden McDaniels doing at #6 like he is a pretty good defender, but in no way is he the 6th best rookie."
I’d appreciate a little more love for Jaden mcdaniels
"I watched all of his games in Timberwolves uniform. Culver does not possess even one good NBA quality. He cannot shoot (even FT), cannot consistently finish through contact, not a good playmaker, may be decent (??) cutter. His defense is fine but not something extraordinary. About success in tanking teams - despite being one of the worst teams last 2 seasons Timberwolves never tanked. Started last season 10-7 and tried to win games after Dlo trade, this season everyone was injured (chance for Culver to step up) and eventually the team started to play well with Culver out of rotation.  Edit: Culver has had tons of chances. We tried him as primary PG, SG next to ball handler, SF, he even played 4. He was a starter, bench player, everyone. Naz Reid, Jaden McDaniels and even Jaylen Nowell somehow used their chances and became consistent rotational players. Culver is literally the worst player in Timberwolves right now."
"I apologize, but who's your third &amp; fourth big? Ed Davis? Juancho? Jaden McDaniels? I just couldn't see putting KAT/Naz + two of the above three over any of the groups listed (although maybe I'm a casual)"
"I think the Wolves would match up decently against the Mavs, seems like Jaden McDaniels frustrates Luka. Porzingis and Towns cancel each other out. Other than the Mavs and Jazz I don't see the Wolves beating the others unless Ant makes a huge leap next year."
"Just learned there's a Jaden McDaniels and a Jalen McDaniels  I was like ""wasn't this mf cooking the Wizards in the 1st half earlier today???"" even got similar hair lol"
"It doesn't make Minny look good, but the element of luck for you to land him.  He was supposedly not interested in Minnesota, and he didn't try out with us.  Jonny Flynn had a great Tournament run (also remember we had an insanely incompetent GM in David Kahn, who was someone who wanted to make a splash, and thought Rubio was that splash).    We also had our GM/Coach DIE on us shortly after drafting KAT.  Who knows what Flip could have done with Wiggins/LaVine/Towns  Absolutely agree with you on the last part.  How can we as a fan base trust anything any management does after something like that, though!  We've been pretty lucky with Rosas gnabbing Anthony Edwards, Jaden McDaniels, and Leandro Bolmaro in this years draft.  I truly think we as a roster currently constructed without those players would have been doomed.  Now we got to make sure we build with these 3 at the forefront.  I am a Minny fan that doesn't think KAT is a first option yet, and probably will never be."
The audacity to throw Naz Reid in there over Jaden McDaniels
