"&gt;  jaden mcdaniels looks like the steal of the 2020 draft and was the best defensive rookie in the league as the 28th pick.  IQ was picked 3 picks before him and hes been better  desmond bane was picked 2 picks after him and outplayed him last night   &gt;naz reid was undrafted and has become one of the most underrated backup centres in the league, and he’s one of the best 3pt shooting centres too.  actually agree with all of this will always endorse naz reid would love to have him on the hornets  &gt;okogie at 20 wasnt a world beater but getting a solid rotation player there is still a win.   he's not a rotation player? more of a sporadic player, on one of the worst teams in the league. not to mention offensively non existent?  &gt;he traded roco, keita bates diop, and some scrubs (vonleh, napier, bell) for malik beasley, jarred vanderbilt, and a first round pick.   roco is the best piece in this trade if the goal is to win basketball games  &gt;youre judging a GM on win percentage? thats straight up idiotic. i guess neil olshey is a better GM than sam presti, or kleiman in memphis, or rosas just because he won more games? fuck no.  you act as if all gm situation are created equal and all of those guys traded away a first round pick the next year basically saying ""we are competing"" then won 23 games, thats remarkable incompetence  and his encore roster looks like it might win 20-25 again  and last i checked the objective was to win games and his tenure not only put the wolves nowhere near doing that, it put them farther away   that is why it is fair to judge him on win percentage when not only did he sabotage their future he managed to sabotage their present as well"
Well there you have it Jaden Mcdaniels MVP
Known Dunker Jaden McDaniels
"yes youre missing everything good he did lmfao. jaden mcdaniels looks like the steal of the 2020 draft and was the best defensive rookie in the league as the 28th pick. naz reid was undrafted and has become one of the most underrated backup centres in the league, and he’s one of the best 3pt shooting centres too. okogie at 20 wasnt a world beater but getting a solid rotation player there is still a win. he traded roco, keita bates diop, and some scrubs (vonleh, napier, bell) for malik beasley, jarred vanderbilt, and a first round pick. he overpaid juancho a little bit (but $7 mil a year is certainly not horrible), but then flipped him and culver for beverly, which significantly improves guard depth, experience, and defence to replace rubio while giving up two players who barely belong in the league and no picks.   rubio trade was bad, yes. dlo in minnesota is significantly better than wiggins was in minnesota, and theres a very good chance kat wouldve already demanded a trade if dlo wasnt there. it was worth it just for keeping kat happy if nothing else.   youre judging a GM on win percentage? thats straight up idiotic. i guess neil olshey is a better GM than sam presti, or kleiman in memphis, or rosas just because he won more games? fuck no. the wolves just have had horrible injury luck the last two years, that’s no fault of the GMs and its really stupid to judge him on that."
Jaden Mcdaniels and Anthony Edwards in their primes together will be monstrous
Kuzma is averaging more rebounds a game than Embiid.  Gary Trent Jr is leading the league in steals per game and is 2nd in deflections  Jaden McDaniels has the same amount of fouls as he does points
"horrible take lmfao he was the best wolves gm in years. wasn’t incredible but he consistently made solid moves, the rubio trade and culver pick were really the only questionable ones, and he only took culver bc he expected the cavs to take culver, not garland. ill die on the hill of the dlo trade being not a bad trade even if it wasnt great, and pickups like naz reid, malik beasley, jaden mcdaniels, and others show he has a great eye for talent"
"Missed most of this game because I had to go do something, when I left I honestly didn’t think we’d win, when I got back we were comfortably winning. From what I gathered it was a combination of a favourable whistle and the Wolves being the Wolves. So not a great W but I’ll take it. I did see that apparently Jaden McDaniels fouled out in 12 minutes of play time. I’m interested to know if they were mostly legit fouls or were they ticky tacky?"
Whatever it takes for Wolves fans to stop acting like Jaden McDaniels is an untouchable asset worthy of an all star in a trade.  Dude makes Matisse Thybulle look like an offensively capable player and fouls out in 10 minutes
Naz Reid catching strays and I won't stand for it! Thanks for having his back. D'angelo Russell is poop though. Jaden McDaniels is a project.
You mean “untouchable” Jaden McDaniels?
"kat on the suns would be unreal, i would try n snag jaden mcdaniels tool"
Chris Boucher for Jaden McDaniels who says no? ^^^^^^^^/s
"I mean Cam Payne (before his rookie contract was up) was traded for Taj Gibson, Doug mcbuckets and a 2nd round pick (I believe it became Mitchell Robinson). OKC then traded Kanter, Mcbuckets, and the 2nd pick for Carmelo Anthony. They then traded Anthony and a top 14 2022 protected pick for Dennis Schroeder. Dennis then got shipped to the Lakers for Danny Green, a first that became Jaden McDaniels I believe. OKC then packaged that pick to Minasota for pick 16 of the 2020 NBA draft to pick none other than Aleksej Pokusevski. So in the end I think the Thunder got their guy!  Also, at least Cameron Payne figured it out and is a role player in the NBA.  A D.  On your report carddoesn't bring your GPA down to a 1.0 if you have all A's."
Our defense was fine through 3 quarters. We were on pace to hold them below 100 after 3 quarters.   What hurt us was:  1) Our best defender Jaden McDaniels fouling out very early. Wagner went off in the 4th once McDaniels went out.  2) DLo getting hurt. Having to run a very undersized JMac out there for big minutes in crunch time just didn't work. Which is why the Magic's guards went off on us.  3) Naz Reid getting destroyed (and injured) by Mo Bamba. Still pissed that wasn't a flagrant foul. Fucking ridiculous.  4) The Ref's were so incredibly one sided for basically 3/4th's of the game. At one point the Magic had like 15 FT's to the Wolves 2.  5) Our offense is a mess. I think that's really the biggest problem. They need to figure that out before anything else.
1. Anthony Edwards  2. Lamelo Ball  3. Cole Anthony   4. Tyrese Haliburton  5. Saddiq Bey / Desmond Bane / Jaden McDaniels / Tyrese Maxey
yeah tbh ben simmons prolly isn't even worth jaden mcdaniels like jordan mclaughlin and a 2028 second is prolly the limit with this much talent on the wolves roster
"Might be a homer for you lol   Check my flair I think Jaden Mcdaniels could’ve gone #5 also, also listed Cole Anthony and Desmond Bane too."
Desmond bane  Cole Anthony  Jaden Mcdaniels   Could all be picked at 5
Miles and Mikael Bridges…  Jalen and Jaden McDaniels…  Franz and Moritz Wagner….  Shit’s getting confusing.
one jaden mcdaniels pls
"As a wolves fans watching B.I. Knock down clutch jumpers with Jaden Mcdaniels playing the best 1v1 D you could ask for to secure the win this week against us, I disagree."
"How does Isaiah Stewart look this year? He played at my college and he looked good but really limited and basic, but I couldn’t tell if it was the coaching and role he was in. When he got picked 16th or whatever it was I was incredibly surprised, I was expecting him to go much later.   How is he doing? Jaden McDaniels is playing far better than he did in the year at UW so I’m wondering if Stewart is having a similar season."
"1. Injuries, this team played fully healthy in the first two games of the season but KAT's injury really derailed their season as a whole. We still don't know if the core of KAT, D'Lo, Edwards and Beasley is actually good because we have only seen them play for two games.  2. Coaching, Ryan Saunders probably made his gameplan around KAT and after he was injured he didn't have second plan. Hence D'Lo tried to carry this team but he failed miserably as only good teammate he had was Malik Beasley. (Anthony Edwards was pretty bad and inefficient.) He tried to implement a gameplan that obviously did not work, and he was fired after going 7-24. But in the great news, Chris Finch looks like he is a pretty great coach, at least after the ASB. The teams record is 6-10 after the All-Star Break and Edwards and KAT looks like completely different players. We knew what KAT was capable of but Edwards came in as a surprise as he is averaging 25 PPG with %54 TS after the all-star break.  3. While a trio of KAT, Edwards and D'Lo looks really good on the paper, basketball is a team sport at the end. Even if you score 60+ PPG as a trio every game, if your teammates are bad, you're not going to win the game. While they have great pieces like Jaden McDaniels, Malik Beasley and Naz Reid to an extent, other players are not helping. Jarrett Culver looks like he is a bust without confidence, Okogie is an offensive liability and Rubio, while his playmaking is still pretty good, he shoots %38 from the field. And the bad thing is I really don't know if they could fix this. We don't have a lot of trade pieces as our first round pick and second round picks were traded and I don't know if free agents would want to come to a team that is the worst team in the NBA.  4. KAT, Edwards and D'Lo are good, but their defense is really bad. To be fair, KAT and Edwards improved a little bit on that front, but they are still pretty bad. KAT improved his pick and roll defense and Ant gets a steal here and there but they just allowed 141 to an Indiana team that didn't have Sabonis, Turner or Brogdon. They are pretty [self-aware](https://old.reddit.com/r/nba/comments/mmi27z/anthony_edwards_coach_cant_come_on_the_floor_he/) about their defensive problems and Edwards at least shows effort on that front but they still need to learn how to do team defense. We'll see if they will fix these problems in the off-season I guess."
"This is the other McDaniels bro, not Jaden."
"Nothing to add here, but I just want to say that I noticed Jalen and Jaden McDaniels have the exact same “run.”"
TIL there is a Jalen McDaniels and a Jaden McDaniels
"I love ant. Absolutely love him and think he’ll be a really good player. But I’d be lying if I said I wasn’t more confident in jaden McDaniels development, dude looks fantastic and seems like he’s got a good feel for the game"
Jaden McDaniels robbed
Saddiq Bey is probably the most underrated rookie this season. Jaden McDaniels has been amazing for the Wolves. Okeke has been a nice piece for the Magic. Tate has been just really solid recently too
Jaden mcdaniels is looking like a steal for the 28th pick
"I’ll give you the Wolves example.   Jaden McDaniels is already the best defender on our team, shooting .379 from 3 (Bey is shooting .381), and the entire Wolves board would take him over Bey.    Who’s the “easily a top 5 rookie” between them?  I’ll take my guy and you’ll take yours, as it should be.  There’s probably 5 or 6 other rookies who can make a case after the obvious top 3.   I’m just letting you know he’s “arguably top 5” not “easily top 5”."
"TIL Gladly = Thank God.  &gt;“We told Jaden [McDaniels] try not to let [Julius] Randle catch the ball, we’re gonna make somebody else beat us,” Edwards said. “Gladly, R.J. Barrett caught it, and if he would’ve made the shot we would’ve lived with it. I mean, because that’s who we wanted taking the shot. We didn’t want anybody else taking it.”  You should know the meanings of words before you use them."
Genuine question: Adding Schröder helps in comparison to Danny Green and Jaden McDaniels? I haven’t watched many Laker games this year.
Jaden McDaniels.  /closes app
"Having a PG who can't shoot and relies on a playmaking as his primary offensive value on a team with a bunch of non shooters (or offensive players in general) is also a recipe for losing.    I would agree with you if we were actually a competent offensive team without KAT but we're 27th on offense despite being KAT having a on/off of +10 when he's on the court (100% derived from his offensive value obviously) so when he's off court our offense is by far the worse in the NBA.    Like I don't think you realize how much anti synergy this roster has with Simmons especially when both D'lo and Beasly can't stay on the court.  Simmons is gonna play significant minutes with Edwards (31 3fg%), Rubio (29 3fg%), and Okogie (23.2 3fg%).  Jaden McDaniels and McLaughlin are decentish three point shooters but they're not good enough to commend that much respect.  With Simmons out there the lane is gonna be so clogged that the team can't even see the rim.  I don't see how this team is gonna get any sort of respectable offense going.    Yea the defense is going to be obviously better but this roster is still filled with enough negative defenders that decent teams can still found ways to exploit.  Overall it's just trading offense for defense so I really don't see how Simmons for KAT makes a difference especially not enough to make the playoffs."
"You can leave off Culver, but add Jaden McDaniels.  He's going to be a great role player, imo."
"I think Jaden can be a pretty good 4. He just needs to get a little bigger like Jerami Grant did. He's 6'10 too his going to be find at the 4. I hope you guys get Cade he would perfect for you guys. A lineup of Cade, Beasley, Ant, McDaniels and Kat is really fun."
A shot blocking PF and then Jaden McDaniels as the shot blocking 3 would definitely help.
Jaden McDaniels is so damn good. he fucking air balled as I was typing go damn it
Jaden McDaniels didn't stand there and let Embiid lean on him?  That's a foul.
"Twolves fans really liked him in the preseason and were baffled when he got cut. It's worked out for us with Jaden Mcdaniels getting his shot now, but dang."
1. KAT  2. D'lo  3. Beasley  4. Rubio  5. Ant  6. Jaden McDaniels  7. Naz Reid  8. Jaylen Nowell  9. Josh Okogie?
"Especially when you consider that he had arguably the best game of his rookie season literally this past Monday lol. Like it's perfectly fine to talk about legitimate criticisms, but people are way too trigger happy with labeling 19-year old rookies as busts. Some rookies, like Jaden McDaniels and Chuma Okeke, have started showing promise out of nowhere within the past week itself despite being completely unknown to 99% of this sub until now."
Jaden and Jalen mcdaniels
"There were 3 plumlees at one point too, but I guess mason is the only one now   Cody and Caleb Martin  Brook and Robin Lopez   Steph and Seth curry.   The Morris twins  The Hernangomez brothers  Jalen and Jaden McDaniels  The Ball Boys"
The fact that they have a coach who is just willing to run Jaden McDaniels out there for 36 minutes is an extremely positive sign for the future. He looks like he is immediately slotting into the “steal of the draft” spot.
Rosas. Turned RoCo into Beasley and the Nets pick which he turned into Bolmaro and Jaden McDaniels. Found Jordan McLaughlin and Naz Reid in the scrapyard.   The only blemish on his tenure was heading into this season without a real PF and drafting Culver.
That sounds like a job for Jaden McDaniels
"Patrick is definetly one of the most underrated rookies, dont know about him being the most underrated when Jaden McDaniels looks like a future all defense and isnt getting top 10 rookie recognition"
Jaden mcdaniels
Who the hell is Jaden McDaniels
"&gt;Yeah I was kind of cringing at them trying to trade for Gordon or Collins  Why? Gordon would be the perfect fit on this team and Collins isn't actually a terrible defender.  &gt;I think that’s the last thing they need lol. They need to be pursuing more defensive wings besides just McDaniels, especially on a team with KAT and D’Lo (Ant too right now, but he projects to be a better defender at least, but so did KAT...)  Our team is full of defensive wings (Josh Okogie,Jaden,Culver) what we need is a honest to God PF."
Anthony Edwards and Jaden McDaniels exist.
Jaden Mcdaniels
Jaden McDaniels carried the team back and then Ant took over late in the fourth.
He is at his best not shooting 3s and just going into attack mode.   Jaden Mcdaniels is the one I think has every other team salivating for though. Made Julius Randle take tough mid rangers in the crunch and even denied him catching the ball which led to a possession where he didn't touch it at all
Don’t disrespect Jaden McDaniels
Jaden McDaniels is going to be one of the best players in this class
Jaden mcdaniels should be getting more credit. He really locks up the best players in the league while being great offensively
"definitely, though if they get Cade and get on that type of promising timeline, I like Jaden McDaniels in that role for them. KAT requires that kind of archetype, but also gives you the flexibility for that player not to be an impactful shooter"
"Jaden Mcdaniels has been on another level recently, not sure why he isn’t even top 10"
DLo has negative trade value though. And hold your horses about building around Jaden McDaniels lol
Not right away but down the line id think so. If KAT and dlo ever get traded using those pieces to build around Ant/Cade/Jaden mcdaniels would be pretty cool
Lakers literally have no answer for jaden mcdaniels
They're all scared of Jaden McDaniels
"But choose to bandwagon the Minneapolis Lakers flair...  Compared to the mess the roster was in when he got here Rosas has done an excellent job and the only glaring mistakes were heading into the season with no starting PF and drafting Culver in 2019 (he can still pan out but its unlikely and he made up for that mistake with Jaylen Nowell,Naz Reid,Jordan McLaughlin and Jaden McDaniels).   Another thing you can blame on him was Ryan but Glenn clearly chose the signing there."
"Full piece  *""Gersson Rosas made no secret when he took the job as Timberwolves president that the primary way he was going to restructure the Wolves was through trades. Minnesota has never been a free-agent destination in the NBA, and Rosas wasn't naive enough to think he could change that overnight for big-ticket players. Instead, trades, the way Rosas' former team in Houston became a contender in landing James Harden, were going to drive the roster overhaul.  		  D'Angelo Russell, Malik Beasley, Juancho Hernangomez, Ricky Rubio and Jarred Vanderbilt all came to the Wolves via trade, and the draft pick that eventually turned into Jaden McDaniels also came in a trade.  The March 25 trade deadline is nearing, and reports are circulating of the Wolves' reported interest in Atlanta's John Collins and, to a lesser extent, Orlando's Aaron Gordon. Hall of Fame NBA reporter Jackie MacMullan said on Bill Simmons' podcast recently that she heard from sources the Wolves were ""dying"" to get Collins.   ""Just as Rosas made clear trades were the primary way he was going to reshape the roster and then followed up on that, when reports have emerged about Rosas' pursuit of a given target, fire typically has followed the smoke. The Wolves never gave up on their pursuit of Russell, and their interest both in the 2019 offseason and before the February 2020 trade deadline was public knowledge. Even as reports varied about the state of negotiations in the days leading to the trade, in the end the Wolves dealt Andrew Wiggins and a first-round pick for Russell.  Before Robert Covington was traded, it was an open secret the Wolves were shopping him, as some national writers strongly hinted in the days leading up to the four-team gargantuan trade that netted the Wolves Beasley, Hernangomez, Vanderbilt and a draft pick.  Now the same dance seems to be happening with Collins, who will be a restricted free agent after the season but is reportedly looking for a max contract. Trading for Collins now ensures the Wolves would secure his Bird Rights, as they did with Beasley and Hernangomez, and would also ultimately control whether he re-signs in restricted free agency, but just what might that cost? Would the Wolves have the room to keep him?  Would part of that cost come in another first-round pick? Since the Wolves owe Golden State a top-three-protected first-round pick this year — and there's a chance the Wolves land in the top three and the (unprotected) pick conveys in 2022 — they can't deal a first-round pick until 2024, as the NBA doesn't allow teams to deal first-round picks in consecutive years.  Perhaps it's just as well the Wolves are hamstrung in dealing first-round picks, considering they may finish this season with a record that gives Golden State a 60% chance of retaining a pick that falls between No. 4 and No. 7. The Wolves were hoping when they dealt the pick that it would be somewhere in the teens, not the top 10.  The way this season has gone, the pressure has built on Rosas to make another move on a roster that still needs building. All the games the Wolves had to play without Russell, Karl-Anthony Towns or both have made that clear. Towns also won't want to play in a state of constant rebuild for long. Trade deadlines and offseasons are the time tectonic roster shifts can happen, and Rosas has pulled the plug on multiple moves in the past two cycles. This deadline promises more of the same. The signs are there, and Rosas is likely to make a move of some kind. As time goes on in Rosas' tenure and the Wolves continue losing, there's more riding on each move Rosas makes.  He has shown he won't sit quietly as the NBA turns around the Wolves, but making the right move is more paramount than ever in his tenure.""*  Chris Hine covers the Timberwolves and NBA for the Star Tribune. chris.hine@startribune.com"
"For those who don't know who he is. He is the brother of Jalen from the Hornets. He was a top 5 high school prospect who had a rough year at Washington before falling to 28.  He's a skinny 3/4 hybrid that was seen as a project that would take about 3 years.  Due to poor performances from all of the PF's on our roster as well as dudes filling in at the 4 (Okogie, Layman, Juancho) both Vanderbilt and McDaniels ended up being forced into rotation.  Jaden has been an absolute revelation for us. He's a fearless defender that loves to get a block and is a decent scorer putting up a career high against New Orleans.  He has been the brightest of bright sparks this season alongside Malik Beasley. Some of our beat reporters like Britt Robson even believe that he will be better than Anthony Edwards, whilst that is unlikely, the sky is the limit for Jaden"
Jaden McDaniels this season
"Stanley Johnson sucks but he isn't next level, do-everything wrong-and-then-some terrible like Baynes  Edit: This post made me realize that Jaden McDaniels and Jalen McDaniels are two different people and some confusion I've had during the season now makes a lot more sense"
John Collins to Minnesota for something centered around Malik Beasely and Jaden Mcdaniels  Harrison Barnes to Boston for Romeo Langford and a first  George Hill to the Clippers for Lou Williams and Detroit seconds
Jaden McDaniels
Jaden mcdaniels
I laughed hard at Jaden Mcdaniels’ one because it was so low quality
"We traded 25 and 28, which were Immanuel Quickley and Jaden McDaniels"
"I am a huge Jaden McDaniels fan, I have been even before the draft but DPOY and comparing him to Issac who is a defensive savant is overstating it quite a bit to my eye"
Jaylen Nowell and Jaden McDaniels 48 points on 19-22 shooting lmao. We’re coming for that 12 seed 😎😎😎
"Jaden McDaniels, Anthony Edwards and Jaylen Nowell are the next NBA big 3"
how bad is the pelicans defense to let jaylen nowell and jaden mcdaniels score 48 on 19-22 shooting
Jaden McDaniels will go top 10 in a redraft this time next year.
Don't sleep on my Wolves' Jaden McDaniels!
"Okoro, Jaden McDaniels, Payton Pritchard, Xavier Tillman have all also been better defensively in my opinion. That also doesn't include players I think are more arguable but are there is also Desmond Bane, James Wiseman, Patrick Williams, and Saddiq Bey."
"Jaden McDaniels.  None of us expected him to get playing time this year behind Juancho, Vanderbilt, Layman and Okogie but he's forced Juancho, Layman and Okogie out of the rotation.  He's not doing anything crazy as a project rookie but he gravitates to the ball for swats. His stats aren't crazy because again he's a rookie coming off the bench but he's averaging a block a game, with 2 or 3 when he gets in a rhythm and has a very good 3 ball from the corner.  I don't think anyone can predict what he'll become but he has worlds of potential"
"That's a funny way of saying Ricky Rubio, Anthony Edwards, Josh Okogie, Jarret Culver, Ed Davis, Jaylen Nowell, Malik Beasley, Naz Reid, Jarred Vanderbilt, Jaden McDaniels, Jake Layman, Jordan McLaughlin, and Jaun Hernangomez are 1-11. It's a team game, feel free to name all the players contributing to our loses next time!"
"Jaden McDaniels is pretty underrated imo, he’s been better than I anticipated, but he still gets no buzz even though he’s a rookie."
"I think this draft class is gonna produce a lot of good pros. I think people seem to equate draft that has stars as automatically ""good"".  Ball, Edwards, Wiseman, Haliburton, Patrick Williams, Jaden Mcdaniels all look really good to me long term. I know I'm missing some but I'm a wolves fan so most of the games I watch are those.  Ive watched a lot of Edwards play and he does things that most guys can't. Better shot selection and playmaking will come in time.  His defense will get better as he matures. He has star potential."
