"I’m not sure what got into him, but it’s awesome. He and Jevon Carter played a full court press in the bubble and legitimately terrorized teams. Payne’s been dealing with some lingering injuries this season and we’re a worse team without him. He’s still shooting at a nice clip, his playmaking has gotten even better, and he’s one of the few guys on our team that can take the ball to the rim. He is super unorthodox and nothing about it is “pretty” but he’s a rock solid player now. A lot of what he does is just high effort, high energy play. I think falling out of the league was the best thing that could have happened to him because he is way more mature and focused now."
"This huge lead can cause people not to notice that Jevon Carter is throwing up some bricks, good lord"
"Disclaimer that this is not an excuse and this lineup 100% blew a 23 point lead against Detroit.  **Starters:**  PG: CP3  SG: Book  SF: Mikal  PF: Crowder  C: Ayton  **Bench:**  PG: Cam Payne  SG: Jevon Carter  SF: Langston Galloway for first 10 games, Abdel Nader after  PF: Cam Johnson  C: Dario Saric  Book, Saric, Payne have been battling injuries or covid. Payne turned his ankle (i think in the houston game), came back, and hasn't really been since; he was on fire to start the season. Saric was in almost all of our most productive lineups, and the dropoff from him to kaminsky is steep. But kaminsky is simply better than Damian Jones who by all means should not be on a roster.   Cam Johnson was 9 of 35 from 3 coming into this game over the last 5 games, where he took over for Jae Crowder in the starting lineup but probably shouldn't have? Idk, the starters were really, really bad, and it was apparent in the Wizards game.  The suns hot start was due to insanely hot bench production. Mikal, Cam Payne and Cam Johnson would take us on massive runs and the starters would allow teams to come back into it, but in the Jazz and Denver games (first ones), our lead was too big to blow or we somehow clutched it out with book / cp3 isos. Those isos have not been working in the more recent clutch games. Vs. Memphis, Houston, and Denver twice, Ayton played amazingly, and when we need him to be dominant against an aging Al Horford, he gives us 5 points on 6 shots and a bunch of soft baby hooks screaming of indecision.  Surely, the starters' lack of production cannot be THIS poor for so long. For a group of high-contributing basketball players, ***playing this bad is IMPOSSIBLY UNSUSTAINABLE.***   But if there's a team that can do the impossibly negative, it's the Phoenix Suns.  I thoroughly expect the Warriors to shove their fist up their asses tomorrow."
jevon carter always dancing lmao
"Yes, behind the help of Finals MVP Jevon Carter, DPOY Mikal Bridges, 6MOY Cam Johnson, and Backup Point Guard Chris Paul, anything's possible"
Jevon Carter representing every Suns fan in that clip
It’s definitely Jevon Carter.
so [Jevon Carter](https://www.basketball-reference.com/players/c/carteje01/gamelog/2021/) has a shot u say
jevon carter
"Now is the time to jump on the Suns bandwagon. We're historically a winning team, but the 2010's were very unkind to us. We have, however, taken great strides to turn that around, and I think we've got a lot going for us now.  1) A young star player in Devin Booker that shows improvement every single year (though he's off to a slow start this year) and has shown incredible loyalty and passion to the city/fans.  2) One of the most talented and respected vets in the league in Chris Paul, who people call the Point God for a reason.  3) A high energy young core of players that give it all on offense and defense, ranging from respectable role players to potential All-Stars down the line, in Mikal, Ayton and Cam Johnson.  4) A scrappy bench mob consisting of Cam Payne, Jevon Carter, Dario Saric, and Langston Galloway that is just smothering on defense and lethal on offense  5) An endearing and respectable head coach in Monty Williams.  Biggest drawback is our owner is a cheap bastard with a history of meddling where he shouldn't. Lately though, he's been much quieter and hands off while our new GM, James Jones, has turned our trashcan fire of the 2010's completely around and created a very strong, balanced, and deep team. Things are looking these days, so why not praise the Suns?"
don't forget Jevon Carter
"You forgot to mention the fella Jevon ""the bald guy on the Suns playing annoying ass defense"" Carter"
(before tonight's games)  Player | FGA | PTS ------------|---|--- Caris LeVert | 120 | 116 Dillon Brooks | 119 | 118 Markelle Fultz | 104 | 103 Kelly Oubre Jr. | 101 | 84 Devonte' Graham | 99 | 80 Bojan Bogdanović | 94 | 94 Cole Anthony | 76 | 69 Gary Harris | 61 | 56 J.J. Redick | 55 | 49 LaMarcus Aldridge | 54 | 50 Tyus Jones | 54 | 50 Al Horford | 53 | 53 Aaron Holiday | 51 | 46 Tyrese Maxey | 49 | 46 Killian Hayes | 47 | 32 Ish Smith | 46 | 42 Aron Baynes | 45 | 37 Michael Carter-Williams | 44 | 36 Juan Hernangómez | 44 | 44 Derrick Jones Jr. | 44 | 42 Sekou Doumbouya | 39 | 38 Markieff Morris | 31 | 31 James Johnson | 29 | 26 Kendrick Nunn | 29 | 26 Jevon Carter | 28 | 22 Grayson Allen | 27 | 25 Brandon Goodwin | 27 | 26 Anfernee Simons | 27 | 26 Dante Exum | 26 | 23 DeMarcus Cousins | 24 | 23 Furkan Korkmaz | 24 | 18 Aleksej Pokusevski | 21 | 5 Mike Scott | 21 | 21 Terance Mann | 20 | 12 Matisse Thybulle | 19 | 18 Frank Kaminsky | 18 | 17 Lamar Stevens | 18 | 18 Kenrich Williams | 18 | 15 Ed Davis | 17 | 13 Jordan McLaughlin | 17 | 16 Chris Chiozza | 16 | 15 Chandler Hutchison | 16 | 13 Dean Wade | 16 | 12 Gary Clark | 15 | 12 Carsen Edwards | 15 | 13 Jerome Robinson | 15 | 15 Marquese Chriss | 14 | 13 Rodney Hood | 14 | 11 Drew Eubanks | 13 | 9 Nicolò Melli | 13 | 11 Amir Coffey | 12 | 12 De'Anthony Melton | 12 | 8 Aaron Nesmith | 12 | 8 Obi Toppin | 12 | 9 Malachi Flynn | 11 | 0 Draymond Green | 11 | 10 Stanley Johnson | 11 | 7 Adam Mokoka | 11 | 8 Georges Niang | 11 | 8 Bruno Caboclo | 10 | 6 Tremont Waters | 10 | 9 Mfiondu Kabengele | 9 | 5 Derrick White | 9 | 9 Josh Hall | 8 | 3 Elijah Hughes | 8 | 8 Kelan Martin | 8 | 2 Reggie Perry | 8 | 7 Robert Woodard | 8 | 6 Tony Bradley | 7 | 4 Kira Lewis Jr. | 7 | 4 Sean McDermott | 7 | 7 Yuta Watanabe | 7 | 6 Keljin Blevins | 6 | 2 Maurice Harkless | 6 | 3 Trey Lyles | 6 | 5 KZ Okpala | 6 | 5 Cody Zeller | 6 | 6 CJ Elleby | 5 | 4 Isaiah Joe | 5 | 2 Saben Lee | 5 | 4 Miye Oni | 5 | 3 Luka Šamanić | 5 | 4 Dennis Smith Jr. | 5 | 4 Jalen Smith | 5 | 4 Tyrell Terry | 5 | 2 Brodric Thomas | 5 | 5 Dylan Windler | 5 | 3 Bol Bol | 4 | 0 Devon Dotson | 4 | 4 Karim Mané | 4 | 2 Garrison Mathews | 4 | 3 Ty-Shon Alexander | 3 | 0 Terrance Ferguson | 3 | 0 Damian Jones | 3 | 2 Rodions Kurucs | 3 | 3 Darius Miller | 3 | 3 Theo Pinson | 3 | 0 Kostas Antetokounmpo | 2 | 0 Mo Bamba | 2 | 0 DeAndre' Bembry | 2 | 2 Vernon Carey Jr. | 2 | 0 R.J. Hampton | 2 | 2 Luke Kornet | 2 | 2 Nico Mannion | 2 | 0 Sindarius Thornwell | 2 | 2 Jaylen Adams | 1 | 0 Vlatko Čančar | 1 | 0 Torrey Craig | 1 | 0 Cristiano Felício | 1 | 0 Willy Hernangómez | 1 | 1 Nate Hinton | 1 | 0 Markus Howard | 1 | 0 Skylar Mays | 1 | 0 Malik Monk | 1 | 1 E'Twaun Moore | 1 | 0 Juwan Morgan | 1 | 0 Zeke Nnaji | 1 | 0 Anžejs Pasečņiks | 1 | 0 Paul Watson | 1 | 0 Keita Bates-Diop | 0 | 0 Deividas Sirvydis | 0 | 0 Edmond Sumner | 0 | 0
Dillon Brooks (129 on 132 shots)   Markelle Fultz (103 on 104 shots)   Kelly Oubre Jr. (84 on 101 shots)   Devonte Graham (80 on 99 shots)   Cole Anthony (69 on 76 shots)   Tyus Jones (59 on 63 shots)   Aaron Holiday (46 on 51 shots)   Killian Hayes (32 on 47 shots)   Aaron Baynes (37 on 45 shots)   Michael Carter- Williams (36 on 44 shots)   Derrick Jones Jr. (42 on 44 shots)   Sekou Dombouya (38 on 39 shots)   James Johnson (33 on 34 shots)   Kendrick Nunn (26 on 29 shots)   Jevon Carter (22 on 26 shots)
Bringing the ball up against Jevon Carter and Cam Payne looks miserable.
1. Booker 2. Ayton 3. Bridges 4. Cam Johnson 5. CP3 6. Dario 7. Jalen Smith  Though 7 could also be Jevon Carter. I'd be bummed to lose Crowder in this scenario though
9. Jevon Carter
Could you put someone like Tyler Hansbrough out there just to hard foul the shit out of him anytime he turns the corner? I would put Jevon Carter out there and tell him to just go for it.
I will not tolerate Jevon Carter slander
I really liked the way Jevon Carter played in the bubble (dude was a freaking bulldog) but this has not been his year so far.  Granted he isn't likely to continue hitting 2 out of 15 from 3.
Jevon Carter was -19 in 3:20 lol
"Not only Chris Paul but Bridges is absolutely shooting and defending great, Crowder is playing well, Cam Johnson is shooting well and somehow Payne is resurging, Jevon Carter is a good defender and can handle the offense well and Saric was one of our most consistent players last yeaer"
"Honestly, I feel like that's an extra weird part for the Suns is that we've had a lot of player change as well.  I thought we were going to come off to a **WAY** slower start, because it takes time to build chemistry and we don't have the usual training camp this year.  * **Starters**    * Returning: Devin Booker, Mikal Bridges\*, Deandre Ayton    * New: Chris Paul, Jae Crowder * **Bench w/ 4+ GP**    * Returning: Cam Johnson,  Jevon Carter, Frank Kaminsky    * New: Langston Galloway, Damian Jones    * In-Between: Cam Payne\*\* * **Bench w/ 3- GP**    * Returning: Saric (2 GP)    * New: Jalen Smith (2 GP), E'Twaun Moore (1 GP), Ty-Shon Alexander (2 GP) * ***Notes***    * *(\*) Mikal noted as he started less than 50% of our games last year despite playing starter minutes*       * *Ayton not noted as the same as his lack of starting was due to Suspension.*    * *(\*\*) Cam Payne noted as in-between since we picked him up before the bubble.  Due to the chemistry we built in the bubble, I initially marked him as 'Returning', but think it's best to give him his own category as he was only with the team during the Bubble.*  Before we ended up grabbing Kaminsky after the Kings cut him, 50% of our roster is new (not including Payne.)  I think that the whole team deserves a fuckload of credit for making it work... Monty and CP3 for obvious reasons, but also the new guys for putting in the work and the returning players for helping bring them up to speed.  All that said, even though we're 5-1, it is clear that we're still trying to get our bearings as a team.  Mikal and Cam Johnson have been absolutely balling their fucking minds out as well as Payne this entire season -- and while their defense will stay, their shots will have to come down to earth, and then it will become more clear where our team is still needing to mesh.  * Mikal Bridges: 15.3 PPG on 53/50/100 Shooting Splits * Cam Johnson: 13.5 PPG on 52/43/100 Shoot Splits * Cam Payne: 8.5 PPG on 51/47/100 Shooting Splits  Where you'll start to see us struggle soon is going to be in comebacks.  The Suns strength is in dictating the pace of the game, and huge shoutout to Monty for this.  We're #30 in Pace, helping us to stay fresh while moving the ball around frequently for open shots.  In contrast, when we start trying to play too quickly, we turn the ball over frequently and get into offensive foul trouble.  It's honestly kind of Grizzlies-esque how they used to play with the Conley/Z-Bo/Gasol core with Tony Allen and various other role players.  Rather than being the 7SOL Suns, we're kind of the Grit &amp; Grind Suns with a 3-ball lol.  The secondary part that you'll see us start to struggle is when the 3 above-mentioned players have their shooting percentages come down to reasonable.  They are good shooters, but those are not sustainable splits... and our Offensive Rebounding Rate is 22nd in the NBA.  **We simply do not crash the offensive glass**, and this **will** hurt us when we start missing."
"Last years Suns squad was not “packed with shooters.” It had two players shoot above league average in Jevon Carter and Cam Johnson, who averaged 16 and 22 minutes. And before that there were an average of like 5 actual NBA players in the Suns rotstion"
"What culture? The fashion and memes? The culture changed when Suns started playing defense in the bubble and actually winning games. If anyone should get credit for the culture change, it's Mikal Bridges, Cam Payne, and Jevon Carter for setting the tone defensively."
"Why do you say our offense isn’t good, we have a pretty damn deep team and a bunch of good shooters, plus ayton hasn’t even had a huge impact and book is not Playing close To His usual level, I think if anything it’s likely our offense is just gonna get better with some more time to Gel. Also our opponent 3p% is not sustainable but the team still looks legit defensively, ayton is a fantastic defensive player and so is bridges, cp3 good, crowder good, cam Payne good, Jevon Carter good and so on, the team has a lot of defensive talent and I see no reason to think the defense won’t be good."
"Those are alright, what pisses me off is when Jae Crowder or Jevon Carter settle for fuckin contested midrange moving shots instead of dumping it down to Ayton."
This makes Jevon Carter the coolest guy there is right?
The play by play guy referred to Jevon carter as Chris paul like 3 times before the other commentator fixed it for him lol
"Book's offense has been struggling hard this year, but his defense has been above average-to-good this season.  Granted, he's getting the easier assignments with CP3/Mikal around him and Jevon Carter coming off the bench, but it's clear that he's all-in for a team game this year.  Honestly, I think it's what I see of a lot of superstars.  When their teams need a supernova offensive player, he gives it to the team and takes away from the defensive effort.  Now that we've got a squad though, he's playing D and not saving 90% of his energy for offense."
Jevon Carter
The play by play guy kept thinking Jevon Carter was Chris Paul lol
Because Jevon Carter is incapable of running an offence. All he can do is shoot.
Why does cam payne play over Jevon Carter?
Still can’t believe the Suns gave up two seconds to trade DeAnthony Melton for Jevon Carter  First time the Wizards have lost at home in forever. Great performance by the Grizz
"Cam Johnson and Mikal Bridges are mature young guys, same with Jevon Carter.    I think Anthony Edwards has all the potential in the world, and KAT is an Elite talent.   They are worth keeping.     But everyone else is not good for the Timberwolves, including Malik Beasley.    It doesn't matter how many points you put up, if you character isn't gonna help the team. It would be smart to trade him.    Trade Rubio to the Clippers for Lou Will, T Mann, and Daniel Oturu"
The Melton + Jackson - Carter trade was a great deal by both Memphis and Suns. Jevon Carter is pretty good at the 3 and we got 2 players who hustles a lot (though we let Jackson go for free).
"Dragan Bender is a good example of rushing a stretch big into NBA minutes too soon and it screwing up his development. Suns don't want a repeat of that, so just they're letting Smith focus on his development this year without the pressure of having to contribute.  Didn't also help that when he got into the game for garbage time, his point guard was Jevon Carter, who doesn't really playmake or pass the ball and Smith would just park it on the perimeter."
"Like Booker said a while ago, the roster is so deep that even good players (such as Langston Galloway, Jevon Carter) aren't getting playing time."
It’s crazy how the Suns have a top five defense and Jevon Carter really hasn’t played much this year
Jevon Carter?
Jevon Carter? He was a good shooter in college and was also the leader of the most tenacious defence in the country.
"As a Suns fan who is loving having Chris Paul on his team, I would say that the Suns record from the 2019-2020 season is worse than that team actually was. Injuries/suspensions to Ayton, Baynes, Oubre, Rubio, Booker and others forced Monty to play absolutely terrible bench lineups. I can still vividly remember the 3 pg lineups of: Elie Okobo, Ty Jerome, Jevon Carter, Oubre and Frank. This led to the Suns being worse than the actually were. You may wonder why the Suns played so well in the bubble, well besides major growth from M. Bridges and C. Johnson and the addition of Cam Payne, finally having a completely healthy roster (with the exception of Oubre) allowed this team to play up to its potential.   Also, James Jones had a great offseason - getting rid of Oubre, Okobo, Baynes, and Jerome while adding Crowder, Galloway, Moore, and Nader. Then he added Craig midseason this year and he's been great. The Suns still remain weak in their big man depth (an injury to Ayton or Saric is my number one fear as a Suns fan right now). But the improved depth of this team is tremendous. Everyone on the team belongs on an NBA roster (well, Jalen Smith is TBD there) which is something you couldn't say about most Suns players for the past 5 years.   Point being, while the Chris Paul addition has been big, I think that health and improved depth have been just as consequential, if not more so. In the case of the Suns, it is a massive over simplification to attribute all their improvement to CP3, and it takes away from the work our GM, coaching staff, trainers, and players have put in. I will grant the argument though that without the CP3 trade we don't get Nader, nor do we attract Crowder, Moore, or Galloway.  TLDR: due to multiple injuries at key positions the Suns record last season was worse than the team actually was; thus, using the change in the Suns record from last season to this season as a means for quantifying the impact of Chris Paul on the suns does not paint a completely accurate picture. Improved health and roster depth for the Suns have been just as consequential, if not more so, than the addition of CP3. Without CP3 there is no way this Suns team is a #2 seed in the west, but I believe they'd be sitting in the #5/#6 range if they still had Rubio instead of Paul.   Thank you for reading this rant."
Do CP3 and Jevon Carter usually play together for the Suns? That's gotta be irritating for opposing backcourts
Abdel Nader. Has the tunnel vision of Oubre without the talent to finish at the rim.  Second pick would be Jevon Carter. While he really only plays during blow outs he takes the most ill-advised three’s pretty routinely (he’s a menace on the defensive side tho so he gets a pass).
Ooooooooo boy Jevon Carter definitely won a locker room bet with that dunk. Mediocre dunk but that's why it's a winner.
Thank you for sneaking bulldog Jevon Carter in here
"Better than Élie Okobo, Jevon Carter or Jalen Brunson?"
"It's mostly just the mechanics and physics of the game. In 2K it's like they're gliding or floating on the court. It's very strange and I hated it immediately. I also feel like NBA Live 19 did a way better job mimicking the players movements and form, even down to small fry guys like Jevon Carter. Playing with him, it looks a lot closer to how he moves and shoots than in 2k21.   Also, defense is maddening in 2k21. Even in rookie mode I was having a really hard time stopping the other team from scoring, though I had an easier time scoring as well. I tried on the hardest difficult and it was borderline impossible to keep the score close. I play on the hardest setting in Live 19 and find the challenge of it much more reasonable. Maybe I just really suck but idk, I have no problems beating anyone that comes over and plays against me. I've never played online though."
he was giving us really good minutes at for a decent stretch at the beginning of the year. jevon carter has kind of eaten into his minutes unfortunately. wish we had more for him.
Jevon Carter
1-100: Jevon Carter
"Suns against 76ers...and they win in 6 (remember, we are assuming both the Lakers and Nets don't make the finals, which means we are assuming the Suns probably beat the Lakers en route to the Finals which would be an insane momentum booster for them).   Monty just has too many weapons in his disposal, he can make 3 teams from his roster (those who watch suns games regularly know) , especially his bench who we have seen beat the starters of other teams on numerous occasions on their current 53-18 run from last season's 8-0 run in the bubble!:  Team 1 : Chris Paul, Devin Booker, Mikal Bridges, Jae Crowder, DeAndre Ayton  Team 2 : Cameron Payne, Langston Galloway, Cameron Johnson, Torrey Craig, Dario Saric  Team 3 : E'Twaun Moore, Jevon Carter, Abdel Nader, Jalen Smith, Frank Kaminsky  The only person among the 15 ppl here who is unproven is the 10th draft pick Jalen Smith who hasn't gotten any burn.   We've seen Team 2 outscore other starting lineups with their 3 pt shooting (3pt percentages = Payne 40.7%, Galloway 45.1%, Johnson 36%, Craig 38.2%, Saric 34.5 %) and defense  And We've seen team team 2 win it as well in pt differential with defense (Carter/Nader) and microwave offense as well (Moore, who's been a 7.9ppg scorer in his CAREER and Kaminsky who had a personal 7-0 run against the clippers just a few days ago).   The Suns haven't been this deep, even dating back to the late 80s and 90s KJ and Barkley teams as well as the SSOL teams. There isn't a drop off whenever the starters leave the court, both on offense and defense. Them sweeping the Jazz and being 27-9 against. 500 and above teams is also a solid indicator of how well they hold up against playoff teams.   I honestly think they have as great a chance as any even if the Lakers were at full strength because of the chemistry and cohesion that hasn't been seen in a Suns team in over a decade worth of basketball... And as u can see, it's not only because Of Chris Paul but because of their really good roster from top to bottom.   Suns will be champions this year, and will win 4 games before losing 4 games against any team in a 7 game SERIES (they haven't lost more than 2 in a row in months... Wc is also testament to Monty and his coaching staff) . GO SUNS!!!"
Yep my suns sub gave me shit for saying Melton is much better than Jevon Carter. Looks like I was right.
"Ranking our bench contributors:  1. Cameron Payne  2. Cameron Johnson  3. Dario Saric  4. Torrey Craig  5. Jevon Carter  Wild cards / unlikely to get playing time in the playoffs, but still threats:  1. Langston Galloway  2. Frank Kaminsky  3. Abdel Nader (if he is even healthy by the playoffs)  Payne is the go-to guy when book / cp3 are off the floor. Even when payne shares time with Book, they are 1A / 1B together. He leads our team in buckets near the end of the shot clock, and we sort of trust him to bail us out when nothing's going in.  Cameron Johnson is a guy who's gonna keep shooting no matter what. He could have 3 points on 1 of 9 and still get hot and make any game into a blowout. He's also an underrated defender, rebounder, and has a nice dribble-drive.   Saric has slumped hard for a few months but before that, he was the best backup big man in the entire league, almost averaging 50/40/90 on double digit scoring and elite defense. Those numbers have angrily regressed to the mean unfortunately, but we're all holding out hope that he progresses back somewhat.  Torrey Craig is one of the most valuable bench pieces regardless of scoring. He is maybe second to Ayton in terms of rebounding, aggressively chasing every defensive and offensive rebound. He's one of the few people on this team who can consistently play above the rim and has a trustworthy shot from 3. We never ask him to create but every now and then he will surprise with an end-of-shotclock midrange that goes in.  Jevon Carter is a guy who we've been trying to figure out his role on the team for a bit. He's usually the guy we sic on opposing guards to harass them for 94 feet but his shot has been solidly improving over the last month and a half or so. We've basically allowed him a green light on catch-and-shoot 3s to try and take out the decision making and it's had pretty solid success. He also has an underrated midrange but we don't ever really want him to take multiple in a game unless we're leading by double digits.  Wild cards:  Langston is instant offense. Second fastest slinger in the west behind Curry. When he's in we basically ask him to run the corners, spot up, and pull if he has 2 inches of space on the 3. Sometimes he gets supernova hot and ends up with double digits in 2-4 minutes of game time. He's a defensive liability unfortunately.  Kaminsky is our NONONOYES guy, but that also makes him our NONONONO guy. Sometimes he plays really, really well and that makes our weakness of relying on Saric less of a weakness. Unfortunately, if he makes 1 3, he'll try to go for another through a stepback.  Nader -- when he played -- was maybe the only guy on the team with a consistent ability to get to the line. He was also a big body who could sometimes hit crucial 3s, but nobody really trusted him over any of the wings. The addition of Torrey Craig has made his niche on the team mostly irrelevant, although it will be nice to see him back if he can recover from his knee arthroscopy before the end of the season (unlikely)."
"I've watched the Suns more than my own team this year and believe me, their bench of Payne, Johnson, Jevon Carter, and Saric are very very good. Even saw Kaminsky throw down a Shaq like dunk against the Clips."
"The speech is my favorite Monty moment, but his reaction after Jevon Carter signed his new contract in November (following incredible hustle in the bubble), is easily second.   https://twitter.com/suns/status/1331033893122699264?s=21  I just love this dude."
I love it. Jevon Carter just needs consistency on the 3
