"Team “JM”:  Ja Morant, Jamal Murray, Jalen McDaniels, Jaden McDaniels, JaVale McGee  Team “RH”:  R.J. Hampton, Rodney Hood, Rondae Hollis-Jefferson, Rui Hachimura, Richaun Holmes    Team “JC”: Jevon Carter, Jordan Clarkson, Jarrett Culver, Jae Crowder, John Collins   Team “LD”:  Luka Doncic, Lu Dort, no other players needed."
*happy jevon carter noises*
"""Her favorite players include Sue Bird, Diana Taurasi, Kobe, Devin Booker, ..and Jevon Carter""  Wuh whaat?"
"Ayton, Book, and Craig played well tonight. Book bounced back from a rough stretch and finally made some threes. Craig played pretty decent defense (unfortunately Durant beats decent defense). Ayton allowed himself to get triggered by Blake Griffin which is too bad because outside of that mental lapse he had an excellent game.  CP3 was pretty bad (RIP Ast:TO ratio). Looked a bit sluggish which is unsurprising considering his age and how tough this road trip has been.  It might sound ridiculous but Jevon Carter and Cam lost us the game in the third. We were right with them all game and then they bricked 3s on a bunch of possessions in a row and the Nets did their Nets thing on the other end."
"Disagree. I'll use the Suns as an example. If Monty has a lineup in of Jevon Carter, Cam Payne, Bridges, Crowder, and Saric that's gelling and doing well, it takes a lot of willpower not to bring in CP3 and DBook to continue the charge. It's more of a mental thing than just looking at the scoreboard. Bringing in those two guys could either bolster your team and keep the momentum going or could cause less ball movement since those guys need the ball more."
Jevon Carter wow
It’s disgraceful that Jevon Carter isn’t being mentioned in the MVP conversation
Why is the Sixers commentator acting like Jevon Carter is a bad shooter lol.  He's a top 3 shooter on our team right now
  **Spurs @ Suns**  [](/SAS) **111 -  85** [](/PHX)  **Box Scores: [NBA](http://www.nba.com/games/20210417/SASPHX#/boxscore) &amp; [Yahoo](http://sports.yahoo.com/nba/san-antonio-spurs-phoenix-suns-2021041721)**  |**Team**|**Q1**|**Q2**|**Q3**|**Q4**|**Total**| |:---|:--|:--|:--|:--|:--| |San Antonio Spurs|28|36|23|24|111| |Phoenix Suns|19|26|23|17|85|  **TEAM STATS**  |**Team**|**PTS**|**FG**|**FG%**|**3P**|**3P%**|**FT**|**FT%**|**OREB**|**TREB**|**AST**|**PF**|**STL**|**TO**|**BLK**| |:--|:--|:--|:--|:--|:--|:--|:--|:--|:--|:--|:--|:--|:--|:--| |San Antonio Spurs|111|45-89|50.6%|12-29|41.4%|9-12|75.0%|5|46|23|17|10|12|9| |Phoenix Suns|85|36-90|40.0%|6-27|22.2%|7-16|43.8%|15|48|19|14|7|14|2|  **TEAM LEADERS**  |**Team**|**Points**|**Rebounds**|**Assists**| |:--|:--|:--|:--| |San Antonio Spurs|**19** Rudy Gay|**13** Drew Eubanks|**6** Derrick White| |Phoenix Suns|**17** Jevon Carter|**9** Deandre Ayton|**6** Chris Paul|
Things probably aren't going well when Jevon Carter is your leading scorer
jevon carter needs to get some sun on that dome
"You'd have to think the \*responsible\* players who would be in the waiver wire zone (i.e. Jevon Carter/Brad Wanamaker) of the NBA wouldn't be trying to live life too lavishly, nor could they reasonably afford to after taxes on their minimum contracts), and if you're an expensive player getting bought out, it's likely just that you were too expensive and someone will sign you on a cheaper contract and you'll continue to make money. Granted some people don't know how to act once they get the bag, but they surely aren't ignorant to the fact that they're at the bottom of the pecking order."
Jevon Carter
"This is barely scratching the surface. CP3 is a big part of the change, but there is a ton more:  1. Monty is a good coach. He gels well with the players and puts them into position to succeed.   2. Ayton missed 25 games last year, then COVID hit. While not as good as this year, we certainly would have been closer without the suspension.   3. Our bench is sooooo much better. Guys whose careers seemed to be over or sluggish (Cam Payne, Saric, Craig, Nader, Jevon Carter) have thrived in our system, have improved, and added to our depth.   4. Player growth (kinda goes along with the last one). Guys who were projects, or young, or who struggled have gotten better. Mikal is having his best year yet, Cam Johnson has come into his own, etc.   5. Injury luck. We haven't had major injury losses yet. Book missed some games, as has CP3, but overall we've been one of the healthiest teams this year.   6. Shooters. Our team can actually (generally) hit 3's. This year we're 7th in the league at 37.9%. Las year we were 16th and 2 years ago, worst in the league at 32.9%.   7. Defense. Ayton has grown to our defensive anchor, Mikal's long arms get in lanes, CP3 is a pest, as is Camp Payne and Jevon Carter. Hell, Book is even having his best year defensively.   A lot has changed for the suns. Other than Book, our roster from 3 years ago has completely changed. In 2018 our starting lineup was Book, Bledsoe, Dragan Bender, Tyson Chandler, and Isiah Canaan. 3 of those guys are now out of the league."
"This is the best Suns defense in 20 years. Personally I think this team has every bit as much potential as any Nash lead team, it's just a much more well rounded team imo. Also those Nash teams had good benches, but this team is way deeper, there's 10+ guys on this team that I feel comfortable with on the floor. Take a guy like Jevon Carter for example, he's barely started to finally see real minutes this year as of late, and he's been doing very well."
"40 wins before 20 losses!   Very gritty win for the Suns, it’s such a surreal feeling watching the Suns grind out wins with their defense and rebounding of all things. The only time I’ve seen a Suns team that’s elite on defense in my lifetime is on NBA2k.  Is Halliburton just going to kill us for the rest of his career for passing on him?   The western conference is such bullshit lol, the Suns have gone 13-2 in their last 15 and haven’t really gained any ground on the 1 seed or created separation from the 3rd seed.   Ayton is going to shock the national media when they see him in the playoffs. He dominated tonight with a huge smile on his face, it looked easy.  I’ve been a pretty big Jevon Carter critic, so I have to give him credit for his sudden overnight transformation into Mike Bibby."
"Suns matchup pretty well. Between CP3, Mikal, Crowder, Ayton, and hell Jevon Carter can be a bulldog, there's some pretty solid versatility.  At the end of the day no one is ""putting the clamps"" on the Nets. I'd say Lakers and Clippers have the best tools/defenders to do it."
Jevon Carter
I did too brother... especially since I’m a WVU fan and Jevon Carter shut him down both times we played them in college.. but turns out I’m a fan now
the jevon carter coming out party has begun
"I don't think Bridges automatically becomes the second option — Ayton is more likely. Booker is first, of course, but the Suns offense is motion-based, with a good handful of weapons, all of whom are solid passers: Bridges, Crowder, Payne, Johnson, Saric even.  My concerns are the backup guards for the Suns: Langston Galloway, E'Tuwan Moore and Jevon Carter. Carter's a great defender with a decent outside shot, but he's not an excellent playmaker. Galloway is a bucket, but his defense isn't spectacular. I don't know Moore well (I rarely paid attention to his minutes, to be honest) but he's not the first guard off the bench for a reason, you know?  It's going to be a hairy few games until CP3 is back. Hopefully the Clips/Jazz series goes to 7."
Enter: Jevon Carter
James Jones turned:  Canaan/Okobo/Melton  Booker/Crawford/Troy Daniels  Warren/Bridges  Ariza/Ryan Anderson/Bender  Ayton/Chandler  Into:  CP3/Payne/Moore  Booker/Jevon Carter/Galloway  Bridges/Cam Johnson/Abdel Nader  Crowder/Craig/Jalen Smith  Ayton/Saric/Kaminsky
"Kevin Huerter, Donte, Wendell, Simons, Shamet, ROBERT WILLIAMS, Mitch rob, Gary Trent jr, Devonte Graham, Brunson, Jevon Carter, Bruce Brown, Melton, Shake, Holiday, Allen and Walker arent busts"
Jevon Carter + Jalen Smith for Luka
"Yeah, you guys legit found something in the bubble and Jones was smart to add to it and keep that same style going with not just CP3 but Jae Crowder as well. He's had his mistakes (giving away T.J. Warren, trading De'Anthony Melton for Jevon Carter, passing on Haliburton for Jalen Smith) but none of them are that egregious and some (Warren giveaway), have helped lead to CP3 being in Phoenix which is more important."
Jevon Carter
"Closing lineup? So, Jevon Carter, Frank Kaminski, E'Twaun Moore, Jalen Smith and Torey Craig?"
"I think they've also got some really good players on the deep bench that will never see the court. Monty decided and said publicly he was done sharing minutes with lots of players so he would stop playing them, but Jevon Carter, Nader, and E'Twaun Moore all looked like really good 2-way players when they got their turns"
Jevon Carter's a thot. he's a freaking nasty hoe. he looks good. i'd love Jevon Carter to bust my pussy open and tell me about the intricacies of the full court press. if a guy shows up with a fucking flat ass and a bald head he can hit my backwalls any fucking time of day dude. if a guy's like 'im the all time wvu steals leader' im like 'take a fucking caterpillar bulldozer to my pussy like its the easton hill intersection dude'
Jevon Carter's a thot. he's a freaking nasty hoe. he looks good. i'd love Jevon Carter to bust my pussy open and tell me about the intricacies of the full court press. if a guy shows up with a fucking flat ass and a bald head he can hit my backwalls any fucking time of day dude. if a guy's like 'im the all time wvu steals leader' im like 'take a fucking caterpillar bulldozer to my pussy like its the easton hill intersection dude'
I love Jevon Carter since WVU is my fav college b ball team
"**Top 7 guaranteed protected for the Suns:**  Devin Booker  Chris Paul  Deandre Ayton  Mikal Bridges  Jae Crowder  Cam Johnson  Cam Payne  &amp;#x200B;  **Last protected slot:**  Either Torrey Craig or Dario Saric. Craig is a great spark plug and can hit the three ball well but Dario probably has a higher ceiling with his size, spacing, and passing ability. Saric is rather inconsistent though.  &amp;#x200B;  **So who would get poached:**  Whichever player out of Saric and Craig isn't protected would absolutely get taken.  Jevon Carter (his toughness on defense is great. When he gets in a rhythm/feel for the ball he has a decent shot)  &amp;#x200B;  **Possibly poached but not really rotation guys:**  E'twaun Moore (serviceable veteran backup guard)  Abdel Nader (haven't seen him in a while but we got a lot out of him when he played)  Frank Kaminsky (he's the tank)  &amp;#x200B;  **Unlikely to get poached due to inability to crack the Suns rotation:**  Jalen Smith (he plays a tough bruising style but is very raw)  Ty-Shon Alexander (I have never seen this man)  Langston Galloway (Probably has the highest percentage of and-1 3s out of total fgs made in nba history)"
"Keep: Booker, Ayton, Mikal, Paul, Johnson, Payne, Crowder, Dario.   Dario is debatable. Some people might like Craig, or want to keep Jalen to have some chance at a guy who could blossom.   Craig would get picked up. Someone would take a flyer on Smith most likely. Jevon Carter would be a good presence for a new team as well."
Jevon Carter
"I'm not gay, but I want to live in a log cabin in the woods with Jevon Carter. We won't ever have sex, but there will be a simmering erotic undercurrent as I stand in the kitchen window watching him hitting fadeaways on the driveway hoop and running cone drills shirtless, sweat pouring off his body. I'll run upstairs and masturbate, the entire time forcing myself to think of women while my thoughts drift back to Daddy Carter. I won't be able to climax and I'll eventually go back downstairs, angry and sexually frustrated. Sometimes we will look across the table at dinner and catch each other's eyes, and in that second, anything is possible, but we both deny ourselves and go back to what we were doing. One day one of us will die, and the other will bury him outside the log cabin. Then he'll go inside, pen a brief missive to his departed friend, and commit suicide, never able to deal with life without his one true platonic love"
Jevon Carter's a thot. he's a freaking nasty hoe. he looks good. i'd love Jevon Carter to bust my pussy open and tell me about the intricacies of the full court press. if a guy shows up with a fucking flat ass and a bald head he can hit my backwalls any fucking time of day dude. if a guy's like 'im the all time wvu steals leader' im like 'take a fucking caterpillar bulldozer to my pussy like its the easton hill intersection dude'
"Suns bench:  Guards - Cam Payne (can start on any team), Etwan Moore (proven vet) Langston Galloway (Microwave scorer from downtown and proven starter), Jevon Carter (best defender among the guards and capable 3pt shooter), Tyshon Alexander (rookie, 3 pt sniper)  Forwards - Cam Johnson (has been a starter as well), Torrey Craig (Proven Vet and rebounder w a sweet 3pt stroke)  PF/C - Dario Saric (proven stretch big), Frank Kaminsky (also proven stretch big) - both of them are capable passers btw ; Jalen Smith (Rookie but can shoot the 3 and block shots/rebound)  Just looking at the Bench, we can field another starting 5 with Cam Payne, Etwan Moore, Cam Johnson, Torrey Craig and Dario Saric and still be able to defend and outscore another average NBA starting 5, and have capable backups in Galloway, Jevon Carter, and Frank Kaminsky to run vs other 2nd units...that's a DEEP bench right there...  I don't think the hawks have a much better bench TBH, outside of Gallinari, Lou Williams and Huerter... Quite the opposite TBH with the Suns probably having the best Bench composition in the entire league TBH.  The bench has been one of the major strengths of the Suns and will be for years to come . Go SUNS!!!!"
"Ideally CP3 opts out for a multi-year deal at less annually. We use the new space to lock down Payne and maybe Craig. If we can then get a backup 5 behind Ayton at a reasonable price, I think we're set to see what we can do for a few years. At that point our team looks like:  Guards of CP3, Book, Cam Payne, and Jevon Carter on multi year deals  Forwards of Mikal Bridges, Jae Crowder, Cam Johnson, Torrey Craig, Jalen Smith  Centers of Ayton, the hypothetical backup I talked about and Dario"
Jevon Carter look just like CP3 lmao
Jevon Carter exists
"It’s almost like hitting 41% of your 3s instead of 28% while not getting better looks opens up the offense substantially! I mean it would be one thing if Thibs got Randle much better looks or something, but even Knicks fans recognized that the biggest difference between the regular season and the first round is that Randle just stopped hitting those contested shots that he was hitting all year, the offense didn’t actually improve.   Who improved???? How about Cam Payne going from out of the league to one of the best backups, Mikal Bridges, Deandre Ayton, Cam Johnson, and Jevon Carter? Ayton’s offense didn’t take a step back, he just got less looks because our offense was an incredibly well oiled machine that didn’t rely on him to get shots like we needed out of him the previous two years... thanks to Monty. And then I know it’s tough to gauge defense if you’re not watching a team, but Ayton has gone from a very below average defender his rookie year to our defensive anchor and most important defender... in the two years under Monty.  It’s wild that your argument is that... our players didn’t improve... but we went from the 17th best record to the 2nd best record. Could that be... coaching????? I mean I’m sure you’re going to respond with CP3, despite the fact that the first round clearly, clearly showed that our team’s success isn’t dependent on CP3."
imagine a suns hawks finals and jevon carter locks trae down like he did with Press Virginia
I wouldn't give up Jevon Carter
Cameron Johnson  ❌  Frank Kaminsky ❌  Cameron Payne ❌  Dario Saric ❌  Torrey Craig ❌  Jevon Carter ❌  After those guys I'll consider Kuzma
And what’d he say to Jevon Carter? The horror of it all
IN JEVON CARTER WE TRUST.  CHEERS BEERS MOUNTAINEERS
"I don't want to jinx it, but my boy Jevon Carter going to get minuets tonight!"
We just gunna disrespect jevon carter like that?
Do you guys really believe this team is as successful with a tandem of Cam Payne and Jevon Carter as opposed to Chris Paul?
"The fourth quarter was for the benches to have a little fun. Frank almost tried to finish an alley-oop (he didn’t) and then had a drive to the basket for an and-one. E’Twaun and Langston got some run along with Frank and the Cams. A minute later Jevon Carter got out there too. Langston was so cold from not playing a couple months he missed a pair of wiiiide open threes.  About this time, with 6:51 left in a 32-point lead, a few hundred Suns fans resumed a time-honored tradition of leaving early to beat the traffic and listen to the end of the game on the radio.     Why not stay until the end anwyyas ? As you are there and wait for others to leave"
"I'm not gay, but I want to live in a log cabin in the woods with Jevon Carter. We won't ever have sex, but there will be a simmering erotic undercurrent as I stand in the kitchen window watching him hitting fadeaways on the driveway hoop and running cone drills shirtless, sweat pouring off his body. I'll run upstairs and masturbate, the entire time forcing myself to think of women while my thoughts drift back to Daddy Carter. I won't be able to climax and I'll eventually go back downstairs, angry and sexually frustrated. Sometimes we will look across the table at dinner and catch each other's eyes, and in that second, anything is possible, but we both deny ourselves and go back to what we were doing. One day one of us will die, and the other will bury him outside the log cabin. Then he'll go inside, pen a brief missive to his departed friend, and commit suicide, never able to deal with life without his one true platonic love."
Digging the mismatched sneakers on Jevon Carter
If you squint your eyes Jevon Carter becomes CP3
1. Cameron Payne  2. Devin Booker  3. Chris Paul   4. DeAndre Ayton  5. Jae Crowder  6. Mikal Bridges  7. Frank Kaminsky  8. Torrey Craig  9. Dario Saric  10. Jevon Carter
Melton was traded. Suns needed to dump Josh Jackson's salary. They had to give up Melton and a conditional 2nd rounder to us. They got Jevon Carter and 1 other player in return.
did u add in Jevon Carter and leave out Luka Doncic and Trae Young?
Jevon Carter is not a good playmaker. He's better as a shooting guard.
"ayton has been great, booker has played so badly the last 2 games it's clear that there's something not right with him mentally.    the lakers are in his head, at one point they left him totally wide open from the 3 point line and just dared him to shoot.. not even bothering to close out  little things like that are adding up to throw booker off his game, it's his first trip to the playoffs ever and the combination of nerves + LA's tight defense + losing CP3 are wearing on him.  and it all cumulated in shoving shroeder and fouling out at the end of game3  I know the playoffs are not the time when you want to mess with your lineups, you generally know which guys are gonna be in your rotation going in, but the suns have to do something at this point.    Paul can barely move and when he is on the court he can't shoot, can't defend and turns the ball over a lot.   They need Payne to play big minutes and be effective in most of them, they might need to start playing jevon carter, try to generate more looks for torrey craig and bridges  But really the big thing is booker needs to play better... if he's going to mentally check out then the suns wont win.  If his teammates were hitting some 3's that would help him I think because LA couldn't sell out the 3 point line as much to pack the paint"
"Fuck it, Jevon Carter SZN"
There is no answer that is good for the Suns. My guess would be Jevon Carter in when Schroeder is in and LeBron is out. Maybe you let Chris Paul play like 10 minutes but how he is utilized will have to change if he can’t shoot. When Booker is doubled goal has to be getting CP in movement to attack the numbers.
"Eh their whole team is cool besides Jae, Booker, and CP3 ( even tho I like CP3). S/O Jevon Carter"
"I wonder if we'll see other players utilized in Game 3 by the Suns. They have a deep bench of shooters, Torrey Craig, Etuwan Moore, Langston Galloway, and even Jevon Carter can get streaky. If I'm Monty Williams, I'm looking for my bench to step it up on defense against Schroeder when Lebron and AD are out.   For those that are trying to say this series is over without CP3 is maybe forgetting how good these bench players have been. The Suns are deep. And they have the best record in the NBA when they're playing AWAY games."
"I wouldn't rest Paul but I would reduce his minutes and I would give some of the extra minutes to Jevon carter, to shut down Schroder.  They have an extra day between 3 &amp; 4 so Paul will already have extra rest built in. I would play him in game 3, but in limited minutes to anchor specific lineups."
they're letting cameron payne run around and foul like jevon carter on press virginia lol
Man if we’re going off college tactics just trade for Jevon Carter
I like that the two guys with the least hair are 49 y/o Monty Williams and 25 y/o Jevon Carter.
"God I hated the national announcers suggesting that Book assume PG roles with an injured CP3. I am not a Book hater at all and I also admit to putting the NBA on the back burner especially since the Suns haven't been good but.. really?! Book at point? No offense to Book, he is ELITE, but the offense runs better with a real PG. I was hesitant for the Suns to give up Rubio... Suns lose CP3 we're in danger. Don't get wrong I love Cam Payne and I actually think Jevon Carter can evolve (my favorite player on this team) but the Suns NEED a true PG. Book isn't a true PG."
"The saddest moment in a nephew's life isn't when he learns Santa Claus isn't real, it's when he learns Jevon Carter is"
"When Jevon Carter left for college he looked at his father and said ""you're the man of the house now"""
"Jevon Carter was bit by a king cobra. After five days of excruciating pain, the cobra died"
Jevon Carter won too
"That was a loaded draft: Sexton, SGA, Miles Bridges, Mikal Bridges  And then Jevon Carter, Jalen Brunson, Devonte Graham ALL in the 2nd round"
"damn people forget about crowder, aytom and bridges defense 😭 they have their secret weapon in jevon carter too"
I WANT JEVON CARTER BIG BUCKETS
Have you seen Jevon Carter? Clearly a clone.
1. Devin Booker  2. Chris Paul  3. Mikal Bridges  4. Jae Crowder  5. Deandre Ayton  6. Cameron Payne  7. Cameron Johnson  8. Dario Saric  9. Torrey Craig  10. Jevon Carter
"Booker, Bridges, Ayton, Cam Johnson, Jevon Carter, and Jalen Smith are currently the 2 seed in the west."
on free agency  etwuan moore  langston galloway  frank kaminsky  abdel nader  torrey craig  tyshon alexander  getting traded  jevon carter  jalen smith  cam johnson  dario saric
"Understandable, we do have Jevon Carter after all"
Booker  Mikal  Ayton  Cam johnson  Cam Payne  Jevon Carter  CP3  Jae crowder or torrey Craig. probably crowder. he would have a higher chance of being drafted but could see both leaving if not protected.
"CP3, Book, Mikal, Jae Crowder, DA, Cameron Johnson, Cameron Payne, Jevon Carter? (8 seems like a tossup tbh)"
"All of the young players made improvements (Mikal Bridges, Cam Johnson, Jevon Carter, Cam Payne) and the culture of the Suns completely changed. That started last year before CP3. Although CP3 deserves a ton of credit, it's easy to see how Monty has done an amazing job and deserves this award"
"I don't see how he deserves it over Monty. Monty led the Suns from the 10th seed to a game behind the best record in the league.  He completely revitalized the career of Cam Payne, Dario found a new role as a small ball center in Monty's system, we brought Craig over from Milwaukee and he fit in right away. Obviously the CP3 addition helped but most people expected the Suns to be a 6 seed at best.  If someone told you Cam Payne, Dario Saric, Jevon Carter, Cam Johnson, and Frank Kaminsky would lead the best bench in the NBA before this year you wouldn't believe it, but they've all thrived under Monty's system."
"I don't see how he deserves it over Monty. I don't wanna hear bubble talk because everyone always says those games are overrated because almost all of our opponents were missing players.   Monty deserves immense credit for leading the Suns from the 10th seed to a game behind the best record in the league.  He completely revitalized the career of Cam Payne, Dario found a new role as a small ball center in Monty's system, we brought Craig over from Milwaukee and he fit in right away. Obviously the CP3 addition helped but most people expected the Suns to be a 6 seed at best.  If someone told you Cam Payne, Dario Saric, Jevon Carter, Cam Johnson, and Frank Kaminsky would lead one of the best benches before this year you wouldn't believe it, but they've all thrived under Monty's system."
