"&gt;believe that the draft does not have to be nearly as hard as many teams will make it. I’m not interested in what the mocks say about where a guy should go. Five years will pass and when we look back at this 2018 draft, we’ll see a long line of players who fail to have real careers in the NBA. In the moment, the selections will not seem ludicrous because the mocks have brainwashed us to believe that the best prospects are listed in the correct range and order. So when I hear people say, “That is too high [or too low] to take [Player A],” I immediately cringe. Too high or too low according to what?  &gt;I care about one thing when it comes to the draft: getting a player who does not suck. Some of these guys will be stars, some might end up just being role players, but I am 100 percent confident none of them will fail. Enough with the small talk. Time to put my money where my mouth is. Vernodamus is here to save the day. These players will not suck (and if they do, I will absolutely blame the situation and the coaching):   * **Marvin Bagley III**   &gt;I seriously wonder if I have different eyeballs than everyone else. There is a 0 percent chance that Bagley is not awesome in the NBA. I’m not sure that he has ever played in a game in his life where he was not the best player on the floor. Coach K said the following regarding Bagley: “He is not a good runner; he’s an amazing runner. And then he’s an amazing repeated jumper. In other words, he doesn’t really take time to even land, he just pops right back up. He wants to learn, he has no demons, he’s a great kid, he’s smart, and has an incredible motor. He never has a bad day. He’s a treasure, really. He’s going to be one of the great players in the NBA during his time.” Coach K also said that in his 38 years at Duke he has had only one other player like him: Kyrie Irving. I honestly have no idea how he is not the consensus first pick in the draft.  * **Luka Doncic**  &gt;I have expressed my worry that Doncic might not have the athleticism it takes to be a massive star in the NBA. That being said, he is smart, he plays hard, and he can dribble, pass, and shoot. I’m positive he is not going to be a failure. He is too good at basketball to fail. He also has a massive tiger tattoo on his forearm, which is a big plus. More than anything, I have warmed up to him more and more since the word that NBA teams have cooled on him, because that means he is probably amazing.  * **Wendell Carter Jr.**  &gt;This is a little reminiscent of when Al Horford and Joakim Noah were in the same draft in 2007. I loved both of them and thought there was no chance that either of them would fail. It was just a matter of how good they were going to be. Bagley is the best prospect in the draft in my opinion, but Carter is also a beast. His fundamentals are ridiculous, he is huge and has a massive wingspan — and his shot looks as good as any player’s in the draft. A smart big that can run the floor, plays hard, and can shoot 3s? Those guys don’t fail.  * **Collin Sexton**  &gt;I love Sexton. He is smart, he is lightning fast, and he plays every game like it is his last game on earth. An absolute fighter who routinely plays his best against the best competition. You need guys like Sexton in the NBA playoffs. I think his ceiling is much higher than most people seem to think, and I know, no matter what, I will love having this guy on my team.  * **Miles Bridges**  &gt;He can dribble, pass, and shoot. He is a freak athlete. He is a smart kid that comes off great in all of his interviews. He is tough as nails. You can have the guys that you think are going to be good, and I’ll take the one that I know will be. Miles Bridges is a perfect example of why teams and analysts miss in the NBA draft. He will absolutely be better than many players taken in front of him and you can see it from a mile away.  * **Jacob Evans**  &gt;Cincinnati won a school-record 31 games, and Evans was the best prospect on the team. His sophomore season he was a finalist for the Jerry West Award, which goes to the best shooting guard in the country, and his junior year he was a finalist for the Julius Erving Award, which goes to the best small forward in the country. Cincy coach Mick Cronin had this to say about him: “He is a winner. He shoots a high percentage. He’s an elite defender. He blocks shots. He guards point guards. He rebounds. He just does so many things, and he’s a coach on the floor. He’s such a smart player.” Umm, sold.  * **Donte DiVincenzo**  &gt;At one point during this draft process, someone asked me, “If we saw DiVincenzo drop 31 in the title game, be great all season, and test physically off the charts, then why in the hell is he supposed to go late first round?” Great question, anonymous guy! The answer is because that is where the mock draft consensus has him slotted, and the mock draft consensus is dumb. He’s a big-time competitor, super athlete, can shoot the cover off the ball, and in the biggest game of the season, he looked like the best player on maybe the best college team I have ever seen.  * **Rawle Alkins**  &gt;Brooklyn in the house! Alkins was a high school force of nature who won three city titles and two state championships in New York. He had a foot issue that hampered his career at Arizona, but this kid has so many attributes that I love. Unstoppable motor, built like a linebacker, good-looking shot, and do-or-die playing style. He has been projected too low since this process started. Alkins will be a fan favorite wherever he plays. You want a Marcus Smart, Tony Allen, or P.J. Tucker–type player when you need a big play in a big game. I see that with Alkins.  * **Jevon Carter**  &gt;You do not want to be guarded by Jevon Carter. Bob Huggins called him “the best defensive player I have ever coached.” Whoa. Carter reminds me of the kind of guy who is playing in the park where the winner stays on the court, and you could leave for six hours and come back and his team would still be playing. He was conference defensive player of the year twice, and national defensive player of the year last year. He affects every game that he plays in. Bona fide bulldog. Every roster in the NBA could use a guy like him."
End of the bench player with Jevon Carter gone. Hope we target another wing because as it stands it’s gonna be a whole lot of Cam Johnson right now
What do you mean lol right now the backups are Jevon Carter and Cam Thomas...  A backup playmaker is definitely a need right now.
"Slightly surprised about Mike James, but he and Chiozza are now replaced by Jevon Carter and Cam Thomas, which is probably a net upgrade."
Jevon Carter is better. They still need to find a backup PG
"Bob Huggins saw him in Miami IIRC. He was picking his man up full court and Bob said something like we are getting that kid. This was before Press Virginia. Carter comes to campus and we had Juwan Staten, Gary Browne, Jaysean Paige, Tarik Phillip and Dax Miles. Huggs called Kevin Mackey and said he had all these guards and asked Mackey to show him some of his presses he used at Cleveland State. The first half of the first game was a disaster and created the longest running thread I've ever seen. It was still going on one of the WVU boards 6 years later. Any time someone suggested that the game passed Bob by, the thread would pop to try top. Huggs has this practice punishment. If someone does something stupid, there are treadmills on the side of the court and the player would have jump on one and turn it to the speed. Jevon was said to have really liked them."
Definitely not. A Jevon Carter upgrade I’d say. Plus it helps our cap situation.
Jevon Carter
"I could see it, with the Lakers getting Russ n the nets getting Jevon carter"
"Mountaineer Jevon Carter going to the Nets  Excited for him, he's a good defender. Not a rim protector, so no one will care"
29 tonight and Jevon Carter
It's better this way. Now I don't have to be mad at James Jones for giving up Jevon Carter and Jaden Spring for Shamet.  Not that he would've taken the consensus guy there anyway lol. Probably would've been someone super unexpected again
"They traded for Jevon Carter who is a good defender after giving up Shamet, their bench scorer. This looks to be a Shamet/Dinwiddie replacement."
"They traded for their Defense guy after giving up Shamet, and getting Jevon Carter. These are all bench players for now though. Was hoping to see a trade for a veteran with these picks."
Jevon Carter 2.0
Who's Carter Jevon-Carter?
Carter. Jevon Carter
Jevon Carter
Watching Jevon Carter play defense in college was a thing of beauty.
"Yesterday I read an article that OKC has had talks to trade SGA for Shamet (and other throw-in pieces.)  Today, I read the Suns got Shamet for *Jevon Carter.*  I don't get why anyone pretends like OKC makes good moves, should be rooted for, etc.  Their front office sucks."
"The Suns gave up a first rounder for taller Jevon Carter, you should be happy"
Jevon Carter is a dog.  I hope he makes it in Brooklyn.
Jevon Carter is even worse.
"It’s a pretty fair trade, I’m going to be honest. Jevon Carter has lots of heart though!"
"This must be to set up another move with our picks, we have no reason to get this many rookies  I've always kinda liked Jevon Carter, wouldn't be totally shocked if he contributed more next year than Shamet did this year."
"For context to confused non-Suns fans and maybe some confused Suns fans, Jevon Carter is your quintessential hustle guy, but he’s undersized and didn’t see the floor at all in the playoffs. My guess is James Jones wanted to swap him out for a guy that has at least seen real playoff minutes on top of being a solid shooter"
Nets trade 19 pick for Shamet  Then trade Shamet for 29 pick and Jevon Carter  Is Jevon and 29 pick better than Bey?
But can he be traded for Phoenix for Jevon Carter?
"This draft is stacked in the top 5 or 6 but falls off pretty quickly after that. Most 29th picks don't turn into anything good, while we already know that Shamet is a rotation guy. Sucks to lose Jevon Carter though I like him."
Jevon Carter adds to our defensive needs so I’m not calling it a net loss yet
"jevon carter underrated and late firsts are useful cost-controlled players, good for nets"
Jevon Carter
"Suns need to sub in Jevon Carter, get that WVU full-court press going"
Jevon Carter would lock up Giannis Antetokounmpo.
Cam Payne and Jevon Carter
"This ignores the other side of the trade. In the scenario you've laid out, the team that gets Simmons will have given up less to get him, so will be in a stronger position themselves. So this only works if the team that gets Ben isn't also a contender.  Obviously this won't happen, but just to illustrate, suppose Simmons' value drops enough that he gets traded to the Nets for Jevon Carter. Sure, that benefits anyone who goes up against Philly in the playoffs. But now the Nets are much stronger. They don't need to worry about Ben's offensive deficiencies -- they have enough offense already. And his defensive skills will help."
"So a team with 9 guys that are legit players is bad depth now? And Paul Millsap and James Johnson are solid rotation pieces who are first off the bench guys for many other teams.  I don’t see what teams really have much better benches than that. Then we also have Cam Thomas, of which many believe he will be a great player, Jevon Carter who could probs be a second string PG on a different team, and some solid dudes 13-15. Sure we may lose a game if all three are out, but that happened like once all last year. We also fell into a bit of a hole early without a roster close to as good as it is now. The nets had one of the most crazily fluctuating rosters in the league last season and still were better than the bucks. I don’t see why their depth is so much better than ours."
"“I can name 15-20 PGs who are better defensively than Curry.”  Then why’d you have to bring in shooting guards?  Some of the people you named are legitimately terrible defenders.  Schroeder is a Celtic so now you’re gonna pretend he’s not one of the worst PG defenders in basketball?  Kyrie is terrible and you had some tired homer bullshit about him being “good when he’s locked in”.  I should stop responding now that it’s clear you’re a serious, serious Celtic homer.  But here are some more who aren’t better than Steph on defense, and I’m just kinda surprised at how random your list seemed to recruit bad defenders from strange places, even the bench.  Fox (dude…), Neto, Dinwiddie (seriously, what lol?), Jevon Carter (you don’t get to say a man who comes in for 12 mins a game and guards backups is an elite defender).  Then you have combo guards like Jrue, Caruso, Kris Dunn etc.  only Jrue can really be considered a point here.  Then you have people like Josh Hart, KCP and Marcus Smart who are absolutely not point guards.  You clearly exaggerated and your weird defensive appraisals here are all over the map and often wrong.  You couldn’t name 15-20 PGs who were better even when you got rookies and shooting guards."
damn nice of him to give a shoutout to that dawg ~~Davion Mitchell~~ Jevon Carter
&gt;He said he'd get clamped in the summer league by Jevon Carter.  Do you have that quote?
He just thought Luka wasn't that nice because he dribbled a lot and wasn't an explosive athlete. He said he'd get clamped in the summer league by Jevon Carter. He just thought he was trash and would get exposed in the NBA and a lot of it had to do with not taking Europe seriously. He wasn't alone either.
"This is a list of guards who're all within 2 inches of Steph and clearly better defenders - Kyle Lowry, FVV, Fox, Cory Joseph, Schroder, Delon Wright, Hali, Beverley, Jrue, Smart, Conley, Neto, Rubio, Jevon Carter, Kris Dunn, Dinwiddie, Rozier, Donte, Caruso, KCP, Brogdon, Josh Hart."
"The team without an unproven rookie, Jevon Carter, Dendre Bembry and James Johnson"
"Nets have depth too lol what  Their top 10 guys: Kyrie, Harden, Durant, Joe Harris, Patty Mills, Blake Griffin, LMA, Bruce Brown, Millsap, Claxton.   James Johnson/Jahlil/Jevon Carter at the end of the bench"
"Asking Suns fan perspective... do you think Jevon Carter will get minutes?  Kyrie, Harden and Mills - looks to be a decent rotation at the lead or secondary ball-handler for the Nets. All 3 do not have superior defense which Carter has."
Jevon Carter. Put some respect on our boy's name.
"I can see you have no intention on discussing this in good faith.  The irony about you talking about ignorance . . .  You said: ""Hali would have played maybe 10 min a game. Maybe"" You do realise both Jevon Carter (60 games) and Langston Galloway (40 games) averaged 12 minutes per game for us? More than your suggested minutes for Haliburton, a far superior player. Talk about ignorance and stupidity . . .  As I said. It's not a Payne v Haliburton argument. They would have split minutes at around 15 each. But you are too simple to figure that out haha. We are done here. Yelling at a brick wall is a waste of time"
Your favorite player is Jevon Carter?
"I wanna see Jevon Carter on him. Carter ate him in college, i really doubt it'd be the same result though"
Warriors: Ben Simmons  Blazers: Jevon Carter and a 2nd  Nets: Damian Lillard and Steph Curry
"Lmao damn can you tell me which 7 of Ricky Rubio, DeAndre Ayton, Mikal Bridges, Kelly Oubre, Cameron Payne, Dario Saric, Aaron Baynes, Cameron Johnson, Jevon Carter didn’t belong in the NBA?"
You can replace brunsen with Jevon Carter
We traded that pick for Landry Shamet and then traded Shamet a year later for Jevon Carter. And we are extremely thin at the wing position
"And no other real playmaker. Nash is trying to make Jevon Carter and Patty Mills run the offense, but that shit just isn’t working"
Why the hell is Bruce Brown playing so little? He was great in the playoffs last season. He surely deserves a starting spot more than Jevon Carter.
Jesus Jevon carter and Claxton suck
Jevon Carter played some great hustle defense tonight too. Millsap wasn't bad either.
JEVON CARTER IS THE SAUCE
They didn’t look too good last night.  Milsap and Aldridge looked washed  Joe Harris is a clear liability when he isn’t hot from three  They had guys like Jevon Carter and James Johnson playing rotational minutes
Bruce Brown is gonna be a key part of the rotation anyway. We all know what he's capable of  If you noticed Nash played end of bench guys like Jevon Carter who will likely never see the floor in a playoff setting heavy minutes. He's experimenting with lineups and strategies   Also a big reason Harden was so passive and just forcing lobs to Claxton that obviously didn't work. We all know Harden could have gone out there like Giannis and KD and dropped 30/10 himself but they were trying to get Claxton acclimated to his role as a rim runner and giving him reps to establish chemistry
"I’m surprised Bruce Brown only played four minutes. He’s a switchable defender that doesn’t hurt you too much on offense. Surely he provides more than Jevon Carter or an absolutely cooked LMA. I know it’s just the regular season and Nash may want to just try some different lineups, but it really seems like the Nets gave up on any remotely defense-focused lineups."
There’s gotta be a better option than those Jevon Carter minutes he was asssssssss
"He did the same exact thing in the regular season last year, he was very passive in the regular season and more interested in getting the role players the ball. It’d be a closer game if he didn’t keep spamming those lobs to Claxton that only worked once. Nash also did some funky things, they were kind of feeling out the new roster. Like no way Jevon Carter should’ve played all those minutes."
Is Jevon Carter our new TLC??
behind Jevon Carter in rotation LMAO
May be able to fix playing Jevon Carter 18 minutes though simply by just taking some of those.
Where the fuck was Bruce Brown tonight? Was he injured?  In no world should you be down 20+ points and playing James Johnson/Jevon Carter over Bruce Brown
Going from Kyrie Irving to having to play Jevon Carter 20 minutes… shits rough
Yeah let’s let Jevon Carter air it out 4 seconds into the shotclock down 17 in the 4th
What’s the word on Jevon Carter? I feel like whenever he has the ball he fucks it up somehow.
Jevon Carter is ass lol
Hot take: Nets should be playing Cam Thomas instead of Jevon Carter since they're so cold right now.
"Traded Jevon Carter for him. Jevon wasn’t getting any playing time in the playoffs so they wanted another guard besides cp3, book, &amp; Payne."
"I meant that picking any one player was a thought exercise, since it's not likely any of these guys (or Jevon Carter) are going to be 100% nailed on; rather, the starter/closer will change game-to-game."
"They already tested it out tonight with Jevon Carter, because his shooting has been phenomenal so far this preseason.  It looks like they’ll just add another shooter so the lineup will look something like   Harden - Carter - Harris - KD - Blake/Claxton  But honestly that 2 slot will probably be rotated with different guys depending on the match up and I can see Bruce, Mills, or even Bembry getting the start throughout the season.   If you watched the game tonight they ran some interesting lineups and even ran the ball through Aldridge at times on the second unit for a little bit. Nets are gonna get creative this year for sure."
Option D. Jevon Carter
"Good to have confirmation.  I pretty firmly believe that the Nets will be fine and should still be a top 3 favorite (health with determine a lot of that). Obviously their ceiling is lower without Irving, but with Patty Mills and Cam Thomas, and Jevon Carter, they have some solid PGs. Time will stell, but if you forced me to bet on a title team, I still might bet the Nets."
"Bro stop there is a huge difference between high school sharp shooters and E’Twan Moore, Jevon Carter and Frank Kaminsky.   To say:  &gt; there’s kids in every high school that can shoot like that  Is such poor perspective considering two of those players are NBA guards and the third is Frank Kaminsky is a stretch big who was college player of the year. Jevon Carter was ranked top 5 in his position in high school and even he wasn’t shooting like that considering the fact that he has improved since and he wasn’t practicing at NBA range. There’s no highschool in Utah that has multiple players that can hit “every 3 point shot without missing” at NBA range at the rate remotely close to what these guys do."
Yep that's a good point. And Jevon Carter  was considered a defensive specialist at WVU and coming into the league and even he was splashing.
"I hung around after game 3 of the WCF at Staples this past season and proceeded to watch Kaminsky, Jevon Carter and E'Twan Moore stroll back out to get shots up. All 3 of these guys were automatic from three. They just took turns shooting around the world style from each spot around the arc. Not only did they rarely miss, they didn't even hit the rim. And I realized just how elite NBA players are, even the end of bench guys. I'm gonna try and find a video. It was insane."
traded jevon carter and the 29th pick for him
"Harden/Joe Harris/KD/Blake/LMA  Bench : Patty Mills/Cam Thomas/Bruce Brown/Millsap/Claxton  With James Johnson/Jevon Carter/ Bembry/ Day'Ron Sharpe as end of bench  This team can win a ring 100%, not like they're favorite and are gonna smash teams left and right but on a good run they can"
Jevon Carter looks like Common  That is all
Jevon Carter-Bruce Brown-Sekou-LaMarcus Aldridge-Nicolas Claxton starting lineup lets go
"Bruce Brown, Jevon Carter and Sekou Doumbouya are the highest paid available players"
"Jevon Carter. He's too good, too ferocious, and too hard of a worker to never get run with this Brooklyn team"
"I think he won’t play much but he’s a nice option to have, probably somewhere between 16-18mins if that. I think we will get THT playing up a few positions (up to SF) and Nunn as backup PG/SG most of the time.    I certainly see that rotation as more than capable of dealing with Patty Mills and Jevon Carter for the Nets, Payne for the Suns, Divicienzo for the Bucks, etc."
That’s how Nets fans feel about Jevon Carter lol
"Griffin can stay. Millsap, James Johnson and Jevon Carter can go."
Jevon Carter in Knicks not scoring again
we really had Cam Thomas sitting on the bench earlier this year so we could play Jevon Carter lmfaooo
"Brooklyn [traded Shamet for Jevon Carter and draft rights to Day'Ron Sharpe](https://www.nba.com/suns/suns-acquire-landry-shamet-brooklyn)  They're saying with Harris out and no Kyrie, they wish they kept Shamet who is a shooter"
"Can you imagine Kyrie on his return to the team right before playoffs, especially if Nets retain 1st seed after close contention from Bucks/Heat? If I was one of his nonsuperstar teammates ( Bembry, Jevon Carter, or Cam Thomas) I'd care more about the PT I'm losing to a regular season ghost.  Side note, anyone else genuinely curious what influenced Kyrie so much while growing up?"
It would be coming at the expense of Jevon Carter.. he’s not very good
Lol Jevon Carter?
Jevon Carter forgot he was a Net for a minute and randomly screams with joy after the Suns victory
For the Nets it’s Jevon Carter
Jevon Carter makes me very very angry
TLC in 2nd place and now this year it’s Jevon Carter lol
Probably Jevon Carter
If Jevon carter is hitting 3s it’s over lol
Jevon Carter is shooting 27% from the field this season lol
But is that a result of getting Patty Mills or guys like Deandre Bembry and Jevon Carter?
"Early on, he was. But Joe's picked it up as of late and regardless, Joey is still significantly better than Jevon Carter lmao"
felt like things really turned when Nash finally benched Blake and Jevon Carter
Improved on some ways too. McGee is a legit backup C. And shamet is better than Jevon carter or etwuan Moore. We miss Torrey Craig though :(
"Ur not wrong both are pretty bad. There is times where we have had jevon Carter, bembry, brown on the floor at the same time for multiple stretches I'm just saying"
Don’t speak poorly of Jevon Carter ever again you ninnywagon
Ngl whenever Jevon Carter gets the ball I get irrationally mad because he just takes some stupid shots
"Bruh, we really saw how well Harden could do with just a bunch of shooters and lob threats in Houston and then brought him to Brooklyn just so we can run him out there with DeAndre Bembry, Blake Griffin, Jevon Carter, and Bruce Brown."
"A win is a win is a win.  FYI, before this game, Jevon Carter averaging 26.4% from the field, and 29.7% from the 3."
"Pablo prigioni, Rubio, Jevon Carter"
Our rookies played better than James Johnson and Jevon Carter. I can’t believe they’re still getting minutes.
Jevon Carter is the oldest looking 26 year old I’ve seen since Greg Oden.
Jevon Carter is so bad
Jevon Carter plays with so much energy I miss him 😢
"I really like our bench. They're not elite our anything, but a high effort and solid group. They had a bad night, but they're not a bad group. Our biggest issue is our ball handling depth which shouldn't have been an issue. We planned around having Kyrie and had no backup plans when he dipped last minute. Jevon Carter was not supposed to be in the rotation."
"Patty Mills, Jevon Carter, DeAndre Bembry, Paul Millsap and LaMarcus Aldridge.. pretty bad. Usually LMA is carrying that unit but he was off tonight."
We win the Jevon Carter Memorial Cup
