  **Suns @ Spurs**  [](/PHX) **123 -  121** [](/SAS)  **Box Scores: [NBA](http://www.nba.com/games/20210516/PHXSAS#/boxscore) &amp; [Yahoo](http://sports.yahoo.com/nba/phoenix-suns-san-antonio-spurs-2021051624)**  |**Team**|**Q1**|**Q2**|**Q3**|**Q4**|**Total**| |:---|:--|:--|:--|:--|:--| |Phoenix Suns|27|25|37|34|123| |San Antonio Spurs|23|38|24|36|121|  **TEAM STATS**  |**Team**|**PTS**|**FG**|**FG%**|**3P**|**3P%**|**FT**|**FT%**|**OREB**|**TREB**|**AST**|**PF**|**STL**|**TO**|**BLK**| |:--|:--|:--|:--|:--|:--|:--|:--|:--|:--|:--|:--|:--|:--|:--| |Phoenix Suns|123|53-104|51.0%|13-35|37.1%|4-4|100%|10|48|36|13|7|8|5| |San Antonio Spurs|121|50-98|51.0%|7-24|29.2%|14-19|73.7%|11|46|30|8|5|10|5|  **TEAM LEADERS**  |**Team**|**Points**|**Rebounds**|**Assists**| |:--|:--|:--|:--| |Phoenix Suns|**22** E'Twaun Moore|**10** Jalen Smith|**9** Jevon Carter| |San Antonio Spurs|**23** DeMar DeRozan|**10** Jakob Poeltl|**7** Tre Jones|
MVP: Jevon Carter
"6'1"", bald as a baby's behind Jevon Carter just casually one assist away from a triple-double, and just happening to be leading the Suns in offensive rebounds."
"I was begging for that Jevon Carter triple double. I wanted it so badly. Would have been an awesome birthday present. I guess I'll settle for a hype E'Twaun Moore game winner from three.  Fun game. Stix looked like an actual NBA player, our guys who haven't seen the floor in awhile stepped up, and we won. Now we just have to hope the Kings still observe our SunKings alliance and pull it off tonight against the Jazz. At the very least, Utah is going to have to play their rotation players tonight.  GG San Antonio. Good luck in the play-ins."
UNDERSTANDABLE THE SPURS LOST TO JEVON “ALLEN IVERSON” CARTER AND FRANK “LITERALLY MAGIC JOHNSON” KAMINSKY
Joe Caldwell  Joe Barry Carroll  Jack Coleman  Jason Caffey  Jose Calderon  Jim Caldwell  Jimmy Carruth  Jake Carter  Jevon Carter  Jay Carty  John Celestand  Jerry Chambers  John Chaney  Joe Chealey  Josh Childress  Jim Chones  Jordan Clarkson  Jim Cleamons  John Clemens  John Coker  Jason Collier  James Collins  Jarron Collins  Jason Collins  Jimmy Collins  John Collins  Joe Colone  Jeff Cook  Joe Cooke  Jack Cooley  Joe Cooper  Jack Cotton  James Cotton  John Coughran  Joe Courtney  John Cox  Johnny Cox  Jamal Crawford  Joe Crawford  Jordan Crawford  Jim Creighton  Joe Crispin  Javaris Crittenton  Jeffrey Crompton  Jeff Cross  John Crotty  Jae Crowder  Jared Cunningham  JamesOn Curry
That’s what happens when you have future hall of famer Jevon Carter on your team
Jevon Carter
"he should be back but I think the rotation is paper thin outside of ayton and saric bc frank can’t really do nearly as much defensively. The point guard position is also kinda thin if monty isn’t willing to play jevon carter. At 36-37, cp3 should be more likely to miss more time.  That’s why unless jalen smith and tyshon alexander really step up their game (first offseason is most important imo), the suns would do well to make a move if they want to do even better. But I think you are right that that probably means smaller moves, not big ones."
"The Suns have/had 3 of my 4 favorite players in the series and I'm still rooting for the Bucks. Mainly because none of them play lol, Dario, Jevon Carter and Langston Galloway and Jrue is a core player. But I just think the Bucks deserve it more (emphasis on) in my mind. This team has been through it"
who the fuck else would it be than jevon carter
Press Virginia figured that out! I'm upset Jevon Carter doesn't get more play in the league. He's awesome
"As good as a player he is, it seems really difficult to manage our guard rotation. He would have had to come off the bench and share minutes with the Cam's and Torrey Craig. Jevon Carter would probably get no minutes either. I think Jones picked Smith knowing our frontcourt depth is pretty shallow"
"as a wvu fan, i wish it was jevon carter instead"
I’m a WVU grad and you have my guy locked up out there. Jevon Carter. That kid plays harder than any human I’ve ever seen. 100% effort at all times. Hoping you pull it out
"The Suns will:  CP3 either, decline his PO and sign him to a 3 year deal, or accept his PO and sign him to a much smaller 2 year extension. That'll be the end for CP3.  Booker is already signed on for 3 years, no sign he wouldn't further extend.  Ayton has 1 more year on his rookie deal, but I would expect him to sign an extension and not enter free agency. Maybe 5 years 35 Mil per year.  Crowder has 2 more years left, on a MLE deal. I would expect a much smaller pay packet to extend him further than that for another 3 years with bird rights, that gets him to 36 years old. So 5 years total.  Saric, has 2 years on his deal... but this is a real unknown, he's now out next season as backup centre. He is also going to be coming back from major injury so I'll hold off on any further contracts. Suns have applied for a disabled player exception for next season, 4.5mil. I would expect to see the Suns sign JaVale McGee to fill that spot. The one thing the Suns lacked was that one extra ""BIG"".  Bridges has 1 more year on his rookie deal, but I would expect him to sign an extension and not enter free agency. Maybe 5 years 20 Mil per year.  Jalen Smith has 3 years left on his rookie deal, I would expect him to hang around for the duration of that as the 3rd string centre. Depending how he develops will decide whether he stays longer.  Cameron Johnson has 2 years left on his rookie deal, but I would expect him to sign an extension and not enter free agency. Maybe 5 year 15 Mil per year.  Jevon Carter has 2 years left on an early bird, currently not getting time as a 3rd string, maybe that'll Change next year.  Now the unknowns, I see the Suns chucking Payne a 3 year 15mil total deal. Other teams will offer more, but the Suns will be reigning Champions... so what will he decide...  Moore, Galloway, Kaminsky, Craig and Nader will probably get some 1 year minimums.  Ty-Shon will get another 2 way deal next year.  I don't know what the Suns will do with their only draft pick. But it'll be pretty tradeable.   The Suns will basically have the same team for 3 years, maybe changing a couple 3rd string guys adding one more centre like JaVale. Then for the next 3 years still have a core of Booker, Ayton, Bridges, Johnson, Crowder, with unknowns being Starting PG, and some backups."
"Run it back, and try to get some cheap guys in FA. Mainly some center insurance with the future of Saric questionable. I would also think they look for an upgrade at backup SG since E’twaun Moore, Jevon Carter, and Galloway aren’t cutting it. Also, get Ayton extended as soon as possible (and maybe under the max?)."
If Pep was the coach he would overthink it and bench cp3 for Jevon Carter
And Jevon Carter is 25-of-47... hooray for garbage time minutes!
"Nader will take Craig's minutes. And the adjustment at center already happened. Both changes considered, expect more small-man rotations. Here's hoping for a Jevon Carter and/or E'Twaun Moore sighting!"
hopefully we see some jevon carter this game
"Misses by player:  * Ayton, 12 (37 FTA) * Booker, 10 (125 FTA) * Paul, 5 (57 FTA) * Torrey Craig, 3 (9 FTA) * Crowder, 3 (23 FTA) * Bridges, 2 (18 FTA) * Jevon Carter, 2 (2 FTA) * Saric, 1 (14 FTA) * Payne, 1 (16 FTA) * Galloway, 1 (1 FTA)"
"Has he? Guys are shooting about 1.5% worse against him than their averages this playoffs which is the same impact had by Clarkson and worse than guys like Pat Connaughton, Huerter, Powell, Dame, Kaminsky, Rivers, Mann, Payne, Beal, THT, George Hill, Lou Williams, Duncan Robinson, and Korkmaz.  He has a -0.6 dbpm. It’s the worst on the Suns besides for Galloway and Jevon Carter. The only guys besides those 3 who don’t have a positive dbpm are Torrey Craig and Abdel Nader. Of the 91 guys who played enough to qualify for the leaderboard, he’s 66th. He’s tied with Bryn Forbes. Some guys in the negative who are still above him include Trae, Mitchell and Shamet. Dame and Mann are at 0. Some guys with positive ones include Monte Morris, Reggie Jackson, Lou Williams, Huerter, Doncic, Batum, Campazzo, Seth Curry, and Schroeder. He also has fewer defensive win shares per 48 than guys like Duncan Robinson, Cam Payne, CP3, Saric, Kuzma, Shake, Korkmaz, Quickley, George Hill, and Drummond."
JEVON CARTER MIKAL BRIDGES UNPATRIOTIC
Jevon Carter and cash considerations.
1. Chris Paul  2. Cameron Payne  3. Jevon Carter
"Wow, had to Google him. [He looked 35 I'm college. ](https://bluegoldnews.com/west-virginia-mountaineers/wvus-jevon-carter-adds-senior-class-award-to-lengthy-honors-list/)"
"Jevon ""Looks like a 40 year old"" Carter."
Still love Jevon Carter from his days in WVU. That Press Virginia team was fun af.
Jevon Carter
"It's nuts how deep the Suns roster is. They have great flexibility across positions and can withstand missing key contributors if needed. They had 9 players play major minutes this off-season so far: Booker, Ayton, Bridges, Crowder, CP3, Payne, Cam Johnson, Craig, and Saric. And even beyond that, they have guys who could act as a solid stopgaps, with Nader returning halfway through the off-season, E'Twaun Moore, Kaminsky, and Jevon Carter (surprised he didn't get more time). The only real role they don't have redundancy is at center, where Saric (and maybe Crowder) could play small ball 5 but it's better if he doesn't do it for too long. Luckily, Ayton's been healthy and great in the playoffs. Payne has filled in for CP3 decently, Booker's scoring could be covered piecemeal (with drawbacks of course), and they have solid defenders across the board, especially at the wing.  I think this is a big difference between the Suns and Hawks roster construction with say, the Jazz or the Bucks. Bucks sacrificed their depth for Holiday and losing Donte (and now, Giannis) hurt them a disproportionate amount. Losing a role player (or even a star) in this injury-filled playoffs impacts a deep team a lot less, and teams with players on great contracts (both the Suns and Hawks have most of their important players on rookie contracts) can take more blows to their roster. For the Jazz, the top 8 played great but Niang and below couldn't be trusted and there wasn't lineup flexibility (no viable small ball 5, much less playmaking once Conley got hurt, worse scoring by quite a bit if Mitchell sits). Even the Clippers, who lost Ibaka before the playoffs started, Kawhi halfway through, and finally Zubac, played hard and stayed competitive up until they lost too many players because they had a really deep roster, too (and Mann stepped up).  Getting solid performers for cheap also helps a lot. The Suns got Torrey Craig for literally just cash and a TPE. Decent end of bench options are all on mins (or close to it): Payne, Nader, Moore, Galloway, Kaminsky, and Craig. Ayton's still on his rookie contract. Crowder at &lt;$10M/yr is a steal.   For the Hawks, Trae, Hunter, Reddish, Collins, Huerter, and Okongwu are all looking great and on rookie contracts, giving them plenty of cap to sign decent vets  like Gallo, Bogdan, Capela, Lou Will, and Solo. (Also, that's 11 solid options most teams would be happy to have in a playoff rotation, hence why they could weather injuries to Trae, Hunter, Reddish, and Bogdanovic so far.)  For both these teams, they have very few wasted roster spots. The Suns' worst player at the moment is probably Jalen Smith, while the Hawks have Bruno Fernando and Brandon Goodwin. (Heck, Mays and Knight are solid.) Still, they take up very little cap. Goes to show how far prudent cap management can go.   TL;DR: James Jones and Travis Schlenk did a great job with these rosters."
Thankfully Jalen Smith and Jevon Carter did lol
1. Cam Payne  2. Jevon Carter  3. LeBron
Bet they don't even know who Jevon Carter is
Those were the bandwagon Warriors/Lakers fans that were hunting for a championship team. Bet they don't know who Jevon Carter is
Jevon Carter for sure.
"Jevon “the Thot” Carter going to the finals. Let’s gooooooo, MOUNTAINEERS"
JEVON CARTER IS GOING TO THE NBA FINALS
Jevon Carter's a thot. he's a freaking nasty hoe. he looks good. i'd love Jevon Carter to bust my pussy open and tell me about the intricacies of the full court press. if a guy shows up with a fucking flat ass and a bald head he can hit my backwalls any fucking time of day dude. if a guy's like 'im the all time wvu steals leader' im like 'take a fucking caterpillar bulldozer to my pussy like its the easton hill intersection dude
YOOOOO JEVON CARTER
JEVON CARTER TIME????
"solomon hill would probably still win finals mvp with trae healthy, jevon carter clamps that dude up like nobody else can"
"At this rate, Jevon Carter and Solomon Hill will be competing for Finals MVP 🤦‍♂️"
"Great thread idea btw  For the jazz I wouldn't mind taking a chance on Cam Reddish, Jarret Culver, Justise Winslow, Denzel Valentine, Isaac Bonga, Chandler Hutchinson, Kris Dunn, Frank Ntilikina, Dante Exum, Kevin Knox, Derrick Jones Jr. Dwight Powell, Austin Rivers, Furkan Korkmaz, Torrey Craig, Jevon Carter, E'twaun Moore, Brandon Clarke if he's fallen out of favor with memphis. Malik Monk and Daniel Gafford were two at the start of the year but it was nice to see them each get their footing this year.   Taking a chance on two of any of these players would make for a nice offseason for me."
"Alotta people will disagree with that but that's what makes them lovable. They have a ton of strong personalities. I feel like most people would call the Suns lovable but they're just so boring to me. And they have way more players that I actually like, Dario, Jevon Carter, Langston Galloway. There's always something intriguing and interesting with the Clippers. And I fall on the side of liking most of their players too"
Time for Jevon Carter 50 point game
"some random role players like craig and nader, but they need the payne man unless jevon carter happens to get good"
It’s Jevon Carter time
Jevon Carter is CP3 minus the athleticism.
jevon carter cp3 protégé
"Absurd take. Caruso is a pesky defender that can hit an open shot and make a play in transition. He is essentially a taller/longer Jevon Carter. There are plenty of Alex Carusos in the league, but not many guards that can create their own offense, hence the differential in pay."
I could have sworn Jevon Carter was at least 30
Isaac Bonga/Chimezie Metu/Jevon Carter. An unstoppable trio.
"I’m not saying Moore has been good, I’m just saying Moore is playing because he is a better playmaker than Carter and can handle the basketball. If you think Moore is bad you should watch Jevon Carter initiate the offense.   I’m actually leaning towards the side of playing Carter because then at least we get defense but honestly neither is a great option unless Carter can start hitting shots."
Carter can barely handle the basketball under pressure and absolutely cannot pass. If his shot is not falling then he gives you nothing on offense and then all you have is defense. With Booker or Paul off the floor you need to replace their playmaking and Jevon Carter can’t provide that. Cam Payne is really important to this team for that exact reason.
"I trust Monty, but not giving Carter any minutes last game I feel was a mistake. We were very clearly playing low energy basketball, and that phrase doesn't exist in Carter's mind. Nothing else was working, why not see if Jevon can at least light a fire under the team's ass."
Moore has been awful both offensively and defensively. At least Galloway is a sniper offensively.   Jevon Carter should get the minutes though. He's got the shot and his defense is way better than Galloway. Plus he raises the energy level of the whole team
"Langstons a 2, when he’s on he doesn’t miss, but his defense is pretty bad. The more puzzling question is why isn’t Jevon Carter getting those minutes instead of Moore."
"If Kawhi doesn’t come back I still like our chances in probably 6 or 7. If he does come back then idk... him and PG have honestly been huge problems for us all year. I still go down with the ship. Suns in 7. If Kawhi doesn’t come back, I suppose the suns still could lose but, I don’t think they will because they have played well after losses all year and really haven’t shown any reason for me to doubt them. We had the best road and above .500 record this year and have consistently mixed it up and found the guys to get it done. Crowder hasn’t been hitting like he has all season. I still think we see Jevon Carter this series. Saric can do more etc. Clips are good too and they won they game on their merit but I just think this team has the mental makeup to rebound from tonight."
Oh there’s Jevon carter
MOORE IS SO ASS. bring in jevon carter.
"Huge loss, Moore is awful and Jevon Carter can't do anything other than spot up 3s on offense. Paul and Booker needs to play +40 minutes"
Jevon Carter hours
"That's when a great front office will shine...for instance, getting Torrey Craig for Cash Considerations was an awesome move for the Suns to gain depth. The Suns stacked up on their positions to ensure if anybody goes down,they have quality players at EVERY position:  Point guard CP3 Backups - Cam Payne, Etwan Moore, Tyshon Alexander  SG - Devin Booker Backups - Langston Galloway, Jevon Carter, Abdel Nader,   SF - Mikal Bridges Backups - Cameron Johnson  PF - Jae Crowder Backups - Torrey Craig, Jalen Smith  C - DeAndre Ayton Backups - Dario Saric, Frank Kaminsky  You could literally have the first five out of the game and a lineup of Cam Payne, Etwan Moore, Cam Johnson, Torrey Craig and Dario Saric can win you games if needed...and that's all because the front office put this team together with a salary cap in mind. That's what I'm talking about regarding preparing your team to win if injuries do happen to your starters."
Not all nba caliber  Not a superstar  Not even a star  Is he even good at basketball? Did you see Jevon Carter put the clamps on him in Summer League? Bust. Rather build a team around Derrick White or Ben Simmons.  I only read /r/NBA tho.
If it’s suns hawks finals I don’t know how I’m gonna watch it. They’ve both been my favorite teams since adding Jevon Carter and Trae Young. Got to see those players go head to head live back when they were both in college. Been watching them since
Dude if Jevon Carter gets a chip imma lose my mind
"Yes anything is possible, like Jevon Carter getting a 70 point game"
Suns should play Jevon Carter with Chris Paul out and just stick him on Reggie Jackson or whoever
"I like Moore and he absolutely has a role on this team, but I'd like to see Jevon Carter get a shot out there."
Lets see Jevon Carter
"We still have E'twaun Moore, Jevon Carter, and Langston Galloway who are all decent players. Our offense will drop off some with Booker off the floor, but it won't die."
"I’m just gonna point out Jevon Carter and the Phoenix suns. Their team is very deep and dynamic, could see 8-12 different combinations for different circumstances and their court stays under control with a few minutes of bench leadership."
forgetting my boy jevon carter
"Can any Suns fans tell me why Jevon Carter doesn't get much playing time?  Just curious as a WVU fan.  I know he is under sized but I always loved his intensity and his shooting was getting pretty decent.  Sorry if it's a dumb question, maybe he obviously can't hang out there I just haven't watched him since college"
"He’s played far above expectations. Sometimes he gets tunnel vision and plays sloppy, but I trust him. Jevon Carter off the bench is the most worrisome. His defense and spot up shooting is good, he’s just not a great playmaker."
Jevon Carter
"I mean sure, they allowed Tatum to drop fifty in their sole loss in that series.   The highest total they allowed the Bucks to score was 115, and that was the overtime game seven. Bucks led the league in pts/g last season.   They clearly were able to turn up their intensity on that end in the postseason, and now they’ve added a few defensive minded players in the off-season (Deandre Bembry, James Johnson, Jevon Carter). I’d like to see them add another big but ultimately I don’t think it’s going to be a big concern for them."
"We really don’t know if Davion Mitchell is good at all yet, he hasn’t played an NBA game.  He’s an awesome defender, but so is Jevon Carter"
Just thinking about it already triggered me a lol lol Them guys as well as Bruce Brown and Jevon Carter will be the most infuriating defensive duos in the league.
"Harden, Kyrie, Harris, KD, Blake   Beverley, Mills, Brown, J Johnson, Claxton   Carter, Thomas, TLC/Bembry, A Johnson, Jordan/Sharpe  They could literally just have one of Pat Bev or Jevon Carter out there constantly hounding the lead guard for the opposition. That sounds horrible."
"Jevon Carter. I’m telling y’all when he can get to a team where he can really flourish off the bench, later on he can finally become a starter somewhere. He’s with the nets right now and just left the suns, his defense is insane he can be a Kawhi or Jrue Holiday type defender. He’s also a better shooter than most think. That’s just me"
"Right next to Jevon carter, McBride is one of my favorite guys to play for West Virginia, Thibs better give this kid serious minutes. Can’t wait to be in MSG this year rocking my McBride Knicks jersey… this kid is a DAWG. A pure Bobby Huggins press Virginia product."
Jevon Carter is very good.
"Every GM has moves like this, lol. Grizzlies turned Jevon Carter in to Melton and a second."
Bruce Brown? Jevon Carter? Jacque Vaughn? Ime Udoka last season?
the Suns even got Jevon Carter who we just traded there lol
"I don't know if I'd count Blake as a good 3 point shooter. He's fine. Carter as in Jevon Carter? I don't know if he can be considered a ""shooter"" either. If the opposing team wants you to shoot it, you probably can't be considered a threat to shoot"
"Yeah, I assume he’ll have around the same workload Jevon Carter/E’twaun had."
All we did is basically just swap jevon Carter and Saric for Shamet and McGee
