"James Wiseman definitely. His biggest problem was on the defensive side, as raw as he was he still got buckets on the back of his physical gifts and he also shows the potential to have a real jump shot.   Jordan Poole, the Warriors 2019 28th pick, took a massive leap from his terrible rookie season. In his rookie season injuries forced him into heavy playing time he wasn't ready for and he put up some of the worst numbers in the league for any player getting regular minutes.   His shooting splits his rookie year were 33/28/80, contributing 8.8 points a game. He reportedly is one of the hardest workers on the roster and the next season, especially in the back half, he was a really effective NBA player and a much needed offensive outlet next to Curry.  That 2nd year his splits improved dramatically, 43/35/88, scoring went up to 12ppg while playing (slightly) less minutes. He had some great games and some great highlights. In the 2nd to last game of the season the Warriors sat Curry, Draymond and Wiggins. [Poole dropped 38 on the Pelicans.](https://youtu.be/xAGf5WjekW8)  Then this season they drafted probably the most athletic young player in the 2021 draft, Jonathan Kuminga. He doesn't have a jump shot (though the form looks OK), he's pretty raw but he has tremendous upside. He also has shown a little bit of an ability to pass, which for a guy like him who will likely be drawing help defenders, is an important ability.   [This was the Summer League highlight that probably shows off his potential the best.](https://youtu.be/mYdEFa95r2I) Crosses up his defender, takes off from right inside the free throw line, launches, hangs, and throws down a monster jam.   Finally there is Moses Moody, who the Warriors selected with the 14th pick. A young player with good length, Moody projects to be a good to elite shooter in the league, has the length to defend multiple positions, and most importantly for the Dubs right now has a natural feel for the game. He's only got average athleticism but he's no Duncan Robinson. Last season showed the Warriors how important it is to have guys who are feared outside the 3pt line, that early season lineup was barely middle of the pack **offensively** when Curry was on the floor (which is crazy) and historically bad when Curry was off the floor.  Poole, Wiseman, Kuminga, and Moody can become great players. I think the Warriors *nailed* the 2021 draft. A great high ceiling player and a more win now player who still has a good ceiling. They brought on some of the best player development coaches in the world this off season, including Kenny Atkins, Jama Mahlalela  and DeJan Milojević.   These young players are all on long rookie deals and those kinds of high upside cost controlled contracts are so important for a team like the Warriors who already have a veteran core making big money.   People are severely underestimating what the Warriors can accomplish over the next several season."
Basically Jonathan Kuminga
"&gt;If Andrew Wiggins went back as the best current player and the money to make the deal work, the reward for Philly would, or could, be some combination of 2020 No. 2 overall pick James Wiseman, and 2021 lottery picks Jonathan Kuminga and Moses Moody.  lmao?!"
I made a case a little while ago how Jonathan Kuminga would be a good basketball player but shows nothing of Kawhi Leonard and that the comparisons by GSW beat writers were lazy.   And I learned that day that the GSW sub has the most subscribers of any on Reddit.
Jonathan Kuminga.
"The wolves were always going to have to pay to get rid of Wiggins, the end of that contract is atrocious. Most people thought they'd have to pay way more than Jonathan Kuminga to get Wiggins off the team and make room financially for players that play up to their contracts. Wiggins is solid, if he was getting $20 mil a year any team would want him. He's not worth $33 mil a year."
Jonathan Kuminga
if I had to build an entire team and I had no other pieces I would only just go for players with development. I'd just take a swing on anyone who could become a super star and figure out the rest and just let them play. There's no reason to draft for fit at this stage just figure out what you have  So I would take  G Cade  G Jalen Green  G/F Josh Giddey  F Jonathan Kuminga  C Evan Mobley   Bench   G - Jalen Suggs  G Bones Hyland  G - Josh Primo  F - Scottie Barnes  F Jalen Johnson  F Ziaire Williams   C Alperen Sengun
"Jonathan Kuminga will be about as good as Stanley Johnson has been.   The Boston Celtics form the next dynasty as they acquire a disgruntled KAT or Lillard. Tatum is on a superstar trajectory and Brown is right there with him. Both guys will be so insanely good and are playing the statistically rarest and most valuable positions in the league.   Sure they might have a few more disappointments in the playoffs, but like Lowry, or more aptly- Giannis players tend to shake that off and just have a godly postseason or two."
Jonathan kuminga = the kum bucket
Jonathan Kuminga: The cum bucket
The Kum Bucket (Jonathan Kuminga)
Jonathan Kumbuckets Kuminga
"It def shouldn’t be used in a convo lol. It’s a nickname that’s fun to explain because the story behind it being what Chinese nba fans called him is funny, but let’s be real it’s a shit nickname, any nickname you can’t say on network television isn’t a good one (Just like a certain Jonathan Kuminga nickname I won’t mention).  The day Richard Jefferson decides to try and say skylover on a broadcast will be the day I finally mute tv broadcasts forever"
Let's all agree to act like Jonathan kuminga doesn't exist
"&gt; bench = supporting cast  No, bench specifically refers to…the bench.   &gt; And what exactly did the Warriors do this offseason? Get back 38yo Iggy? Sign Otto Porter while losing Oubre?  Drafted Jonathan Kuminga and Moses Moody. Signed Otto Porter Jr, Nemanja Bjelica, and Andre Iguodala.   &gt;  No one seriously thinks Warriors got better if we don't factor in Klay yet.  They improved significantly. You can’t seriously think Oubre, Bazemore, Paschall, and Wanamaker contribute more to winning than OPJ, Moody, Kuminga, Bjelica, and Iguodala…"
"Underrated Take: Golden State drafts James Wiseman and Jonathan Kuminga on back-to-back years.  I think it would come as a surprise to many that Golden State would get a top 2 high school recruit then a top 3~4 high school recruit in back-to-back drafts because that would mean that they’d have to be really, really bad despite having Steph and Dray. Even Klay was expected to come back last season."
"have you heard of jonathan ""kum bucket"" kuminga?"
"Jonathan Kuminga - ""Kum Buckets"""
Jonathan Kuminga better be Kevin Garnett 2.0
Jonathan Kuminga
He’s a wolves fan ofc he hates us his FO gave us Jonathan Kuminga
"Collin Sexton, Rudy Gay, Kevin Love, Denzel Valentine, Jonathan Kuminga because lol"
"Didn't pay much attention to prospects until the 2017 draft.  2017 top 5 prospects 1. Markelle Fultz 2. De'Aaron Fox 3. Josh Jackson 4: Jonathan Isaac 5. Jayson Tatum  Didn't think Bam Adebayo, Lonzo Ball (thought he'd be a bust because of his jumpshot and they hype) or Jarrett Allen would be as good as they have become  2018 top 5 prospects 1. Luka Doncic (thought he'd be a superstar but not to the level that he is) 2. Marvin Bagley III 3. Deandre Ayton 4. Mo Bamba 5. Michael Porter Jr  I thought Trae Young would be Isaiah Thomas 2.0 with his defense being the reason he can't lead a team against strong competition and didn't think much of Shai Gilgeous-Alexander.    2019 top 5 prospects 1. Zion Williamson 2. Ja Morant 3. RJ Barrett (pre college season, I had him number 1) 4.  Coby White 5. Cam Reddish  Hunter, Thybulle, and Clarke have really impressed me and I think Herro is great but don't know how much better he will get  2020 top 5 prospects (was not that high on these prospects compared to other years) 1. Anthony Edwards 2. LaMelo Ball (thought he was the most NBA ready and also most likely to bust 3. James Wiseman 4. Cole Anthony 5. Onyeka Okongwu   I think that Tyrese Halliburton can be a great player and Patrick Williams can be a third option on a championship team but this class hasn't had a chance to reach the heights of rookies from other classes yet  2021 top 5 prospects 1. Cade Cunningham (think he's the best player drafted since Luka) 2. Jalen Green (watched a few of his games to watch Kuminga and Green always outplayed him although he was ball dominant) 3. Jonathan Kuminga (second highest ceiling in the draft) 4. Evan Mobley (most likely to bust but the best big since the 2018 draft excluding Zion who is a wing / big hybrid) 5. Ziaire Williams (I think he has the physical tools to be a player that comes close to the all star game but doesn't make it)   Scottie Barnes and Davion Mitchell have gone on my radar"
G league ignite it's the development team owned by the NBA. Jalen Green and Jonathan Kuminga.
My short list of most impressive awesome physiques-physicality... Literally just seeing a guy moving without a ball just impressive statures nothing about play on court.  Centers Dwight Robinson Wilt  Wings Giannis Lebron Jordan  Guards Russ Rose  Honorable mention Maggete Zion  The How is that guy 18? list Ben Simmons Jonathan Kuminga Young LeBron
I seriously doubt it  You think there is a Chinese Jonathan Kuminga just hiding in a Chinese village somewhere?  I don’t
"You guys are really managing to have both the present and the future covered with the young players you've got...   Jordan Poole, Moses Moody, Jonathan Kuminga, Jonathan Wiseman"
G League might be good if you’re a Jalen Green or Jonathan Kuminga but ultimately it proved to be not beneficial for prospects like Isaiah Todd or Brandon Boston  I think as time develops there’s gonna be more prospects going to different places to showcase themselves more individually
Jonathan Kuminga is gonna dominate off the bench (when Steph sits) early in the season. During his second unit minutes he is gonna take a lot of teams by surprise. His size and athleticism is gonna overwhelm a lot of second units who won't be prepared for him.
Jonathan Kuminga will be a star.
The Kum Bucket - Jonathan Kuminga
"Because I know I’m right and I’ll just keep receipts with this thread on how he should be getting more minutes whether it come at the 4 or 5.    &gt;Golden State Warriors forward Draymond Green believes forward Jonathan Kuminga can develop into an elite defender in the NBA and recently explained why the rookie could reach that level. ... Green has been impressed by the early showing from Kuminga. I think he has been incredible.Nov 16, 2021   &gt;He's blocked my shot a bunch of times from the perimeter"" - Stephen Curry talks about how Jonathan Kuminga is being groomed as a defensive force by the Golden State Warriors"
"&gt;Golden State Warriors forward Draymond Green believes forward Jonathan Kuminga can develop into an elite defender in the NBA and recently explained why the rookie could reach that level. ... Green has been impressed by the early showing from Kuminga. I think he has been incredible.Nov 16, 2021   &gt;He's blocked my shot a bunch of times from the perimeter"" - Stephen Curry talks about how Jonathan Kuminga is being groomed as a defensive force by the Golden State Warriors"
"[Kris Weems](https://youtu.be/yJRKbkqHwCg?t=1157):   &gt;Yeah, I think when you're gonna draft a kid that size, -- and knowing that long term he's going to be bigger and stronger [and] he may grow a couple inches taller -- his versatility, because of the size gives him a chance to stay on the floor longer. So, we did talk about him playing a little bit of [the] 5. We still want him to play on the wing -- play the 3 and the 4 -- for the most part. Work on his ball handling [and] his passing. But you can be effective as a 5. Draymond Green is a Hall of Famer because he does a lot of the things that Jonathan does. So we'll be very specific about those times and what we can run [and] the packages and plays we want to put in there. But the versatility on defense is really what sets him apart  So:  1. Because they're trying to win games so Kuminga isn't going to see a ton of playing time  2. Because they want to develop him as a forward first."
"MKG was pretty mobile at first. He was considered a plus athlete as a prospect. Yes, Kuminga is more athletic than him. But that doesn't make it an awful take for a floor. Kuminga doesn't have an outside shot yet. MKG never got one.  Butler is a great defender, attacks the basket with physicality, and can playmake. I see a little of that passing from Kuminga. Despite an inconsistent outside shot, Butler is a star who can lead a team very far.  Kawhi is too good of a shooter for me to make that comparison. I mean, Jonathan is yet to approach his sophomore college shooting splits of 44/29/76."
How good would this Wolves team look with Jonathan Kuminga as the power forward? Obviously right now McDaniels is a better player in the 3-D mold but going forward it seems as though a playmaking PF that can potentially be a lockdown defender is exactly what they are missing. What Kuminga can be as a secondary playmaker to DLO would open up their offense and still maintain a high level of defense. Obviously you would go through another year of growing pains but that could potentially land another lottery pick to add to the war chest.
jonathan “kum bucket” kuminga would like a word
Jonathan Kuminga?
We'll trade them Ed Davis for Jonathan Kuminga.
Jonathan Kuminga
"If you don't move a guy demanding a trade, even if you don't like the return, you will simply lose them for nothing in free agency if they are an UFA.  When KD left the Warriors he was going to walk for nothing as an unrestricted free agent, same as he did in OKC.  He just happened to be going to a team with a young star guard looking to land a max contract, one his biggest suitors, the Wolves, didn't have the cap space to offer that ([remember the Wolves gave D'lo a helicopter ride where it was revealed he had signed w/the Warriors?\)] (https://www.sfgate.com/warriors/article/D-Angelo-Russell-helicopter-ride-Wolves-los-angele-14899527.php)  So the Warriors were able to offer D'lo that max he wanted, facilitated through a KD sign and trade, as the Warriors didn't have the cap space either. The Nets wanted to do right by D'lo and help him get that max and were open to the sign and trade transaction.   KD actually balked and said he wouldn't agree unless a Warriors 1st was included ([Nets hadn't even asked for that and allowed very good protections, top 20, it converted to a 2nd](https://www.nbcsports.com/bayarea/warriors/nba-rumors-kevin-durant-demanded-warriors-give-nets-first-round-pick)).   I won't write an entire article myself here but ultimately we all know what the final result was. Warriors sent out KD, Iguodala, a lightly protected 2024 1st round pick. They then flip D'lo and ultimately end up with Andrew Wiggins, a pick they used to select Jonathan Kuminga, and they were able to get off of Wanamaker, Spellman and Evans to get out of the tax, delaying their repeater penalty by one year.   There was a lot of luck involved in this, if KD picks the Knicks instead of the Nets the Warriors wouldn't have landed any of that, or if the Wolves weren't feeling pressure to keep KAT happy and bring in one of his best friends to play with him while moving off of Wiggins, the Warriors would be left with a big hole at SF and not have a prospect like Kuminga.    It is way, way better to execute a trade when a star is leaving rather than see them walk for zero return."
"  # Top Highlights:  0. [[Highlight] Curry lets it go from the logo over Larmcus Aldridge](https://streamable.com/dgk3xa) | [(Comments)](/r/nba/comments/qvowe5/highlight_curry_lets_it_go_from_the_logo_over/)  0. [[Highlight] Curry getting MVP chants in Brooklyn](https://streamable.com/hc7nl0) | [(Comments)](/r/nba/comments/qvp38n/highlight_curry_getting_mvp_chants_in_brooklyn/)  0. [[Highlight] Andre Igoudala beats the 3rd quarter with a 3.](https://streamable.com/19n0lr) | [(Comments)](/r/nba/comments/qvoppi/highlight_andre_igoudala_beats_the_3rd_quarter/)  0. [[Highlight] Jonathan Kuminga Denies James Harden at the Rim](https://streamable.com/syj30i) | [(Comments)](/r/nba/comments/qvnc0r/highlight_jonathan_kuminga_denies_james_harden_at/)  0. [[Highlight] Draymond's pass is deflected straight to Curry who hits the 3](https://streamable.com/yvxcqq) | [(Comments)](/r/nba/comments/qvmqkv/highlight_draymonds_pass_is_deflected_straight_to/)  # Day in the history:  ### Saturday, November 17, 2018  Kemba Walker of the Charlotte Hornets scored 60 points in a 122-119 loss to the Philadelphia 76ers.  ### Tuesday, November 17, 2015  Hassan Whiteside of the Miami Heat blocked 10 shots in a 103-91 loss to the Minnesota Timberwolves.  ### Saturday, November 17, 2012  Rajon Rondo of the Boston Celtics dished out 20 assists in a 107-89 win over the Toronto Raptors.  Daily Discussion Thread : [Rules](https://www.reddit.com/r/nba/wiki/rules#wiki_daily_discussion_thread)"
"Jonathan ""Evan Mobley"" Kuminga"
Jonathan Kuminga passes the eye test. Looks like a blend of Giannis and Kawhi. He is going to be so good once Kerr figures out how to use him.
well since he went 1-3 from the line it obviously saved two points. We all know Jonathan Kuminga has never missed from beyond half-court in his entire NBA career
why the fuck are you fouling Jonathan Kuminga at HALF COURT
The Jonathan Kuminga game
1. Ja Morant 2. Zion Williamson 3. Evan Mobley 4. Lamelo Ball 5. Anthony Edwards 6. Scottie Barnes 7. Cade Cunningham 8. RJ Barrett 9. Jalen Green 10. Darius Garland 11. Tyler Herro 12. DeAndre Hunter 13. Jalen Suggs 14. Tyrese Maxey 15. Josh Giddey 16. James Wiseman 17. Patrick Williams 18. Cole Anthony 19. Franz Wagner 20. Jordan Poole 21. Jonathan Kuminga 22. Cam Reddish 23. Alperen Sengun 24. Matisse Thybulle 25. Tyrese Haliburton 26. Rui Hachimura 27. Chris Duarte 28. Deni Avdija 29. Immanuel Quickley 30. Davion Mitchell  Kevin Porter Jr. has to be one of the most overrated assets in the entire league.
"You are looking at skill-based bigs as opposed to freak athletes. Giannis and Jonathan Kuminga are much better comps IMO.  Freak athletes succeed by charging headfirst into defenders during HS (where Wiseman has mostly played), so the transition to organized NBA basketball is inevitably rough for them."
Im convinced people aren't watching Jalen Green right now. Maybe he gets better in the future but he stinks right now. He and Jonathan Kuminga are the same level of project player to me. If he's not scoring he does literally nothing else.
1. Evan Mobley  2. Scottie Barnes  3. Jalen Green  4. Josh Giddey  5. Franz Wagner  6. Chris Duarte  7. Jonathan Kuminga  8. Davion Mitchell  9. Cade Cunningham  10. Alperen Sengun  11. Cam Thomas  12. Jeremiah Robinson Earl  13. Jared Butler  14. Sharife Cooper
Jonathan Kuminga better be Kevin Garnett 2.0
"&gt;Ok saying they were surprised Kuminga was available at 7 does not indicate he was above Giddey on their board.   I just explained to you. They said they had to take Kuminga if he fell to 7.  [""To me, \[Kuminga\] was one of — certainly the top five prospects in the draft — but, for me, probably higher. When it looked like he could drop, I couldn’t believe it and neither could Bob (Myers)...We were hoping maybe one or two would surprise and we could maybe get Moody. More than one or two surprised""](https://np.reddit.com/r/warriors/comments/ov7j4m/joe_lacob_via_slater_its_very_unlikely_ive_said/?utm_source=share&amp;utm_medium=web2x&amp;context=3)   [""I shouldn’t say where they were on our board, but it’s hard for me not to say it. I’ll just tell you they were both clearly in our top 10. We feel like we got really fortunate on Kuminga. Then with Moody, I think it’s pretty common knowledge we were seriously considering him at seven. So it’s pretty astonishing to me that we could get him at 14.""](https://bleacherreport.com/articles/10009238-warriors-joe-lacob-ecstatic-about-jonathan-kuminga-moses-moody-nba-draft-picks)  After the draft. Is this enough proof for you? They wanted Moody at 7 and Kuminga was a pipedream at 7, and Moody AND Kuminga was impossible. Then we got both."
