1	Pistons	Cade Cunningham	G	Oklahoma State  2	Wizards	Evan Mobley	B	USC  3	T Wolves	Jalen Suggs	G	Gonzaga  4	Thunder (via Heat)	Jonathan Kuminga	W	G League Ignite  5	Magic	Jalen Green	G	G League Ignite  6	Bulls	Moses Moody	W	Arkansas  7	Pelicans	James Boughknight	G	Uconn  8	Knicks (via Mavs)	Ziaire Williams	W	Stanford  9	Raptors	Jalen Johnson	W	Duke  10	Kings	Scottie Barnes	W	Florida State  11	Knicks	Jaden Springer	G	Tennesee  12	Thunder	Corey Kispert	W	Gonzaga  13	Rockets	Keon Johnson	G	Tennesee  14	Spurs	Usman Garuba	B	Real Madrid  15	Cavs	Greg Brown	B	Texas  16	Hornets	Day'ron Sharpe	B	North Carolina  17	Hawks	Cameron Thomas	G	LSU  18	Pacers	Franz Wagner	W	Michigan  19	Warriors	Josh Christopher	G	Arizona State  20	Celtics	Sharife Cooper	G	Auburn  21	Rockets (via Blazers)	Kai Jones	B	Texas  22	Suns	Daishen Nix	G	G League Ignite  23	Grizzlies	Marcus Bagley	W	Arizona State  24	Bucks	David Johnson	G	Louisville  25	Nets	Josh Giddey	G	Adelaide 36ers  26	Nuggets	BJ Boston	G	Kentucky  27	Lakers	Rokas Jokubaitis	G	Zalgiris Kaunus  28	76ers	Jared Butler	G	Baylor  29	Jazz	Tre Mann	G	Florida  30	Clippers	Alperen Segun	B	Besiktas  31	Pelicans (via Wizards)	Ariel Hukporti	B	Nevezis Kedainai  32	Knicks (via Pistons)	Chris Duarte	G	Oregon  33	Thunder (via T Wolves)	Roko Prkacin	W	Cibonia  34	Hawks (via Heat)	Trayce-Jackson Davis	W	Indiana  35	Magic	Josh Primo	G	Alabama  36	Pelicans	Ayo Dosumnu	G	Illinois  37	Bulls	Ibou Dianko Badji	B	FC Barcelona II  38	Pistons (via Raptors)	Neemias Queita	B	Utah State  39	Mavericks	Ron Harper Jr	W	Rutgers  40	Kings	Terrance Shannon Jr	G	Texas AM
"Mock Draft [Week #8](https://np.reddit.com/r/nba/comments/l4ndsx/mock_draft_monday_game_thread_index/) - Lottery simmed on tankathon based on current record (I obviously don't expect these teams to all be lottery teams, the exercise is to track the changes week by week as records change)  1) Minnesota (+2) - Cade Cunningham - PG - OKSt  2) Orlando (+3) - Jalen Green - SG - G-League  3) Detroit (-2) - Jalen Suggs - G - Gonzaga  4) OKC (from MIA) - Jonathan Kuminga - F - G-League  5) Washington (-3) - Evan Mobley - C - USC  6) Chicago - Jalen Johnson - F - Duke  7) New Orleans - Moses Moody - SG - Arkansas  8) New York (from DAL) - Scottie Barnes - F - FSU  9) Toronto - Jaden Springer - G - Tennessee  10) Sacramento - Ziaire Williams - F - Stanford  11) New York - Sharife Cooper - PG - Auburn  12) Oklahoma City - Keon Johnson - SG - Tennessee  13) Houston - James Bouknight - SG - UConn  14) San Antonio - Day'Ron Sharpe - C - UNC  15) Cleveland - Corey Kispert - F - Gonzaga  16) Charlotte - BJ Boston - G/F - Kentucky  17) Atlanta - Josh Christopher - SG - ASU  18) Indiana - Roko Prkacin - PF - Croatia  19) Golden State - Jared Butler - G - Baylor  20) Boston - Alperen Sengun - C - Turkey  21) Houston (from POR) - Franz Wagner - SF - Michigan  22) Phoenix - Greg Brown - F - Texas  23) Memphis - Cam Thomas - SG - LSU  24) Milwaukee - Daishen Nix - PG - G-League  25) Brooklyn - Ron Harper Jr - SF - Rutgers  26) Denver - Usman Garuba - PF/C - Spain  27) LA Lakers - Ayo Dosunmu - PG - Illinois  28) Philadelphia - Keyontae Johnson - SF - Florida  29) Utah - Chris Duarte - SG - Oregon  30) LA Clippers - Josh Giddey - PG - Australia"
"If they land the Wolves pick outside the Top 3 in 2021, this team is gonna be stacked again.  Steph - Klay - Wiggins - Oubre - Draymond - Wiseman - Paschall - Looney - Wanamaker - Bazemore  And one of Jonathan Kuminga, Jalen Suggs. Jalen Green, Scottie Barnes or Zaire Williams."
Yeah four would be devastating in this deep draft. Right now it looks like the #4 and #5 players are Jalen Green and Jonathan Kuminga who are so promising that the G League made a team just for them.
"Mock Draft [Week #6](https://np.reddit.com/r/nba/comments/kv25ke/mock_draft_monday_game_thread_index/giw10wn/) - Lottery simmed on tankathon based on current record (I obviously don't expect these teams to all be lottery teams, the exercise is to track the changes week by week as records change)  1) Sacramento (+4) - Cade Cunningham - PG - OK St  2) OKC (via MIA) (+4) - Jalen Suggs - PG - Gonzaga  3) Toronto (+1) - Evan Mobley - C - USC  4) Washington (-1) - Jonathan Kuminga - SF - G-League  5) Detroit (-4) - Jalen Green - SG - G-League  6) Golden State (via MIN) (-4) - Jalen Johnson - F - Duke  7) OKC (via HOU) - Scottie Barnes - F - FSU  8) Chicago - Jaden Springer - G - Tennessee  9) Atlanta - Keon Johnson - SG - Tennessee  10) New Orleans - Moses Moody - SG - Arkansas  11) New York - Daishen Nix - PG - G-League  12) Denver - Ziaire Williams - SF - Stanford  13) Houston (from OKC) - James Bouknight - SG - UConn  14) Memphis - Corey Kispert - SF - Gonzaga  15) Charlotte - Day'Ron Sharpe - C - USC  16) Orlando - BJ Boston - G/F - Kentucky  17) Cleveland - Josh Giddey - PG - Australia  18) Golden State - Josh Christopher - SG - ASU  19) New York (from DAL) - Ron Harper Jr - SF - Rutgers  20) San Antonio - Greg Brown - PF - Texas  21) Brooklyn - Usman Garuba - PF/C - Spain  22) Indiana - Roko Prkacin - PF - Croatia  23) Houston (from POR) - Terrence Shannon - SG - Texas Tech  24) Phoenix - Ayo Dosunmu - G - Illinois  25) Philadelphia - Marcus Bagley - F - ASU  26) Boston - Kai Jones - PF/C - Texas  27) Milwaukee - Jared Butler - G - Baylor  28) Utah - David Duke - PG - Providence  29) LA Clippers - David Johnson - PG - Louisville  30) LA Lakers - Alperen Sengun - C - Turkey"
I'm going to use [CBSSports](https://www.cbssports.com/nba/news/nba-power-rankings-lakers-reclaim-top-spot-warriors-mavericks-make-huge-jump-76ers-drop-amid-covid-fallout/) powerrankings for my mock draft.  1. Wizards - Cade Cunningham  2. Kings - Evan Mobley  3. Hawks - Jalen Suggs  4. Warriors (via T Wolves) - Jalen Green  5. Grizzlies - Jonathan Kuminga  6. Pistons - Keon Johnson  7. Raptors - Jalen Johnson  8. Bulls - Ziaire Williams  9. Rockets - Scottie Barnes  10. Cavs - Usman Garuba  11. Pelicans - James Boughknight  12. Magic - Moses Moody  13. Hornets - Day'ron Sharpe  14. Knicks - Corey Kispert
"Mock Draft [Week #5](https://np.reddit.com/r/nba/comments/kq8am3/mock_draft_monday_game_thread_index/gi35hyo/) - Lottery simmed on tankathon based on current record (I obviously don't expect these teams to all be lottery teams, the exercise is to track the changes week by week as records change)  1) Detroit (+1) - Cade Cunningham - PG - OK St  2) Memphis (+3) - Evan Mobley - C - USC  3) Toronto - Jalen Suggs - PG - Gonzaga  4) Golden State (from MIN) - Jonathan Kuminga - F - G-League  5) Washington (-4) - Jalen Green - SG - G-League  6) Chicago - Jalen Johnson - F - Duke  7) OKC (from Houston) - Scottie Barnes - F - FSU  8) Sacramento - Ziaire Williams - F - Stanford  9) Atlanta - Moses Moody - SG - Arkansas  10) New Orleans - Keon Johnson - SG - Tennessee  11) Brooklyn - James Bouknight - SG - UConn  12) San Antonio - Day'Ron Sharpe - C - UNC  13) Denver - Corey Kispert - F - Gonzaga  14) Charlotte - BJ Boston - G/F - Kentucky  15) New York - Daishen Nix - PG - G-League  16) Cleveland - Jaden Springer - PG/SG - Tennessee  17) OKC (from Miami) - Josh Giddey - PG - Australia  18) Portland - Greg Brown - PF - Texas  19) Houston (from OKC) - Josh Christopher - SG - ASU  20) New York (from Dallas) - Ron Harper Jr - SF - Rutgers  21) Orlando - Terrence Shannon Jr - SG - Texas Tech  22) Milwaukee - Roko Prkacin - PF - Croatia  23) OKC (from Golden State) -  Usman Garuba - PF/C - Spain  24) Utah - Ayo Dosunmu - PG - Illinois  25) Clippers - Jared Butler - PG - Baylor  26) Indiana - Marcus Bagley - PF - ASU  27) Philadelphia - Alperen Sengun - C - Turkey  28) Phoenix - Scottie Lewis - G/F - Florida  29) Boston - Kai Jones - PF/C - Texas  30) Lakers - David Duke - SG - Providence"
"Mock Draft [Week #4](https://np.reddit.com/r/nba/comments/klq3s6/mock_draft_monday_game_thread_index/ghadynb/) - Lottery simmed on tankathon based on current record (I obviously don't expect these teams to all be lottery teams, the exercise is to track the changes week by week as records change)  1) Minnesota - Cade Cunningham - PG - OK St  2) Washington (+1) - Evan Mobley - C - USC  3) Toronto (-1) - Jalen Suggs - PG - Gonzaga  4) Charlotte (+2) - Jalen Green - SG - G-League  5) Detroit (-4) - Jonathan Kuminga - SF - G-League  6) San Antonio (-1) - Jalen Johnson - F - Duke  7) Memphis - Scottie Barnes - F - FSU  8) New York (from DAL) - Jaden Springer - G - Tennessee  9) Denver - Ziaire Williams - F - Stanford  10) OKC (from MIA) - Keon Johnson - SG - Tennessee  11) OKC - Daishen Nix - PG - G-League  12) Brooklyn - James Bouknight - G - UConn  13) Chicago - BJ Boston - G/F - Kentucky  14) Sacramento - Corey Kispert - SF - Gonzaga  15) Portland - Greg Brown - PF - Texas  16) New York - Moses Moody - SG - Arkansas  17) Golden State - Roko Prcakin - PF - Croatia  18) Milwaukee - Tre Mann - PG - Florida  19) Houston - Ron Harper Jr - SF - Rutgers  20) Boston - Usman Garuba - PF/C - Spain  21) Orlando - Josh Christopher - SG - Az St  22) Atlanta - Ayo Dosunmu - G - Illinois  23) Indiana - Terrence Clarke - PG/F - Kentucky  24) Cleveland - Day'Ron Sharpe - C - UNC  25) New Orleans - Keyontae Johnson - SF - Florida  26) Utah - Josh Giddey - PG - Australia  27) Phoenix - Marcus Bagley - PF - Az St  28) LA Clippers - Jared Butler - PG - Baylor  29) LA Lakers - Alperen Sengun - C - Turkey  30) Philadelphia - Kessler Edwards - G/F - Pepperdine"
"Warriors getting 1 of the following then:  Jalen Green, Jonathan Kuminga, Jalen Suggs, Zaire Williams.   Unless the basketball Gods save the league from a Steph-Klay-Wiggins-Draymond-Wiseman with Green off the bench.  And let the T'Wolves select Cade or Mobley."
"Mock Draft [Week #11](https://old.reddit.com/r/nba/comments/lkd6w1/mock_draft_monday_game_thread_index/gnj72zr/) - Lottery simmed on tankathon based on current record (I obviously don't expect these teams to all be lottery teams, the exercise is to track the changes week by week as records change)  1) Washington (+3) - Cade Cunningham - PG - OKSt  2) Houston (+3) - Jalen Green - SG - G-League  3) Minnesota (-2) - Jonathan Kuminga - SF - G-League  4) Oklahoma City (+3) - Evan Mobley - C - USC  5) Detroit (-3) - Jalen Suggs - G - Gonzaga  6) Cleveland (-3) - Scottie Barnes - PF/PG - FSU  7) Sacramento - Jalen Johnson - F - Duke  8) Orlando - Moses Moody - G/F - Arkansas  9) Atlanta - Corey Kispert - SF - Gonzaga  10) New Orleans - Jaden Springer - G - Tennessee  11) Oklahoma City - Ziaire Williams - SF - Stanford  12) Chicago - Sharife Cooper - PG - Auburn  13) New York (from DAL) - Franz Wagner - SF - Michigan  14) Memphis - James Bouknight - SG - UConn  15) Charlotte - Keon Johnson - SG - Tennessee  16) New York - Daishen Nix - PG - G-League  17) Boston - Usman Garuba - PF/C - Spain  18) Golden State - Josh Christopher - SG - ASU  19) Toronto - Alperen Sengun - C - Turkey  20) Indiana - Greg Brown - PF - Texas  21) Denver - BJ Boston - G/F - Kentucky  22) Milwaukee - Jared Butler - G - Baylor  23) San Antonio - Day'Ron Sharpe - C - UNC  24) Houston - Terrence Shannon - SG - Texas Tech  25) Brooklyn - Chris Duarte - SG - Oregon  26) Philadelphia - Roko Prkacin - PF - Croatia  27) Phoenix - Ayo Dosunmu - G - Illinois  28) LA Clippers - Ayo Dosunmu - G - Illinois  29) LA Lakers - Cam Thomas - SG - LSU  30) Utah - David Johnson - PG - Louisville"
"Closer to the FadeForCade Sweepstakes now, but a Jalen Green or Jonathan Kuminga fits their team more than another guard, even if Cade has drawn Grant Hill/Ben Simmons/Luka comparisons."
"Unrelated to this post but Jonathan Kuminga is going to be a beast, just so underrated. He really reminds me of Kawhi and is the first prospect to do so"
Jonathan Kuminga
1	Thunder (via Heat)	Cade Cunningham	PG	Oklahoma State  2	Bulls	Evan Mobley	C	USC  3	Wizards	Jalen Suggs	PG	Gonzaga  4	Cavs	Jonathan Kuminga	SF	G League Ignite  5	Warriors	Jalen Green	SG	G League Ignite  6	Pistons	Jalen Johnson	SF	Duke  7	Magic	Ziaire Williams	SF	Stanford  8	Thunder	Scottie Barnes	PF	Florida State  9	Hawks	Moses Moody	SG	Arkansas  10	Pelicans	Corey Kispert	SF	Gonzaga  11	Rockets	Sharife Cooper	PG	Auburn  12	Knicks	Jaden Springer	PG	Tennessee  13	Grizzlies	Alperen Segun	C	Beşiktaş  14	Kings	Greg Brown	PF	Texas
They saw Jonathan Kuminga play and said we need him
"Mock Draft [Week #10](https://np.reddit.com/r/nba/comments/lfba9d/mock_draft_monday_game_thread_index/gml9xe5/) - Lottery simmed on tankathon based on current record (I obviously don't expect these teams to all be lottery teams, the exercise is to track the changes week by week as records change)  1) Cleveland (+3) - Cade Cunningham - PG - OKSt  2) Sacramento (+10) - Jonathan Kuminga - SF - G-League Ignite  3) Washington (-1) - Evan Mobley - C - USC  4) Oklahoma City (+7) - Jalen Suggs - G - Gonzaga  5) Golden State (via MIN) (-4) - Jalen Green - SG - G-League Ignite  6) Detroit (-3) - Jalen Johnson - F - Duke  7) Orlando (-2) - Scottie Barnes - F/PG - FSU  8) Chicago (-2) - Corey Kispert - SF - Gonzaga  9) Oklahoma City (via HOU) (-2) - Ziaire Williams - SF - Stanford  10) Atlanta (-2) - Moses Moody - SG - Arkansas  11) New Orleans - Jaden Springer - G - Tennessee  12) Houston (via MIA) - Keon Johnson - G - Tennessee  13) New York (via DAL) - Daishen Nix - PG - G-League Ignite  14) Memphis - James Bouknight - SG - UConn  15) Toronto - Usman Garuba - PF/C - Spain  16) Charlotte - BJ Boston - G/F - Kentucky  17) New York - Franz Wagner - SF - Michigan  18) Boston - Day'Ron Sharpe - C - UNC  19) Golden State - Roko Prkacin - PF - Croatia  20) Indiana - Greg Brown - PF - Texas  21) Houston (via BRK) - Josh Christopher - SG - ASU  22) Denver - Alperen Sengun - C - Turkey  23) Milwaukee - Sharife Cooper - PG - Auburn  24) San Antonio - Kai Jones - PF/C - Texas  25) Brooklyn (via POR) - Jared Butler - G - Baylor  26) Phoenix - Ayo Dosunmu - PG - Illinois  27) Philadelphia - Terrence Shannon Jr - SG - Texas Tech  28) LA Clippers - Josh Giddey - PG - Australia  29) LA Lakers - Marcus Bagley - PF - ASU  30) Utah - Chris Duarte - SG - Oregon"
I’d definitely take Jonathan Kuminga for the Warriors
He's mainly doing it to help mentor the prospects like Jalen Green and Jonathan Kuminga on team Ignite
Seen Siakim and Jaylen Brown in other places https://www.nbadraft.net/players/jonathan-kuminga/
How the fuck does Woj leave out Jonathan Kuminga in his tweet?
Jonathan Kuminga
If we tank and get Jonathan Kuminga we can have people Kum to Sexland
"Mock Draft [Week #9](https://np.reddit.com/r/nba/comments/la2i9v/mock_draft_monday_game_thread_index/glls1tx/) - Lottery simmed on tankathon based on current record (I obviously don't expect these teams to all be lottery teams, the exercise is to track the changes week by week as records change)  1) Detroit - Cade Cunningham - PG - OK St  2) New York (From DAL) (+6) - Jalen Suggs - PG - Gonzaga  3) Orlando (+1) - Jalen Green - SG - G-League  4) Cleveland (+3) - Evan Mobley - C - USC  5) Washington (-3) - Jonathan Kuminga - F - G-League  6) Golden State (from MIN) - Jalen Johnson - F - Duke  7) OKC (from MIA) - Scottie Barnes - F/PG - FSU  8) Chicago - Corey Kispert - SF - Gonzaga  9) Toronto - Moses Moody - SG - Arkansas  10) OKC - Jaden Springer - G - Tennessee  11) New Orleans - James Bouknight - SG - UConn  12) Memphis - Keon Johnson - SG - Tennessee  13) Houston - Ziaire Williams - SF - Stanford  14) Sacramento - Day'Ron Sharpe - C - UNC  15) New York - BJ Boston - G/F - Kentucky  16) Charlotte - Josh Christopher - SG - ASU  17) Atlanta - Sharife Cooper - PG - Auburn  18) Indiana - Greg Brown - PF - Texas  19) Golden State - Daishen Nix - PG - G-League  20) Denver - Roko Prkacin - PF - Croatia  21) Boston - Alperen Sengun - C - Turkey  22) Houston (from POR) - Terrence Shannon Jr - SG - Texas Tech  23) Brooklyn - Cam Thomas - SG - LSU  24) San Antonio - Usman Garuba - PF/C - Spain  25) Phoenix - Jared Butler - PG - Baylor  26) Milwaukee - Ayo Dosunmu - PG - Illinois  27) LA Clippers - Josh Giddey - PG - Australia  28) Philadelphia - Ron Harper Jr - SF - Rutgers  29) LA Lakers - Franz Wagner - SF - Michigan  30) Utah - David Johnson - PG - Louisville"
"1. Washington - Cade Cunningham, PG, OKlahoma St.   2. Magic - Jalen Green, G, G League  3. Raptors - Jalen Suggs, G, Gonzaga  4. Sacramento - Evan Mobley, C, USC  5. Warriors - Jonathan Kuminga, F, G League  6. OKC - Moses Moody, G/F, Arkansas  7. Detroit - Keon Johnson, SG, Tenn  8. Cleveland - Jalen Johnson, F, Duke  9. OKC - Scottie Barnes, F, FSU  10. Magic - James Bouknight, SG, UConn"
"If its Jonathan kuminga, Jalen Green, someone like that , they'll be better than Lonzo by Year 2 for sure"
"Mock Draft [Week #17](https://np.reddit.com/r/nba/comments/mfp1km/mock_draft_monday_game_thread_index/gsoov7r/) - Lottery simmed on tankathon based on current record (I obviously don't expect these teams to all be lottery teams, the exercise is to track the changes week by week as records change)  1) Houston (+1) - Cade Cunningham - PG - OK St  2) Washington (+4) - Evan Mobley - C - USC  3) Cleveland (+2) - Jalen Suggs - G - Gonzaga  4) Toronto (+4) - Jalen Green - SG - G-League  5) Golden State (from MIN) (-4) - Jonathan Kuminga - F - G-League  6) Detroit (-3) - Moses Moody - G/F - Arkansas  7) Orlando (-3) - Keon Johnson - SG - Tennessee  8) Oklahoma City - Scottie Barnes - PF - FSU  9) Orlando (from CHI) - Jalen Johnson - F - Duke  10) Sacramento - Corey Kispert - F - Gonzaga  11) New Orleans - James Bouknight - SG - UConn  12) Indiana - Franz Wagner - SF - Michigan  13) Golden State - Jaden Springer - G - Tennessee  14) San Antonio - Alperen Sengun - C - Turkey  15) New York - Davion Mitchell - PG - Baylor  16) Boston - Usman Garuba - PF/C - Spain  17) Charlotte - Isaiah Jackson - PF/C - Kentucky  18) Memphis - Ziaire Williams - SF - Stanford  19) Atlanta - Cam Thomas - SG - LSU  20) Oklahoma City (from MIA) - Sharife Cooper - PG - Auburn  21) New York (from DAL) - Jared Butler - G - Baylor  22) Houston (from POR) - Kai Jones - PF/C - Texas  23) LA Lakers - Daishen Nix - PG - G-League  24) Denver - Terrence Shannon Jr - G/F - Texas Tech  25) LA Clippers - Josh Giddey - PG - Australia  26) Houston (from MIL) - Josh Christopher - SG - Arizona St  27) Philadelphia - Chris Duarte - G/F - Oregon  28) Brooklyn - Tre Mann - PG - Florida  29) Phoenix - Greg Brown - PF - Texas  30) Utah - Ayo Dosunmu - G - Illinois"
MIN: Cade Cunningham  HOU: Evan Mobley  DET: Jalen Green  ORL: Jalen Suggs  CLE: Jonathan Kuminga  WAS: Keon Johnson  TOR: Jalen Johnson  OKC: Scottie Barnes  ORL: Moses Moody  SAC: Kai Jones  NO: James Bouknight  IND: Jaden Springer  GS: Franz Wagner  SA: Corey Kispert  NY: Sharife Cooper  BOS: Usman Garuba  CHA: Alpern Sengun  MEM: Cameron Thomas  ATL: Josh Giddey  OKC: Davion Mitchell
"Mock Draft [Week #16](https://np.reddit.com/r/nba/comments/mamz3k/mock_draft_monday_game_thread_index/grt75b7/) - Lottery simmed on tankathon based on current record (I obviously don't expect these teams to all be lottery teams, the exercise is to track the changes week by week as records change)  1) Detroit (+1) - Cade Cunningham - PG - OK St  2) Minnesota (-1) - Evan Mobley - PF/C - USC  3) New Orleans (+7) - Jalen Suggs - G - Gonzaga  4) Washington (+1) - Jalen Green - SG - G-League Ignite  5) OKC (from HOU) (-2) - Jonathan Kuminga - F - G-League Ignite  6) Orlando (-2) - Moses Moody - G/F - Arkansas  7) Cleveland (-1) - Scottie Barnes - PF - FSU  8) Toronto (-1) - Keon Johnson - SG - Tennessee  9) Oklahoma City (-1) - Jalen Johnson - F - Duke  10) Orlando (from CHI) (-1) - Corey Kispert - SF - Gonzaga  11) Sacramento - Franz Wagner - SF - Michigan  12) Indiana - James Bouknight - SG - UConn  13) Golden State - Ziaire Williams - SF - Stanford  14) Memphis - Jaden Springer - G - Tennessee  15) Houston (from MIA) - Kai Jones - PF/C - Texas  16) Atlanta - Cam Thomas - SG - LSU  17) Boston - Alperen Sengun - C - Turkey  18) Charlotte - Isaiah Jackson - PF/C - Kentucky  19) New York - Terrence Shannon Jr - SG - Texas Tech  20) New York (from DAL) - Davion Mitchell - PG - Baylor  21) San Antonio - Usman Garuba - PF/C - Spain  22) Denver - Greg Brown - PF - Texas  23) Houston (from POR) - Sharife Cooper - PG - Auburn  24) LA Lakers - Chris Duarte - G/F - Oregon  25) Houston (from MIL) - Josh Christopher - SG - ASU  26) LA Clippers - Jared Butler - G - Baylor  27) Brooklyn - Josh Giddey - PG - Australia  28) Phoenix - Daishen Nix - PG - G-League Ignite  29) Philadelphia - Roko Prkacin - PF - Croatia  30) Utah - Tre Mann - PG - Florida"
"Mock Draft [Week #14](https://np.reddit.com/r/nba/comments/m0f5yz/mock_draft_monday_game_thread_index/gq7jayb/) - Lottery simmed on tankathon based on current record (I obviously don't expect these teams to all be lottery teams, the exercise is to track the changes week by week as records change)  1) New Orleans (+9) - Cade Cunningham - PG - OK St  2) Sacramento (+5) - Evan Mobley - C - USC  3) Memphis (+10) - Jalen Green - SG - G-League Ignite  4) Indiana (+7) - Jonathan Kuminga - F - G-League Ingite  5) Golden State (from MIN) (-4) - Jalen Suggs - G - Gonzaga  6) Detroit (-4) - Moses Moody - G/F - Arkansas  7) Oklahoma City (from HOU) (-4) - Scottie Barnes - PF/PG - FSU  8) Orlando (-4) - James Bouknight - SG - UConn  9) Cleveland (-4) - Keon Johnson - SG - Tennessee  10) Washington (-4) - Jaden Springer - G - Tennessee  11) Toronto (-3) - Alperen Sengun - C - Turkey  12) Oklahoma City (-3) - Corey Kispert - F - Gonzaga  13) Chicago (-1) - Sharife Cooper - PG - Auburn  14) Golden State - Ziaire Williams - SF - Stanford  15) Atlanta - Cam Thomas - SG - LSU  16) New York - Franz Wagner - SF - Michigan  17) Charlotte - Usman Garuba - PF/C - Spain  18) Boston - Jared Butler - G - Baylor  19) New York (from DAL) - Ayo Dosunmu - G - Illinois  20) Oklahoma City (from MIA) - Daishen Nix - PG - G-League Ignite  21) San Antonio - Day'Ron Sharpe - C - USC  22) Houston (from POR) - Kai Jones - PF/C - Texas  23) Denver - BJ Boston - G/F - Kentucky  24) LA Clippers - Josh Giddey - PG - Australia  25) Milwaukee - Davion Mitchell - PG - Baylor  26) LA Lakers - Terrence Shannon Jr - SG - Texas Tech  27) Brooklyn - Greg Brown - PF - Texas  28) Phoenix - Isaiah Jackson - PF/C - Kentucky  29) Philadelphia - Josh Christopher - SG - ASU  30) Utah - Miles McBride - PG - WVU"
"I just wanna know whether T'Wolves are gonna keep a Top 3 pick or the Warriors about to get even more stacked next year with Klay back and one of Jalen Green, Jonathan Kuminga, or Jalen Suggs joining them."
"And also hoping for the 4th pick to fall to them from Minnesota.      Jalen Green, Jonathan Kuminga, or Jalen Suggs come to the Bay."
Klay Thompson &amp; Timberwolves 2021 4th pick who will turn out to be Jonathan Kuminga
"Jalen Suggs, Jalen Green, Cade Cunningham, Jonathan Kuminga, Evan Mobley.  Davion Mitchell, Keon Johnson, Jalen Johnson, Scottie Barnes, Isaiah Jackson.  Corey Kispert, James Bouknight, Kai Jones."
"Preparing for Cade Cunningham, Evan Mobley, Jalen Green, Jalen Suggs or Jonathan Kuminga??"
But Jonathan Kuminga is a certain impact player on a playoff team? Lol. Turn off 2k
"The Thunders would be really good.   Ep 1: Okla-Home-A: the Thunder is born and the team comes to OKC for the first time with Kevin Durant and Russell Westbrook in tow. Shows some background on what happened with Seattle  Ep. 2: The Thunder Rolls: Drafting Harden, and covers the challenge to LA in 2010, taking Dallas to the WCF, and going to the Finals in 2012.   Ep 3: When it Rains, it Pours: Covers the Harden trade post 2012 Finals, the Westbrook injury in 2013, and the tough 2015 season.   Ep 4: You the Real MVP: Covers Durant’s 2014 MVP season and his impact on the city.   Ep 5: New Beginnings: Covers the hire of Billy Donovan and the departure of Kevin Durant in 2016  Ep 6: The Brodie: Episode goes in-depth on Russell Westbrook’s relationship with the city and organization. Also covers his 2017 MVP Year  Ep 7: OK3: Covers the trades for Paul George and Carmelo Anthony and their season together in OKC  Ep 8: Shockwaves: Covers the Paul George extension, the failed 2019 season, and the trades of Westbrook/George to begin the new era.   Ep: 9: Restructuring: Covers the return of Chris Paul to OKC and his impact. Also covers to arrival of Shai Gilgeous Alexander, Lu Dort, Darius Bazley, and the teams new direction.   Ep 10: A New Storm: Mark Daigneault is hired as the new coach, the team begins its process of tanking to draft in the lottery, and begin their race back to where they once were, trying to bring the organization back full circle where they were a decade ago. Could possibly feature: Cade Cunningham, Jalen Green, Jalen Suggs, Evan Mobley, or Jonathan Kuminga"
Bj and Davion way too high there bud    Cade Cunningham   Evan Mobley   Jalen Green  Jalen Suggs   Jonathan Kuminga   Moses Moody   Keon Johnson   Jaden Springer  Jalen Johnson    Franz Wagner
"Don’t sleep on Franz Wagner. I would take him higher than anybody you have after Jonathan Kuminga on your board. He is top 10 on my board for sure . The combination of versatility, playmaking, defense and scouring on the wing is to valuable in today’s nba. He will at least be a high level role player!"
"If Jonathan Kuminga ends up in Cleveland and hits his ceiling, the Cavaliers are going to have a very nice young core."
48% chance the Thunder get Jonathan Kuminga as a result of the trade.
