"Here are the top lottery prospects (via ESPN ranking with some highlights) for the folks that want a glimpse ahead of the NBA draft with tonight's lottery day:  1. [Cade Cunningham](https://www.youtube.com/watch?v=aFVlfVXpl6g) \- Oklahoma State - PG - Freshmen - 6'8"" - 220 lbs - \[20.1 pts, 6.2 reb, 3.5 ast\] 2. [Evan Mobley](https://www.youtube.com/watch?v=YbHIPNF1aeA) \- USC - C - Freshman - 7'0"", 210 lbs - \[16.4 pts, 8.7 rebs, 2.4 ast\] 3. [Jalen Suggs](https://www.youtube.com/watch?v=dJi3gpoO_3g) \- Gonzaga - SG - Freshman - 6'4"", 205 lbs - \[14.4 pts, 5.3 reb, 4.5 ast\] 4. [Jalen Green](https://www.youtube.com/watch?v=-6wpRvMjZaU) \- G League - SG - Undrafted - 6'6"", 178 lbs - \[17.9 pts, 4.1 reb, 2.8 ast\] 5. [Jonathan Kuminga](https://www.youtube.com/watch?v=6MV8O4xE9aU) \- G League - PF - Undrafted - 6'6"", 210 lbs - \[15.8 pts, 7.2 reb, 2.7 ast\] 6. [Scottie Barnes](https://www.youtube.com/results?search_query=scottie+barnes+highlights) \- FSU - SF - Freshman - 6'9"", 227 lbs - \[10.3 pts, 4 reb, 4.1 ast\] 7. [Davion Mitchell](https://www.youtube.com/watch?v=BzdcM8Hk_po) \- Baylor - PG - Junior - 6'2"", 205 lbs - \[14 pts, 2.7 reb, 5.5 ast\] 8. [Keon Johnson](https://www.youtube.com/watch?v=VYFep7QOVjI) \- Tennessee - SG - Freshmen - 6'5"", 186 lbs - \[11.3 pts, 3.5 reb, 2.5 ast\] 9. [Jalen Johnson](https://www.youtube.com/watch?v=wr8M3FWWkso) \- Duke - SF - Freshman - 6'9"", 220 lbs - \[11.2 pts, 6.1 reb, 2.2 ast\] 10. [Franz Wagner](https://www.youtube.com/watch?v=6Gcf1hohyc8) \- Michigan - SF - Sophmore - 6'9"", 220 lbs - \[12.5 pts, 6.5 reb, 3 ast\] 11. [Isaiah Jackson](https://www.youtube.com/watch?v=trAGUPwNKlM) \- Kentucky - PF - Freshman - 6'10"", 206 lbs - \[8.4 pts, 6.6 reb, 0.7 ast\] 12. [Corey Kispert](https://www.youtube.com/watch?v=BTv6-T3k3ec) \- Gonzaga - SF - Senior - 6'7"", 220 lbs - \[18.6 pts, 5 reb, 1.8 ast\] 13. [Josh Giddey](https://www.youtube.com/watch?v=HuJj4p0SaOU) \- Australia - PG - 18 years old - 6'8"", 205 lbs - \[11.2 pts, 7 reb, 6.8 ast\] 14. [Alperen Sengun](https://www.youtube.com/watch?v=lfWFeOuuNXE)\- Turkey - C - 18 years old - 6'10"", 240 lbs - \[19.2 pts, 9.4 reb, 2.5 ast\]"
"I'm trying to point out that it's *not* that easy to compile a collection of useful future assets.   Yeah, it's *even more* difficult to put together a championship-caliber team out of those assets (some will turn into a pumpkin at midnight. You'll pay the wrong guy, or somebody will get hurt, or somebody will leave in FA, or you'll draft a bust.)  But it is not *easy* to collect assets.   Detroit was terrible this year. It's been 14 years since they had a 45-win season. They have two playoff appearances in the last 12 seasons. They're short future picks. They don't have much cap room this offseason. They have some intriguing young players, but nobody that looks like a future star.  That's really common.   Your team's not any good, and you're missing future picks, and you've got a full cap sheet.   What's the Cavs' path to relevance? They're never going to have cap space. They don't have anybody who actually looks like the #1 guy on a contender. They've been fucking *awful* for the last three years. What's the path? Hope Jonathan Kuminga is a lot better than he looked this year? Hope they win the lottery *again?*   What about the Pacers? How are they going to get off of this treadmill of mediocrity? They probably won't keep both their FAs this year (would make them a tax team)...They could *try* to blow it up, or they could try to keep making moves on the margins until they're good enough to lose in round 2...but there is no path to a legitimate contender right now.  That's a whole division. Milwaukee and a pile of crap."
"I don't blame him.  This whole one and done ""student athlete"" thing is an insult to everyone's intelligence.   Everyone knows these guys aren't there for an education. I don't understand the value in even pretending that these guys are actually getting one.  I can't wait until all the best prospects just go the Jalen Green/Jonathan Kuminga route and just go to the G-league."
"&gt; “So the more likely path — and the path that I think, as an owner, I feel most comfortable with, quite frankly — is to bridge the gap to the future,” Lacob said. “We’ve got three or four contracts and big players that are still in their early 30s, still have quite a bit of time to go, especially in this day and age. If we can kind of have a Wiseman and a Kuminga and a Moody and a Poole (help in the meantime). They don’t have to be awesome next year. With a great investment in our player development staff, we just want them to show great potential.”  [Source](https://theathletic.com/2742823/2021/07/31/exclusive-joe-lacob-discusses-jonathan-kuminga-pick-and-his-win-now-develop-now-plan-for-the-warriors/?amp). I don't know if you're being sarcastic because while it seems clear to me (based on what the FO has both said and done), I know the idea that they should be trading for a win-now player is popular on r/nba."
"\&gt; Derrick Rose being the youngest MVP in NBA history at age 22 because it’s rare for a player that young to play on a team that good that early in their careers, and some people said Rose shouldn’t have won that year regardless.  Jonathan Kuminga."
"Sources: Jonathan Kuminga, ""No."""
"Nah. That ain't it. It's just that GSW fans are loaded to the tits with young bandwagon fans so there is a disproportionate number of posts about Jonathan Kuminga relative to what he's shown so far. There's more upvoted posts about Kuminga than Cade Cunningham, why is that?  Combine that with the fact that I actually watched him play last year, so I feel like I'm in a good position to talk some basketball with some real fans. Raptors fans are too high on Barnes and consider him the next coming of Giannis. It's also a lazy comparison.  Anyway, you can carry on getting baited for clicks by the beat writers in The Bay. As, I said, he'll be a good player and has a good head on his shoulders. But if you think his game has shown the capability to be a 2xDPOY, you're on several."
"Jonathan Kuminga ambled past a horde of nephews as he surveyed the spectacle of the offseason on r/nba. Cascades of shitposts. The off-color 'shipping of Jordan impersonators. Paul Pierce posing with twerkers.  ""I'm too old for this sub,"" Kuminga said."
"So Nike got Cade Cunningham, Jonathan Kuminga, and now Scottie Barnes. Adidas got Jalen Green, Jalen Suggs, and Evan Mobley already.  That just leaves Josh Giddey as the only sneaker deal-less of the Top 7"
You can't win with logic here. You're the bad man for coming at a franchise for pacifying their weak azz stars. (Yeah KAT is as good as Andre Drummond fluff stats on poor teams). I would've traded Kat to the Knicks for both of the firsts this year and they keep Jonathan Kuminga (hope I spell it right) plus them picks u got a deep young team. But now they got two former all stars mentoring Anthony Edwards on how to fall off.
"jonathan kuminga, the warriors #7 pick this draft.  it's not even intended to be insulting towards him, it's just dumbasses amusing themselves being shitty."
1. Cade Cunningham 2. Jalen Green 3. Evan Mobley 4. Jonathan Kuminga 5. Jalen Suggs 6. James Bouknight 7. Jalen Johnson 8. Alperen Sengun 9. Scottie Barnes 10. Davion Mitchell 11. Trey Murphy 12. Chris Duarte 13. Moses Moody 14. Josh Giddey
Scottie Barnes. Jalen Green. Jonathan Kuminga. Davion Mitchell. Tre Murphy
"I would go:  1) Cade Cunningham  2) Jalen Green  3) Jalen Suggs  4) Evan Mobley  5) Jonathan Kuminga   6) Scottie Barnes  7) Josh Giddey (don’t think it’s fair to drop him since he pretty much hasn’t played)  Also, Scottie Barnes being two spots lower than where he was drafted isn’t meant to be a diss or anything. I still think he’s gonna be a great player and 3-6 are pretty much interchangeable to me, plus that’s where I had him before the draft anyway. I also think Cade or Jalen Green going #1 would be fine"
Jonathan Kuminga   Immanuel Quickley
Jonathan Kuminga.
Jonathan Kuminga
"It's honestly not surprising how awesome Jonathan Kuminga has looked.  Actually, IIRC we were both on the same mindset that JK was the best BPA at the 6th spot, and I said it was basically set in stone not drafting him would be a huge mistake.  &gt;I just don’t get it, he clearly is good at basketball, he’s not some uncoordinated bumbling doofus, he was playing against grown professionals on the worst team in the league and took a ton of shots he probably shouldn’t have been taking. Dude is great at drawing contact, has shown the ability to create his own shot from anywhere on the floor, he’s just an awesome prospect IMO. Barnes has way more question marks imo, I’d take Kuminga 10/10 over him, but I also totally understand why teams like Barnes.   &gt;   &gt;What’s the argument for anyone else over Kuminga? Sengun is the only one I can make an argument for, and he might not even go top 10. Bouk has the same problems as Kuminga except he’s older and has lesser physical tools, Moody is way more limited, Mitchell is older and lower upside, who’s the guy that’s going over Kuminga at 5 or 6  [https://www.reddit.com/r/NBA\_Draft/comments/oqxo2y/hedo\_on\_a\_mission\_he\_predicts\_sengun\_at\_8/h6fi9cu?utm\_source=share&amp;utm\_medium=web2x&amp;context=3](https://www.reddit.com/r/NBA_Draft/comments/oqxo2y/hedo_on_a_mission_he_predicts_sengun_at_8/h6fi9cu?utm_source=share&amp;utm_medium=web2x&amp;context=3)  To be honest, I really don't understand why OKC chose Giddey over JK. I wonder if it's something we'll look back from years from now on. GSW lucked out drafting someone like JK and Moses Moody though, they got two excellent two-way wings that could definitely help fit and establish their death line up 2.0"
Poku (not ironically)  And Jonathan Kuminga.  I really believe it
"Kuminga, hachimura, Jonathan issac, lamelo ball. Lamelo and kuminga all nba potential. Issac dpoy and all star potential, he gotta get out of Orlando ASAP tho. Hachimura perennial 20, 8, and 4 all star if his team is competing. I like his feel for the game. He is to me what Kyle kuzma thinks he is."
1. Anthony Edwards 2. Jonathan Kuminga 3. Patrick Williams
"&gt; Jonathan Kuminga (GSW) possible steal at 7  I know we live in a era of overhype over everything where people feel they're out there to ""prove DOUBTERS wrong 😤"", but I don't know if I'd call a very exciting seventh pick a *steal*. It's still a very high pick in a draft that seems sneakily loaded with good talent. Like if I remember correctly he fell off from the top 5 on some mocks - which are fun but bs anyway - in the weeks leading up to the draft because nobody really knows how to value performance in the G League, but still no one ever denied (DOUBTED????) he's very talented.   If there's a steal in the mid-high first round I'd say Sengun. Dude literally fell in Houston's lap. Who knows how he's gonna fare in the NBA, but inside center's value is at an all-time low :-/"
"Gelo Ball, Jalen Green and Jonathan Kuminga."
"Missing the crowd commentary. ""No it's Jonathan Kuminga! No! No! No not this guy!"""
"""Vous atteignez, j'enseigne.""    --Jonathan Kuminga probably."
"I dunno, $100,000 is a good chunk of money, and a lot of these guys come from really poor backgrounds where they really need the money right away. If he's good enough to make it in the NBA, he'll get his chance at the real big money either way. And if he's not, then more exposure from college isn't necessarily a good thing.  Put it this way: would you rather be BJ Boston or Jonathan Kuminga right now?  Edit: that said, it is really strange that he picked this league over the G-League or an overseas one."
"In addition, Jalen Green and Jonathan Kuminga going top 7 in the draft shows that the Ignite can maintain and increase a high school player’s NBA prospects."
"Similarly Jonathan Kuminga should unofficially take up of the mantle of, “Kum Bucket” because he comes off the bench and gets you buckets."
Jonathan “Thon Maker” Kuminga
"&gt;  and looking at our 2015/16 squads, we had Barbosa/Livingston/Iguodala/Speights/Ezeli coming off the bench with some David Lee, Ian Clark etc.  &gt; The only player who could be on that level next year is Poole, if he keeps developing. JTA is a good piece but he's more of a Draymond and needs people to work with. We also don't have a big as talented or important as Bogut  Poole? Are you fucking serious? You also have Iguodala, Otto Porter Jr., Moses Moody, Jonathan Kuminga, Bjelica, and Looney. That’s very comparable to what you had then."
"Jonathan ""Raw"" Kuminga 😂 I kept getting laughed at for saying he will make an impact from day one"
Jonathan Kuminga looked beastly tonight.
"Can we preemptively ban using any version of ‘Kum’ for Jonathan Kuminga?  It’s disgusting, demeaning, and disrespectful. On the Warriors sub we do not like it and don’t support it and yet other flaired users are claiming we condone it."
"LOL he was a G League ignite kid, playing with Jalen Green and Jonathan Kuminga. He was their PG"
1. Cade Cunningham 2. Jalen Green 3. Evan Mobley  4. Scottie Barnes  5. Jalen Suggs  6. Josh Giddey  7. Jonathan Kuminga  8. Franz Wagner  9. Davion Mitchell  10. Ziaire Williams
"This my ""Spurs-like"" wet dream. Curry winning FMVP at age 38 with multi-time all star Jonathan Kuminga, all-NBA James Wiseman, and 2xAll Star Moses Moody with 6MOY winning Jordan Poole to get Curry his 6th championship."
Jonathan Kuminga *
"Wiggins homecoming? Raptors get Wiggs and Paschall. Warriors get Dragic, Baynes and second round pick(s)  Warriors depth chart:  |[](/GSW)|Starters|Reserves|3rd string| |:-:|:-|:-|:-| |**C**|James Wiseman|Kevon Looney|Aron Baynes |**F**|Draymond Green|Nemanja Bjelica| |**F**|Otto Porter Jr.|Jonathan Kuminga|Juan Toscano-Anderson| |**G**|Klay Thompson|Modey Moosy|Jordan Poole| |**G**|Stephen Curry|Goran Dragic|  edit: Raptors just waived Baynes. Nevermind"
"The Golden State Warriors are the perfect team for a Leeds United fan. First of all, both teams have gold and blue as their colors. This means you can be aesthetically consistent in the clubs you support. Also Leeds United gear can double as Warriors gear because they’re the same colors.     Theres also an interesting San Francisco connection between the clubs. The San Francisco 49ers (NFL) own 37% of Leeds United and the Warriors are also based in San Francisco. This would be an interesting thread of continuity between teams you support.    In terms of basketball, the Warriors have one of the most entertaining players of all time in Steph Curry. This is a great time to become a Warriors fan because they’re coming off a disappointing season where they missed the playoffs (so you wouldn’t be glory chasing), but are in a solid position to bounce back with one of their best players in Klay Thompson returning after missing two entire seasons with injuries.    Speaking of Klay, he’s also a very exciting player to watch and has one of the hottest hands in the league. He holds the NBA record for most points in a quarter with 37. Make sure to watch a video of that if you haven’t seen it already. He’s also an interesting personality off the court (look up Klay on a boat).    Finally, the Warriors are a solid team to root for because they have a mix of veteran players and young promising players. Their core is getting up there in age and has a few more seasons to contend for a championship before they pass the torch to guys like James Wiseman and Jonathan Kuminga. This mix of talent means that the Warriors can be competitive for many years to come."
Acting like all these guys aren't gonna take less to play with Jonathan Kuminga.
"""TLDR: Unless a player at the level of a Beal, Dame, PG, Kawhi, etc, requests a trade and says the Warriors are one of their preferred destination, we will be keeping James Wiseman, Jonathan Kuminga, and Mody Mooses""   I'm not a big fan of Lacob, but this doesn't seem like an unreasonable position to have."
"Woj doesn’t have sources? MTII also:    *They were ready to take Arkansas' Moses Moody at No. 7. But as the whispers suggested, Jonathan Kuminga, once considered a top-five pick, was sliding a bit. When Kuminga fell to the Warriors, they went ahead and jumped on the good fortune. The picks of Josh Primo and Ziaire Williams pushed some of their desire players down the board. Moody fell right to them. Based on their board, they essentially got two top-seven picks.*"
"Draymond sat crying his car in the Oracle Parking lot, his first call was to G-League Ignite Forward Jonathan Kuminga: “We need you”, he repeated.   His next call was to Bob Myers: “It’s all on you now. Bring him”"
Per Anthony Slater  Age of Warriors first round picks:  Jonathan Kuminga: 18  Moses Moody: 19  James Wiseman: 20
"I am a teacher, and Jonathan Kuminga was in my class for one day in 9th grade before transferring (dead srs, not a joke).   AMA"
Perk: Jonathan Kuminga: poor man's Jordan Bell
The golden state projects featuring James wiseman and Jonathan kuminga!
"One Jonathan Kuminga, coming right up!"
"Two low-floor high-ceiling prospects (say, Jonathan Kuminga and Kai Jones), neither of whom pans out"
"7-Warriors-Jonathan Kuminga  yeah, no"
Here's my mock draft  1-Pistons-Cade Cunningham  2-Rockets-Jalen Green  3-Cavaliers-Evan Mobley  4-Raptors-Jalen Suggs  5-Magic-Scottie Barnes  6-Thunder-James Bouknight  7-Warriors-Jonathan Kuminga  8-Magic-Moses Moody  9-Kings-Franz Wagner  10-Grizzlies-Josh Giddey  11-Hornets-Jalen Johnson  12-Spurs-Alperen Sengun  13-Pacers-Davion Mitchell  14-Warriors-Chris Duarte   15-Wizards-Trey Murphy II  16-Thunder-Isaiah Jackson  17-Pelicans-Corey Kispert  18-Thunder-Keon Johnson  19-Knicks-Usman Garuba  20-Hawks-Jared Butler  21-Knicks-Ziare Williams  22-Lakers-Ayo Dosunmu   23-Rockets-Kai Jones  24-Rockets-Jaden Springer  25-Clippers-Cam Thomas  26-Nuggets-Charles Bassey  27-Nets-Day’Ron Sharpe  28-76ers-Kessler Edwards  29-Suns-Bones Hyland  30-Jazz-JT Thor
"From the consensus, there’s too much Jonathan Kuminga disrespect going around"
1. Cade Cunningham 2. Evan Mobley 3. Jalen Suggs 4. Jalen Green 5. Scottie Barnes 6. Jonathan Kuminga 7. James Bouknight 8. Franz Wagner 9. Josh Giddey 10. Ziaire Williams
"You guys honestly could even be in a position to trade back.  From pick 6 on a lot of teams want specific players but that’s where things kind of explode.  Moses Moody, Franz Wagner, Jonathan Kuminga, Bouknight.  I could see you guys getting a lot of value for that 6th pick.  You figure that 6th pick is what, a 3rd or 4th pick most years?"
"The Smailagic you mentioned are from the g-league bubble this season where he was coming back from knee surgery and playing limited mins.  Smailagic G league stats in 2019-20: (9 games, 19 years old):  14.1 pts  6.0 rbs  1.3 asts  0.8 stls  1 block  27 MPG  52-22-58 splits   Jonathan Kuminga G league stats last year (13 games) 15.8 pts 7.2 rbs  2.7 asts 1 stl 0.8 blocks 32 MPG  38-24-62 splits"
"Jonathan Kuminga if he falls.  I think he's too much of a project, and I worry about the idea that you draft him to trade him later."
I don’t know what I’m getting out of Siakam in the playoffs.  I am not certain he will show up.  7 and 14 is something like Jonathan Kuminga and Davion Mitchell - it’s a lot.  I won’t stick my nose up at 7 and 14 this year.  Look at everything that Memphis did just to get to 10.
"Masai I am BEGGING you to draft this man  If I hear Adam Silver say ""With the fourth pick in the 2021 NBA draft, the Toronto Raptors select: Jonathan Kuminga"" I will drive my car off a bridge"
1. Cade Cunningham (Detroit Pistons)  2. Jalen Green (Houston Rockets)  3. Evan Mobley (Cleveland Cavaliers)  4. Jalen Suggs (Toronto Raptors)  5. Scottie Barnes (Orlando Magic) 6. James Bouknight (Oklahoma City Thunder)  7. Jonathan Kuminga (Golden State Warriors) 8. Moses Moody (Orlando Magic) 9. Franz Wagner (Sacramento Kings)  10. Josh Giddey (Memphis Grizzlies)  11. Alperen Sengun (Charlotte Hornets) 12. Keon Johnson (San Antonio Spurs)  13. Davion Mitchell (Indiana Pacers)  14. Chris Duarte (Golden State Warriors)  15. Corey Kispert (Washington Wizards) 16. Trey Murphy (Oklahoma City Thunder)  17. Cameron Thomas (New Orleans Pelicans) 18. Jalen Johnson (Oklahoma City Thunder)  19. Kai Jones (New York Knicks)  20. Jaden Springer (Atlanta Hawks) 21. Ziaire Williams (New York Knicks) 22. Jared Butler (Los Angeles Lakers) 23. Isaiah Jackson (Houston Rockets) 24. Sharife Cooper (Houston Rockets) 25. Tre Mann (Los Angeles Clippers) 26. Joshua Primo (Denver Nuggets) 27. Miles McBride (Brooklyn Nets) 28. Quentin Grimes (Philadelphia 76ers) 29. Day'Ron Sharpe (Phoenix Suns) 30. Josh Christopher (Utah Jazz)   I got bored at work and decided to take a stab at the first round.
I'm partial to Jonathan Kuminga due to his tools despite his shooting.   For the Warriors I think there's growing talk of drafting Josh Giddey out of Australia.
"No idea. All I heard was that it was offered and rejected.   Personally, I don’t think it’s that unreasonable of a decision. I’d rather have Cade on a rookie deal than a soon-to-be-extended SGA + someone like Jonathan Kuminga."
"He isn't even in the league yet, but Jonathan Kuminga. Supposedly a top 5 pick right now in the draft. He doesn't really do anything well and is 'only' a great athlete, not elite. I wouldn't touch him in the top 10 personally. A lot of 'ifs' need to go his way for him to be a good player."
"Kevin O'Connor did a Jonathan Kuminga video yesterday on The Ringer and mentioned the Kuminga discussion most likely starts at 6, as Orlando likes Scottie Barnes with the 5th pick. Honestly, either one of Barnes/Bouknight seems great, at least personally."
My own mock draft for first round top 23 picks:  Cade Cunningam \[Pistons\]  Evan Mobley \[Rockets\]  Jalen Green \[Thunder move up 6 and 16\]  Jalen Suggs \[Raptors\]  Jonathan Kuminga \[Magic\]  James Bouknight \[Cavs from Thunder\]  Moses Moody \[Warriors\]  Davion Mitchell \[Magic\]  Scottie Barnes \[Kings\]  Trey Murphy \[Knicks trade up 19 and 21\]  Josh Giddey \[Hornets\]  Chris Duarte \[Spurs\]  Jalen Johnson \[Pacers\]  Corey Kispert \[Warriors\]  Isaiah Jackson \[Wizards\]  Alperun Sengun \[Cavs from Thunder\]  Usman Garuba \[Grizzlies\]  Kai Jones \[Thunder\]  Jared Butler \[Pelicans from Knicks\]  JT Thor \[Hawks\]  Franz Wagner \[Pelicans from Knicks\]  Keon Johnson \[Lakers\]  Nah'Shon Hyland \[Rockets\]
My own mock draft for first round top 23 picks:   1. Cade Cunningam \[Pistons\] 2. Evan Mobley \[Rockets\] 3. Jalen Green \[Thunder move up 6 and 16\] 4. Jalen Suggs \[Raptors\] 5. Jonathan Kuminga \[Magic\] 6. James Bouknight \[Cavs from Thunder\]  7. Moses Moody \[Warriors\] 8. Davion Mitchell \[Magic\] 9. Scottie Barnes \[Kings\] 10. Trey Murphy \[Knicks trade up 19 and 21\] 11. Josh Giddey \[Hornets\]  12. Chris Duarte \[Spurs\] 13. Jalen Johnson \[Pacers\]  14. Corey Kispert \[Warriors\]  15. Isaiah Jackson \[Wizards\] 16. Alperun Sengun \[Cavs from Thunder\]  17. Usman Garuba \[Grizzlies\] 18. Kai Jones \[Thunder\] 19. Jared Butler \[Pelicans\] 20. JT Thor \[Hawks\] 21. Franz Wagner \[Pelicans\] 22. Keon Johnson \[Lakers\] 23. Nah'Shon Hyland \[Rockets\]
"Yeah, good for you, don't give in Andrew - Jonathan Kuminga  probably"
Fair enough.  Michael Jordan and Jonathan Kuminga?
Kum &amp; Go should do a sponsor deal with Jonathan Kuminga. It’s the greatest opportunity for both if them.
"He also compared Jonathan Kuminga to Jordan Bell and then when he thought the microphones were muted he laughed and said ""hurr hurr, you like that Jordan Bell (comparison)?"""
And your 2028 MVP…. Jonathan “Kum Bucket” Kuminga!
"The Warriors traded Robert Parish for the right to draft Joe Barry Carroll ahead of Kevin McHale.  That kinda hurts less than ""traded a player we got in trade for a guy we would have lost in free agency if we didn't trade him for a solid two-way wing and also Jonathan Kuminga"""
