"Gallinari and Lou Williams led a 31 point comeback for Doc back then, now they led a 26 point comeback against Doc."
Who in 2021 would have ever thought Lou Fucking Williams would be the catalyst in one of the greatest road comebacks in NBA history?  Yeah me neither.
They chocked it to fucking Lou Williams lmao
Youll be even worse off with 5 players with no offense. Lou williams and trae young just beat 3 all nba defenders
The Lou Williams final
"Don't know if you watched the game or just looked at the box score... Huerter was bricking every shot early, made a bone head clear path foul, and he was missing open layups.    Bogi was in early foul trouble , he ended up with 5 fouls in the 3rd. He never got in rhythm with the foul trouble. It would've been really dumb to keep play either one of them in their closing lineup under those circumstances.   In the last 3 minutes is the sixers failed to capitalize on the offense with Lou Williams and Trae on the floor on 3 straight positions at least. Yet when the hawks had the mismatch with Seth guarding Gallo, he immediately took advantage.   Gallo and Lou Will were playing great and it's what brought them back in the game, why on earth would he put in Bogi and Huerter.  Obviously plus minus isn't the best tracker, but I'm sure that Huerters and Bogi were garbage considering they were being blown out for 3 quarters.   Great hawks win but it's obviously all due to the sixers collapse. Only embiid and curry scored in the 2nd half..."
Its like Doc had never seen Lou Williams play
Lou Williams
I want Clippers vs Hawks so Lou Williams can get Finals MVP
Lou Williams 6th man of the year awards: 3 KD: 0 checks out
Is starting Lou Williams even legal?
with kawhai out clippers doing well.  sometimes too many chefs mess up a pot.  Reggie Jackson is lou Williams.
"The teams are not equally talented at all.  Trae has vetrans Gallinari, and Lou Williams and Capella - no one comparable on Mavs.  Think before you post :)"
Clips could really use Lou Williams now. He's been awesome for the Hox.
I mean like 5% Trae. Lou Williams' fire shooting and our entire team/coach decided to achieve maximum choke. Trae Young and Lou Williams were both defending for 8 minutes in the 4th and we made about 4 points.
I’d clamp the fuck out of 54 years old Lou Williams corpse
"Probably like a vanvleet, Norman Powell, Lou Williams.   I don't think Ben Simmons is a bad player. Definitely overrated but with a change of mindset and maybe a role change I think he could be great. When he's using his athleticism and being aggressive I think he's one of the top finishers in the NBA at the rim. Good hook touches from short range as well. He's way too passive though and his lack of confidence in jump shooting hurts him"
"As an OKC fan, I'm a full KD hater. But his greatness is undeniable. When he's on fire, all you can do is ask god for mercy. Too tall to block, too strong to body, ball handling too good to be stripped, ultra efficient at high usage, high BBIQ to kill you if you double team. He's a real life MyPlayer with all the sliders turned up. This MFer tore his achilles and is still a top 3 player in the league.  The Sixers dropping a 20+ point lead in half a quarter to Lou Williams and Trae Young is worse."
I think they won this game if they start Lou Williams
He was outplayed by 46 years old lou Williams that’s what happened
Durant is no Lou Williams
As someone who is a Sixers fan and a big Lou Williams fan I knew he was due for an explosion sooner or later. That man is a walking bucket.
Lou Williams +31. +31. +31!!
"Lou Williams was the MVP of that game, those shots in the 3rd quarter were ginormous"
The fact that the Hawks won a game where Bogi scored only 6 points in 21 minutes before being benched for old washed up Lou Williams is just hilarious.
How did he get away with trae Lou backcourt though? Sixers didn't even think of attacking them?  Monty Williams relentlessly attacked Mpj who is a slightly better defender than both. Doc sucks
The Sixers couldn't score on a lineup featuring Trae Young and Lou Williams together. I simply cannot understand it.
Lou Williams +31  LOL
And shout out to Lou Chicken Wings Williams and Danilo Gallinari for being clutch af in the 4th. Ben Simmons need to be traded right now for a bag of Cheetos that can shoot 70% from the line
Their closer was fucking Lou Williams tonight lol. You can build around a star that gets you up 30 points at the start of the 4th quarter and win as a team in the 4th. It’s possible. What’s not possible is having to score every single point in the 4th because 4/5th of the team are a complete non-threat  Swap Lou Williams and Tobias tonight and they win by 40
Is this where we pretend trae young and lou Williams have looked like good defenders their entire careers?
Lou Williams has now been a massive part in 2 25+ point comebacks in the playoffs. Incredible
How do you go on that long of a scoring drought against a backcourt of Trae Young and Lou Williams??
Not even trae young they got torched by Lou fucking Williams in the 4th.. at home.. in a game 5
"Yes Lou Williams went vintage mode. Yes, Trae Young is a fucking beast (though Holy shit the dude takes 4 steps at least once ever single lay up attempt he's not alone in this but it's still infuriating to watch him blow by simply because he's traveling egregiously), but WHATHE GODDAMN FUCK WAS THA 4TH QUARTER OFFENSE.  No scheme execution at all. So many forced bad shots. So many careless turnovers   How the fuck did a team this big let the hawks get so many offensive rebounds  And fucking hack a Ben, my God you get paid 10s of millions of dollars a year to play goddamn basketball, and you can't make free throws more than half the time. Free-throw are all about the time you spend practicing the shot. You get in what you put out. Guys like Nash would take over a hundred free throws a day. It's all routine. If your not making them, it's inexcusable.  The Hawjs didn't win, the 76ers didn't want to win. I'm sorry but it's the fucking truth.  PATHETIC"
That Lou Williams for Rondo trade looking pretty nice right now…
"Lou Williams led the charge since the third. Gallo was steady, the rest of the team were playing active defense against the Sixers predictable offense.  He got so hot with repeated PnRs against Curry. Floaters, jumpers. Trae got in and did the same. Gallo also did the same whenever he got Curry"
Lou Williams
Lou Williams was +31 tonight.
Lou Williams is a hero. He deserves all the Lemon Pepper he wants for the rest of his life.
Lou Williams can I be your third girlfriend
Lou Williams +31 that's pretty good
"Lou ""I was supposed to retire but decided not to because I'm gonna eliminate the team that drafted me"" Williams"
Lou Williams is lowkey better
"Lou Williams with +31, what a game"
lou williams happened
Lou Williams is about to win a Championship before the Clippers.
I LOVE YOU LOU WILLIAMS
76okers 😵😵😵😵😵 holy fuck.  Lou williams led that charge
Lou Williams is a hero if we win
Lou Williams and Doc Rivers
Bruh how you can't score with Lou Williams and Trae on the floor.
"Philly Subs on halfway through the 3rd gave Atlanta a boost, then Lou Williams and gallinari hit every shot in the 4th"
"Ben Simmons can’t hit a free throw, Lou Williams good, Trae young good, sixers bad apparently"
Lou Williams went off . Hack a summons worked
Lou Williams and Hack-a-Ben
Lou Williams owns that building
Sixers offense went for a stroll and Lemon Pepper Lou Williams took over
lou williams is the mvp of this game lmfao
"Progression in sports seems to work out half the time, but this Hawks team is fucking YOUNG. They SHOULD be a lock to make the playoffs for years. They wont add any free agent of significance I don't think but they have 4 draft picks this year, 5 next year depending on protections (for instance, Thunder is top 14 protected).   This team has enough draft capital to make a trade if they want, and this entire top 10 minus Lou Williams is back next year (they could resign him)"
Clippers could use Lou Williams
sixer fans do not worry. it took lou williams going ape shit for them to come back. this ain’t happening again lol
Lou Williams was a crazy good postseason pickup for the Hox.
Lou Williams is a +20 in this game
Lou Williams doing Lou Williams things.  He’s low key the 3rd greatest sixth man of all time
Lou Williams really likes big comebacks in playoff games don’t he?
Playoff Lou Williams is about to take over and put the Hawks down for good!
Im here for Lou Williams v Seth Curry
"Come for the excessive flopping, stay for the Seth Curry v Lou Williams duel"
Oh my goodness Lou Williams and Seth are trading buckets
#Lou Williams vs Seth Curry
for this exact moment ~ lou williams is a hawk
we getting a Lou Williams v. Seth Curry duel
lou williams saving the hawks
"Seth Curry VS Lou Williams to decide the game, as we all predicted"
lou williams made somebody fall gahtdam
I’m a fairly casual eastern conference viewer so forgive me  But wtf happened to Lou Williams? Are the hawks just not using him like the clippers did?
6’1 170 lbs Lou Williams dropped 6’10 240 lbs Ben Simmons 🧢🧢🧢   Flop
Start Lou Williams in the second half and have him hack Simmons from the first minute.
Shake reminds me of Lou Williams so much
A Lou Williams mid range jump shot on a fast break gross
"I’m probably in the minority here but I think the Hawks have a loaded roster and are probably underperforming. Two near max players on rookie contracts leaves space for high end role players like Capela, Gallinari, Bogdonavic, and Lou Williams. The Hawks are stacked right now."
"Just throw a golden oldies squad out there:  **Guards:** Kyle Lowry, Rajon Rondo, George Hill, Wes Matthews, Lou Williams, JJ Redick.  **Forwards:** Andre Iguodala, Carmelo Anthony, Paul Millsap, PJ Tucker, Trevor Ariza, Jared Dudley, Al Horford.   **Centres:** Dwight Howard, Taj Gibson.  Lowry, Redick, Iguodala, Melo, Dwight.   Rondo, Matthews, Tucker, Millsap, Horford.   Hill, Lou Will, Ariza, Dudley, Gibson."
"Not a big name, but Lou Williams shooting splits drop significantly in the playoffs:  Regular season: 14.5 points on 42% FG 35% 3P  Playoffs: 12.3 points on 39% FG 25% 3P"
🎶 2 bad seconds like I'm Lou Williams 🎶
"he's had 1 above average efficiency season in his career, 5 years ago  'overrated' is an understatement, he's lou williams in a starting spot and on a max contract"
Those guys just don't perform in the playoffs. Lou Williams has struggled every year in the postseason and Clarkson is being found out once again right now (-50 for the series)
"The Bucks are obviously a very talented team that has the ability to dominate anyone. Just need to find the right coach to get that team to show up all of the time. Also some minor adjustments to their bench could do wonders. They could use a ""you miss every shot you don't take"" type of bench scorer (like a Jamal Crawford/Lou Williams/Jordan Clarkson type)."
Lou Williams all nba third team incoming
"I want him to play poorly. I want him to get frustrated, have some techs thrown at him, and make mistakes.  Of course all of that depends on him playing hurt, but that could end up helping us.  You know who scares me right now? Freaking Shake Milton. Whenever he is in, it looks like we cant keep up with him. Its kind of how i would feel about playing against a younger Lou Williams. Like even though he isnt a starter, he can gets buckets and run up the score."
He was a -1 in a 14 point loss. Check the Defensive rating with him Off the court. There’s a reason dudes like Lou Williams and Jamaal Crawford aren’t all stars. The game has two sides
And there is no way Gallo and Lou Williams don't absolutely dwarf shake Milton and Tyrone maxey lol
Ty Lue deserves way more credit than he gets.   Doc would have happily continued to play Trez and Lou Williams against the mavs to lose. And if we somehow made it this far he would never have made these adjustments.
|Rk|Player|Date|Per.|Opp|FG|FGA| |-:|:-|:-|:-|:-|-:|-:| |1|Bradley Beal|2021-02-05|H1|MIA|0|12| |2|O.J. Mayo|2008-12-30|H2|PHO|0|12| |3|Shareef Abdur-Rahim|1997-01-14|H2|LAL|0|11| |4|Shareef Abdur-Rahim|1999-02-16|H2|LAC|0|11| |5|Chucky Atkins|2001-03-20|H2|UTA|0|11| |6|Rodney Buford|2002-03-09|H2|MIA|0|11| |7|DeMarcus Cousins|2016-01-30|H2|MEM|0|11| |8|Robert Covington|2018-11-24|H1|CHI|0|11| |9|Michael Finley|2002-02-19|H2|MIN|0|11| |10|Allen Iverson|2000-02-20|H2|LAL|0|11| |11|Michael Jordan|1997-05-26 *|H1|MIA|0|11| |12|Shawn Marion|2003-02-21|H1|TOR|0|11| |13|Kristaps Porzingis|2017-12-21|H1|BOS|0|11| |14|Antoine Walker|1998-02-17|H1|SAC|0|11| |15|Antoine Walker|1999-03-21|H1|CHI|0|11| |16|Russell Westbrook|2008-11-12|H1|ORL|0|11| |17|Lou Williams|2019-12-09|H2|IND|0|11|   Provided by [Stathead.com](https://www.sports-reference.com/sharing.html?utm_source=direct&amp;utm_medium=Share&amp;utm_campaign=ShareTool): [View Stathead Tool Used](https://stathead.com/basketball/quarter_finder.cgi?utm_source=direct&amp;utm_medium=Share&amp;utm_campaign=ShareTool) Generated 6/14/2021.
I'll never understand why you guys wanted him over Lou Williams
Lou Williams being unable to score against Dwight is telling of how bad he is nowadays.
*skip to my lou williams gets a ring if/when LAC win the title this year*
"Definitely both. And you're right, 35 and 33 points is 2021 Lakers territory lol.   It's not like they didn't have any playmakers either though, so it is kinda baffling how they could be so bad. Kawhi and George were both pretty limited in that regard early in their career, but at this stage, Kawhi's definitely above average and George is solid. Lou Williams was more than capable of setting others up, and Reggie Jackson isn't bad as the 4th playmaking option, but yeah, they also didn't have a top-30 playmaker in the league either. Just a bizarre set of circumstances, fit, chemistry, and choking I guess."
And Lou Williams
"Superstar, no. I see Lou Williams when Graham plays."
“Lou Williams is a professional scorer”
Yeah but the Nets are out there giving up ORebs to Lou Williams  Defensive rebounding one of the reasons they can't stop anyone
Yeah Giannis shouldn't have won the 2019/2020 DPOY because of what happens in 2020/2021.  Also I think Lou Williams should've never won 6th man of the year in his career because he's bad now.
"As my hero, Johnny Lawrence, said, “the best defense is more offense”. We should just double down on the offense. Let’s get Enes Kanter, Brook Lopez, Lou Williams, Kevin Love, Tim Hardaway Jr., Doug McDermott... can we bring back Marshon Brooks? He was always good for a bucket.   Realistically though, I'm beginning to think it'll be tough for us to fix the defense when you have Harden/Kyrie playing 30+ minutes a game. They can't guard anyone and they're getting destroyed on switches. We could have Ben Wallace or KG anchoring the D and it'll be brutal. At best, we should try to find ways to limit offensive rebounding/TOs and ways that can reduce opponent shot attempts, because they'll hit anywhere north of 45%.  Basically, if we get to shoot 5-10% more than the opponent does, then we'll probably win more than lose. Play to our strengths, Harden, Durant are good rebounders and any future PF/C we get should just be great at rebounding more than defense. Board and make good decisions should be our mantra."
Is lou williams old now?
We have two of the stupidest people on Earth on this team and their names are Lou Williams and Ivica Zubac
Lou Williams has been ass tonight
Lou Williams so bad this year my god
Why does Lou Williams still get minutes on a contender lol
Lou Williams is washed up. It's no wonder the Clippers have been begging to trade him
Lou Williams iso ball is killing the second units rhythm.
Lou Williams is a washed player
How the hell did the Nets let Lou Williams get that rebound? That stuff is unacceptable for a championship contending team.
Tough look for Deandre having Lou williams get a board on him and going 1-4 on FTs to end the quarter
KD really let Lou Williams run in behind him and get an uncontested offensive rebound.  That's always been a weak point of his defensively.
Lou Williams not as effective as he was 2 years back on the offense.
Nets really allowed Lou Williams to get a rebound lmao
They let Lou Williams grab the rebound lmao
"So lou williams, D rose, steven adams.   I'll say d rose doesn't fit but I genuinely believe he is impossible to hate."
He could be a lou williams microwave bench scorer type of guy if he can keep this up
Pleasant: Ty Lue  Unpleasant: Lou Williams
He’s not terrible...at all. Lol he’s actually been playing better than Lou Williams this entire season. He’s usually not in our regular rotation but at this rate he might have to be
"potentially  i think RJ definitely showing he's a legit starting two  IG has potential  some have pointed out he's more of a lou williams, i kinda agree  but think he can still grow as a playmaker and could be a legit starting pg for a playoff team   especially in the east  and especially depending on who they get going forward, if you get a lebron/luka type who can drop 6-10 dimes a game not in the pg spot, then i think he's even more likely to   (obviously that's not too likely, just saying- depends on how rest of roster is)"
"# [Yesterday's Game Thread Index](https://www.reddit.com/r/nba/comments/l9buc1/sunday_stats_thread_game_thread_index/)  # Top Highlights:  0. [[Highlight] Westbrook and Beal put the Wizards up 1 with 4.3 left](https://streamable.com/lhuekc) | [(Comments)](/r/nba/comments/l9sih0/highlight_westbrook_and_beal_put_the_wizards_up_1/)  0. [[Highlight] Knicks rookie Immanuel Quickley to Lou Williams: “You were one of my favorite players.”](https://streamable.com/ixuidb) | [(Comments)](/r/nba/comments/l9k8ng/highlight_knicks_rookie_immanuel_quickley_to_lou/)  0. [[Highlight] Klay after being a quarter late to joining the Warriors broadcast: ""I've got about 8 unanswered Bob Fitzgerald text messages."" Warriors color analyst Kelenna Azubuike: ""I texted you too, I didn't get a reply back!"" Klay: ""I don't have your number bro, sorry.""](https://streamable.com/o38cii) | [(Comments)](/r/nba/comments/l9g9et/highlight_klay_after_being_a_quarter_late_to/)  0. [[Highlight] Mike Breen offers some comforting words as PG looks in bewilderment](https://streamable.com/262etp) | [(Comments)](/r/nba/comments/l9l7xk/highlight_mike_breen_offers_some_comforting_words/)  0. [[Highlight] Aaron Gordon with a cheap shot on Kyle Lowry](https://streamable.com/odaezr) | [(Comments)](/r/nba/comments/l9qmr7/highlight_aaron_gordon_with_a_cheap_shot_on_kyle/)  # Day in the history:  ### Saturday, February 1, 2020  Damian Lillard of the Portland Trail Blazers scored 51 points in a 124-107 win over the Utah Jazz.  ### Thursday, February 1, 2018  Russell Westbrook of the Oklahoma City Thunder dished out 21 assists in a 127-124 loss to the Denver Nuggets.  ### Wednesday, February 1, 2012  Serge Ibaka of the Oklahoma City Thunder blocked 10 shots in a 95-86 win over the Dallas Mavericks.  Daily Discussion Thread : [Rules](https://www.reddit.com/r/nba/wiki/rules#wiki_daily_discussion_thread)"
Lou Williams then proceeded to whoop the Knicks ass after that.
"Lou Williams is the best player I ever played against in high school. He had a way more athletic game back then, played above the rim. Probably the best high school player in the history of Georgia basketball. Everyone thought he was literally the next Kobe, he has somehow underperformed in the minds of a lot of Atlanta folks who saw him at South Gwinnett, that’s how freakishly good he was back then."
"""Were""?  Isn't Lou Williams like 19 years old?    What year is it?"
"""What do you mean *were*?""  -Lou Lemmon Pepper Williams"
"Didn't know about that. First thing upon Googling: ""Lou Williams runs triangle offence with 2 women"". Lol"
Lou Williams one of everyones favorite players
"The context though is that it's a rookie that's less than 20 games into his NBA career saying that... to a 15-year NBA all-time great. So it's one of those like starstruck moments ""I looked up to you while I was learning to play ball"" kind of moments and I think it's obvious to Lou   Not to mention, it's Lou Williams. He gets league wide respect from everyone lol"
Lou Williams has to be the most underrated player ever. The league knows he’s the truth but  most fans will never see him as more of a sixth man
"&gt; This was back when he was with the Sixers in 2011. He’s driving his car in Philadelphia on Christmas Eve. He stopped at a light, and a gunman comes up to rob him. Knocks on the window, ready to rob him. And Williams talked him out of it. Part of talking him out of it was he told him who he was. The gunman apparently said to him, ‘Yeah, you do a lot for this community.’ And decided not to hold him up. Williams then had him get in the car, and he took him to McDonald’s. And had a nice, long chat with him about life and what’s going on. Pretty incredible.  https://ftw.usatoday.com/2019/03/lou-williams-gunman-robbery-story-breen-nba-clippers"
I’ve never really thought about using him this way. It makes a lot of sense. He could be like a slightly more efficient Lou Williams with more range and playmaking ability.
"Lou ""Pawghunter"" Williams"
Conley x Lou Williams
They don't and the wizards obviously want good from they have no reason to get lou williams or pat Bev even trading them would get less that just straight up trading beal for picks
"You only need 22.4m to match 28m in salary, Pat bev and Lou Williams get them pretty much all the way there for matching.  Not sure about the Clippers' picks situation but it wouldn't surprise me if they actually have some tradeable picks once the offseason hits."
Notice how I said if defense is not an issue. There is no Trezz so the Clippers don't have a traffic cone on defense anymore. Also Lou Williams minutes have been significantly cut down as they have another plus defender in Batum.
"Do manu ginobli, jamal Crawford, Lou Williams or (maybe) Lamar Odom count? This is off the top of my head, so I don’t actually know if they made it to the game in a year they were 6th man, but feel like one of them had to right?"
"&gt; steph underperformed so they threw everything at stopping KD  Steph AVERAGED 25-7-5 on 71% TS in that series, 71%. They threw ""everything"" at KD, i guess everything was 9 inches shorter Patrick Beverley and Lou Williams.  &gt; steph also underperformed in the HOU series  Steph underperformed so much that when KD went down he carried Golden State to back to back wins and a 4-2 victory.  &gt; it was KD winning them games, hate to break it to u  KD was the best player on a team that without him still went to the Finals and was a Klay Thompson injury away from beating the Raptors. He was sensational, probably the best player in the league, but to act like there was no comparison between his 2019 version and Kobe in 2013, it is laughable."
"AD isn't a wing and is the best lob threat in the league, so of course his assist rate is higher lol. That's basic basketball. You keep using exceptions and act like that disproves trends. Hunter is generally considered a role player due to both his counting stats, his advanced stats, and eye test. It's not simply ""durr 2 numbers determine who a player is"" - it's a bunch of factors coming together. Hunter can work his way out of being a role player the same way Jaylen Brown did.   The Rockets and 7-9 and the Hawks are 9-9, but Eric Gordon's stats don't count and Hunter's do? Let's try to not be so biased here. The Hawks aren't some team kicking ass out here either.   You can be a 6man candidate and be a role player. That's been Lou Williams entire freaking career. Clarkson is a bona-fide role player - has been his whole career. Same with THJ - he's still a role player who had to step up due to injuries.   I think ultimately, our ideas of role player is quite different."
"He really wasn't *that* good, people only mention him because his play style was ahead of his time. But if you take a guy whose play style is ahead of his time and move him forward in time, then he's just another guy.  If you subtract out the shortened three point line seasons, he shot 30.7% from three for his career. If he focuses more on that part of his game then he would be an above average shooter, but not some lights-out guy. He was tiny and would have been an absolute liability on defense in today's NBA. His best case scenario today would have been a Lou Williams type 6th man role, 16 ppg at his peak. He would have been more of a regular season player, but not good enough to be a major contributor in the playoffs when teams gameplan around attacking defensive weakpoints."
"And that’s why he retired. Iverson could’ve given The Grizzlies, Pistons, whoever 20 minutes a game somewhere between Trey Burke and Lou Williams. But he didn’t want to do that."
If the Clippers can build a playoff team around Lou Williams I'm pretty sure there's a way to build a good team around Bradley Beal.
