"He's not wrong. When you're a defensive liability who can put up a ton of points, that's a perfect 6th man. Is there any serious difference between CJ and prime Lou Williams or Jamal Crawford?"
Lou Williams and Ben Gordon are the two names that get throwing around our sub a lot.
Demar Derozan &gt; Jamal Crawford &gt; Lou Williams
"100%. I’ve been saying for a while, that’s the role Coby is best suited for. I can seem him having a nice career in a Lou Williams style instant bench offense role."
"its a shame more guys dont wanna play in Canada, I remember Lou Williams winging about having to get a Canadian bank account."
"They should’ve traded him back when they lost to the Celtics in like 2018 where he had a 1 point playoff game. Or after 2019 when Jimmy Butler and Embiid carried his bum ass against Toronto as he did nothing to contribute. After another playoff choke job by Ben teams don’t care about his fraudulent “all around” stats because the impact isn’t there. His value has plummeted because every can’t even be in late close games shooting less than 40 % from the line in the playoffs. He won’t even attempt a mid range let alone a three. The Sixers are stuck with this overrated “PG” because of his max contract. They should’ve traded him back then when teams though they could fix him. He only has confidence on social media and in open runs that’s the only time he’ll shoot. Defense wasn’t so great either. Trae, Huerter, Collins, and Lou Williams all went right at him in games 5 and 7. They’re stuck in 2nd round mediocrity with him. The process failed!"
"Lemon Peppa Lou (Williams), Red Velvet (Kevin Huerter), Ice Trae, John The Baptist (Collins)   Can you guess i’m a Hawks fan? Lol"
"Some of it is borderline hilarious at this point.  I remember my roommate had a podcast on and they were talking about whether or not Lou Williams is a good defensive player. And one of the arguments was that if you look at his defensive analytics numbers with Kawhi and Paul George on the floor, he’s an above average defender….  I almost fell out of my chair because I’m pretty sure with Kawhi and PG on the floor I’d be an above average defender analytics wise too."
What if it were one way defensive vs one way offensive  Ex:  Tony Allen vs Lou Williams   Ben Wallace vs Amare Stoudemire
He pretends to be Lou Williams until the contract is signed. Then he finally reveals his true identity.
No but a healthy Trae young probably does more damage then 40 year old lou williams trying to create offense in a playoff game while trae young is holding his leg in the corner  God the bucks run was so funny
A sixers fan of all people should see the value in having secondary ball handlers who can take pressure off the #1 option and help exploit mismatches in the post season.  We were able to run a lineup with Lou Williams Gallinari and Trae that completed a massive comeback because the 76ers did not have a reliable 2nd option that could take advantage and Embiid was so totally gassed he couldn't score even from the line at the end if the game.
LeBron  MJ  Isaiah Thomas  Lou Williams Chris Paul Dwyane Wade Al Horford Paul Millsap  Muggsy Bogues DeMar DeRozan Tony Parker
"Hawks for sure. Collins, Bogie, Hunter and Lou williams can be counted to make shots anytime, and Capela is a reliable and defender who doesn’t need the ball to be impactful."
LOL i just remembered LOU WILLIAMS past the 1st round faster than the clippers. hahaha
Can’t believe Atlanta gave up Playoff Rondo for Lou Williams.
"Not really. He made the right move to stagger Trae and Bogdan after game 2. After that there's not much else you can do when Gallo and Lou Williams, your dedicated 6th men underperform. Especially Gallo.   Idk about too long. The Knicks just had a better bench."
The Knicks should have gone for LOU WILLIAMS or EVAN FOURNIER! Or someone who understands offense is a thing!
"Depends how you define ""clutch.""  Since 1997, 25 players have taken 500+ shots in the final 5 minutes of a game that's within 5 points. Here they are sorted by eFG%:  |Rk|Player|FG|FGA|3P|3PA|eFG%|%Astd| |-:|:-|-:|-:|-:|-:|-:|-:| |1|Al Horford|271|518|39|105|.561|.782| |2|Shaquille ONeal|331|594|0|0|.557|.565| |3|Steve Nash|405|887|139|353|.535|.207| |4|Shawn Marion|337|694|47|122|.519|.700| |5|Anthony Davis|269|549|26|93|.514|.714| |6|Stephen Curry|341|810|143|405|.509|.355| |7|Chris Bosh|312|659|43|109|.506|.612| |8|LeBron James|906|1995|207|639|.506|.251| |9|Reggie Miller|265|683|142|392|.492|.777| |10|Ben Gordon|258|619|93|231|.492|.453| |11|Jason Terry|436|1031|140|384|.491|.466| |12|Al Jefferson|325|667|2|10|.489|.489| |13|Ray Allen|519|1287|217|618|.488|.534| |14|Lou Williams|262|636|96|265|.487|.363| |15|Kyrie Irving|356|822|85|266|.485|.233| |16|Karl Malone|307|637|2|11|.484|.782| |17|Pau Gasol|370|776|9|26|.483|.505| |18|Rashard Lewis|260|630|85|251|.480|.612| |19|Chris Paul|502|1136|84|264|.479|.120| |20|Manu Ginobili|284|686|88|282|.478|.521| |21|Damian Lillard|386|952|138|415|.478|.262| |22|Andre Iguodala|291|674|59|214|.476|.488| |23|Jrue Holiday|264|619|59|175|.474|.254| |24|Tony Parker|451|999|44|129|.473|.299| |25|Kawhi Leonard|216|509|45|151|.469|.347|   Provided by [Stathead.com](https://www.sports-reference.com/sharing.html?utm_source=direct&amp;utm_medium=Share&amp;utm_campaign=ShareTool): [View Stathead Tool Used](https://stathead.com/basketball/shot_finder.cgi?utm_source=direct&amp;utm_medium=Share&amp;utm_campaign=ShareTool) Generated 6/2/2021."
"Depends how you define ""clutch.""  Since 1997, 25 players have taken 500+ shots in the final 5 minutes of a game that's within 5 points. Here they are sorted by eFG%:  |Rk|Player|FG|FGA|3P|3PA|eFG%|%Astd| |-:|:-|-:|-:|-:|-:|-:|-:| |1|Al Horford|271|518|39|105|.561|.782| |2|Shaquille ONeal|331|594|0|0|.557|.565| |3|Steve Nash|405|887|139|353|.535|.207| |4|Shawn Marion|337|694|47|122|.519|.700| |5|Anthony Davis|269|549|26|93|.514|.714| |6|Stephen Curry|341|810|143|405|.509|.355| |7|Chris Bosh|312|659|43|109|.506|.612| |8|LeBron James|906|1995|207|639|.506|.251| |9|Reggie Miller|265|683|142|392|.492|.777| |10|Ben Gordon|258|619|93|231|.492|.453| |11|Jason Terry|436|1031|140|384|.491|.466| |12|Al Jefferson|325|667|2|10|.489|.489| |13|Ray Allen|519|1287|217|618|.488|.534| |14|Lou Williams|262|636|96|265|.487|.363| |15|Kyrie Irving|356|822|85|266|.485|.233| |16|Karl Malone|307|637|2|11|.484|.782| |17|Pau Gasol|370|776|9|26|.483|.505| |18|Rashard Lewis|260|630|85|251|.480|.612| |19|Chris Paul|502|1136|84|264|.479|.120| |20|Manu Ginobili|284|686|88|282|.478|.521| |21|Damian Lillard|386|952|138|415|.478|.262| |22|Andre Iguodala|291|674|59|214|.476|.488| |23|Jrue Holiday|264|619|59|175|.474|.254| |24|Tony Parker|451|999|44|129|.473|.299| |25|Kawhi Leonard|216|509|45|151|.469|.347|   Provided by [Stathead.com](https://www.sports-reference.com/sharing.html?utm_source=direct&amp;utm_medium=Share&amp;utm_campaign=ShareTool): [View Stathead Tool Used](https://stathead.com/basketball/shot_finder.cgi?utm_source=direct&amp;utm_medium=Share&amp;utm_campaign=ShareTool) Generated 6/2/2021."
"Best 3P% in the final 30 seconds of games within 5 points (since 1997, heaves excluded, minimum 70 3PA):  |Rk|Player|3P|3PA|3P%| |-:|:-|-:|-:|-:| |1|Ray Allen|41|120|.342| |2|Paul Pierce|40|130|.308| |3|Vince Carter|31|104|.298| |4|Chauncey Billups|24|81|.296| |5|Kevin Durant|33|118|.280| |6|Damian Lillard|27|97|.278| |7|Lou Williams|20|72|.278| |8|Jason Richardson|20|74|.270| |9|Stephen Curry|20|74|.270| |10|Jamal Crawford|24|91|.264| |11|Jason Terry|21|81|.259| |12|Dirk Nowitzki|19|74|.257| |13|Mike Bibby|19|77|.247| |14|LeBron James|40|166|.241| |15|James Harden|18|76|.237| |16|Reggie Miller|20|88|.227| |17|Kobe Bryant|42|189|.222| |18|Steve Nash|16|74|.216| |19|Andre Iguodala|14|70|.200| |20|Baron Davis|15|75|.200| |21|Carmelo Anthony|18|91|.198| |22|Paul George|15|76|.197| |23|Joe Johnson|19|98|.194| |24|Jason Kidd|19|107|.178| |25|Russell Westbrook|21|121|.174| |26|Dwyane Wade|13|83|.157|   Provided by [Stathead.com](https://www.sports-reference.com/sharing.html?utm_source=direct&amp;utm_medium=Share&amp;utm_campaign=ShareTool): [View Stathead Tool Used](https://stathead.com/basketball/shot_finder.cgi?utm_source=direct&amp;utm_medium=Share&amp;utm_campaign=ShareTool) Generated 6/2/2021."
Dude's peak is hardly better than Jamal Crawford or Lou Williams.
"KD was right, CJ isn't on the level of other 2nd options and needs to be utilized as a 3rd at best, in that Lou Williams / Clarkson kind of role."
Needs a prime Lou Williams type player who can come in and create on his own so the offense isn't just dead when Dame sits.
He’s worth 8M per year — same as Lou Williams.
Payne is playing like prime Lou Williams with this bench scoring
ainge wouldnt trade picks for real players so hes definitely not adding picks just to have some take kemba.  I wonder if boston can get by with kemba on the bench with the 2nd unit and playing 20 min a game...sorta like rose or Lou Williams have done the last few years.  kemba has to accept that though
"Nah, thats false..theres been other dirty plays by the hawks as well...but we'll ignore that because ultimately i dont think either team has done anything disgraceful.  Noel is not baiting and flopping at all? He falls all the fucking time and knicks fans cant stand it...every game this year he falls down doing basic shit. IQ, hasnt really baited anything at all this entire series. he did in the regular series, but he definitely hasnt much at all this series. The guy that's done it more than anyone is Lou Williams. Guy hasnt seen an open shot that he doesnt want to pump fake and jump into."
Lou Williams?
"Kawhi has been arguably the best player in the playoffs for the last 4 seasons. Not many players in the league consistently take their game up a notch from a 24-25 ppg to a full blown 30ppg scorer while playing elite level defense. The man got hurt because of zaza but there’s a chance he single handedly dismantled the warriors that year too on the Spurs. He was the best player in the nba when playing for Toronto. He also absolutely destroyed during last years exit outside of the final game which doesn’t wipe away his entire backpacking to drive them there.   You can forget how bad PG, Harrell, Lou Williams, and pat bev played last year. That man almost had them in the conference finals with a 500 pound gorilla jumping on his back.   Kawhi has been the best player in the nba for 4 years now but he’s not popular in the media and doesn’t sell as good so they don’t push him. Enjoy and appreciate what he is if you’re a basketball fan this is the Kobe/Jordan of this era he’s just not as cool."
"That’s some interesting logic, lol. 2019 Warriors struggled against Lou Williams. They then came around and went all the way to the finals. They would’ve won easily had KD and Klay not gone down. How are you making a conclusion off 1 game."
Why rhe fuck clipps trade Lou Williams smh
"Trae young is no where near the worst defender in the NBA, he isn’t even the worst defender on the hawks, Lou Williams is much worse."
The Knicks are just missing an offensive threat like Lou Williams.  They don’t have anyone that can create their own shot very easily so the slow half court style playoff games are limiting their easy buckets compared with the regular season.
Lou Williams flair too
"Lou Williams really fell off a cliff since the Magic City incident, hasn’t he?"
lol playing Lou Williams in the playoffs
"I think Raptors fans feel mistreated enough by some of our previous stars (Carter, Bosh), plus disrespected by some random guys (Carroll, Antonio Davis, Lou Williams, Turkoglu), so when a guy who wanted to stay is traded, we go overboard in wanting them to know that we appreciated them, because it matters to us that they have positive feelings about their time here."
Drake had a song called 6 man that was about Lou Williams back when he was a Raptor
"Carmelo Anthony, Devin Booker, Bradley Beal, Trae Young, Gary Trent Jr., Ja Morant, Collin Sexton, Doug McDermott, Lou Williams, CJ McCollum, Tim Hardaway Jr."
&gt; Lou Williams  In what way?   He's been awful this year
"less efficient, way less cool Lou Williams"
Lou Williams tried it then promptly realized he didn’t have clout like that
he's not a point guard  he's a slightly better lou williams on a max
The Lou Williams strategy
"Revisionist history as its finest.  - The Milwaukee Bucks were arguably biggest favorites coming out of the East in most recent seasons &amp; made a lot of great additions to make their roster even better.  - The East being weak is a false narrative &amp; simply not true. Brooklyn Nets, 76ers &amp; Bucks were the biggest title contenders before going into this playoffs.  - Trae had much worse teammates than Luka last year, but didn't get any of those excuses. Especially when Luka had the best offense in the NBA last year and it persisted when he was on the bench. Every analyst had the Mavs above the Hawks this year, and now that Trae's team looks better suddenly Luka's team sucks and Trae is being carried by Kevin Huerter and Lou Williams."
"Not counting posts about the Hawks’ postgame, 10 posts on the front page right now are either young highlights, quotes, stat lines, teammates praising him, or his dad talking about he and Lou Williams’ relationship. It’s half if you count posts about the Hawks winning"
"Lou Will is a 3 time 6MOTY (imo that's a much bigger achievement than winning a chip as the 4th option).   Yeah Rondo has 2 rings but let's not forget he was playing with legends like LeBron and KG.  If you look at their stats in these Playoffs, Rondo has on overall Box(+/-) of -22. Lou Will on the other hand has a Box(+/-) of 0.  Lou Will has scored more points, steals, played fewer minutes despite being available for more games. Most importantly Lou Williams has been instrumental in winning games.  Rondo can create shots for others, not for himself. Lou Will can score at will.   It depends on the requirement as they have different playstyles, but as a Hawks fan I'll take Lou Will in these Playoffs over Rondo who didn't do well with us."
For sure. Lou Williams is a savant and connoisseur when it comes to the Atlanta strip club scene. He probably bestowed Trae with all his knowledge so now he’s pleased and has an extra bounce in his step.
Trae Young &gt; Greek Cheeks  John Collins &gt; Trash Money  Lou Williams &gt; Jrue ISuckToday  Hawks in 4
"Off the top of my head of guys who actually get some minutes: Conley, Garland, Sexton, Lou Williams, Patrick Beverley, Shroder, Conley, Patty Mills  &amp;#x200B;  And there's a lot more, but i don't want to google it."
"Rajon Rondo, Lou Williams, Dennis Schroeder, Mike Conley, Patrick Beverly, Darious Garland, Devonte Graham……. Plenty of guys. The hawks have had 3 guys of these guys on our team alone"
"Loool u think trae isn’t surrounded by good players? He got bodganovic a three point shooter, Collins athletic player, Capella a strong defensive player and Lou Williams on the bench a good sixth man. Meanwhile Luka is stuck with porzingis who is just a fragile 7 foot who refuse to post up and just shoot 3 like a shooting guard."
Who woulda though bogdonavic Lou Williams and Gallo were the different between a shitty team and a ecf
"I'd say Andre Drummond, Hassan whiteside, Lou williams are some empty stat players"
Lou Williams is officially closer to the NBA Finals than his former team the Clippers.
Lou Williams gonna do playoff Lou Williams stuff
"&gt;Arenas and Lou Williams put it somewhat like this, ""If you had a time machine and could drop LeBron (or Durant for that matter) a few decades back, he would easily average 60  And if Jordan had a time machine to access today's medicine, PEDs, nutrition, physical training and even better shoes? What if he was able to get all of this and more than hitch a ride back in his time machine?   he would easily average 60"
Lou Williams can be really bad. But he can also be really good.
"Obviously. I love how objective Kerr is throughout the years. I've been watching NBA since the mid 80s fanatically.  Jordan was by far the best player of his generation and he is the greatest basketball player ever, but definitely not the best skill wise.  He turned the NBA global and super-commercial. No other US athlete had managed something like that in the worldwide stage. That's why he is the most important player ever for the game. But the best? Not even close.  The level back then was very low compared to the modern NBA. He could barely hit a three and didn't improve much even though he tried. And we won't even talk about his super selfish character. He wouldn't survive today being so egocentric.  Even he admitted in 2001 that his career wouldn't be the same if zone defenses were implemented earlier.  Arenas and Lou Williams put it somewhat like this, ""If you had a time machine and could drop LeBron (or Durant for that matter) a few decades back, he would easily average 60""."
Were there any big roster changes after Nate took over? Like did they add/subtract any new pieces outside of Lou Williams or change any major rotations?
"But normally contending teams are the only ones motivated to take on a veteran player borderline star player like this. Even then, the only role I really see Kemba fitting into on a good team would be the backup PG/scorer, similar to how Lou Williams was used on the Hawks...thats not that valuable of a role, especially for $36/37 million&gt;  A) If a team needs a PG, then they better be contending or else it would make no sense in taking on Kemba's contract.  B) If a team can take the dead money, that would mean that the Thunder are the ones compensating another team then? Give them picks to take Kembas contract off their hands? That seems backwards to the Thunders strategy  C) This is no one, no one wants his presence for $30+ million a year. Not sure what you were envisioning here."
Cameron Payne looks Like a young Lou Williams
"Good. Watching Harden and guys like Lou Williams not even try to score, but manipulate a foul call makes me so bitter. Ruins the integrity of the game. They should also have a post-game flop review committee that reviews possible flops missed by the refs during the game. If found guilty for flopping, they can get a post game fine or a post game tech that is added to their season total"
"Yeah, we've improved a lot in that department since the early days, that's for sure LOL  Not everyone is Lou ""Magic Kingdom"" Williams, thankfully. Toronto is a genuinely great place and I'm really happy more dudes are starting to realise that. Now if only it were cheap enough for normal Joes to live in haha"
It's rare that a player says something negative about a coach in public... even when the coach is terrible. Doc had a reputation for being good when Kawhi was signing because he took the Warriors to 6 games when his best player was Lou Williams.
"Announcer : The Las Vegas Harems are here tonight. James Harden, Lou Williams taken in during expansion."
"That's not all the way fair. Morey only traded for 2 established superstars in his tenure w/the Rox, CP3(awesome) and Russ(not awesome). D12 was a free agent, and Beard wasn't a superstar when we traded for him. So which players did he trade that you cared about so much, and which superstar did you not want?  Unless you're yearning for the days of the post-TMac/Yao era of the treading water Rox, then you can't hate on the Harden trade at all if you even want to count that one. FWIW I loved Scola, Brooks, KMart, Chuck, KLow, Dragic, etc.  1. In order to get CP3, Morey traded Patrick Beverley, Sam Dekker, Montrezl Harrell, Darrun Hilliard, DeAndre Liggins, Lou Williams, Kyle Wiltjer, a future first round pick, and cash considerations. I still adore Pat Bev and Trezz, and I got love for LouWill, but that CP3 trade led to the greatest non-Hakeem led team in franchise history. It's undeniable that trade was amazing, and even if you hate CP3, it was the best move for the team. I cared more about team success at that point than how much I missed Pat Bev and Trezz, and I became a CP3 fan.  2. I agree with you on the Russ trade tho, and I hated it in real time but tried to stay positive. We all saw how that worked out, and I still miss CP3. But that trade was on Frittata and Harden 100%, and I can't be convinced Morey wanted Russ especially at the cost of those picks. It is what it is, but Morey makes moves to get better, and he's generally on point unless the owner is a cheap bastard who takes out $200 million loans at like 35% lmao"
"Educating us by acting like popularity contest allstar appearances are more important than being able to stay on the floor at the end of playoff games, sure lol.  Dude had 32 year old Gallinari, Lou Williams, and Trae Young on him in game 5 and he didn't even attempt a single shot. Thats..not good lol"
What does Lou Williams have to do with Chris Paul though? How are they connected? If Kevin love got suspended you wouldn’t say this
"But people do sag way off Thybulle and don’t try and follow him. He stands in the corner waiting for wide open 3’s. Not to mention he couldn’t score on Lou Williams.   I never said CJ is a trash playmaker either. I said he isn’t a “very good playmaker” which is a clear cut fact.   Looks like you didn’t even make an attempt to read what I typed. Makes sense since you didn’t even successfully refute a single thing I said  Also use midrange stats, not distance. KD routinely beats CJ in midrange shooting. Embarrassing to use 3-10 and 10-16 as mid range when a lot of that are shots in the paint. Just shows your understanding is worse than initially suggested.    Thanks for proving that you don’t know what you are talking about!"
"Yep, and we've seen a big improvement since Lou Williams came over in the trade as his mentor. Really is a whole different player from the 1st half of the year to the second half."
No way is Game 5 solely on him. Fucking doc had around 15 mins of game time to adjust.  Lou Williams of all people started that whole run and never did he get defensive pressure
Lou Williams suffered an acl injury and was out the whole year. What in the fuck are you smoking?
"Casual take.   1-People need to understand that while the west is deep, outside of the 2 LA teams none of these teams overwhelm you with star power.  Utah is a 1 star team. Phoenix is a 1 star team with an aging quasi star CP3. They are what we hope for, they are winning based on chemistry and coaching, not just overwhelming talent. So that can be matched.   That’s the Hawks as well. The Hawks in my book are every bit as good as Phoenix and Utah and those are top seeds. The Hawks would smoke the Clippers (without Kawhi) and I’d take them over Phoenix too. Why?…  2- I said this even before the  lseason started that they were a ‘year 3 leap’ from Trae away from being really dangerous. Their vet signings were a home run and pound for pound as good as anyone’s: Bogi, Gallo, Lou Williams, Capela. The latter 3 have been on nothing but good teams in recent years   Then what separates them is their young guys which give them depth: Huerter (who shocked everyone but was already known to those in the know), Hunter, don’t forget Reddish, even Okongwu is better off raw talent than most teams’ 10th man.   3- Anybody should have been able to see that if Trae somehow became efficient, he would pose a lot of the same issues that teams have with Steph. Having to guard 40ft out, the threat of both the floater and the lob on the pick n roll. And then you surround him with 3 other not good but great shooters at all times . This is not a surprise"
Lou Williams 34 though.  What are they gonna do when he retires?
"But you said few guys used the midrange and it’s pretty clear that’s not the case. An assortment of guys is relying on the midrange to score more than Booker is.  Guys these playoffs averaging more midrange attempts than restricted area attempts include Embiid, Middleton, Westbrook, Randle, Tatum, CP3, Butler, CJ, Kyrie, Dragic, MPJ, Melo, Bogdan, Ish, Hunter, Marcus Morris, Gallinari and a whole lot of others  More midrange than three include: KD, Embiid, Westbrook, Butler, CP3, Rose, AD, Ish, Lou Williams, Tyler Herro, Tyrese Maxey, and Jabari Parker among others.  It’s just not accurate that Booker is one of the few players with a midrange game."
I liked it when it was 'how the fuck are we struggling to score when they're running Trae Young and Lou Williams'
You talking about the guy Lou Williams blew past to the bucket in the 4th quarter last night?   His defense is painfully overrated.
"He's the best shooter but he also got absolutely abused by Kevin Huerter on defense in Game 7. I just dont think you could theoretically play him and McCollum together in a playoff game, he would be a great option off the bench but I'm not sure if he would want to accept that role. Then again, the Hawks did just play Trae Young and Lou Williams together for stretches this round but that just said more about the Sixers abysmal scoring than anything."
"People take the narrative of “Lou Williams sucks in the playoffs” and then continue with it even when the player showed up  Williams helped the hawks win the series, no doubt about it."
Eh; it was Lou Williams two games before.   Whoever gets hot was being out on curry and doc didn’t adjust.
"This is crazy I just looked up the stats for that game and the Timberwolves held Trae Young, Kevin Heuter, Clint Capela, Danilo Gallinari, Bogdan Bogdonavic, Lou Williams, Oneyeka Okongu, and John Collins to 10 points combined that game.  It's almost like they are two completely different teams and at that time the Hawks did suck."
