"&gt; He's looking like what Fultz should've been.  No…not at all. I swear this sub just puts together the most random basketball statements and then think that people are going to agree with them. Fultz was billed as a three level scorer with draft comparisons of Harden/DLO. Maxey was billed as a future 6 man similar to Lou Williams. Fultz is 6ft 5 with a 6’ 10” wingspan and great court vision. Fultz shot 41% from 3 in college, Maxey shot 29%. Fultz had twice as many assists/game as Maxey and was more efficient with 9 more ppg on similar minutes.   You’re either misremembering what Fultz was billed as or you’re overestimating what Maxey can do. I watched at least 15 of his college games and a solid half dozen of Maxey’s and they are two completely different players outside of their ability to get to the rim."
Dennis is getting paid 900k more than Lou Williams. Even if he flames out it's worth it because the Celtics 2nd unit is basically the Maine Red Claws.
"Yep.  Jamal Crawford got it over him shooting 40.4% from the field and 34% from 3 for a whopping 14.2 ppg, 1.8 rebounds and 2.3 assists and a -1.4 on/off.  Crawford wasn't even top 5 bench players that year.  Lou Williams did almost the exact same thing but slightly better in every way.  Ridiculous."
Dude fuckin flat out scores. He can give you the same thing Lou Williams is doing at this point. Sure that’s not highly valued but it deserves a spot on a team
Curry is a plus defender. Wiggins is a plus defender. Draymond is a top 5 defender. We can slot Luke Garza and Lou Williams in those last two spots and we still wouldn’t be the worst defense in the league.
"who was the 2nd best player on the lakers those years?Nick young, young randle and d'angelo, lou williams, fucking robert scare? if you're not making the playoffs, fuck it try to get the most points til you retire."
"I can't imagine that's still a thing. They earn so much more now, they are way better advised and I would imagine they are a little bit more privat nowadays since the glaring eye of social media (not falling to every gold digger around etc). Also it's really hard to reach that point without being super disciplined these days.  Guys like Lou Williams and James Harden kind of relevate the last two points, but I hope you see where I'm coming from.  I heard that fun fact in the 2000s the first time when guys like Toine and AI went broke, so I guess the actual source for it is kind of old."
"Isaiah Thomas is a bad locker room guy unlike Lou  He kinda hurt his rep coming into Cleveland, coming back 70% then publically critiquing the teams  and coaching while playing some of the worst defense in the league with the Cavs slumping. Then the whole D Wade / IT vs K Love thing  Also Lou Williams really never was in a position to command a massive contract like IT. If IT was on a $8 mil deal or something, he would still be in the league"
"Is this guy not good enough for a minimum contract in the NBA?  &amp;#x200B;  I don't get it. He looks fit and healthy, and I thought health was the only thing stopping him from being an NBA player.  &amp;#x200B;  I thought there was still a spot in the league for offensive spark plugs off the bench, even with suspect defense. I mean... Lou Williams still has a job."
"Well we do in reality, Delon Wright is a bigger, more physical guard who will presumably be the backup and Lou Williams is, well, Lou Williams.  Cooper likely won’t play much barring injury."
How much do u honestly think he’s worth inconsistent guards usually aren’t paid very well I always felt like Lou Williams was underpaid and I’d certainly take Lou Williams over him any day of the week. I don’t even think he was worth anything close to the 84million they offered him.
"Imo an empty stats player is basically just someone who puts up good looking stats, but makes up for it by either being super inefficient, or by being a turnstile on defense. I think Lou Williams would fit the bill if he was a starter and got more minutes. I think his role as a bench scorer allows his scoring to outweigh his issues on D.  The obvious choice for this question is Andre Drummond, but since you said no centers, I'm having a difficult time coming up with a good example off the top of my head. Guys no longer in the league who fit the description are Monta Ellis, Jamaal Crawford, etc."
Usually any dude who scores over 10ppg but utterly refuses to play defense.  Like Jeremy Lamb or Oubre types.   Maybe even someone like Lou Williams
I remember when I thought Carsen Edwards was gonna be a Lou Williams-esque sixth man after his first year in summer league…
"Seriously, 34yo Lou Williams signed for 5m iirc."
"Yeah, the Sixers sure punished the Hawks lol, even Trae and Lou Williams were getting minutes together"
Great to see. His floor rn is Lou Williams which is amazing already. Lou averaged 12.8ppg when he was 22. That’s something IQ could easily do
"They're the underdog team in their own city but are not wholesome enough to vibe with it. Lou Williams was culture changing when he was there. Paul George honestly is kinda empathetic he might change it. But with Chris Paul and those guys the chippyness wasn't a champion level style. It was like warning track power. Angry enough to whoop ass and get there, but not resilient enough to climb over the challenge when the board tipped against them.  Doesn't help that Balmer doesn't know what humble pie is. more like do coke and go for the thighs."
Do you think a relatively successful outcome for someone like that would be a bench guard kind of role? With the very best possible outcome being continued development and ending up in a Lou Williams or Jordan Clarkson kind of role?
IT doesn't want to be Lou Williams.  He still fancies himself an All-Star and that's a big part of the problem.  If he'd be totally cool with a 10 minutes a game backup PG role and a commensurate borderline vet min contract then he could be a great veteran bench guy for most teams in this league.  But he needs to be totally happy with that and accept playing within his role.
"I mean, Gilbert Arenas just took a steamy shat on the Raptors a few days ago lol. And Lou Williams last year, Kawhi's family during free agency, etc. It's definitely not something that's long in the past."
&gt;none of his teammates deserve blame.  Clint Capela: 3-11  Eric Gordon: 2-9  Ryan Anderson: 0-6  Lou Williams: 3-7  Sam Dekker: 2-6
Lou Williams   I’m legit surprised he never got a fat contract his entire career
Dollar store Lou Williams or Jamal Crawford
Player comps for the last 2 years:  Jason Kidd = Rondo Shawn Marion = Iggy Tyson Chandler = Montrez Harrell Jason Terry = Lou Williams
"I'd say Melo is currently similar to Kidd in that they're an older respected, former all-star, but not nearly as good of a player as he once was. Completely different positions but similar in situation.  Terry is lou Williams? Just a respected team player who can get hot and score in bunches?"
"When LeBron and AD were out the Lakers were a below average team. When LeBron got hurt the Lakers were 28-13, and they then proceeded to go 9-17 over the next few weeks. He could probably be a starter for a bad team, so I guess if some bad team has nobody else then he could start for you at point guard, but he's never going to be the answer as a starting PG for a good team.   The reason he's more suited for a bench role is because he's got too many holes in his game. There's some things he does well, but there's things he does poorly too. He's more in the vein of a Lou Williams, Jamal Crawford kind of player, who is just better suited to playing with a good second unit than being a weak link with a good starting 5. He'd be one of the better backup PGs in the league, but would be one of the worst starting PGs. So if you're an NBA team you need to ask yourself which role you'd rather have him fill."
"When LeBron and AD were out the Lakers were a below average team. He could probably be a starter for a bad team, so I guess if some bad team has nobody else then he could start for you at point guard, but he's never going to be the answer as a starting PG for a good team.   The reason he's more suited for a bench role is because he's got too many holes in his game. There's some things he does well, but there's things he does poorly too. He's more in the vein of a Lou Williams, Jamal Crawford kind of player, who is just better suited to playing with a good second unit than being a weak link with a good starting 5. He'd be one of the better backup PGs in the league, but would be one of the worst starting PGs. So if you're an NBA team you need to ask yourself which role you'd rather have him fill."
"Seeing CP3 and Lowry balling out at their age gives me hope. Maybe a better comp is Lou Williams coz he's skinny like PM. Whatever, I think he'll be there.  Also wouldn't surprise me at all if he just retires and does humanitarian stuff in Aus after his next contract. He's just that type of dude."
Lou Williams is named after a flavor of wing from MAgic City because of how much he stripped there
"Embidd was the obvious pick, he was thought of as possible number 1 pick if not for his injury.    Simmons was consensus 1st  pick.  Tatum neither him or colangelo drafted, so don’t know how Hinkie gets credit for it.    Noel, was an ok pick,McCollum, giannis and gobert were all in this draft, though. So it’s not like he hit a home run.   One thing I noticed is they got hosed in the Bynum trade. They trade iggy and vuc and a 1st round pick for Bynum, Jason Richardson.  They had a promising team with vuc, Thad, iggy, jrue, Lou Williams. And completely screwed it up."
Lou williams leaves the bubble in Orlando to pick up wings at a strip club in Atlanta and people just think it's hilarious.
Hawks the deepest imo  Trae Young  Lou Williams  Kevin Huerter  Bogdan Bogdonavich  Cam Reddish  DeAndre Hunter  Sharife Cooper  Danilo Gallinari  Jalen Johnson  John Collins  Onyeka Okongwu  Clint Capela
"This is the right answer. Where is it fun to be young, wealthy, and famous. Lou Williams didn't want to go to Atlanta then, likely, discovered the strip club scene and was like ""this could work out...""  It ain't Iowa..."
"I said in another comment, he is the successor to Lou Williams as an elite 6th man and could easily win that award like every year going forward if he wants to. But he wants to be more than that."
"[Just take a few minutes to watch his iso package.](https://www.youtube.com/watch?v=4k8Xgs1xUNo) He has a ton of tools, and a good ability to get to the rim, he's strong for his size.  If he can build a long ball he could be knocking on the door of an all-star status or lou williams peak in a few years. Big if but plenty of kids his age develop a shot if they work at it."
They should have traded CJ a long time ago. He's good but more in a Lou Williams role on a championship team. You can't start Dame and CJ and expect to compete for a title in a guard heavy league. They're both defensive liabilities and one if not both will be exploited by really good teams.
"No one (nor advanced stats) hates on the offensive skills he possesses. People hate on his defense, and his inability to develop a 3 point shot in a league metagame that necessitates spacing from 4-5 of the starters.  Its not that DeRozan is bad at basketball, it has just been hard to fit him into a modern offense (his newfound playmaking skills make it easier now), and its hard to be a Championship contender when your Forward is a liability on defense.  You can get away with worse defensive guards as a solid defensive center can often compensate... but when you have a guy at SF/PF who can't defend the perimeter/interior, on-ball/off-ball, and gets destroyed in pick-and-roll? That is very hard to win playoff games against the elite teams.  He has always been an ELITE mid-range scorer, and an upper-echelon finisher at the rim, and now he has even developed playmaking skills (a skill that I think actually allows him to finally fit into a modern offense), but his defense is still something that he needs to get figured out in these later years of his career if he wants to get a ring as a starter. Otherwise, he might see these last years in the league as a 6th man of the year bench spark plug like Lou Williams/Jamal Crawford but at Forward."
"Friday on ESPN, the Kings with Young Socialite Ben Simmons face off against Strip Club frequenter Lou Williams and the Hawks."
lmao did ben say he want to go to detroit or cleveland? has anyone ever? beside when Lebron was in Cleveland?  😂🤡  which athletes tell me i wanna embarrass you   lou williams? dude who didn’t get a contract from us? then felt some type of way? or vince carter 20 years ago? 😂🤡
Sign Lou Williams.  He knows where to find the best ones.
&gt;Strip Club frequenter   And chicken wing enthusiast  &gt;Lou Williams and the Hawks.
Excuse me that’s Mr. “Have Two Girlfriends” Lou Williams to you sir.
&gt;against Strip Club frequenter Lou Williams   Lemon Pepper Lou
"Lou Williams, the young socialite that he is, got his preferred destination"
"Steph will hopefully stop changing his motion to try and bait the foul. He definitely attempts to bait, it just rarely works.    Other than the ones you listed I would think Lou Williams, Kemba (when he shoots). Potentially Lowry too"
"Friday on ESPN, the Kings with Young Socialite Ben Simmons face off against Strip Club frequenter Lou Williams and the Hawks."
Lou Williams.
"Jordan Clarkson, Lou Williams, Colin Sexton"
"It really is, I got 3,000 upvotes on a comment just saying I love Lou Williams lol. If I was one of those people that sells their accounts I would definitely farm karma here"
I’m just saying ish Smith can get you 12 assists every night and 2013 kawhi can give your best player nightmares is that combined a good player or a 6th man like a Lou Williams
That exactly what Lou Williams said to Trae before his winning shot in game 1 against y’all. It was something like “All I told him was don’t pass it”
Isn't Lou Williams still a good player to have on the bench? I would think a young team would want him to guide the young players
Idk if people have watched THJ on the Mavs much but he is like Lou Williams pretty much. He can take a team that needs a boost and will them to victory by scoring spurts.   He is a better player per value compared to Fournier. But they are not far off. Mavs got a deal with THJ turning down 14 mil extra from the pels
"Dennis Schroeder - PHI      Danny Green - LAL      Andre Iguodala - GSW      Kelly Oubre - GSW      JJ Redick - BKN      Paul Millsap - ATL      Lou Williams - MIL      Avery Bradley - BOS      Reggie Jackson - LAC      Lauri Markennen - CHI      Josh Hart - NOP      Hamidou Diallo - DET      Svi Myk.. - OKC      Khem Birch - UFA (has been signed, Raptors)"
**Dennis Schroeder** - Mavericks  **Danny Green** - Celtics  **Andre Iguodala** - Retirement  **Kelly Oubre** - Heat  **JJ Redick** - Nets  **Paul Millsap** - Nuggets  **Lou Williams** - Bucks  **Avery Bradley** - Lakers  **Reggie Jackson** - Clippers  **Lauri Markennen** - Hornets  **Josh Hart** - Kings
"Pretty sure Lou Williams left because of playing in Canada, that's the only person I can think of though.  He's quoted saying ""When you play in Toronto, you feel like you're playing overseas,"" ""We can't wait to go on the road sometimes, just to be in America...  It's like little \[things\] you don't think of, like the Channels on your TV, phone bill, you got to get a Canadian bank account."""
"I think Iguodala might retire, maybe JJ as well.  Lou Williams will go to the Pacers or the Bucks, but I'm not confident on that.  Reggie Jackson back to the Clippers  Hamidou Diallo re-signs with the Pistons  No idea for most of the rest of them."
"Dennis Schroeder - Honestly no idea.  At this point, Shanghai maybe?      Danny Green - Whomever can pay him the most, maybe Dallas?      Andre Iguodala - GS  &amp;#x200B;  Kelly Oubre - Lakers for Vet minimum     JJ Redick - He didn't do much last season so maybe retirement?      Paul Millsap - Brooklyn on vet minimum?      Lou Williams - still provides a scoring punch off the bench.  Maybe Boston or NO?     Avery Bradley - Lakers      Reggie Jackson -  NO      Lauri Markennen - resigns with Bulls     Josh Hart - NO      Hamidou Diallo - ?      Svi Myk.. - Lakers?"
If we somehow land danny green or Lou Williams… this team will be really fun to watch
"I disagree. I think that Melo has a unique ability to create offense out of nothing and change the momentum of a game. Even if he’s not hugely efficient over long stretches, he makes timely shots and always demands defensive attention. It’s really a failure of analytics that stats don’t measure the full impact of high-volume, low-efficiency scorers like Melo, Lou Williams, Russ, and even younger guys like Donovan Mitchell and Anthony Edwards.  Also I guarantee Melo was not a net negative either for attendance or for the locker room."
"Unpopular opinion here, but I've always felt like Derozans skillset has been suited for a Lou Williams type of role, as someone who doesn't start but comes off the bench for a burst of offense and closes in an offensive situation"
"Streaky scorer, sort of a poor man's Jamal Crawford or Lou Williams.  He might get you 25 one night and 6 the next. Not a bad heat check coming off the bench."
"Who specifically though? Like I said, Lou Williams and some second round picks is very, very little. You shouldn't expect much for that, even a contributing bench player."
I see him as a 6th man tbh. Maybe his ceiling is Lou Williams lite.
"He helps them a lot in the sense that he's way better than Lou Williams and Reggie Jackson and kinda combines their skill set into 1 player.  But he still doesn't solve their play-making issues, Hill is a shooting guard in a point guard's body."
John Collins to Minnesota for something centered around Malik Beasely and Jaden Mcdaniels  Harrison Barnes to Boston for Romeo Langford and a first  George Hill to the Clippers for Lou Williams and Detroit seconds
"OKC has a vested interest in making sure the Clippers stay mediocre so I can't see them trading Hill to them. Also what assets do they have to trade for Hill? Lou Williams makes sense salary-match wise but he straight up said he'd retire if he got moved.  I think the Clippers need a playmaker but they have to lower their expectations. I don't even think they can get Ricky Rubio now. As much as I hate to say, two potentially obtainable playmaking upgrades are *gag* Elfrid Payton and Eric Bledsoe."
"&gt;Need these losses so the front office doesn’t get complacent and makes some moves.   What moves are you expecting them to make? They don't have anything other teams would want. Lou Williams would just retire if he was traded, the Clippers don't have any 1st round picks they can trade, and everyone else is either wildly overpaid or is someone the Clippers wouldn't trade. So what's the move you're waiting on?"
Lou Williams is such an odd one on this Clippers roster. He’s actually likeable.
"Guy who has never averaged even 2 assist has ""euro level passing ability""? Is that a pasta? Lou Williams is also a secret euro level passer."
"Paul George, Harrell and Lou Williams last year"
"I always saw Coby as more of a Lou Williams 6th man scorer then a Facilitating Starting PG, I think this move will work out better for him"
"He’s not there as a leader yet overall. He needs to mature. People tend to forget he could still be in college. But making his teammates better? And you name Collins? Nearly every one of John’s buckets the past two seasons have been a by product of a pick n roll with Trae or a spot up 3 off his pass. They’ve made each other much better. Trae is a willing passer and leads the league in hockey assists this season. He gets his teammates open shots, it’s up to them to hit it.   Capela’s whole offensive game is predicated off putbacks and lobs so idk what you mean, he gets plenty. If anything he hurts the offense because he can’t space the floor.   That whole Collins film session debacle was greatly exaggerated, as Collins himself was confused when the article dropped. He and Trae have been like peas in a pod since entering the league, it doesn’t mean they’ll have disagreements.  Lou Williams is a solid passer but he didn’t make his mark in this league for passing the ball. Trae is better in that area and you can’t just use his usage against him. Plenty of teams have high usage guys and he beats all but harden and Westbrook in assists.  I don’t think Trae is a championship level 1a as of now either and i wouldn’t be surprised if he never gets there but this talk of him being Lou Williams with a high usage rate is absolutely absurd. He’s not Luka but he’s plenty good in his own right, more than equipped to run an offense for a playoff team. If he suddenly became available on the market every GM would take him over Murray"
Lou Williams and Jamal Crawford wish they could pass the ball like Trae. Just say you don’t actually watch him. Dude has led the eastern conference in assists since he entered the league and all you think he is a bench scorer?
"For Trae Young to contribute to a championship team, he would need to play a Lou Williams or Jamal Crawford 6th man role because ultimately that is his skillset. I'll take my downvotes gladly until that day comes. This isn't a Lavine, Booker, or Beal situation where they are below average defenders but great offensive players. They still all have the size and strength to compete at their position. Trae will get eaten alive in the playoffs when teams gameplan to target him."
Lou Williams is blamed for everything lately. We have a lot of fans that think Luke Kennard is a good player
Lou Williams
"So teams should value Lou Williams and EG defense comparably because EG gets away with being physical?  Not sure I follow.  Maybe if Lou were physical he'd get away with it, too."
The Clippers not having that many good defenders after Kawhi/PG/Bev is part of the issue yes.   The Morris at the 5 132 defensive rating lineups dont have that rating because of guys like Reggie Jackson. And theyve been terrible defensively in the sample we have(small) regardless of who the guards are even when its Beverley/Batum/PG/Kawhi/Mook. One shitty guard isnt going to make that kind of defensive rating good suddenly.  Also Ill believe Ty Lue wont play Lou Williams in the playoffs when I actually see it. Established veterans getting more time than they should in the playoffs is a tradition as old as any. And regardless their defensive rating has been about identical this year with or without Lou Will
"I mean defensive slips might have more to do with Reggie Jackson, Lou Williams and kennard in the rotation and sometimes two of those three will be on the court at a time."
Taller Lou williams
"Bradley Beal always seems to get a pass; he's been one of the worst defensive players on the Wizards, and the wizards have been one of the worst defensive teams in the league. Most metrics would throw him in the same bucket defensively as D'Lo, Trae, Lou Williams, and Colin Sexton.   RPM has him 117th of 118 shooting guards defensively. RAPTOR has him 75th of 90 shooting guards (using the default 514 minutes played filter)."
KD couldn't even hold Lou Williams nuts on defense. PG is the better defender
"Yeah but Gobert is going to be the one people remember for years. Nobody’s going to remember Harden or Lou Williams’ lemon pepper wings, and both of those were well after anybody could be excused for not knowing how serious it was"
"Or lou Williams, not Joe Johnson, don't want to segregate based on skin color, however it's easy to do so. Michael Finley but no.  Maybe Paul pierce"
Herro is not worth it. Not by a long shot. You don’t trade an all-star you control for Lou Williams 2.0
"This is so true. You can see in real time too exactly what Draymond was going for, and it’s not terribly hard to argue that he had the right idea. He even had the cutter wide open in Looney (no way in hell Lou Williams was going to stop that). He just flubbed the pass badly. If anything KD not running the floor made that pass way harder than it needed to be."
&gt; I don’t think they can go another playoffs with Lou Williams. He’s a terrible playoff player.   Lol Simmons is definitely hanging out on this sub
"I really don't get the Tyler Herro projections of him potentially being an all-nba guy (which Booker is close to now)  I think his ceiling is more like a Lou Williams-type player.. a great 4th option, butttt probably shouldn't be higher than that. He's not a good enough shooter/shot-creator/passer to be a first or second option in most starting lineups."
"&gt; Who is making somebody else better on that team?  Paul George, Lou Williams, and Nic Batum mainly. Kawhi's gotten better at it too but he does go through stagnant stretches.  We had our worst stretch of the season right before the all-star break, but for most of this season our offense has looked fine. It's our defense that's been a more consistent issue. But I guess Simmons would rather talk about coffee"
the lakers do it all the time when they target reggie jackson and lou williams
Clippers can pound sand we don't want luke Kanard or Lou Williams or Patrick Beverly or 2nd round pics
"Loy Vaught, Darius Miles, Keith Closs and Lou Williams."
Lou Williams
