"Yeah imagine being the LA franchise that's had a winning record for 10 straight seasons (the longest active streak in the league) and several All-Stars (Blake Griffin x5, Chris Paul x5, DeAndre Jordan, Kawhi Leonard x2, Paul George) and 6MOY winners (Jamal Crawford x2, Lou Williams x2, Montrezl Harrell) ...  Yet has never made it to the conference finals and sadly plays second fiddle to the other LA team that had six straight losing seasons over the same timespan.  Just brutal."
"Barber and facial reconstruction plastic surgeon: ""What'll it be?""  Cameron Payne: ""The Lou Williams look. But don't use a photo, it has to be from memory."""
I wish they still had Lou Williams..
Don’t forget Lou Williams who’s unplayable in the postseason
i don’t blame him i blame lou williams and doc rivers
I can't believe Lou Williams would do this to the Clippers.
They should've traded Rat Bev and not Lou Williams. That scrub is a liability on offense.
Lakers fans are so mad they’re getting worked by Walmart Lou Williams
Caveman Lou Williams stole Sweet Lou's 3pt shooting like a Monstar
Payne looks like Mongloid Lou Williams
"He's like a mix between Lou Williams and the ""I'm the captain now"" guy."
Jeremy Lin hasn’t been better than Lou Williams a day in his life
"Lou Williams and Montrezl Harrell, and Eric Gordon and Lou Williams"
2017 Lou Williams:
Also Eric Gordon and Lou Williams lol
Haven't Montrezl Harrell and Lou Williams been basically in the same boat for the past few years when they were both on the Clippers?
Yeah but Ingles is objectively better. It's like comparing Klay and Lou Williams
"Always got love for Clarkson since he started on the Lakers. I just hope he does well in the playoffs. High scoring 6th man guards tend to play awful in the playoffs like Lou Williams, Jamal Crawford, etc."
Lmaoo   The Lou Williams Center for Kids Who Should Never Pass and Want to Learn to Not Pass in Clutch Moments too.
Not even close. Ingles is so much better than Clarkson it's like comparing Klay Thompson and Lou Williams
"Tooting my own team’s horn here, but to put context on how insane the Lou Williams lead comeback on golden state was, if the heat were to come back and win in the second half, they’d miss the record by three points.   Also to put that into even further context, the warriors were also healthy."
"Except Lou Williams only said ""franchise"" one time in this entire clip. Not sure why OP decided to butcher the quote in the title"
lou williams is just so cool. hes got that swag
"lou williams basketball camp day 1  ""do not pass the ball"""
Lou “Really Smart Guy” Williams
"Trae Young: *hits game winner*  Lou Williams: ""I told him to do that!"""
Step into the mind of a Lou Williams
"[Lou ""Ice in my veins"" Williams steps up in these moments](https://www.youtube.com/watch?v=SWrfMY81Bbg).  Although I remember losing my shit when I saw him pull up on this shot and I had a half-second mini meltdown before it went in. Not that I thought we even had a chance in the series to begin with though"
Lou Williams
Lou Williams and Gallo are both worse defenders. I think Gallonari's feet have to weigh about 40 pounds a piece. I am a homer but I know for a fact that hes not as bad at defense as this sub makes him out to be. Hes still a bad defender but Dame is just as bad if not worse.
He’s like the outlier of recent seasons. Lou Williams and Trezz being great examples.
NBA needs to keep that same energy like they did with Lou Williams in the bubble
This particular call was one that seemed to be a regular season foul but not a playoff foul.  Go watch some of the terrible Lou Williams playoff performances of years past and see how many times he tries this and the ref’s swallow their whistles. He would get it every time during the season.
And the best part? He didn't come onto the court until the 7 minute mark of the 4th. For the last several minutes of the 3rd and up until that 7 minute mark? Lou Williams was the PG while Young sat on the bench. And then Knicks fans cried about Young like he shot 40 free throws. He shot 9 and won on a floater and they still wont shut their dumb fucking mouth about him going to the line
"I'm certain they viewed him as their Lou Williams replacement at the start of the year, but the sudden Terrance Mann emergence sort of put Kennard in a weird spot in the rotation. Mann was suddenly taking the minutes that Kennard was gonna get."
"We don’t win this game without bogi or Lou Williams, bogi been coming through all year"
He literally swung his arms into Lou Williams and got free throws and then kicked his legs out into Bogi.
"Drose, Lou Williams, Westbrook"
"westbrook, d rose, lou williams"
Lou Williams is fucking sweet!
Professional scorer Lou Williams
goddamn lou williams is cold
Lou Williams is gonna turn into a hired gun different team every year and in the playoffs every year
His favorite player is Lou Williams or Clint Capela?
Lou Williams is keeping the hawks in the game
"Lou Williams is crazy talented.  If he's a free agent, I want him on the Knicks next year."
Lol Knicks can't seem to stop Lou Williams
Lou Williams is really good to have in the playoffs
"It's the year 2050. Tom Brady still winning Super Bowls, Phil winning tournaments, and Lou Williams hitting shots."
Sweet Lou looks like the real Lou Williams again on ATL
I either forgot or didn't even know the Hawks had Lou Williams. Got to feel good having him on your squad down the stretch.
"Lou Williams keeping the Hawks in the game, just like we all expected"
I routinely forget that Lou Williams is on the Hawks.
How does Lou Williams keep getting these layup line points!
RESPECT LOU WILLIAMS
"Lou Williams is a good one. Cam's D has actually impressed me the last couple of games, you can tell he's trying super hard on D to earn more minutes.   He's also clearly been working on catch and shooting"
I guess like a Lou Williams type of player? He can score the ball. Been like that since High School. Led the EYBL in scoring his last year of AAU.   He was born to score the basketball.
"2nd round picks for essentially worthless unless you get lucky. For instance, our entire roster (that actually play) were FRP other than Lou Williams. But yeah it definitely wasn't a net positive for us"
"Damn good point Luka really abused Lou Williams, who wasn’t even on the Clippers in the playoffs last year."
dealing with draymond green vs getting switches onto lou williams and reggie jackson
CJ McCollum &amp; Colin Sexton. Jamal Crawford or Lou Williams if comparing to retired players.
6 men aren't really bought in to play defense. They are there to generate offense and points whilst the stars sit.  It's why Lou Williams was so good off the bench.
"I feel like giving Jalen Johnson minutes can't be worse than Hill and TLC getting them, honestly.   And realistically I'm not sure how giving Cooper a shot can be much worse than Delon Wright and Lou Williams have been so far this year.  That's not to say that you don't want to get your vets right by the playoffs, but these young guys have to be options too.    People love to give Thibs shit for relying too much on the starters and not liking rookies, but he played Obi and IQ big minutes last year, and when we've been missing guys this year he's had no hesitation putting Jericho Sims and Quentin Grimes into games."
"Yeah Lou Williams creates more of his offense than Ray Allen did.  Off-ball scoring is just as valuable as on-ball, if not more.  AD’s been better than Luka this season. It’s not even debatable."
"[It's real](https://www.si.com/nba/2019/03/28/devin-booker-suns-scoring-future-james-harden-kyrie-irving) from the end of the 18/19 season. Dude says that Booker's future is as role player like Lou Williams. (FYI, video won't load with an ad blocker on)."
"I also know that Bogdanvic and Capella who've been in the league for a while now both look massively improved now that they play with Trae. I also know that John Collins doesn't look nearly as good when he plays with Delon Wright or Lou Williams - both of whom are competent PGs. Maybe some of the credit for Trae's teammates playing so well should go to him.  All I'm saying is that everyone always says Luka is way better and has a way worse team, but every other great player with a bad team has massive on/off numbers. AD had +8.8, +9.4, and +9.7 his last three years in NOLA. KAT has +9.0, +11.2, +5.3 last three years in Minny, etc."
How many minutes is he even averaging these days? Feel like I don't see him much. I still think the Lou Williams trade was a terrible decision and they may have gotten through us last year if they had him instead.
"I'm gonna go ahead and say Lou Williams. I saw someone mention Solo Hill for Hawks too, but I think the general consensus with Lou is that he's just lost a step and isn't fit for meaningful bench minutes.   Lou does have his moments though were he's a one man scoring run and those are fun to watch. Overall though I believe the fan base would prefer that when the team is healthy, Lou sees less minutes. Awesome vet to have on the team though."
"My problem with the 6MOTY award is in recent history it almost always goes to a very specific type of player. Specifically a shooting guard bucket getter.   9 out of the last 10 have went to a SG. It’s almost always the Jamal Crawford/Lou Williams/Jordan Clarkson types. Not saying they weren’t deserving but what about the defensive guys, rebounders, and facilitators?"
Lol I have a feeling you don’t realize how average Lou Williams was
Herro is an average defender and certainly not close to as poor as Lou Williams was.
Herro has done nothing to be put ahead of Lou Williams. Suggesting that he's better than Lou all time is a peak homer take.
?  Herro is better than Lou Williams lol
Coby White as the off the bench volume scorer a la the Jamal Crawford/Lou Williams mold
Depending on if he hits his stride/how the team treats him moving forward I can see Cam Thomas basically being the second coming of Lou Williams
Small guys with a nice handle and score a lot = Lou Williams or CJ McCollum
"I know what you’re saying but which DRose are we talking about here? The 30-year old one right?  Pooles fast af but DRose was a generational physical freak, legit was him VS Russ in terms of explosiveness for a long time.  Poole reminds me more of Lou Williams without the foul drawing ability. He’s slippery &amp; nimble and has great touch. But he’s still not an athletic freak"
"Well that's kind of the name of the game for microwave scorer 6th men lol  If Lou Williams could have hit 5 threes and scored 25 points in 25 minutes every game then he'd have been a perennial all star, but he could only do it once every five games.  Nature of the role."
&gt; Lou Williams seems like a good over/under for Poole. His ceiling is higher I'd say.  Even if true. That's NOT a superstar ceiling.
"Plenty of players with good physical attributes never turned into plus defenders.  Jamal Crawford had the length to be a decent perimeter defender, but he had no defensive instincts and never applied himself on that end of the floor.  And so he became one of the worst defenders of all time.  Go back and look at his draft profile.  People comment on his need to add weight, which he never really did, but it's not a Lou Williams situation where his height/length put a low ceiling on his defensive potential."
Clarkson is probably at his ceiling now. He's 29. Poole is 22 and has played only about 50 decent games since he seems to have figured it out (his rookie season was garbo)  Lou Williams seems like a good over/under for Poole. His ceiling is higher I'd say.
"I don't see why it matters what year Lou Williams peaked. When Klay comes back, Poole will be the sixth man. You'd have to be delusional to think Jordan Poole is going to be top 5 or top 10 in this league. At best, he'll be a Bradley Beal type. Who almost led the league in scoring but NOBODY considers a superstar."
"No way. I love the kid but superstar puts him in a class with Steph, Durant, LeBron and Harden. His ceiling is Lou Williams when he played for the Clippers or Jamal Crawford."
Agreed. And Clarkson will never be a superstar either. Both of their ceilings are Lou Williams when he was on the Clippers.
"&gt;Harden had capela his first year starting, beverly, gordon, ariza, and ryan anderson and still lead them to a high seed.  &amp;#x200B;  flat out false. It takes legitimately 5 seconds to look at their rosters side by side. You also didnt mention Montrezl and Lou Williams. Most the role players you named, russ would have killed for lmfao. Russ was the best player in the league that year.   &amp;#x200B;  &amp;#x200B;  &gt;f billy donovan had demar and lavine you think hed lose to the blazers/jazz?  I dont know. Would Demar score like 8 points in an elimination game like PG? Would lavine constantly underperform like melo?  &amp;#x200B;  &amp;#x200B;  &gt;You think Allen Iverson would lose  I dont..know?   &amp;#x200B;  &gt; Billy Donovan doesn’t tell Russ to brick shots and turn the ball over so many times. That’s 100% on him as the leader and star of the team. You can’t coach a parked car  but he does tell russ to carry his teams with shitty spacing and get triple doubles and win like 75% of the time with them. The leader and star of the team put up great stats in wins. Whats your point? He did what he had to do"
"He added new moves and hunted fouls, that doesnt change the fact that his bread and butter was getting too the line, last year in OKC he averaged 6 FT's a game, 1st year in HOU 10.2, lowest FT's per game came in 13-14 with 9.1. Like im not saying hes a bad player, but he based his game heavily around getting too the line, and unlike most other players who done that before him (Magette, Lou williams, etc), Harden had the talent to be an elite scorer without needing to bait the refs."
The pump fake and jump into someone move was less of a Harden thing because so many of his shots are step backs. I always associate that move with Jeff Teague and Lou Williams for whatever reason.
Looks like he's finally figured out his role.  Like the RC cola version of Lou Williams off the bench.
"If he's a max player ig Lou Williams and Jamal Crawford were max caliber players too right?      There's more to the game than scoring guys. Garland is a better guy to run ur offense and the defense is gonna be too trash to start them both"
Hey it worked for Lou Williams
"No. The commentator was claiming curry is the reason the warriors value grew. I disagreed by pointing out the demographic and area the warriors played in. They grew value because of San Francisco becoming the  social media  and  tech companies preferred place.   Also the warriors haven't signed any valuable free agent except kd who liked Steve kerr ball movement.    The current core is based off draft picks and trades plus  journey man.. You've never had cap space to go and get a Lou Williams type role player .   So I don't know what players on the current warriors who aren't Journey man, drafted by them or traded for."
"Magic got Rafer Alston for Kyle Lowry  Washed up T-Mac for Kevin Martin and a first  Aaron Brooks for Goran Dragic and a first  Corey Brewer and the 28th pick for Lou Williams  CP3 for Lou Williams, Beverly and space parts"
Per Tim McMahon that trade was Harden and Fertitta's idea and Morey's disapproval led to his leaving the team. Other trades include...  Clippers got spare parts for CP3  Thunder got spare parts for Harden  Magic got Rafer Alston for Kyle Lowry  Washed up T-Mac for Kevin Martin and a first  Aaron Brooks for Goran Dragic and a first  Corey Brewer and the 28th pick for Lou Williams
"At the time, dragic wasn’t good, and he didn’t play well for Houston. Brooks was the better player at the time. Suns also got to let dragic develop under Houston and sign him for cheap. Suns probably win that trade given Houston traded away the pick for nothing.  I’d take a 28th pick over Lou Williams. Also, the Lakers were wanting to tank, so it worked well for them.  Alston went to the Magic in a three team deal, so Memphis fleeced orlando. Lowry wasn’t that much better than Alston in Houston.  The mcgrady deal was about cap relief and also, Rockets gave up fan favorite Carl Landry."
"By your logic Morey deserves no credit for acquiring CP3 and Harden which is idiotic but whatever, how about  Rafer Alston for Kyle Lowry  Washed up T-Mac for Kevin Martin and a first  Aaron Brooks for Goran Dragic and a first  Corey Brewer and the 28th pick for Lou Williams"
"I mean Trae young and lou williams still exist lol.  Am aware, i watched him in OKC when he was the 6th man, he just stopped giving a fuck once he got too Houston"
"I thought Lillard was supposed to be a legit superstar, why does he seem like a glorified Lou Williams now? Sad."
"We were super dissapoinyed to lose bev, and the year before that with Lou Williams."
"Trick question, the answer is obviously Lou Williams"
It was a lot of fun I won’t lie. And very funny since 31 is a lot like 3-1. And it was Lou Williams.   Also you sure talk a lot of shit for someone who doesn’t  have a flair.
Imagine if those two teamed up and blew a 31 point lead to Lou Williams in the playoffs
I thought his ceiling was sweet lou williams but I may be wrong
lou williams didn't want any of that
"""He's Kevin Durant. You know who he is. We tried I promise we did"" - Lou Williams, Patrick Beverley.  I believe the lesson learned is they know who KD is now.    That or the power of friendship?"
"I want to know what you mean by great. Top 20? Top 30? Top 50? Top 100? Top 150?  Are we going to start calling every single solid starter a great player? Lonzo ball is great? bogdan/bojan bogdanovic are great? current gordon hayward is great?  Great has to be at least a fringe all star. You don't have to make the all star team but your name should be in the 5 or 6 ""snubs"". Like Lou williams that one year."
Lou Williams GOAT RIP
"You would think between Hunter, Capela, and to a lesser extent Reddish, they would have an ok defense. But their other players are all atrocious defensively. Trae, Collins, Bogdan, Huerter, Gallinari, Lou Williams all suck at d.   Should’ve seen Curry embarrass Huerter the other night. Targeted him every play and just kept scoring at will"
"I was happy with the results we got from him, so i wouldn’t say i was against keeping him. Coming off an ECF appearance, the last problem I thought we’d have would be coaching. But i definitely did have thoughts when we resigned him that we could do a lot better considering our talent. We need a more innovative coach. Nate can inspire, and usually runs good defensive squads, but there’s no way you trot our Trae/Collins/Bogi and don’t get 70+ points from that trio on a nightly basis. With shooters like Gallo, Huerter, and Reddish off the bench? Lou Williams doesn’t even play. Our offense should never be the problem besides those few nights a year where you can’t buy a bucket.  But what can he do when Bogi/Collins/Huerter/Gallo/Hunter hit a whopping one 3 pointer between them on 20 attempts, most WIDE open."
"Whenever KD hits his midrange I feel like that clip of Lou Williams and PB being like YO WE TRIED TO STOP HIM, YOU TELL US HOW?"
i feel like really bad is reserved for guys like trae young and lou williams. Curry is passable for a guard his size or slightly below average
"yep. He is an sg with great handles and ability to make plays.  I think like maybe Lou williams, Manu Ginboili he can have his best impact coming off the bench as a spark and creating rather than a full time pg.   Talented player"
Thought it was Lou Williams shitting on LeMao for a second.
"They’d have to have a Malcolm Brogdon style RotY, a thoroughly disappointing sophomore campaign and then break out in their third year as a 6MOtY and MIP. Then develop into an MVP/DPOY caliber player. The 10/3/4 line he won ROTY with is probably the lowest realist line, and leaves just enough space to win 6th man and MIP with something like 22/5/6 off the bench. His career would pretty much have to be if Lou Williams had a great rookie year and then also turned into Gary Payton defensively in his prime."
Malik “Lou Williams” Monk
True. Its not impressive for starting quality players to play starters minutes from the bench. Lou Williams kind of screwed up 6moty
"You can try to stop one thing with KD, but his bag is so deep you'll end up giving him something else.   I don't have the effort to link it right now, but Google the Patrick Beverly and Lou Williams interview about KD. When NBA players are looking at reporters and going, you got any ideas? That's KD"
"Lmao are you 14? Did you ever watch these players play? All 3 were bonafide All NBA talents. All 3 racked up individual accolades whether it’s all nba / all star selections or in bens case DPOYs. 2 of the 3 were in the MVP race at their peaks, and of course Ben also has a ring to go along with all of that. Tmac and Webber are top ten at their positions all time. Easily HOF worthy.  Lou Williams isn’t a fraction of how good they are. For most of his career he’s been a putrid defender while being an inefficient mid-high teens scorer off the bench. He has no accolades outside of his 6 man awards"
You mean Lou Williams***
"Is he a top 100 player of all time? No.  But is he a top *200* player of all time? Also no.  But can you write the story of the NBA without including Lou Williams?? Well... yes. Yes you can.  But *all of that said...* — if a player of note is asked if he should be in the HOF, I will never blame him for saying yes."
Lou Williams has never heard of Manu Ginobili
And that young protégée.... Lou Williams
"Silenced? Ever since he ""returned"" to the NBA he is playing like a average spot up shooter who provides zero defense, his percentages are pathetic besides the FT shooting, this is a simple fact. Still a serviceable role player who can provide 15 minutes of contribution, but nothing beyond that. If Vogel keeps forcing him as this Lou Williams kind of role, being a scorer off the bench with the green light at 38 years old, 30 minutes per game? That will backfire for sure. It would not be a problem if Melo could actually defend, also if he is ego was not so great + the unwanted attention/distraction... if he was a role player in the literal sense, ok, why not keep him around. But he brings a lot of negative aspects, it's really not worthy imo"
Why didn't Lou Williams play last night? I remember him going off as last year as a microwave scorer.
