"**Most Dominant Player:** Joel Embiid  **Most Impactful Free Agent Signing:** Gordon Hayward  **Most Dangerous Lineup That Doesn’t Actually Play:** Kawhi Leonard, Paul George, Nicolas Batum, Serge Ibaka, Marcus Morris Sr.  **All-Around Strangest Development:** Andrew Wiggins becoming mini Mutombo  **Breakout Sidekick:** De’Andre Hunter  **Sunniest Bounce Back:** Mike Conley  **Most Concerning Start (That Actually Matters):** Josh Richardson"
Lou Williams -25  Ivica Zubac -26  Marcus Morris Sr. -20  Luke Kennard -22  Our fucking bench is just Trezz clones Jesus Christ...
"Marcus ""Carmelo ""Dwight Howard"" Anthony"" Morris Sr."
Are 11 2nd rounders worth enough?  u/LAClippers get:  Bradley Beal  Alex Len  u/WashWizards get:  Lou Williams  Marcus Morris Sr.  Luke Kennard  Patrick Patterson  2022 - RD 2  2022 - RD 2  2023 - RD 2  2023 - RD 2  2024 - RD 2  2024 - RD 2  2025 - RD 2  2025 - RD 2  2026 - RD 2  2026 - RD 2  2027 - RD 2  https://tradenba.com/trades/Oe3lbVZ00
"When Steph needs help on his shooting form, he calls up Marcus Morris Sr."
"Random question - when did Marcus Morris start going by ""Morris Sr""? Has that always been the case and I'm just dumb?"
Marcus Morris Sr.
  **Heat @ Clippers**  [](/MIA) **118 -  125** [](/LAC)  **Box Scores: [NBA](http://www.nba.com/games/20210215/MIALAC#/boxscore) &amp; [Yahoo](http://sports.yahoo.com/nba/miami-heat-los-angeles-clippers-2021021512)**  |**Team**|**Q1**|**Q2**|**Q3**|**Q4**|**Total**| |:---|:--|:--|:--|:--|:--| |Miami Heat|35|27|29|27|118| |Los Angeles Clippers|33|34|25|33|125|  **TEAM STATS**  |**Team**|**PTS**|**FG**|**FG%**|**3P**|**3P%**|**FT**|**FT%**|**OREB**|**TREB**|**AST**|**PF**|**STL**|**TO**|**BLK**| |:--|:--|:--|:--|:--|:--|:--|:--|:--|:--|:--|:--|:--|:--|:--| |Miami Heat|118|46-91|50.5%|8-36|22.2%|18-22|81.8%|9|39|27|21|7|8|6| |Los Angeles Clippers|125|47-85|55.3%|15-32|46.9%|16-20|80.0%|7|39|31|22|5|12|0|  **TEAM LEADERS**  |**Team**|**Points**|**Rebounds**|**Assists**| |:--|:--|:--|:--| |Miami Heat|**30** Jimmy Butler|**12** Bam Adebayo|**10** Jimmy Butler| |Los Angeles Clippers|**32** Marcus Morris Sr.|**9** Serge Ibaka|**10** Lou Williams|
Terance Mann Marcus Morris Sr.  Serge Ibaka Reggie Jackson Lou Williams  Jimmy Butler Kelly Olynyk Bam Adebayo Duncan Robinson Kendrick Nunn   Starting lineups   Lmao
Marcus Morris Sr is absurd bro. That man is money off the bench
  **Lakers @ Clippers**  [](/LAL) **86 -  104** [](/LAC)  **Box Scores: [NBA](http://www.nba.com/games/20210404/LALLAC#/boxscore) &amp; [Yahoo](http://sports.yahoo.com/nba/los-angeles-lakers-los-angeles-clippers-2021040412)**  |**Team**|**Q1**|**Q2**|**Q3**|**Q4**|**Total**| |:---|:--|:--|:--|:--|:--| |Los Angeles Lakers|20|18|17|31|86| |Los Angeles Clippers|27|26|24|27|104|  **TEAM STATS**  |**Team**|**PTS**|**FG**|**FG%**|**3P**|**3P%**|**FT**|**FT%**|**OREB**|**TREB**|**AST**|**PF**|**STL**|**TO**|**BLK**| |:--|:--|:--|:--|:--|:--|:--|:--|:--|:--|:--|:--|:--|:--|:--| |Los Angeles Lakers|86|32-80|40.0%|7-23|30.4%|15-20|75.0%|7|36|16|11|9|18|7| |Los Angeles Clippers|104|41-86|47.7%|14-28|50.0%|8-9|88.9%|13|50|23|25|10|19|4|  **TEAM LEADERS**  |**Team**|**Points**|**Rebounds**|**Assists**| |:--|:--|:--|:--| |Los Angeles Lakers|**19** Montrezl Harrell|**7** Kyle Kuzma|**7** Dennis Schroder| |Los Angeles Clippers|**22** Marcus Morris Sr.|**10** Kawhi Leonard|**8** Kawhi Leonard|
Crazy how much better Marcus Morris Sr is than Markieff.
  **Bucks @ Clippers**  [](/MIL) **105 -  129** [](/LAC)  **Box Scores: [NBA](http://www.nba.com/games/20210329/MILLAC#/boxscore) &amp; [Yahoo](http://sports.yahoo.com/nba/milwaukee-bucks-los-angeles-clippers-2021032912)**  |**Team**|**Q1**|**Q2**|**Q3**|**Q4**|**Total**| |:---|:--|:--|:--|:--|:--| |Milwaukee Bucks|38|17|31|19|105| |Los Angeles Clippers|26|31|39|33|129|  **TEAM STATS**  |**Team**|**PTS**|**FG**|**FG%**|**3P**|**3P%**|**FT**|**FT%**|**OREB**|**TREB**|**AST**|**PF**|**STL**|**TO**|**BLK**| |:--|:--|:--|:--|:--|:--|:--|:--|:--|:--|:--|:--|:--|:--|:--| |Milwaukee Bucks|105|38-81|46.9%|11-30|36.7%|18-21|85.7%|5|32|18|14|8|12|4| |Los Angeles Clippers|129|51-95|53.7%|19-34|55.9%|8-10|80.0%|13|46|25|15|5|12|2|  **TEAM LEADERS**  |**Team**|**Points**|**Rebounds**|**Assists**| |:--|:--|:--|:--| |Milwaukee Bucks|**32** Giannis Antetokounmpo|**7** Pat Connaughton|**7** Jrue Holiday| |Los Angeles Clippers|**25** Marcus Morris Sr.|**9** Kawhi Leonard|**8** Kawhi Leonard|
"No disrespect to lose to legends like Marcus Morris Sr, Luke Nuke 'em and T Mann."
  **Raptors @ Clippers**  [](/TOR) **100 -  105** [](/LAC)  **Box Scores: [NBA](http://www.nba.com/games/20210504/TORLAC#/boxscore) &amp; [Yahoo](http://sports.yahoo.com/nba/toronto-raptors-los-angeles-clippers-2021050412)**  |**Team**|**Q1**|**Q2**|**Q3**|**Q4**|**Total**| |:---|:--|:--|:--|:--|:--| |Toronto Raptors|30|24|28|18|100| |Los Angeles Clippers|26|22|34|23|105|  **TEAM STATS**  |**Team**|**PTS**|**FG**|**FG%**|**3P**|**3P%**|**FT**|**FT%**|**OREB**|**TREB**|**AST**|**PF**|**STL**|**TO**|**BLK**| |:--|:--|:--|:--|:--|:--|:--|:--|:--|:--|:--|:--|:--|:--|:--| |Toronto Raptors|100|40-87|46.0%|12-35|34.3%|8-13|61.5%|7|37|22|15|10|12|3| |Los Angeles Clippers|105|39-75|52.0%|15-34|44.1%|12-13|92.3%|4|42|28|14|7|18|5|  **TEAM LEADERS**  |**Team**|**Points**|**Rebounds**|**Assists**| |:--|:--|:--|:--| |Toronto Raptors|**27** Fred VanVleet|**8** Khem Birch|**13** Fred VanVleet| |Los Angeles Clippers|**22** Marcus Morris Sr.|**9** Paul George|**5** Kawhi Leonard|
"As much as I don't like the Clippers bashing, it's insane how they drafted two players right before MPJ (Miles Bridges &amp; Jerome Robinson)   Obviously Bridges --&gt; Shai and Shai + others --&gt; PG13 so that isn't that bad, but just imagine they took MPJ with that second pick instead of *Jerome Robinson* (Though they did use him to get Marcus Morris Sr., but I'm sure they could've used another asset anyways)"
Add in Otto porter jr and Marcus Morris sr and you got the suffix squad
"Marcus Morris Sr., Philly's finest"
Montrezl Harrell missing the free throws or PG or Marcus Morris Sr
Kawhi was obviously holding back Marcus Morris Sr
"If I was in a room with Marcus Morris Sr, P Bev, and Hitler and had a gun with two bullets, I’d shoot Hitler twice"
"Some very slim chances that Clippers wins this without him. They heavily relied on him to clutch it past Luka Donricks. If they're gonna win PG13 (and Marcus Morris Sr. for that matter as he has played very well this post season) has to play the best basketball they've ever played + the team as a whole has to step up to an even higher degree than they did before.  Even so, I'm tooting for Clippers now to win since it would be a very very epic comeback!"
"How will this affect someone like Marcus Morris, Sr.  ?"
Mr Marcus Morris Sr did not expect that hug
  **Clippers @ Jazz**  [](/LAC) **111 -  117** [](/UTA)  **Box Scores: [NBA](http://www.nba.com/games/20210610/LACUTA#/boxscore) &amp; [Yahoo](http://sports.yahoo.com/nba/los-angeles-clippers-utah-jazz-2021061026)**  |**Team**|**Q1**|**Q2**|**Q3**|**Q4**|**Total**| |:---|:--|:--|:--|:--|:--| |Los Angeles Clippers|29|24|33|25|111| |Utah Jazz|30|36|27|24|117|  **TEAM STATS**  |**Team**|**PTS**|**FG**|**FG%**|**3P**|**3P%**|**FT**|**FT%**|**OREB**|**TREB**|**AST**|**PF**|**STL**|**TO**|**BLK**| |:--|:--|:--|:--|:--|:--|:--|:--|:--|:--|:--|:--|:--|:--|:--| |Los Angeles Clippers|111|40-85|47.1%|11-30|36.7%|20-23|87.0%|7|37|19|25|6|11|3| |Utah Jazz|117|42-76|55.3%|20-39|51.3%|13-21|61.9%|2|36|15|23|4|14|3|  **TEAM LEADERS**  |**Team**|**Points**|**Rebounds**|**Assists**| |:--|:--|:--|:--| |Los Angeles Clippers|**29** Reggie Jackson|**10** Marcus Morris Sr.|**6** Paul George| |Utah Jazz|**37** Donovan Mitchell|**20** Rudy Gobert|**4** Joe Ingles|
"PG will get slander, but Marcus Morris Sr. is a huuuuge part of these playoff struggles. Outside of game 3 and 7 vs Dallas, dude has been ASSSS. His only job is to hit open 3s, and he did it at a 47% rate all year.  In the other 7 games he is fucking 2/8, 3/9, 3/5, 5/13, 1/10, 4/14, and 4/11.  22/70. 31.4%.  8/38 from deep. 21%.  Dude is choking hard.  He gets the wide ass open ones in the corner as a 47% 3 ball shooter, and is 21% in 7 of our 9 games.  FUUUUCK"
"Marcus ""Zaza Bowen"" Morris Sr."
We are losing more cus marcus fucking morris sr is 3/11 and 0/6 from 3
Luke FUCKING Kennard is 4/5 3 pointers and they giving it TO FUCKING MARCUS MORRIS SR????
Lol Marcus Morris Sr. top 10 center in the league
I would love to know why Carlisle had 7'3 Porzingus standing at the perimeter the whole game while the Clippers were defending the Mavs w/Marcus Morris Sr. as their tallest player for large parts of the game. Boban &amp; Porzingus in the game being guarded by 6'8 guys &amp; very few post-ups were called to take advantage of this mismatch. Shit blew my fuckin mind.
"PG personally a scum bag, Pat Bev hurt Russ on purpose and is generally annoying and not good, Reggie thought he should be starting over Russ and was ass in Detroit, Kawhi fucked the Spurs over heavy, Marcus Morris Sr., Rondo spit on CP3.   Take your pick."
#KAWHI STEPPED UP  #PAUL GEORGE STEPPED UP  #TERANCE MANN STEPPED UP  #LUKE KENNARD STEPPED UP  #MARCUS MORRIS SR STEPPED UP  #BATUM STEPPED UP  #REGGIE JACKSON STEPPED UP
"That’s Knicks legend, Marcus Morris Sr."
MARCUS MUTHAFUCKIN’ MORRIS SR.
"Marcus ""Luka Doncic Jr. "" Morris Sr."
And Lukas other son Marcus Morris Sr
"&gt; he’s playing far far superior defense      I would not say it's ""far"" superior.        Here are the defensive numbers for Jokic against players he guarded for more than 5 minutes.    Kanter - 40% (2-5)     Lillard - 46% (12-26)      Nurkic - 41% (12-29)       Average - 43% (26-60)       For Kawhi...     Tim Hardaway Jr - 52.9% (9-17)      Maxi Kleber - 75% (3-4)     Luka Doncic - 38% (9-24)       Kristaps Porzingis - 46% (5-11)      Dorian Finney Smith - 17% (1-6)       Average - 38% (27-72)  For Luka...      Reggie Jackson - 67% (6-9)      Rajon Rondo - 17% (1-6)     Paul George - 29% (2-7)    Nicholas Batum - 38% (3-8)     Marcus Morris Sr - 33% (3-9)     Kawhi Leonard - 50% (7-14)       Average - 42% (22-53)       They are all terrific. Yes, Kawhi has been better on that end. But it's not ""far far"" superior.      &gt; while getting far more attention from the defense than harden/Durant      If we're using this argument, then what about Luka? His three main defenders have been Kawhi (18m), PG (13m), and Batum (13m).     Kawhi's main defender? Maxi Kleber (29m) followed by Dorian Finney-Smith (20m). There's no question Luka has been facing far better defenders.      &gt; against the the pacers in the first round.      You mean the 48-win Pacers? I think there's a difference between a team that's 2 wins from 50 versus a team that's 2 wins from 40."
Marcus Morris Sr. should let Marcus Morris Jr. take his shots.
Marcus Morris Sr. ISO
Can we plz all agree that LeBron is a dirty player? Any other player that’s done as much as him would be called dirty repeatedly. He’s done more dirty plays than Marcus Morris Sr. Lol
"Lakers: missed LeBron, AD, and Shroder for significant time.  Clippers: missed PG and Kawhi for a combined 38 games, before including 31 missed from Ibaka, 35 from Pat Bev, 15 from Marcus Morris Sr. etc.  Nuggets: Murray missed 24 games, Monte Morris missed 25, Dozier missed 22, Millsap missed 15, MPJ missed 11.  The only guys who DIDNT miss double digit games are Jokic.  Lastly, Blazers: Nurk missed 35 games, CJ McCollum missed 25.  Besides Dame, those are practically their only relevant players.  Glad you can talk shit in a 5+ month old deleted thread, when you didn't even comment on it initially.  Real impressive"
"Bron, KD, and the best shooter in the league Marcus Morris Sr. (Just ask him, he'll tell ya lol)"
Even I will take advice from Marcus Morris Sr.
"Yeah unlike Marcus ""Luka with female tendencies Doncic Jr"" Morris Sr"
"That's ***Marcus Morris, Sr*** to you there, buddy"
"&gt;Because just having Kawhi and PG is making a killing in ticket sales and branding.  Is it?  Because Clippers playoff tickets could be had for as little as $30 for game 1.  Not sure how game 2 sales went.  Clippers have no choice but to run it back.  They are well over the cap, so they can't sign any free agents except for vets.  If they try to trade PG it will likely be for cents on the dollar.  And beside, the problem isn't even PG, the problem is Pat ""trick ya'll"" Beverly, Marcus ""Jr"" Morris Sr, and Luke ""DNP"" Kennard.  Nobody wants those trash role players and their trash contracts (Beverly is expiring)."
"Marcus Morris Sr., Reggie Jackson and Patrick Beverly. Pick 1"
Love me some Marcus Morris Sr
Marcus Morris Sr. and Beverley should not be starters on any NBA team much less a playoff team.
Marcus Morris Sr. is not playing well.
Marcus Morris Sr Sr
"Trade him for Marcus Morris Sr, then Bertans can back out of the deal"
"Oh nah it's interesting because after last year's playoffs, it's a shock to see Luka say anything positive about Marcus Morris Sr."
Definitely. You can see how well it worked for Kennard and Marcus Morris Sr.
"|MATCHUP|PTS|AST|TOV|FGM|FGA|3PM|3PA|TS| :--|--:|--:|--:|--:|--:|--:|--:|--:| |Paul George|36|3|5|13|27|3|10|58.14%| |Reggie Jackson|25|3|1|9|19|4|9|61.52%| |Dennis Schroder|16|3|1|4|15|0|7|43.20%| |Marcus Morris Sr.|18|2|0|8|14|2|5|64.29%| |Terance Mann|15|1|0|7|12|1|4|62.50%| |LeBron James|18|4|5|6|12|1|3|61.48%| |Kentavious Caldwell-Pope|4|3|0|2|10|0|6|20.00%| |Facundo Campazzo|11|1|0|4|10|3|7|55.00%|  all the players he guarded who had at least 10 FGA against him  only players who were inefficient against him were dennis and KCP. and they combined for 0/13 from 3 and it's not like they were shooting contested threes lmao suns let them shoot. all in all, nothin impressive.  not that bad either, of course... paul george isnt a good matchup for booker so ""holding"" him to 58% TS% with more turnovers than assists isn't bad or anything. but **nothing impressive**."
And Marcus Shithead Morris Sr.
Marcus morris Sr.
  **Suns @ Clippers**  [](/PHX) **130 -  103** [](/LAC)  **Box Scores: [NBA](http://www.nba.com/games/20210630/PHXLAC#/boxscore) &amp; [Yahoo](http://sports.yahoo.com/nba/phoenix-suns-los-angeles-clippers-2021063012)**  |**Team**|**Q1**|**Q2**|**Q3**|**Q4**|**Total**| |:---|:--|:--|:--|:--|:--| |Phoenix Suns|33|33|31|33|130| |Los Angeles Clippers|29|28|26|20|103|  **TEAM STATS**  |**Team**|**PTS**|**FG**|**FG%**|**3P**|**3P%**|**FT**|**FT%**|**OREB**|**TREB**|**AST**|**PF**|**STL**|**TO**|**BLK**| |:--|:--|:--|:--|:--|:--|:--|:--|:--|:--|:--|:--|:--|:--|:--| |Phoenix Suns|130|53-94|56.4%|17-31|54.8%|7-11|63.6%|10|47|27|21|5|9|4| |Los Angeles Clippers|103|33-79|41.8%|12-39|30.8%|25-32|78.1%|7|32|18|11|5|8|3|  **TEAM LEADERS**  |**Team**|**Points**|**Rebounds**|**Assists**| |:--|:--|:--|:--| |Phoenix Suns|**41** Chris Paul|**17** Deandre Ayton|**8** Chris Paul| |Los Angeles Clippers|**26** Marcus Morris Sr.|**9** Paul George|**8** Reggie Jackson|
Marcus Morris sr is better than Joe Harris
Except it was Marcus Morris Sr who was doing the cooking... He's a turnstile on defense
i think lue did the smartest thing subbing Marcus Morris Sr. in at the starting line up. Instant offensive + spacing.
Fucking Marcus Morris Sr. is feeling right at home here in Phoenix right now.  Dude is on fire: 8-9 in the first half.
It’s time we had a serious discussion about Marcus Morris Sr. being the best player in the league.
I just woke up. Is Marcus Morris Sr finals MVP yet?
Marcus Morris (Sr.) is the greatest player of all time
Marcus Morris Sr. is EXACTLY who LAC need the most right now
Marcus Morris has sr in his name therefore old and washed. Trade him
Marcus Morris Sr. is exactly who LAC need the most
You know how I knew I got old as fuck.   Marcus Morris Sr
I hate when Marcus Morris sr does these isos
"I know I'm obviously biased but I just don't want to see the Clips in the Finals this year. I have rooted for them for a long time because I want them to finally make it all the way after all the suffering - But Kawhi has already won with two other teams and I don't want to see ""Champion"" next to the names Patrick Beverly or Marcus Morris Sr."
"Sure, but are you *really* going to say that ankle was the main reason you lost the series when all of the following happened **post-Kawhi injury**? (Keep in mind that I haven’t even included Conley’s horrid game 6 because he, too, was returning from injury.)   #**Game 5 :**   Marcus Morris Sr. : 25 pts, 10/16 shooting (3/4 from 3)  Reggie Jackson : 22 pts, 8/15 shooting (3/8 from 3)   Jordan Clarkson (second half) : 1 pt, 0/6 shooting (0/4 from 3)  Royce O’Neale (second half) : 4 pts, 1/7 shooting (0/5 from 3), 4 PF, -14 in 20:14  Utah Jazz (second half, Mitchell’s stats not included) : 10/29 from the field (34.5%), 2/15 from 3 (13.3%)  Utah Jazz (second half, Mitchell’s stats included) : 13/43 from the field (30.2%), 3/24 from 3 (12.5%)  Utah Jazz (full game, Mitchell’s stats not included) : 14/21 from the FT line (66.7%), 10 AST, 12 TO (AST:TO = 0.83), 18 pts off TO  Utah Jazz (full game, Mitchell’s stats included) : 19/27 from the FT line (70.4%), 15 AST, 14 TO (AST:TO = 1.07), 20 pts off TO   #**Game 6 :**   Terance Mann (second career playoff start) : 39 pts, 15/21 shooting (7/10 from 3)  Reggie Jackson : 27 pts, 10/16 shooting (3/7 from 3), 3 stl  Los Angeles Clippers (second half) : 30/42 from the field (71.4%), 14/19 from 3 (73.7%)   Rudy Gobert (second half) : 6 pts, 2/2 shooting (0/0 from 3), 6 reb, 3 PF, 2 TO, -34 in 24:00  Rudy Gobert (full game) : 12 pts, 5/6 shooting (0/0 from 3), 10 reb, 2 stl, 5 PF, 3 TO, -24 in 42:08  Jordan Clarkson (second half) : 0 pts, 0/4 shooting (0/3 from 3), -25 in 10:42  Joe Ingles (3rd quarter) - 0 pts, 0/2 shooting (0/2 from 3), 2 AST, -17 in 06:18  Utah Jazz (second half, Mitchell’s stats not included) : 11/26 from the field (42.3%), 5/17 from 3 (29.4%), 5 AST, 10 TO (AST:TO = 0.5)  Utah Jazz (second half, Mitchell’s stats included) : 15/39 from the field (38.5%), 9/25 from 3 (36.0%), 10 AST, 11 TO (AST:TO = 0.91)  Utah Jazz (full game, Mitchell’s stats not included) : 27 pts conceded off TO, 8/10 from the FT line (80%), 10 AST, 14 TO (AST:TO = 0.71)  Utah Jazz (full game, Mitchell’s stats included) 29 pts conceded off TO, 14/19 from the FT line (73.7%), 19 AST, 16 TO (AST:TO = 1.19)  Biggest lead : Utah Jazz (25, 11:36 left in 3Q)   Given all of that, are you really still gonna sit here and say that the main reason you lost the series was because of an ankle injury to a guy who **averaged 30/7/7 over the last 2 games anyway**? Y’all didn’t lose because of that - **y’all lost because the team played like shit**."
&gt; someone post all the tiers plz?  Tier 1: Giannis Antetokounmpo	MIL Kevin Durant	BKN LeBron James	LAL Steph Curry	GSW Nikola Jokic	DEN James Harden	BKN Kawhi Leonard	LAC  Tier 2: Jayson Tatum	BOS Anthony Davis	LAL Joel Embiid	PHI Luka Doncic	DAL Damian Lillard	POR Jimmy Butler	MIA Paul George	LAC Rudy Gobert	UTA Bam Adebayo	MIA Chris Paul	PHX Khris Middleton	MIL Kyrie Irving	BKN  Tier 3: Jaylen Brown	BOS Devin Booker	PHX Jrue Holiday	MIL Trae Young	ATL Zion Williamson	NOP Bradley Beal	WAS Donovan Mitchell	UTA Ja Morant	MEM Jamal Murray	DEN Karl-Anthony Towns	MIN Mike Conley	UTA Shai Gilgeous-Alexander	OKC Ben Simmons	PHI Draymond Green	GSW Pascal Siakam	TOR Russell Westbrook	LAL Zach LaVine	CHI  Tier 4: Al Horford	BOS Marcus Smart	BOS Brandon Ingram	NOP CJ McCollum	POR Clint Capela	ATL De'Aaron Fox	SAC Domantas Sabonis	IND Fred VanVleet	TOR Gordon Hayward	CHA Jerami Grant	DET Joe Harris	BKN Joe Ingles	UTA Julius Randle	NYK Kemba Walker	NYK Kyle Lowry	MIA LaMelo Ball	CHA Malcolm Brogdon	IND Myles Turner	IND Robert Covington	POR Seth Curry	PHI Aaron Gordon	DEN Bogdan Bogdanovic	ATL Bojan Bogdanovic	UTA Brook Lopez	MIL Caris LeVert	IND Christian Wood	HOU Deandre Ayton	PHX De'Andre Hunter	ATL Derrick Rose	NYK Dillon Brooks	MEM Jae Crowder	PHX John Collins	ATL Jonas Valanciunas	NOP Jusuf Nurkic	POR Klay Thompson	GSW Kristaps Porzingis	DAL Michael Porter Jr.	DEN Mikal Bridges	PHX OG Anunoby	TOR Spencer Dinwiddie	WAS Tobias Harris	PHI DeMar DeRozan	CHI Nikola Vucevic	CHI  Tier 5: Dennis Schroder	BOS Andrew Wiggins	GSW Anthony Edwards	MIN Blake Griffin	BKN Bruce Brown	BKN Buddy Hield	SAC Cameron Payne	PHX Collin Sexton	CLE D'Angelo Russell	MIN Danilo Gallinari	ATL Danny Green	PHI Davis Bertans	WAS Dejounte Murray	SAS Robert Williams III	BOS Derrick White	SAS Devonte' Graham	NOP Duncan Robinson	MIA Evan Fournier	NYK Gary Trent Jr.	TOR Harrison Barnes	SAC Immanuel Quickley	NYK Ivica Zubac	LAC Jaren Jackson Jr.	MEM Jarrett Allen	CLE Jeff Green	DEN Jonathan Isaac	ORL Jordan Clarkson	UTA Kelly Olynyk	DET Kentavious Caldwell-Pope	WAS Kevin Huerter	ATL Kyle Anderson	MEM Marcus Morris Sr.	LAC Nerlens Noel	NYK Nicolas Batum	LAC Norman Powell	POR P.J. Washington	CHA Patrick Beverley	LAC Reggie Jackson	LAC Richaun Holmes	SAC Steven Adams	MEM T.J. Warren	IND Terry Rozier	CHA Tim Hardaway Jr.	DAL Tyrese Haliburton	SAC Alex Caruso	CHI Lonzo Ball	CHI
|Tier 1| |:--| |Giannis Antetokounmpo| |Kevin Durant| |LeBron James| |Steph Curry| |Nikola Jokic| |James Harden| |Kawhi Leonard| |**Tier 2**| |Jayson Tatum| |Anthony Davis| |Joel Embiid| |Luka Doncic| |Damian Lillard| |Jimmy Butler| |Paul George| |Rudy Gobert| |Bam Adebayo| |Chris Paul| |Khris Middleton| |Kyrie Irving| |**Tier 3**| |Jaylen Brown| |Devin Booker| |Jrue Holiday| |Trae Young| |Zion Williamson| |Bradley Beal| |Donovan Mitchell| |Ja Morant| |Jamal Murray| |Karl-Anthony Towns| |Mike Conley| |Shai Gilgeous-Alexander| |Ben Simmons| |Draymond Green| |Pascal Siakam| |Russell Westbrook| |Zach LaVine| |**Tier 4**| |Al Horford| |Marcus Smart| |Brandon Ingram| |CJ McCollum| |Clint Capela| |De'Aaron Fox| |Domantas Sabonis| |Fred VanVleet| |Gordon Hayward| |Jerami Grant| |Joe Harris| |Joe Ingles| |Julius Randle| |Kemba Walker| |Kyle Lowry| |LaMelo Ball| |Malcolm Brogdon| |Myles Turner| |Robert Covington| |Seth Curry| |Aaron Gordon| |Bogdan Bogdanovic| |Bojan Bogdanovic| |Brook Lopez| |Caris LeVert| |Christian Wood| |Deandre Ayton| |De'Andre Hunter| |Derrick Rose| |Dillon Brooks| |Jae Crowder| |John Collins| |Jonas Valanciunas| |Jusuf Nurkic| |Klay Thompson| |Kristaps Porzingis| |Michael Porter Jr.| |Mikal Bridges| |OG Anunoby| |Spencer Dinwiddie| |Tobias Harris| |DeMar DeRozan| |Nikola Vucevic| |**Tier 5**| |Dennis Schroder| |Andrew Wiggins| |Anthony Edwards| |Blake Griffin| |Bruce Brown| |Buddy Hield| |Cameron Payne| |Collin Sexton| |D'Angelo Russell| |Danilo Gallinari| |Danny Green| |Davis Bertans| |Dejounte Murray| |Robert Williams III| |Derrick White| |Devonte' Graham| |Duncan Robinson| |Evan Fournier| |Gary Trent Jr.| |Harrison Barnes| |Immanuel Quickley| |Ivica Zubac| |Jaren Jackson Jr.| |Jarrett Allen| |Jeff Green| |Jonathan Isaac| |Jordan Clarkson| |Kelly Olynyk| |Kentavious Caldwell-Pope| |Kevin Huerter| |Kyle Anderson| |Marcus Morris Sr.| |Nerlens Noel| |Nicolas Batum| |Norman Powell| |P.J. Washington| |Patrick Beverley| |Reggie Jackson| |Richaun Holmes| |Steven Adams| |T.J. Warren| |Terry Rozier| |Tim Hardaway Jr.| |Tyrese Haliburton| |Alex Caruso| |Lonzo Ball  Taken from OP's google spreadsheet since some people are having problems opening it.
Knicks legend Marcus Morris Sr.
"""Good"" is being generous to describe Marcus Morris Sr."
"&gt; I don't think the Clippers have a realistic shot at DeRozan.  Terence Mann, Marcus Morris Sr., Keon Johnson and BJ Boston. Clips can dump a lot of contracts too, to go below the apron.  &gt; Both the Lakers and Clippers are gonna be way over the apron Spurs can absorb a lot of contracts in a trade. It will come down to what the teams will be offering, so Spurs would agree and take those contracts."
Maybe they ought to trade for  Nicolas Batum  Patrick Beverley  Amir Coffey  DeMarcus Cousins  Yogi Ferrell  Paul George  Serge Ibaka  Reggie Jackson  Keon Johnson  Luke Kennard  Kawhi Leonard  Terance Mann  Marcus Morris Sr.  Daniel Oturu  Patrick Patterson  Jason Preston  Rajon Rondo  Jay Scrubb  Ivica Zubac
"If they don’t bring them back, then they have zero chance of bringing back:  Nicolas Batum  Patrick Beverley  Amir Coffey  DeMarcus Cousins  Yogi Ferrell  Paul George  Serge Ibaka  Reggie Jackson  Keon Johnson  Luke Kennard  Kawhi Leonard  Terance Mann  Marcus Morris Sr.  Daniel Oturu  Patrick Patterson  Jason Preston  Rajon Rondo  Jay Scrubb  Ivica Zubac"
Nicolas Batum  Patrick Beverley  Amir Coffey  DeMarcus Cousins  Yogi Ferrell  Paul George  Serge Ibaka  Reggie Jackson  Keon Johnson  Luke Kennard  Kawhi Leonard  Terance Mann  Marcus Morris Sr.  Daniel Oturu  Patrick Patterson  Jason Preston  Rajon Rondo  Jay Scrubb  Ivica Zubac
They should bring back  Nicolas Batum  Patrick Beverley  Amir Coffey  DeMarcus Cousins  Yogi Ferrell  Paul George  Serge Ibaka  Reggie Jackson  Keon Johnson  Luke Kennard  Kawhi Leonard  Terance Mann  Marcus Morris Sr.  Daniel Oturu  Patrick Patterson  Jason Preston  Rajon Rondo  Jay Scrubb  Ivica Zubac
Marcus Morris Sr.
Marcus Morris sr
"""Tim Hardaway Sr."" I can live with, but someone like Marcus Morris having a baby and then calling himself Sr. is wack"
we need to save tobi from this hell. would the sixers be interested in a lightly used marcus morris sr?
"I'm only impressed when you get to the III. It gets exponentially better from N/A -&gt; Sr. --&gt; III --&gt; X   but then loses all marginal gains after 10  edit - Till you hit 100, because then your numeral just looks like your position in the lineup (Marcus Morris C)"
"I feel like Marcus Morris doing that is putting some unbelievable pressure on his kid to make it to the league too.  ""I didn't put Sr. on the back of my jersey for you to dick around on your PS5, now go shoot some low percentage midrange shots in the driveway!"""
