"Any news on Embiid's availability?  I'm high-key hoping he doesn't play, both to protect the knee and to get us some sweet Paul Reed minutes."
"They are thinking all their picks and pick swaps for 7 years, all their crypto, Pat's and Gino's, Ben Simmons, Shake Milton, Paul Reed, and Tyrese Maxey for Damian Lillard and a Dutch Bros. Location.  Edit: Neil Olshey hangs up then calls Philadelphia Police to do a wellness check on Daryl Morey."
"| # | Name | Score | Start | End | Games | PPG | RPG | APG | PER | EWA | WS | |---|---|---|---|---|---|---|---|---|---|---|---| | 1 | 33Kareem Abdul-Jabbar | 32.3 | 1969 | 1989 | 1,560 | 24.6 | 11.2 | 3.6 | 24.6 | 319.8 | 273.5 | | 2 | 23LeBron James | 30.5 | 2003 |  | 1,310 | 27.0 | 7.4 | 7.4 | 27.4 | 336.5 | 242.1 | | 3 | 23Michael Jordan | 29.7 | 1984 | 2003 | 1,072 | 30.1 | 6.2 | 5.3 | 27.9 | 284.0 | 214.1 | | 4 | 6Bill Russell | 25.8 | 1956 | 1969 | 963 | 15.1 | 22.5 | 4.3 | 18.9 | 134.0 | 163.5 | | 5 | 13Wilt Chamberlain | 25.6 | 1959 | 1973 | 1,045 | 30.1 | 22.9 | 4.4 | 26.1 | 295.7 | 247.4 | | 6 | 21Tim Duncan | 24.2 | 1997 | 2016 | 1,392 | 19.0 | 10.8 | 3.0 | 24.2 | 248.2 | 206.4 | | 7 | 32Magic Johnson | 24.2 | 1979 | 1996 | 906 | 19.5 | 7.2 | 11.2 | 24.1 | 180.1 | 156.1 | | 8 | 8Kobe Bryant | 23.5 | 1996 | 2016 | 1,346 | 25.0 | 5.2 | 4.7 | 22.9 | 240.2 | 172.9 | | 9 | 33Larry Bird | 22.8 | 1978 | 1992 | 897 | 24.3 | 10.0 | 6.3 | 23.5 | 171.4 | 145.7 | | 10 | 32Shaquille O'Neal | 22.1 | 1992 | 2011 | 1,207 | 23.7 | 10.9 | 2.5 | 26.4 | 264.1 | 181.8 | | 11 | 32Karl Malone | 21.9 | 1985 | 2004 | 1,476 | 25.0 | 10.1 | 3.6 | 23.9 | 270.6 | 234.9 | | 12 | 9Bob Pettit | 20.0 | 1954 | 1965 | 792 | 26.4 | 16.2 | 3.0 | 25.3 | 174.6 | 136.1 | | 13 | 2Moses Malone | 19.4 | 1974 | 1995 | 1,329 | 20.6 | 12.2 | 1.4 | 22.3 | 201.9 | 167.2 | | 14 | 14Oscar Robertson | 18.9 | 1960 | 1974 | 1,040 | 25.7 | 7.5 | 9.5 | 23.2 | 212.8 | 189.1 | | 15 | 35Kevin Durant | 18.9 | 2007 |  | 884 | 27.0 | 7.1 | 4.2 | 25.3 | 190.6 | 146.6 | | 16 | 44Jerry West | 18.9 | 1960 | 1974 | 932 | 27.0 | 5.8 | 6.7 | 22.9 | 176.7 | 162.3 | | 17 | 14Bob Cousy | 18.7 | 1950 | 1970 | 924 | 18.4 | 5.2 | 7.5 | 19.8 | 105.3 | 91.0 | | 18 | 34Hakeem Olajuwon | 18.6 | 1984 | 2002 | 1,238 | 21.8 | 11.1 | 2.5 | 23.6 | 228.6 | 162.7 | | 19 | 41Dirk Nowitzki | 18.0 | 1998 | 2019 | 1,522 | 20.7 | 7.5 | 2.4 | 22.4 | 232.8 | 206.3 | | 20 | 21Kevin Garnett | 18.0 | 1995 | 2016 | 1,462 | 17.8 | 10.0 | 3.7 | 22.7 | 232.9 | 191.5 | | 21 | 34Charles Barkley | 17.4 | 1984 | 2000 | 1,073 | 22.1 | 11.7 | 3.9 | 24.6 | 213.5 | 177.4 | | 22 | 50David Robinson | 17.3 | 1987 | 2003 | 987 | 21.1 | 10.6 | 2.5 | 26.2 | 212.4 | 178.6 | | 23 | 30Stephen Curry | 17.1 | 2009 |  | 762 | 24.2 | 4.6 | 6.5 | 24.0 | 135.8 | 112.2 | | 24 | 17John Havlicek | 17.0 | 1962 | 1978 | 1,270 | 20.8 | 6.3 | 4.8 | 17.5 | 130.1 | 131.5 | | 25 | 22Elgin Baylor | 16.4 | 1958 | 1972 | 846 | 27.4 | 13.5 | 4.3 | 22.7 | 164.3 | 104.1 | | 26 | 6Julius Erving | 16.3 | 1972 | 1987 | 836 | 22.0 | 6.7 | 3.9 | 22.0 | 130.9 | 106.4 | | 27 | 13James Harden | 16.2 | 2009 |  | 877 | 25.1 | 5.5 | 6.5 | 24.8 | 169.3 | 142.0 | | 28 | 3Dwyane Wade | 15.4 | 2003 | 2019 | 1,054 | 22.0 | 4.7 | 5.4 | 23.5 | 181.3 | 120.9 | | 29 | 4Dolph Schayes | 15.3 | 1948 | 1964 | 996 | 18.5 | 11.3 | 3.1 | 22.0 | 129.7 | 142.1 | | 30 | 3Chris Paul | 15.2 | 2005 |  | 1,090 | 18.3 | 4.5 | 9.4 | 24.9 | 208.5 | 189.5 | | 31 | 34Giannis Antetokounmpo | 14.7 | 2013 |  | 589 | 20.9 | 9.1 | 4.5 | 23.7 | 100.4 | 74.5 | | 32 | 13Steve Nash | 14.6 | 1996 | 2014 | 1,217 | 14.3 | 3.0 | 8.5 | 20.0 | 135.8 | 129.4 | | 33 | 3Allen Iverson | 14.6 | 1996 | 2010 | 914 | 26.7 | 3.7 | 6.2 | 20.9 | 152.4 | 99.1 | | 34 | 0Russell Westbrook | 13.8 | 2008 |  | 943 | 23.2 | 7.4 | 8.5 | 23.2 | 159.0 | 104.7 | | 35 | 23Anthony Davis | 13.5 | 2012 |  | 564 | 23.9 | 10.2 | 2.3 | 27.1 | 123.9 | 86.8 | | 36 | 11Isiah Thomas | 13.3 | 1981 | 1994 | 979 | 19.2 | 3.6 | 9.3 | 18.1 | 100.5 | 80.7 | | 37 | 12Dwight Howard | 13.2 | 2004 |  | 1,182 | 16.2 | 12.1 | 1.4 | 21.3 | 157.8 | 138.4 | | 38 | 11Elvin Hayes | 13.2 | 1968 | 1984 | 1,303 | 21.0 | 12.5 | 1.8 | 17.7 | 133.1 | 120.9 | | 39 | 12John Stockton | 13.2 | 1984 | 2003 | 1,504 | 13.1 | 2.7 | 10.5 | 21.8 | 206.0 | 207.7 | | 40 | 33Scottie Pippen | 13.1 | 1987 | 2004 | 1,178 | 16.1 | 6.4 | 5.2 | 18.6 | 133.0 | 125.0 | | 41 | 99George Mikan | 13.1 | 1948 | 1956 | 439 | 23.1 | 9.5 | 2.8 | 27.0 | 54.5 | 108.6 | | 42 | 5Jason Kidd | 13.0 | 1994 | 2013 | 1,391 | 12.6 | 6.3 | 8.7 | 17.9 | 142.8 | 138.4 | | 43 | 33Patrick Ewing | 12.6 | 1985 | 2002 | 1,183 | 21.0 | 9.8 | 1.9 | 21.0 | 161.0 | 126.4 | | 44 | 44George Gervin | 12.6 | 1974 | 1986 | 791 | 26.2 | 4.6 | 2.8 | 21.7 | 118.7 | 88.0 | | 45 | 2Kawhi Leonard | 12.5 | 2011 |  | 576 | 19.2 | 6.4 | 2.9 | 23.4 | 92.3 | 83.3 | | 46 | 19Willis Reed | 12.5 | 1964 | 1974 | 650 | 18.7 | 12.9 | 1.8 | 18.6 | 69.1 | 74.8 | | 47 | 11Paul Arizin | 12.4 | 1950 | 1962 | 713 | 22.8 | 8.6 | 2.3 | 19.7 | 90.7 | 109.0 | | 48 | 10Walt Frazier | 12.4 | 1967 | 1980 | 825 | 18.9 | 5.9 | 6.1 | 19.1 | 100.3 | 113.7 | | 49 | 21Bill Sharman | 12.4 | 1950 | 1961 | 711 | 17.8 | 3.9 | 3.0 | 18.2 | 66.9 | 82.8 | | 50 | 24Rick Barry | 12.3 | 1965 | 1980 | 794 | 23.2 | 6.5 | 5.1 | 20.2 | 111.1 | 93.5 | | 51 | 22Clyde Drexler | 12.3 | 1983 | 1998 | 1,086 | 20.4 | 6.1 | 5.6 | 21.1 | 158.0 | 135.8 | | 52 | 1Chris Bosh | 12.2 | 2003 | 2016 | 893 | 19.2 | 8.5 | 2.0 | 20.5 | 120.7 | 106.2 | | 53 | 18Dave Cowens | 12.2 | 1970 | 1983 | 766 | 17.6 | 13.6 | 3.8 | 17.0 | 70.3 | 86.4 | | 54 | 24Sam Jones | 11.8 | 1957 | 1969 | 871 | 17.7 | 4.9 | 2.5 | 18.7 | 78.9 | 92.1 | | 55 | 20Gary Payton | 11.6 | 1990 | 2007 | 1,335 | 16.3 | 3.9 | 6.7 | 18.9 | 147.7 | 145.5 | | 56 | 34Paul Pierce | 11.6 | 1998 | 2017 | 1,343 | 19.7 | 5.6 | 3.5 | 19.7 | 168.7 | 150.2 | | 57 | 00Robert Parish | 11.6 | 1976 | 1997 | 1,611 | 14.5 | 9.1 | 1.4 | 19.2 | 156.9 | 147.0 | | 58 | 34Ray Allen | 11.6 | 1996 | 2014 | 1,300 | 18.9 | 4.1 | 3.4 | 18.6 | 148.7 | 145.0 | | 59 | 15Nikola Jokić | 11.4 | 2014 |  | 453 | 18.5 | 9.8 | 6.0 | 26.0 | 83.1 | 64.3 | | 60 | 11Bob McAdoo | 11.3 | 1972 | 1986 | 852 | 22.1 | 9.4 | 2.3 | 20.7 | 109.3 | 89.0 | | 61 | 32Kevin McHale | 11.2 | 1980 | 1993 | 971 | 17.9 | 7.3 | 1.7 | 20.0 | 102.1 | 113.1 | | 62 | 15Tom Heinsohn | 11.1 | 1956 | 1965 | 654 | 18.6 | 8.8 | 2.0 | 17.8 | 52.4 | 60.0 | | 63 | 21Dominique Wilkins | 11.0 | 1982 | 1999 | 1,074 | 24.8 | 6.7 | 2.5 | 21.6 | 167.8 | 117.6 | | 64 | 16Jerry Lucas | 10.9 | 1962 | 1974 | 829 | 17.0 | 15.6 | 3.3 | 18.8 | 99.7 | 98.4 | | 65 | 41Wes Unseld | 10.8 | 1968 | 1981 | 984 | 10.8 | 14.0 | 3.9 | 16.0 | 76.8 | 110.2 | | 66 | 22Ed Macauley | 10.8 | 1949 | 1959 | 641 | 17.5 | 6.7 | 3.2 | 20.4 | 67.4 | 100.7 | | 67 | 11Yao Ming | 10.8 | 2002 | 2011 | 486 | 19.0 | 9.2 | 1.6 | 23.0 | 78.3 | 65.8 | | 68 | 15Hal Greer | 10.6 | 1958 | 1973 | 1,122 | 19.2 | 5.0 | 4.0 | 15.7 | 77.7 | 102.7 | | 69 | 33Alonzo Mourning | 10.4 | 1992 | 2008 | 838 | 17.1 | 8.5 | 1.1 | 21.2 | 105.3 | 89.6 | | 70 | 15Carmelo Anthony | 10.4 | 2003 |  | 1,191 | 23.0 | 6.3 | 2.8 | 19.7 | 144.2 | 104.9 | | 71 | 1Tracy McGrady | 10.3 | 1997 | 2013 | 938 | 19.6 | 5.6 | 4.4 | 22.1 | 141.9 | 97.1 | | 72 | 17Pau Gasol | 10.2 | 2001 |  | 1,226 | 17.0 | 9.2 | 3.2 | 21.4 | 168.5 | 144.2 | | 73 | 16Bob Lanier | 10.2 | 1970 | 1984 | 959 | 20.1 | 10.1 | 3.1 | 21.7 | 141.7 | 117.0 | | 74 | 9Tony Parker | 10.1 | 2001 | 2019 | 1,254 | 15.5 | 2.7 | 5.6 | 18.2 | 110.3 | 111.5 | | 75 | 0Damian Lillard | 10.0 | 2012 |  | 682 | 24.7 | 4.2 | 6.6 | 22.4 | 112.0 | 92.1 | | 76 | 2Kyrie Irving | 10.0 | 2011 |  | 582 | 22.8 | 3.8 | 5.7 | 22.5 | 89.9 | 68.6 | | 77 | 42James Worthy | 10.0 | 1982 | 1994 | 926 | 17.6 | 5.1 | 3.0 | 17.7 | 80.4 | 81.0 | | 78 | 24Paul George | 9.93 | 2010 |  | 706 | 20.2 | 6.4 | 3.5 | 19.4 | 83.7 | 75.3 | | 79 | 19Vern Mikkelsen | 9.82 | 1949 | 1959 | 699 | 14.4 | 8.5 | 2.2 | 18.6 | 52.2 | 83.4 | | 80 | 1Amar'e Stoudemire | 9.76 | 2002 | 2016 | 846 | 18.9 | 7.8 | 1.2 | 21.8 | 112.5 | 92.5 | | 81 | 55Dikembe Mutombo | 9.70 | 1991 | 2009 | 1,196 | 9.8 | 10.3 | 1.0 | 17.2 | 96.8 | 116.9 | | 82 | 7Tiny Archibald | 9.69 | 1970 | 1984 | 876 | 18.8 | 2.3 | 7.4 | 18.0 | 86.8 | 83.3 | | 83 | 33Grant Hill | 9.67 | 1994 | 2013 | 1,026 | 16.7 | 6.0 | 4.1 | 19.0 | 118.0 | 100.4 | | 84 | 32Bill Walton | 9.64 | 1974 | 1987 | 468 | 13.3 | 10.5 | 3.4 | 20.0 | 49.8 | 39.2 | | 85 | 4Adrian Dantley | 9.63 | 1976 | 1991 | 955 | 24.3 | 5.7 | 3.0 | 21.5 | 149.7 | 134.1 | | 86 | 2Alex English | 9.41 | 1976 | 1991 | 1,193 | 21.5 | 5.5 | 3.6 | 19.9 | 142.0 | 100.5 | | 87 | 12LaMarcus Aldridge | 9.38 | 2006 |  | 1,029 | 19.4 | 8.2 | 2.0 | 20.7 | 135.7 | 112.4 | | 88 | 18Bailey Howell | 9.26 | 1959 | 1971 | 950 | 18.7 | 9.9 | 2.0 | 19.1 | 99.1 | 114.7 | | 89 | 25Chet Walker | 9.25 | 1962 | 1975 | 1,032 | 18.2 | 7.1 | 2.1 | 17.6 | 94.5 | 117.1 | | 90 | 16Larry Foust | 9.24 | 1950 | 1962 | 817 | 12.6 | 9.1 | 1.6 | 20.2 | 76.2 | 74.2 | | 91 | 43Jack Sikma | 9.23 | 1977 | 1991 | 1,107 | 15.6 | 9.8 | 3.2 | 17.3 | 98.5 | 112.4 | | 92 | 22Dave DeBusschere | 9.19 | 1962 | 1974 | 875 | 16.1 | 11.0 | 2.9 | 15.5 | 56.0 | 60.7 | | 93 | 44Paul Westphal | 9.16 | 1972 | 1984 | 823 | 15.6 | 1.9 | 4.4 | 19.4 | 72.3 | 67.6 | | 94 | 32Blake Griffin | 9.14 | 2009 |  | 668 | 20.9 | 8.6 | 4.3 | 21.5 | 91.3 | 77.4 | | 95 | 14Lenny Wilkens | 9.12 | 1960 | 1975 | 1,077 | 16.5 | 4.7 | 6.7 | 16.8 | 87.5 | 95.8 | | 96 | 12George Yardley | 9.08 | 1950 | 1960 | 472 | 19.2 | 8.9 | 1.7 | 20.5 | 62.8 | 58.5 | | 97 | 53Artis Gilmore | 9.07 | 1971 | 1988 | 909 | 17.1 | 10.1 | 2.0 | 20.2 | 113.0 | 107.4 | | 98 | 15Vince Carter | 9.06 | 1998 | 2020 | 1,541 | 16.7 | 4.3 | 3.1 | 18.6 | 150.2 | 125.1 | | 99 | 4Chris Webber | 9.05 | 1993 | 2008 | 831 | 20.7 | 9.8 | 4.2 | 20.9 | 121.4 | 84.8 | | 100 | 22Slater Martin | 9.05 | 1949 | 1960 | 745 | 9.8 | 3.1 | 4.2 | 11.6 | 5.0 | 47.5 |"
NBA 50 at 50 list:  Kareem Abdul-Jabbar Nate Archibald Paul Arizin Charles Barkley Rick Barry Elgin Baylor Dave Bing Larry Bird Wilt Chamberlain Bob Cousy Dave Cowens Billy Cunningham Dave DeBusschere Clyde Drexler Julius Erving Patrick Ewing Walt Frazier George Gervin Hal Greer John Havlicek Elvin Hayes Magic Johnson Sam Jones Michael Jordan Jerry Lucas Karl Malone Moses Malone Pete Maravich Kevin McHale George Mikan Earl Monroe Hakeem Olajuwon Shaquille O’Neal Robert Parish Bob Pettit Scottie Pippen Willis Reed Oscar Robertson David Robinson Bill Russell Dolph Schayes Bill Sharman John Stockton Isiah Thomas Nate Thurmond Wes Unseld Bill Walton Jerry West Lenny Wilkens James Worthy
List:   - Kareem Abdul-Jabbar - Ray Allen - Giannis Antetokounmpo - Carmelo Anthony - Nate Archibald - Paul Arizin - Charles Barkley - Rick Barry - Elgin Baylor - Dave Bing - Larry Bird - Kobe Bryant - Wilt Chamberlain - Bob Cousy - Dave Cowens - Billy Cunningham - Stephen Curry - Anthony Davis - Dave DeBusschere - Clyde Drexler - Damian Lillard - Tim Duncan - Jerry Lucas - Kevin Durant - Karl Malone - Julius Erving - Moses Malone - Patrick Ewing - Pete Maravich - Walt Frazier - Bob McAdoo - Kevin Garnett - Kevin McHale - George Gervin - George Mikan - Hal Greer - Reggie Miller - James Harden - Earl Monroe - John Havlicek - Steve Nash - Elvin Hayes - Dirk Nowitzki - Allen Iverson - Hakeem Olajuwon - LeBron James - Shaquille O'Neal - Magic Johnson - Robert Parish - Sam Jones - Chris Paul - Michael Jordan - Gary Payton - Jason Kidd - Bob Pettit - Kawhi Leonard - Paul Pierce - Scottie Pippen - Willis Reed - Oscar Robertson - David Robinson - Dennis Rodman - Bill Russell - Dolph Schayes - Bill Sharman - John Stockton - Isiah Thomas - Nate Thurmond - Wes Unseld - Dwyane Wade - Bill Walton - Jerry West - Russell Westbrook - Lenny Wilkens - Dominique Wilkins - James Worthy
"There is no cap space. If they were able to somehow get rid of Ben without taking on any salary at all, they'd still be right around the cap. They're using roster spots on guys like Paul Reed and Charles Bassey, they don't need roster spots.  A few good role players and picks is not better than having Ben, it really is that simple. There is nothing gained by dumping Ben, and they already have more than enough role players. What they're missing is a star PG, and dumping Ben for anything less than a star PG closes the window. And Morey isn't going to close the window just so he doesn't have to deal with this."
Paul Reed got out the mud so that tells you something!
Thybulle and Maxey aren't even the biggest argument. The biggest argument are guys like Isaiah Joe and Paul Reed that might be second and deep second picks with great value
paul reed and isaiah joe :)
"If OKC would agree to make the sixers 2025 1st round pick unprotected, then the sixers will have all but 1 of their draft picks. Seth Curry is on a really good contract and he would be valuable to any tanking team purely to flip for draft picks.  And maxey, thybulle, isaiah joe, are all quality young players. Even Paul Reed, Shake Milton, and Jaden Springer have a bit of trade value. Are any of them elite prospects? Hell no. Notice I said ""decent war chest of assets"". Not the best in the league. There are teams with better war chests.   Let's say dame became available in a trade. The knicks, nuggets and warriors could probably all beat the sixers best offer. But would the knicks be willing to go all in on Dame this early into their rebuild? We all know what Lacob has said about wanting to build for the future. Now maybe the warriors would go all in on dame, but it would cost a pretty penny to beat the sixers offer, and it's not clear that they would do that. And would the nuggets be willing to offer murray AND mpj? They can't even trade MPJ until next year because of the poison pill provision."
"Random thoughts:  Dwight should probably be above Drexler, Havlicek, and Grant Hill.   Nash and Chris Paul peaked higher than Isiah and Stockton.  Allen Iverson is too high. No way he added more offensive value than Nash.  Don't know how I feel about Elgin over Scottie, but it's hard to say because Elgin had a relatively short peak because of injuries and I don't have a great idea of his prime ability.  And for the previous 25...  They had Pete Maravich ahead of Reggie Miller. There's no way you want Pete ahead of Reggie on your team unless your only goal is to sell tickets.   D Rose is pretty low at 65 but that's sort of a pleasant surprise considering how deified he is on r/NBA and Twitter.  Carmelo should not be ahead of Paul Pierce, Kyrie, Frazier, Reggie Miller, or Reed."
G League MVP and future NBA MVP Paul Reed as well
Wtf is Paul Reed on this list????
“And it doesn’t matter whether he’s a committed ideologue or an amoral opportunist. Nazis came in both varieties - think Alfred Rosenberg and Paul de Man - and in real life the lines separating the two are seldom clear.” Adolph Reed Jr on Charles Murray
  **Nets @ 76ers**  [](/BKN) **104 -  115** [](/PHI)  **Box Scores: [NBA](http://www.nba.com/games/20211011/BKNPHI#/boxscore) &amp; [Yahoo](http://sports.yahoo.com/nba/brooklyn-nets-philadelphia-76ers-2021101120)**  |**Team**|**Q1**|**Q2**|**Q3**|**Q4**|**Total**| |:---|:--|:--|:--|:--|:--| |Brooklyn Nets|25|24|24|31|104| |Philadelphia 76ers|37|31|32|15|115|  **TEAM STATS**  |**Team**|**PTS**|**FG**|**FG%**|**3P**|**3P%**|**FT**|**FT%**|**OREB**|**TREB**|**AST**|**PF**|**STL**|**TO**|**BLK**| |:--|:--|:--|:--|:--|:--|:--|:--|:--|:--|:--|:--|:--|:--|:--| |Brooklyn Nets|104|39-77|50.6%|15-36|41.7%|11-13|84.6%|6|38|18|18|7|26|4| |Philadelphia 76ers|115|44-89|49.4%|13-36|36.1%|14-25|56.0%|9|41|25|18|20|15|2|  **TEAM LEADERS**  |**Team**|**Points**|**Rebounds**|**Assists**| |:--|:--|:--|:--| |Brooklyn Nets|**23** Kevin Durant|**7** Kevin Durant|**4** James Harden| |Philadelphia 76ers|**27** Furkan Korkmaz|**10** Paul Reed|**6** Andre Drummond|
then Ben Simmons and Paul Reed start scissoring on the bench
Paul Reed is Ronaldo but he’s also Messi
"Paul Reed dominates the league in one of my many 100+ seasons save of BasketballGM, just saying"
I had a few minutes so I threw together the average player ranks across all the panelists.         Player| Average Rank ---|--- Michael Jordan | 1.4   LeBron James | 3.13   Kareem Abdul-Jabbar | 3.53   Wilt Chamberlain | 5.73   Magic Johnson | 5.8   Bill Russell | 6.13   Kobe Bryant | 8.4   Larry Bird | 9.07   Tim Duncan | 9.93   Shaquille O’Neal | 10.13   Oscar Robertson | 10.2   Hakeem Olajuwon | 11.2   Kevin Durant | 13.67   Jerry West | 15.47   Stephen Curry | 17   Julius Erving | 18.8   Karl Malone | 20.2   Moses Malone | 20.53   Elgin Baylor | 20.93   Dirk Nowitzki | 22.53   Charles Barkley | 25.4   Scottie Pippen | 25.6   David Robinson | 26.73   Isiah Thomas | 27.33   John Havlicek | 28.87   Kevin Garnett | 29.47   John Stockton | 30.13   Dwyane Wade | 30.93   Allen Iverson | 33.47   Giannis Antetokounmpo | 33.8   Rick Barry | 34.67   Bob Pettit | 34.87   Jason Kidd | 35.07   Kawhi Leonard | 36.07   George Mikan | 36.33   Patrick Ewing | 36.53   Bob Cousy | 37.21   Kevin McHale | 39.31   Steve Nash | 39.4   Chris Paul | 40.8   Walt Frazier | 42.57   Elvin Hayes | 42.8   James Harden | 43.2   Russell Westbrook | 43.2   Sam Jones | 43.83   George Gervin | 44.53   Draymond Green | 45.5   Gary Payton | 46.4   Dominique Wilkins | 46.8   Dolph Schayes | 48.75   Bill Walton | 50.27   Reggie Miller | 50.36   Ray Allen | 50.64   James Worthy | 50.85   Anthony Davis | 51.22   Joe Dumars | 51.5   Clyde Drexler | 52.14   Dave DeBusschere | 53   Paul Arizin | 53   Paul Pierce | 53.22   Mitch Richmond | 54   Willis Reed | 54   Dennis Rodman | 54.42   Adrian Dantley | 56   Tiny Archibald | 56.5   Carmelo Anthony | 56.8   Dave Bing | 56.8   Wes Unseld | 57.36   Bob McAdoo | 57.55   Jerry Lucas | 57.6   Pete Maravich | 58.21   Pau Gasol | 58.75   Chris Bosh | 59   Nate Thurman | 59   Billy Cunningham | 59.67   Manu Ginobili | 59.71   Vince Carter | 59.75   Earl Monroe | 60   Jack Sikma | 60   K.C. Jones | 60   Paul Westphal | 60   Tracy McGrady | 60.22   Dwight Howard | 60.33   Amare Stoudemire | 61   Grant Hill | 61   Neil Johnston | 61   Hal Greer | 61.5   Bill Sharman | 61.75   Klay Thompson | 62   Tony Parker | 62.3   Dikembe Mutombo | 62.4   Tommy Heinsohn | 62.67   Robert Parish | 62.9   Dave Cowens | 63.43   Dan Issel | 63.5   Sidney Moncrief | 63.5   Bernard King | 63.6   Nate Thurmond | 63.75   Spencer Haywood | 64   Derrick Rose | 65   Yao Ming | 65   Kyrie Irving | 65.75   Bob Lanier | 65.86   Chris Mullin | 66   David Thompson | 66   Dennis Johnson | 66   Lenny Wilkens | 66.2   Damian Lillard | 66.44   Alonzo Mourning | 66.67   Nikola Jokic | 66.67   Connie Hawkins | 67   Alex English | 67.27   Artis Gilmore | 67.5   Ben Wallace | 67.5   Slater Martin | 68.5   Bailey Howell | 70   Manu Ginobli | 70   Chris Webber | 71   Paul Gasol | 71   Tim Hardaway Sr. | 72   Vern Mikkelson | 72   Ed Macauley | 73   Paul George | 73   Gail Goodrich | 74   Robert Horry | 75
"maxey, thybulle, green, korkmaz, milton, drummond off the bench, with Paul Reed and Isiah Joe as deep bench rotation guys during the regular season aint bad.  problem is we'd have 3 injury prone starters that are all guarenteed to miss time, likely overlapping, at which point we'd be boned.   Frankly it's probably the best we could get at this point, so TBD.   i do wonder if this is smoke screen to try and force Minnesota into a panic trade where they over offer for simmons for fear of missing out."
Paul Reed feeling blessed
"Paul Reed was near my building in the city and my girlfriend asked for a picture and he was an incredibly nice dude.    That said, there’s no shot he was 6’9”. Looked way smaller than I’d have thought"
"Finally, I spent the whole summer worrying about how tall Paul Reed is."
Paul Reed ~kinda~ got out of the mud hence the one inch increase
Oh yeah these are bot upvotes lmao. Your argument is that Paul Reed shouldn’t have thrown him under the bus? Get to the end of your comment lmao.    Ben Simmons nor spica know you you don’t have to de all day
"quitting on your teammates is real alpha dog shit for real lmao. The organization doesn’t matter they’re just a business but the guys on the team need you and you’re just not showing up? Not just the Embiids chasing a legacy but like, Shake Milton, Paul Reed, Isaiah Joe, these guys need the team to succeed, need a role on a strong team that performs well to get them another contract. Not talking about the dudes making 110 million, the guys making $2m and hoping they have another contract in their career so they can set their kids up for life. But I guess if the “fuck you I got mine” is alpha shit then"
"Which FMVP's have gotten a triple double:  Jerry West: yes Willis Reed: no Kareem Abdul-Jabbar: yes Wilt Chamberlain: yes John Havlicek: yes Rick Barry: yes Jo Jo White: no Bill Walton: yes Wes Unseld: yes Dennis Johnson: no Magic Johnson: yes Cedric Maxwell: yes Moses Malone: no Larry Bird: yes James Worthy: no Joe Dumars: no Isiah Thomas: yes Michael Jordan: yes Hakeem Olajuwon: yes Tim Duncan: yes Shaquille O'Neal: yes Chauncey Billups: yes Dwyane Wade: yes Tony Parker: yes Paul Pierce: yes Kobe Bryant: yes Dirk Nowitzki: yes LeBron James: yes Andre Iguodala: yes Kevin Durant: yes Kawhi Leonard: yes Giannis Antetokounmpo: yes  1) why did I do this 2) by my calculations, 33 different players have won FMVP 3) 6 of them have not recorded a triple double (18% of FMVPs)"
"You want Paul Reed to set up a press conference in the middle of the summer just to support Ben Simmons? This is a bizarre request. That's not how things happen in the NBA, just looks desperate."
lmao you could hear Marv's paper rustle trying to figure out who in the hell Paul Reed was
Paul Reed
Paul Reed?
"Everyone but Mike Scott, Isaiah Joe, Anthony Tolliver, and Paul Reed. The only one I do not want to see on the floor under any circumstance is Scott.   Ceterum autem censeo Mike Scott esse delendam"
Paul Reed?
The formatting is making ADHD explode but good but I'd say it's good enough. Average not original MVP placing was 3.1.  &amp;#x200B;  YEAR	ORIGINAL MVP		                     NEW MVP  1956	Bob Pettit		               		      Bob Pettit  1957	Bob Cousy		               		       Bob Cousy  1958	Bill Russell		               		       Bill Russell  1959	Bob Pettit		               		       Elgin Baylor (3)  1960	Wilt Chamberlain		               	       Wilt Chamberlain  1961	Bill Russell		               		       Oscar Robertson (5)  1962	Bill Russell		               		        Jerry West (5)  1963	Bill Russell		               		        Red Kerr (6)  1964	Oscar Robertson		               		Hal Greer/Gus Johnson (6T) Elgin(6T)  1965	Bill Russell		                		Sam Jones (4)  1966	Wilt Chamberlain		               		Jerry Lucas (5) Sam Jones (5T)  1967	Wilt Chamberlain		               		Nate Thurmond (2)  1968	Wilt Chamberlain		               		Lenny Wilkens (2)  1969	Wes Unseld 		               		         Wes Unseld  1970	Willis Reed		                                Willis Reed  1971	Kareem Abdul-Jabbar		               	Kareem Abdul-Jabbar  1972	Kareem Abdul-Jabbar		               	John Havlicek (4)  1973	Dave 		               		                Dave Cowens  1974	Kareem Abdul-Jabbar		               	Bob McAdoo (2)  1975	Bob McAdoo		               		        Elvin Hayes (3)  1976	Kareem Abdul-Jabbar		               	Rick Barry (4)  1977	Kareem Abdul-Jabbar		               	Bill Walton (2)  1978	Bill Walton		               		        George Gervin (2)  1979	Moses Malone		               		Moses Malone  1980	Kareem Abdul-Jabbar		               	Julius Erving (2)  1981	Julius Erving		               		        Larry Bird (2)  1982	Moses Malone		               		Robert Parish (4)  1983	Moses Malone		               		Magic Johnson (3)  1984	Larry Bird		                		Bernard King (2)  1985	Larry Bird		                		Terry Cummings (5)  1986	Larry Bird		                		Dominique Wilkins (2)  1987	Magic Johnson		               		Michael Jordan (2)  1988	Michael Jordan		               		Charles Barkley (4)  1989	Magic Johnson		               		Karl Malone (3)  1990	Magic Johnson		               		Patrick Ewing (5)  1991	Michael Jordan		               		David Robinson (3)  1992	Michael Jordan		               		Clyde Drexler (2)  1993	Charles Barkley		               		Hakeem Olajuwon (2)  1994	Hakeem Olajuwon		               	Scottie Pippen (3)  1995	David Robinson		               		Shaquille O'Neal (2)  1996	Michael Jordan		               		Penny Hardaway (3)  1997	Karl Malone		               		        Grant Hill (3)  1998	Michael Jordan		               		Gary Payton (3)  1999	Karl Malone		               		        Alonzo Mourning (2)  2000	Shaquille O'Neal		               		Kevin Garnett (2)  2001	Allen Iverson		               		Allen Iverson  2002	Tim Duncan		               		        Tim Duncan  2003	Tim Duncan		               		        Kobe Bryant (3)  2004	Kevin Garnett		               		Jermaine O'Neal  2005	Steve Nash		               		        Steve Nash  2006	Steve Nash		               		        Lebron James (2)  2007	Dirk Nowitzki		               		Dirk Nowitzki  2008	Kobe Bryant		               		        Chris Paul (2)  2009	Lebron James		               		Dwyane Wade (3)  2010	Lebron James		               		Kevin Durant (2)  2011	Derrick Rose		               		        Derrick Rose  2012	Lebron James		               		Tony Parker (5)  2013	Lebron James		               		Carmelo Anthony (3)  2014	Kevin Durant		               		        Blake Griffin (3)  2015	Stephen Curry		               		Stephen Curry  2016	Stephen Curry		               		Kawhi Leonard (2)  2017	Russell Westbrook		               	Russell Westbrook  2018	James Harden		               		James Harden  2019	Giannis Antetokounmpo		        Giannis Antetokounmpo  2020	Giannis Antetokounmpo		        Luka Doncic (4)  u/fukdatsonn
