"I think it was always a deep draft. A lot of guys have came in and helped their teams, even some late picks second rounders.   Pritchard has been great for the Celtics. Theo Maledon has looked very good. Xavier Tillman and Desmond Bane are effective rotation players and spot starters for a .500 team. Immanuel Quickley looks like he's gonna be a very good player. Isaiah Joe from Philly is still very raw but when they needed a shooter to insert into the lineup he played generally well.   And then I think there's quite a couple more second rounders who will become solid rotation players. Saben Lee has had some good flashes for Detroit, Paul Reed is tearing up the  G League for Philly.   All of those guys picked 20+, and then add on Wiseman, Patrick Williams, Lamelo, Halibuton with all-star potential and then Bey, Achiuwa, Maxey from non-lottery picks showing future starter ability. It's a good draft, and there's always going to be late bloomers as well"
"I've been discussing this trade with Raptors fans for months now, and they have given the exact same response. You guys don't care about Tisse or Maxey. Instead how about Paul Reed, Tony Bradley, and multiple firsts (I think we can give out 3 with some type of protections)?"
Paul Reed
"Because we hate the Celtics.  That's just the way it is.  But for real, not trying to be a dick, but Nesmith is completely out of your rotation.  He has no value right now despite being a good prospect and a high draft pick.  That's like the Sixers saying Paul Reed has trade value cause he's killing it in the G League.  He most certainly does not have any value right now either"
[Paul Reed highlights here.](https://youtu.be/LEC_lkpD3rM)
Paul Reed
Getting off that contract is huge.   If they give us Paul Reed I’m okay with it. PJs about to be gone for 2 seconds anyways
Paul reed and some seconds and I’m down
paul reed. o u t t h e m u d
Paul Reed will win MVP 12 years straight once we get him out the mud.
Paul Reed snubbed
No. It’s Paul Reed. We just need to pull him out the mud.
"No need to be a condescending dickhead. What I said isn’t really that outlandish. Think it was actually relatively objective.   Yes, Smith was a miss. The circumstances around his situation sucked. Was high on him before the draft and would’ve loved to see him actually develop. But, overall it was still a successful draft considering that year we got Shamet+the heat pick - which became our third “star” in Tobias Harris, while also grabbing Shake Milton who is our best bench player.   Paul Reed was the 58th pick of the draft. If he can become our cheap backup, how is that not a win? We pay max deals to 3 players. We need to find value in later picks. Reed is currently averaging 21/12/2 with 2 blocks and 2 steals shooting .587/.412/.714 in the GLeague. I’m not saying he’s a fucking star, just saying we’re able to find good value.   Every team misses on stars in a draft. Hell, even your Bulls passed on SGA for Wendell Carter. Shit happens"
"I still think the pick made sense from a value perspective (the Miami pick was viewed as a very valuable asset at the time) and Zhaire Smith was seen as an extremely high upside defender with good shot instincts. SGA was viewed as an equally raw player at the time, and Bridges was seen as a low ceiling/middle floor type player who was on the older side (obviously he’s taken some spectacular leaps)  I’d say the last few years we’ve actually been pretty effective in drafting to fill out the roster.   The last 3 drafts have gotten us:  - Shake Milton who is our primary bench scorer  - Landry Shamet who played a lot before being a key piece in the Harris trade  - Matisse Thybulle who is our primary bench defender who very well could slot into the starters role next year  - Tyrese Maxey who is our high upside combo guard who should help lead the bench and eventually push for a starting role  - Isaiah Joe who will be the bench shooter replacing Korkmaz next year and has defended a bit better than expected in limited run  - Paul Reed who is absolutely obliterating the GLeague and should be our bench big next season.    I’d say we’ve actually done a pretty good job hitting on contributors with upside relative to their draft position."
"Paul Reed is a Sixer and the Sixers beat the Mavs last night.  Following your nonsensical logic, Reed, who didn't play a second last night, is the one responsible for the Mavs loss."
Paul Reed would’ve gotten minutes tonight.
"Like it when Paul Reed makes a FT, hate it when Paul Reed misses a FT"
Announce Paul Reed as the b2b G-league player of the week cowards
Paul Reed G League MVP szn
"Hey same, Paul Reed has been amazing"
Half-time means take a Blue Coats break on ESPN+ to see Paul Reed continue to cook.
"Paul Reed aint coming back until the G-League season ends. And, to be fair to Mike Scott, he's been out for like two months with a leg injury."
Paul reed has to be better than Mike Scott
Paul Reed still stuck in the mud ☹
I would’ve locked myself in my room with a tub of ice cream and Paul Reed G-league highlights for a week if the Sixers lost this game tbh
Paul Reed is really going to get G-league MVP/DPOY/ROTY/FMVP
You're all just lucky Paul Reed is in the G-League Bubble.
"paul reed the 6'9 center that's played 25% of his minutes as a small forward and not a single one as a center  looks like you're the one that's unable of having a rational discussion, literally everything you wrote was a lie"
"Dwight Howard, Tony Bradley, Paul Reed.  Reed who was called up from the G league for that game.  But there’s probably no possibility you are going to have a rational conversation about Embiid or the Sixers so there’s no point in further discussion"
C: calling up Paul Reed
Paul Reed
It’s kind of crazy that 31 teams are fucked and they just don’t know it yet.   Paul Reed is coming and nobody can stop him 😤
Paul Reed
"It's been said Tilman was so pissed off at Morey that he wanted like every player and asset we have lol. It would be like Embiid, Harden, Seth Curry Paul Reed, and Isaiah Joe out there lmao"
1. Korkmaz isn't very good and should not get minutes on a championship contender in the playoffs  2. Paul Reed will eventually get out of the mud and become the next Lebron
I'd protect Paul Reed before Korkmaz
Paul Reed aka future G league bubble MVP aka Bball Paul aka out the mud
The mud had no shot at keepin Paul Reed down
"**Americans (11)**: Danny Green, Tyrese Maxey, Dwight Howard, Tobias Harris, Shake Milton, Isaiah Joe, Tony Bradley, Mike Scott, Terrance Ferguson, Paul Reed, Rayjon Tucker.  **Australians (2):** Ben Simmons, Matisse Thybulle.   **Cameroonians (1):** Joel Embiid.   **Turks (1):** Furkan Korkmaz.   **Frenchman (1):** Vincent Poirier."
You mean CUrrent HOFer Paul Reed  https://rutgersnewarkathletics.com/hof.aspx?hof=59&amp;path=gen&amp;kiosk=
Watch 37 year old Joel win 6MOTY coming off the bench for Paul Reed
Paul Reed is better. No.
Paul Reed. He's finally out the mud
"Ima just say it. Paul Pierce was a good player but be totally fucked around for his Willis Reed moment he was fucking fine or minorly hurt at best. He was fucking okay, don't write him up like he suffered the same fucking injury he didn't. He bitched out his way to this God like figure and hes not. Hes takes are mostly awful as well."
Paul Reed
Paul Reed bro straight out the mud
Paul Reed?
"this man got out scored by Paul Reed, James Michael Scott &amp; Dwight David Howard II, how embarrassing"
Paul Reed 10 pts on 5/7 in 13 minutes &gt; Ben Simmons 7 pts on 2/6 in 26 minutes.
And? He did fuck all otherwise. At least Paul Reed plays with energy and makes an effort to play defense. Mike Scott looks like he is on Ketamine on defense.
"I don’t think he has. He got out scored by Dwight Howard, Paul Reed, and Mike Scott today. I want to give him the benefit of the doubt but I have no faith in his offensive ability."
"I’m worried for the playoffs. The regular season no longer matters for the Sixers. Embiid is a MVP caliber player and they can’t wait on Ben Simmons much longer. He is an elite defender and does many things well, but games like today show his biggest flaws. He looks straight up disinterested at times, and even though he’s not a scorer he should not be getting out scored by Mike Scott, Dwight Howard and Paul Reed in a game without Joel. This year’s playoffs will be very interesting."
Paul Reed needs to play more and Mike Scott needs to get back into his beehive.
Poor man’s Paul Reed
Ben Simmons gotta forfeit his game check to Paul Reed and Isaiah Joe
Paul Reed
Fuck Doc tho. Give Paul Reed Mike Scott's minutes.
"So Paul Reed will break Jokic’s new record, huh."
"So Paul Reed will break Jokic’s new record, huh."
"Ja’Sean Tate’s draft class is 2018. He went undrafted and played overseas. So he’s a rookie this year but doesn’t qualify for this particular draft class. If you want a late 2nd round player who would now be a top 20 pick (and I think top 15 imo), I would go with Paul Reed."
"LeBron James, Los Angeles Lakers  Kevin Durant, Brooklyn Nets  Paul Reed, Philadelphia 76ers"
I don’t want him I’d rather get Isaiah Joe or Paul Reed but I doubt you’d give either up. Matisse is overrated.
Paul Reed?
"Well according to this [article](https://www.google.com/amp/s/sixerswire.usatoday.com/2021/03/19/sixers-rookie-paul-reed-loves-the-fans-says-his-confidence-is-high/amp/) it basically means to work hard and grind it out. I believe the expression came from Paul himself on Twitter. Must be a Florida thing. It’s parallels a bit of the Sixer’s Process, it’s no wonder he’s a fan favorite."
"Since nobody else is telling you, Paul Reed, or BBall Paul was the G League MVP for the Blue Coats and is now on a contract with the Sixers.  Just the fan base meme'ing."
Paul Reed and Lu Dort
Paul Reed
Euroleague MVP Luka Doncic  G-League MVP Paul Reed
I had Paul Reed as a late first. I'm stunned he fell a full round. Happy for him
"Play Paul Reed you coward  And if not, play 4v5 instead of having Mike Scott on the court"
"This is facts.   Precious was always an overrated prospect, there were a solid amount of big men better than like Xavier Tillman, Paul Reed, Isiah Stewart.  It’s not like he’s super young either which you mentioned, he’s the same age as paul reed and averaged worst stats than him in college and Reed looks better than him now as well."
"Precious was such an overrated prospect, there were a solid amount of big men better than him. I don’t understand the appeal at all.  Xavier Tillman, Paul Reed, Isiah Stewart.  It’s not like he’s super young either he’s the same age as paul reed and averaged worst stats than him in college."
It would be unfair to include Paul Reed in any discussion about the best Sixer.
Only if we’re not including the Mudman Paul Reed
I wanted him to take Mike Scott's minutes if Doc was insistent on not using Paul Reed.
"Philly, they have Ben and Joel under contract for the next few years also unlike many other contenders Philly still has various first round picks over the next few years. Also they still have young and upcoming players such as Matisse, Shake Milton, Maxey, Paul Reed and Isaiah Joe. They have a great combination of win now players and assets to help the team get better over the next couple of years."
And to beat Rayjon Tucker and Paul Reed in the east.
"Clippers played really well tonight. Not really frustrated at the loss from a play perspective.    I am, however, really frustrated at the officials for continually overstepping boundaries with ejections. Howard shouldn’t have been ejected 2 games in a row. What he did in these games was extremely minor.   Also frustrated at Doc for refusing to sub Mike Scott out for Paul Reed to at least see what would happen.   But end of the day, this type of loss isn’t a huge deal for this team. Clippers are great. It’s a damn shame we couldn’t watch Embiid eat Zubac Alive, but it’s not a big deal.   I won’t ever root for the Clippers as long as Marcus Morris is on their team, which is a shame considering I truly do like watching the rest of their team play."
Paul reed is just collecting dust
Dwight continues to tank for Paul Reed.
Paul Reed is winning Finals MVP this year. Change my mind.
Sixers have Paul Reed so Philly easily
Weird way to spell Paul Reed
Paul Reed
"It’s so sick, it’s funny how people might criticize him for being “detached” from the game as an analytics guy, but he so clearly loves the game.  He had a halftime interview during our G League team’s game where he talked about the progress of the team through the year, the importance of the program, and his thoughts in the game thus far. He’s like two weeks away from saying “Paul Reed is untouchable.”"
Sorry Paul Reed had to burst your bubble
No one is pointing out the random Paul Reed propaganda at the end of this article?
"I mean seriously we started a game with Isaiah Joe, Tyrese Maxey, Dakota Mathias, Danny Green, and Dwight Howard with a bench of Paul Reed, Tony Bradley, and supposedly Mike Scott I’m not sure why anyone is shocked that our differential is a bit off."
Paul Reed almost singlehandedly led us to a G league championship
prefer bball paul at the 5 but I'll take any paul reed minutes
"Paul ""Muddy"" Reed hitting that sweep hook"
"The people want, nay, demand Paul ""in the dirt"" Reed!"
crowd is yelling for paul reed lol
WE WANT PAUL REED
Alaa with the Paul Reed reference. I see you OUT THE MUD!!
ITS PAUL REED TIME
Oh I hope we get a Paul Reed sighting
"No stars are available right now. I’d imagine the Embiid Simmons pairing will be allowed to prove themselves this season, and if they fall short again, there will be heavy rumours but they’ll get one last shot before trading one of the two. Other than that they have pretty limited assets to trade. Maxey is an option, but he’s average just under 8 PPG and 2 APG, he’s going to be a good player, but not remotely enough to bring in a real scoring threat. Trading Harris is an option, but he’s in the second year of his 5 year $180 million contract. He’s still tradeable, but he’s a 20 PPG shot creator, he’s probably their best option now. I can’t see them trading for a better option. He’s not on a great contract, but he’s done well this year, and there’s no upgrade that they can get at the moment.  They have some other assets, but if they want to compete, they should hold onto them. Thybulle is a good asset, but wouldn’t you want to hold onto an elite wing defender who’s an alright enough 3 point shooter? They’ve got lesser assets like Ferguson, Paul Reed and Isaiah Joe, but they haven’t proven to be more than subpar rotation pieces, and they’re just not going to net you great players. If a superstar becomes available and they can make an offer of Harris, Maxey, Ferguson and picks, then by all means do it. But at the moment, I can’t see any trade options for them."
Paul “still ain’t made it out the mud” Reed
"who cares, Paul Reed is on"
"I think George Hill to Philly would be cool if they don't pull off the Buddy deal that's been in some unsubstantiated rumours    Hill won't fetch you a Maxey or Mitlon or anything because of age, but maybe Isaiah Joe/Paul Reed or something as the young player. I haven't looked at the salaries to see how it would work"
"Idk man, if I’m the Spurs I’d look at Paul Reed and give up Patty Mills and a second for him."
"If I were the Raptors, I would look long and hard at Paul Reed too. Dude is tearing up the G league and will develop into a really solid player. Although I doubt Toronto is interested in a package of Maxey, Reed, Danny Green, Mike Scott, and a first."
Paul Reed better don’t @
"You really wanna see Sixers fans spam Paul Reed highlights, huh?"
"Anecdotal I guess but as someone who consumes a ton of basketball media I’ve noticed him becoming more mainstream. Like I mentioned his work gets brought up on the ringer now regularly and that’s a new development, same with his work being referenced on the Lowe Post. Also makes semi-regular appearances on the Athletic basketball podcast   He’s definitely respected in deeper basketball circles, I’m deep into the draft world and all the Twitter draft analysts like his work and several of them have been hired by now. Also has had a ton of the smartest basketball content creators on his podcast, like he just had the basketball index guys to talk their new metric   Also Fwiw, PER is outdated but idk if John Hollinger is. He was banging the drum for Paul Reed all of last year and now Paul Reed is one of the best players in the G league, so I think he’s still on the pulse of things"
All I know about this guy is that he can shoot and that he got his soul stolen by Paul Reed last night.
"So? All that changes is the number of jerseys sold. If you're a fan of a player the reason behind you buying their jersey doesn't change depending on how good they are. If you're gonna buy their jersey, you're gonna buy their jersey. The reasoning doesn't change because they're a star; if somebody has an affinity towards Paul Reed or Joel Embiid it isn't different. Not everybody that loves Steph bought his jersey already in the past 6 years. It's absurd to think that like everybody who would buy a Rui jersey had already done so. Maybe people are just getting into it, maybe they can afford it now when they couldn't then, etc  I still buy Ronaldo jerseys and he hasn't played in over a decade. There's no new jerseys coming out, I don't grow more fond of him. The psychology of buying a player's jersey isn't so simple as ""I like him, I'll buy his jersey."" There's a ton of factors that drive consumers"
Paul Reed
"honestly, the paul reed out the mud meme making it this far is pretty hilarious"
Isiah Thomas  Dwight Howard  Carmelo Anthony  Walt Frazier  Willis Reed  Paul Pierce  Reggie Miller
"Exactly. We didn't even get to play Isaiah Joe last season and he could use the minutes, there's no playing time to be had outside injuries. Don't even get me started on how Paul Reed has to sit to watch andre Drummond"
"True who could ever pass up springer, Joe and paul Reed?!?!"
"Yeah just completely ignore the other assets the Sixers have available. It’s not like we have the ability to trade the rights to our next 7 FRPs as well as young, promising prospects like Thybulle, Maxey and to an extent Springer, Joe, and Paul Reed."
"The likely scenario would probably be:  Lillard, Malik Beasley and Pat Bev to the Sixers    Simmons to Minnesota   2022 unprotected FRP (Sota)   2022 top 3 protected FRP (Sixers)   2023 Pick swap (Sota)   2024 top 5 protected FRP (Sota)   2024 top 5 protected pick (Sixers)   Tyrese Maxey   Paul Reed   Matisse Thybulle   Jaden Springer   Naz Reid    To the Blazers. Four firsts, a swap and four young talented cheap players (albeit no potential super stars).  They then trade McCollum for another good first or two decent firsts and start over."
"Mirotic's contract with Barcelona was for 6 years and $79 million and he signed it before Covid. Covid is why he took such a big paycut the following year. Not disagreeing with the rest of your points, but I'd still like to know about which exact players somebody's talking about when they're supposedly better than some NBA players. I think the figure is 90-95%, and not necessarily higher than 95%.  I have trouble believing that Mo Bamba would have a good career with Real Madrid, or that James Wiseman would be a whole lot better with Fenerbahce. Here's a short list of Eastern Conference players currently with contracts for 2021-22 who I don't think should be in the NBA:  1. Udonis Haslem  2. Devin Cannady (Magic)  3. Mo Bamba  4. Cassius Winston (Wizards)  5. Nick Richards (Hornets)  6. Sam Merrill (Bucks)  7. Kelan Martin (Pacers)  8. Sekou Doumbouya  9. Cory Joseph  10. Kevin Knox  11. Jabari Parker  12. Paul Reed (Sixers)  13. Sam Dekker  I'm sure there's a few more in there."
"Simmons to Minnesota, Lillard to Philly, Paul Reed, Tyrese Maxey, 4 1sts from Philly and Naz Reid, Malik Beasley, 2 1sts from Minny to Portland"
Paul Reed anyone?
"Nice, here's a table with the top three category leaders.  |**Player**|**PPG**| |:--|--:| |Cam Thomas|27.0| |Tyrese Maxey|26.0| |Desmond Bane|24.0|  |**Player**|**REB**| |:--|--:| |Jalen Smith|12.5| |Paul Reed|12.0| |John Konchar|12.0|  |**Player**|**AST**| |:--|--:| |Payton Pritchard|8.5| |Immanuel Quickley|7.8| |Sharife Cooper|7.3|  |**Player**|**BLK**| |:--|--:| |Daniel Oturu|3.3| |Alperen Sengun|3.0| |Sekou Doumbouya|3.0|  |**Player**|**STL**| |:--|--:| |Tremont Waters|3.5| |Jordan Goodwin|3.3| |Louis King|3.2|"
"Morey got us out of the Horford contract to get us Danny Green who we now have for 2 more years, traded Josh Richardson for 2 more years of Seth Curry, drafted Tyrese Maxey and drafted Paul Reed, not to mention that was his first year as a GM (even though technically Elton Brand is our “GM”). The only trade so far that was bad was trading Tony Bradley for George Hill, which was an understandable move at the time as we needed veteran depth in the PG position.   I’d say he’s done a damn good job so far for his first year here. Far better than Elton Brand for sure"
Still upset we haven't given him a min contract to be on our bench. I'd love to do that but Doc would probably give him minutes over Paul Reed. I just want Mike there for the locker room.
Paul Reed so you can have bball paul
This was Paul Reed - that was the adult in the gym.
Paul Reed looks so damn good. Will he get minutes this year?
"He’s so great, he and Paul Reed"
Paul Reed.
Man if you aren’t building around Paul Reed then your team may never get out the mud
I can’t believe the Sixers are going to go from Embiid’s beautiful post game to [this guy](https://youtu.be/A12E66l85dM) every time the bench comes in  (hopefully paul reed takes drummond’s minutes by the end of the year)
"If you compare number of good players relative to teams in the league you can have a pretty insane Centrr position mid 60s : Wilt, Russell, Reed, Bellamy, Embry, Beaty, Thurmond, Lucas and probably others.   Also today's guard era with : Steph, Harden, Westbrook, Paul, Booker, Young, Doncic, LeBron James PG version, Lillard, Irving, Holiday, McCollum, Lowry, Butler, George etc..."
Where's Paul Reed?
"And that list is just the call ups. It doesn't include players like Siakam, Chris Boucher, Richaun Holmes, Paul Reed, JJ Barea, Jeremy Lin, Gerald Green and others who weren't called up, but rather transitioned between seasons."
"lets go players by players  Precious is already other than THT at 21. Precious has no offensive game right now outside of rim runs and dunks. He hasnt attemtped at a 3 yet. only played 12mins a game last year avg 5 pts. Some defensive upside due to atheleticsm but rmb he is 21 so not a young rookie. at 6'8 wont be a small ball 5 either so will be a 4 most of his career. a 4 without a 3pt shot is a liability long term in todays game.  Raps didn't have complete control in the season either. Lowry was expiring then.oks like a Richaun Holmes type . Id take Paul Reed over him too but thats my homerism.  THT is still 20, has played deep into the playoffs, 6'4 guard that is jack of all trade master of none kind of guy. but due to youth and athleticism has the potential to be more. Played deep into a finals run. already has 2 years of NBA experience compared to Precious one but is younger.  Thybulle&gt;&gt;&gt; Precious and idk how its even a question lol. 2nd year NBA player. Already made 2nd teall All NBA defense. Has all defensive steals and block metrics. is already a top 15-20 iso defender in the NBA if not top 10. top 10 team defender already. lack of offensive game is true but Precious has no offensive game outside of dunks and an ineffiecient mid range himself. So lack of offensive game is a wash and Thybulle is a elite NBA defender already. No potential or projection but already 2nd team All nba defense good.  Caruso, reddits darling speaks for himself and i dont gotta explain him.  Raps didn't have complete control in the season either. Lowry was an expiring then.  Herro was never offered idk why raps fans believe that. Herro and Precious are no where the same level in terms of assets or worth. Precious is a projection potential pick. Herro has shown his value already in NBA games, and the NBA playoffs."
"Morey was thinking that our only backup 4 or 5 is Paul Reed, and that getting Drummond for the minimum is pretty good value considering it doesn't effect our ability to go out and get a stretch 5 for the MLE or minimum"
well we had paul reed but doc didn't think it was worth him getting minutes in the regular season. he'd fuck up once and then doc would bench him and didn't give him any chance to develop.  now he's going to do the same shit but with drummond who is garbage.
"it's not that we don't like him, we just didn't want a player like him on the roster anymore.  drummond is not a good compromise. i'd rather just not have a player of that profile on the team in general. much rather would have run out our rookie as backup C or Paul Reed.  now doc will play drummond a million minutes. barf."
