"Sixers fan here:  I feel like there was a narrative that got established about 30-40 games into last season that ran something along the lines of “hey! Dwight still has something left in the tank! Look at that! How’d the sixers steal him away on a vet min? Lakers really blew it!” etc  To be fair, I *was* all aboard this train around last March, and given the track record of backup centers during the Embiid era, I think it’s fair to label Dwight’s time on the sixers a [Good Time(https://mobile.twitter.com/LaurenMRosen/status/1378025905734483971). I mostly enjoyed watching Dwight and his antics, and for the first half of the season he was a pretty solid backup for Embiid.   I think it’s probably gotten lost in the *sturm und drang* of our All-Star point guard’s spectacular mental implosion in the playoffs, but the wheels *reeeeeally* started coming off the Dwight bus sometime after the ASB. Just take a gander at [his game log](https://www.basketball-reference.com/players/h/howardw01/gamelog/2021) and ask yourself why his minutes got so low at the end of the season while Embiid was out, Dwight was nominally healthy, and the Sixers were fighting for a (sadly useless) #1 seed.  I know the Simmons situation takes up most of people’s attention, but Dwight did not have a good playoffs, to say the least. He had more fouls than minutes in the playoffs. He could somehow pick up offensive fouls while his team was taking free throws.   I know there’s plenty of exceptions to The Wisdom of the Crowd (especially on Reddit, lol), but go take a gander at the sixers sub if you want to see how completely100% OK sixers fans are with this signing (pay no mind to the deranged Paul Reed stans; they’re mostly harmless)  I know people have thought Dwight’s career was cooked before and been wrong, and maybe there is something left in the tank, but as a Sixers’ fan (and denizen of LA who values an entertaining Lakers team over a good one), I’m not worried about losing Dwight in the slightest, even at a vet min."
Dwight and Paul reed would bring back gold in so many sports
CJ+2 firsts+*maybe* Covington(if Philly sends 28 and Paul Reed back)
got the next Giannis last year. Paul Reed baby
i love Paul Reed but isn’t he like 4 years older than Kuminga
I don’t get the Kuminga hype at all. He was terrible in the g-league where Nico Mannion and Paul Reed looked like Nash and Hakeem. If Kuminga went to college his draft stock would be a lot lower like BJ Boston.
"Fred VanVleet, Matisse Thybulle, OG Anunoby, Tobias Harris, Joel Embiid.   Tyrese Maxey, Shake Milton, Furkan Korkmaz, Paul Reed, Dwight Howard.   If they brought back Korkmaz and Dwight, that would be a horrible team to face. The defence with FVV, Matisse, OG and Joel would be almost impenetrable."
Paul Reed era begins
"I'd love to get him, but it's hard to figure out who on our roster we'd be willing to move for him. Boucher is basically a fast-forwarded version of what Paul Reed projects to be (with better shot-blocking). For a UFA that will likely leave anyways, maybe a picks-driven deal. I really just want to pair him with Matisse and watch them fling themselves around at shooters for 10 minutes a game."
"Paul Pierce and Vince Carter. ESPN had them ahead of players like Bob McAdoo, Willis Reed, and Dave Cowens all who were MVP, or near MVP level in their time."
"The funny thing is that our fan base wanted to trade for Paul both of those years.  That’s how desperate we were for a playmaker who could shoot.  But let’s be honest.  We’re not matching up with the Nets regardless.  If they get hurt, we’re not matching up against the Bucks or the heat.    Simmons unwillingness to improve is the primary reason for that.  I don’t think he should be rewarded for destroying the franchise.  I would get more satisfaction from punishing him then from being a four or five seed and getting knocked out in the first round.  I’m fine resting Embiid and using this as a developmental year for Maxey, Shake, Thybulle, Reed, Joe and Springer."
I saw Chris paul his rookie year walking around OKC (hornets - when they relocated for Katrina) and talked to him for a little bit. Super nice guy. Also saw JR smith and he was ok but didn’t really wanna talk to people   Met willis reed and he was cool. I shook his hand and they were HUGE
You mean Paul Reed? NO DEAL
"Trade Machines tell me that it's possible if Houston gets a contract dump of a bunch of players - Malik Beasley, Taurean Prince, Danny Green, Shake Milton, Naz Reid, Paul Reed and Isaiah Joe would work, with two or three first round picks as sweetener.   So many players means that a 4th team might be needed (OKC or Memphis or San Antonio?).  Basically:   Philadelphia: John Wall and Jaden McDaniels, some 2nd rounders?  Minessota: Ben Simmons, some 2nd rounders?   Houston: Malik Beasley, Taurean Prince, Danny Green, Shake Milton, Naz Reid, Paul Reed and Isaiah Joe + 2 first round picks.  http://www.espn.com/nba/tradeMachine"
"We are only two seasons removed from 2018 (considering he missed 19) where Cam threw for 3400 yards, 24 touchdowns, 13 INTs on 68% completion, and rushed for an additional 500 with 4 TDs. That's basically Baker Mayfield from last year, with 300 yards more rushing and a better completion percentage.  That was Cam's highest completion % for his career, tied for 2nd most TDs in his career, lower than average INTs, and his second highest QBR (icky). and probably his best overall year of his career except for his MVP year which just looks like an insane outlier in comparison.   I think maybe the issue is that people are looking at that 2015 year and assuming that was kind of how he was playing for a few years there, but he wasn't. That year Cam had 11 TDs more than his next best year, tied for the lowest INTs, the most yards he threw for since his first 2 years in the league, and the second most rushing TDs he ever had.   If you take out that year from the equation then his ""prime"" lasted until he got to NE which was a terrible fit for him. Every year was wildly similar to each other. The only thing that was different in Carolina year by year was the team around him, not really Cam at all when healthy.   I think we are both overrating how good Cam was outside of that 2015 year, and underrating the consistency he had up until he got knocked out in 2019.   I think the best comp for Cam might be DeMar DeRozan in that sense. Had that stellar 2018 year and then everything else around it is just, like, the same. Other guys in that same mold are Arenas (though his career was entirely derailed due to injury, not the teams around him or anything else), Jermaine O'Neal (3rd in MVP in 04-05), Bob McAdoo, and Willis Reed.  If that Panthers team stays together, Olsen is healthy, Peanut is healthy, O-line stays healthy, running backs stay healthy, Benjamin doesn't eat himself out of the NFL, I think we would probably have a much different view on Cam. He would probably still be in Carolina too. Though, the injuries may have caught up to him by now because a guy in his 30s who took some of the most insane hits during the year probably isn't recovering like he used to. Still, I wonder how he would have done if he went anywhere other than NE considering the last healthy Cam we saw, again, had his 2nd best season of his career individually with a pretty shitty team.  * Also there exists the rumor that the Denver Broncos in 2015 broke Cam Newton mentally and he didn't recover from that. Not sure if there's any validity to that but if that's the case maybe Cam is Paul George or a supercharged Nick Anderson."
Yeah like this one. Others ive had over the yrs.   Ben Simmons-JaDeveon Clowney  Blake Griffin--Tony Romo  Chris Paul--Phillip Rivers  Lamar Jackson--Allen Iverson  Ja Morant--Kyler Murray  Jimmy Butler--Richard Sherman  Draymond Green--Donta Hightower  Kevin Garnett--Ed Reed  Rob Gronkowski--Shaq  Kyle Lowry--Steve Smith  Dirk Nowitzki--Antonio Gates
"Sixers are well poised for Ben to stay home.  They have Tyrese Maxey and Shake Milton competing for minutes already, and then drafted Jaden Springer.  Milton is a legit nba player, and Maxey looks to be even better.    This is a Khawi Leonard-San Antonio holdout/injury situation.  Both sided need to call it a mental health break, like Simone Biles and Naomi Osaka did.    Considering Philly's bench also includes prospects they are high on and want to showcase for potential trades, like Matisse Thybulle, Furkan Korkmaz, Bball Paul Reed and Isaiah Joe, seems to me the Sixers can win on the court and develop at the same time Ben sits out.    If any of Chicago, Portland or Minnesota gets off to a poor start while the Sixers and Embiid chug along, philly's chances of getting Lillard, Lavine, or Edwards increases.    Edwards most likely, because KAT, Malik Beasley and Dangelo Russell and Jaden McDaniels all fit around Ben Simmons  better than Edwards if the Wolves were to trade for him.  Plus, Morey built a team lat year suited for James Harden, stands to reason the next best thing would be a prospect with Harden's skillset like Anthony Edwards.  ."
"He's pretty close with some of the Guys on the team, like Maxey and Paul Reed. I doubt hes going to want to ruin the games for them just to be petty towards the 76ers Organization."
Ben Simmons trade won’t get done by the start of the regular season and Simmons doesn’t play - Matisse Thybulle and Paul Reed get playing time and surprise a lot of people.
"Haha, in shambles? We’re currently discussing Charles Bassey and getting Paul Reed out of the mud"
"As a blazer fan from 2004- June 2021 I would love cj on the team. He fits great with Joel due to his lack of need of pnr, has a decent half court off ball passing game, and his huge amount of gravity anywhere on the court relative to his nba value. The whole summer I was an advocate of CJ + Roco for tobi + Thybulle + Paul Reed as I think it would push the blazers to being easily one of the top 5 in the west and the sixers into championship contention.  That all being said, I don't think CJ + Tobi + Joel is a championship contender. What ever somewhat possible trade happens in the next couple of months, up to and including Anthony Edwards, the sixers will be in a worse possition. CJ + Roco + Simmons + Nasir does not replace the value of a 24 year old all nba player on a 4 year contract. What the sixers need are trade assets and players that are easy to build around. CJ is great, but D'Lo is a better facilitator. The blazers assets exist, but are not as good as the Timberwolves."
Yes sir! Paul Reed is also there.
"Based on what? And what do you mean by European? Euroleague teams or just a random team from Germany or Turkey? Do you have any idea how many great NBA players spent time in the G League? Just this year KPJ played a good 10 games in the G league and scored 50 points in an NBA game. Do you actually think that Jordan Pool or Jalen Green are less talented than many Euroleague players. Do you have any idea what a monster Paul Reed is? Obviously the game is played differently and rules favor a different playing style but the talent level in the G league is amazing. My claim isn't that Euroleague competition isn't better (see my original comment), teams are well coached, rosters stay longer together and the motivation to play hard for the team is higher."
No such thing as Europe as it pertains to basketball. The best G league players are bench warmers in the Swedish league? Here are some of the players playing in the g league last year: Kevin Porter Jr.  Jalen Green   jordan Poole.  Paul Reed.  Jared Harper.  Henry Ellenson.  Jeremy Lin.  Nico Manion.  Oshae Brissett.  Kobi Simmons.  KJ Martin.  Jalen Adams.  Vernon Carey jr Antonio Blakeney.   Any of these players can play for top European clubs. Some would dominate. Some actually signed with European clubs and many more were called up to the NBA. Some were sent for development and played a good 10-15 games.
"Paul reed is a big question mark. He may turn out to be great and someone like the names you mentioned. I think most of the people I listed were people who are already established as either busts (Bender, Okafor) or ended up being really good (Bam/Ayton)."
"Paul Reed (who’s also a PF/C) had an even better summer league this year and he’s not on your list.   Reed just needs a chance to play. He’s got Siakam/Wood like potential (both were end of the bench players early on), but he just can’t get a chance to play in Philly. Ironically, Simmons holding out and not being traded for like McDaniels who plays an overlapping position might end up netting him a few extra minutes, although they don’t overlap too much in position."
"Probably around 10th, but it also depends on the exact team that’s drafting him and what their needs are. Charlotte who drafted Bouknight would be a team that could have drafted THT if he were available. However, a major flaw with THT is he’s not a good shooter - worse than a lot of these lottery picks, and that’s something that isn’t helped by the fact he’s had 2 years of NBA training and hasn’t improved that much.   Call me crazy, but I actually think Paul Reed (who was nearby undrafted last year) should at least be a late lottery pick in this same draft - he just needs an opportunity to play."
Just give Paul Reed more playing time - problem fixed.
The hope (or at least my hope) is that Doc is willing to play Paul Reed in that role. He needs to get more run.
"It’s completely arbitrary. There’s really only a handful of stars in the league today  Steph, KD, Lebron, Paul Reed"
"Yeah, it's weird Paul Reed isn't involved."
"As unlikely as it may seem right now, the Sixers path to success is for Zach Lavine to inform the Bulls he won't re-sign despite the moves they made, and for him and Rich Paul to see his best chance at a ring with fellow Klutch client Ben Simmons in Philadelphia.  Winning a chip or coming close with the Sixers dramatically increases the value of three Klutch Sports properties (Simmons, Lavine, Maxey).   Meanwhile, I'm not sure Demar Derozan and Lonzo Ball fit all that well around Lavine.  Is Derozan gonna bury 3pt shots after Lavine drives and kicks it?  I dont think so.  Is Lavine going to cede the #1 scoring role to Derozan and wait for kickouts?  I don't think so.  With all of them together, I still don't think they're better than Atlanta or Boston.   Besides that, the Bulls lost Thaddeus Young and Otto Portert and Lauri Markkanen, but just took Portland's FRP instead of Larry Nance Jr.  I suspect they signed Derozan to a marquee contract and Lonzo Ball to carry the weight after Lavine leaves instead of seriously thinking those guys can make the conference finals in the East.    Because he was in a contract year and had say in where he was going, the Bucks got Jrue Holiday for has-been Eric Bledsoe and picks.  Also in his contract year, the Sixers got Jimmy Butler for Dario Saric and Robert Covington.  It's a players league.  Zach Lavine and Rich Paul have the power.   **Ben Simmons, Zach Lavine, Matisse Thybulle, Tobias Harris, Joel Embiid**  **Tyrese Maxey, Shake Milton, Furkan Korkmaz, Paul Reed, Andre Drummond**"
McDaniels is hardly an entity in the NBA let alone a centerpiece in a trade for an perennial All star. It’s the equivalent of saying that Paul Reed is the centerpiece for the Sixers offer for Lillard.
"I was thinking about it more and it was Simmons, Thybulle, Springer, and Reed for CJ, RoCo, and someone I think (McLemore? I can't remember).  Reasons this is bad for Portland: we're giving up 2 starters including our best forward and our best SG.  Additionally, we're acquiring Ben Simmons while giving away 1/3 of our spacing.  CJ would be gone either way, so if you ignore his 40% 3pt% at near 10 3pa (what he was averaging pre-injury), we're still losing our 1 out of 2 bench shooters and our only forward who's a legit shooter in RoCo (not to mention our best defender atm and would-be 2nd best if we got Simmons).  RoCo is the only forward we have which could share the floor with Simmons without a detriment on offense due to his outside c&amp;s ability.  Thybulle obviously is a great defender, and in a vacuum I'd take him on the Blazers.  However, the reason he can't get more minutes is his lack of offensive ability.  In a package giving up 3 shooters for 2 non-shooters, we're shooting ourselves in the foot here.  The garbage contracts they're sending are irrelevant outside taking up 2 roster spots.  So yeah.  There's why the trade is bad.  Our fan base is definitely torn (I did a poll on our sub yesterday about it) about Simmons, but the mild consensus is a CJ-Simmons swap.  The rest of the trade ruins it.  The same is true when someone proposed CJ+Simons for Simmons+Maxey (after the report Rich Paul wanted Maxey out).  I said no to that, too, since we kill our outside shooting.  Maxey could very well be better than Simons, as early as this season even.  But Simons' 40+% 3pt shooting is what makes Simmons even an option for us.  Replacing him with an undersized SG with 30% 3pt is just making us worse."
"Tbf I don’t know who/what else leaves Philly but I don’t like the idea of 3 for 1, especially when Russell essentially consumes the Simmons minutes minus a couple, and further pushes back the younger guards. Likely because I am a Sixers fan but I really like what they could get out of Maxey, Milton, Thybulle, Joe at guards and Paul Reed at the 4. This doesn’t even include the potential of the draft picks this year. I know that the contracts they’d trade for wouldn’t last forever, but a number one pick like Simmons feels like someone you’d keep for the majority of their career and I’d expect these three to be Sixers for a long time in exchange, at the cost of giving their own picks playing time. Unless this trade comes with a corresponding deal for a different top player, I’m not a big fan of it"
Paul Reed out tha mud
1. Michael Jordan 2. LeBron James 3. Wilt Chamberlain 4. Magic Johnson 5. Kareem Abdul-Jabbar 6. Larry Bird 7. Shaquille O’Neal 8. Kobe Bryant 9. Tim Duncan 10. Bill Russell 11. Oscar Robertson 12. Hakeem Olajuwon 13. Jerry West 14. Moses Malone 15. Karl Malone 16. Julius Erving 17. Kevin Durant 18. Kevin Garnett 19. Elvin Hayes 20. Charles Barkley 21. Walt Frazier 22. Dirk Nowitzki 23. John Havlicek 24. Scottie Pippen 25. Dwyane Wade 26. Stephen Curry 27. George Gervin 28. Rick Barry 29. David Robinson 30. Isiah Thomas 31. John Stockton 32. Alex English 33. Clyde Drexler 34. Patrick Ewing 35. Willis Reed 36. Steve Nash 37. Jason Kidd 38. Allen Iverson 39. Bob Cousy 40. George Mikan 41. Gary Payton 42. Kevin McHale 43. Bob Pettit 44. Ray Allen 45. Reggie Miller 46. Dominique Wilkins 47. Kawhi Leonard 48. Chris Paul 49. Vince Carter 50. Paul Pierce  I found a [list](https://www.lineups.com/articles/top-50-nba-players-all-time/) that had Paul Pierce conveniently located at 50
"De'Aaron Fox for Ben Simmons, Isaiah Joe/Paul Reed and a first round pick in the 2022 draft. Do the kings accept?"
"De'Aaron Fox for Ben Simmons, Isaiah Joe/Paul Reed and a first round pick in the 2021 draft who says no?"
Paul Reed
"No one voted for Paul ""G League MVP"" Reed? This is rigged for views or money or smthn.....just saw it live sorry"
"How do you not have LeBron, Paul Reed, or Kawhi"
*You sense a disturbance in the mud*  *Paul Reed would like to battle!*
"A few months from now:  No way Sixers should have given up Thybulle, Maxey, 3 1st round picks, Green, Paul Reed, 2 2nd round picks, 10 mill in cold hard cash, and pick swaps in 2025/2026  The apparent asking price of Masai just keeps going up."
We’ll give you Ben Simmons and Paul Reed for him. Gotta give us Maxi Kleber too though.
Maxey and Paul Reed
Everyone gets to watch the best center Paul reed now
% we see Paul Reed tonight??
I'd argue that paul reed is better than both
"Sixers would protect embiid, simmons, harris, curry, thybulle, hill, maxey, and milton. so out of anyoke else that isnt a free agent, itd have to be isaiah joe or paul reed. if i had to guess, a team would want joe simply for the shooting"
Embiid Simmons Harris Curry Maxey Hill Thybulle Shake  Only other players under contract are Isiah Joe and Paul Reed; plus Tolliver on a non guarantee
"""G League MVP Paul Reed defects to Serbia"""
"Paul Reed, but it'll be Pfizer Paul"
Paul Reed
"Korkmaz hurs my soul. Those 3 shots he took.....my lord, where is PAUL REED"
"Isaiah Joe, Paul Reed, and Mike Scott all sound like auto-generated 2k players"
Paul Reed
Is that paul reed? 🤔
"They should just trade him to the Sixers so he can finish his career playing alongside his brother.   George Hill, Isaiah Joe, Shake Milton, Paul Reed and a 1st. Make it so, Daryl."
1. Paul Reed
"Forgot the reigning MVP *and* ROTY, Paul Reed.   (G League)"
Paul Reed
Maxey has more value than wiseman... Paul Reed and Joe are both young interesting guys to throw in as well.  Sixers have the best offer from a contending team.
"Maxey Thybulle Simmons and 2-3 1sts is a great offer.  Not sure it would take all of that honestly. Sixers probably wouldnt want to give up Thybulle if theyre losing Ben.  Throw in a Paul Reed, Isiaha Joe or a Shake Milton."
"Start Paul Reed, cut the other two."
"Lebron, KD, Paul Reed"
I truly don't understand why Paul Reed wasn't taking some Mike Scott minutes.
Unfortunately just had to settle for some scrub like Paul Reed to get em out the mud... its a rough life
Put in Paul Reed. None of this mike scott bs
Paul Reed x4
Paul Reed
Paul Reed.
He needs to get Paul Reed out the mud.   Scott's ass has been bricking everything all year and he still gets minutes.
PUT IN PAUL REED. MIKE SCOTT ASS
Clearly Paul Reed is the most underrated player.
"I can't say this enough, for like 4 minutes the Sixers closed an NBA playoff game with  Furkhan Korkmaz, Shake Milton, Mike Scott, Paul Reed, and Isaiah Joe.   In a win. 🤮 The disrespect."
Paul Reed
He tweets something mud related every time Paul Reed checks in. Reed said “I guess I have to get it out the mud” when he didn’t get minutes his first game. Been like a catchphrase every since
He tweets something mud related every time Paul Reed checks in. Reed said “I guess I have to get it out the mud” when he didn’t get minutes his first game. Been like a catchphrase every since
It's Isaiah Joe and Paul Reed time. In the playoffs.
Paul Reed - The mud
Don't forget Paul Reed came from heaven.
Paul Reed is clearly the best playoff performer of the last 3 years.
"Paul reed, Isaiah Joe, and Tyrese Maxey all in one draft."
Turns out the real Playoff P was Paul Reed all along
"Paul reed , playoffs and finals mvp"
Alright. We have Mike Scott. We have Paul Reed.   Give me Isaiah Joe for ultimate disrespect.
Does Paul Reed not exist?
Paul Reed bout to go from GLeague MVP to simply MVP
"Fuck yeah, playoff Maxey has arrived.  &amp;#x200B;  &amp;#x200B;  &amp;#x200B;  Now where is Paul Reed?"
Paul Reed?
Paul Reed
The team with Paul Reed
"They got 3 soon to be co-DPOYs in Embiid, Simmons and Thybulle  Maxey looks like a young, more athletic Tony Parker out there, soon to be an all-star candidate  Paul Reed might be a meme right now but he's probably peak Paul Milsap by next season  Harris should've been an all-star  Embiid was MVP if he played enough.  I think they're one of the best teams in the league for the foreseeable future.  Nets in 5."
Paul Reed is about 26 spots too low
  **Magic @ 76ers**  [](/ORL) **117 -  128** [](/PHI)  **Box Scores: [NBA](http://www.nba.com/games/20210516/ORLPHI#/boxscore) &amp; [Yahoo](http://sports.yahoo.com/nba/orlando-magic-philadelphia-76ers-2021051620)**  |**Team**|**Q1**|**Q2**|**Q3**|**Q4**|**Total**| |:---|:--|:--|:--|:--|:--| |Orlando Magic|26|39|25|27|117| |Philadelphia 76ers|32|28|39|29|128|  **TEAM STATS**  |**Team**|**PTS**|**FG**|**FG%**|**3P**|**3P%**|**FT**|**FT%**|**OREB**|**TREB**|**AST**|**PF**|**STL**|**TO**|**BLK**| |:--|:--|:--|:--|:--|:--|:--|:--|:--|:--|:--|:--|:--|:--|:--| |Orlando Magic|117|36-76|47.4%|10-28|35.7%|35-41|85.4%|9|47|23|25|4|16|3| |Philadelphia 76ers|128|46-94|48.9%|19-40|47.5%|17-23|73.9%|9|41|35|27|8|11|5|  **TEAM LEADERS**  |**Team**|**Points**|**Rebounds**|**Assists**| |:--|:--|:--|:--| |Orlando Magic|**37** Cole Anthony|**10** Donta Hall|**4** Mo Bamba| |Philadelphia 76ers|**30** Tyrese Maxey|**12** Paul Reed|**9** Shake Milton|
You just lost to Paul “skinny Joel embiid” Reed and Tyrese “Ben simmons with dreads” Maxey
Lebron is the Great Value version of Paul Reed
speak for yourself. im going to be watching paul reed get out the mud and dominate the magic
The team with Paul Reed
I assume Paul Reed is the consensus #1?
 ** The Paul Reed Effect
Two words: Paul Reed.
"It's in reference to one of our rookies, Paul Reed. He didn't get to play in one of our first games and he tweeted saying he needs to ""get out the mud"" and anytime Reed checks into a game, morey tweets that."
I'm hyped to see Paul Reed getting heavy minutes on Sunday.
"Paul Reed out da mud, I think"
"paul reed is just trying to earn minutes as an end of bench guy, that aint something to be upset about, happens nearly every game"
"I can give you 30 other guys from the 70s in the NBA alone (not including the ABA) that were clearly better and more impactful than Bing.  Kareem, Walton, Lanier, Unseld, Reed, Debusshere, Dandridge, Frazier, Monroe, Gus Johnson, Gus Williams, Rick Barry, Billy Cunningham, Dennis Johnson, Elvin Hayes, McAdoo, Maurice Lucas, Oscar Robertson's last years, Jerry West's last years, Wilt's last year, Dr. J's intro to the NBA, Randy Smith, Artis Gilmore, David Thompson, George Gervin, John Havlicek, Dave Cowens, Paul Silas, Jojo White, Jim Chones.  There. 30 guys who anyone around in the 70s would have said made more of an impact on their teams than Dave Bing did."
