"&gt;Lowry has long been intrigued with joining Heat star Jimmy Butler and the Miami organization, and now Miami has maneuvered to have two key elements of a possible sign-and-trade package -- guard Goran Dragic and forward Precious Achiuwa -- to offer the Raptors once talks can ensue at 6 p.m. ET on Monday, sources said.  &gt;The Heat picked up the option on Dragic's $19.4 million contract for the 2021-2022 season, making him an ideal contractual fit to include in talks to make a deal possible with the Raptors. A market exists for the Raptors to move Dragic, 35, onto a new team, including the Dallas Mavericks and New Orleans Pelicans, sources said.  &gt;Achiuwa, a well-regarded 2020 first-round pick out of the University of Memphis, showed significant promise in his rookie season and would serve as a sweetener to Toronto to facilitate a sign-and-trade deal, sources said. Miami could add draft assets to a package, too.  &gt;Dragic has been a longtime mentor to Mavericks star Luka Doncic, both natives of Slovenia. They also share an agent, Bill Duffy of BDA Sports. The Raptors have Fred Van Vleet returning at point guard, and drafted playmaker Scottie Barnes out of Florida State with the No. 4 pick in Thursday's NBA draft.  Some form of a 3 team deal looks most likely."
"&gt; [Lowry's long been intrigued with joining Heat star Jimmy Butler and the Miami organization, and now Miami's maneuvered to have two key elements of a possible sign-and-trade package – Goran Dragic and Precious Achiuwa -- to offer Raptors once talks can ensue at 6 PM, per sources.](https://twitter.com/wojespn/status/1422009965548642305)"
"The assumption would be that it gets us at least one asset like Precious Achiuwa or a first round pick. Maybe both if we can bargain hard enough. Then they can try to flip Dragic to another team. Or maybe they’ve figured out that the guys they’re targeting in free agency with big offers (Jarrett Allen, Lonzo Ball are rumored examples) are going elsewhere. So then Dragic is a solid vet on an expiring deal that can be moved at the deadline to a team that wants to add some depth for the playoffs."
How is precious achiuwa an actual nba player. Guy is a black hole today on offense. Turnover galore.
"**Team Africa**  C: Joel Embiid, Precious Achiuwa.  PF: Pascal Siakam, Chimezie Metu, KZ Okpala.   SF: Josh Okogie, Luc Mbah a Moute.  SG: Victor Oladipo, DJ Strawberry.  PG: Miye Oni, Gabe Vincent."
Star: Jaylen Brown  Emerging star: DeAndre Ayton  Unproven Youngster: Precious Achiuwa
"Monteverde has just been churning out NBA players the last 5-10 years. Other alumni are D’Angelo Russell, Ben Simmons, Precious Achiuwa, RJ Barrett, and Dakari Johnson."
Yeah I shit on Jimmy Butler not Precious Achiuwa or Bam. How do you not get what I'm saying?
Precious Achiuwa and Goran Dragic
"The deal was Duncan Robinson, Kendrick Nunn, Herro, and Precious Achiuwa with 2 first round picks and 4 pick swaps right?  I don't see how that's everyone when you could have Harden, Bam, Butler, and Dragic (at the time). That would have done a whole lot better in this past playoffs and you ended up losing Nunn and trading Achiuwa anyway."
https://heatnation.com/rumors/heres-the-ridiculous-package-the-rockets-wanted-from-the-heat-for-james-harden/   This is an article from Heat media right after the trade.   They called this ridiculous:   * Tyler Herro * Duncan Robinson * Precious Achiuwa * Kendrick Nunn * Salary Filler * Two 1st-Round Picks * 4 Pick Swaps
"I dont think they are in purgatory but their timeline is kind of weird. The young players they have that are 24 years old or younger are OG Anunoby,Gary Trent Jr,Scottie Barnes,Precious Achiuwa and Malachi Flynn, OG and Gary are already starting level players,Scottie is a project who has star potential and both Flynn and Precious looked good in summer league and could develop well. Imo thats a fringe top 10 young core  Its just that on top of those guys they also have a bunch of win now players who dont really have time to develop like Siakam,Fred,Boucher,Dragic and Birch who would rather win now"
I know Precious Achiuwa played soccer and he's still good at it. This is all I know lmao
PG: FVV  SG: Gary Trent Jr.   SF: OG Anunoby   PF: Pascal Siakam  C: Khem Birch  Bench:  Goran Dragic  Malachi Flynn  Scottie Barnes  Chris Boucher  Precious Achiuwa
"&gt; Ignoring the contradiction in calling the team ""talent-starved"" when they have OG, Siakam and VanVleet plus promising young players in Trent Jr., Scottie Barnes and Precious Achiuwa, if it involves trading Fred along with Boucher, Dragic and a first, then I am absolutely not in favor of it.  They are 100% high end talent starved.   OG, Trent Jr. Scottie and precious are all good role players or show promise. FVV is a really good guard but not quite all star. Siakam with no injuries is an all star except he's coming off injury.   This team replaced Lowry, Kawhi, Ibaka/Gasol with noone of similar value. We completely lack high end talent. We have no first start, we have no leader like the way Lowry was. We have no quality centers like Ibaka/Gasol. Our Center rotation right now is just good backup centers being played as starters.   Pascal is coming off injury,  his ramp up to game shape will take a while and the jury is still out if he can ever become an all star again. He willl no doubt struggle on a team without a true point guard in the starting lineup. FVV is not a point guard. He's a shooting guard in a point guards body.   I won't argue how good of a shooter FVV is. but he isn't really a leader and he isn't a playmaker. and he's streaky prone to hero ball espeacilly with even less talent around him.   I see Ben brining playmaking, defense and scoring on this team. He has shown he can do that in the regular season and is only 24.   Do i want to trade the whole kitchen sink for him? No but you would be absolutely the biggest homer ever if you don't think he could bring value to this team if we didn't give up too much for him.  He would instantly help Siakam, and FVV if we could keep him in a trade.  Salary wise? cap space means nothing in Toronto since we will never attract a big FA. We need to find our stars in trades or drafting.  I want to stress, for the right price, Ben is a great get for this team."
"Ignoring the contradiction in calling the team ""talent-starved"" when they have OG, Siakam and VanVleet plus promising young players in Trent Jr., Scottie Barnes and Precious Achiuwa, if it involves trading Fred along with Boucher, Dragic and a first, then I am absolutely not in favor of it.   Fred is our second-best shooter Pascal (arguably he's our most efficient shooter from the 3), an offensive threat and a natural leader.  With Lowry gone, that last factor is going to become more important, and I don't see Ben bringing that leadership to the Raptors, let alone being our first, second or even third option on offense unless Nick Nurse and our staff can work on his ""pass first"" apprehension to shooting.  And even then, I'm not optimistic about our chances of ""fixing"" Ben Simmons."
"Not at all, I didnt want to trade Achiuwa either, I think he has a ton of potential but not anything near the potential as Herro.  If you seriously believed that the Heat were open letting the Raptors pick between Herro or Precious then you will believe anything."
They got Precious Achiuwa from the Heat
"In contrast, Precious Achiuwa still hosted a back-to-school event in Miami after getting traded to Toronto"
Thank you! And Precious Achiuwa isn't that hard to say either.
"In 2K, the Giannis team would for sure sweep. Precious Achiuwa, Giannis and Bol Bol would kill the simulation. That's a freaking dynasty.  IRL, I'll give the Giannis team an edge in 6. I think Collins and PG13 could steal a couple, but I can't see them winning any more than that."
" Precious Achiuwa, OG Anunoby, Dalano Banton, Scottie Barnes Khem Birch, Isaac Bonga, Chris Boucher, Sam Dekker, Goran Dragic, Malachi Flynn, Freddie Gillespie, David Johnson, Stanley Johnson, Pascal Siakam, Gary Trent Jr., Fred VanVleetand Yuta Watanabe plus 2 frp for Simmons straight up... who says no?"
"Honestly our full squad is nothing but sick names. Precious Achiuwa, Khem Birch, Pascal Siakam, Freddy Vanvleet, OG Anuonoby, Chris Boucher, Malachi Flynn, Nick Nurse, Yuta Watanabe, Delano Blanton, Goran Dragic. even Scottie Barnes is kinda cool  Definitely top 5 team based purely on cool/unique names"
"For Miami, it’s Michael Beasley, Justise Winslow, and possibly Precious Achiuwa (maybe too soon to call, but we traded him after only one season)."
"Toronto is in a transitionary period, but the question is whether they got more worse than the Hornets got better?  The Raptors guard rotation is weaker than the Hornets', though I think you are overestimating Ball slightly and underestimating VanVleet slightly.  I think its hard to argue that the Hornets frontcourt is better, Siakam and OG are more versatile options than Washington/Hayward; and I have no confidence that Hayward will stay healthy long enough to revert back to old Hayward and make it a contest between him and Pascal.  Centre is basically a wash between each team.  Last year the Hornets won 6 more games than the Raptors.   The respective factors in their issues were Lamelo's Injury and Hayward's for the Hornets.  COVID absences, Pascal/Kyle injuries and playing ~70 away games for the Raptors.  We lose Kyle over the offseason, gain Scottie Barnes, Dragic and Precious Achiuwa, likely a net negative in win shares.  Hornets get Oubre, Plumlee, Bouknight and Kai Jones, I would score that as neutral, maybe +2 win shares.  My confidence comes from believing that a healthy Raptors team that gets to play out of Toronto increases wins by 8-10. Whether that is enough remains to be seen, any gap in projected wins is made up by homerism.  My greater point is that you refer to teams getting significantly better in the last 2 years, for the Hornets their improvement is Lamelo Ball, Hayward and improvement from Rozier. In the last 4 years they finish 10th, 9th, 10th and 10th in the East. Their success this year depends on Lamelo growth, Rozier maintenance/growth and Hayward health, none of their acquisitions are big needle movers.  I don't think they belong in the conversation about why the Raptors no longer figure into the Playoff picture. And as for the Raptors not being contenders, that's pretty clear, but not because the Hornets are a juggernaut.  My confidence in 100 out of 100 matchups is just me saying if I was putting money on the head to head matchup, I'm taking the Raps."
"&gt; OG Anunoby, Pascal Siakam, Scottie Barnes, Precious Achiuwa, Khem Birch, Chris Boucher and Yuta Watanabe  That’s not really a logjam. For one, Yuta and OG could play the 2 and have at times last season. Another thing to mention is that the front court has 3 slots while the backcourt has 2. Starting OG/Siakam/Birch then having Barnes/Boucher/Achiuwa off the bench is perfectly fine. I could see Nurse cycling in Yuta to be a positional filler in case someone goes down."
  **Bulls @ Raptors**  [](/CHI) **111 -  108** [](/TOR)  **Box Scores: [NBA](http://www.nba.com/games/20211025/CHITOR#/boxscore) &amp; [Yahoo](http://sports.yahoo.com/nba/chicago-bulls-toronto-raptors-2021102528)**  |**Team**|**Q1**|**Q2**|**Q3**|**Q4**|**Total**| |:---|:--|:--|:--|:--|:--| |Chicago Bulls|24|37|31|19|111| |Toronto Raptors|24|27|29|28|108|  **TEAM STATS**  |**Team**|**PTS**|**FG**|**FG%**|**3P**|**3P%**|**FT**|**FT%**|**OREB**|**TREB**|**AST**|**PF**|**STL**|**TO**|**BLK**| |:--|:--|:--|:--|:--|:--|:--|:--|:--|:--|:--|:--|:--|:--|:--| |Chicago Bulls|111|39-81|48.1%|12-27|44.4%|21-22|95.5%|5|28|24|16|11|12|3| |Toronto Raptors|108|40-83|48.2%|12-30|40.0%|16-20|80.0%|14|48|27|18|7|19|1|  **TEAM LEADERS**  |**Team**|**Points**|**Rebounds**|**Assists**| |:--|:--|:--|:--| |Chicago Bulls|**26** DeMar DeRozan|**8** Nikola Vucevic|**6** DeMar DeRozan| |Toronto Raptors|**22** OG Anunoby|**11** Precious Achiuwa|**17** Fred VanVleet|
  **Mavericks @ Raptors**  [](/DAL) **103 -  95** [](/TOR)  **Box Scores: [NBA](http://www.nba.com/games/20211023/DALTOR#/boxscore) &amp; [Yahoo](http://sports.yahoo.com/nba/dallas-mavericks-toronto-raptors-2021102328)**  |**Team**|**Q1**|**Q2**|**Q3**|**Q4**|**Total**| |:---|:--|:--|:--|:--|:--| |Dallas Mavericks|18|27|29|29|103| |Toronto Raptors|25|26|21|23|95|  **TEAM STATS**  |**Team**|**PTS**|**FG**|**FG%**|**3P**|**3P%**|**FT**|**FT%**|**OREB**|**TREB**|**AST**|**PF**|**STL**|**TO**|**BLK**| |:--|:--|:--|:--|:--|:--|:--|:--|:--|:--|:--|:--|:--|:--|:--| |Dallas Mavericks|103|38-91|41.8%|14-42|33.3%|13-18|72.2%|13|50|24|22|6|9|6| |Toronto Raptors|95|34-85|40.0%|11-37|29.7%|16-23|69.6%|11|49|17|23|7|12|6|  **TEAM LEADERS**  |**Team**|**Points**|**Rebounds**|**Assists**| |:--|:--|:--|:--| |Dallas Mavericks|**27** Luka Doncic|**10** Kristaps Porzingis|**12** Luka Doncic| |Toronto Raptors|**23** OG Anunoby|**12** Precious Achiuwa|**5** Fred VanVleet|
  **Raptors @ Celtics**  [](/TOR) **115 -  83** [](/BOS)  **Box Scores: [NBA](http://www.nba.com/games/20211022/TORBOS#/boxscore) &amp; [Yahoo](http://sports.yahoo.com/nba/toronto-raptors-boston-celtics-2021102202)**  |**Team**|**Q1**|**Q2**|**Q3**|**Q4**|**Total**| |:---|:--|:--|:--|:--|:--| |Toronto Raptors|23|28|33|31|115| |Boston Celtics|23|24|17|19|83|  **TEAM STATS**  |**Team**|**PTS**|**FG**|**FG%**|**3P**|**3P%**|**FT**|**FT%**|**OREB**|**TREB**|**AST**|**PF**|**STL**|**TO**|**BLK**| |:--|:--|:--|:--|:--|:--|:--|:--|:--|:--|:--|:--|:--|:--|:--| |Toronto Raptors|115|42-100|42.0%|10-35|28.6%|21-21|100%|21|60|22|13|16|11|2| |Boston Celtics|83|32-82|39.0%|11-34|32.4%|8-11|72.7%|10|42|19|19|6|25|11|  **TEAM LEADERS**  |**Team**|**Points**|**Rebounds**|**Assists**| |:--|:--|:--|:--| |Toronto Raptors|**25** Scottie Barnes|**15** Precious Achiuwa|**9** Fred VanVleet| |Boston Celtics|**18** Jayson Tatum|**11** Al Horford|**5** Marcus Smart|
"I have lasting images of Scottie Barnes, Chris Boucher, &amp; Khem Birch/Precious Achiuwa murdering us on the offensive glass  As well as Gary Trent Jr. getting to the rim at will on us"
We got Matthews and   Precious Achiuwa?
"Really?   Players from these seasons drafted 15-30 who look like they will be starters this season:   2017 - John Collins, Jarrett Allen, OG Anunony, Kyle Kuzma, Derrick White   2018 - Donte DiVincenzo, Lonnie Walker, Robert Williams   2019 - NAW, Jordan Poole, Keldon Johnson, Kevin Porter Jr   2020 - Saddiq Bey, Precious Achiuwa, Jaden McDaniels   Philly isn't drafting these guys. They're not one of the best drafting teams. They're middle of the pack. Drafting Thybulle and Maxey amongst these picks isn't outstanding."
"I’m actually kinda excited to watch the Raptors play this year, I’m been curious about how a 5-man lineup of Scottie Barnes, OG, Siakam, Precious Achiuwa &amp; Khem Birch will do on the court, especially on defense."
Precious Achiuwa.  A solid center rotation is key for Nurse’s offensive and defensive schemes…
It’s the same thing every time. Raptors fans just pissed they only got Dragic and Precious Achiuwa and want to believe Lowry is the difference between a 2nd round exit and a guaranteed championship for the Sixers lol. It’s the same shit in every thread.
I was also confused when I saw Precious Achiuwa draining pull up 3's off the dribble.
"It's probably more wise to lean on Birch's experience, and consider pre-season to be a not-so-great warmup for him.  Precious is going into his second year in the league, and Birch has already shown his value as a starter at the end of last season.  But I think the transition from Birch to Achiuwa won't take more than a couple months (baring injury)."
"Birch had Covid though, possibly affected by that. Birch was so much better  last year for the Raptors than Achiuwa was for the heat that Precious will need to take a major step forward to take the starting role."
"  # Top Highlights:  0. [[Highlight] Scottie Barnes threads the needle to Precious Achiuwa](https://streamable.com/3b41a4) | [(Comments)](/r/nba/comments/q707fv/highlight_scottie_barnes_threads_the_needle_to/)  0. [[Highlight] Jordan Poole with the nasty in and out blow by dunk](https://streamable.com/imqpfn) | [(Comments)](/r/nba/comments/q73oih/highlight_jordan_poole_with_the_nasty_in_and_out/)  0. [[Highlight] Westbrook lunges into a defender, doesn’t get the call under the new rules](https://streamable.com/lxubyc) | [(Comments)](/r/nba/comments/q71tf5/highlight_westbrook_lunges_into_a_defender_doesnt/)  0. [[Highlight] Sam Dekker scores his 18th point in 8 minutes of playtime](https://streamable.com/h5ecko) | [(Comments)](/r/nba/comments/q708xh/highlight_sam_dekker_scores_his_18th_point_in_8/)  0. [[Highlight] LeBron hits his classic step back three](https://streamable.com/yd9966) | [(Comments)](/r/nba/comments/q726ej/highlight_lebron_hits_his_classic_step_back_three/)  # Day in the history:  ### Friday, October 13, 1978  6-time NBA All-Star Jermaine O'Neal was born in Columbia, South Carolina.  ### Thursday, October 13, 1977  10-time NBA All-Star Paul Pierce was born in Oakland, California.  ### Tuesday, October 13, 1970  8-time All-Star Dave Cowens made his NBA debut for the Boston Celtics in a 114-107 loss to the New York Knicks.  Daily Discussion Thread : [Rules](https://www.reddit.com/r/nba/wiki/rules#wiki_daily_discussion_thread)"
  **Raptors @ Wizards**  [](/TOR) **113 -  108** [](/WAS)  **Box Scores: [NBA](http://www.nba.com/games/20211012/TORWAS#/boxscore) &amp; [Yahoo](http://sports.yahoo.com/nba/toronto-raptors-washington-wizards-2021101227)**  |**Team**|**Q1**|**Q2**|**Q3**|**Q4**|**Total**| |:---|:--|:--|:--|:--|:--| |Toronto Raptors|26|32|23|32|113| |Washington Wizards|30|28|31|19|108|  **TEAM STATS**  |**Team**|**PTS**|**FG**|**FG%**|**3P**|**3P%**|**FT**|**FT%**|**OREB**|**TREB**|**AST**|**PF**|**STL**|**TO**|**BLK**| |:--|:--|:--|:--|:--|:--|:--|:--|:--|:--|:--|:--|:--|:--|:--| |Toronto Raptors|113|39-95|41.1%|15-35|42.9%|20-27|74.1%|14|56|26|18|8|11|6| |Washington Wizards|108|38-88|43.2%|17-43|39.5%|15-20|75.0%|9|52|27|18|6|15|7|  **TEAM LEADERS**  |**Team**|**Points**|**Rebounds**|**Assists**| |:--|:--|:--|:--| |Toronto Raptors|**22** Malachi Flynn|**10** Precious Achiuwa|**7** Scottie Barnes| |Washington Wizards|**24** Kyle Kuzma|**17** Daniel Gafford|**7** Spencer Dinwiddie|
  **Rockets @ Raptors**  [](/HOU) **92 -  107** [](/TOR)  **Box Scores: [NBA](http://www.nba.com/games/20211011/HOUTOR#/boxscore) &amp; [Yahoo](http://sports.yahoo.com/nba/houston-rockets-toronto-raptors-2021101128)**  |**Team**|**Q1**|**Q2**|**Q3**|**Q4**|**Total**| |:---|:--|:--|:--|:--|:--| |Houston Rockets|19|19|26|28|92| |Toronto Raptors|28|29|31|19|107|  **TEAM STATS**  |**Team**|**PTS**|**FG**|**FG%**|**3P**|**3P%**|**FT**|**FT%**|**OREB**|**TREB**|**AST**|**PF**|**STL**|**TO**|**BLK**| |:--|:--|:--|:--|:--|:--|:--|:--|:--|:--|:--|:--|:--|:--|:--| |Houston Rockets|92|34-78|43.6%|9-30|30.0%|15-23|65.2%|8|46|23|12|7|28|7| |Toronto Raptors|107|41-90|45.6%|15-42|35.7%|10-16|62.5%|7|43|22|29|18|20|5|  **TEAM LEADERS**  |**Team**|**Points**|**Rebounds**|**Assists**| |:--|:--|:--|:--| |Houston Rockets|**15** Armoni Brooks|**7** Christian Wood|**4** Jalen Green| |Toronto Raptors|**17** OG Anunoby|**5** Precious Achiuwa|**5** Fred VanVleet|
  **Raptors @ Celtics**  [](/TOR) **111 -  113** [](/BOS)  **Box Scores: [NBA](http://www.nba.com/games/20211009/TORBOS#/boxscore) &amp; [Yahoo](http://sports.yahoo.com/nba/toronto-raptors-boston-celtics-2021100902)**  |**Team**|**Q1**|**Q2**|**Q3**|**Q4**|**Total**| |:---|:--|:--|:--|:--|:--| |Toronto Raptors|16|43|27|25|111| |Boston Celtics|31|26|28|28|113|  **TEAM STATS**  |**Team**|**PTS**|**FG**|**FG%**|**3P**|**3P%**|**FT**|**FT%**|**OREB**|**TREB**|**AST**|**PF**|**STL**|**TO**|**BLK**| |:--|:--|:--|:--|:--|:--|:--|:--|:--|:--|:--|:--|:--|:--|:--| |Toronto Raptors|111|41-101|40.6%|16-46|34.8%|13-18|72.2%|12|45|25|20|11|13|5| |Boston Celtics|113|38-81|46.9%|19-40|47.5%|18-21|85.7%|8|49|29|20|5|23|8|  **TEAM LEADERS**  |**Team**|**Points**|**Rebounds**|**Assists**| |:--|:--|:--|:--| |Toronto Raptors|**22** Fred VanVleet|**13** Precious Achiuwa|**8** Scottie Barnes| |Boston Celtics|**20** Jayson Tatum|**10** Enes Kanter|**7** Jayson Tatum|
"Honestly after watching the Raptors today, I'd go all-in on a Fred/Ben swap.  I think they're going to struggle to make serious noise without a genuine superstar player but I think you can sometimes get around that by being different and they have the potential to be really different.   No hate against Fred, he's a great player, but they're already a very big and switchable lineup and I'd lean into that size and switchability and hope to strike gold.  Watching Scottie Barnes and Precious Achiuwa playing as well as they did has me feeling like they could just throw caution to the wind.  Simmons / Anunoby / Barnes / Siakam / Achiuwa  Spacing is an obvious concern but I think there's potential there for the team to be insanely weird and dynamic."
"At the game rn, Precious Achiuwa looks like a grown ass man despite being a year younger than Tatum."
  **Raptors @ 76ers**  [](/TOR) **113 -  125** [](/PHI)  **Box Scores: [NBA](http://www.nba.com/games/20211007/TORPHI#/boxscore) &amp; [Yahoo](http://sports.yahoo.com/nba/toronto-raptors-philadelphia-76ers-2021100720)**  |**Team**|**Q1**|**Q2**|**Q3**|**Q4**|**Total**| |:---|:--|:--|:--|:--|:--| |Toronto Raptors|22|33|25|33|113| |Philadelphia 76ers|27|44|27|27|125|  **TEAM STATS**  |**Team**|**PTS**|**FG**|**FG%**|**3P**|**3P%**|**FT**|**FT%**|**OREB**|**TREB**|**AST**|**PF**|**STL**|**TO**|**BLK**| |:--|:--|:--|:--|:--|:--|:--|:--|:--|:--|:--|:--|:--|:--|:--| |Toronto Raptors|113|42-87|48.3%|11-37|29.7%|18-21|85.7%|13|33|21|19|12|18|5| |Philadelphia 76ers|125|47-87|54.0%|18-37|48.6%|13-17|76.5%|11|37|28|25|14|20|5|  **TEAM LEADERS**  |**Team**|**Points**|**Rebounds**|**Assists**| |:--|:--|:--|:--| |Toronto Raptors|**22** OG Anunoby|**8** Precious Achiuwa|**5** Scottie Barnes| |Philadelphia 76ers|**16** Georges Niang|**7** Andre Drummond|**5** Tyrese Maxey|
Is it true that Precious Achiuwa was based on the novel 'Push' by Sapphire?
"Why is 'GodGifted' one word and capitalized here? Because if it has something to do with Precious' brother, God'sGift Achiuwa, I can assure you as someone that watched him play at St. John's, the only gift God gave him was being really tall, because he sucked so bad at basketball.  Okay God probably gave him a massive dick too"
I believe Precious Achiuwa is going to have a bigger role on the Raps this season and may overtake the starting role eventually
"Precious Achiuwa will likely see a spike in his numbers, due to the lack of size on the Raptors roster."
"Lol your kings analogy is dumb. 76ers could have had Lowry at the deadline if they weren't stingy, their offer was nearly accepted, just just had to beat Precious Achiuwa to get Lowry in a S&amp;T"
2016: Henry Ellenson becomes Malik Beasley; Michael Gbinijie becomes  Georges Niang  2017: Luke Kennard becomes Donovan Mitchell  2018:  Bruce Brown becomes Justin Jackson; Khyri Thomas becomes Isaac Bonga  2019: Sekou Doumbouya becomes Chuma Okeke; Deividas Sirvydis becomes Daniel Gafford  2020: Killian Hayes becomes Obi Toppin; Isaiah Stewart becomes Aleksej Pokusevski; Saddiq Bey becomes Precious Achiuwa; Saben Lee  becomes Elijah Hughes.  \---  We won as soon as we got Donovan Mitchell.
Precious Achiuwa-&gt;Gerald Wallace/Mo Harkless  Malachi Flynn-&gt;Patty Mills  Our bench is better than our starting lineup!
  **Celtics @ Raptors**  [](/BOS) **109 -  97** [](/TOR)  **Box Scores: [NBA](http://www.nba.com/games/20211128/BOSTOR#/boxscore) &amp; [Yahoo](http://sports.yahoo.com/nba/boston-celtics-toronto-raptors-2021112828)**  |**Team**|**Q1**|**Q2**|**Q3**|**Q4**|**Total**| |:---|:--|:--|:--|:--|:--| |Boston Celtics|27|27|26|29|109| |Toronto Raptors|26|25|25|21|97|  **TEAM STATS**  |**Team**|**PTS**|**FG**|**FG%**|**3P**|**3P%**|**FT**|**FT%**|**OREB**|**TREB**|**AST**|**PF**|**STL**|**TO**|**BLK**| |:--|:--|:--|:--|:--|:--|:--|:--|:--|:--|:--|:--|:--|:--|:--| |Boston Celtics|109|34-82|41.5%|12-34|35.3%|29-31|93.5%|12|53|24|19|5|17|3| |Toronto Raptors|97|35-93|37.6%|13-42|31.0%|14-16|87.5%|14|44|19|24|6|10|5|  **TEAM LEADERS**  |**Team**|**Points**|**Rebounds**|**Assists**| |:--|:--|:--|:--| |Boston Celtics|**21** Marcus Smart|**11** Al Horford|**10** Jayson Tatum| |Toronto Raptors|**27** Fred VanVleet|**9** Precious Achiuwa|**5** Pascal Siakam|
"Potential Lineups:  Toronto – Fred VanVleet, Svi Mykhailiuk, Scottie Barnes, Pascal Siakam, Precious Achiuwa  Boston – Dennis Schroder, Marcus Smart, Jaylen Brown, Jayson Tatum, Al Horford  Not very promising for us"
Don’t google ‘precious achiuwa TS% 2021-22 season’
"He's 2nd I think. He has 7, Precious Achiuwa has 9 (on 12 less attempts lmao)  https://www.basketball-reference.com/players/z/zubaciv01/shooting/2022"
"Our center rotation is like Khem Birch and Precious Achiuwa. Also we’re running a new scheme that utilizes our new length, so its gonna take time for everything to run well especially with all the new pieces we have. Also basically we trap ball handlers and have dudes scramble to close out which only works sometimes"
The Precious Achiuwa Game
Precious Achiuwa was Anthony Bennett for the entire first half and Anthony Davis in the 3rd quarter.
