"There's a ton of untapped potential in Africa, I mean look this past years draft had 8 players of Nigerian descent:  Onyeka Okongwu (Hawks) Isaac Okoro (Cavaliers ) Precious Achiuwa (Heat) Zeke Nnaji (Nuggets) Desmond Bane (Celtics) Udoka Azubuike (Jazz) Jordan Nwora (Bucks) Daniel Oturu (Timberwolves)  And that's just players of Nigerian descent, African is a big ass continent with a shitload of different people. Wise investment here for the NBA. It also makes me wonder whether they'll be investing in India as well, another place with a huge population and the potential to produce NBA players and grow the NBA's international audience"
  **Heat @ Pistons**  [](/MIA) **120 -  107** [](/DET)  **Box Scores: [NBA](http://www.nba.com/games/20210516/MIADET#/boxscore) &amp; [Yahoo](http://sports.yahoo.com/nba/miami-heat-detroit-pistons-2021051608)**  |**Team**|**Q1**|**Q2**|**Q3**|**Q4**|**Total**| |:---|:--|:--|:--|:--|:--| |Miami Heat|32|37|26|25|120| |Detroit Pistons|13|34|24|36|107|  **TEAM STATS**  |**Team**|**PTS**|**FG**|**FG%**|**3P**|**3P%**|**FT**|**FT%**|**OREB**|**TREB**|**AST**|**PF**|**STL**|**TO**|**BLK**| |:--|:--|:--|:--|:--|:--|:--|:--|:--|:--|:--|:--|:--|:--|:--| |Miami Heat|120|47-84|56.0%|13-34|38.2%|13-20|65.0%|6|39|32|19|11|10|5| |Detroit Pistons|107|40-86|46.5%|11-35|31.4%|16-22|72.7%|7|33|26|21|4|16|4|  **TEAM LEADERS**  |**Team**|**Points**|**Rebounds**|**Assists**| |:--|:--|:--|:--| |Miami Heat|**23** Precious Achiuwa|**10** Precious Achiuwa|**11** Tyler Herro| |Detroit Pistons|**22** Saddiq Bey|**9** Tyler Cook|**7** Saben Lee|
"&gt;This isn't true. A team's free agent players can be sign and traded and aggregated with other players in trades. There's a random misconception that this isn't allowed for some reason. It's not always easy to arrange because the player + both teams have to agree to it, but it's allowed.  All sides have to agree to it and why the fuck would the rebuilding Blazers overpay some 27 role players just to get Herro lmao  &gt;Also not true. The Heat have all of their own future picks after this year except 2023. Also Precious Achiuwa is another decent asset that you didn't include.  You have your picks but you cant trade them caause of protections you put on them and the stepien rule since that 2023 pick will be protected until 2026 that means you can only trade either a 2027 or 2028 pick. Oh yeah sorry for excluding Precious cause he is such a massive deal breaker for Dame lmao"
"&gt;They cant include Nunn and Duncan because of sign and trade rules because they arent on the roster.  This isn't true. A team's free agent players can be sign and traded and aggregated with other players in trades. There's a random misconception that this isn't allowed for some reason. It's not always easy to arrange because the player + both teams have to agree to it, but it's allowed.  &gt;The very best offer they can make is Iguodala,Dragic,Herro and a 2028 pick  Also not true. The Heat have all of their own future picks after this year except 2023. Also Precious Achiuwa is another decent asset that you didn't include.  Not saying that the heat have enough assets to trade for him (rn they definitely don't) but just wanted to point out everything you said is wrong lmao."
"There may well end up being a bigger steal than Saddiq Bey, he's just arguably not even better than the dudes who got drafted around him (Precious Achiuwa, Tyrese Maxey, Imm Quickley) because he entered the draft age 21 and was more ready."
Breakout: Precious Achiuwa  Fall off: Jeremy Grant
Rookie of the Year and 2x MIP Precious Achiuwa
"Three Nigerian starters in this game -- Precious Achiuwa, KZ Okpala, and Gabe Vincent -- are all Heat bench players"
You know who I am. I’m Precious Achiuwa
"# [Yesterday's Game Thread Index](https://www.reddit.com/r/nba/comments/ohi9jj/shitpost_saturday_game_thread_index/)  # Top Highlights:  0. [[Highlight] Precious Achiuwa absolutely rejects Kevin Durant's dunk attempt!](https://streamable.com/xn0d0b) | [(Comments)](/r/nba/comments/ohuj2b/highlight_precious_achiuwa_absolutely_rejects/)  0. [[Highlight] Mills hits the buzzer beating three to get the win for Australia](https://streamable.com/tmzaab) | [(Comments)](/r/nba/comments/ohyl9l/highlight_mills_hits_the_buzzer_beating_three_to/)  0. [[Highlight] LaVine misses the clutch free throw, securing a shocking upset by Nigeria against USA, who had been 39-0 in their last three Olympic seasons and pre-Olympic exhibitions.](https://streamable.com/qxni9t) | [(Comments)](/r/nba/comments/ohw1ji/highlight_lavine_misses_the_clutch_free_throw/)  0. [[Highlight] Facundo Campazzo with a one-handed bullet pass right on the money](https://streamable.com/sz6vli) | [(Comments)](/r/nba/comments/ohyhbe/highlight_facundo_campazzo_with_a_onehanded/)  0. [[Highlight] Knicks guard Luca Vildoza with the buzzer beater from halfcourt against Australia!](https://streamable.com/3a7p49) | [(Comments)](/r/nba/comments/ohxs8j/highlight_knicks_guard_luca_vildoza_with_the/)  # Day in the history:  ### Wednesday, July 11, 2012  Joe Johnson was traded from the Atlanta Hawks to the Brooklyn Nets.  ### Wednesday, July 11, 2007  Rashard Lewis was traded from the Seattle SuperSonics to the Orlando Magic.  ### Tuesday, July 11, 1944  6-time NBA All-Star Lou Hudson was born in Greensboro, North Carolina.  Daily Discussion Thread : [Rules](https://www.reddit.com/r/nba/wiki/rules#wiki_daily_discussion_thread)"
Precious Achiuwa grew up in Nigeria
"&gt;Edit: wtf why is this the most upvoted comment lmfao  People lowkey enjoy Magic's tweets. ""That was a fantastic block by Precious Achiuwa who is a Nigerian basketball player"""
"They did lose that exhibition, and it must have been great for the Nigerian team's morale. But, KZ Okpala and Precious Achiuwa are not beating Dame and KD in a game that actually matters.   Especially since now they have something to prove"
Currently it’s precious achiuwa
"Where do you think Jahlil Okafor, Jordan Nwora, Precious Achiuwa, etc. grew up?? Still elected to play for Nigeria. Trash take."
"NBA 2K legend, Precious Achiuwa"
"The 2020 NBA Draft had Onyeka Okongwu, Isaac Okoro, Precious Achiuwa, Udoka Azubuike, Zeke Nnaji, Daniel Oturu, Jordan Nwora and Desmond Bane who were either from Nigeria themselves or had a parent from Nigeria.  So not only is the top end talent promising, but they would be able to field a deep team"
That guys name is really Precious Achiuwa? He must be a really precious player
The good: Literally nothing  The bad: You lost to josh okogie and precious achiuwa
Precious Achiuwa and Gabe Vincent for Kevin Durant. Who says no?
Precious Achiuwa DPOY
Short handed? Bro we’re playing Precious achiuwa and friends lmao
I was watching when Precious Achiuwa embarrassed my best friend Kevin Durant on an international stage.
"Gabe Vincent, KZ Okpala and Precious Achiuwa."
"Precious Achiuwa, Miami Heat   KZ Okpala, Miami Heat   Miye Oni, Utah Jazz    Josh Okogie, Minnesota Timberwolves   Jordan Nwora, Milwaukee Bucks   Chimezie Metu, Sacramento Kings   Jahlil Okafor, Detroit Pistons   Gabe Vincent, Miami Heat  Alzo Michael Gbinije and Ekpe Udoh have experience in the NBA."
"NBA players on their roster include:  Precious Achiuwa, Kezie Okpala, Miye Oni, Josh Okogie, Jordan Nwora, Chimezie Metu, Ekpe Udoh, Jahlil Okafor, Gabe Vincent."
My Precious Achiuwa
Precious Achiuwa with one of the greats
"I actually heard the above news from someone I know who’s kinda close to the Nigerian team, but I also saw this on Twitter (see link below) since I wanted to make sure I wasn’t misleading anyone. That’s the official Nigerian Olympic Basketball team Twitter page (you can see it has a lot of info/photos from the training camp).   I was told guys like Gabe Vincent, Precious Achiuwa, and Jahlil Okafor would be some important pieces. Also Ike Diogu is their veteran leader (he’s played overseas a lot but was a former 1st round pick). Also I believe Jordan Nwora (who’s currently with the Bucks) might be able to make the team if he chooses to play after the Finals is over (his dad is associated with the team so my guess is he doesn’t need as many contractual stipulations).   Nigeria’s group is super balanced but I would say a team like Australia which has a core who’s played together a long time is probably better at this point, but we’ll see what happens. I am rooting for Nigeria over Australia.   https://mobile.twitter.com/NigeriaBasket/status/1409722941005258752"
"Nigeria is ranked way too high. Australia and France are definitely better. Not only is the NBA talent on Australia and France better but their players also haven’t played much with each other.   I think you are overestimating exactly which NBA players are projected to be on the Nigerian team. The best player might end up being Monte Morris and the rest of the team will be some combination of guys like Precious Achiuwa, Jahlil Okafor, and Josh Okogie."
"Warriors can add in Paschall and then that allows them to match salary to get Covington back in the trade too. Covington doesn’t have too much value after being exposed in Houston / Portland, but maybe Kerr can pull something more out of him, and it gives them someone to replace Wiggins in the rotation.   I think this is the best package for Portland. I think Simmons / Ingram packages would be shortsighted and they should focus on a more longterm rebuild and get some top draft picks as you develop Wiseman, the Warriors picks, and whatever you get for CJ (Tyler Herro and Precious Achiuwa?)"
"Trade idea:   Raptors get:   * Jimmy Butler  Heat get:   * De'Aaron Fox  * Marvin Bagley  Kings get:   * OG Anunoby  * Tyler Herro  * Precious Achiuwa  * Rodney Hood (filler)  * 2022, 2024, 2026 Raptors 1sts  * 2024, 2026, 2028 Heat 1sts  Let's say the Raptors draft Suggs. They will have a lot of cap space so let's say they sign John Collins or Richaun Holmes. Then they run something like Suggs/Fred/Butler/Siakam/Collins. That's a good playoff team.   Heat pay up to move on from their aging core to get one of the top young players in the game. Fox is a beast, averaging 25/4/7 last season. Plus they get a reclamation project in Bagley, who still has potential. A Fox/Bam duo could be built around for the next decade.  Kings get a a quality young wing, a promising young point guard, a promising young big man, and six 1sts to continue their rebuild.  They can go forward with Haliburton/Hield/Anunoby/Barnes/???, with Herro/(Ninth Pick)/Precious off the bench. That's a solid young core."
"Let's dispel the Herro for Harden was rejected. Harden was always going to the Nets, every other conversation was to pump up the price for the nets.  THE ACTUAL ROCKETS OFFER WAS:  Tyler Herro  Duncan Robinson  Precious Achiuwa  Kendrick Nunn  Salary Filler  Two 1st-Round Picks  4 Pick Swaps  Source https://www.google.com/amp/s/heatnation.com/rumors/heres-the-ridiculous-package-the-rockets-wanted-from-the-heat-for-james-harden/amp/"
Alaa Abdelnaby Zaid Abdul-Aziz Kareem Abdul-Jabbar Mahmoud Abdul-Rauf Tariq Abdul-Wahad Shareef Abdur-Rahim Tom Abernethy Forest Able John Abramovic Álex Abrines Precious Achiuwa Alex Acker Don Ackerman Mark Acres Bud Acton Quincy Acy Alvan Adams Don Adams George Adams Hassan Adams Jaylen Adams Jordan Adams Michael Adams O'Neal Adams Ray Adams Sparky Adams Steven Adams Willie Adams Rafael Addison Bam Adebayo Deng Adel Rick Adelman Jeff Adrien Arron Afflalo Maurice Ager Mark Aguirre Blake Ahearn Jake Ahearn Danny Ainge Matt Aitch Warren Ajax Alexis Ajinça Henry Akin Josh Akognon DeVaughn Akoon-Purcell Solomon Alabi Mark Alarie Gary Alcorn Furkan Aldemir Cole Aldrich LaMarcus Aldridge Chuck Aleksinas Cliff Alexander Cory Alexander Courtney Alexander Gary Alexander Joe Alexander Kyle Alexander Merle Alexander Ty-Shon Alexander Victor Alexander Nickeil Alexander-Walker Steve Alford Rawle Alkins Bill Allen Bob Allen Grayson Allen Jarrett Allen Jerome Allen Kadeem Allen Lavoy Allen Lucius Allen Malik Allen Randy Allen Ray Allen Tony Allen Will Allen Odis Allison Lance Allred Darrell Allums Morris Almond Derrick Alston Rafer Alston Leonard Alterman Peter Aluma Al Alvarez Bob Alwin John Amaechi Ashraf Amaya Al-Farouq Aminu Ralph Amsden Lou Amundson Bob Anderegg Chris Andersen David Andersen Alan Anderson Andrew Anderson Antonio Anderson Art Anderson Carl Anderson Cliff Anderson Dan Anderson (b. 1943) Dan Anderson (b. 1951) Derek Anderson Dwight Anderson Eric Anderson Gene Anderson Cadillac Anderson J. J. Anderson James Anderson Jerome Anderson Justin Anderson Kenny Anderson Kim Anderson Kyle Anderson Michael Anderson Nick Anderson Richard Anderson Ron Anderson Ryan Anderson Shandon Anderson Willie Anderson Wally Anderzunas Ernie Andres Martynas Andriuškevičius Don Anielak Ike Anigbogu Michael Ansley Chris Anstey Giannis Antetokounmpo Kostas Antetokounmpo Thanasis Antetokounmpo Carmelo Anthony Cole Anthony Greg Anthony Joel Anthony Paul Anthony Pero Antić Clyde Anton OG Anunoby Keith Appling Rafael Araujo Stacey Arceneaux Gerry Archibald Nate Archibald Robert Archibald Ryan Arcidiacono Jim Ard Gilbert Arenas Trevor Ariza Paul Arizin Joe Arlauckas B. J. Armstrong Bob Armstrong (b. 1920) Bob Armstrong (b. 1933) Brandon Armstrong Curly Armstrong Darrell Armstrong Hilton Armstrong Scotty Armstrong Tate Armstrong Fred Arndt Jesse Arnelle Jay Arnette Bob Arnzen Stan Arnzen Carlos Arroyo Ron Artest Darrell Arthur John Arthurs Jamel Artis Bill Ash Ömer Aşık Vincent Askew Keith Askins Don Asmonga Dick Atha Chucky Atkins Al Attles Chet Aubuchon Stacey Augmon D. J. Augustin James Augustine Isaac Austin John Austin Ken Austin Carl Austing Deni Avdija Anthony Avent Bird Averitt William Avery Dennis Awtrey Gustavo Ayón Jeff Ayres Deandre Ayton Kelenna Azubuike Udoka Azubuike
"The Heat were devastated by injuries and COVID protocols all season. Only Bam, Duncan Robinson, Iggy (21 mpg), and Precious Achiuwa (12 mpg)  played 60+ games."
"Achiuwa: FINALLLY, PRECIOUS ACHIUWA HAS COME BACK TO TORONTO"
Starring Emma Stone as Precious Achiuwa
"Masai ""Griffith"" Ujiri  Precious ""Guts"" Achiuwa"
"Toronto is easy.  Fred VanVleet, Gary Trent Jr., OG Anunoby, Pascal Siakam, Malachi Flynn, Scottie Barnes, Precious Achiuwa, Khem Birch  Everyone else is expiring or a project."
"&gt;It’s not. The difference between $30M/year and $25M/year is pretty significant, especially when we’re talking about a 3 year deal.   I disagree, especially since the reference to 30 was only Lowry's then-current salary.  He was never matching that on a 35+ deal.  &gt;You’re also over exaggerating how raw Precious is,  No, I'm not, he was terrible.  The Heat were 8 pts / 100 better with Achiuwa tucked safely on the bench.  &gt; He’s an off-guard. What him play basketball games.  The Heat called him a PG, and started him at that position for two years. Basketball-reference says 100% of his career minutes have been at point guard.   The Lakers sign him to be their backup point guard.  /u/DoyinYale says he's not a point.  Hmmm... tough call."
"Sure, let’s do that. Looking at just the starters for both teams, assuming DeAndre Hunter is not injured, and Precious Achiuwa starts over Khem Birch, the Hawks have an average age of 24.6 years, while the Raptors have an average age of 24.2 years. And personally, I have no qualms if the Raptors do end up being bad this year. We got our chip 3 yrs ago, must be tough having your last chip be 64 yrs ago, and even that was with only 8 teams in the league."
"Considering Lowry was moved for Precious Achiuwa, that “extra” would have to be quite the haul to make the deal worth it."
The talk so far is that they're picking up a bunch of young athletic defensive monsters and trying to [teach at least some of them to shoot](https://www.si.com/nba/raptors/news/toronto-raptors-turning-precious-achiuwa-into-skilled-scorer) (like they did with their current core).
"Precious Achiuwa. In the Raptors development, with the type of opportunities he'll get and the older mentors he has (Baynes, Dragic, Siakam even?). Also his playstyle helps as he is a hustle guy who wants to get better. Miami would be even better for him if they were willing to start him at the 4"
My 2 answers are Hachimura and Precious Achiuwa.
MY MEMPHIS BOI PRECIOUS ACHIUWA OUT HERE BEING A GROWN MAN ON THE MF COURT MANE
"Precious ""Based on the novel Push by Sapphire"" Achiuwa is some old school Chris Berman level stuff lol"
"A GM would be fired, if he didnt hang up on Masai for offering that garbage.  The zeitgeist is that Porzingis is trash. In reality, and OP and a lot of you, should join it, he is still an excellent ballplayer.  Precious Achiuwa....smh FOH"
"He went from getting Danny Green+28th pick for Lowry to Precious Achiuwa, i don’t see the drop off."
"Well Dragic's value is pretty obvious.  His statements didn't change that.  FO knows what the offer is, they've definitely talked.  The only way it gets any 'better' is if we decide any of our prospects are actually shit and TOR doesn't see that yet.  I just don't think holding a veteran player hostage to get Precious fucking Achiuwa is a good look for a place that's already not a huge FA destination.  And trust me I know about not being a FA destination.  It's harder for y'all cuz Toronto is actually a cool ass city.  But seriously the value on this contract is not what you want it to be, and that's not Dragic's fault.  You've gotta recognize that, at least."
"PSG are taking out their Qatari checkbook as we speak. Imagine a front-line of Messi, Mbappe, Neymar and Precious Achiuwa"
Precious “Hakeem” Achiuwa
"After some development we can throw Precious in there too, he has huge defensive upside  Lmao, here’s a potential future lineup  Dalano Banton, Scottie Barnes, OG Anunoby, Pascal Siakam, Precious Achiuwa."
So now that Lowry has been traded I thought it was pretty fiasco free and we got a decent return.   20th overall pick in Precious Achiuwa and Dragic on a 20 mil dollar expiring deal. I’m happy.   Interested to see if we ride with Dragic or trade him for more assets.
So now that Lowry has been traded I thought it was pretty fiasco free and we got a decent return.   20th overall pick in Precious Achiuwa and Dragic on a 20 mil dollar expiring deal. I’m happy.   Interested to see if we ride with Dragic or trade him for more assets.
"&gt;Also, on a more important note, does your username refer to Precious Achiuwa?  No"
"Is it because of the contract extension?    Also, on a more important note, does your username refer to Precious Achiuwa?"
"Without shoes:  Pascal is 6’8.25”, Chris Boucher is 6’8”, Khem Birch 6’7.5”, Scottie Barnes 6’7”, Freddie Gillespie 6’9”, Dalano Banton 6’7.75”, Precious Achiuwa 6’7.5”, Yuta Watanabe 6’8”, and Sam Dekker 6’7.75”. So most of these guys would end up being 6’9” in shoes, except Scottie Barnes, who’d be 6’8” in shoes, and Freddie Gillespie, who’d be 6’10” in shoes."
Achiuwa is precious. Like lite giannis. Just mark my words
2k21 Perennial Sixth Man Of The Year Precious Achiuwa
"Look at the team though.  Siakam: Good player, all-star caliber. Disappointed on offense. Not really a #1 option.  VanVleet: Another good player, but undersized and clearly given too much scoring responsibility last season. Needs to develop as a scorer outside of the three point line.  Powell: Traded for GTJ, an inferior player with a lot of the same issues as FVV  Lowry: Traded for Dragic, a significantly worse player.  OG Anunoby: I love OG. nothing to say here.  Boucher: Good young scorer, not sure what else to say lol  Birch: Better option at the C position than Baynes  Scottie Barnes: I think the raptors development staff will turn him good, but I don't think he'll make a huge impact this year while his jumper is still developing  Precious Achiuwa: Decent young big? Should get rotation minutes this season  That's the rotation, unless I'm missing anybody. Considering how dense the east is this year, I have very little faith in this team making the 5 seed. Decent depth but Siakam + VanVleet as a 1-2 punch is extremely underwhelming when you pit it against the teams they'll be competing against."
"Precious Achiuwa is also involved in the trade. Seems like you are just talking shit for the sake of it. Nobody really cares about what we get for Lowry except for other fanbases lol. Raps fans have moved on, and He was a free agent that was about to leave for nothing  anyways in case you forgot."
"&gt; was Maxey Green and a 1st still better than Dragic Precious and a 2nd. Green and Dragic both are coming off their deals. Dragic under contract for one more year, Green expired now.   The 1st round pick wasn't offered that's the issue. 76ers final offer was Maxey, Green, Scott and 1 second round pick. That's not the farm and frankly, that's an insulting offer at the deadline.   Dragic can be used to gain more assets, which is what will happen. Green would've likely been bought out. Maxey and Achiuwa are comparable prospects. Achiuwa provides a positional need, so that's more beneficial."
"The trade wasn't ""Miami gives Precious Achiuwa and Toronto gives Kyle Lowry"", it was ""Miami gives Goran Dragic and Precious Achiuwa and Toronto gives Kyle Lowry"". Dragic is essential for the money to work, and, since the deal isn't officialized, literally nothing is stopping Toronto from just refusing to eat up Dragic's contract if we don't accept their terms.   Achiuwa would be the compensation if Miami had cap. They do not, so they need to offload Dragic to Toronto. Toronto can refuse to take Dragic if they want. It isn't rocket science, Miami needs Dragic on the trade and Toronto will accept it only with a 3rd team involved. No 3rd team, no Dragic. No Dragic, can't sign Lowry."
Aren't we getting Precious Achiuwa? I thought that guy could play C too.
"They should do a full rebuild imo and trade Siakam,Vanvleet and Boucher  OG,Gary Trent Jr,Precious Achiuwa,Scottie Barnes and whatever they get from Siakam,FVV and Boucher sounds like a good young core"
Precious Achiuwa and Goran Dragic
"Didn’t you get Precious Achiuwa?  Khem Birch, lol"
Isn't Precious Achiuwa a big?
"By Sam Quinn     7m ago2 min read  [Kyle Lowry](playerlink://nba/1113164) will join the [Miami Heat](teamlink://346) on a three-year deal through a sign-and-trade arrangement with the [Toronto Raptors](teamlink://358), according to Vincent Goodwill of [Yahoo Sports](https://twitter.com/VinceGoodwill/status/1422316481501671446). While full terms on the deal are not yet available,[ ESPN's Adrian Wojnarowski](https://www.espn.com/nba/story/_/id/31937408/sources-miami-heat-positioning-become-frontrunners-land-kyle-lowry-sign-trade-toronto-raptors) reported Sunday that the Raptors may receive [Goran Dragic](playerlink://nba/1622530) and [Precious Achiuwa](playerlink://nba/3141438) in the deal. Miami had attempted to land Lowry at the trade deadline, but couldn't come to terms on a deal with the Raptors. Now, finally, it appears they've landed their point guard"
"[League sources confirm to @miaheatbeat  that the Heat are sending Goran Dragic, Precious Achiuwa, and a future 2nd round pick in the sign and trade deal for Kyle Lowry](https://twitter.com/HawksBeatMHB/status/1422321343421427712?ref_src=twsrc%5Etfw%7Ctwcamp%5Etweetembed%7Ctwterm%5E1422321343421427712%7Ctwgr%5E%7Ctwcon%5Es1_&amp;ref_url=https%3A%2F%2Fwww.redditmedia.com%2Fmediaembed%2Fowpi9p%3Fresponsive%3Dtrueis_nightmode%3Dtrue)"
"Lmao you dug up a week old thread for this? You realize dragic isn't staying in toronto and the 76ers offered maxey + a fr pick, and instead we got Precious Achiuwa + a sr pick and potential to flip dragic to dallas."
"Precious ""based on the novel 'Push' by Sapphire"" Achiuwa"
Lmao we already have so many posts hyping up Precious and there are dudes down voting anything negative about previous achiuwa. People never learn it's like the Suggs thing 2.0
“It’s probably a different Achiuwa they are trading”  -precious
Does that mean they value whoever they can sign using the MLE more than precious Achiuwa?
"I imagine Miami calls up the team, say that they’re working on a Precious Achiuwa trade with Toronto that they’re trying to expand into a three team trade with Dragic going elsewhere and that they have Masai on speakerphone. They just say Toronto will give up something undecided for Achiuwa and Dragic to Miami, and that they’re looking for a third team to take Dragic.  As none of the players are free agents, no tampering is involved in discussing this trade, so everything is very legal and very cool."
"&gt; Lowry has long been intrigued with joining Heat star Jimmy Butler and the Miami organization, and now Miami has maneuvered to have two key elements of a possible sign-and-trade package -- guard Goran Dragic and forward Precious Achiuwa -- to offer the Raptors once talks can ensue at 6 p.m. ET on Monday, sources said.  &gt; The Heat picked up the option on Dragic's $19.4 million contract for the 2021-2022 season, making him an ideal contractual fit to include in talks to make a deal possible with the Raptors. A market exists for the Raptors to move Dragic, 35, onto a new team, including the Dallas Mavericks and New Orleans Pelicans, sources said.  &gt; Achiuwa, a well-regarded 2020 first-round pick out of the University of Memphis, showed significant promise in his rookie season and would serve as a sweetener to Toronto to facilitate a sign-and-trade deal, sources said. Miami could add draft assets to a package, too.  Getting Precious, picks, and whatever we get for re-routing Dragic would be a fantastic return for Kyle in a S&amp;T. Keeps our cap space open while also getting some big depth"
