"U.S.-China tensions, human rights and business are once again meeting uncomfortably on the basketball court.  In China, local brands are prospering from a consumer backlash against Nike, H&amp;M and other foreign brands over their refusal to use Chinese cotton made by forced labor. Chinese brands have publicly embraced the cotton from the Xinjiang region, leading to big sales to patriotic shoppers and praise from the Beijing-controlled media.  In the United States, two of those same Chinese brands, Li-Ning and Anta, adorn the feet of N.B.A. players — and those players are being rewarded handsomely for it. Two players reached endorsement deals with Anta in February. Another signed on this week. Klay Thompson of the Golden State Warriors already had a shoe deal with Anta that has been widely reported to be valued at up to $80 million.  Dwyane Wade, the three-time N.B.A. champion and retired Miami Heat player, has a clothing line with Li-Ning that is so successful he has recruited young players for the brand.  Like the foreign brands in China, the league and its players could soon feel themselves squeezed between Washington and Beijing. Western companies are being pressured by American officials and lawmakers to respond to accusations of genocide in Xinjiang. But they face a consumer-driven backlash in China, where celebrities have severed ties with brands like Burberry and patriotic citizens have burned their Nike shoes on social media.  The N.B.A. and its athletes are familiar with the challenges of trying to stand up to China and maintain access to its nearly 1.4 billion consumers. Just two years ago, China exiled the N.B.A. from state media channels after the general manager of the Houston Rockets supported pro-democracy protesters in Hong Kong.  The league has so far avoided the latest round of controversy. That may not last for long.  “It’s hard to imagine celebrities and brand ambassadors being able to walk this line between those negative views of China in their home countries and the increasingly clear demands in China to publicly demonstrate the use of products made in Xinjiang,” said Natasha Hassam, director of the Public Opinion and Foreign Policy Program at the Lowy Institute in Australia.   The Chinese companies themselves are unlikely to take a significant hit. The United States banned imports of products made from Xinjiang cotton in January, but neither Li-Ning nor Anta sells large numbers of shoes there. (They are available online, however.) Still, their full-throated support of Xinjiang could have reputational consequences for the American athletes.  “It is a simpler proposition for a Chinese celebrity to say I’m going to end my ties with X European company and probably be rewarded domestically for it,” Ms. Hassam said. “Americans looking to profit off China’s market find themselves in a much more challenging place.”       After Li-Ning and Anta published positive statements on Xinjiang cotton last week, investors in China sent the share price of both companies soaring. Chinese state media was quick to fuel the show of patriotism. At one point, a pair of Li-Ning shoes under Mr. Wade’s Way of Wade line traded for nearly $7,500.  But the statements could invite regulatory scrutiny on future business operations in the United States, said Brian J. Fleming, a lawyer specializing in sanctions at Miller &amp; Chevalier Chartered.  “By speaking out, Anta and Li Ning are simultaneously supporting the Chinese government and thumbing their noses at U.S. restrictions, which is a combination unlikely to be greeted warmly by U.S. authorities,” Mr. Fleming said.  Anta and Li-Ning did not respond to requests for comment.  Mr. Thompson, one of the N.B.A.’s biggest stars, is known as “China Klay” to his Chinese fans and once said he wanted to be the Michael Jordan of Anta. His teammate James Wiseman, as well as Alex Caruso of the Los Angeles Lakers, signed with Anta earlier this year, according to the sportswear brand’s social media account. Precious Achiuwa of the Heat announced this week that he was joining Anta.  Requests for comment from Mr. Thompson and other N.B.A. players also went unanswered.  Outside China, Xinjiang has become synonymous with repression. Reports suggest as many as one million Uyghurs and other largely Muslim ethnic minorities have been held in detention camps. In March, Secretary of State Antony J. Blinken accused China of continuing to “commit genocide and crimes against humanity” in the far northwestern region.  The N.B.A. has powerful reasons to keep quiet on China. When Daryl Morey, the general manager of the Rockets, voiced his support for the Hong Kong protests on Twitter in 2019, Li-Ning and Shanghai Pudong Development Bank Credit Card Center paused their partnerships with the team. The Chinese Basketball Association, whose president is the former Rockets player Yao Ming, also suspended its cooperation with the Rockets.  Mr. Morey deleted the message.  Adam Silver, the N.B.A. commissioner, later said that the Chinese government had asked the league to fire Mr. Morey, a claim that the Chinese Foreign Ministry quickly denied. But the incident left a scar on the N.B.A.’s reputation for supporting free speech and severely limited its access to the Chinese market.  China Central Television, the state-run television network, stopped broadcasting N.B.A. games after Mr. Morey’s message on Twitter. Late last year, it briefly resumed coverage for Games 5 and 6 of the N.B.A. finals. A week later, Mr. Morey stepped down as general manager.  In a radio interview this week, Mr. Silver said that CCTV had stopped airing N.B.A. games again, but that fans could stream them through Tencent, the Chinese internet conglomerate. He said that the N.B.A.’s partnership with China was “complicated,” but that “doesn’t mean we don’t speak up about what we see are, you know, things in China that are inconsistent with our values.”  A spokesman for the league declined to comment for this article.   Money and a large China fan base are at stake for players like Mr. Thompson and the dozens of other American athletes who have been heavily promoted by Anta and Li-Ning. Mr. Thompson has had a partnership with Anta since 2014 that has given him a popular shoe line and sponsored tours in China.  More recent deals between the companies and N.B.A. players could face questions in coming weeks as tensions between the United States and China escalate. Jimmy Butler, a five-time all-star who plays for the Heat, and the Toronto Raptors guard Fred VanVleet signed on with Li-Ning in November. Mr. Wade, the retired Heat player, helped CJ McCollum and D’Angelo Russell, two star guards, secure deals with Li-Ning through his sportswear line.  “My decision 7 years ago to sign with Li-Ning was to show the next generation that it’s not just one way of doing things,” Mr. Wade wrote on Twitter when he announced Mr. Russell’s contract in November 2019. “I had a chance to build a Global platform that gives future athletes a canvas to create and be expressive.”"
He atleast seems to have learned the dirty side of winning plays from CP3. Some of the plays where he managed to get free throws were hilarious. Especially the one where he stopped running to get bumped by Precious Achiuwa.
"Well, tbh a big part of being a good rookie is being able to prove that you're a good NBA player while playing decent minutes in actual NBA games. We could sit around and talk about how Onyeka Okongwu or Precious Achiuwa could've been ROTY candidates if they got enough playing time or something to that effect, but that's still very intangible, unlike actually getting playing time at the highest level and having decent efficiency playing against NBA level players in your first year. They don't put people on All-Rookie teams based on potential, you know."
Precious Achiuwa
"Dude, relax, it's not even that unbelievable of a name... There's literally Precious Achiuwa on the same team. Who has a sibling named Godsgift."
I love precious hachimura man. Rui Achiuwa is my second favourite
It’s Precious Achiuwa
This is the package yeah?  * Tyler Herro * Duncan Robinson * Precious Achiuwa * Kendrick Nunn * Salary Filler * Two 1st-Round Picks * 4 Pick Swaps  That's a huuuuge price to pay but it would have been workable.  Dragic Harden Butler Bam Olynyk.  Maybe you could have kept someone like Nunn out of the conversation too.
"NGL this one hurts, but Jimmy Buckets deserves better than going to the playoffs with Precious Achiuwa as his back up big.     I hope we can snag LMA in the offseason if Kanter wants a big pay day."
If they want to get better right now they would have to part with young talent. Lowry would probably only cost Precious Achiuwa in terms of their prospects but they can’t hold on to all their enticing trade chips while also adding high impact players like Lowry. You’re either in win now mode or you’re still building/re-tooling
Not a good trade for the raptors unless Precious Achiuwa is involved.
"Did you say what they were asking for harden though? Apparently they wanted:  Tyler Herro Duncan Robinson Precious Achiuwa Kendrick Nunn Salary Filler Two 1st-Round Picks 4 Pick Swaps  Bam-harden-butler would be awesome, but there’s no way they win a chip with just that and then literally scraps. so if we don’t win a chip, what’s the point of going all in?"
Can they work together?  u/nyknicks get:  Kelly Olynyk  Precious Achiuwa  2022 - RD 2from Heat  2027 - RD 2from Heat  2027 - RD 1from Heat  u/MiamiHEAT get:  Julius Randle  Bradley Beal  u/WashWizards get:  Andre Iguodala  Meyers Leonard  2022 - RD 1from Heat  2024 - RD 1from Heat  https://tradenba.com/trades/sCFOb0H-3
"The best foreign player this draft so far is Deni Avdija, followed maybe by Precious Achiuwa and Theo Maledon. This draft has just not had made good foreigners."
If either bam or precious can develop a jump shot it can be done. Bams Jumpshot is getting better especially this season. I’ve hear achiuwa has a good shooting form so who knows what good coaching can do for his game
"I cannot understand WHY does defense get overlooked so much when it is HALF the game lol.  How can Brooklyn even compete with Lakers when it's ""Big 3 vs Big 2"" BUT the 2 best defenders are on the Lakers side. So really it's Big 3 vs Big 4, and then the Lakers are much deeper bench wise. So I can't see the Nets winning maybe give them 20 percent chance but it's doubtful that series even goes 7 games.  Now who COULD be the team to upset Lakers???  In the Finals you could see Miami Heat upset the Lakers if Butler is Butler, Bam is Bam, and the supporting cast all shoots 40+ percent from 3 plus they keep up their ELITE DEF in the playoffs like last season. BAM with experience is scary he could match AD possibly, Jimmy can maybe even match an aging LeBron, so it might be cast vs cast and the Heat could have the slight edge if healthy with Precious Achiuwa the difference maker the X factor.  The SPURS??? Yes with Pop coaching and Tim Duncan experience beating the Lakers they can school the young Spurs how to beat the Lakers. Duncan knows how to get inside LeBron head he almost beat him 3 times in the finals. So yes they know LeBron secrets....and then you have the Big 3 of Dejounte, Derozan and LMA who are all very complimentary players. Murray is a DEF beast, Derozan is a leader, and LMA is a Vet. Not to mention the depth of guys like Gay, and Poetl and PATTY MILLS  The Sixers are the BEST team in the NBA this year. They have the MOST depth and the best players. The problem is coaching. Doc Rivers is a choke artist with the Clippers and Celtics. The 2008 win was in spite of him. Awful coach the guy doesn;t have a clue what he's doing out there.  So will the Lakers beat them?? Yes easily only because Doc Stinks. If Phil Jackson was coaching this Sixers team they EASILY win the chip. Embiid &gt; AD, and the Combo of Simmons/Tobias is good enough to match LeBron. Simmons on DEF and transition offense and Tobias with the clutch shooting like his game winner to beat Lakers this year."
" Tyler Herro, Duncan Robinson, Precious Achiuwa, Kendrick Nunn, Salary Filler, Two 1st-Round Picks, 4 Pick Swaps For Harden for two years."
No there was a report of Houstons asking price from the Heat  - Tyler Herro - Duncan Robinson - Precious Achiuwa - Kendrick Nunn - Salary Filler - Two 1st-Round Picks - 4 Pick Swaps
"Who knows. Goran Dragic has been hurt recently and Jimmy's coming off COVID but doesn't look that bad. I think the bigger issue is they're putting a ton of pressure on Duncan Robinson and Tyler Herro to produce on both ends and maybe they're just not ready to be so important to a competitive team's starting 5?  When you're depending on Kendrick Nunn, Precious Achiuwa, Duncan Robinson and Tyler Herro to perform well, you gotta kinda accept the inconsistently that comes with it."
"Maybe he can be useful with The Heat? Veteran championship coach with Jimmy Butler and Udonis Haslem as the captains of the team. They won't allow him to behave like that. Plus, The Heat could use some size and rebounding (Olinyk, Injured Meyers Leonard and rookie Precious Achiuwa is Adebayo's help). Adebayo can move to the 4 which could give him a break fighting the Centers and help with perimeter defense a bit more. He also has a good mid range shot now. The Heat need some size right now."
Precious Achiuwa
"It depends on what Toronto is asking for. Even though Lowry's contract is expiring, the Heat are likely looking for his bird rights. So Toronto might leverage those rights for a young prospect: ~~Tyler Herro~~, Precious Achiuwa, Duncan Robinson, or Kendrick Nunn.  Also, the Heat likely include some combination of Iguodala ($15m), Olynyk ($12m), and Leonard ($9.7m) to match salaries for Lowry ($30)."
"Kendrick Nunn, Precious Achiuwa, Duncan Robinson, and a 2nd round pick."
"In no particular order it's probably Quickley, the top 3 picks, Haliburton, Desmond Bane has been shooting super well, Pritchard had some great games and should be getting back from his injury soon, Tyrese Maxey was kinda balling when the sixers needed him to step up, Patrick Williams seems solid, and then Precious Achiuwa seems good whenever I see him? Idk I'm probably missing someone, but sure is 10 good rookies"
1. Precious Achiuwa 2. Jaylen Adams 3. Steven Adams 4. Bam Adebayo 5. LaMarcus Aldridge 6. Ty-Shon Alexander 7. Nickeil Alexander-Walker 8. Grayson Allen 9. Jarrett Allen 10. Al-Farouq Aminu 11. Kyle Anderson 12. Giannis Antetokounmpo 13. Kostas Antetokounmpo 14. Thanasis Antetokounmpo 15. Carmelo Anthony 16. Cole Anthony 17. OG Anunoby 18. Ryan Arcidiacono 19. Trevor Ariza 20. D.J. Augustin
"Yes because the rockets only wanted Herro for mvp winner James Harden 🤡🤡 you're a casual  [The Rockets asking price from Miami for James Harden included Tyler Herro, Duncan Robinson, Precious Achiuwa, Kendrick Nunn, two first-round picks, and 4 pick swaps.](https://twitter.com/LegionHoops/status/1349806703513100292)"
Precious achiuwa gonna pull another bam and make people look dumb again
first: IQ Tyrese Hali Wiseman(ROY) Lamelo Pat Will  Second:  Devin Vassell Desmond Bane Tyrese Maxey Cole Anthony Xavier Tillman  Just missed: Payton Pritchard(would be in it if he wasn’t hurt) Precious Achiuwa Ant Edwards Saddiq Bey Isaiah Stewart Mason Jones
"Precious Achiuwa is fuckin sick, I'm excited about this guy"
"It’s my go-to example for an outlandish name—God’sgift Achiuwa (played for St. John’s, older brother of Precious) is another one I reference too lol"
Precious Achiuwa. Enough said
"well except you’re wrong  https://twitter.com/TheHoopCentral/status/1349771437675073546?s=20  Rockets wanted unprotected 1sts in 2025, 2027, unprotected swaps in 2026 and 2028 and Precious Achiuwa  Herro and D Robinson weren’t the reason Miami didn’t trade for Harden  edit: also 2 more pick swaps apparently"
Precious Achiuwa easily   /s
Look at the threads in this subreddit about Precious Achiuwa. This sub is just as xenophobic as it accuses Shaq of being.
  **Heat @ 76ers**  [](/MIA) **108 -  125** [](/PHI)  **Box Scores: [NBA](http://www.nba.com/games/20210114/MIAPHI#/boxscore) &amp; [Yahoo](http://sports.yahoo.com/nba/miami-heat-philadelphia-76ers-2021011420)**  |**Team**|**Q1**|**Q2**|**Q3**|**Q4**|**Total**| |:---|:--|:--|:--|:--|:--| |Miami Heat|30|28|20|30|108| |Philadelphia 76ers|38|35|25|27|125|  **TEAM STATS**  |**Team**|**PTS**|**FG**|**FG%**|**3P**|**3P%**|**FT**|**FT%**|**OREB**|**TREB**|**AST**|**PF**|**STL**|**TO**|**BLK**| |:--|:--|:--|:--|:--|:--|:--|:--|:--|:--|:--|:--|:--|:--|:--| |Miami Heat|108|40-81|49.4%|12-34|35.3%|16-26|61.5%|9|41|28|19|4|20|1| |Philadelphia 76ers|125|44-82|53.7%|17-37|45.9%|20-24|83.3%|5|35|27|22|15|18|3|  **TEAM LEADERS**  |**Team**|**Points**|**Rebounds**|**Assists**| |:--|:--|:--|:--| |Miami Heat|**22** Duncan Robinson|**11** Precious Achiuwa|**8** Gabe Vincent| |Philadelphia 76ers|**31** Shake Milton|**10** Ben Simmons|**12** Ben Simmons|
Those of us from Memphis and are familiar with Wiseman's situation don't hold a grudge at all.  It was the NCAA's fault.  They cleared Wiseman to play and then later said he would need to sit out a number of games and repay monies Hardaway gave Wiseman's family for relocation.  I don't blame Wiseman at all.  Instead of bowing to the NCAA he said no.  I would rather have had him stay but it worked out in his favor considering the shortened college season.  It also gave Precious Achiuwa a chance to shine which directly led to him being drafted in the first round and if you look at the numbers I think Achiuwa has been playing a lot better than Wiseman thus far.
Precious Achiuwa
They think it’s Duncan Robinson and Precious Achiuwa
"Hell of a game and hell of a carry job with a short handed squad!   But...  Let’s also recognize the context of the fact he was dominating against a defense of Precious Achiuwa and Olynyk for a Heat team with 8 active players. He better damn well dominate that matchup, and he did that a little bit more. Doesn’t suddenly make him MVP, though."
"Nope, although Precious Achiuwa is for sure better than Jokic LOLLLL. Denver is 5-6 for a reason."
"This game has been awesome. Got Danny Green going crazy for three quarters, Tyler Herro and Joel Embiid taking over in OT, someone named Dakota hitting a shot to take the lead, Precious Achiuwa playing amazing, and potential for more of the Heat can score."
Please let us get Precious Achiuwa in action for 30 minutes tomorrow 🙏🏼
Bruh what? Precious Achiuwa is looking like the steal of the draft. We don’t have a competent center outside of Boucher so we could get him plus another draft pick for Masai to work his magic with. It’s that or Lowry walks in FA and we get nothing.
Precious Achiuwa and Peyton Pritchard would like to have a word.
"Ah yes, white Heat rookie Precious Achiuwa"
precious achiuwa is a s++ tier name
"The crazy thing is that they also have other valuable players like Kendrick nunn, who I expect to get there by the end of the season, precious achiuwa, who looks like a promising young defender, Andre iguodala, who provides veteran leadership, defense, and shooting, Myers Leonard, a strong center who can shoot threes, and mo harkless, who is a solid 3 and d player. This is after losing derick Jones jr, Jae crowder, and Solomon hill in free agency. If they were able to bring those guys back they would be 15 men deep."
Marvin Bagely or Precious Achiuwa
"I wanted Desmond Bane with the 20th pick, who is doing great in limited minutes on the Grizz bench.  However, I am very pleased with Precious Achiuwa"
He’s basically precious achiuwa lite
"They didn't start that way, but in the later half of the season it's been Precious Achiuwa and Gabe Vincent.  Since we acquired Bjelica he's played like 3 games then disappeared, doesn't even get garbage time."
Fully healthy they also have Tyler dragic nunn Dedmon iggy dipo/Duncan bjelica precious achiuwa. Max strus has been giving great minutes kz is a good defender but has some potential offensively and gabe isn’t great but he’s a role guy who can cover if you have no one else which at times the heat havnt
Precious Achiuwa I assume
I was mildly amused by some Heat fans calling Precious Achiuwa “Sneeze”
Precious Achiuwa
  **Rockets @ Heat**  [](/HOU) **91 -  113** [](/MIA)  **Box Scores: [NBA](http://www.nba.com/games/20210419/HOUMIA#/boxscore) &amp; [Yahoo](http://sports.yahoo.com/nba/houston-rockets-miami-heat-2021041914)**  |**Team**|**Q1**|**Q2**|**Q3**|**Q4**|**Total**| |:---|:--|:--|:--|:--|:--| |Houston Rockets|28|27|19|17|91| |Miami Heat|30|24|35|24|113|  **TEAM STATS**  |**Team**|**PTS**|**FG**|**FG%**|**3P**|**3P%**|**FT**|**FT%**|**OREB**|**TREB**|**AST**|**PF**|**STL**|**TO**|**BLK**| |:--|:--|:--|:--|:--|:--|:--|:--|:--|:--|:--|:--|:--|:--|:--| |Houston Rockets|91|33-85|38.8%|9-38|23.7%|16-17|94.1%|6|41|20|7|8|13|3| |Miami Heat|113|45-93|48.4%|19-48|39.6%|4-7|57.1%|11|52|31|19|7|13|5|  **TEAM LEADERS**  |**Team**|**Points**|**Rebounds**|**Assists**| |:--|:--|:--|:--| |Houston Rockets|**18** Christian Wood|**8** Kelly Olynyk|**6** John Wall| |Miami Heat|**30** Kendrick Nunn|**11** Precious Achiuwa|**8** Kendrick Nunn|
It should be Precious Achiuwa because he went from never playing again to starting from one game to the next.
&gt; Houston’s asking price from Miami in a James Harden trade: &gt;  .. &gt; &gt; Tyler Herro  &gt; Duncan Robinson  &gt; Precious Achiuwa  &gt; Kendrick Nunn  &gt; Salary Filler  &gt; Two 1st-Round Picks  &gt; 4 Pick Swaps &gt;  ..  &gt; Miami was not interested  That is so worth James Harden for 2 fucking years guaranteed lmao. You get to keep Bam and get an instant big 3.
"has Precious looked as bad as Wiseman this year? I remember watching the 3 college games Wiseman played, and he seemed more lost out there than Achiuwa did (like he was actively getting in Precious's way, bumping into him, clogging the paint against his own teammate). I figured a year's worth of college games would've benefited Precious to the point where he'd be less raw/green than Wiseman coming into this season."
"Miami played 1/3 of the season without Butler cuz of COVID... Only three of their players have played at least 50 games as of today (Robinson, Iguodala, and Precious Achiuwa)."
Precious Achiuwa [Ben Wallace]
Precious Achiuwa.
Precious Achiuwa with one of the greats
"For Miami idk if it’s even possible for us to put together a good package without including Bam.. that being said Bam is untouchable, I’ll ship Jimmy out before I ship a hair on Bam’s buttcheek. So realistically we can give Herro, Precious Achiuwa, KZ Okpala, picks, maybe sign and trade of Duncan Robinson if possible..   The end goal is to have Dame with Jimmy and Bam.. We’ll fill out the rest of the roster with Max Strus and some G Leaguers"
"I wanna say the Heat but after reading some of the other packages mentioned in this thread, we don’t got the juice. Best we could do is Duncan Robinson via S&amp;T, Tyler Herro, Precious Achiuwa. If we could incentivize OKC to get involved by removing the protections on the picks we owe them, it frees up draft capital to be able to send to the Wizards as well.   There are stronger offers out there though"
"The protections on the pick owed to OKC prevents Miami from trading any unconditional first round picks, which is a big reason they couldn’t get in on Harden. They will gain a 2028 pick that can be traded after the draft though, but that’s the only tradable pick they can get if they can’t get OKC to lift the protections on the 2023 pick (which OKC won’t do without good compensation).   Tyler Herro and Precious Achiuwa are their only two young trade assets. Achiuwa has little trade value and Herro’s value took a massive dip.   As a result of all this, Miami isn’t in position to get a high end star in a trade because they would be easily outbid by a number of other teams.   Only way to salvage the trade cupboard would be internal improvement from Herro and Achiuwa."
"No it wouldn’t, stop making shit up. Heat had nothing to offer that was nearly as good as the Nets package  *”But the Rockets want more. Even if the Heat offered Herro, Robinson, Precious Achiuwa, KZ Okpala, Iguodala, Olynyk and first-round picks in 2025 and 2027, I’m not sure that would be enough to satisfy the Rockets.”*  -Barry Jackson, Miami Herald"
"&gt;Dude didn’t even entertain a Herro trade for Harden even tho his best player is 31  How do you entertain a trade if there isn’t one to begin with ?  [Heat were prepared to offer Herro+Duncan Robinson](https://twitter.com/flasportsbuzz/status/1344691335459201028?ref_src=twsrc%5Etfw%7Ctwcamp%5Etweetembed%7Ctwterm%5E1344691335459201028%7Ctwgr%5E%7Ctwcon%5Es1_c10&amp;ref_url=https%3A%2F%2Fd-30835999862001070912.ampproject.net%2F2105210438000%2Fframe.html)  Houston wanted more. Heat don’t much in terms of picks either. The only picks they can trade are in 2025/2026.  Nets traded Levert &amp; Allen AND 3 FRPs, Allen was traded for another FRP from the Cavs.  That’s 4 FRPs + Levert in terms of valuable assets not including filler + Pick swaps.  Where in gods name do Miami come up with the Picks ? This deal could never happen realistically. The Lowry deal is much more realistic. You guys have to stop this narrative.  *”But the Rockets want more. Even if the Heat offered Herro, Robinson, Precious Achiuwa, KZ Okpala, Iguodala, Olynyk and first-round picks in 2025 and 2027, I’m not sure that would be enough to satisfy the Rockets.”*  -Barry Jackson, Miami Herald"
"If he wants to take our two 2-way players, precious achiuwa, and maybe KZ  and go on a tear in practice vs Herro-Nunn-Robinson-Ariza-Bam  Then who are we to stop him."
