"&gt;He’s a rookie who went off in summer league  That right there is the issue. Summer league means nothing cause you're battling with other players trying to earn roster spots with the G league team. Naturally you're going to look great against that competition if you're a hyped lottery draft pick. Feels like people have unnatural expectations based off a great 4 games in the summer and think that'll translate to the NBA offense.   Case in point, Precious Achiuwa looked like god in summer league, looked average to below average against NBA level defences.   Ppl need to adjust their expectations and understand that summer league rookie performances don't translate to NBA where you're literally playing against the 400 top players in the world."
"Something something 'greatest raptor of all time"" something something precious achiuwa."
Double digits constitutes a monster night for Precious Achiuwa
Scottie Barnes  OG Anunoby  Pascal Siakam  Fred VanVleet  Gary Trent Jr  Precious Achiuwa  Khem Birch  Dalano Banton  Would be the likely list I imagine.
"Neither Slovenia or Serbia are part of Eastern Europe, they’re both considered Central.  Team Nigeria is basically just Dream, Giannis, Boston’s Head Coach, Prince Al-Farouq and Precious Achiuwa."
Okay you better be posting Grant Williams and Precious Achiuwa hitting 3’s next time it happens. Apparently that’s what you want to see
Bust?  I'd like to offer in trade one lightly used Precious Achiuwa
"Javale McGee, Tacko Fall, Precious Achiuwa, Manute Bol, Bol Bol  Checkmate"
"It's because your post wasn't just about him having a shitty TS%, you posted    &gt;Is Precious Achiuwa the worst player in the NBA?"
Precious Achiuwa has a 38.4 TS% as a big!
"I think it's a 3 guard, small ball unit with;  Jalen Brunson Tyler Herro Alex Caruso Cam Reddish Precious Achiuwa (now that he's coming off the bench)   Most of these guys could start on many teams and have shown that. They also play as closers frequently.   As a Spurs fan I had to stop myself from putting Devin Vassell in there for either Brunson or Caruso (although he might play his way in soon at this rate)."
"OG actually played Seth perfectly it was actually Precious Achiuwa who got ""bamboozled. He assumed Achiuwa would stay near the paint and not randomly come up since Drummond had the ball and isn't an outside threat."
the Miami Heat passed on Tyrese Maxey for Precious Achiuwa
  **Raptors @ Celtics**  [](/TOR) **88 -  104** [](/BOS)  **Box Scores: [NBA](http://www.nba.com/games/20211110/TORBOS#/boxscore) &amp; [Yahoo](http://sports.yahoo.com/nba/toronto-raptors-boston-celtics-2021111002)**  |**Team**|**Q1**|**Q2**|**Q3**|**Q4**|**Total**| |:---|:--|:--|:--|:--|:--| |Toronto Raptors|25|21|22|20|88| |Boston Celtics|33|29|18|24|104|  **TEAM STATS**  |**Team**|**PTS**|**FG**|**FG%**|**3P**|**3P%**|**FT**|**FT%**|**OREB**|**TREB**|**AST**|**PF**|**STL**|**TO**|**BLK**| |:--|:--|:--|:--|:--|:--|:--|:--|:--|:--|:--|:--|:--|:--|:--| |Toronto Raptors|88|33-77|42.9%|6-25|24.0%|16-19|84.2%|6|41|20|17|8|18|8| |Boston Celtics|104|42-94|44.7%|10-29|34.5%|10-15|66.7%|12|44|21|13|10|15|5|  **TEAM LEADERS**  |**Team**|**Points**|**Rebounds**|**Assists**| |:--|:--|:--|:--| |Toronto Raptors|**21** Scottie Barnes|**9** Precious Achiuwa|**6** Fred VanVleet| |Boston Celtics|**22** Jayson Tatum|**13** Robert Williams III|**7** Jayson Tatum|
"You gotta be braindead man. You think NOP would take Satoransky, Temple, and a SRP over fucking Simmons if Morey pushed for it??? 6ers would've got Lonzo and picks back if they wanted, too. Those picks could also be used for asset management.  We know Miami tampered, yet we also know the 6ers had an opportunity to get Lowry. Which, on that note, another complete bone headed mistake by Morey. Lowry has literally transformed the Heat offense, and he is, again, a perfect PG for the 6ers. Maxey, Thybulle, and a pick would've been enough and would've been totally worth it. Morey cheaped out and got beat by fucking Precious Achiuwa lmaoooo"
Precious Achiuwa would be crying in the car after practise if he was on the same team as Kobe.
"Raps fans too.  I'm glad we got *something* for Lowry in a S&amp;T, but a deal based around Precious Achiuwa is significantly less appealing than one based around Tyrese Maxey (from Philly) or Horton-Tucker.   We had the most valuable asset at the trade deadline and held onto him because two win-now contenders refused to give up young guys who barely played in the playoffs. Big missed opportunity all around."
Fun fact: Precious Achiuwa was based on the novel 'Push' by Sapphire
  **Raptors @ Wizards**  [](/TOR) **109 -  100** [](/WAS)  **Box Scores: [NBA](http://www.nba.com/games/20211103/TORWAS#/boxscore) &amp; [Yahoo](http://sports.yahoo.com/nba/toronto-raptors-washington-wizards-2021110327)**  |**Team**|**Q1**|**Q2**|**Q3**|**Q4**|**Total**| |:---|:--|:--|:--|:--|:--| |Toronto Raptors|29|30|27|23|109| |Washington Wizards|29|19|29|23|100|  **TEAM STATS**  |**Team**|**PTS**|**FG**|**FG%**|**3P**|**3P%**|**FT**|**FT%**|**OREB**|**TREB**|**AST**|**PF**|**STL**|**TO**|**BLK**| |:--|:--|:--|:--|:--|:--|:--|:--|:--|:--|:--|:--|:--|:--|:--| |Toronto Raptors|109|41-88|46.6%|10-25|40.0%|17-20|85.0%|10|42|17|23|10|10|3| |Washington Wizards|100|34-78|43.6%|8-32|25.0%|24-30|80.0%|10|44|19|15|6|13|7|  **TEAM LEADERS**  |**Team**|**Points**|**Rebounds**|**Assists**| |:--|:--|:--|:--| |Toronto Raptors|**33** Fred VanVleet|**10** Precious Achiuwa|**6** Fred VanVleet| |Washington Wizards|**25** Bradley Beal|**10** Montrezl Harrell|**7** Bradley Beal|
We will no longer tolerate precious achiuwa slander for the next...6 hours
"The heat being good now does not disprove they were ""bubble frauds"". They added Kyle Lowry, PJ Tucker and Victor Oladipo. While also taking away Goran Dragic, Precious Achiuwa and Kendrick Nunn. They aren't the same team anymore."
"- Tyler Herro (currently averaging 22.4/6/4.4, leading bench scorer in the NBA)  - Duncan Robinson (extended, enables extensive spacing for two stars who can't shoot even if he's in a slump)  - Precious Achiuwa (used in trade to acquire Kyle Lowry)  - Kendrick Nunn (let go for nothing)  - Salary Filler (would've likely been Goran Dragic &amp; Andre Iguodala, one of which was used in the Lowry trade)  - Two 1st-Round Picks (likely 2022/2024)  - 4 Pick Swaps   this is the king's ransom they asked for Harden."
"the point is that james harden's net impact would not have made up for the loss of all houston wanted for him (that we **DID NOT HAVE ANYWAY**)   now, it's nearly a whole season later -- james harden is struggling, precious achiuwa and goran dragic (**TWO PIECES WHO WOULD'VE LEFT FOR HARDEN**) were exchanged for kyle lowry (who has been phenomenal), and tyler herro is having a breakout year -- not to mention the picks we managed to hold onto that houston wanted  miami won the hypothetical"
  **Raptors @ Knicks**  [](/TOR) **113 -  104** [](/NYK)  **Box Scores: [NBA](http://www.nba.com/games/20211101/TORNYK#/boxscore) &amp; [Yahoo](http://sports.yahoo.com/nba/toronto-raptors-new-york-knicks-2021110118)**  |**Team**|**Q1**|**Q2**|**Q3**|**Q4**|**Total**| |:---|:--|:--|:--|:--|:--| |Toronto Raptors|26|27|38|22|113| |New York Knicks|34|23|22|25|104|  **TEAM STATS**  |**Team**|**PTS**|**FG**|**FG%**|**3P**|**3P%**|**FT**|**FT%**|**OREB**|**TREB**|**AST**|**PF**|**STL**|**TO**|**BLK**| |:--|:--|:--|:--|:--|:--|:--|:--|:--|:--|:--|:--|:--|:--|:--| |Toronto Raptors|113|43-99|43.4%|14-42|33.3%|13-14|92.9%|13|48|24|20|12|8|4| |New York Knicks|104|35-76|46.1%|16-38|42.1%|18-24|75.0%|7|41|20|13|3|16|4|  **TEAM LEADERS**  |**Team**|**Points**|**Rebounds**|**Assists**| |:--|:--|:--|:--| |Toronto Raptors|**36** OG Anunoby|**9** Precious Achiuwa|**8** Fred VanVleet| |New York Knicks|**27** RJ Barrett|**12** Mitchell Robinson|**5** Julius Randle|
The minute Precious Achiuwa stepped off the court they started playing like Peak Warriors
"Thanks for the insight. Didn't see any of the Suns gleague games and his stats looked solid.   Right now for the Raptors, Precious Achiuwa has great stats but takes bad shots out of the flow of the offense and drives head down everytime. No chance of a pass at all. But they are giving him constant chances to figure it out  Poor Frank is always the whipping boy. He has had a much longer career than i ever thought. Saric injure was brutal for the Suns last year"
He averages nearly 6 potential assists per game the issue has more to do with guys like Khem Birch and Precious Achiuwa just not catching the ball and finishing plays. Comparing him to Magic Johnson may be a bit of a hyperbole but he definitely will be an above average playmaker in his prime.
