"Here is our roster after your mentioned players:   2 Veterans: Tristan Thompson and washed Jeff Teague   2 Euroleague pickups: Daniel Theis and Javonte Green   9 rookie contracts: Tremont Waters, Carsen Edwards, Tacko Fall, Grant Williams, Romeo Langford, Aaron Nesmith, Payton Pritchard, Rob Williams   Our team routinely is packed with young players with midlevel upside. It's not so much Brad isn't creative enough with his offense, it's just a matter of ability. The team is top heavy and most of these young guys don't know what their ceiling is going to be. Ainge sat on the draft picks and decided he was going to try and build out the roster with young talent instead of trading for established names. It's worked out because Jaylen, Tatum, and to a degree Smart have all worked out, but it's left us top heavy. A contested Tatum 3 is better than Semi Ojeleye doing literally anything. Replace a handful of the rookies with solid veterans and the offense would look a lot better. Despite the fact that it seems like it's not working, Boston is one of 3 teams with a top 10 offense and defense, even with the rotating cast of young players.   Stevens has gotten more than his money's worth in Theis and spun gold out of guys like Jordan Crawford, Jae Crowder, Evan Turner, and others. A good number of former Celtics have gone from Steven's system where they had success to flounder elsewhere.   It may seem boring or uncreative or like bad coaching but if you look at this roster it's a borderline G-League team after the starting 5. This IS the optimized Celtics offense.   Here's the Offensive Rating of the Celtics for each year Stevens has been coach: 27th, 18th, 10th, 8th, 18th, 10th, 4th, 9th   The season we spiked back up to the 18th best offense Ainge made Brad take on **7!!!** rookies, 2nd year Jaylen Brown, no Gordon Hayward, and a hobbled Kyrie Irving.   I hope this doesn't come off as a rant because I really built this comment as I went and it's actually been a frustration of mine with the team overall that we have so many young players, and often undrafted guys rounding out the roster, instead of giving Stevens some older guys to work with. When Stevens had a roster of mid career guys he led us to the #1 seed in the East.   TL;DR  Stevens is a good offensive coach. Boston doesn't have the personnel to do much more than whats on the court right now, but even that is a top 10 offense. When given more established players Brad can spin gold."
"Jeff Teague, Carsen Edwards, Semi Ojeleye, Grant Williams, Tristan Thompson"
"Payton Pritchard pleasant, Jeff Teague unpleasant. The bench would be Semi Ojeleye pleasant, Tristan Thompson unpleasant.  I expected a leap (still, not this big) from Jaylen so I don’t really think he fits this, tho he is close. I had no expectations for Payton and I expected Semi to be getting 0 minutes. I expected Teague to be a solid backup and Tristan to be a solid starter. All four of no where close to accurate so far."
"Semi Ojeleye is a walking brick shithouse. If you're going purely based on how jacked a player is, and not skill, he's easily starting over Lebron at SF"
So you've never heard of Semi Ojeleye?
"Posted it elsewhere in this thread, but fuck it.  Semi literally had an [article](https://www.google.com/amp/s/www.gq.com/story/semi-ojeleye-real-life-diet/amp) written about how jacked he is"
I think [Semi’s got that honor](https://www.google.com/amp/s/www.gq.com/story/semi-ojeleye-real-life-diet/amp) on the Cs
Semi Ojeleye
"On the Celtics Sub, someone said that instead of Semi Ojeleye, we needed Full Ojeleye"
"Boston needs bench depth, but Wings... as crazy as that sounds. last year we had Brown, Tatum, Hayward so there was no reason to get a wing because 1 of them was always on the floor and most of the time 2 of them were out there. Without Hayward this year on the wing we have Jaylen and Jayson. after that the depth is really: Javonte Green, Semi Ojeleye, Romeo Langford (injured), Aaron Neismith. the back up ball handlers are Teague, Pritchard, Edwards and Waters. IT was one of my favorite players, but we couldn’t really use any point guard help right now unless we move some guys."
Oh you don't know that Semi Ojeleye is very strong because of his very loud workouts that are very famous in the locker room?
"larry  nance, even stanley johnson, semi ojeleye could be cheap to go get  just to have wing bodies"
"Why are we pretending that Crowder and IT alone got them all those players, that's not what happened at all.   If I trade Semi Ojeleye for a second round pick and then package that pick with a bunch of other stuff for like fuckin Luka Doncic, I'm not gonna turn around and say that I traded Semi Ojeleye for Doncic"
"The problem is that if Ben is really that great, Semi Ojeleye shouldn’t be able to stop him"
Garrett Temple  Rodney Hood  Kyle Anderson  Semi Ojeleye  Harrison Barnes
"I think that Grant Williams was actually a massive success of a pick. He's playing very well and has a positive plus minus with the team having a higher Net rating whenever he hits the court. On the topic of Nesmith, Semi Ojeleye said that Nesmith was ""a straight shooter, you guys will see soon."" on his stream yesterday so clearly he's showing something in practice that we haven't yet seen in game. I'm still super hopeful on him."
"That team would be one injury away from semi ojeleye being a regular starter.   I live semi and I think he’s seriously underrated by most Celtics fans, but if he’s in the starting lineup you are in trouble."
Why is Semi Ojeleye in NBA?
"Definitely the most fun I’ve had this season! Semi really went Full Ojeleye, FastPP went off, and Nesmith was able to hit a 3 and had a good drive!"
"Pony up! Him and ""Brick Shithouse"" semi ojeleye are the only names I recognize getting any minutes these days.   We don't talk about Mudiay lol"
"Theis is your starting C, my dude. Teague is at best a league average backup PG, normally that would be dinwiddie for us but he tore his ACL. With kyrie/harden/kd, we don’t really need a backup 1 guard because they can all handle the ball. Brown, shamet, and green are all viable players off the bench, and we have 3 spots that we can fill with buyout players/vets.   I’m not gonna even bother talking about “HUGE” leaps from ... *checks notes* semi ojeleye through 10 games this year, or payton pritchard. If your team actually has either of those guys getting big minutes in playoff rotations, it says enough about your team."
"Teague? Theis? both proven guys, then you have Grant, who was great defensively year 1, Semi Ojeleye, who has taken a HUGE leap this year with 7 points on 42% from 3, you have Payton Pritchard, who has exceeded expectations massively, you have Robert Williams, averaging 1.5 blocks in 16 minutes as well as being a huge presence as a roller. Then off the end of the bench Javonte Green, a freaky athletic guy. Also when we are fully healthy, Marcus Smart may come off the bench(all-defense 1st team btw)     The nets have who? Tyler Johnson and Jeff Green?Bruce Brown? Chris Chiozza? that is not a good bench lmfao. C's may not have the best bench in the world, but y'all's bench is awful"
"Robert Williams is playing 16 minutes a game on a team with Thompson and Theis and when he is on the court the team has its second highest net rating. Wanna know who’s number one? Semi Ojeleye with a +28.3 net rating, who by the way just scored 18 about 2 hours ago on efficient shooting. Grant Williams literally started and played his role well. Nesmith is a developing young player who is still figuring out defensive rotations. These guys are all playing very important roles on the #1 seed in the east. Why do you try so hard to discredit players who worked hard to get where they are? These guys put blood sweat and tears into improving on their games year in and year out yet their success is a joke to you. I don’t understand how you can be so arrogant while blatantly disregarding the known truth. I’ll say it again.   *Delete this nephew*"
"this season's heroes, Payton Pritchard and semi ojeleye. just like we all expected"
"Holy shit, that was such a fun game. And what the hell happened to Semi Ojeleye? I'm loving this dude right now. Loved the last minute there with Tacko. I really was hoping that would be 3 on that jumper."
"Michael ""Jesusemilore Talodabijesu ""Semi"" Ojeleye"" Jordan"
"Jesusemilore Talodabijesu ""Semi"" Ojeleye"
"Semi ""Third option"" Ojeleye.  Watch it, Kemba.  About to get Wally Pipp'd."
Must suck to not realize THT is about equivalent to Semi Ojeleye
And a powerhouse sniper and LeBron stopper off the bench like.. Semi Ojeleye
"He's not moving probs, but I'll trade Semi Ojeleye and Carsen Edwards for him"
Thybulle is Semi Ojeleye with a few more blocks and steals.
My Semi just went Full Ojeleye
"Horford to Toronto is pretty interesting. I don’t think we’re in the running for Hill. Payton Pritchard has turned out to be a really good bench PG, especially for a rookie and Brad Stevens trusts Jeff Teague with reckless abandon. Plus, we still have our tiny toons guards.  We need another wing to be honest. Semi Ojeleye has actually been very good this season so far but after him and the Jays, it’s pretty barren. Javonte Green is an exciting deep bench guy but he shouldn’t be getting many minutes, we don’t know if Romeo Langford will be able to stay healthy and Nesmith just isn’t ready to contribute yet (he looks fine, just needs to be in the nba system to catch up to the game).  Plus, Danny ainge almost NEVER makes roster adjustments mid-season outside of 10-day contracts."
"I’m just a fan of girthy thicc muscular jacked chad like Stanley Johnson, Justise Winslow, Semi Ojeleye, Admiral Schofield"
"Jesusemilore Talodabijesu ""Semi"" Ojeleye"
I was feeling upset just from seeing the replay of that one. Fucking nasty fall that was. Wasn't JB also the one who ended up like straight up headbutting Semi Ojeleye and fucking up his neck last season (iirc)?? Or was that someone else
Yeah why you think we keep Semi Ojeleye around?
"I liked the Pritchard pick as well but was really opposed to Nesmith. A 20% jump in 3pt shooting in one season rarely happens, not to mention it was on a pretty small sample size against non-conference opponents. Plus he doesn’t do anything else well offensively. On the other side of the floor, his lateral quickness and defensive IQ leaves a lot to be desired. All in all, he looks like a project.   I liked Bey because he could fit into our rotation like a glove and give us much-needed wing minutes. Right now we have to rely on Semi Ojeleye and Javonte Green for backup wing minutes."
Like what exactly? I'd argue that in the last 3 drafts the only time we didn't get the BPA was Semi Ojeleye over Jordan Bell.
Semi Ojeleye
Maybe Semi Ojeleye is actually good
I hate Semi Ojeleye
I'm Semi Ojeleye
"Yeah if the Cs want to get serious there are 3 or 4 young players who need a few more years of development to really begin producing, but also some guys we need to dump off to try and acquire more vets. I think both Williams and Pritchard are the ones worth hanging onto, along with maybe Waters. Ojeleye and Langford should be part of a package tbh, Semi is at his ceiling and Romeo is a project for a rebuilding team to gamble on, he cannot seem to stay healthy. Edwards may not have a role on any team tbh."
"I need to take some time off those game threads tbh. If Tatum doesn’t get the ball, people scream “stop icing Tatum out he needs the ball!” And if he does get the ball and doesn’t shoot 100%, they go “stop with the Tatum isos, pass the ball!”. Nothing will ever please the people there. If you just read the game threads and didn’t watch the games, you’d think that the Jays were averaging 10 PPG, Smart has never made a shot in his life, Brad Stevens is the worst coach in the league, and Semi Ojeleye is a war criminal."
"“He got me,” Smart said of Ojeleye's whiskey theft from him. ""That f***ing Semi boomed me.""  Smart added, “He’s so good,” repeating it four times.  Smart then said he wanted to add Ojeleye to the list of players he exchanges birthday gifts with next year."
Meanwhile I can't even get semi ojeleye to watch a single one of my videos.
Detroit needs to atleast get something valuable in return. Throw in Semi Ojeleye.
"Renowned sharpshooter and lockdown perimeter defender Semi Ojeleye is all they should need for this deal, the man is a certified Giannis Stopper™, trust me guys"
"you say bench forwards, but we are fucking playing two bigs most of the time, or starting Semi Ojeleye or Javonte Green, OR BOTH.  But yeah, Jerami Grant doesn't seem like a guy who wants to be 3rd-4th scoring option."
"Some things not necessarily related to the box score that I enjoyed/noticed from this game:   The refs actually did a pretty good job. Of course there's a few questionable calls but overall the game was played pretty smoothly and it was much more enjoyable because they let both teams play through some contact. This is also partially the result of the clippers taking a lot of jump shots.   Both teams helped players of the other team up after committing fouls every now and then. I noticed Reggie Jackson do it a couple times most notably.   The amount of pick &amp; pop the clippers run lets defenders hedge with very little consequence. I haven't watched a lot of their games, maybe a clippers fan could comment on if this is something that defences exploit or if it just works too well to run more rolls.   Semi Ojeleye can jump really fuckin high if he wants to."
The Celtics will win If Payton Pritchard and Semi Ojeleye have anything to say about it
Sure made Payton Pritchard and Semi Ojeleye better against us  I’d like to see Semi get 20+ points without them
"Could he be putting together a better gameplan? Of course. But you’re basically asking him to get blood from a stone with this dogshit roster where the first wing off the bench is semi ojeleye, the only point guard taller than 6 foot is Jeff Teague, and the tallest person on the roster besides tacko is 6-9"
The tristan thompson thing was so dumb and their whole fanbase was behind it. Same with Semi Ojeleye🤔. Grant williams might be a bit of an exaggeration tho
"To offer a somewhat serious reply - it's difficult to judge the recent picks too much. For one, 2nd round picks rarely ever pan out, and so there's no surprise guys like Carsen Edwards and Tremont Waters aren't anything noteworthy (shoutout to Semi Ojeleye though, who's actually a contributor). And even first-rounders don't carry a high guarantee of success.  As for his first-round picks, Romeo Langford has been injured more than not, and that's never a good sign for any player's potential. But when he did play, it did look like he belonged in the league. Time will tell what becomes of him once he returns.  Speaking of time, Rob Williams is a pretty underrated prospect. Yeah he's already in his 3rd year and is 23, but he was always a project to begin with, and this year he's definitely shown a lot of improvement with his defense. His minutes aren't very high, but that's supposedly so his hip problem doesn't flare up too soon into the season. If he can put everything he has together, he'd definitely be outplaying his #27 draft selection.  Grant Williams is okay, it's hard to see him getting a 2nd contract at this point, but he looked better last year, so there's hope he can revert (his 3P% is up at least).  It's way too early to tell with Nesmith, but he's definitely not a James Young kind of player. His career will rely on being able to knock down 3s consistently.  As for Ainge getting better results from these draft picks - one could certainly argue for that. What was once a treasure trove of picks has now resulted in a lot of uncertainty. It didn't help that both the Kings and Grizzlies played above expectations (they were seen as surefire top 7 picks prior). But in order for him to sell those picks, there had to be buyers - and not a lot of buyers want late lottery/mid-20s picks and nothing else. Ainge was definitely targeting someone like Jrue Holiday, but the Bucks' offer was simply too much for him to match.  I do think it's unfortunate so many players left the C's without compensation, such as Horford, Irving, and Morris. Rozier and Hayward as well, sort of, though we'll see how that TPE and Kemba's knee turn out. I just think his draft assets - combined with the success of Tatum/Brown -  got way overhyped."
Let’s not pretend that Celtics fans thought their supporting cast was actually decent in the beginning of the season lmao.   “Grant Williams next Draymond green”  “Semi Ojeleye has reinvented himself into a top tier sniper role player”   “Tristan Thompson is better than Myles Turner and his championship experience will help the Celtics”
Holdup lemme call my best friend semi ojeleye and ask him
well when its between that and starting Semi Ojeleye you kinda just hold you nose and do it
"Sadly in this case it is. Grant Williams, Javonte Green, and Tremont Waters are not NBA players. Semi Ojeleye and Carsen Edwards are maybe 12th men. There's 5 guys, an entire lineup, that doesn't belong on a contending team. The only real case is Ojeleye would be a fine 12th man on a contender.  There's plenty of current free agents that would be better. The Nets just released like 3 guys who would be upgrades didn't they?"
 Semi Ojeleye has played the 5th most minutes for the Celtics this year and you want to put the issues on coaching?
"See that's also an oversimplification.   Yes, ideally Tatum needs to be more efficient. I'm not going to argue there.    However, the mistake you're making is assuming players should be compared to league averages and not team averages. I would love for Tatum to defer his shots to LeBron James more frequently, but unfortunately, we don't have LeBron James on the team.   Tatum often can't pass out of a bad shot because if he passes out we get an even worse shot. He can't defer to Jeff Teague, Semi Ojeleye and Grant Williams.   Kyrie on the other hand, had: Jayson Tatum, Jaylen Brown, Gordon Hayward, Al Horford, Marcus Morris and Terry Rozier. There were guys he could have deferred to. Instead, he took shots away from them to focus on his own volume stats.  There is an argument to be said that Tatum could offload a couple of extra scoring attempts (and I've been wary of his low assist numbers and poor body language lately), but we really need him scoring ~20-25ppg at least, even at this efficiency because we can't get those points in a more efficient way.   &gt;Does that mean you'd rather have Deandre Jordan as a scorer than Tatum?  No.   Because as much as Tatum has struggled recently:  1. His efficiency isn't bad for a perimeter player (TS% is warped by highly efficient bigs on low volume) 2. His efficiency needs to be seen in the context of the team, not the league."
"-Marcus Smart is the spiritual leader, defensive tone-setter, and best playmaker on the Celtics, losing him has been absolutely massive as you said.  -We’re trying to work Kemba back into playing shape but he’s been very inconsistent and our depth at guard is not good. Pritchard was a nice find but every other guard we have is undersized and shouldn’t be on an NBA roster. we all complained about Wanamaker last year but Teague makes him look like Magic Johnson  -Behind Brown and Tatum we have no depth at wing at all. Grant Williams and Semi Ojeleye are like carbon copies of each other: undersized, dense, not very athletic, inconsistent shooters. I’ve actually liked Nesmith’s effort the last few games but he’s not ready to play significant minutes, and our lottery pick Langford from last year hasn’t even touched court this year due to injury, and really so far his whole career has just been marred by injury  -Our big rotation is actually pretty decent between Theis, Williams and Thompson. I’d say Thompson hasn’t been great though, and the double big lineup we keep running is..very meh.  -Tatum and Brown have gotten flack for ball hogging but they create lots of open looks, team just isn’t converting. Which eventually leads them to force the issue and just make SOMETHING happen  Overall it’s a lot of problems and it’s mainly roster construction. There are only 6 players (Brown, Tatum, Smart, Pritchard, Theis, Rob Williams) that are definitely worth keeping around long-term. It’s crazy how fast we went from having one of the leagues most stacked rosters two years ago to this"
"I don't buy that roleplayers are garbage excuse.   If the Celtics roleplayers are garbage, why do they ALWAYS seem to go off against us? Different players every game too.  Aaron Baynes shat on us randomly one game, and then proceeded to almost lose his game once joined our team.   Last year it was Timelord and Brad Wannamaker.   This year it's been Semi Ojeleye and Payton Pritchard. Their rookie has already given us the business while our rookie has been forced to slowly go about his business.  Truthfully, the Celtics are still figuring it out this season, just like a bunch of other top East teams have had to. This season is no different for them than it is for us, Miami, Milwaukee etc."
No dump him to the Celtics for semi ojeleye.
"A lot of those teams listed rely on them to some degree, but that's also what their skillset are for. The Trailblazers have 2 pick and roll, ball handling, creating guards. That's not what Brown and Tatum are, they are great at lots of things, but that's not the role they are best served in  There's also that those other teams at least have other options. The Blazers at least have GTJ who can get to a pullup  The Raptors just full stop have a creation problem, as do the Trailblazers recently. Spurs have multiple ball handlers and guards. The Warriors I would say are very non reliant on a single creator, they run a lot of pass and motion heavy offence, they are reliant on them to make it good, but not to do it.   Clippers still have Lou William's, the Bucks have 3 creators + other guards that can get to a shot, the Nets have 3 all league calibre creators, the Sixers have multiple ball handlers and scorers  The Celtics have a broken Kemba, and a late 1st round pick as their other creators. They have 4 bigs in their rotation, including starting TT and Theis together. Semi Ojeleye now plays important minutes on the wing for them. This team isn't just built around two stars like other teams are, they have virtually zero creation outside of those stars"
"I just think with the amount of picks they had, their depth should be better than it is. In the post-big 3 era how many second-rounders did they have? and how many of those worked out? I know that most second rounders don't work out, but to have as many as they did and for them to basically all be bad picks is the reason they have no depth. The last two champions have had players drafted in the second round rounding out their depth: Norman Powell and Kyle Kuzma.  Like quickly scrolling through some drafts right now, in 2015 they took Jordan Mickey above Richaun Holmes and Willy Hernangómez and Marcus Thornton over Norman Powell.  In 2016 they took Demetrius Jackson when they could have taken Georges Niang.  2019: Tremont Waters over Jalen McDaniels.  The only really solid second round picks I came across, where there weren't better players taken right after, were Abdel Nader and Semi Ojeleye."
"Expectations were too high, I'm honestly not at all surprised with the struggles so far. We knew Kemba would take a while to return (and he has been worse than expected for sure but he was a question mark heading into the season), our bench offense was horrific last season and only got worse without Hayward, who would often lead 2nd units. Add in the Smart injury and 15-15 sounds about right.  There are a lot of positives to the season: Jaylen took a huge step, Payton Pritchard looks like a future rotation piece, Robert Williams looks amazing at times, Semi Ojeleye sometimes looks like an actual NBA player on the court, Theis is still Mr. Underappreciated and his three ball has been terrific.  I'm not ""worried"" in the sense that I didn't expect this team to compete for a championship this season; my preseason prediction was the 5th seed and we are a half game behind that. Losing Hayward was huge, it would be foolish for people to expect us to just carry on like we did last season without him.  I think Danny Ainge is going to re-evaluate the roster and use the trade exception in the offseason, not at the trade deadline this year. Kemba is the key to the future -- he has to either start playing better and quickly, or we *have* to find a way to unload his contract."
"Even more annoying when you remember that we neutralized the J’s in the second game, only to get dummied by Payton Pritchard and Semi fucking Ojeleye."
"LOL, we got torched by Semi Ojeleye a week ago, I know your pain."
"I think he means if you can throw an end of the bench defensive minded guy out there to take elbows, yes it is a risk for the player, but it is beneficial to the team.  The Celtics are relying on Semi Ojeleye right now due to other guys missing time, but at full strength he's a guy they could throw out there to take elbows to the face all night.  Wouldn't want to see that happen to my man Semi tho."
Semi has started the last two games. Obviously he doesn’t start when healthy but if we are missing Kemba and Smart and have to resort to starting Semi Ojeleye and Javonte Green we have a problem. We need 2/3 more good bench pieces.
We'll continue to see Semi Ojeleye until everyone learns to spell his last name and away-team announcers can pronounce it right.
I remember when Bill said if Semi Ojeleye was on the Nets instead of Caris LeVert he'd be getting hyped up just as much and is just as good
