"As soon as next summer, really. They can put all their eggs in the Beal basket (which I’m still not sure is the right choice), or they can add actual quality depth all around the edges rather than having to play Grant Williams Semi Ojeleye and Romeo Langford big minutes"
the disrespect to Semi Ojeleye... smh
Millsap to buck to form up a super team with bobby portis and semi ojeleye
"Not all corner threes are created equal. Ideally, a shooter in the corner means that his defender can't leave him, opening up lanes for the rest of the offense. If the defender cheats too far, then a quick pass to the corner means a high percentage shot as the defender scrambles to get back.  This is not the case with Semi Ojeleye. Even if he hits a three here and there, his defender is NEVER going to respect him as a threat from the corner. The Celtics were playing 4-on-5 on offense whenever Semi was on the floor, and his defender is able to essentially play free safety. They accept that Semi *might* hit a three, but the added benefit of roaming on defense is greater than the risk.  I'd also consider his defense to be average at best, but that's a different thing entirely. He's the 3-and-D player who is average at best at 3s and D, and a complete zero in all other facets of the game."
PJ Tucker replacement Semi Ojeleye
Meanwhile I’m out here hoping my team will sign one nba player so grant williams and semi ojeleye don’t have to play major minutes
Semi Ojeleye to the jazz
Would love to add turner if we could keep timelord and the core. I just dont see pacers giving him up for carson edwards n semi ojeleye :(
Don't even get me fuckin started on Semi Ojeleye
Celtics notable draft pick over the last 5 years;  - Jayson Tatum - Jaylen Brown - Robert Williams - Aaron Nesmith - Payton Pritchard  - Romeo Langford - Grant Williams - Semi Ojeleye  - yeah it falls off pretty hard now
He can’t be any worse than Romeo Langford or Semi Ojeleye or Jabari Parker
He can’t be worse than Semi Ojeleye
Spoken like someone who's never watched Semi Ojeleye on a regular basis.
Man do you have any idea how much playing time we gave to Semi Ojeleye the past few years in our wing rotation? I'll give you the answer: way too much. Richardson will be an upgrade.
"Haha so you're gonna use last year as hard evidence that the Jays need Bradley Beal? Most games missed due to injuries and covid, with 50% of Kemba Walker as our starting Point Guard? Maybe if we didn't have to play Grant Williams and Semi Ojeleye for 20 MPG, and start Tristan Thompson for 43 games, things would have been different. Our best 5 barely played together last year. If you think the Celtics were a Bradley Beal away from not being a .500 team then I don't know what you were watching."
Semi Ojeleye. About the best they can afford.
Nurse's schemes are heavy on team defense and helpers coming in at the last second.  This keeps the unit much more compact and is vulnerable to pick and pops and swing passes for open 3's.  The system is great against bad shooting teams but everyone in the NBA including centers are shooting 3's at a decent rate now.    That's why you get nights where Semi Ojeleye and Payton Pritchard can run them off the court.    Simmons doesn't really fix this issue.
"Ben Simmons for Carsen Edwards, Tremont Waters, Semi Ojeleye and our 45th pick this year. We can also add Grant Williams if they ask for more."
You don't deserve much credit for beating the hospital Celtics in the 1st round because you were very efficient.  Romeo Langford and Semi Ojeleye actually started for them in the playoffs.
"Add in Jesusemilore Talodabijesu ""Semi"" Ojeleye and baby, you got a stew going."
Looks like Semi Ojeleye has found a home.
"you could join Celtics Nation, we got 17 rings but that's the past and also people get mad when I bring that up since they were won back in the day but anyway  currently we have one of the best young duos in the NBA, Jayson Tatum and Jaylen Brown. Both 25+ PPG scorers with multiple playoff series wins under their belts. As well as these guys, you'll surely love rooting for   Marcus Smart, the heart &amp; Soul of the team who wears his heart on his sleeve and dives for every loose ball.   Al Horford, our steady veteran presence.   Payton Pritchard &amp; Aaron Nesmith, our two terrific sophomore players who can shoot the lights out and make tons of hustle plays    Rob ""Timelord"" Williams, he does cool dunks and blocks and it's awesome  Tacko Fall, he's 7'5 lol(or 228.6 cm)  as well as many other players such as Romeo Langford, Evan Fournier, Carsen Edwards, Grant Williams, Jesusemilore ""Semi"" Talibejesu Ojeleye, Tristan Thompson, Moses Brown, and so many more.   We also have fans who are super passionate about the game and even once cheered ""Let's Go Celtics!"" for 5 minutes even though we were down by 20 in a playoff game, because that is Celtic Pride.   I can fill you in more on the lore of the team if you want, there's a lot though, we're a very historic franchise"
"Drew Hanlen, the guy who turned Semi Ojeleye into a beast"
"The biggest factor will be getting ≥60 games out of Horford, Richardson and Schroder **each**. With injuries and covid we only actually got ~60 games out of Walker and Fournier **combined.**    For r/nba users who might not know, it meant we spent a lot of time either starting Thompson out of position as a PF or starting guys like Semi Ojeleye (who started more games and played twice as many minutes as Fournier).   We should actually have a starting 5 this year and that starting 5 might even play a single game together, that's huuuuuuuge for us."
"Nicolas Claxton, Al Horford, Rudy Gobert, Deandre Ayton, Ben Simmons, Joel Embiid, Clint Capela, Semi Ojeleye (lol), Myles Turner, Kawhi Leonard, Marc Gasol, and Bam Adebayo have all been ""Giannis stoppers"" at some point or another. Last two have been pretty good though"
"Yep, so far the pieces from the original trade (along with some added free agency pieces and the occasional conditional pick that frequently didn't convey) have been turned into 4 total all stars:  Jaylen Brown (via draft)   Jayson Tatum (via draft)   Isaiah Thomas (via trade)  Kyrie Irving (via trade that included Thomas, Jae crowder, and the 2018 nets pick)   As well as a list of players who have logged playoff minutes for the Celtics:  Semi Ojeleye  Romeo Langford  Tyler Zeller  Jonas Jerebko  James Young (not very good playoff minutes, but he did log minutes on the 2017 ecf team)   Jordan Mickey (see above)  Abdel Nader   Gerald Wallace  Jae Crowder (IF and only IF we include the Rondo to Dallas deal as an extended part of the rebuild)   Juancho Hernangomez is the latest player to find his way to the Celtics as a direct result of the nets trade, so if he is traded away then I'll have to add more lines to my spreadsheet"
when was the last time you saw him and Semi Ojeleye hanging out?
Semi Ojeleye?
"Same. Liked him since his duke days. That was a likable team. Tyus Jones, Quinn Cook, Justise Winslow, Grayson Allen before his reputation, Semi Ojeleye, a Plumlee bro. They had a squad"
"Bunch of rookies, sophomore and 3rd year player on our bench last season. Now we have a decent bench. Semi Ojeleye, Recovering Langford, Rookie Neismith, Sophomore Grant Williams, Carsen Edwards and Tremont Waters (both under 6 feet), Jabari Parker, Washed TT, White guy from the bulls and Tacko Fall. Oh I forgot Kemba in and out Walker. Did you even know those guys? Lmfaoo"
Our guy Semi Ojeleye. He has a special place in Celtics fan culture
Semi Ojeleye on the list but no Connaughton LMAOOOO
They signed semi ojeleye to a secret max
"Semi Ojeleye. He got traded To the bucks this offseason I think. Longtime Celtic, he just never did much, was never a true explosive player on either end. Also, Markell fultz comes to mind but he hasn’t played enough."
You misspelt Semi Ojeleye
"Poor Semi Ojeleye, dude is getting absolutely shat on in half of these lmao"
Did Semi Ojeleye just hit a contested mid range over Andre Roberson?
i love how they snuck a semi ojeleye jumper in there
I thought i saw Semi Ojeleye in there... am i crazy? is that Semi?
"Exactly! Andre Roberson sighting.   But yes I saw Cheick, I saw Semi Ojeleye, I think that was Montrezl in the Lakers shorts??"
Semi Ojeleye? I've heard from multiple celtics fans he doesn't dribble the ball very well and he's an inconsistent shooter but excellent perimeter defender and hustler so probably him
"Yea I mean this doesn’t really matter too much bc you’re right that they both need to improve. I would just disagree with the first point—teams didn’t have to worry about Tatum passing to the open man bc way too often the open man was Grant Williams/semi ojeleye/Daniel theis + Thompson at the same time, etc. Obviously brown had to deal with that as well, I’m just higher on tatum’s ability to grow into an offensive hub based on what I’ve seen him do in spurts."
"Bobby Portis and Semi Ojeleye are back tonight and will be playing; think that just leaves Brook Lopez, Jrue Holiday and Donte DiVincenzo on the injury list."
"Bucks look like they’re missing 1 strong forward tht can switch and hustle hard like PJ Tucker to unlock the Giannis at center line up.. Maybe Semi Ojeleye can be better? Prob not.  But Grayson Allen, Connaughton and Nwora look like they all improved a lot and looking like legit rotational pieces now"
Semi oJeleye is 1 of the worst players in the NBA. Divenchenzo sucks. Portis is a role player.   Sorry Khris Mickey and the Greek Cheeks are shitting the bed. Maybe next year don't waste a roster spot on Giannis' scrub nepotism brother. Bum ass probably averages like 13 fouls/36 😹
"Totally agree, people will talk about PJ but not talk about how thin we were at guard without Donte. That’s why I’m really satisfied with the Grayson Allen trade and Semi Ojeleye on a minimum deal to at least fill PJ’s role on paper."
"Semi Ojeleye is a cheaper, younger, more athletic PJ Tucker with a better jumper. He doesn't have the intangibles though"
"Deeper than that even. They were 9 deep tonight without Donte, Bobby, Rodney Hood and Semi Ojeleye"
Kalaitzakis is on a guaranteed deal and he’s a raw forward who just came from the Euroleague. I genuinely believe that Thanasis will contribute more than Semi Ojeleye and Rodney Hood (who is washed). Thanasis is actually a good bench piece.
"They actually changed quite a bit, their depth is almost completely different. Brought in role players to fill gaps, like Grayson Allen, George Hill, Rodney Hood, Semi Ojeleye, and a new rook 'Mamu', and Jordan Nwora will probably get more time this year after looking really strong in the Olympics. Not earth shattering moves but quite a bit of roster change"
you're exaggerating. he can become another Semi Ojeleye by the end of this season.
"Allen, re-signed Portis, Nworas been doing very good, Rodney Hood(I think is coming back from an injury so we will see) Semi Ojeleye and might be more I can’t remember off the top of my head. Oh and Donte should be back.   May not sound like much but it’s not uncommon for people to come here and look noticeably better than they did on previous teams (Portis for example).   Plus Khris and Jrue could always shoot better next time we face them, that was our issue when Kyrie went down. Aside from game 6, Middleton and Jrue were pretty bad offensively that series."
"Dude averaged 17, 5, and 7 last season on 39% 3pt shooting. If that's declining, then I guess half of the point guards in the league want to decline. Imagine thinking Grayson Allen and Semi Ojeleye are going to help the Bucks get far this year, especially against a vengeful Heat team 🤡"
Bucks bench: George hill/Grayson Allan/Pat Connington/Semi ojeleye/Jordan nwora/Bobby Portis
"Nah bro, Semi Ojeleye"
Marcus smart and semi ojeleye
"Someone on the Celtics sub once said trading Semi Ojeleye or Carsen Edwards was akin to mortgaging the future. Another person once said (in a heavily upvoted comment) that the Celtics would probably turn down an offer of 2 1st round picks for Kemba in May 2021.   Both of those really stood out to me, but the takes on r/bostonceltics are pretty much consistently terrible."
"I know. But at this point, saying ""if Kyrie comes back...."" seems like about as realistic a hypothetical as saying ""if Semi Ojeleye returns from his injury as an All Star-calibre player....""  Theoretically possible, but all evidence points towards it not being remotely plausible."
"Nah, it’s rather a frowned upon move because the general consensus is that you want to bring a guy like PJ Tucker back after how much you relied on him thru the championship run.  He was great for them against Heat and Nets. He was instrumental in that he unlocked Giannis at the 5 and let Bucks play a more switchable defense. That is crucial and they miss that this year. Bobby Portis won’t see the floor against certain match up and he def didn’t see the floor against the Nets. Same if you go down the line of Pat Connaughton, Jordan Nwora, Semi Ojeleye… those guys can’t provide what Tucker brought"
Semi Ojeleye and maybe George hill to some of the fan base
Semi ojeleye
"There wasn't downside other than not being able to sign other players for that money.   Kemba wasn't the answer, so the alternative was maybe to try and build a deeper bench with someone like Seth Curry, Danny Green, or even JJ Reddick (who shot 45% from 3 in 2019).   As for the draft - yeah it's a crapshoot, but his constant drafting of project wings who lacked traditional skillsets was frustrating. Yabusele, Semi Ojeleye, even Grant to some extent, Zizic, Bird...a crapshoot means you hit once in a while beyond the lottery, and since 2016 we legit are 1/12 or 2/12 depending on how you slot Grant.   If you go out and spend on big pieces in FA, you need to have a better hit rate in the draft to fill a deeper bench. But you can't sign the wrong FA, and miss in the draft consistently.   Again, his moves before Kemba were good. But 2019 and 2020 were both major misses, and it wasn't looking like the tune was going to change in 2021, so I welcome the change."
"In back-to-back games against Philly and the Knicks, Semi Ojeleye shot 8/9 FG% (89%) including 5/6 3pt% (83%).    In the other 9 games he has played for the Bucks this year, he has shot 5/38 FG% (13%) and 1/22 3PT% (4.5%)"
"You know what’d be cool is building a giant lead ***and not fuckin losing it the second Giannis sits***.  Also why is Jordan Nwora not playing, there is no way Bud has watched Semi Ojeleye this year and thought “yes this man deserves to be in our rotation” but there’s no room for Nwora."
"""Fall got some reassurance that wouldn’t be an issue after remembering one of his teammates, Semi “Muscles Jesus” Ojeleye, has been vegan for a while.  “Semi has been vegan as long as I’ve known him. If you look at him, Semi’s a big dude,” Fall says. “For someone like him to be vegan and still maintain his physique, that should tell you everything you need to know. I won’t sit here and tell people to become vegan, but I think it doesn’t hurt to give it a try.”"
"iirc he got a lot of PJ Tucker comparisons his rookie year. He regressed a bit last season outside of his shooting, but he's been mostly solid this season (Semi Ojeleye is gone now, so he's become /r/bostonceltics scapegoat, but he's not that bad)"
"Been the case for them basically this entire year, opponent's players sitting (either for legitimate injuries or just ""load management"") and then still winning.  We had Semi Ojeleye, Justin Robinson, Thanasis, George Hill, and Jordan Nwora all playing 20+ minutes, with Giannis as our only normal starter playing 27 minutes (though I guess Grayson Allen has probably taken the job from Donte at this point, so him too, with 22 minutes)..... And won by 28.  Loyal Pistons fans buying tickets this year are definitely not getting a good show for their money."
Counterpoint: Semi Ojeleye
Semi Ojeleye is shooting 28% on the season  💀
Semi Ojeleye is like Jason Statham in that one movie I never saw.  Gotta keep the game close to keep that adrenaline level high and stay alive.
Kent Bazemore and Semi Ojeleye were throwing up shots just to see who could miss more tonight.
"jv level sloppy from both sides  passing into the middle of traffic, blowing bunnies (semi ojeleye), bricks louder than drone strikes"
"I gotta say, Semi Ojeleye and George Hill on the floor together is just disgusting basektball"
I see you haven’t met Semi Ojeleye
  **Bucks @ Celtics**  [](/MIL) **113 -  122** [](/BOS)  **Box Scores: [NBA](http://www.nba.com/games/20211112/MILBOS#/boxscore) &amp; [Yahoo](http://sports.yahoo.com/nba/milwaukee-bucks-boston-celtics-2021111202)**  |**Team**|**Q1**|**Q2**|**Q3**|**Q4**|**OT1**|**Total**| |:---|:--|:--|:--|:--|:--|:--| |Milwaukee Bucks|30|25|26|27|5|113| |Boston Celtics|30|21|37|20|14|122|  **TEAM STATS**  |**Team**|**PTS**|**FG**|**FG%**|**3P**|**3P%**|**FT**|**FT%**|**OREB**|**TREB**|**AST**|**PF**|**STL**|**TO**|**BLK**| |:--|:--|:--|:--|:--|:--|:--|:--|:--|:--|:--|:--|:--|:--|:--| |Milwaukee Bucks|113|44-98|44.9%|16-47|34.0%|9-11|81.8%|12|39|23|19|7|11|3| |Boston Celtics|122|47-96|49.0%|12-41|29.3%|16-18|88.9%|16|53|22|12|5|16|7|  **TEAM LEADERS**  |**Team**|**Points**|**Rebounds**|**Assists**| |:--|:--|:--|:--| |Milwaukee Bucks|**22** Bobby Portis|**7** Semi Ojeleye|**13** Jrue Holiday| |Boston Celtics|**38** Dennis Schroder|**11** Jayson Tatum|**6** Marcus Smart|
It was a very fun game lmao.  Happy to see Semi Ojeleye doing well (relatively).
Semi Ojeleye getting single-triple game against his former team
Semi is gonna go Full Ojeleye against us
"Timelord's been doing this pretty often over the past couple seasons, the only thing really holding him back was availability and playing time. It's not like when fucking Semi Ojeleye inexplicably went off and had his career high against you guys last season."
Semi Ojeleye
Semi Ojeleye
Semi Ojeleye has no business playing over 5 minutes in an NBA game
semi ojeleye....i understand why the celtics were happy he left
"Semi Ojeleye, I have no clue why we signed him all the man does is run cardio and brick yet bud keeps giving him pt"
"Jesusemilore Talodabijesu ""Semi"" Ojeleye"
"""Semi"" Ojeleye =  Jesusemilore Talodabijesu Ojeleye"
"If I never ever see Semi Ojeleye again it would be seeing him to much. He is about the most useless NBA player I have seen. He is neither a good defender, he can't shoot, can't pass, can't dribble. Lets just put more guards out there, better then this."
SEMI OJELEYE IS NOW 1-13 FROM 3 THE LEAGUE IS NOT READY
Guerschon Yabusele and Semi Ojeleye were the beefy glue holding the Celtics together
SEMI OJELEYE HAS SCORED POINTS IN THIS GAME
"Giannis/Grayson/Hood are all on the injury list for this game, but only as probable.  In seriousness, if those 'probables' don't play, here my attempt at a possible depth chart;  PG: George Hill/Justin Robinson/Thanasis Antetokounmpo  SG: Pat Connaughton/Jordan Nwora  SF: Jordan Nwora/Pat Connaughton/Thanasis Antetokoumpo/Georgios Kalaitzakis  PF: Thanasis Antetokoumpo/Semi Ojeleye/Sandro Mamukelashvili  C: Bobby Portis/Sandro Mamukelashvili"
Giannis Antetokounmpo  Thanasis Antetokounmpo  Grayson Allen  George Hill (I think)  Sandro Mamukelashvili  Semi Ojeleye  Scrimblo Bimblo
I knew I shouldn't have mortgaged my house for my Semi Ojeleye MVP bet.
I don't put a lot of weight (if any) into preseason and summer league stats. Lots of NBA players can hit open shots in low-pressure situations. Last year Carsen Edwards shot 47% from three in the summer league and 45% in preseason. I once watched Greg Stiemsma make like 9/10 threes in warmups. Romeo was a very bad shooter in college and a very bad his first two seasons in the league. I don't think it's unreasonable to wait for a larger sample size of actual NBA games.  Almost all of Romeo's shots are wide open because the defense doesn't care about him. It's like guys on r/bostonceltics who would argue that Semi Ojeleye was actually a good shooter because he was *slightly above average* on ultra low usage and every single attempt he had like 10 ft of space because his defender was playing free safety.
"I think the main problem is when Giannis plays the C, they need a competent PF to fill in. Portis is exactly that, and so was PJ. Semi Ojeleye/Pat Connaughton/Khris Middleton at the 4 however..."
