"Bickerstaff simplify the game for Sexton just get buckets and surround him with Jarrett Allen, Larry Nance Jr, Taurean Prince, and Issac Okoro play on ball &amp; help defense, set screens, and make extra passes."
"The Nets obtained James Harden and gave away Caris LeVert, Jarret Allen, Rodion Kurucs and Taurean Prince, their umprotected first round picks in 2022, 2024 and 2026, plus a first round pick swap (so if the pick of the other team is lower that that of the Nets they trade those picks) in 2021, 2023, 2025 and 2027.  The Cavaliers obtained Jarret Allen and Taurean Prince and gave away Milwaukee's umprotected first round pick in 2022 and Dante Exum.  The Pacers obtained Caris LeVert and a 2nd round pick in 2023 from Houston and gave away Victor Oladipo.  The Rockets obtained Victor Oladipo, Rodion Kurucs, Dante Exum, the Nets 3 umprotected first round picks, Milwaukee's 1st round pick (via Cleveland), the Nets 4 1st round pick swaps and gave away James Harden and a 2023 2nd round pick."
"Rockets get: Victor Oladipo + A shitload of picks  Nets get: James Harden + some picks  Cleveland gets: Jarett Allen, Taurean Prince + some picks  Pacers get: Caris Levert + some picks"
"He's been awful these last couple of weeks.  Can't believe I'm saying this, but possibly even worse than Taurean Prince."
"Theyre actually really tight.  They embraced before the game and he was just doing friendly trash talk in a game that was already decided.  This clip starts too late but lebron playfully yells 'cedi miss it!'  And then goes 'YEA thats my guy thats my guy' and then continues trash talking with his bench and then tells taurean prince to stfu.  If anything, this would boost cedis confidence that lebron would personalize his trash talk enough to call him 'his guy' in front of everyone on the court.   This and their workout in LA with kawhi and KD might be the highlight of cedi's career tbh."
Bro taurean prince was looking like kd out there
"KD is going to have to be their defensive anchor, as the only one that can probably do it.  They don't have anyone else to stick on the other teams best player.  DJ seems capable of manning the post, for maybe 30 minutes a game?  Other than that I'm not sure.  Harris was getting destroyed, Kyrie is okay when he tries, Harden has limitations but can usually at least hang in down low but looks slow until he gets in shape.  They could really use a Taurean Prince type dude, and can maybe find a buyout version later?  Offensively they can probably just keep passing to each other and all big 3 take 20-25 shots a game, but they need some kind of scheme on D.  Maybe work on a zone?  Whatever is easy and can cover up some deficiencies.  If they get to average-ish defense they'll have a chance."
"Of course, the Nets gave prime Sexton Jarrett Allen and Taurean Prince. Lakers are literally drawing dead against the Cavs"
TAUREAN PRINCE IS EVEN QUITE GOOD LOL
They could sure use a guy like Jarrett Allen or Taurean Prince
"You can actually (kinda) connect this trade as being a continuation of the Kyrie trade. It's not a perfect match but...  Kyrie was traded for IT, Jae Crowder, BKN's pick, etc.  Crowder + Shumpert + D-Rose (free agent pickup) were traded for George Hill &amp; Hood  George Hill was traded to Milwaukee for their first-round pick  Milwaukee's first-round pick was traded for Jarrett Allen &amp; Taurean Prince."
"And for the second game in a row, the combo of Taurean Prince and Jarrett Allen substantially outscored James Harden.  Wait, Harden started at power forward what the fuck?"
"They need to trade one of their Big 3 for solid role player defender types.   Just watching tonight guys like Taurean Prince and Jarret Allen would be perfect fits over there, as an example"
"Taurean Prince had way less touches and wasn’t as involved as he was tonight. Last game he wasn’t as envolves and nobody was commenting about not including him on a trade. Oh, and every year some asks how is Jeff Green playing for the minimum, which feels like the same comment as “why did they include Prince in the trade?” But both are usually answered pretty easily as the season progress."
Taurean Prince fits like a glove
We should trade Harden for some defensive pieces..is Jarrett Allen and Taurean Prince available?
Nets fans probably HATE Taurean Prince lmao
Taurean Prince is a vengeful motherfucker.  I love it.
"Free taurean ""rebounds"" prince"
Taurean Prince and Jarrett Allen are exactly the kind of players the Nets could really use right now.
"Can’t decide if that’s worse, or him calling Taurean Prince the wrong name for an entire game"
"Levert was redundant, he wasn't really good in the games Kyrie and KD both played. Guys like Bruce Brown, Shamet even TLC can replace those mins and while they are way worse players, the can fit better, and Levert shot creation isn't needed anymore (and really wasn't before the trade when everybody was there)  Taurean Prince is an absolutely terrible player  So really they lost Allen, and yeah that's a huge loss... but it's James Harden"
Wait is taurean prince the Baylor rebound guy
would’ve been a good time for a taurean prince answer
Yes with great defensive players like Taurean Prince and Jarrett Allen all things are possible
Yeah I was mad when we traded him but we weren’t going to get anything better for him and his contract was expiring. And we traded Exum for Jarrett Allen and Taurean Prince so I guess it worked out ok.
Jarrett Allen and Taurean Prince on the revenge tour
Fluke game. Taurean prince told the team the entire Nets playbook. Just watch they will lose to Minnesota or something.
Taurean Prince really gave it back.
"* James Harden: 6-14 shooting, 3-6 from 3, 21 points, 10 rebounds, no blocks, 2 steals, 5 turnovers, 5 fouls, -3 * Jarrett Allen and Taurean Prince: 11-19 shooting, 3-5 from 3, 27 points, 18 rebounds, 5 blocks, 2 steals, 4 turnovers, 1 foul, +26  Welp, Nets clearly lost that trade."
Then just take out Joe Harris put Brown on Sexton and let Kyrie guard Taurean Prince or Osman
"it has to be, idk how you score this many points in a second OT. and then Taurean prince with the revenge 3 at the very end lmao"
Getting Jarrett Allen (and Taurean Prince) for Dante Exum and a Bucks 1st was absolute fucking robbery by the Cavs.
Taurean Prince and Jarrett Allen getting payback already lol
i want taurean prince to sink it
every now and then i have to remind myself taurean prince isn't demarre carroll - both played for atlanta and brooklyn too
Prince Taurean &gt; King James  At least as far as Cleveland legends go
ah yes who could forget that epic duel between KD and Taurean Prince...
I can't believe that the Cavs managed to get rid of Exum and got the Fro and Taurean Prince back
2021 NBA MVP Taurean Prince
"Taurean Prince, the Nets killer?!"
Taurean Prince getting his revenge!
Lol taurean prince
Taurean Prince making Kevin Durant shots lmaooooo
Taurean prince revenge game
one of those occasions you have to remember where you were when you were watching the Taurean Prince revenge game.
Taurean prince revenge game
Taurean Prince revenge game
Nets fans    🤝   Cavs fans  🤝 Hawks fans:  What is Taurean Prince doing????
can taurean prince do a single thing right today?
I had assumed Jarrett Allen was the cost for dumping Taurean Prince and his deal basically.
Taurean Prince is a 5 year NBA vet. KPJ has one year under his belt. Likely that's all there was to it.
Is that normal? Having a hierarchy based on your lockers seems terrible for team chemistry.  His reaction was definitely overblown but I understand being pissed about having my locker moved just because some other bench player joined the team.  If it's LeBron or a different superstar I would understand but Taurean Prince?
Montrezl/Demarre/Taurean Prince/Predator
"&gt; Porter, 20, who has not played this season due to personal issues, grew angry when he entered the locker room and realized the team gave his old locker to Taurean Prince, who was acquired in a blockbuster trade Wednesday.  He's gone. Unfortunately, nobody is worried about you."
"Taurean **Prince**, hence the royalty comment"
"&gt;Originally reported by The Athletic this morning, Porter's locker was given to newcomer Taurean Prince and his new locker was near the lounge area with the reserves. The report indicates that Porter started shouting and at one point threw food (though the source told BasketballNews.com that this was relatively minor). However, the confrontation between Porter and general manager Koby Altman was very heated.    * Whoa, non-sensationalized news reports  &gt;The argument kept escalating and Porter was heard yelling about ""modern-day slavery."" Porter had grown frustrated recently because the team had been holding him out. He has yet to play in a game this season.  &gt;""He snapped on Koby, and Koby snapped back,"" the source told BasketballNews.com. ""Ultimately, I think Koby being unable to calm him was the last straw that broke the camel's back.""   * This is meme material lol"
"I mean, I would be kind of upset too if my locker was moved just because we got Taurean Prince. But you don't throw food at people."
"I'm not defending KPJ's behavior, but yes its a locker, so there's no reason why they should have moved him for fucking Taurean Prince (at least without telling him first)  It's like a weird, passive aggressive message."
"He felt disrespected from the CAVS, because he can dribble and put the ball in the bucket better than Taurean Prince in Kevin Porter Jr mind. Looks like he can't handle this situation as a mature adult, and he is finding out he is not that valuable to the CAVS."
"""Porter, 20, who has not played this season due to personal issues, grew angry when he entered the locker room and realized the team gave his old locker to Taurean Prince, who was acquired in a blockbuster trade Wednesday.""  I'm not saying Porter Jr.'s reaction was warranted, but moving his locker without telling him is really poor management. Him being angry is warranted."
"""Porter, 20, who has not played this season due to personal issues, grew angry when he entered the locker room and realized the team gave his old locker to Taurean Prince, who was acquired in a blockbuster trade Wednesday.""  His reaction was over kill, but that's really poor management on behalf of the Cavs to just move his locker without talking to him. For those of you that worked in an office, how would you feel if you just came in one day an your boss had moved your cubicle to a new floor and didn't say anything?"
"I challenge, Prince Taurean, for the right to hold, this locker!  Don't worry, he wasn't going to kill him, but he was going to throw some food."
not to defend him here because that's obviously insane but why did they move his locker? for taurean prince of all people? like I get doing it for durant or kawhi or something
"Here yall go:  &gt;CLEVELAND — Cavaliers guard Kevin Porter Jr. is expected to be traded or released following an outburst Friday in the Cavs locker room, The Athletic has learned from several sources with direct knowledge of the events.  &gt;Porter, 20, who has not played this season due to personal issues, grew angry when he entered the locker room and realized the team gave his old locker to Taurean Prince, who was acquired in a blockbuster trade Wednesday.  &gt;Sources said Porter, whose locker was moved to the wall where the younger, end-of-bench players reside, began yelling and at one point threw food.  &gt;Sources said general manager Koby Altman came into the locker room and confronted Porter, and the player remained combative with his boss. The Cavs spent the weekend trying to trade him.  &gt;Coach J.B. Bickerstaff heard the commotion in the locker room from his office and came in, shocked and disgusted by what he heard.  &gt;Porter was involved in a one-car accident in November. He was arrested and charged with improper handling of a firearm in a motor vehicle, failure to control the vehicle and misdemeanor possession of marijuana. All of those charges were dismissed. He was considered to be the most promising of Cleveland’s young players after last season. The Cavs were helping him get his life together before putting him back on the court.  &gt;Porter averaged 10 points and 3.2 rebounds as a rookie last year in 23.2 minutes per game. He shot 44.2 percent from the field and 33.5 percent from 3."
"We’ll take him on if you attach Jarrett Allen and ~~Taurean Prince.~~ Actually, just Jarrett Allen."
According to the article he basically got super pissed and starting yelling and throwing food when he found out they gave his old locker to Taurean Prince and he had to move to a new locker.
"You really think that this sub believes that perennial MVP candidate James Harden, who's led the NBA in 3 pointers for three consecutive seasons, is a league average shooter?  Like, if you posted ""Who's a better shooter- James Harden or Taurean Prince"", do you really think the responses will be split 50/50?"
"No one is guarding Embiid, Giannis or AD.  Jarrett Allen wasn't.  Taurean Prince wasn't.  Jeff Green at the 5 gives the Nets the most switchable lineup.  There is going to mismatch no matter what, but determinations have to be made.  I'm sure the Nets would rather have AD than Harden or Kyrie but they can't get him.    BTW I like Bam, but offensively he is not in the same conversation as the other three."
Taurean Prince isn't on the Nets anymore
I’m not sure who KD guards. Harden is a good defender as well though. I think Taurean Prince or Jeff Green would get assigned to AD or Lebron.
Jarret Allen didn't just fetch Mil's first round pick in 2022. It was Jarret and Taurean Prince for Exum and the pick. Taurean is a bad contract and still has two years remaining; it would have probably taken a late first round pick just to dump his contract.   The trade gives Rockets salary flexibility for summer. They can use the cap space to sign a promising young player in the offseason (similar to Christian Wood). Talen Horton-Tucker could be a good target.
Cleveland Cavalier Taurean Prince?
"Fuck it I’ll throw them Coby, Otto, Wendell and picks for Kyrie and Taurean Prince"
Did the Spurs reporter just say Tayshaun Prince is going to Cleveland instead of Taurean Prince? Lol
Nets basically gave up Jarrett Allen.  Harden replaces Levert. Kurucs was a benchwarmer. Taurean Prince is absolute garbage.   Allen is a huge loss and I'm sad to see him go. But we didn't destroy our depth.
What does finalized mean though?  Taurean Prince and Jarrett Allen were at last night's game on the Cavaliers bench in Cavaliers warm-ups.   James Harden already had his introductory press conference and the Nets are using him in marketing material.   How would any of that be legal if the trade was not approved by the league office?
"Whole bench? lol I love LeVert, but Harden is a huge upgrade. Taurean Prince was super inconsistent and Rodi was basically our 15th man. JA is the only real loss (it’s a big loss). But they’ve got 3 open roster spots to fill and the MLE &amp; DPE and the buyout market to use to try and fix their defensive issues. I’m sure they’ll be able to attract some serviceable vets to fill out the bench."
Taurean Prince is now on Reddit
"dude I totally feel that, my favorite dudes in the league are jakarr sampson, bobby portis, and taurean prince. I think rooting for the guy who no one expects to be great is a lot of fun. moments like rodney hood coming in for portland in 4ot to save the game vs the nuggets are the moments I live to watch as a fan"
"Getting Jarrett Allen for a (most likely) late first round pick that wasn't even their own is really good.   They did have to take on Taurean Prince, but he only has one year left on his contract. He's overpaid but it's not anything crazy."
"I've seen a lot of people either misunderstanding what we gave up or blatantly over-exaggerating it.  I've seen people say we gave up 8 first round picks. No, we didn't. Hell we didn't even give up 4 picks. We gave up 3. The other first round pick is coming from Cleveland. We also gave 4 swaps, which aren't the same thing as picks. For some reason a lot of people have trouble understanding this. We still have picks in the years of those swaps, we simply have the worst pick out of ours and Houston's  In total it was: 3 first round picks, 4 swaps, Caris LeVert, Jarrett Allen, Taurean Prince, and Rodions Kurucs for James Harden and a second round pick. In no conceivable way did we get fleeced"
"You forgot about the FRP coming from the Cavs (that they got from the Bucks) and the 4 pick swaps. All unprotected.  The starter they gave up, Jarrett Allen, was pretty important for them considering how atrocious their defense is. I'm assuming LeVert is the 6th man. They also gave up Kurucs and Taurean Prince."
"Rows of tall, bushy-topped trees flank the procession, among them a prized chestnut Ok. There is a turkey running around, frightening the children. An enormous Drum plays consistently in double-double time.   The king and queen of SexLand, Darius and Collin stride down the central promenade at a brisk pace. A Porter and a well-regarded Yogi smile and nod in approval to the side. They are not involved today but wanted to be in attendance. Behind the royal couple walks the handsome Prince, Taurean, and the lovely princess Nance, named after her mother.  It's a happy day for the royal family, but from the shadows watches the princess's disgraced Ex, um ... Dante was his name. He was the old candlestick Maker. If only he could break the ankles of her new beau, the Bold Son of the king's adviser from a land down under. He plots his revenge for six or seven weeks from now, or not at all.  Love is rarely ever in the air, but today, one might say it is."
Taurean Prince is meh because of his contract.
"DeMarre Carroll (the Nets version of him, not even the peak Hawks version) is way better than Taurean Prince lol  Find it weird how it seems non-Nets fans think that Prince is pretty good or at least respectable. He's just bad though. Idk where the misconception comes from."
"Did we really?  If we took on Prince and Allen, we wouldnt be able to pay Allen, wothout going into the tax for a non contending team  We basically paid an Expiring Allen and dumping Taurean Prince for a late FRP  All in all not terrible if we couldnt pay him either way, and hes going to get a bag, have u looked at next years FA?  The Oladipo deal is a question mark, my guess is we want to compete this year and still be able to tank the next"
They sent the 17th pick and Allen Crabbe to Atlanta for Taurean Prince + 2nd. Then Griffin declined Atlanta's 10th pick for various other things including 17.
Cavs somehow turned Dante Exum into Jarrett Allen and Taurean Prince. Gotta give it to them.
Also Taurean Prince!
"We’re getting more dudes with big boy appetites, he may have to bring extra  I’m so hyped for this though, from a basketball standpoint. In a vacuum we gave up Dante Exum, a bench player who never stuck and that we didn’t need, and a first round pick for *Jarrett Allen* and Taurean Prince. It’ll be a lot of sharing the paint, but good luck getting to the rim on us"
"Not really , Allen essentially offers the same rebounding skills with better rim protection and comes at a lower price tag . Drummond is a free agent after this year and will want a max deal. Cleveland won’t give him that (Drummond does not fit with what the NBA has turned into - it’s a shooters league).   Cavs just turned Dante Exum into Allen ( one of the best young centers in the league) and Taurean Prince who’s a decent bench player. They can move Drummond now for draft capital or other young pieces to go along side the core group of Sexton, Garland, Allen , and Porter Jr. (if he ever comes back).   This was a great move by Cleveland"
"""The Rockets will receive four first-round picks and four-pick swaps, all unprotected. Those picks will come from Brooklyn in 2022, 2024 and 2026 along with Milwaukee in 2022 (previously owned by Cleveland), and the swaps will come from Brooklyn in 2021, 2023, 2025 and 2027. They will also receive Rodions Kurucs and Dante Exum. Additionally, Caris LeVert will be sent to the Indiana Pacers, who will send Victor Oladipo to the Rockets. Jarrett Allen and Taurean Prince will go to Cleveland in the deal.""  https://www-cbssports-com.cdn.ampproject.org/v/s/www.cbssports.com/nba/news/james-harden-trade-rockets-send-all-star-to-nets-in-four-team-deal-involving-cavaliers-and-pacers-per-report/amp/?amp_js_v=a6&amp;amp_gsa=1&amp;usqp=mq331AQHKAFQArABIA%3D%3D#aoh=16105754565273&amp;referrer=https%3A%2F%2Fwww.google.com&amp;amp_tf=From%20%251%24s&amp;ampshare=https%3A%2F%2Fwww.cbssports.com%2Fnba%2Fnews%2Fjames-harden-trade-rockets-send-all-star-to-nets-in-four-team-deal-involving-cavaliers-and-pacers-per-report%2F  Who lost the most in this deal will be telling as the season goes forward."
"Trade him for Jarrett Allen, Rodion Kurucs, Caris Levert, and Taurean Prince. Get a haul of picks, reinvigorate the defense with some youth."
"The Nets sent Houston a package that includes multiple players and draft picks and features guard Caris LeVert, who was then traded to the Pacers for Victor Oladipo, sources tell ESPN.  Center Jarrett Allen and forward Taurean Prince are headed from the Nets to the Cavs in the deal, according to sources, while the Rockets receive Cleveland guard Dante Exum and Brooklyn forward Rodions Kurucs  Houston also receives Brooklyn's three unprotected first-round draft picks -- 2022, 2024 and 2026 -- in the deal, plus pick swaps in 2021, 2023, 2025 and 2027, according to sources. The Rockets also get Cleveland's 2022 first-round pick, via the Milwaukee Bucks.  Wow"
"Hahaha wtf, going to the Cavs is having your life ruined???  Fuck you too!!  The Cavs would be a good team to play for in my opinion.  There’s no clear #1 star so Allen, Sexton, Garland, Nance can all figure this out together.  All of these players have shown clear development recently, they’re on the right trajectory.  Taurean Prince gets a chance for more shots.  It’s really not bad."
So the Cavs really gave up the perpetually injured Dante Exum and a late first for Jarrett Allen and Taurean Prince? Completely fleeced em
"I'm not sure if this is complete, but from what I gather:  To Brooklyn:  * James Harden (obviously)  To Houston:  * Dante Exum * Victor Oladipo * Rodions Kurucs for some reason * Two 2022 firsts, a 2024 first and a 2026 first  To Cleveland:  * Jarrett Allen * Taurean Prince  To Indy:  * Caris LeVert"
"Via @ShamsCharania on Twitter  ""Sources: Full current trade:  Rockets: Victor Oladipo, Dante Exum, Rodions Kurucs, 3 BKN first-rounders (22, 24, 26), 1 MIL first (22, unprotected), 4 BKN 1st round swaps (21, 23, 25, 27)   Nets: James Harden  Pacers: Caris LeVert, 2nd-rounder  Cavs: Jarrett Allen, Taurean Prince"""
aw man just when I was starting to dig the vibe in Brooklyn. now they DON'T have Jarrett Allen and Taurean Prince and they HAVE Harden. oh well. Going back to my Wiz kidz.
Hey at least you gave Taurean Prince his locker to teach him a lesson. I'm sure he'll never forget.
They really got Jarrett Allen and Taurean prince for Dante Exum. Unbelievable
"So the Cavs took on Taurean Prince’s deal which expires next year, thats why they got Allen and sent the Rockets a pick.  Thing is Prince is really not a bad contract.  Its another year around 13M.  They could had dealt one of their picks for someone to take on his deal if they didnt want it.  So IMO they essentially opted for 4 picks, 4 swaps and Olapido   vs 2 picks, Jarrett Allen, 4 swaps and Olapido   or vs 3 picks, Allen, 4 swaps, Olapido and paying Prince for 1.5 seasons."
"The Cavs picked up Allen and Taurean Prince for the corpse of Dante Exum and Milwaukee’s 2022 1st. Neither of those are assets I’d lose any sleep over wasting. Obviously I hope we keep Allen around, he’s a great young player, but I think he’s limited enough as a player that he’s not gonna get the max.   He’s a good defender, rebounder, and rim protector, but he’s skinny enough to get bullied by larger 5’s and not quite quick enough on the perimeter to be comfortable switching. Offensively he can catch lobs and sometimes hit an open midrange jumper, but he’s extremely limited on that end. If he can add some muscle and mass for screens and the low block, he could have a broke man’s Gobert kind of impact, but he’s not nearly there yet."
"That’s pretty much all of them. Most stretch four/fives are on contenders who likely wouldn’t give them up. Taurean Prince and Harrison Barnes are two other ones, but both have large contracts and I doubt the Kings want to move Barnes."
Them Nene and Taurean Prince are the same dude.
I've messed with Clarkson since before college. Then again I'm from San Antonio so him and Taurean Prince were on everyone's radar around there.
I think he’s joking. He’s probably making a joke that Singler looks like Taurean Prince
"Thank you, Taurean Prince"
the Cavs are gonna sweep the shit out of us on the way to the finals and Taurean Prince is gonna be crowned FMVP to spite us
Taurean Prince explains it best   https://youtu.be/atr60tR7Emo
Fucking Taurean Prince
