"I mean KPJ very clearly has raw talent, but the off-court issues have pretty much zapped his value as an asset.      Keep in mind, a lot of people had him as a top 5 talent in his draft class but he slipped all the way to 30 because of the off court stuff/suspension at USC.      Then he had the weapons charge/car accident and the Taurean Prince outburst in Cleveland and was traded for a heavily protected 2nd rounder. There was even rumors he was going to be cut entirely.      As talented as he is, he's still a major risk. I doubt teams value him more than like a mid 20's pick."
Taurean Prince got the answer
"I mean if you want to bank on those unprotected picks turning into lotteries, I got a bridge I'd like to sell you. Nets under Sean Marks never tanked and made playoffs with D'Lo as their best player. To think that any of those picks would convey top 10 is fool's gold. Ben's trade value was way higher last year than it is now. Minny or Denver would've given up valuable assets for him at the time. Just because you acquire Ben doesn't mean you have to keep him and worry that you're gonna make the playoffs, you could flip him immediately and continue sucking for the foreseeable future.   &gt; Not acquiring Ben Simmons and bottoming out into the worst record in the league maximized getting a top pick and Cleveland did us a favor after routing them jarrett allen in harden trade.  &gt; Not to mention that KPJ never gets kicked off the team this year without the locker room incident which happened from... taurean prince entering cleveland as part of the harden trade.  &gt; Do you not see how everything is holistic and affects each other? Do you think we getting get the no 2 pick, getting kpj, developing kpj at point and him going 50 11 in a game, was compatible with us acquiring simmons this year?  Not gonna bother even arguing with this level of copium. The mental gymnastics some Rockets fans do to justify that trade lol"
"As recently suggested in the Cavs sub… Collin Sexton, Kevin Love and Taurean Prince to the Knicks for RJ Barrett, Immanual Quickley, Obi Toppin, Kevin Knox, and picks 19, 21, 32, 58 lmao."
Finch is a good coach.    All of the terrible contracts are gone.  You can argue DLos contract is terrible.  That's what it is.  He picked up McDaniels and Naz Reid.  Nowell and Mclaughlin in the second as well if you care about young bench depth.    Gorgui and Teague money is now Beasley and Taurean Prince.  Watching KAT get doubled on the break and tripled in the post only to kick out to a sub-30 percent shooter sucked.  That was the situation that Rosas inherited.
"&gt;Sure ""anybody"" might be able to beat the Wolves offer, but how many are willing.   Multiple teams, including a majority of the ones I named would be willing. I promise you if the best offer Philly gets is that dog shit Minnesota one centered around Beasley and Prince MULTIPLE teams will swoop right in and take Simmons.   &gt;To trade, you need at least two interested and willing partners.    And please explain to me why Philly would want Malik Beasley and Taurean Prince when there are CLEALY better offers out there????  &gt;Right now, it looks like Minnesota and two others and none of the offers out there are better than the Wolves offer.  False. I don’t understand why you Minnesota fans think your offer is so good. You’re setting yourselves up to be inevitably disappointed when Simmons is traded else where after Morey laughs at that offer.   &gt;So sure, sit on Simmons, deflate his value even more   Declining to take a horrible trade package isn’t deflating someone’s value."
"If there is a trade, the package would most likely be something like  Ben Simmons to Timberwolves  Malik Beasley, Jaden McDaniels, and either Patrick Beverley or Taurean Prince, and 2-3 first round picks (with some initial protections) to Sixers  Salaries match. No way Sixers do this unless they are desperate. I don’t think Sixers are that desperate. I think they are actually hopeful to give Maxes/Thybulle/Reed some of Simmons playing time to see how they do, even if he sits out."
"Trade Machines tell me that it's possible if Houston gets a contract dump of a bunch of players - Malik Beasley, Taurean Prince, Danny Green, Shake Milton, Naz Reid, Paul Reed and Isaiah Joe would work, with two or three first round picks as sweetener.   So many players means that a 4th team might be needed (OKC or Memphis or San Antonio?).  Basically:   Philadelphia: John Wall and Jaden McDaniels, some 2nd rounders?  Minessota: Ben Simmons, some 2nd rounders?   Houston: Malik Beasley, Taurean Prince, Danny Green, Shake Milton, Naz Reid, Paul Reed and Isaiah Joe + 2 first round picks.  http://www.espn.com/nba/tradeMachine"
Taurean Prince trade I think
"The whole Morey connection has me thinking though. PatBev would make sense for the Sixers. But then if you’re Minnesota why do this whole press conference? If you’re not trading him or KAT/DLo/Ant then how are you getting the salaries to match for Simmons? Malik Beasley and Taurean Prince gets it done in that sense, but then you’d have to include every pick in your arsenal for it to work value-wise. At that point Philly would probably prefer a third team getting involved to take that junk + picks deal and send a star their way, but nobody they want seems to be available. I’m sick of replaying the possibilities in my head lol just gimme a damn Sham slam or Woj bomb already."
"If the Wolves don't find a third team I think salary + 3 first round picks would be the best deal for both parties.  3 picks is a lot, but Simmons fits the Wolves like a glove but with him they would have their best team in decades.  Morey won't be getting an all star for Simmons anyway so I think his best option is to get assets and try to trade for a star next season, and hope that someone good is available.  So it would be something like  Simmons for 2 of Beverley, Taurean Prince and Beasley and 3 picks"
"**What realistically do Timberwolves end up giving away for Simmons if anything?**  &gt;We’ve reported that Edwards and Towns are off the table. I also believe Rosas wants to keep Russell, and there are questions about whether Philly would be interested in a Russell-centered package in the first place. What is important to remember is that these are negotiations. Morey might be saying he needs Edwards or there’s no deal right now. Maybe Rosas is saying, “I’m not trading you KAT, Ant, Russell or McDaniels.” That’s how these positions are staked early. Remember above with Thibs asking for Embiid and Simmons for Butler.  &gt;Those things can change over time. As high as the Wolves, and fans, are on McDaniels, he is one of the team’s most attractive players. If you want to land a star, you’ve got to spend money to make money. Beasley would seem to be a great fit with Embiid as a floor-spacer. Beverley’s defense and his playoff experience could be attractive, in addition to the money on his deal to help make it work. Taurean Prince could be used on that front as well.  &gt;The most viable scenario for the Wolves making a deal work is to find a third team to direct more of what Morey wants to Philadelphia. And that is where the draft pick compensation comes in. An unprotected Timberwolves first-rounder carries a heck of a lot more weight than, say, one from San Antonio. That is true for Philly, who could use those picks to try to pry a real star away from a playoff team that shifts into rebuild or for another team that is looking for a reason to jump in and facilitate the deal.  &gt;Will any of that blow Philly away? No. It doesn’t seem like there is a “Harden-like” package out there for Simmons. So the Wolves’ best hope is that the market remains cool, the temperature in Philly gets hotter and their offers look better over time.  &gt;Getting a third team involved is a very complex and delicate process. That’s why all of the discussion revolving around Simmons to Minnesota has to be colored with that context. Finding a third partner, or finding a way to make a straight-up trade with Philly will be exceedingly difficult. But the Wolves are motivated, just as they were with Russell and Golden State. That’s why it can’t be ignored or dismissed.  He also added earlier this;  &gt;Maybe the Blazers do ante up with a C.J. McCollum-led package. Maybe San Antonio or Toronto make a run. But if the market stays dry, that gives the Wolves a chance. And a couple of unprotected Timberwolves picks, while not helping Morey immediately, could be a nice carrot to dangle for a stepping-stone move that would give Morey a bigger treasure chest of assets to deploy should Lillard or Beal eventually ask for a trade.  I don't want to spoil anymore of the article so go and read it for yourself and give Jon some love!"
"from bbref:   December 23, 2019: Traded by the Utah Jazz with a 2022 2nd round draft pick and a 2023 2nd round draft pick to the Cleveland Cavaliers for Jordan Clarkson. (2022 second-round pick is owned by SAS) (2023 second-round pick is owned by GSW)  January 13, 2021: As part of a 4-team trade, traded by the Cleveland Cavaliers with a 2022 1st round draft pick to the Houston Rockets; the Brooklyn Nets traded Jarrett Allen and Taurean Prince to the Cleveland Cavaliers; the Brooklyn Nets traded Rodions Kurucs, a 2021 1st round draft pick (Cade Cunningham was later selected), a 2022 1st round draft pick, a 2023 1st round draft pick, a 2024 1st round draft pick, a 2025 1st round draft pick, a 2026 1st round draft pick and a 2027 1st round draft pick to the Houston Rockets; the Brooklyn Nets traded Caris Levert to the Indiana Pacers; the Cleveland Cavaliers traded a 2024 2nd round draft pick to the Brooklyn Nets; the Houston Rockets traded James Harden to the Brooklyn Nets; the Houston Rockets traded a 2023 2nd round draft pick to the Indiana Pacers; and the Indiana Pacers traded Victor Oladipo to the Houston Rockets. 2024 2nd-rd pick is CLE own Houston has the option to swap 1st round draft picks with Brooklyn in 2021. Pick not swapped. Houston has the option to swap 1st round draft picks with Brooklyn in 2023 Houston has the option to swap 1st round draft picks with Brooklyn in 2025 Houston has the option to swap 1st round draft picks with Brooklyn in 2027 2022 1st-rd draft pick is MIL own 2023 2nd-rd pick is HOU own  ----  He was injured but part of the Harden trade"
"Bruh... Kenneth Faried, Trezz, Jae Crowder, Taurean Prince, DeMarre Carroll  are they gonna be the most intimidating line up?"
And taurean prince
"For me used to be DeMarre Carrol. Remember back in days when I did a bit of scouting reports for prospect and any time end up watching a mediocre 3&amp;D that will end up in the 1st round but which nobody expect to play the star role on a team ever, I always labelled him like ""DeMarre Carroll like"".  In those days DeMarre became also an important piece of the Hawks and for some years was really good 3&amp;D, courios that almost nobody lived that Carrol hype 😅 except for Taurean Prince that now us my kind of Carroll. Good player but for sure replaceable."
Allen being traded had nothing to do with DJ and everything to do with harden and taurean prince. Nets had nobody else to trade who would’ve made Cleveland willing to part with the 1st the rockets needed while also absorbing prince’s bad contract
"“Report: 76ers have traded Ben Simmons for Malik Beasley, Taurean Prince, and 2025 2nd round pick”  Yeah I’m calling bullshit on that one.  *wins 2021 Championship*  Ehh, idk, highly debatable"
"Yep. My guess is V8 and perhaps McLaughlin are waiting to sign because we're still trying to position ourselves for a Ben Simmons trade, which won't happen until the end of the month at the earliest (if Taurean Prince is involved) or just before season tip-off (if Beverley is involved). So he should hopefully re-sign within 1 month or so, which is still quite late.   He has been involved with the team a fair amount this offseason, for example going to Summer League with the team, so I think there's almost no chance he gets poached at this point. If he did, it would've happened earlier because a team would've made him a great offer, maybe similar to the DJJ offer from Portland last year."
"Trying to think, is that better than Pat Bev, Malik Beasley, Taurean Prince and 3 1sts?"
"The most realistic to me for the Wolves requires a 3rd team. I think the Wizards makes sense, with it going:  Simmons to Minnesota  Beal to Philadelphia  Patrick Beverly (sorry for the 1000000th trade), Taurean Prince, Jaden McDaniels, and two 1sts to Washington.   I could also see Washington getting a 1st out of Philly to get it done. Beverly and Prince are expiring contracts so they get cap flexibility going forward.  McDaniels looks like he could develop into a very good player, probably not an all star, but one of those guys that you love starting for you under a cheap contract for 3 years. They also get 2 or 3 extra firsts, and Minnesota firsts hit different.   I'd be interested to get the perspective of a Wizards fan because from the outside your team looks like a prime candidate to blow it up and see what can happen in a few years."
Malik Beasley  Taurean Prince  Naz Reid  2022 2nd round pick (via Washington)   Unprotected 2023 FRP  2024 1st round pick swap  Top 5 protected 2025 FRP  Top 5 protected 2027 FRP
"I’m betting on San Antonio.   I think it’ll eventually come down to CJ or a package of rotational players and picks. I think Philly will opt for the package of players to try and recoup possible future assets for a bigger trade. When it gets to that point the 3 teams I see bidding against each other are Minnesota, Sacramento, and San Antonio.   When comparing deals for these teams I’m going to assume a few guys are just off limits so those being De’Aaron Fox, Tyrese Haliburton, Karl-Anthony Towns, D’Angelo Russell, Anthony Edwards, and Dejounte Murray.   To keep everything fair for hypothetical reasons I’ll say each team trades a unprotected pick, protected pick and a swap along a starter level player, rotational player, and a player on a rookie deal. So deals of something like;  Malik Beasley, Jaden McDaniels, Taurean Prince, 2022 top 5 1st, 2024 pick, 2025 swap   Derrick White, Devin Vassell, Thaddeus Young, 2022 top 5 1st, 2024 1st, 2025 swap   Buddy Hield, Davion Mitchell, Marvin Bagley?, 2022 top 5 1st, 2024 1st, 2025 swap.  Looking at it like this I would instantly rule out Minnesota. I think they have the worst collection of players here (outside of McDaniels I’d probably take him over Mitchell and Vassell but it’s not a large gap at all) and when it comes to future value of those picks I think they’d be a playoff team and those picks would project to be late teens to mid 20 picks. Along side that Minnesota virtually has nothing of value to add to compete against other offers other than picks, and their whole team is just consisted of 4 players.   That leaves it between Sacramento and San Antonio. To me both teams add something of value to Philly SAS gives them a Swiss Army knife half court ball handler, SAC gives them a high level floor spacer, and to me Mitchell and Vassell are equal in value and have similar skillsets despite playing different positions. I think the main swing factor here is if Sacramento throws in Harrison Barnes or not. If Harrison banes is replaced with Bagley I’ll go Sacramento without a doubt, but if not I don’t see what other quality rotational or player with value sac can really add to entice Morey (I wouldn’t take Bagley or TT over Thaddeus Young). Unlike Minnesota I think despite adding Simmons both teams could still realistically miss the playoffs which makes those draft picks more valuable, and I think both teams can take the depth hit when trading Quantity for Quality. I think even more so San Antonio can with how many players they have still on rookie deals, and if needed to they could probably throw in even more players like Walker IV or more picks like the bulls one they just got.   Did I just damn near write an essay on Ben Simmons trade destinations? Yes. Is it flawed? Probably am I bored? Also yes"
"They could have come for the culture, but are you really teeling me you wouldn't trade Jarett Allen, Caris LeVert and Taurean Prince for a chance to sign James Fucking Harden?  Even Jarett Allen said he would trade himself because the chance of trading for a superstar like Harden is so slim.   Now ofc they asked KD &amp; Kyrie their opinion, but what are they supposed to do?  Tell them ""Oh sorry we don't want to play with Harden""?"
"Damn sixers about to end up with Malik Beasley, Taurean Prince, Jaden McDaniels and like 3 firsts"
"Really? Nets gave up Jarrett Allen, Levert, Taurean Prince, Kurucs, 3 firsts, and 4 first swaps for Harden.  Even if minny matches those picks, Allen and Levert are way better than any player in this package"
Fair 😂  Until you guys swooped in for Nance the Wolves and Blazers were fighting for most uninspiring offseason. At least you've got *something* to point to this offseason to be encouraged by now.   If the Wolves don't get Simmons their biggest acquisition is a fight between Patrick Beverley or Taurean Prince.
"&gt; Detroit: Jaden Mcdaniels, Taurean Prince, Danny Green  Bruh"
Key dates if yoi think its a Minnesota deal:  Sep 12th Taurean Prince can be traded and Oct 1st Pat Beverley can be traded
Who is their best wing defender? Taurean Prince? That seems problematic in terms of roster construction.
"I actually do think Blazers take Malik Beasley, Taurean Prince, 2 1sts for CJ McCollum, CJ's overpaid because he's forced to take a reduced role and they paid him for his talent level, which is greater than his role. Malik does 80% of CJ at 50% of the cost, for two more years then a team option, off ball. Taurean Prince is a feasibly switchable rotation player who gives you mildly efficient but not super productive play on both sides of the ball.   If you throw Naz Reid into the mix then you have a super young but productive backup big who is on a &lt;1st Round contract."
I'm not treating him as anything significant here. Make it the expiring Taurean Prince instead of Beasley for all I care. the only serious value here are the picks.
"Minnesota: Simmons Philadelphia: Damian Lillard Portland: 2022 FRP Minnesota, 2023 FRP Philadelphia, 2024 FRP Minnesota, 2025 FRP Philadelphia, Malik Beasley, Taurean Prince, and Tyrese Maxey to Portland"
"His trade value remains the same.  The same teams have reported being interested and there hasn't been reports on the price changing.  I know this sub exists in it's own reality, but Simmons publicly asking out does not mean he is now only worth a Taurean Prince and a 2nd"
"I think the Wolves gotta give up Ant Edwards if they want to get this done.  Simmons + Maxey for Edwards + decent players as salary filler (Taurean Prince &amp; Pat Beverly) works salary-wise, and I think it’s fair for both teams.  Thoughts? Minny giving up Edwards means they get Maxey back, and can hold onto McDaniels/all their picks   I have Ant as a better asset at the moment over Simmons. Would suck to lose him, but Ben might fit the timeline better and help you become a playoff team quicker."
"&gt;Some combination of Malik Beasley, Jaden McDaniels, Naz Ried, multiple big expiring contracts (Taurean Prince or Patrick Beverley), and/or multiple future 1sts.  LOL"
"Some combination of Malik Beasley, Jaden McDaniels, Naz Ried, multiple big expiring contracts (Taurean Prince or Patrick Beverley), and/or multiple future 1sts."
"Sure. Cleveland wants to be competitive and actually make the play in / playoffs this upcoming year. People want to slide in Mobley as a starter from day 1 but forcing him to guard starting PFs doesn’t really make sense if you’re trying to win now. There will be plenty of backup Center minutes for him behind Allen. They traded Taurean Prince (who was a PF for them) for a guard in Rubio. They traded Nance (a PF) for another PF. If Love isn’t in the plans, who are the PF/Cs on the team that are going to get minutes? Isn’t it just the 3 guys I mentioned (Lauri/Allen/Mobley)?"
"Taurean Prince - San Angelo, Texas before he moved to San Antonio to live with his mom"
But then what can you offer the 3rd team to make them give a great piece? It’s not like teams are knocking down the door for Malik Beasley or Taurean Prince. Best I can see is maybe Hield and the Kings won’t help the Wolves get Simmons.
"Jae Crowder, Taurean Prince, Demarre Carroll"
"Taurean Prince, it's in the title..."
"they opened up a shitload of cap in 2019 and got Kyrie and KD (and deandre jordan who hitched a ride onto his talented friends). they had bird rights on Joe Harris and Brown. blake wants a free ring and signed for minimum wage. patty wants a free ring and signed for the MLE which every single team gets. they traded levert, allen, taurean prince, and 3 first rounders with 4 swaps for harden. their tax bill will be 200+ million soon but the owner can afford it"
"&gt; Blazers get: (from Minny) Malik Beasley, Taurean Prince, LeAndro Bolmaro   LMAO."
Ricky Rubio and a second got traded for Taurean Prince. You're right.
"When they play us, Taurean Prince can give him a lesson."
Had Taurean Prince playing Twister
“The guy” from Baylor was Taurean Prince actually. Don’t know about the dude from Wisconsin though
"The Wolves top 3 players (KAT, D-Lo, Ant) are better than the Kings top 3 players (Fox, Barnes, Haliburton).   The Kings have better back-end starters. Holmes, Hield, and Mitchell are better than McDaniels, Beasley, and Naz Reid.   The Wolves bench has Taurean Prince, Patrick Beverley, Jarred Vanderbilt, Josh Okogie, Jake Layman, and Leandro Bolmaro.   The Kings bench has Tristan Thompson, Marvin Bagley, Mo Harkless, Terence Davis, Jahmi'us Ramsey, and Neemias Queta.   The Wolves have the better bench.   The Wolves head coach is Chris Finch. The Kings head coach is Luke Walton.   The Wolves have the better head coach.   Based on this, the Wolves are more likely to be successful this season."
"Ask Taurean Prince, I think he knows a word for that"
"Now that Taurean Prince is not on the Nets, he needs to take the role of making snarky answers to reporters."
"A bunch. Played against KAT a few times back in the day, him and his family were great. He played alongside Wade Baldwin, who actually got ejected when we played him and we thought was pretty overrated but we ended up reconnecting a few years later and laughed about the whole thing.  Worked at a hotel that hosted the NBA Rookie Symposium in 2016. Served Ben Simmons, he very much kept to himself and didn’t socialize like everyone else. Buddy Hield gave me a free speaker, shirt, bags, etc. because “man we got money we don’t need this” was super appreciative. Jamal Murray was my guy too, super nice. Did not like Taurean Prince because he was offended I didn’t know who he was and was kind of a dick (to be fair, I knew most of them, but like dude you’re Taurean Prince).  Went to college with Kevin Huerter, wasn’t super close but he used to hookup with my friend and we talked a few times, he’s pretty quiet and reserved but a good guy. Bruno Fernando was hilarious, we loved him."
"Idk man it's making me think of people who say DeMarre, Nene, Taurean Prince and Montrezl look the same back in the day and it doesn't sit right with me  (Also light skinned black dude)"
"It's not like the Hawks were in a good position when we drafted Trae, our best players were Taurean Prince and Schroeder. The only player we still have from that roster is Collins. It's a credit to Trae's skillset that we've been able to build around him so successfully. Sure, our front office has been competent but you couldn't have asked for much more from Trae."
Taurean Prince.
"KPJ and Green are literally products of that trade  We literally got KPJ because Taurean Prince took his locker. Taurean Prince was in that Harden trade  We also 100% wouldn’t have been picking in the top 4 , if we had Simmons from January"
We weren’t already getting KPJ  KPJ got cut because of his tantrums when Taurean Prince took his locker  Taurean Prince was traded to Cleveland because of the Nets trade
Taurean Prince better
"you all were [actually one of the healthiest teams in the NBA](https://twitter.com/ManGamesLostNBA/status/1390054193294159874?s=20) and just massively underperformed relative to number of games missed but not that it mattered at all   a healthy wolves with Dlo, Ant, and KAT got taken out behind the woodshed and shot by a Pacers team led by Tj McConnell and missing Sabonis, Turner, Warren, and Brogdon  there isn't really a single PF on the roster, they have zero defensive identity or really any net positive defensive players, and i dont see how adding patrick beverley and taurean prince (seriously wtf?) is going to add 10 wins to this roster."
