"Nets gave up Caris LeVert, Jarrett Allen, and Taurean Prince who were all contributing on Defense to various degrees along with Rodions Kurucs who was relegated to the Bench.   They received James Harden who isn’t known for his Defensive skills and only recently filled up 3 Empty Roster Spots a month after the trade.    Nets essentially lost their entire 2nd Unit between the trade and Dinwiddie’s injury. Not to mention Sean Marks shitting the bed on the Bey for Shamet trade. Of course their Defense was going to be bad.   How many great high quality Free Agents are available to sign mid season? Nets can only do so much and so far Sean Marks hasn’t proven himself to be on the level of Morey when it comes to in season roster building.   Sean Marks gets a ton of his shine from hitting on LeVert and Allen back to back in the draft along with finding Dinwiddie and Harris in the trash bin. He’s been very limited in his drafting skills since 2016-17."
"The King vs the Prince, and I ain't talking Taurean"
he threw food at Taurean Prince after getting his locker replaced. what’s wrong with what I said?
"He wasn't that bad last season, and of course he had a good bubble run, so Nets fans thought he'd be at least okay (and better than Taurean Prince, who was the old punching bag).   But he's way worse now."
Taurean Prince in shambles
"You don’t think a team of Durant, Kyrie, Dinwiddie, Harris, Allen, DeAndre Jordan, LeVert, Jeff Green and Taurean Prince would have been competitive with the Lakers?"
"Jae Crowder, Taurean Prince, and Kenneth Faried"
Taurean Prince with the game high +30 for Cleveland
"Last time the Cavs beat us in Miami - Obama was still in his 1st tenure. (Jan. 25th, 2010)  Good win. 'Dipo's inefficiencies are still present but I'm digging the way Ariza has played the last two games + Bjelly contributing. Lowkey really, *really* would love Taurean Prince to become a Miami Heat at some point in the future. Love the idea of him as a role player on a playoff contender since his Atlanta days."
And then Cleveland turns around and somehow turns Exum into Jarrett Allen and Taurean Prince lol
Demarre Carroll Jae Crowder and Taurean Prince are all the same player
You really need to include the picture? People know who Taurean Prince is lol
he lost some weight and now goes as [Taurean Prince](https://cdn.nba.com/headshots/nba/latest/1040x760/1627752.png)
"couldn't he have just received Caris LaVert, Taurean Prince and Jarrett Allen.  Jarrett Allen is a franchise cornerstone center for a team to build around. Between him and Caris those two could've easily netted them a SGA type player or a whole bunch of picks. Jarrett Allen is going to be so valuable as a RFA, so many teams will throw him money. The entire deal with Cleveland and Indiana to land Oladipo was so stupid, did Tillman really think that Oladipo was going to have value as a star coming off an injury? I guess he loves picking up injured former stars considering he has John Wall (which is now looking like an absolute savior for DC that we got rid of him)"
To think Rockets got laughed at for trading Jarrett Allen and Taurean Prince to the Cavs. Rockets got KPJ and a 1st rounder for them.
KPJ is such a steal man. Rockets basically got him and a 1st rounder for Allen and Taurean Prince.
"Considering we're talking about Cleveland Cavs drama, you definitely mean Taurean Prince, right?   *The player Formerly Known as Prince of Atlanta and then Prince of Brooklyn.*"
They chose Taurean fucking Prince over a 20 year old with star potential. Cavs gonna Cav
They moved his locker over a spot for Taurean Prince who legit just joined the team and he apparently threw food around the locker room after. I’m highly doubtful it’s actually about the locker and not about more of an amalgamation of situations however.
this is what happens when you give  your best players locker to Taurean Prince
Imagine having this talent then botching it by giving his locker to Taurean Prince lmao 🚀
Can't believe bum ass Cavs chose Taurean fucking Prince over this stud. We all knew this guy had all star potential just from watching him play. Cavs are so dumb god damn
Cleveland shipped him off during the Harden trade and somehow got Jarrett Allen and Taurean Prince out of it
We trade JC for Taurean Prince (who we traded last season for the corpse of allen crabbe) the 25th pick and a low second rounder and we somehow also have to give up Kris Dunn? Absolutely not. I'd rather let him walk than make sure a terrible trade.
"I understand that if they trade him they’re not gonna get the same value as Collins, but Taurean Prince, a late first and a second is laughable."
Lol hawks FO aren't dropping off John Collins for Taurean prince and a shitty pick. They aren't gonna get finessed so badly.
"Absolutely awful trade for Atlanta. A pick in the late 20s, the corpse of Taurean Prince (48%TS) and a late 2nd?"
They didn’t do it to piss him off. Taurean prince (a guy who was actually playing) needed a locker and Covid protocols limited availability. Learn some details before  blind stumping for some kid who was 100% in the wrong
I get DeMarre Carroll confused with Taurean Prince
"No, didn’t you hear? We held the rockets at gunpoint and forced them to give us Harden. We clubbed the Pistons knees until they bought out blake. We gave Taurean Prince blankets with small pox to pass out amongst the Cavs because they haven’t handed us Drummond yet. We’re the worst"
"Taurean prince going from pretty good to falling off a cliff, fucking Jalen Adams, JEREMY LIN (lest we forget), the living meme deyonta Davis. Allen Crabbe existed for a moment in time and we were actually excited to get him too lmao, who else? Fucking Damian Jones who is maybe the worst player I’ve ever seen in the nba, Tyrone Wallace, CHARLIE BROWN JR.   YOUR CONTRIBUTIONS WILL NOT BE FORGOTTEN LADS"
"Let's not forget the Nets trade away Caris Levert, Jarret Allen and Taurean Prince for Harden, then Kyrie switch to the SG role while Harden switch to PG role.  This all happen when Dinwiddie, the only good PG they have left was injured.  After that trade, Nets sign Andre Roberson (defensive SG), Iman Shumpert (another SG), Alize Johnson (wing player) Blake and Lamarcus (big men). None of them are PG. Until the Harden injury which the Nets sign Mike James as a stopgap measure until Harden return.   So yes, it was clear that Nets intend for Harden to be the playmaker."
"His contract is 3 years $40 million. Players who make around that: taurean prince, patty mills, Cody zeller, Davis Bertans, Rudy gay, justice Winslow, dion waiters. Kuzma has been big for us all year if you watch the games. And what are you on about we kept him over lonzo? There was no way we kept lonzo or BI in that deal."
"Nets have played 27.  In order of total minutes: Joe Harris, Kyrie Irving, Jeff Green, Bruce Brown, James Harden, Landry Shamet, DeAndre Jordan, Timothe Luwawu-Cabarrot, Kevin Durant, Tyler Johnson, Nicolas Claxton, Blake Griffin, Caris LeVert, Jarrett Allen, Chris Chiozza, Taurean Prince, Reggie Perry, Alize Johnson, LaMarcus Aldridge, Mike James, Spencer Dinwiddie, Andre Roberson, Norvel Pelle, Tyler Cook, Rodions Kurucs, Iman Shumpert, Noah Vonleh"
Don't forget Taurean Prince
"&gt; TLC is terrible but at least he knows his role  Agree with you on James but completely disagree with this. TLC does not know his role at all, or at least forgets what it is too often. There's a ton of times where he's jacked up threes when he's had no business to. He's basically become an even worse version of Taurean Prince at this point."
I wonder how much Taurean Prince likes his locker.
I wonder what the CAVS front office are thinking right now? Basically choosing Taurean Prince over him.
"Seriously, fuck my team.  Let's make sure benchwarmer Taurean Prince is more respected than the 2nd best player on our team at the time.  Cavs are dumb.  I don't care what he did, you don't give someone away like that for free.  I hope our front office and coaching staff feel really stupid right now"
"During the off-season he had legal troubles involving illegal possession of a weapon, during the season he got his locker switched with Taurean Prince, had a fit and threw food at a staff member."
It was scrub ass Taurean Prince.
"Lmao bro, some of your fans are willing to die on a hill that he was a locker room cancer for throwing a tantrum because they moved his locker for scrub ass Taurean Prince. Who the fuck wouldn't throw a tantrum if their locker got moved for his scrub ass?   Then they want to bring up the gun shit like it has anything to do with him playing basketball. For fucks sake, it's not like he pulled an Arenas."
Didn't the Cavs basically give Taurean Prince KPJ's locker without notice which lead to the entire blowup?
Had to move all his stuff to make room for Taurean Prince
Cavs legend taurean prince deserves that respect bro
Had to move all his stuff in the locker room for Taurean Prince
This is why midsize contracts are important. I think most nets fans were confused when marks signed taurean prince to that deal when we did but it’s clear that he was being used as a salary filler for a potential trade whether it was a smaller salary like lavine or for a big star like harden
"Those two points are all that's needed to know the other user is being beyond disingenuous in trying to defend the cops at all costs.  This is on top of the fact this~  &gt; KPJ called the cavs black/jewish gm a ""modern day slave-master"" bc his locker was moved to make room for Taurean Prince  Never actually happened and this user keeps spewing this BS all over the thread and when questioned give a source that does not back that up"
"&gt; KPJ was kicked off his College team and first Pro team bc of his attitude/mental issues  &gt; KPJ called the cavs black/jewish gm a ""modern day slave-master"" bc his locker was moved to make room for Taurean Prince  These two things have literally nothing to do with this situation though. You don't think the public deserves transparency because KPJ said some questionable things months before this, thousands of miles away from the incident? I honestly have no idea why you're bringing this up (though I'm starting to get an idea since you're shitting on KPJ all over this thread)."
These Taurean Prince jokes aged horrendously.
People in here making Taurean Prince jokes but this article has some dope stories
This gave me Taurean Prince what is a rebound vibes lol
Taurean Prince level analysis
"we traded taurean prince to cleveland in the harden trade, who took porters locker...."
"Exactly. The Rockets fleeced themselves out of a good trade. Like, how the hell did the Cavs even enter that trade?I'm pretty sure if they didn't make it a 4 team trade, the Nets would have given up a Allen, LeVert, picks, and Taurean Prince deal to get Harden. Instead, this happened."
"Did the Heat have that many picks and pick swaps to trade? Seems like that's what the Rockets wanted... do the Nets even any picks left in the next like 6 years?  By the way everything went down, it seemed like the Rockets were clearly more interested in sending Harden to the Nets, and didn't really want back players. They rerouted Jarrett Allen and Taurean Prince to Cleveland, Caris LeVert to Indiana, and eventually traded Oladipo to Miami. The only player they actually kept was Kurucs, and he plays like shit. If you look at all that, I don't think they were all that serious about negotiating with parties other than the Nets, unless they were gonna fleece them."
&gt; Taurean Prince  You're telling me this isn't a World of Warcraft character?
"Because nobody cares about the Cavs without LeBron. You probably haven't seen much Collin Sexton (who averages an efficient 24 ppg including 30 pts tonight), Darius Garland (who just recently had 37 pts and 7 ast), Taurean Prince (had an efficient 25 pts against Charlotte last night), and others either"
  **Cavaliers @ Hornets**  [](/CLE) **103 -  90** [](/CHA)  **Box Scores: [NBA](http://www.nba.com/games/20210414/CLECHA#/boxscore) &amp; [Yahoo](http://sports.yahoo.com/nba/cleveland-cavaliers-charlotte-hornets-2021041430)**  |**Team**|**Q1**|**Q2**|**Q3**|**Q4**|**Total**| |:---|:--|:--|:--|:--|:--| |Cleveland Cavaliers|27|22|26|28|103| |Charlotte Hornets|23|18|25|24|90|  **TEAM STATS**  |**Team**|**PTS**|**FG**|**FG%**|**3P**|**3P%**|**FT**|**FT%**|**OREB**|**TREB**|**AST**|**PF**|**STL**|**TO**|**BLK**| |:--|:--|:--|:--|:--|:--|:--|:--|:--|:--|:--|:--|:--|:--|:--| |Cleveland Cavaliers|103|37-76|48.7%|13-31|41.9%|16-19|84.2%|9|47|27|11|9|15|7| |Charlotte Hornets|90|34-84|40.5%|16-44|36.4%|6-12|50.0%|10|38|23|18|8|12|5|  **TEAM LEADERS**  |**Team**|**Points**|**Rebounds**|**Assists**| |:--|:--|:--|:--| |Cleveland Cavaliers|**25** Taurean Prince|**11** Kevin Love|**7** Darius Garland| |Charlotte Hornets|**22** Terry Rozier|**7** Miles Bridges|**8** Terry Rozier|
"There is no indication that the GM preferred Philly's offer over what we got from Brooklyn. Simmons (who wouldn't re-sign in Houston) and a couple protected swaps vs 7 or 8 unprotected pics, caris levert, jarrett allen and taurean prince. Pretty easy call in my opinion"
The best is still the Taurean Prince trade netting us the pick to trade up for Hunter and the pick we traded for Capela
Should have kept Taurean Prince and traded Harris if he's going to play like this.
"Not having taurean prince helps you win. Levert missed more games than Harden. You’re basically saying Jarrett Allen makes up for the loss of Harden. Claxton and Allen provide many of the same things and personally I prefer Claxton because he is better switching onto perimeter players, but he never cracks the rotation if JA stays. Plus the Nets were not the clear favorites then, so good chance they don’t get Blake either. I would prefer Blake Claxton and harden to Allen Levert and prince lol"
Taurean Prince explaining what a rebound is will always be a classic
If Brown gets all those Taurean Prince minutes at the start of the year do they still trade for Harden?
I think you mean Taurean Prince
"Well when you’re the GM you take on the the risk and reward when you sign a player. I don’t think the problem is Ainge being complacent or looking at offers to move him. I think that Ainge failed to communicate with either Kemba or his agent that a trade was a possibility and that he would actively look at offers. When Sean Marks traded Caris Levert, Jarrett Allen and Taurean Prince he made it clear to each of those guys that a trade was possible so they wouldn’t be blindsided when they saw their names in rumors or when ultimately they had to move their entire lives and families to another city. Ainge isn’t a bad person for that."
"BOS gets: CJ McCollum, Kristaps Porzingis, Josh Richardson, POR 2023 1st, POR 2027 1st, DAL 2025 1st, CLE 2025 2nd  POR gets: Kevin Love, Jaylen Brown, Collin Sexton  DAL gets: Norman Powell, Taurean Prince, Tristan Thompson  CLE gets: Kemba Walker, POR 2025 1st, DAL 2024 2nd  It’s not realistic, nor does it make sense, but here is one."
"Caris Levert,Jarrett Allen,Taurean Prince,Rodion Kurucs 3 unprotected first round picks and 4 draft swaps"
"I don’t think he’ll leave. I was curious where he *could* go though, cause I hate the Lakers (not a LeBron fan either tbh) and it’d be funny.  -	Mav’s would be the best option, they’ve got cap space, a good coach, shooters, and a young star. He runs the risk of being called a snake since the Mav’s beat his old Miami team.  -	Miami has cap space too, and he could frame it as a “returning to his roots” kinda situation. I’m not sure how much better their roster is than the Lakers though.  -	Knicks have max cap space and need a playmaker. NY would also be good for his advertisement and investment potential -	Portland might be the best option legacy wise. They’ve never won a title and even non Blazer fans want Dame to win one. Dame would also be the perfect compliment to current LeBron.  -	The Cavs wouldn’t be the worst option in the world. They’ve got a bad record, so it wouldn’t look like he was just aiming for a “hardest road” situation. Despite this, the team is reasonably built to be a good fit for LeBron. SexLand can definitely make shots at the very least, and Larry Nance Jr and Jarrett Allen are good defenders. They’d need to dump salary though either by packaging Love with good draft picks or trading a combination of Taurean Prince, Larry Nance Jr, and Cedi Osman.  -	The Pelicans would be a hilarious option, and might be my favorite option. They’ve got two young start already in Zion and Ingram, and could potential keep Lonzo too. They’ve also got a ton of picks to facilitate trades and clear cap with.  -	The Raptors would be an out of left field option. LeBron may view it as a good way to boost his international brand.   How I’d rank them:  1.	Of all these options, the Mav’s seem like the clear cut winner. They’d probably need to find a way to dump Porzingis though, so that they can re-sign Hardaway Jr and have room for LeBron, but that seems do-able.  2.	The biggest knock on Portland is I don’t know enough about their Cap Space situation to know if they could manage to sign him. I’d imagine that it wouldn’t cost a ton to find a way to offload CJ’s cap space though. Dame would be the best possible fit next to old LeBron of almost anyone in the league though. It’d also look the best for his legacy since the Blazers have never won and Dame is universally liked. The other big negative is their porous defense.   3.	The Knicks wouldn’t necessarily be a good fit if he wants a guaranteed ring. However, it would look decent for his legacy. The team would be decent around LeBron if they could re-sign Rose too. Rose, Barrett, LeBron, Randle, Robinson is a decent lineup especial when you figure they’ve got all they’re picks available to find other pieces.  4.	The Pelicans would be hilarious but could turn really deadly, really quickly. Especially since the Lakers picks the Pelicans own become prized trade capital id LeBron just decides up up and walk. Ingram plus lotto picks could probably net them Beal or LaVine which couldproduce a Lonzo, Beal/LaVine, LeBron, Zion, Hayes lineup which could be very deadly."
"&gt;Shoulda gave up the farm for Jrue Holiday when they had the chance  I don't think Jrue was the solution, they needed forward depth not a second PG.  Hayward, Jae Crowder, Bobby Portis, etc are all good defensive forwards that Portland could have gone after in FA, hell even Tristan Thompson or even  Dwight or Javale could have been good defensive backup centers. Trades aside, they had options and just didn't pursue anything. It's honestly baffling.  Then there's trades. I'm confident they could've traded for some good defensive 3&amp;D forwards from rebuilding teams like Taurean Prince or Kelly Olynik, not to mention guys like PJ Tucker or Aaron Gordon who got picked up by contenders for basically nothing. Gary Trent Jr is literally a better defender than Powell and they packaged that trade with picks which to this day still makes no sense.  Sorry Portland fans, you guys have an atrociously lazy FO"
He got conditioned to expect misses after playing with taurean prince and deandre bembry as his wings his rookie year
"all I remember for Taurean Prince before he came to us is ""What does a King do to a Prince!!!"""
Also the first we got in the Taurean Prince trade. Can y’all believe we got a first for Taurean Prince???
No taurean prince wouldn’t be dressing for games if he was a laker
"Because he gets credit purely off the fact that he's a Laker, and for no other reason. He's at absolute *best* a middling role player level talent, who has completely wasted his natural athleticism.  Kuz has been relegated to just rebound robot, and yet he still thinks he's hot shit. In reality if he were on a team in a city that doesn't have 8 fucking million people, he'd be drowned into complete obscurity.  If Taurean Prince took his place, LA fans would think he was literally Jesus in comparison. And I'm not even a fan of Taurean Prince, **at all**.  All this to say.. Fuck the Lakers."
I can hear Taurean Prince in this
They moved his locker for Taurean Prince.. They obviously didn't respect him
It matters.   It determines the playoffs.  Taurean Prince
[Taurean Prince explains rebounding](https://www.youtube.com/watch?v=atr60tR7Emo)
Taurean Prince would be goated if it happens
It was Taurean Prince I’m pretty sure
"They had shitloads of draft picks, the Lakers do not. The only picks the Lakers have are the 22nd pick in this year's draft and the 2027 pick. That's it. Brooklyn traded three 1st round picks and 4 pick swaps for Harden along with Jarrett Allen, Caris LeVert, Taurean Prince and Rodions Kurucs."
It's normal don't let others tell you how to enjoy basketball otherwise. Those people are lame.   I got into the NBA and followed the tanking Hawks led by Taurean freaking Prince. Fast forward years later and I'm loving where we are now. I've also started following the Pistons this year and they have a lot of potential to go big. I'm all for long term storytelling baby.
"In college, but [Taurean Prince](https://youtu.be/atr60tR7Emo) had this great response to being asked about being out rebounded"
"They can have Taurean Prince and a 2nd for him.   Actually, no. That's an overpay."
"Wait hunter trade is not related to this in any way iirc   Mavericks moved from 5 to 3, gave up the pick that became reddish   Hawks got hunter cuz they traded up from 8 (their own pick) to 4 by giving up 17 (from the Taurean Prince trade), 35, and took on the Solomon hill contract. These are not related in anyway, it’s just Trae + Reddish vs Luka"
"Taurean Prince looked good his rookie year, then he apparently learned from Bazemore how to go 3-13 with 5 TOs every game"
Bring in Taurean Prince to talk about rebounding
"The only real fleece is getting 2 firsts for Taurean Prince.. but that allowed the nets to sign Kyrie/KD lol so yeah. kinda funny how his trades work out like that  schlenks done a lot of smaller scale ""doing teams/players a solid"" type trades-- trading for Labissiere so portland could save money, same with uhh a guy from boston in 2019 I think, he basically asked Rondo if he wanted to go to LA, etc"
"The Hawks hit gold in the 2017-2019 drafts.  * John Collins (2017, 19th pick) * Trae Young (2018, 5th pick) * Kevin Huerter (2018, 19th pick) * De'Andre Hunter (2019, 4th pick, moved up by trading up with New Orleans) * Cam Reddish (2019, 10th pick, obtained from Luka Traed) * Onyeka Okongwu (2020, 6th pick, TBD how valuable of a contributor he can be)  Getting Taurean Prince (12th pick) and De'Andre Bembry (21st pick) in 2016 could have gone worse, too. Real minefield in that draft, with Papagiannis (13th), Yabusele (16th), Baldwin (17th), Ellenson (18th), Malachi Richardson (22nd), Zizic (23rd), Brice Johnson (25th) lurking. That doesn't even include Dragan Bender (4th), Kris Dunn (5th), Marquese Chriss (8th), and Thon Maker (10th). Bruno Fernando has been a letdown, but he was the 34th pick, so expectations can't be too high.  And somehow, they have positive draft capital moving forward (i.e. didn't sacrifice their picks unnecessarily).  Having all these guys on rookie deals means they were able to sign or acquire a bunch of vets to fill in their roster holes: Gallinari, Bogdanovic, Capela, Lou Will, and Solo. Their cap also allowed them to act as cap relief for other teams. Schlenk has done wonders for this team since his 2017 arrival. He apparently also scouted Draymond when he was working for the Warriors."
Should be noted he took Collins and Huerter at pick 19.   He also turned Taurean Prince into Capela and Hunter
"nah, you guys just managed to make it find its way home.  [here's the jarrett allen trade release from the nba](https://www.nba.com/cavaliers/releases/allen-prince-trade-210114)  &gt;The Cleveland Cavaliers have acquired center Jarrett Allen and forward Taurean Prince from the Brooklyn Nets as part of a three-team trade that also includes the Houston Rockets, Cavaliers General Manager Koby Altman announced from Cleveland Clinic Courts. In exchange, Cleveland is sending guard Danté Exum and a 2022 unprotected first round draft pick via Milwaukee to Houston"
YO taurean prince viewed my story like a year ago (I literally have like 400 followers) and I was so hyped. Now it doesn’t feel nearly as cool
&gt;Taurean Prince - views fans IG stories randomly to try and get them to follow him  This is hilarious
"Maybe, but I wouldn't count on it. The NBA is a little weird with draft picks and unless you get a top pick in a good draft class, their value is very small. Compare that to the NFL, who value top 15 picks like gold and you can many times find a franchise changing player. The NBA is just strange that way, and many times, you need 2-3 firsts as well as a decent player or two to trade for a all star.   Look at the Harden trade, for example. The Nets gave up Caris LeVert, Jarrett Allen, Taurean Prince, Rodions Kurucs as well as three unprotected 1st rounders (2022,  2024, 2026) and four first-round pick swaps (2021, 2023, 2025, 2027). With two young promising players they still had to just throw in 4 firsts and 4 swaps to get Harden. If the Nets team goes bust any time soon (which, can happen with Kyrie.. just sayin), they are fucked. Even if they tank down to the bottom of the league, they either gave their pick away, or another team will swap their pick away.  I'd imagine the same kind of firepower in a trade for Dame will be needed, likely with a 4 team trade as well, so even with a young a promising Anthony Edwards, I would expect a TON of picks to be going Portland's way as well as at least another decent starter."
Taurean Prince
