"I iant saying Okoro is the next Kawhi, but as a 19 year old kid he guarded literally every single All-Star night in and night out and held most of them to well below average scoring and play.    https://www.cleveland.com/cavs/2021/04/isaac-okoro-undaunted-after-defending-gauntlet-of-nba-stars-including-stephen-curry.html   “But Isaac makes you beat him. He doesn’t give you angles, he doesn’t go for steals and get out of position. He makes you have to score over the top of him, and I thought he did a great job of that in the first half for sure.”  Harden’s attempts to get past or around the stout Okoro were to no avail, so much that he didn’t even take a shot until a minute and 25 seconds into the second quarter.   “It was impressive from the young fella,” said Taurean Prince, who scored a season-high 17 points in his Cavs debut. “Usually you see guys kinda get happy feet guarding those caliber of players, but he was staying solid and sticking to his principles. Definitely stuck to the game plan. He definitely looked well-prepared and focused out there, and that’s truly all you can ask (for) out of the young guy.”  Of course, Harden is not going to be held down for very long. He found some success in the second-half and overtime periods, and ended up dropping 21 points (along with recording his third consecutive triple-double for the Nets). With that said, when you look at the shots he made, he didn't actually score on Okoro until the 3:28 mark in the fourth quarter.  https://www.basketballnews.com/stories/nba-cleveland-cavaliers-rookie-isaac-okoro-swarms-james-harden-brooklyn-nets-kyrie-irving-kevin-durant-defense  Pre All-Star break, a span of time consisting of 31 games, Okoro averaged a mere 8.1 points, 2.7 rebounds and 1.9 assists. Not exactly encouraging numbers for a top five pick averaging 33.2 minutes a game up to that point.  Post All-Star break, the rook has scored at a rate of 10.6 points per game, adding 3.4 rebounds and is still dishing out just 1.9 assists. What’s more? Okoro is having a great month of May as through seven games, he is posting about 16.3 points, 4.3 rebounds and 3.1 assists.  “Ice,” as he is often referred to, showcased exactly what he is capable of in a May 4 matchup against the Phoenix Suns (currently the No. 2 seed in the Western Conference) in which he exploded for a career-high 32 points while defending two of the game’s best in Chris Paul and Devin Booker.  He did a bit of everything offensively as he hit 10-of-16 of his field goal attempts and shot three-of-four from three-point range while also going nine-of-nine from the free throw line.  https://kingjamesgospel.com/2021/05/14/cleveland-cavaliers-should-isaac-okoro-make-one-all-rookie-teams/"
I saw once that Taurean Prince checked out my IG story.... So you could say I'm kinda of a big deal
"Pelicans trade #10, NAW, Bledsoe, Lakers 2023 FRP for Sexton and Taurean Prince.   Resign Lonzo, Lonzo/Sexton backcourt, Lonzo can take on the harder defensive assignment and playmake while letting Sexton do what he does best: play the 2 guard and score."
"Jerami Grant, Malcolm Brogdon, Aaron Baynes, Taurean Prince. All those guys fetched protected FRPs in Sign &amp; Trade deals."
"Almost all his highlights on here have cavs fans regretting the trade, and he only got traded after the Taurean Prince incident. Not because of his allegations."
"I got another example for you, I watched a team this past year take on 13 a year of Taurean Prince playing hot garbage basketball in exchange for having a better asset attached to the same deal."
"Tanking is always an option.   The Hawks didn't have a boatload of picks from trading superstars. Most of our good players left for nothing. Got nothing for Horford. Got nothing for Millsap.   We did get a 1st for Teague (was technically pre-tank though). A pick for Schroder (it was part of a salary dump for Melo's contract), and 2 1st rounders for Taurean Prince (who we drafted with the Teague pick) in a salary dump with Brooklyn to unload Crabbe so they could sign Kyrie and KD.  If the Spurs are willing to trade middling players and take on bad contracts then they can get a few picks that way too."
"Jamal and Dejounte Murray!  Then like Darius Bazley, Terrance Davis, Taurean Prince, and WCS. Qickley, Maxey, and Patrick Williams as rookies.  So... you can go real young + Kawhi, or very Murray + Kawhi."
Shit. Taurean Prince. Is he even alive?
Yeah  Don’t feel bad we turned the Nets picks we got for Taurean Prince into Hunter and Capela
"First of all, false. Second of all, where were all the people comparing rosters when the Hawks were starting Alex Len, Taurean Prince, and DeWayne Dedmon?"
"No I wouldn't, and you're not getting my point. Nobody outside of GSW thought that KD going to the Warriors as a free agent was good for the league.  Imagine if Harden went to Brooklyn without Brooklyn having to give up most of their playoff core, and without them having to mortgage their future. Would you see a team with KD, Kyrie, Harden + Joe Harris, Levert, Jarrett Allen, Dinwiddie, and Taurean Prince as fair, especially if they had their first rounders every subsequent year?"
I saw two players named Taurean Prince and Brice bowen and I was wondering what year it was lol
"Montrezl, demarre Carroll, taurean prince, Kenneth faried, nene"
"Jabari Parker was supposed to be a sixth man on a projected 30 win team. The goal wasn’t to win games. Why is this difficult for you understand? Schlenk came in at a time where the team got bounced from the first round of the playoffs, and our only true positive assets were basically Taurean Prince and John Collins. That team was obviously going nowhere. He took a team with a lack of assets and got them to the eastern conference finals in three years. That’s objectively very fucking impressive and you know it."
Reminds me of Taurean Prince describing to a reporter what a rebound is..lol.
Strong Taurean Prince being asked about rebounds energy  https://youtu.be/atr60tR7Emo?t=20
The dude turned Taurean fucking Prince into Capela and Hunter. Give him some credit
"When we traded Allen Crabbe for Taurean Prince I would never have guessed Atlanta would make it to the ECF in two years, faster than the Nets."
"What's more interesting is how little of what that 2014- 2015 team became assets for them:  * The following left in free agency for nothing: Al Horford, Paul Millsap, DeMarre Carroll, Thabo Sefolosha, Pero Antic, John Jenkins, Elton Brand, Austin Daye (waived in his final season) * Adreian Payne traded that season (his rookie year) to the Twolves for the pick that became K'Von ""Red Velvet"" Huerter  * Following were traded for things that didn't matter: Mike Scott  (a 2nd that did not convey), Shelvin Mack (traded for washed up Kirk Hinrich in his final season), Korver (traded for a retired Mo Williams, Mike Dunleavy Jr. in his final season and a 1st that did not convey). * Schroder was traded for a pick that conveys next year plus a whole bunch of nothing. *  Jeff Teague traded for Taurean Prince and a pick that was packaged with other picks to get DeAndre Hunter. * Kent Bazemore and a future first eventually became Clint Capela.   So in summary, from that roster they only really got Clint Capela, Huerter, and DeAndre Hunter. 4/5 of the ""NBA Player of the Month"" team left for nothing. I remember there was a lot of criticism of the Hawks for not getting assets for their players, but it didn't really matter. Schlenk did a good job of rebuilding through the draft and free agency."
"We sent Taurean Prince to Cleveland, which resulted in the Cavs giving Porter his locker, leading to a meltdown."
"&gt;DeAndre Bembry  &gt;Taurean Prince  &gt;Traded Oubre  Mixed bag, Prince is a bad piece on a bad team, Bembry is on a minimum in Toronto, and Oubre is the best individual player, but was traded before he could really do anything for the team"
"Reminder that as part of the trade to get harden, the nets gave up 3 first rounder, 3 picks swaps, and lost LeVert, Jarrett Allen, Taurean Prince and Kurucs.  Now they have 3 aging stars, a threadbare team and no assets."
"Word is Bev and Taurean Prince can’t be traded again until late September. My money is on a 3 team deal sending SGA, Bev, and Prince to Philly, Simmons to Minny, young players/picks to OKC"
Does anyone follow Taurean Prince? He’s been sharing some Anti-Vax stuff on his stories. Shame.
We wouldn’t have KPJ or Green if we took the Simmons package  KPJ was waived because of the Taurean Prince locker room incident. Taurean Prince was traded to Cavs in the harden trade and then took KPJ’s locker  Jalen Green was gotten from us getting the number two pick. We would’ve lost our pick of it landed outside the top 4 and it would have if we had Simmons because he’d prolly win us 3-6 games.  It’s also important to note that Simmons is on a max for 4 years and we still have Wall on a super max for two more years. I think a complete rebuild was a better option  I do think we should’ve traded Harden for like MPJ and picks but I’m not sure that deal was even available
Y’all better hope someone wants Fresh outta jail Beasley or the Taurean Prince of Bel-Air
"Minnesota thinking they can get Simmons without giving up Ant, Dlo or McDaniels is one of the funniest storylines I’ve ever seen.  They’re not going to get Simmons or any win now pieces to trade for him with a deal centered around Taurean Prince and All-Prison first team members Pat Bev and Malik Beasley"
"&gt;On Nov. 14—two months before the trade was officially announced—early talks between Houston and Brooklyn included Harden for Spencer Dinwiddie, Caris LeVert, Taurean Prince and Jarrett Allen. The picks weren't finalized at that point, but a verbal agreement was made, according to sources close to Harden and Durant. (A Nets spokesperson denies a verbal agreement was made at that time.) Harden and Durant believed the deal was done and celebrated the occasion together.  &gt;By Nov. 17, news of the potential deal had spread across the league. Harden and Durant thought it would be finalized on Nov. 22, when trades could officially be announced. But Rockets management changed its tune. Harden, Durant and the Nets had underestimated the Rockets' capacity to posture for a better deal.  &gt;""Houston was being difficult,"" a front-office executive familiar with the Rockets' negotiating tactics at the time told Bleacher Report.  Ah yes I'm sure Harden and KD celebrated the trade based off of nothing. Fuck outta here"
Taurean Prince - Explaining to reporters what rebounds are.
"Anderson Varejao, Delly, and Taurean Prince (gonna miss him)"
If Taurean Prince sticks on the team he’d probably take 12
"I kind of understand how the Wolves won the trade - Culver needs to be another team's rehab project and most Wolves fans are just completely out on Juancho but my God your forward rotation outside of McDaniels is absolutely awful.  Ant's too small to defend the 3 + doesn't have the defensive acumen yet. Okogie's undersized and is a black hole on offense.  That leaves you Taurean Prince (solid enough as a rotation guy, but he's also an expiring that I don't see being on the team in the future), Jarred Vanderbilt (basically a small-ball 5 but okay maybe you can work around that with KAT), Jake Layman (oh boy)."
"&gt;Think you could argue that those three guys combined would provide more value in the playoffs than Simmons.  Yeah I dont think that at all, I think that's genuinely a delusional statement.  First of all Prince is the definition of a replacement player, posting a grand total of 0.1 VORP over his 5 seasons in the NBA. I watched him for both the Hawks and Nets - genuinely one of the most frustrating players to ever watch (/u/Bigbadbuck knows.) You can get and Vanderbilt's value for 2 minimum value contract guys without having to pay $13m/yr for Taurean Prince. They are human TPEs to deliver the 3 picks.  Patrick Beverly literally does nothing better than Simmons other than spot up shoot while being way older and could decline at any point. He probably does still have value to the Sixers but in no way is what is essentially a Bev + picks for Simmons trade be fair considering picks from like 2028 (which if the Wolves are sending 3, it has to start in 2024) help Joel Embiid or is seen as a win."
"Selling at  all time low value is just bad management in my opinion.   There's no defensible thing about replacing Rubio, Culver and Juancho with PatBev and Taurean Prince."
"In the last few years Minnesota has turned Kevin Love, Zach Lavine, and 4 lottery picks into D-LO, Malik Beasley, ~~Ricky Rubio~~ Taurean Prince, and ~~Jarret Culver~~ Pat Bev."
"Could they have used their TPE on Rubio? Because unless the Wolves were keen on trading Rubio for Taurean Prince then that was a missed opportunity to fill their need at a cheap price.. they then used their TPE for Josh Richardson, who really doesn’t do much or do anything consistently these days"
"Id try to force a trade to 6ers, essentially forcing the Blazers to rebuild, which means they wouldn't want Simmons, so a third team that really wants a defensive pf who won't take touches away from players will have to be involved in this completely hypothetical and unbiased trade. If I was the Blazers FO, I would get rid of McCollum obviously, but I would need draft picks and some young players who haven't hit their stride, someone like, idk, Jarrett Culver, maybe a shooter and an ok pf, like, Malik Beasley and Taurean Prince maybe? That's just what seems fair and unbiased to me."
"Who knows what they'd do - Jody Allen is apparently trying to sell the Blazers and it's easier to sell a competitive team (probably).  I imagine if the Blazers are blowing it up they'd clear house for all of the picks they can. Here's the rough deal:  Philly gets: Either Dame/CJ, Robert Covington  Minny gets: Ben Simmons  Portland gets: Malik Beasley, Taurean Prince, picks from BOTH Philly and Minny"
Trae had Collins Dedmon and Taurean Prince and averaged 8.1 as a rookie
"Taurean prince, Denzel valentine, Markelle fultz, lauri markkanen, Dennis Smith Jr, marvin bagley, Kevin knox. That's my list of guys that were hyped but either have had bad injury luck or don't know what the hell is going on."
This doesn’t make sense  The Rockets arent bad enough for green if harden stays   Taurean Prince never goes to Cleveland without the harden trade and KPJ never complains about his locker  Sengun was also apart of the trade and he isn’t a starter yet to begin with  KMJ doesn’t play big minutes for a playoff team
"Jaden McDaniels is going to establish himself as one of the more coveted 3 and D players in the league this season. Wolves making it to the playoffs with help from his improvement, Edwards taking a big step up with efficiency and leadership, Balmaro being more useful than most expect, and Taurean Prince fitting in as a bench 3 point sniper to go along with Malik"
"He was great in college. 14th wasn't a reach at the time, but it's a cautionary tale about overvaluing production as a senior in college when the player is older and more experienced than the competition. It just didn't translate to the NBA.  Dragan Bender, Marquese Chriss, Thon Maker, Taurean Prince, and Georgios Papagiannis all had similar or worse NBA careers than he has had and they were drafted ahead of him. It's just the nature of the draft that not every guy is suited for the NBA/not every team is good at developing prospects. Not the worst 14th pick ever imo"
they sent taurean prince to cleveland and the cavs gave him kpj's locker and kpj was understandably upset so the cavs traded him to the rockets for a bag of chips
"So Taurean Prince, Malik Beasley and 2 1sts? We will even throw a Prince Prince jersey."
"If MIN isn’t moved, they need to do something. The only thing I heard about them this off-season was trading for Taurean Prince."
Oh shut tf up. Porter was under investigation for assaulting a woman AND flipped his car over at 3 am on the highway in the ghetto of Ohio and cops found an unregistered gun in his car. The Cavs weren’t letting him play until he proved he was focusing on himself. Then the FIRST DAY they bring him back he throws a temper tantrum over his locker being moved for a recently acquired veteran (Taurean Prince) and calls our black GM (who gave KPJ plenty of leeway) a slave owner and threw food around the room.   KPJ’s locker was moved because he wasn’t an active player on the roster. It was moved to the end of the room temporarily while he was basically on a team inflicted suspension.   AND the way I’ve heard it was Cleveland had offers from other teams in the league but chose to send KPJ to houstin because of their history of dealing with troubled players. They wanted him to be in a place he could succeed and made sure to only trade him to a team that had a plan in place.
It actually can work pretty easily if you use Malik Beasley's and Taurean Prince's contracts. They earn $27M between them this upcoming season. Not to mention that Prince is an expiring and Beasly is on a rather team friendly deal. I can see this trade as one of the few possibilities for a Dame/Simmons trade to happpen.
ATL - Josh Smith  BOS - Paul Pierce  BRO - Joe Johnson  CHA - Raymond Felton  CHI - Derrick Rose  CLE - Christian Eyenga  DAL - Dirk Nowitzki  DEN - Ty Lawson  DET - Chauncey Billups and Taurean Prince  GSW - Steph Curry  HOU - Tracy Mcgrady    IND - Danny Granger  LAC - Blake Griffin  LAL - Kobe Bryant  MEM - Tony Allen  MIA - Dwyane Wade  MIL - Michael Redd   MIN - Jonny Flynn  NOP - Chris Paul  NYK - Danilo Gallinari  OKC - Kevin Durant    ORL - Dwight Howard  PHI - Andre Iguodala  PHO - Amare Stoudemire  POR - Damian Lillard  SAC - Tyreke Evans  SAS - Manu Ginobili and Matt Bonner  TOR - Vince Carter  UTA - Deron Williams and Sundiata Gaines  WAS - Gilbert Arenas
"This is great for MIN, that means no one else wants Lauri. Can we interest you in Taurean Prince, Jarrett Culver, and a 2nd round pick?"
"Could have used EF in a S&amp;T for some assets though, like all teams were doing this offseason. Could have traded for Rubio for quite cheap to help the ball movement (was acquired for Taurean Prince/2022 2nd). There’s a number of moves they could have made but chose not to, to save for Beal, which I just don’t think is the right play"
"The fact that adding Rubio and substracting fucking Taurean Prince is supposedly going to worsen your team tells you all you need to know about ""WORP""."
"It's nice someone on here believes in the Wolves but unfortunately we're not doing anything without trading for a different PF, Taurean Prince and Hernangomez in the frontcourt is not good enough"
"If Jaylen Nowell or Taurean Prince get hurt, Timberwolves don't make the finals."
"Taurean Prince was rumoured to be moved again, so perhaps."
"average age: 26.28 years old    more averages   average height: 6'6.28 in  average weight: 219 lbs   experience: 4 1/2 years in the league   making Taurean Prince the most average player in the league. he's 6'6.5, weighs 219 lbs, turned 27 back in march, and has spent 5 years in the league  [source, but this is all information from the beginning of the 2020-21 season ](https://www.google.com/amp/s/www.nba.com/news/10-facts-to-know-from-the-2020-21-nba-roster-survey%3famp=1)"
Tobias might have a big contract but I'd still take it in a heartbeat (depending on what we have to send to Philly) because Tobias on 30 million is still far more useful than Juancho Hernangomez and Taurean Prince
We really just traded Rubio for... checks notes... Taurean Prince....
How many points did Taurean Prince ever score against Team USA?
Minnesota just traded Ricky Rubio Plus a Second Round Pick Plus Cash to Cavs for Taurean Prince! HIGHWAY FUCKING ROBBERY!! Good Luck Cleveland!
"Yeah but Taurean Prince is a better ""fit"""
Taurean Prince
ricky rubio is gonna eliminate team USA and all the wolves were able to get for him was taurean prince and a 2nd💀
We traded Ricky Rubio for Taurean Prince. And we also gave the Cavs a 2nd round pick.
Unless the cavs are included rubio is already out (reportedly traded Rubio for Taurean Prince and a 2022 2rp (via washington))
Taurean Prince made a fan out of me that game he dropped 30 something on the Celtics a few years ago. Really fun player to watch
"He's the new Taurean Prince. People just gave him the reputation of a ""defender"" because he looks the part when he was a rookie and went from there. He's terrible he doesnt guard anybody. He's much closer to one of those microwave scorer type guards than he is some kind of 3+D wing."
"Taurean Prince is arguably one of the best defenders on the team. Jesus, that tells you everything you need to know."
"He said he's looking, but what we got right now... Taurean Prince is a smallball 4, Jaden McDaniels is a smallball 4, ect."
They do have a Taurean Prince tho
"&gt;July 29 CLE Ricky Rubio, 2022 2nd MIN Taurean Prince   we got the 2nd"
We got Taurean Prince and no draft picks how tf do you think
We got Taurean Prince and no draft picks how tf do you think
Taurean Prince was a sleeper agent sent to disrupt the Cavaliers locker room. You will not change my mind.
What?? Point guards are everywhere? We just got one for a shit pick and Taurean Prince
taurean prince to the rescue
"I mean, we sent Taurean Prince to Cleveland to take Kevin Porter's locker, causing a blow-up, and forcing the Cavs to trade him to us for free."
Here  Adams and Bledsoe and 10 and a lakers first for JV and 17  Shamet for pick 29 and Carter  Rubio and a 2nd rounder for Taurean Prince  Plumlee and 37 for 57
"Is Taurean Prince any good?  I thought he was just some end of bench guy, which makes this trade look like a salary dump from the Wolves."
Mavs should've jumped on that Rubio trade. They could easily outbid a Taurean Prince.
"Not happy about this one. As a Wolves fan from NYC, i've seen Taurean Prince absolutely stink up the show many times when he was on the Nets. What an awful pickup. Surely there was a better option available."
"TRADE: The Cleveland Cavaliers are acquiring Minnesota Timberwolves G Ricky Rubio, a 2022 second-round pick and cash for F Taurean Prince, sources tell ESPN."
Wasn’t taurean prince decent at one point
Rockets legend Taurean Prince
"I don't hate the guy or anything and I think he might even put up decent points and rebounds if he got to start at the 4 somewhere, but 538 had him between Solomon Hill, Wes Iwundu, Taurean Prince, Thad Young and Torrey Craig last year. That's what, an 8-10M guy in Thad, a 5-6M guy in Prince, a 3-4M guy in Craig and a couple minimum guys. Kuzma is younger than those guys except Iwundu, but I think you're still talking 20M over 3 kind of deal, though as I said I think if he moved to a non-playoff team where he could be a full-time 4 he would probably put up decent numbers.  As a Raptors fan, if Lowry signs with you guys and we have 19M in cap space, I wouldn't be stoked if we spent 13M of that on Kuzma. The Lakers have apparently been offering him and KCP all over town for a reason, and it's not because LeBron think he's a solid rotation guy. He's shot 40 percent in the playoffs and 28% on 3s in the 5 playoff series he's been in at age 25 and 26.  Though ironically, I think he'd be a good fit for us at forward next to whichever of OG or Siakam is sitting. Kuzma is a tantalizing player, but there's no real evidence he's more than a 9th man. My guess is he goes somewhere, puts up slightly better numbers but doesn't help his team win. But today? I think he's a 7M guy on potential and 5M on actuality. I wouldn't trust him over a guy like JaMychal Green and that seems like a guy who would be overpaid at 10M a year, never mind 13. He's not Marcus Morris, he's a guy who in theory could be."
"Okay fine: you got Larry Nance Jr, Taurean Prince, Cedi Osman and a protected future first."
"Don't forget that the Cavs had Jarret Allen and Taurean Prince who the Nets JUST traded for Harden   Watching OT was hilarious to me because Sexton just turned on the ""I'm not missing tonight"" settings and it was hilarious watching the leagues new Superteam not able to match or contain him   So after getting embarrassed in double OT and get ripped by social media and TV personnel, the stars are gonna come back and destroy them to show them who's boss right? Nope, their very next game was also against the Cavs and they LOST AGAIN. It was just quality memes"
It's Taurean Prince syndrome people decided coming out he must look like he's a good defender so he got that reputation and everybody just ran with it. He's terrible he doesnt guard anybody gives off all kinds of slap your hands on the court before your guy blows by you on defense energy. He's young so he might be able to get to being fine/non issue on that end but he's much closer to a combo guard microwave scorer/chucker than any kind of 3+D wing.
"Larry Nance, Taurean Prince, Cedi Osman, and a top 10 protected 2022 1st."
funnily enough they moved it because they gave the locker that he was using to taurean prince who they got from houston in the harden trade
it was because he had a locker room outburst because the Cavs gave Taurean Prince the locker KPJ was using (ironically Taurean Prince was traded to Cleveland by the Rockets) he hasn't had any outbursts like that in Houston though
