"In no particular order it's probably Quickley, the top 3 picks, Haliburton, Desmond Bane has been shooting super well, Pritchard had some great games and should be getting back from his injury soon, Tyrese Maxey was kinda balling when the sixers needed him to step up, Patrick Williams seems solid, and then Precious Achiuwa seems good whenever I see him? Idk I'm probably missing someone, but sure is 10 good rookies"
"[I believe his injury played a role](https://www.si.com/college/2020/02/10/tyrese-haliburton-injury-iowa-state-nba-draft#:~:text=Iowa%20State's%20Tyrese%20Haliburton%20to%20Miss%20Rest%20of%20Season%20After%20Fracturing%20Wrist&amp;text=Haliburton's%20injury%20to%20his%20non,an%20MRI%20over%20the%20weekend.)"
  **Kings @ Pelicans**  [](/SAC) **118 -  109** [](/NOP)  **Box Scores: [NBA](http://www.nba.com/games/20210201/SACNOP#/boxscore) &amp; [Yahoo](http://sports.yahoo.com/nba/sacramento-kings-new-orleans-pelicans-2021020103)**  |**Team**|**Q1**|**Q2**|**Q3**|**Q4**|**Total**| |:---|:--|:--|:--|:--|:--| |Sacramento Kings|30|30|27|31|118| |New Orleans Pelicans|33|29|32|15|109|  **TEAM STATS**  |**Team**|**PTS**|**FG**|**FG%**|**3P**|**3P%**|**FT**|**FT%**|**OREB**|**TREB**|**AST**|**PF**|**STL**|**TO**|**BLK**| |:--|:--|:--|:--|:--|:--|:--|:--|:--|:--|:--|:--|:--|:--|:--| |Sacramento Kings|118|42-88|47.7%|14-43|32.6%|20-26|76.9%|13|52|31|18|3|20|8| |New Orleans Pelicans|109|40-101|39.6%|9-30|30.0%|20-24|83.3%|17|46|22|22|11|10|5|  **TEAM LEADERS**  |**Team**|**Points**|**Rebounds**|**Assists**| |:--|:--|:--|:--| |Sacramento Kings|**38** De'Aaron Fox|**11** Tyrese Haliburton|**12** De'Aaron Fox| |New Orleans Pelicans|**20** Brandon Ingram|**13** Josh Hart|**5** Lonzo Ball|
I mean Wiseman isn't even performing as the best rookie atm either. It's either Tyrese Haliburton or Quickley.
"Then that should be about all players who get their stats posted with no substance. LaMelo, Wiseman,  Tyrese Haliburton,  etc"
"That's scorching hot. 12 points on league average effeciency, with 2 assists and 2 rebounds. Tyrese Haliburton is my pick."
"2020 was the supposed ""quiet"" draft but it's really produced a ton of great rookies  the top 3 all look solid Tyrese Maxey  Immanuel Quickly  Tyrese Haliburton  Payton Pritchard  That's at least 7 solid NBA players with some of them showing star potential. Then there are still dudes like Cole Anthony, Deni Avidja, Desmond Bane. Like 10 players that might make a career is a pretty good draft. It's definitely no 2018 but the potential still has yet to fully reveal itself."
"ugliest shooting form nominees: Tyrese haliburton, Lamelo ball, ja morant"
"I'm not saying he is or will become a bust but there's a lot of rookies who come into the league and aren't shooting sub 40% out the gate. One of the biggest criticisms coming in was that he was a really mediocre shooter and inefficient scorer in college and people who liked him said to not worry. Then it got worse when he came into the league. I hope he turns it around since he seems like a fun player but people take the ""we shouldn't give rookies a hard time"" thing way too far. Tyrese Haliburton was taken 12th and he's been amazing across the board. So clearly it's possible to at least not be disastrously inefficient as a rookie."
"Haliburton plays both sides of the ball way better than Melo. His defense isn’t even comparable. The game is a lot more than just counting stats and Tyrese playing more minutes shouldn’t be a slant on him. He’s literally playing so well Luke can’t afford NOT to play him in the end of games, even though he’s not starting."
"You should watch more of Haliburton then. His game is much more than the stats show, and while Edwards and Wisemen have both stepped it up, Tyrese has been gunning since game 1."
Betting odds as of earlier this week   https://www.fanduel.com/theduel/posts/nba-rookie-of-the-year-odds-update-lamelo-ball-tyrese-haliburton-james-wiseman-01ex0a09qq18
"The top 3 guys look like they could be all stars. Anthony Edwards has been unsurprisingly inefficient from long distance but he's a great finisher that has the tools to also be a good defender. James Wiseman is already one of the most fluid 7 footers I've seen. Lamelo is a great passer already and seems to be gaining confidence as a scorer.  Tyrese Haliburton is great, too. The guy has so much poise for a rookie.  Okoro looks like a good defensive player already. Not the type of guy who gives you flashy defensive highlights but the guy who can contain scorers for long stretches.  PWill was definitely a project coming into the draft but he looks already like an NBA starter Sometimes he goes a little mental, though, and shoots ill advised contested middies. Quickley and Maxey deserve a shout out too because of surpassing expectations."
  **Kings @ Heat**  [](/SAC) **104 -  105** [](/MIA)  **Box Scores: [NBA](http://www.nba.com/games/20210130/SACMIA#/boxscore) &amp; [Yahoo](http://sports.yahoo.com/nba/sacramento-kings-miami-heat-2021013014)**  |**Team**|**Q1**|**Q2**|**Q3**|**Q4**|**Total**| |:---|:--|:--|:--|:--|:--| |Sacramento Kings|35|24|18|27|104| |Miami Heat|24|33|27|21|105|  **TEAM STATS**  |**Team**|**PTS**|**FG**|**FG%**|**3P**|**3P%**|**FT**|**FT%**|**OREB**|**TREB**|**AST**|**PF**|**STL**|**TO**|**BLK**| |:--|:--|:--|:--|:--|:--|:--|:--|:--|:--|:--|:--|:--|:--|:--| |Sacramento Kings|104|41-85|48.2%|17-45|37.8%|5-11|45.5%|12|41|22|21|12|17|3| |Miami Heat|105|36-77|46.8%|11-32|34.4%|22-26|84.6%|9|39|25|14|5|15|4|  **TEAM LEADERS**  |**Team**|**Points**|**Rebounds**|**Assists**| |:--|:--|:--|:--| |Sacramento Kings|**30** De'Aaron Fox|**7** Tyrese Haliburton|**6** De'Aaron Fox| |Miami Heat|**30** Jimmy Butler|**13** Bam Adebayo|**8** Jimmy Butler|
  **Kings @ Raptors**  [](/SAC) **126 -  124** [](/TOR)  **Box Scores: [NBA](http://www.nba.com/games/20210129/SACTOR#/boxscore) &amp; [Yahoo](http://sports.yahoo.com/nba/sacramento-kings-toronto-raptors-2021012928)**  |**Team**|**Q1**|**Q2**|**Q3**|**Q4**|**Total**| |:---|:--|:--|:--|:--|:--| |Sacramento Kings|36|32|36|22|126| |Toronto Raptors|24|34|33|33|124|  **TEAM STATS**  |**Team**|**PTS**|**FG**|**FG%**|**3P**|**3P%**|**FT**|**FT%**|**OREB**|**TREB**|**AST**|**PF**|**STL**|**TO**|**BLK**| |:--|:--|:--|:--|:--|:--|:--|:--|:--|:--|:--|:--|:--|:--|:--| |Sacramento Kings|126|43-78|55.1%|16-36|44.4%|24-31|77.4%|11|38|31|25|7|22|5| |Toronto Raptors|124|42-86|48.8%|13-32|40.6%|27-33|81.8%|12|35|20|27|14|15|2|  **TEAM LEADERS**  |**Team**|**Points**|**Rebounds**|**Assists**| |:--|:--|:--|:--| |Sacramento Kings|**26** Harrison Barnes|**9** Hassan Whiteside|**11** Tyrese Haliburton| |Toronto Raptors|**32** Pascal Siakam|**10** Aron Baynes|**6** Fred VanVleet|
Why you bringing up the current rookie of the year Tyrese Haliburton in a thread about the Minnesota Timber..... uh...the... uh...Wolves! The Timberwolves man?
"You can spew numbers all you want but I’ve been keeping up with both of these guys heavily and I can tell you via my own two eyes that Tyrese definitely has the edge right now. Not saying IQ can’t pass him up, he’s the hottest rookie at the moment &amp; if he keeps this up he will pass Haliburton, but Tyrese hit the ground running &amp; has been better from the get-go."
"What happened was, Haliburton just happened to be walking between Fred and Lowry, as soon as Lowry turned back to Fred to yell something at him. Unfortunately, Haliburton walked between them that very split second, and I'm assuming the ref thought that Kyle was talking shit to Tyrese. Bad call."
"Tyrese Haliburton. I still don’t know why he is third in ROTY run, especially how good he has been."
"Just FYI, most mocks had Hali around 5-8, but prior to the draft [he asked other teams to pass on him so that he could go to the kings](https://kingsherald.com/draft-news/2020-nba-draft-tyrese-haliburton-sacramento-kings-lowe-post/).   So still an upset, but it's a bit of an odd scenario. I think had he been picked at 5 it wouldn't be a big surprise to see him get ROTY."
"Just FYI, most mocks had Hali around 5-8, but prior to the draft [he asked other teams to pass on him so that he could go to the kings](https://kingsherald.com/draft-news/2020-nba-draft-tyrese-haliburton-sacramento-kings-lowe-post/).   So still an upset, but it's a bit of an odd scenario. I think had he been picked at 5 it wouldn't be a big surprise to see him get ROTY."
"Just FYI, most mocks had Hali around 5-8, but prior to the draft [he asked other teams to pass on him so that he could go to the kings](https://kingsherald.com/draft-news/2020-nba-draft-tyrese-haliburton-sacramento-kings-lowe-post/).   So still an upset, but it's a bit of an odd scenario. I think had he been picked at 5 it wouldn't be a big surprise to see him get ROTY."
Tyrese Haliburton
It is within the realm of possibility that Tyrese Haliburton is Tall Jason Kidd.
It is not inconceivable that Tyrese Haliburton is Tall Jason Kidd.
"The NBA isn’t paying them, we as fans are paying them. What we all spend on the game determines how much salaries are.  Your comment about being born in tough neighborhoods without education or guidance is very ignorant and might I add a racist dog whistle. You’re implying that any player born in a tough neighborhood (which statistically means mostly the black players) is uneducated and unable to receive guidance from people around them. And they don’t get “any sort of education”, wtf man. That’s fucked up. Education isn’t just the school you went to, it’s the people you grew up around. Look at KD’s mom, she’s a fucking saint and clearly educated Kevin and he turned out to be a nice, humble young man with a good head on his shoulders. Or Tyrese Haliburton. Or 98% of all players in the NBA. They mostly all had good role models and support systems, because it’s damn near impossible to get to the NBA without people close to you making sacrifices in order to enrich your life. That is the opposite of no guidance.  The problem has nothing to do with where they were born or whom they had for guidance. It’s the fact that you’re giving a 19 year old a ton of money. And to them 1 million seems the same as 100 million, like it could never, ever run out. A million is “only” a thousand thousand, which saying it like that is laughable, but it’s actually pretty easy to spend if you aren’t smart about it, and kids are generally not smart about money. It’s the fact that they’re rich kids, not uneducated idiots that got no guidance or education."
Tyrese haliburton
Tyrese Haliburton is coming for Tyler Herro's spot
"I love BI so I hope we can just shove as many good shooters around Zion/BI as possible. BI needs space to slash too.  So maybe some Devin Booker types, a Tyrese Haliburton-type (who can shot create for others and hit shots,) etc."
Feel like that's even more of a thing with Tyrese Haliburton lol
Tyrese Haliburton is the same way
"Tyrese Haliburton on the Kings reminds me more of Brogdon: taller combo guards, good shooters and playmakers, who can also take it to the hoop. Good all-round floor generals."
Excited to introduce Clippers fans to Tyrese Haliburton.
"relative to expectations yes but in the grade scheme of things no. Lots of these guys are high floor/low ceiling types. So like Tyrese Haliburton, LaMelo Ball, and even James Wiseman are all guys who will realistically peak at a sub-all star level."
COTY - Nate Bjorkgren  MIP - Christian Wood  6MOTY - Chris Boucher   ROTY - Tyrese Haliburton   DPOY - Joel Embiid   MVP - I have no clue rn  Philly trades for Kyle Lowry and make it to the Finals but lose to the Lakers in 6 games.
"How about Tyrese ""True ROY"" Haliburton?"
I wonder how the warriors offense would have looked if Warriors drafted Tyrese Haliburton?
Tyrese Haliburton
"Aggressive what, all we did was pass on Tyrese Haliburton and sign 10 PF’s"
Tyrese Haliburton
Tyrese Haliburton has been the best to me
"Tyrese Haliburton, LaMelo, etc..."
"Tyrese Haliburton at 12 is a safe bet for this draft. We have some of the best scouting in the league, you don’t think we could pull off a good pick in the 10-15 range?"
Tyrese Haliburton is the truth
Tyrese Haliburton is the better player
So you’re saying he’s almost as good as Tyrese Haliburton?   Dude’s Rocklin’ a 5.5:1 assist to turnover ratio.
  **Trail Blazers @ Kings**  [](/POR) **125 -  99** [](/SAC)  **Box Scores: [NBA](http://www.nba.com/games/20210109/PORSAC#/boxscore) &amp; [Yahoo](http://sports.yahoo.com/nba/portland-trail-blazers-sacramento-kings-2021010923)**  |**Team**|**Q1**|**Q2**|**Q3**|**Q4**|**Total**| |:---|:--|:--|:--|:--|:--| |Portland Trail Blazers|38|28|27|32|125| |Sacramento Kings|24|25|20|30|99|  **TEAM STATS**  |**Team**|**PTS**|**FG**|**FG%**|**3P**|**3P%**|**FT**|**FT%**|**OREB**|**TREB**|**AST**|**PF**|**STL**|**TO**|**BLK**| |:--|:--|:--|:--|:--|:--|:--|:--|:--|:--|:--|:--|:--|:--|:--| |Portland Trail Blazers|125|44-100|44.0%|17-41|41.5%|20-23|87.0%|9|50|26|27|10|8|5| |Sacramento Kings|99|33-81|40.7%|8-30|26.7%|25-35|71.4%|6|47|21|20|4|15|5|  **TEAM LEADERS**  |**Team**|**Points**|**Rebounds**|**Assists**| |:--|:--|:--|:--| |Portland Trail Blazers|**37** CJ McCollum|**15** Enes Kanter|**6** Damian Lillard| |Sacramento Kings|**15** Marvin Bagley III|**8** Marvin Bagley III|**8** Tyrese Haliburton|
"tf no. Tyrese will pan out to be a top 5 or so player from this draft, assuming health. And even if Tyrese had the FULL green light he wouldn’t beat Tyrese Haliburton in Sacramento."
Won't it be Tyrese in the lead? Tyrese Haliburton has had a hell of a season so far.
"Surprise: Tyrese Haliburton. League ready on day 1, makes whole team better, maybe best player on the team so far.  Disappointing: Hassan Whiteside. Nice having a real shot locker, but he's otherwise a complete liability."
"Most Surprising: Tyrese Haliburton. I knew he was good, I didn't know he was ""carrying this team on his back"" good.   Most disappointing: Buddy Hield. He's been in a very long shooting slump, only cracked the 20+ pts once this season so far. Hoping he turns it around soon."
Tyrese Haliburton having a great start to his rookie year.
The guy I'm playing this week also has them. Luckily I drafted basically the entire Suns starting lineup and Tyrese Haliburton so I'm justttt squeeking out a win thanks to KD missing games.
#TYRESE HALIBURTON IS WHO buddy hield THINKS HE IS
"Tyrese Haliburton with  9pts, 3-3 3PT, 4 ast, and a block in like 6 minutes too. Jesus."
Tyrese Haliburton
Damn I wonder what you think of Tyrese Haliburton.
https://kingsherald.com/draft-news/2020-nba-draft-tyrese-haliburton-sacramento-kings-lowe-post/  Supposedly zach lowe heard about it and talked about it on a podcast.  And there's actually one guy I can think of who wanted to be a king - vlade divacs. Lol
all these people saying the kings won’t make it are really doubting 2021 kia mvp Tyrese Haliburton
"James Wiseman has freakish athleticism, length, and Size.  Anthony Edwards has size and explode with great athleticism to get buckets  Lamelo Ball has the height with good lead ball handling, and his passing is elite level  Tyrese Haliburton is just good at everything, and she showed drastic improvement from freshman to sophomore year. He is older than James Wiseman, Anthony Edwards, and Lamelo Ball with extra time to improve his skills against good competition.  Tyrese Haliburton talented but those 3 have potential to be top 10 player in the league be the main guy on the team, but they have a lot of work to do to get there. I am not sure if they are going to reach that level. Whatever happen from his freshman to sophomore year Tyrese Haliburton gets it, and know what to do on the court with his abilities with almost any situation. To me his potential is Malcolm Brogden."
A1 steal of the draft. He can play any sport he wants if there's money on the line. I'd like to see Tyrese Haliburton beat him at cooked food smh 😤 😤 😤
"He was just too much money for the role we would be giving him, unless we are still trading Buddy. Having kept both Bogi and Buddy would’ve made it a lot harder to get solid minutes for Tyrese, and Rese has looked amazing.   Bogi leaving was basically addition by subtraction. Our team got cheaper and we ended up better, IMO. Obviously I would’ve loved the Bucks trade to go through since we still could’ve used DD, but then again having DD would’ve also made it a bit harder to get minutes for Rese. (Luke would’ve likely played DD over Haliburton until Haliburton got to prove himself, which ended up happening way quicker now)."
  **Bulls @ Kings**  [](/CHI) **124 -  128** [](/SAC)  **Box Scores: [NBA](http://www.nba.com/games/20210106/CHISAC#/boxscore) &amp; [Yahoo](http://sports.yahoo.com/nba/chicago-bulls-sacramento-kings-2021010623)**  |**Team**|**Q1**|**Q2**|**Q3**|**Q4**|**Total**| |:---|:--|:--|:--|:--|:--| |Chicago Bulls|25|34|34|31|124| |Sacramento Kings|28|34|31|35|128|  **TEAM STATS**  |**Team**|**PTS**|**FG**|**FG%**|**3P**|**3P%**|**FT**|**FT%**|**OREB**|**TREB**|**AST**|**PF**|**STL**|**TO**|**BLK**| |:--|:--|:--|:--|:--|:--|:--|:--|:--|:--|:--|:--|:--|:--|:--| |Chicago Bulls|124|49-93|52.7%|14-40|35.0%|12-15|80.0%|10|43|27|21|3|14|2| |Sacramento Kings|128|47-91|51.6%|14-37|37.8%|20-27|74.1%|12|39|30|16|8|7|3|  **TEAM LEADERS**  |**Team**|**Points**|**Rebounds**|**Assists**| |:--|:--|:--|:--| |Chicago Bulls|**36** Coby White|**17** Wendell Carter Jr.|**7** Coby White| |Sacramento Kings|**24** Richaun Holmes|**12** Marvin Bagley III|**6** Tyrese Haliburton|
How the fuck did 11 teams pass up on Tyrese Haliburton? This man looks like the best rookie by far at the moment.
"If it is between Lamelo and Tyrese, it will go to Lamelo without a doubt. Unless Haliburton gets starting minutes, his contribution on the floor will be overlooked."
Apparently AK and the FO really likes both Patrick Williams and Tyrese Haliburton so that’s a good thing
Tyrese Haliburton.   Any objections?
Tyrese Haliburton boomed us
Tyrese Haliburton is the Kings second best player. He’s played six games. It’s seriously night and day when he’s in the lineup. I love him.
Tyrese Haliburton looked like Chris Paul. Corey Joseph looked like Piss Crawl.
Is it crazy to say Tyrese Haliburton is already the Kings 2nd best player? He’s fucking ridiculous
"if you had to build an nba franchise around one player would you choose michael jordan, lebron james, or tyrese haliburton"
Who is Tyrese Haliburton?  in math: my solution ➗ in history: my king 👑 in art: my muse 🎨 in science: my oxygen 💨 in geography: my world 🌎  But for real this kid is actually the most important player on this team already. I’m in awe.
TYRESE HALIBURTON&gt;PRIME MICHAEL JORDAN
Who will stop the vaunted Tyrese Haliburton/Richaun Holmes pick and roll?
tyrese haliburton will win ROTY
"Tyrese Haliburton (born February 29, 2000) is an American basketball player for the Sacramento Kings of the National Basketball Association (NBA)."
Edwards- dwyane wade/anthony masons  Wiseman- anthony randolph/marvin bagley  Lamelo ball- jason williams  Payton pritchard- muggsy bogues  Immanuel quickly- lou williams  Tyrese haliburton- george hill
Tyrese Haliburton - Magic Johnson
"A lot of us wanted Patrick Williams and thought he would still be on the board at 12 while Haliburton would be long gone. Then Patrick's stock went through the roof, and Tyrese fell. Funny how that happens. You won't find a single Kings fan that's disappointed with Tyrese though."
The Haliburton thing is going to look rough for a lot of teams imo. Tyrese was projected to go as high as top 6 for a reason.
"Wood has been very good, but I’m not really surprised by it after his post-Drummond-trade play. Nor am I surprised by Sabonis - he’s an excellent player and was an All-Star last year for a reason.  I’m surprised by Aquaman’s on/off numbers. And I’m surprised by just how great Tyrese Haliburton has looked early on."
"I'm genuinely curious what they do with Fox, Haliburton, Hield and HB. Who's the odd man out? Do they move HB and run Hield at the 3 so Tyrese can can play the 2. Or trade Hield and run HB. Or trade Fox (least likely thing to happen, I know)    It's going to be interesting what happens in Sacramento this season"
(pre-injury) Jonathan Isaac   Tyrese Haliburton   Lamelo Ball   Ja Morant   Dame   Draymond   Coby White   Aleksej Pokuševski    Zion   Anthony Edwards   Jarrett Allen   Seth Curry
"These are not my predictions but simply my picks right now, two weeks into the season.  MVP: James Harden (37! ppg)  DPOY: idk...Joel Embiid maybe  ROTY: Tyrese Haliburton...although I think LaMelo pulls ahead by the end of the season  6MOY: Terrence Ross  MIP: Christian Wood. Jaylen might be slightly better this year but Wood made a bigger jump from last year.  COTY: Monty Williams"
Tyrese Haliburton
Tyrese Haliburton
Tyrese Haliburton been goin off
"Tyrese Haliburton, the ROTY"
Tyrese Haliburton
Tyrese Haliburton obviously
Tyrese Haliburton
ESPN is always useful to test. Especially when it comes to their Ball obsession:  Boban Marjanovic: About 2.490 results  Shai Gilgeous Alexander: About 3.040 results Alex Caruso: About 7.880 results Ja Morant: About 35.000 results   Lamelo Ball: About 80.900 results  Tyrese Haliburton: About 2.820 results Anthony Edwards: About 43.100 results James Wiseman: About 34.800 results Theo Maledon: About 422 results Killian Hayes: About 1.150 results
Tyrese Haliburton will be the best player out of the class
https://www.nbcsports.com/bayarea/warriors/nba-rumors-warriors-high-deni-avdija-devin-vassell-draft  https://www.nbcsports.com/bayarea/warriors/nba-rumors-warriors-would-likely-draft-anthony-edwards-if-available  https://bleacherreport.com/articles/2897309-warriors-rumors-gsw-high-on-tyrese-haliburton-ahead-of-2020-nba-draft  Just a quick google search
"Some are just obvious though. Like, you don't need to watch 7 years of NBA basketball to figure out why drafting Jalen Smith over Tyrese Haliburton was a bad choice."
"Tyrese Haliburton, Jordan Clarkson, Norman Powell, Montrezl Harrell, Enes Kanter"
"True! And look at how bad the picks were. Tyrese Haliburton, who would have gone No. 1 if he had played another collegiate year, was only picked at No. 12 by the Sacramento Kings. And yet he is the only real threat to LaMelo's RoY run.   What happened to Anthony Edwards? The greatest offensive rookie, except he lacks one factor: teamwork. Any teamwork at all. A star forward should average more than two assists in thirty minutes. Especially when working with other offensive players that also lack cohesiveness."
https://kingsherald.com/draft-news/2020-nba-draft-tyrese-haliburton-sacramento-kings-lowe-post/
"Eh, we got lots of dudes to watch in the NBA (so we don't have to watch the Flyin' Pr0-16hms this year). Monte Morris, Georges Niang, THT, Matt Thomas, Abdel Nader, Haliburton. All having solid years, and all but Tyrese on good-ish teams."
Listen to JJ Reddick talk about his ejection with Tyrese Haliburton. It absolutely sounds like profanity at a ref is an automatic punishment. He doesn't dispute at all that he deserved his first tech for swearing.
"I know r/nba doesn't like it but there are a lot of things you can't say to the official. Reddick was just talking about it with Tyrese Haliburton, and JJ said he agreed with the first tech he got for swearing. Tyrese said he'd never heard anyone swear at an official until the NBA. Booker probably crossed the line twice."
"Tyrese Haliburton in the month of february - 16.1 pts, 3.8 rebs, 5.3 asts, and 1.8 stls with only 1.4 TOVs per game on 51.3/45/83.3 shooting splits  Dude may not be flashy but damn he’s a great player, everyone says it but if you didn’t know any better you would think he’s a vet"
"Tyrese Haliburton talks about the difficulty in guarding Kelvin Benjamin, and how during a trip to Golden Corral as Kelvin stepped back into a 3-point stance and swallowed three handfuls of breaded shrimp, James Harden yelled ""Can I have this ranch dressing, Kelvin!"" It was nothing but diarrhea."
"Tyrese Haliburton talks about the difficulty in guarding Kyrie, and how during an iso as Kyrie stepped back into a 3-point shot and let it go, James Harden yelled ""Can I have this dance, Kyrie!"" It was nothing but net."
"Lamelo &gt; Tyrese Haliburton &gt; Immanuel Quickley for the rookie standings. Come on now, Chuck."
Clearly your teams still having draft issues seeing as they selected tyrese haliburton when guys like Immanuel Quickley were on the board
"For the uninitiated, the Kings roster. (Positions could be debated)  PG: De'Aaron Fox | Tyrese Haliburton | Jahmi'us Ramsey  SG: Buddy Hield | Cory Joseph | Kyle Guy | Justin James  SF: Harrison Barnes | DaQuan Jeffries  PF: Marvin Bagley III | Jabari Parker | Nemanja Bjelica  C: Richaun Holmes | Hassan Whiteside (Out) | Norvel Pelle  Whiteside's out for Health and Safety Protocols. Luke Walton's not a good coach, but how the heck is he supposed to win games with that roster? Fox is good, Hield will get his, Barnes is solid, and Bagley/Holmes are not terrible but they're below-average starters. Somehow though, their bench is even more dire. How many of these guys would even start on a good team? I think it's a bit extreme, but only Fox and Hield/Barnes could start for certain teams. I don't think anyone past Bagley/Holmes/Haliburton would crack a rotation, and some of those (like Bagley) would even be questionable."
[Don’t mind me ](https://www.google.com/amp/s/www.nydailynews.com/sports/basketball/knicks/ny-tyrese-haliburton-kermit-meme-20210123-4gzqkxxjabhp7gso4jwnqos2vm-story.html%3foutputType=amp)🐸☕️in all seriousness tho gg kings
Tyrese Haliburton esque
