"I’m betting on San Antonio.   I think it’ll eventually come down to CJ or a package of rotational players and picks. I think Philly will opt for the package of players to try and recoup possible future assets for a bigger trade. When it gets to that point the 3 teams I see bidding against each other are Minnesota, Sacramento, and San Antonio.   When comparing deals for these teams I’m going to assume a few guys are just off limits so those being De’Aaron Fox, Tyrese Haliburton, Karl-Anthony Towns, D’Angelo Russell, Anthony Edwards, and Dejounte Murray.   To keep everything fair for hypothetical reasons I’ll say each team trades a unprotected pick, protected pick and a swap along a starter level player, rotational player, and a player on a rookie deal. So deals of something like;  Malik Beasley, Jaden McDaniels, Taurean Prince, 2022 top 5 1st, 2024 pick, 2025 swap   Derrick White, Devin Vassell, Thaddeus Young, 2022 top 5 1st, 2024 1st, 2025 swap   Buddy Hield, Davion Mitchell, Marvin Bagley?, 2022 top 5 1st, 2024 1st, 2025 swap.  Looking at it like this I would instantly rule out Minnesota. I think they have the worst collection of players here (outside of McDaniels I’d probably take him over Mitchell and Vassell but it’s not a large gap at all) and when it comes to future value of those picks I think they’d be a playoff team and those picks would project to be late teens to mid 20 picks. Along side that Minnesota virtually has nothing of value to add to compete against other offers other than picks, and their whole team is just consisted of 4 players.   That leaves it between Sacramento and San Antonio. To me both teams add something of value to Philly SAS gives them a Swiss Army knife half court ball handler, SAC gives them a high level floor spacer, and to me Mitchell and Vassell are equal in value and have similar skillsets despite playing different positions. I think the main swing factor here is if Sacramento throws in Harrison Barnes or not. If Harrison banes is replaced with Bagley I’ll go Sacramento without a doubt, but if not I don’t see what other quality rotational or player with value sac can really add to entice Morey (I wouldn’t take Bagley or TT over Thaddeus Young). Unlike Minnesota I think despite adding Simmons both teams could still realistically miss the playoffs which makes those draft picks more valuable, and I think both teams can take the depth hit when trading Quantity for Quality. I think even more so San Antonio can with how many players they have still on rookie deals, and if needed to they could probably throw in even more players like Walker IV or more picks like the bulls one they just got.   Did I just damn near write an essay on Ben Simmons trade destinations? Yes. Is it flawed? Probably am I bored? Also yes"
Tyrese Haliburton
tyrese haliburton. he'll be good but not great i think
This year the Kings didn't play the Lakers in May but 1 day before on April 30th the Kings beat the Lakers with Tyrese Haliburton scoring the most points by either team.
"Simmons value has completely plummeted. He was gonna get James Harden and now he can’t even get Tyrese Haliburton. PG had a bad series but if he went on the trade block that season, tons of teams would’ve wanted him."
"I understand not wanting to pay the high price Morey's asking right now (which is exactly what he should be doing incase one of the lower tier GMs tries to ""meet us in the middle"" and still overpay), but we're also not giving hi away for nothing either.  I'm sorry, but if Sac isn't willing to part with Tyrese Haliburton and picks, then there's no way this happens.  I understand Fox, but you have to be willing to give up something of value.  This isn't the Philadelphia fucking fire sale."
"3 team trade idea that Kings fans will probably get mad about:  Golden State Warriors: Ben Simmons, Damian Jones (for salary purposes)  Philadelphia 76ers: Harrison Barnes, Buddy Hield, GSW 1st round pick  Sacramento Kings: Draymond Green, Shake Milton, Kevon Looney (for salary purposes), 2 GSW 2nd round picks  **Why the Warriors do it**:  I think everybody agrees that Ben Simmons is the best Draymond Green successor the Warriors could possibly find in terms of style of play. Everything the Warriors have done the last 2 offseasons has been about trying to extend their window of contention for as long as possible, and this move is in a similar vein. Furthermore, Draymond Green is going to suffer age related decline faster than most players, and as he gets older is going to be more of a 5 than a 4, and the Warriors remain committed to James Wiseman. This move undoubtedly makes them worse in the short term as Draymond is a better player than Ben Simmons, but the Warriors don't seem to care that much about the upcoming season, evidenced by them being very conservative with Klay.   **Why the Sixers do it**  This move is all about maximizing fit and spacing around Joel Embiid. This move unlocks Tyrese Maxey and clears the way for him to be the starting point guard. Their starting 5 becomes Maxey/Hield/Barnes/Harris/Embiid with Seth Curry a strong contender to win 6MOY. That starting 5 has lots of shooting to surround Embiid, and in Barnes, they get the wing defender to replace Simmons as well as a solid 16-18 PPG scorer, and in Hield, they get the 3-point sniper that Embiid can run the lethal DHO actions with, something he had great success with when he played with JJ Redick.   **Why the Kings do it**  Alright, I admit this one is kind of a hard sell. But hear me out. Draymond Green is still a more valuable and better player than Harrison Barnes, and is a better fit around the young backcourt that Sacramento is trying to build around with Fox and Haliburton. Sacramento was the #30 defense in the league last year by Cleaning the Glass, and they could use a still DPOY caliber player on that end of the floor, as well as a vocal leader, much more than they need Harrison Barnes' ISO scoring. Draymond can be the necessary bad cop to Luke Walton's good cop.   As for Buddy Hield, his role on the team has been marginalized with every passing year, and has been in trade rumors for years, at this point the Kings want off his contract as he is their 4th guard and they get Shake Milton from the Sixers to be said 4th guard and lead the bench along with rookie Davion Mitchell. This move does leave them light at the 3 as Terence Davis(?) becomes their starter at that position. However, they would have a lot of shot creation in their backcourt (Fox, Haliburton, Mitchell, Shake), and the requisite intelligent defensive bigs to complement them with Draymond, Holmes, and Tristan Thompson as the backup 5. They also pickup a valuable 3rd string center in Kevon Looney.  This move is made by the Kings with an eye towards trying to compete for the playoffs NOW by getting a proven leader and defensive presence in the team, and let's not forget that Draymond Green shoots 3s well when Steve Kerr is not the coach of the team, evidenced by his outrageous run at the start of the 2016 season under current Kings coach Luke Walton, and in the 2017 playoffs when Mike Brown was the interim coach."
"Um, yes you should absolutely trade Haliburton for Simmons. Is everyone in this thread insane?  I can't believe the comments in this thread. Tyrese Haliburton is not even close to the level of Ben Simmons, despite how badly Ben shits the bed in the playoffs, he's still runner up DPOY and is obviously going to come out of the off season somewhat improved. Insanity."
Monte Mcnair is not trading Tyrese Haliburton nor Davion Mitchell he is not Vlade Divac God Bless 🙏🙏
"I think *ideally* for Philly, and **this is a longshot to happen** is a trade to the Raptors for OG and FVV.  Ben has a lot of faults, but the two things he can provide are ball-handling and defending the opponent's best player. Having both of those duties for 1 player is huge and to realistic replace those duties it'd require 2 players back. FVV and OG provide that.  A shittier version of that would be one of Davion Mitchell/Tyrese Haliburton and Harrison Barnes.   That's always been my issue with a CJ trade - Philly is going to kick and scream to get Robert Covington back too because if Ben's gone - who's going to defend the 3 on the 76ers? Old-ass Danny Green?"
Tyrese Haliburton
Tyrese Haliburton
Doug Christie and Tyrese Haliburton
Tyrese Haliburton will be a multiple time all star 🤞
I like Tyrese Haliburton. And I like the Marvin Bagley III memes.
"&gt; The Kings have a logjam at guard with Fox, Tyrese Haliburton, Davion Mitchell and Buddy Hield  if only they weren't forced at gunpoint to keep drafting guards even though there were good non-guard prospects on the board and they already had good guards"
"It’s a necessary question when looking how things behind the scenes factor into player development. A point Jerry makes is Tyrese Haliburton would not have developed if he was drafted when Cousins was here because of how Boogie feasted on rookies, especially ones as nice as Haliburton."
Not a superstar (yet) but Tyrese Haliburton is cool asf
Tyrese Haliburton should be on everyone's radar.
"Buddy Hield, Tyrese Haliburton, Harrison Barnes and Richaun Holmes is on par with Grayson Allen, Dillon Brooks, Jonas Valanciunus and Kyle Anderson"
Tyrese Haliburton
Tyrese Haliburton and Anthony Edwards
Davion Mitchell Tyrese Haliburton and De’Aaron Fox are bringing the kings back to the playoffs
  **Warriors @ Kings**  [](/GSW) **119 -  107** [](/SAC)  **Box Scores: [NBA](http://www.nba.com/games/20211024/GSWSAC#/boxscore) &amp; [Yahoo](http://sports.yahoo.com/nba/golden-state-warriors-sacramento-kings-2021102423)**  |**Team**|**Q1**|**Q2**|**Q3**|**Q4**|**Total**| |:---|:--|:--|:--|:--|:--| |Golden State Warriors|29|31|30|29|119| |Sacramento Kings|31|31|26|19|107|  **TEAM STATS**  |**Team**|**PTS**|**FG**|**FG%**|**3P**|**3P%**|**FT**|**FT%**|**OREB**|**TREB**|**AST**|**PF**|**STL**|**TO**|**BLK**| |:--|:--|:--|:--|:--|:--|:--|:--|:--|:--|:--|:--|:--|:--|:--| |Golden State Warriors|119|43-97|44.3%|13-37|35.1%|20-24|83.3%|14|43|26|13|12|6|3| |Sacramento Kings|107|42-86|48.8%|15-46|32.6%|8-13|61.5%|10|47|26|16|0|19|4|  **TEAM LEADERS**  |**Team**|**Points**|**Rebounds**|**Assists**| |:--|:--|:--|:--| |Golden State Warriors|**27** Stephen Curry|**9** Otto Porter Jr.|**10** Stephen Curry| |Sacramento Kings|**24** Harrison Barnes|**11** Richaun Holmes|**9** Tyrese Haliburton|
Davion Mitchell/Tyrese Haliburton and okay? Shot's a little off but it just looks like it's still standard early-season Steph rust
Davion Mitchell Tyrese Haliburton and De’Aaron Fox will bring the kings back to the playoffs
  **Jazz @ Kings**  [](/UTA) **110 -  101** [](/SAC)  **Box Scores: [NBA](http://www.nba.com/games/20211022/UTASAC#/boxscore) &amp; [Yahoo](http://sports.yahoo.com/nba/utah-jazz-sacramento-kings-2021102223)**  |**Team**|**Q1**|**Q2**|**Q3**|**Q4**|**Total**| |:---|:--|:--|:--|:--|:--| |Utah Jazz|24|22|35|29|110| |Sacramento Kings|26|26|28|21|101|  **TEAM STATS**  |**Team**|**PTS**|**FG**|**FG%**|**3P**|**3P%**|**FT**|**FT%**|**OREB**|**TREB**|**AST**|**PF**|**STL**|**TO**|**BLK**| |:--|:--|:--|:--|:--|:--|:--|:--|:--|:--|:--|:--|:--|:--|:--| |Utah Jazz|110|37-90|41.1%|16-42|38.1%|20-23|87.0%|13|51|16|17|14|17|3| |Sacramento Kings|101|39-99|39.4%|8-36|22.2%|15-21|71.4%|16|52|20|22|15|15|5|  **TEAM LEADERS**  |**Team**|**Points**|**Rebounds**|**Assists**| |:--|:--|:--|:--| |Utah Jazz|**27** Donovan Mitchell|**20** Rudy Gobert|**4** Donovan Mitchell| |Sacramento Kings|**25** Harrison Barnes|**15** Harrison Barnes|**6** Tyrese Haliburton|
"eh, we got a lot of work to do. bagley is benched and we lost the rebounding battle and play small all game. that'll be a problem all season. our offense turned into 1 on 1 hot garbage at the end of the 4th quarter. tyrese haliburton is struggling in his new role. fox can't get any calls."
"I don't know, it's year 4 of the rebuild. Sexton has to get paid next season, or traded before that. Garland has one more year on a cheap deal. The Love contract clogs up the books enough that they are capped out if they pay Sexton. Then when he expires, the same thing happens with Garland. You're paying two guys who can't both play next to Mobley. You've got this thread talking about whether Okoro is a fucking starter while they question whether or not Sexton is a real long-term piece...but they drafted Okoro over Tyrese Haliburton, who's really fucking good because they already had Sexland.   It's bad roster management."
By who? Buddy Hield? Tyrese Haliburton? Harrison Barnes?
De’Aaron Fox Tyrese Haliburton and Davion Mitchell are bringing the kings back to the playoffs
1. Romeo Langford.  2. Aaron Nesmith.  3. Robert Williams.  4. Jordan Poole.  5. Terrence Mann.  6. Jordan Nwora.  7. Isaiah Joe.  8. Mikal Bridges.  9. OG Anunoby.  10. Tyrese Haliburton.
"I really liked him coming out of Maryland, and still think he can have some NBA upside. But Tyrese Haliburton was right there."
"I think the challenge is that the drama stuff is way more universal and easier to talk about than game content. As a Thunder fan, I want to read and discuss game content about Thunder games and players but haven't watched enough of Talen Horton-Tucker to be able to discuss his play. As a Lakers fan, you probably want to read and discuss game content about the Lakers but probably don't have much to say about Darius Bazely.  However, when Kyrie Irving says the earth is flat, that's an easy discussion point to all of us because everyone on this forum knows who Kyrie is and is generally familiar with accepted cosmology. There's no barrier to entry to discussion.  We'd all love to *read* other people's analysis of how the Kings' defensive schemes don't properly utilize the talents of Tyrese Haliburton or whatever, but this content takes a significant amount of effort (research, film study, analytics code/spreadsheets, visualizations, etc) to *produce*. Any OC on this forum with the slightest modicum of effort and insight is instantly upvoted to the top, but you can't upvote what isn't there. I tried to write up a film study thing for /r/cfb earlier this season, but my god it takes *so. much. time* to produce something worthwhile.  Commenting ""lmao I bet Jimmy Butler and Rachel Nichols hooked up"" or ""lmao MPJ finally found a shot he won't take"" takes 3 seconds."
Herro (idk if he counts) if he doesn't- Tyrese Haliburton  Jaren Jackson Jr  Grayson Allen
"Blowout trade idea of the day. Just made impossible due to Brogdon's extension but I want to get thoughts on it anyway:   **Sixers receive:**   * Malcolm Brogdon  * Andrew Wiggins  **Warriors receive:**  * Domantas Sabonis  * Buddy Hield  **Pacers receive:**  * James Wiseman  * Davion Mitchell  * Marvin Bagley  * Seth Curry  * Kings 1st  **Kings receive:**  * Ben Simmons  * Furkan Korkmaz  Sixers starting 5: Malcolm Brogdon/Danny Green/Andrew Wiggins/Tobias Harris/Joel Embiid  Warriors starting 5 (by playoffs): Steph Curry/Jordan Poole/Klay Thompson/Draymond Green/Domantas Sabonis  Pacers starting 5: Seth Curry/Caris Levert/TJ Warren/Marvin Bagley/Myles Turner  Kings starting 5: De'Aaron Fox/Tyrese Haliburton/Harrison Barnes/Ben Simmons/Richaun Holmes  Sixers flip Ben Simmons and Seth Curry into Malcolm Brogdon and Andrew Wiggins, fixing their roster construction. They're a better playoff team than before.   Warriors turn Wiggins and Wiseman into all-star Sabonis and flamethrower Buddy Hield. We'd have Steph/Poole/Hield as guards, Klay/Otto/Kuminga/Moody/Iguodala/Juan as wings, Dray/Bjelica/Looney as our bigs. That's solid top to bottom.   Kings flip two of their excess guards and a failed prospect plus a pick for Ben Simmons and a bench guard, it's a no brainer for them. Fox/Haliburton/Barnes/Simmons/Holmes is the best lineup they would have put out in a long time  Who says no?"
"Some interesting things in these tweets   On Bey vs Green &gt; Its too early to tell, this is not a knock on S Bey at all but the All Rookie teams historically have been roughly sorted by ""minutes played as a rookie""  What’s the main thing you’ve learnt being inside a team vs outside? Did you underestimate how hard it is? &gt; How Machiavellian and cut throat ppl were while attempting to advance.  On Mavs  &gt; A few ppl in the org enjoyed telling players that I was considering trading them, thinking it would do me harm without really considering the implications it would have on the actual player.   &gt; I was never the GM nor Shadow GM. I never discussed trades with other teams.   &gt; Mavs had a GM and an an owner who generally made the final decision.   &gt; I was just one of many voices albeit at times a very influential one.   &gt; Ones that got away chronologically;  &gt; * Mikal Bridges * Duncan Robinson  * R Covington * Mattise Thybulle * Alex Caruso * Christian Wood * Tyrese Haliburton.   &gt; There were a few that likely would not have worked out too  Q. What do you mean by ones that got away  &gt; Either couldn't pull of a deal - or couldn't convince the powers that be to make the deal."
"Aint no one triggered by no truth lmaoo what truth that De’Aaron Fox, Tyrese Haliburton and Davion Mitchell are bringing the Kings back to playoffs? Clearly you’re the one that’s triggered by all these HYPOTHETICALS that you clearly dont seem to understand because you’re a laker fan that just spew nothing but bullshit thinking they know exactly how the seasons gonna go 😂😭 all Im doing is matching that same energy which is obviously is what triggered YALL 😭 like i said so fucking pathetic lmao but what else should i have expected from laker fans 😂😭"
"That’s cool bro De’Aaron Fox, Tyrese Haliburton and Davion Mitchell are still bringing the Kings back to playoffs, and you are correct, this isn’t the east 😭😂😂"
"De’Aaron Fox, Tyrese Haliburton and Davion Mitchell are bringing the Kings back to playoffs"
"The Kings have De’Aaron Fox, Tyrese Haliburton, and Davion Mitchell GUARANTEED for the next 5 years so Kangz"
"Bias but a few of the Kings players.  Tyrese Haliburton. Able to initiate the offense or be the secondary playmaker. Efficient shooter. Smart player and a cheap contract.  Buddy Hield. Every team could use an elite shooter.  And maybe Harrison Barnes? Had a great year shooting 39% from 3. Good size, solid defense, just a steady player all-around."
"Turns out Vlade Divac was not a very good GM and hiring someone competent brought reasonable (expected) improvement. Hopefully, no more striking out on limited, raw, paint-anchored bigs from here on out!  2015: Picked Willie Cauley-Stein (Round 1: Pick 6) [yikes though this draft was a minefield at this point]  2016: Shipped the 8th pick (Marquese Chriss) PHX for the rights to Bogdan Bogdanovic (good move) and the 13th (Georgios Papagiannis) and 28th (Skal Labissiere) picks [good move, though lots of bleh in this trade]  2017: Picked Fox (great) but also picked Zach Collins for the Trail Blazers and shipped him to Portland for Justin Jackson (15th) and Harry Giles (20th) [debatable, lots of players that never fully panned out]  2018: Picked Bagley (2nd) ahead of Luka/JJJ/Trae and shipped out Gary Trent Jr. on draft day for future picks [biggest mistake by far]  2019: No 1st round pick because of the infamous Stauskas salary dump in 2015, almost certainly engineered by Divac. Pick was the 14th and used to pick Romeo Langford.  Divac steps down, new GM Monte McNair picks Tyrese Haliburton and Davion Mitchell in 2020 and 2021, respectively."
"Josh Giddey aka next season’s Tyrese Haliburton, special enough to be talked about but will not compare to the obvious future stars when guys like Mobley/Green/Cade are showing huge impact"
"&gt;  The Pistons would “entertain” trading Jerami Grant for Simmons, the Sixers don’t seem interested in a Spurs package including Dejounte Murray and Lonnie Walker IV (which is fair enough), and the Kings aren’t discussing any deals that include either De’Aaron Fox or Tyrese Haliburton.  If those are still the deals on the table in December I don't think a trade is likely.  Grant is fine and on a fair deal but i'd rather wait for Ben to come around, at least until closer to the trade deadline."
"High: Was a fan of these players before they got drafted and often wondered why they werent picked a bit higher.   Dwyane Wade, Donovan Mitchell, John Collins, Deandre Jordan, Andre Iguodala, Danny Granger, Paul George, Joakim Noah, Roy Hibbert, Jrue Holiday, Kawhi Leonard, 	   Domantas Sabonis, Tyler Herro, Nickeil Alexander-Walker, Tyrese Haliburton.   &amp;#x200B;  Wrong: I thought these players would be pretty good before the draft.  Marcus Williams, Ben McLemore, Rodney Stuckey, Chris Douglas-Roberts, Earl Clark, Wesley Johnson, Kévin Séraphin, Andrew Nicholson, Nerlens Noel, Rashad Vaughn, Justin Patton, Wendell Carter Jr., Goga Bitadze.'Too soon, but I was high on Jalen Smith, Zeke Nnaji."
"From https://www.onlinegambling.com/news/nba-most-improved-player-odds-kpj-mpj-sga-2022-mip/. Sorry no Lu Dort.  2022 NBA Most Improved Player Odds      Michael Porter, Jr +900      Kevin Porter, Jr +1000      Shai Gilgeous-Alexander +1500      Collin Sexton +1500      Jaren Jackson, Jr +1500      Jordan Poole +1500      Zion Williamson +2000      Christian Wood +2200      De’Aaron Fox +2200      Zach LaVine +2500      Tyrese Haliburton +2500      OG Anunoby +2500      Domantas Sabonis +2500      RJ Barrett +3000"
ever heard of tyrese haliburton bitch
"I've said for a minute that if Sacramento is serious on the Simmons sweepstake that the offer would have to be Harrison Barnes, TT and one of either Davion Mitchell/Tyrese Haliburton."
Tyrese Haliburton
Tyrese Haliburton
  **Kings @ Clippers**  [](/SAC) **113 -  98** [](/LAC)  **Box Scores: [NBA](http://www.nba.com/games/20211006/SACLAC#/boxscore) &amp; [Yahoo](http://sports.yahoo.com/nba/sacramento-kings-los-angeles-clippers-2021100612)**  |**Team**|**Q1**|**Q2**|**Q3**|**Q4**|**Total**| |:---|:--|:--|:--|:--|:--| |Sacramento Kings|28|23|38|24|113| |Los Angeles Clippers|22|29|17|30|98|  **TEAM STATS**  |**Team**|**PTS**|**FG**|**FG%**|**3P**|**3P%**|**FT**|**FT%**|**OREB**|**TREB**|**AST**|**PF**|**STL**|**TO**|**BLK**| |:--|:--|:--|:--|:--|:--|:--|:--|:--|:--|:--|:--|:--|:--|:--| |Sacramento Kings|113|44-98|44.9%|14-43|32.6%|11-17|64.7%|10|50|24|21|9|12|8| |Los Angeles Clippers|98|35-92|38.0%|9-35|25.7%|19-25|76.0%|14|56|19|17|8|19|6|  **TEAM LEADERS**  |**Team**|**Points**|**Rebounds**|**Assists**| |:--|:--|:--|:--| |Sacramento Kings|**23** De'Aaron Fox|**11** Tristan Thompson|**5** Tyrese Haliburton| |Los Angeles Clippers|**20** Brandon Boston Jr.|**7** Brandon Boston Jr.|**4** Eric Bledsoe|
"Hi I’ve been drinking a lot of purple kool-aid these past few weeks  The Kings are gonna make a big jump. I’m not even exaggerating when I say they can even get up to 6th seed, but that’s assuming a lot goes wrong for other teams, like the blazers, clippers, warriors, and Mavs— and of course all the other potential play-in teams like minny, nola, and San Antonio  Of course I’m expecting us somewhere around 9-10. BUT kings have a few things working for us  Fox is a beast, and if he improves even more, like he has pretty much every season, he’s at an all star level. Tyrese Haliburton kicks ass and is going to be solid no matter what. Harrison Barnes is underrated af and at least league average. Richaun Holmes has like 95% accurate hook shot and can play great defense, and is a great roller on offense.   Our bench is the deepest it’s been in like 10 years. Yeah, it’s not the best, but now with guys like Buddy off the bench, Bagley if he makes a double jump- in terms of defense and health (he can be a walking 18/8), Alex Len to give us some size, Terence Davis for extra shooting and some defense, Harkless and TT for the vet presence, and potential up-and-comers like Chimezie Metu (ask Spurs fans) and our boy Davion MITCHELL to round it out  Obviously last year we had one of the statistically worst defenses ever, but we saw it get better to the end of the season. We got a couple new defensively minded assistant coaches in Doug Christie and Longabardi, we got some grittier players in our rookie Davion Mitchell AKA Off-Night, Terence Davis, Mo Harkless, Alex Len, and hopefully we embrace the chip on our shoulder of not being in the playoffs for so long  So, yeah I could go on and on about why I think we’ll be better. Even with Luke Walton, even with our shitty defense last season, even with our lack of traditional forwards. The kings are making a jump this year, into the play-in at least and hopefully right into the playoffs  I know the Kings are the joke of the league and have been for a long time but it ends this season. From Sacramento we’re gonna see a jump like the Knicks, hawks, and Suns had last year.   When all the media and you motherfuckers look back at the end of the season and go “wow we had no idea they were gonna be so good” I want you to look back at posts like these cause goddamn it some of us knew it was coming"
