"* Zion Williamson and **Chris Paul**. CP3's playmaking can help open the floor for Zion, and he won't be taking shots away from him like other ball-dominant guards. Also, the lobs would be fun. Bam Adebayo is another good option, a solid secondary playmaker who can cover for Zion's defensive limitations thanks to his versatility.  * LaMelo Ball and **Nikola Jokic**. LaMelo has thrived this year thanks to Hornets' ball-sharing system, which lets him function as a playmaker and an off-ball threat. Jokic is the perfect fit for that, even if Melo/Jokic would be serviceable at best on defense. Of course, if Melo-Jokic pick and pops aren't your speed, Melo-Zion would also be fun, again because of lobs.  * Tyrese Haliburton and **Damian Lillard**. Hali doesn't iso a lot, usually having others set up his shots for him, but is a great playmaker. Dame can create his own shot with ease, but isn't a spectacular playmaker, and can be worn down if he has to have the ball in his hands on every possession. The strengths perfectly complement each other's weaknesses. Hali and Steph would also be a really fun pairing, or Hali and Jimmy Butler."
**tyrese haliburton**
It was LaMelo for the majority of the season then he got hurt and Edwards became the front runner and then I don't think he will win over the two of them but I do want to mention Tyrese Haliburton has been pretty good and out of the three of them the most consistent.  Edwards has been erratic and his play has improved but it's happened to be when the Timberwolves have gone into tank mode and let him start chucking.  And I see all of the LaMelo Ball talk and I've been watching all season and I recognize the talent and creativity but I also see a kid who has a decent amount of holes in his game and I remember when they were taking him out of games in the fourth quarter when the game was on the line.  Both Edwards and Ball have the potential to be really great players in this league but I have to point out that right now both have quite a few wart's in their game.  While Haliburton doesn't have the long term potential as them he's been really good all season and steady. I don't think he's going to win but I do want to point out that for the duration of the season he's been the most consistent rookie this year.
&gt;	Tyrese Haliburton has been ruled out for the rest of the game due to a left knee injury.  https://twitter.com/espn_macmahon/status/1389036488285818882?s=21
"probably no one right now but there are guys coming in to the league who will absolutely get opportunities to chuck a lot in their first 2 years. ANT is gets 7 3PA a game and he's not even a good shooter. if tyrese haliburton had found himself on the rockets or wolves or something instead of the kings he might be getting a ton of attempts too. cade might end up on either of those teams and he's a guy who could get a lot of run his rookie year, and be in a ball dominant position."
"I just want to plug my video I made of him a while ago because it shows some more of his more mature plays, so you guys can see something other than highlights about him:  Tyrese Haliburton - Floor General of the Future https://youtu.be/O0EpVM3eVkU"
  **Kings @ Lakers**  [](/SAC) **110 -  106** [](/LAL)  **Box Scores: [NBA](http://www.nba.com/games/20210430/SACLAL#/boxscore) &amp; [Yahoo](http://sports.yahoo.com/nba/sacramento-kings-los-angeles-lakers-2021043013)**  |**Team**|**Q1**|**Q2**|**Q3**|**Q4**|**Total**| |:---|:--|:--|:--|:--|:--| |Sacramento Kings|30|25|23|32|110| |Los Angeles Lakers|23|33|32|18|106|  **TEAM STATS**  |**Team**|**PTS**|**FG**|**FG%**|**3P**|**3P%**|**FT**|**FT%**|**OREB**|**TREB**|**AST**|**PF**|**STL**|**TO**|**BLK**| |:--|:--|:--|:--|:--|:--|:--|:--|:--|:--|:--|:--|:--|:--|:--| |Sacramento Kings|110|39-86|45.3%|12-33|36.4%|20-22|90.9%|11|37|29|16|10|17|3| |Los Angeles Lakers|106|42-83|50.6%|7-28|25.0%|15-21|71.4%|11|43|24|17|9|21|12|  **TEAM LEADERS**  |**Team**|**Points**|**Rebounds**|**Assists**| |:--|:--|:--|:--| |Sacramento Kings|**23** Tyrese Haliburton|**9** Richaun Holmes|**10** Tyrese Haliburton| |Los Angeles Lakers|**22** Anthony Davis|**11** Anthony Davis|**7** LeBron James|
"Had LAL ML as part of 2 separate 3-leg parlays with other 2 legs locked up (PHO ML, MIL ML and PHO double result, MIL double result).  Also had 2-leg parlay with AD 24+ points and Schroder 8+ assists.  Almost had all those locked up.  AD ended with 22 points and Schroder 7 assists.  Fucking trash LAL, can't even beat a horrible SAC team that is dead last in DRTG and gives up the most ppg in the league.  Oh yeah they were also missing Fox and Barnes, two of their top scores.    Lebron, AD, and company really just lost @ home vs. Tyrese Haliburton, Richaun Holmes, and company.  While up 10 to start the 4th.  LAL managed a measley 18 points in the 4th.  AD is subbed out to start the 4th, doesn't enter back until 6:44 left and lead cut to 3.  LAL scored only 8 points in that 5 minutes and 16 seconds.    In the last 6:44 of the game, Richaun Holmes scores 8 points, 4 of which came via free throws.  Terrence Davis scored 7 points.  Haliburton sealed the game w 2 FT's.  During that same 6:44 remaining, AD scored 4 points, Lebron scored 5 points, and Drummond scored 1 point.  4 turnovers by LAL (2 by Lebron, and those occured within 24 seconds of one another).  4-9 on fg attempts (they only managed two attempts from 6:44 left to 3:11 left, over 3 and a half minutes of game time, and only 2 fg attempts?!?).  Committed 5 fouls which led to 8 SAC points.  Had 5 rebounds which led to a whopping 1 point for LAL.  Had possession for roughly 3:16 in that stretch and managed to only make 4 fg's.  Had 2 blocks which resulted in a whopping 0 points.    I know Lebron just came back tonight and AD is still getting back into rhythm, but my god, what a horrible stretch of the last half of the 4th quarter to lose to the worst defense in the league.  LAL has 3rd best DRTG in the league and SAC had 7 players in double digits.  LAL 7-28 from 3pt!  LAL got outscored by 5 in FT's.  They let a SAC team averaging 79.3% from FT go 90.9% tonight.    4 of the SAC players who scored double digits average under 8 ppg each.  2 of them average 5.2 and 4.3 ppg.    LAL had 21 turnovers.  Their 5th leading scorer in Kuzma managed to score 2 points (!) in 22 minutes.  Only had one starter (Lebron) with a positive +/-.  Had 12 blocks compared to 3 for SAC.    That was a bit therapeutic to write all that.  Sure I'm upset about losing those bets, but it's not like I'm losing my house (say less!).  I know this has been probably one of the weirdest NBA seasons as well due to the shortened, compressed nature of it, and the empty stands and other impacts due to COVID.  I also know LAL is still a title contender, but man, what a loss today.  Vs. the worst defense in the league, a team that had lost 12 of their last 15, and who in their previous game gave up 154 points and lost by 49, a team missing two of their top scorers.    Obviously will take some time for Lebron and AD to get to 100%, but besides them, the team was fully healthy (besides Caruso).  I don't think the Lakers are a team most will want to face in the playoffs, but this game shows how much the injuries to AD and Lebron have affected this team.    Only 9 games left for LAL and 22 days till playoffs start.  I'd be a little bit concerned if I were a LAL fan."
Tyrese Haliburton is the best player in the world and I’m tired of pretending he’s not
I made a whole spreadsheet before realizing I forgot to take position into account.  Top 5 scoring teams are as follows if we're playing positionless and/or small-ball:  |*Team MB -  79.9 PPG*|*Team DB -  77.6 PPG*|*Team JH -  76.5 PPG*|*Team BB -  76.1 PPG*|*Team TH -  72.4 PPG* | |:-|:-|:-|:-|:-| |Malcolm Brogdon - 21.2|Devin Booker - 25.4|James Harden - 25.2 |Bradley Beal - 31.3|Tobias Harris - 20| |Malik Beasley - 19.6|Dillon Brooks - 16.7|Jrue Holiday - 17.3 |Bojan Bogdanovic - 15.7|Tim Hardaway Jr. - 16| |Marvin Bagley III - 13.9|Darius Bazley - 13.4|Joe Harris - 14.5 |Bogdan Bogdanovic - 15.2|Tyler Herro - 14.9| |Mikal Bridges - 13.1|Davis Bertans - 11.4|Justin Holiday - 10.3 |Bruce Brown - 8.8|Tyrese Haliburton - 12.8| |Miles Bridges - 12.1|Dwayne Bacon - 10.7|Josh Hart - 9.2|Bismack Biyombo - 5.1|Talen Horton-Tucker - 8.7|
Tyler Herro  Tyrese Haliburton  Tim Hardaway Jr.  Talen Horton-Tucker  Tobias Harris  lol. no active big available
  **Jazz @ Kings**  [](/UTA) **154 -  105** [](/SAC)  **Box Scores: [NBA](http://www.nba.com/games/20210428/UTASAC#/boxscore) &amp; [Yahoo](http://sports.yahoo.com/nba/utah-jazz-sacramento-kings-2021042823)**  |**Team**|**Q1**|**Q2**|**Q3**|**Q4**|**Total**| |:---|:--|:--|:--|:--|:--| |Utah Jazz|30|46|40|38|154| |Sacramento Kings|27|17|30|31|105|  **TEAM STATS**  |**Team**|**PTS**|**FG**|**FG%**|**3P**|**3P%**|**FT**|**FT%**|**OREB**|**TREB**|**AST**|**PF**|**STL**|**TO**|**BLK**| |:--|:--|:--|:--|:--|:--|:--|:--|:--|:--|:--|:--|:--|:--|:--| |Utah Jazz|154|55-86|64.0%|24-41|58.5%|20-21|95.2%|8|47|36|15|4|13|9| |Sacramento Kings|105|42-87|48.3%|7-21|33.3%|14-17|82.4%|3|24|24|19|8|12|6|  **TEAM LEADERS**  |**Team**|**Points**|**Rebounds**|**Assists**| |:--|:--|:--|:--| |Utah Jazz|**24** Bojan Bogdanovic|**11** Derrick Favors|**7** Joe Ingles| |Sacramento Kings|**18** Richaun Holmes|**5** Chimezie Metu|**8** Tyrese Haliburton|
Tyrese haliburton
  **Mavericks @ Kings**  [](/DAL) **106 -  113** [](/SAC)  **Box Scores: [NBA](http://www.nba.com/games/20210426/DALSAC#/boxscore) &amp; [Yahoo](http://sports.yahoo.com/nba/dallas-mavericks-sacramento-kings-2021042623)**  |**Team**|**Q1**|**Q2**|**Q3**|**Q4**|**Total**| |:---|:--|:--|:--|:--|:--| |Dallas Mavericks|17|35|33|21|106| |Sacramento Kings|31|28|28|26|113|  **TEAM STATS**  |**Team**|**PTS**|**FG**|**FG%**|**3P**|**3P%**|**FT**|**FT%**|**OREB**|**TREB**|**AST**|**PF**|**STL**|**TO**|**BLK**| |:--|:--|:--|:--|:--|:--|:--|:--|:--|:--|:--|:--|:--|:--|:--| |Dallas Mavericks|106|43-92|46.7%|12-42|28.6%|8-14|57.1%|14|40|24|15|9|10|2| |Sacramento Kings|113|42-81|51.9%|13-29|44.8%|16-18|88.9%|11|46|23|15|6|16|4|  **TEAM LEADERS**  |**Team**|**Points**|**Rebounds**|**Assists**| |:--|:--|:--|:--| |Dallas Mavericks|**24** Luka Doncic|**7** Dorian Finney-Smith|**8** Luka Doncic| |Sacramento Kings|**24** Richaun Holmes|**7** Damian Jones|**10** Tyrese Haliburton|
If tyrese haliburton becomes Michael Jordan and Fox turns into Magic Johnson then the Kings could have a dynasty
"Haliburton is a better passer, rebounder and defender than Fox so it really shouldn’t surprise anyone the Kings look better with a true point guard out there alongside Buddy. And I love Fox and watching him play... But I dunno.. I’d sell high if I was the kings and roll with Tyrese."
Tyrese Haliburton - The Weapon of Mass Destruction
  **Kings @ Warriors**  [](/SAC) **113 -  117** [](/GSW)  **Box Scores: [NBA](http://www.nba.com/games/20210425/SACGSW#/boxscore) &amp; [Yahoo](http://sports.yahoo.com/nba/sacramento-kings-golden-state-warriors-2021042509)**  |**Team**|**Q1**|**Q2**|**Q3**|**Q4**|**Total**| |:---|:--|:--|:--|:--|:--| |Sacramento Kings|39|26|27|21|113| |Golden State Warriors|32|31|31|23|117|  **TEAM STATS**  |**Team**|**PTS**|**FG**|**FG%**|**3P**|**3P%**|**FT**|**FT%**|**OREB**|**TREB**|**AST**|**PF**|**STL**|**TO**|**BLK**| |:--|:--|:--|:--|:--|:--|:--|:--|:--|:--|:--|:--|:--|:--|:--| |Sacramento Kings|113|41-86|47.7%|14-37|37.8%|17-22|77.3%|6|38|22|15|8|11|5| |Golden State Warriors|117|46-95|48.4%|14-36|38.9%|11-15|73.3%|16|52|30|16|6|16|3|  **TEAM LEADERS**  |**Team**|**Points**|**Rebounds**|**Assists**| |:--|:--|:--|:--| |Sacramento Kings|**25** Buddy Hield|**7** Harrison Barnes|**8** Tyrese Haliburton| |Golden State Warriors|**37** Stephen Curry|**14** Draymond Green|**13** Draymond Green|
"Tyrese Haliburton locks vet Buddy Hield in the bathroom on the team bus: ""You're gonna pass the ball to me tomorrow?"" Buddy: ""I'll pass you the ball every day"" Hali: ""No, you be missing the open gimmes"""
ESPN tomorrow: Reports are that Tyrese Haliburton has locked Buddy Hield in a bathroom screaming what can you improve on.
"""Is Tyrese Haliburton Wes Unseld reincarnated as a guard?"""
"My favorite player is LeBron, and I've liked him ever since he was on the cover of Sports Illustrated magazine like 20 years ago. But I would advise you not to be a LeBron stan.  Here's some young and exciting players that I love to watch:   \- **Shai Gilgeous-Alexander, Oklahoma City** \- Crafty young point guard with an all-around skillset   \- **Lamelo Ball, Charlotte Hornets** \- Great passer and playmaker, and still super young   **- Ja Morant, Memphis Grizzlies -** Explosive athlete, a point guard who plays above the rim   **- Tyrese Haliburton, Sacramento Kings -** Smooth, reliable guard who plays like a veteran  Luka Doncic, Devin Booker, Zion Williamson, and Trae Young are all really good and young, but they already get lots of fanfare."
  **Timberwolves @ Kings**  [](/MIN) **134 -  120** [](/SAC)  **Box Scores: [NBA](http://www.nba.com/games/20210420/MINSAC#/boxscore) &amp; [Yahoo](http://sports.yahoo.com/nba/minnesota-timberwolves-sacramento-kings-2021042023)**  |**Team**|**Q1**|**Q2**|**Q3**|**Q4**|**Total**| |:---|:--|:--|:--|:--|:--| |Minnesota Timberwolves|39|35|25|35|134| |Sacramento Kings|43|31|29|17|120|  **TEAM STATS**  |**Team**|**PTS**|**FG**|**FG%**|**3P**|**3P%**|**FT**|**FT%**|**OREB**|**TREB**|**AST**|**PF**|**STL**|**TO**|**BLK**| |:--|:--|:--|:--|:--|:--|:--|:--|:--|:--|:--|:--|:--|:--|:--| |Minnesota Timberwolves|134|51-90|56.7%|18-43|41.9%|14-19|73.7%|12|50|34|16|5|18|9| |Sacramento Kings|120|44-97|45.4%|18-42|42.9%|14-16|87.5%|13|39|28|17|10|10|3|  **TEAM LEADERS**  |**Team**|**Points**|**Rebounds**|**Assists**| |:--|:--|:--|:--| |Minnesota Timberwolves|**28** Anthony Edwards|**18** Karl-Anthony Towns|**11** Ricky Rubio| |Sacramento Kings|**20** Harrison Barnes|**8** Harrison Barnes|**9** Tyrese Haliburton|
[Here ya go](https://www.espn.com.au/nba/insider/story/_/id/31198084/nba-best-25-25-ranking-young-stars-future-potential)  Mikal Bridges and Tyrese Haliburton??? Get them the fuck off this list. LaMelo at #3 before all those other proven dudes is the biggest joke of 2021.  They have Sabonis below Mikal? 🤨  These three ESPN “writers” are hot sweaty ass.
[Tyrese Haliburton: GUILTY](https://twitter.com/TyHaliburton22/status/1384615044978257921?s=19)  [Mark Jones: Guilty.Guilty.Guilty It won’t bring George Floyd back to his daughter but it’s a beginning. His life mattered.  We need police reform. Police have killed black people like this before.We need to fix the dark side of law enforcement.  What if there was no video \#BlackLivesMatter](https://twitter.com/MarkJonesESPN/status/1384619111779475458?s=19)
"He wasn't the one who brought Quickley up lol. This is how the comment chain started:  &gt;There's only a handful of rookies that contributed to winning basketball games consistently in Ball, Haliburton, and Quickley  To which you replied  &gt;Ball is the only rookie that’s playing above avg if nba has an avg. Tyrese is about avg in the grand scheme of things. edwards isn’t playing winning basketball and is inefficient.  You left him off while saying Ball is the only rookie playing above-average, so the other guy was chiming in with the fact that Quickley has also been above-average (.125 WS/48, 83rd in the NBA for RPM)."
"Yeah he's definitely capitalising. Even now, it's still a hard sell trying to convince me Anthony Edwards or Tyrese Haliburton deserves it over LaMelo.  Secure your shit Melo!"
"Here's a few more.   Isaiah Stewart is better than James Wiseman.   While Tyrese Haliburton is better currently, Killian Hayes will be better in his prime.   Duncan Robinson's season last year was a fluke. He's still an elite shooter, but hes never going to shoot 46% on 8 threes per game ever again. Probably more like 39-40% (which is still good).   Saddiq Bey is better than Blake Griffin.   If Kawhi Leonard wasn't an MVP candidate playing 78% of the games last season, Embiid shouldn't be an MVP candidate playing 68% of his games.   Donovan Mitchell is the Jazz's best player. It becomes obvious in the playoffs imo.  Curry is more valuable to the Warriors than Harden is to the Nets.   Not all players who put up good numbers on a bad team are empty stats players."
The entire Sacramento Kings roster with De'Aaron Fox and Tyrese Haliburton being given a yearlong vacation.
"&gt;Just kidding, Ant is the truth. This draft is already looking much better than it was made out to be. I think there’ll be multiple perennial All Stars in LaMelo/Ant/Haliburton and some really strong starters.  I don't want to sound like I'm negative but I don't see Tyrese Haliburton as some kind of all star. He's that Malcolm Brogdon/FVV type of player (not to say he's bad (he's quite good) but just that's the ceiling for him)."
&gt; He didn’t start Tyrese Haliburton who has been the 2nd best player on the Kings this year   I don't watch a lot of Kings basketball but I thought it was 1. Fox 2. Holmes 3. Haliburton. Correct me if I'm wrong.
"Fox needs more help. Fox is 23. It really isn’t that deep. We have 3-4 years to build a winning team around him. We already had one chance with Luka and screwed it up, so that front office got replaced and in year 1 the new front office picked Tyrese Haliburton, who has been one of the best rookies in the league.   There’s no reason for Fox to demand a trade instead of seeing what the front office that he literally just signed a 5 year max deal with can do."
I had no idea Tyrese Haliburton was so popular with Wolves fans
Tyrese Haliburton robbed
Tyrese Haliburton
"ah yeah Tyrese Haliburton, famous nickname for Luka Doncic. You do realize we're talking about Luka right?"
The Weapon of Mass Destruction for Tyrese Haliburton.
"Tyrese Haliburton, Buddy Hield, and a 1st"
1. Jalen Smith was a much more raw prospect than Tyrese Haliburton 2. Jalen Smith has done mostly nothing this year 3. The Suns would be better with Haliburton 4. The Suns would have both Payne and Haliburton in the rotation 5. A player's future isn't determined by only their rookie year
Tyrese Haliburton* &amp; De’Aaron Fox
"Tyrese Haliburton. I think he'll be an all-star one day."
"I wish Suns got Tyrese Haliburton but since they didn't I am glad Kings got him to help ease pain of not drafting Luka, even if it is only a little bit."
"Monte Morris, Georges Niang, Matt Thomas, Abdel Nader, Talen Horten Tucker and Tyrese Haliburton."
You know who would've been nice?   Tyrese Haliburton.    Still don't know what the Suns were thinking
"Tyrese Haliburton, OG Anunoby, Jalen Brunson, Mikal Bridges, Lu Dort, Dejounte Murray"
Tyrese Haliburton
"Think they're closing their eyes and ears and yelling ""Tyrese Haliburton should have been Rookie of the Year"" repeatedly in response to this."
Same here. I wish the Suns drafted Haliburton but since they didn't I was happy they got Tyrese Haliburton instead to help ease the pain of not having Doncic as a guard even if it is only eases a little bit of it.
"It's not just positioning. Wiseman right now doesn't have a great feel for the game and the intuition you'd hope for in a top draft pick.  The Warriors front office were also surprised by how slowly he developed throughout the season.  Deandre Ayton for e.g. while bad in his rookie season was no where near as negatively impactful as Wiseman &amp; Ayton showed a lot more promise and development in his rookie campaign too.  Evan Mobley who tbf probably will end up playing PF also looks like he'd be a way, way better PF/C than Wiseman straight out of the gate.  Wiseman is an athletic freak no doubt, and a high character guy, and he was my preferred pick at 2 as well but damn GSW would be so, so much better with Lamelo/ Tyrese Haliburton"
"u convinced me right now, give me Haliburton for Killian Hayes, i wanted tyrese draft night anyways lmfao  Edit: sweet i glossed over the ending of three where you are already looking for hayes! I was looking for a Haliburton u genius"
"Tyrese Haliburton won't win it, but watching him close games in the 4th quarter for the Kings was like watching a 10 year vet.  He seemed so composed even though he was a rookie."
I think you make great points and I might be mistaken on the flexibility they would have in a trade. But would a team give up a 12th pick? Maybe? Tyrese Haliburton (Kings) is looking like that type of player and he was a 12th pick.
"Very much agreed about the cherry picked stats. I would have called it out myself if you hadn’t.   That said, this is what Ant fans have been seeing in reverse all year. There was an article from the Ringer a few weeks ago that used rookie stats to compare the top rookies from this class against historic rookies to “project” their ceiling. For Anthony, they chose his usage rate combined with his FG% and compared him to Dion Waiters, Coby White, and JR Smith. And then for Melo, they did some magic with his stats of like 15-5-5 to compare him to Luka, Trae, and Ja. It’s just infuriating to see the misrepresentation.   https://www.theringer.com/nba/2021/4/20/22393182/rookie-comps-lamelo-ball-anthony-edwards-tyrese-haliburton  *edited to correct typo"
"Dont worry Kings fans, you got some good to think about, TYRESE HALIBURTON!!!"
"**ALL-NBA**  *FIRST TEAM*  G: Stephen Curry, Damian Lillard  F: Luka Doncic, Giannis Antetokounmpo  C: Nikola Jokic  *SECOND TEAM*  G: Chris Paul, Jimmy Butler  F: LeBron James, Kawhi Leonard  C: Joel Embiid  *THIRD TEAM*  G: Kyrie Irving, Bradley Beal  F: Julius Randle, Paul George  C: Rudy Gobert  ----  **ALL-DEFENSE**  *FIRST TEAM*  G: Ben Simmons, Jimmy Butler  F: Draymond Green, Giannis Antetokounmpo  C: Rudy Gobert  *SECOND TEAM*  G: Marcus Smart, Jrue Holiday  F: Matisse Thybulle, Bam Adebayo  C: Joel Embiid  ----  **ALL-ROOKIE**  *FIRST TEAM*  LaMelo Ball, Tyrese Haliburton, Anthony Edwards, Desmond Bane, Immanuel Quickley  *SECOND TEAM*  Jae'Sean Tate, Isaiah Stewart, Saddiq Bey, Payton Pritchard, Facundo Campazzo"
MVP: Nikola Jokic  DPOY: Matisse Thybulle  COTY: Monty Williams  ROTY: LaMelo Ball  MIP: Julius Randle  6MOTY: Jordan Clarkson  &amp;#x200B;  |All NBA 1st Team|All NBA 2nd Team|All NBA 3rd Team| |:-|:-|:-| |Nikola Jokic|Rudy Gobert|Julius Randle| |Joel Embiid|Luka Doncic|Jayson Tatum| |Giannis Antetokounmpo|Kawhi Leonard|Jimmy Butler| |Chris Paul|Damian Lillard|Russell Westbrook| |Stephen Curry|James Harden|Kyrie Irving|  &amp;#x200B;  |All Defense 1st Team|All Defense 2nd Team| |:-|:-| |Rudy Gobert|Clint Capela| |Giannis Antetokounmpo|Nerlens Noel| |Bam Adebayo|Myles Turner| |Matisse Thybulle |Jimmy Butler| |Ben Simmons|T.J. McConnell|  &amp;#x200B;  |All Rookie 1st Team|All Rookie 2nd Team| |:-|:-| |LaMelo Ball|Isaiah Stewart| |Anthony Edwards|Cole Anthony| |Jae'Sean Tate|Isaac Okoro| |Tyrese Haliburton|Immanuel Quickley| |Saddiq Bey|Desmond Bane|
"de'aaron fox, tyrese haliburton, buddy hield, harrison barnes, and richaun holmes should really be enough to get it done within the next five years imo  funny thing is their roster seems better than their record, like bagley isn't trash and he comes off the bench, they've got delon wright and terence davis hanging around there too, you can do much worse than fox for your superstar and the supporting cast are above-average starters. It just all goes awry for them every time because 1) terrible fo 2) bad coaching 3) it's the kings"
A better version of this list  1 Timberwolves select Anthony Edwards  2 Warriors select Lamelo Ball  3 Hornets select Tyrese Haliburton  4 Bulls select Patrick Williams  5 Cavs select Isaac Okoro  6 Hawks select Killian Hayes  7 Pistons select Devin Vassell  8 Knicks select James Wiseman  9 Wizards select Onyeka Okongwu (honestly Wiseman and Okongwu could go either way)  10 Suns select Deni Avdija  11 Spurs select Aaron Nesmith  12 Kings select Kira Lewis Jr  13 Pelicans select Obi Toppin  14 Celtics select Jalen Smith
There's actually a few nba players that shoot like that too. The one that comes to mind is Tyrese Haliburton.
Tyrese Haliburton is going to replace cp3 as the league point god within the next few years
Tyrese Haliburton.
Genuinely can’t wait for this. Pair him with Spencer Dinwiddie or Tyrese Haliburton and bring back Players Only
"So who's better? Jalen Green? In the FIBA final, playing om the same team against the same competition, Green put up 1/0/1, Cade put up 21/7/7 and was the unquestioned go to guy and leader on a team that had a good NBA player (Tyrese Haliburton). That means Cade is at least as good as Haliburton (probably)."
Luka Doncic and Jokic Tatum  Tyrese Haliburton Zion Shai-Gilgeous Alex
"Tyrese haliburton please, he was on the select team"
Tyrese Haliburton would be good for the team. This will never happen though. Also move Kevin out for an actual big that can defend the paint and set heavy screens.
"i'm not familiar with what he wants to do, article had him included   &gt;The Kings would be looking to put Simmons, a 6-foot-11, 240-pound point guard, in a frontcourt position in a lineup featuring Fox, Tyrese Haliburton, Harrison Barnes and possibly Richaun Holmes, if they are able to keep him in free agency."
Tyler Herro/ Tyrese Haliburton/ Jordan Poole/ Deonte Burton/ Kevon Loney  You could add Wes Matthews/ Frank Kaminsky as starters/bench guys.  Man that team would be bad.
[yeah it was a weird choice for sure](https://www.nbcsports.com/bayarea/kings/did-tyrese-haliburton-agent-engineer-nba-draft-day-tumble-kings)
"My breakout list is...  Tyrese Maxey, Tyrese Haliburton, Johnathan Isaac.  &amp;#x200B;  My fall off list is...  Russell Westbrook, Zach Lavine, Nikola Vucevic."
