"Since the 2003 NBA draft, only four players remain currently playing in the NBA from that draft: LeBron James, Carmelo Anthony, Zaza Pachulia &amp; Kyle Korver"
[Reynolds] Lakers star LeBron James and Pelicans star (until tomorrow) Anthony Davis will both have courtside seats tonight at Summer League.
"Tim Duncan goes coast-to-coast, crosses over LeBron James, and sinks the And-1."
Lebron James has the best career Plus/Minus and it's not really even close.
"LeBron James 2012 ECF GAME 6 VS. Celtics - 45 Pts, 15 Rebs, 5 Dimes - one of the most legendary individual performances in NBA playoff history."
"Chris Bosh, Lebron James, Dwight Howard, CP3, DWilliams happily eating junk food at a random gas station. [circa 2008]"
The product of Anthony Davis’ and LeBron James’ jersey numbers is 69
Lebron James glides through the air in Cleveland!
Alex Caruso has scored 363 points in his career so far. Lebron James scored 370 points in his first 22 games
Lebron James hits the fadeaway 3 against the Wizards to tie the game
The product of LeBron James and Anthony Davis is 69.
LeBron James block on Tiago Splitter (Game 2 2013 NBA Finals)
LeBron James and Dwyane Wade go on a 19-4 comeback run to advance to 2011 NBA Finals (5.26.11)
LeBron James EPIC Dunk Over Jusuf Nurkic / Cavs vs Blazers
LeBron's high school scouting report: [Marc Stein] Breaking down LeBron James' game
"Greece v. USA 2006 FIBA World Championships - A team of LeBron James, Dwyane Wade, Chris Paul, Carmelo Anthony, Dwight Howard, Chris Bosh, and Joe Johnson lost to the reigning European World Champions that had just two players with NBA experience"
Westbrook can make the Heat relevant for the first time since LeBron James left - Bomani Jones | High Noon
LeBron James averaged 35/7/5 on 60% TS and Gilbert Arenas averaged 34/5/5 on 60%TS in a 6 game series.
LeBron James gets ALL the way up to block Brandon Roy
"LeBron James and Dwyane Wade mocked Dirk Nowitzki for being sick, then proceeded to lose 3 straight games and lose the 2011 NBA Finals"
"[Kosmider] Donovan Mitchell, DeMar DeRozan, Lonzo Ball and LeBron James among the stars here with Zion’s debut."
[Stein] A doubles match for all ages: LeBron James and Anthony Davis against Kawhi Leonard and Paul George ... just to win Best Team In Staples Center bragging rights
Anthony Davis Surprised That LeBron James Is Rated Higher Than Kawhi Leonard In NBA 2K20
LeBron James gigantic weiner exposed during nba finals.
"9 years ago today, LeBron James 'The Decision' (7/8/2010)"
"[Charania] Free agent Troy Daniels has agreed to a one-year, $2.1M, agent Mark Bartelstein of Priority Sports tells @TheAthleticNBA @Stadium. Daniels gives the Lakers an elite shooter to pair with LeBron James and Anthony Davis and does not affect the team’s cap space."
"[Murray] LeBron James finished 12th in MVP voting. Receiving one vote, which was for 5th place. The lowest finish of his career."
Lebron James behind the back pass to Kobe
Lebron James insane dunk after the whistle
Yao Ming Block on Lebron James
"[Faigen] ""I can't think of any duo right now that's better than Anthony Davis and LeBron James"" - Jared Dudley"
"[Amick] As the NBA’s new power structure unfolds in free agency, LeBron James has a message for Kawhi Leonard: Come join him and Anthony Davis in Laker Land, and he’ll take a step back in the kind of way that will empower them all"
LeBron James NBA Debut Highlights 2003 Summer League
LeBron James sleeps 12 hours a night
"Jason Terry teaching Lebron James the rules. Hand down, Man down!"
NBA 2K20 Player Ratings: LeBron James and Kawhi Leonard tied at top with 97
LeBron James and Matthew Dellavedova - Chemistry!
LeBron James fools the entire Lakers team with no-look pass...
Dwyane Wade full court alley-oop to LeBron James...
"[Rovell] JUST IN: LeBron James leaves no potential business opportunity on the table. Over time, he has sought to own “Taco Tuesday.” He has now filed to trademark the phrase for social media posts and a show of that name. First discovered by @JoshGerben"
22-year old LeBron James drives through all the Pistons to hit the game-winning layup and cap off his historic 48-point (29 of last 30 points) performance in Game 5 of the 2007 ECF.
"[UNDISPUTED] ""I believe Kawhi talked to Paul George. Everybody crushed LeBron James for needing help... If LeBron says he wants another person, I don't want to hear a word. Kawhi went to a team that won 48 games, went to the playoffs and said 'Doc, y'all don't have enough.""' — @ShannonSharpe"
[Marketwatch.com] LeBron James - The Making of a Billion-Dollar Athlete and his four most successful investment in his career: #1 sign with Nike over Reebok #2 ownership stake in Beats by Dre #3 Investing in Blaze Pizza #4 2% stake in Liverpool F.C.
Paul George blows past LeBron James &amp; puts Chris Andersen on a poster with a monster dunk
"LeBron James after Game 6 of 2011 NBA Finals: ""All the people that was rooting on me to fail, at the end of the day they gotta wake up tomorrow have the same life that they had before they woke up today. Same personal problems that they had today. I'm gonna continue to live the way I wanna live."""
Tracy Mcgrady’s explosive dunk intrigues high school Lebron James in the crowd
"New LeBron ""Ron"" James Blaze Pizza Commercial"
"Sumo wrestler Hakuho hit a free throw and his friend Rui Hachimura got excited. 34 year-old Hakuho(6'3"" &amp; 341 lbs) is the LeBron James of the sumo. He has dominated sumo for over a decade."
How much higher in All-Time rankings would Kevin Durant be considered if LeBron James never existed?
"In 2012, Lebron James Won the NBA MVP, Finals MVP and an Olympic Gold Medal."
LeBron James voices support for California bill that would allow college athletes to be paid
Lonzo Ball says LeBron James was his biggest mentor with Lakers
"LeBron James donates 1,000 computers to 59 different Boys &amp; Girls Clubs nationwide (2011)"
"[Haynes] Lakers star Anthony Davis reveals personal goal of winning DPOY, how he plans to challenge all teammates, what LeBron James did privately to ensure he’s the focal point and why it’s his time."
Steve Kerr “LeBron James and Michael Jordan are the two best players I’ve ever witnessed”
Lebron James vs Draymond Green: Basketball IQ in Action
"Two Basketball analysts discussing this historic date in basketball history, and what it has meant to the legacy of the great Lebron James."
"Tony Parker's MJ sequence: Hits a tying stepback three over LeBron James, gets the steal on the next possession, then puts the Spurs up two with a minute left in Game 6 of the 2013 Finals"
"LeBron James cleanly breaks Thabo Sefolosha's ankles, then finds Delly to beat the shot clock (2014)"
Demarcus Cousins Expected To Attend LeBron James Led Mini Camp
LeBron James' playoffs statistics vs. The Raptors
Lebron James with the nasty dunk but refs don't count the basket for some reason
Spurs guard DeJounte Murray working out in LA with several Lakers players including LeBron James and Anthony Davis at the Lakers training facility.
[LeBron James] Sharpening the knives daily for battles coming in the near future #WashedKing #TMC #SFG
LeBron James Clutch Missed Free Throws Compilation
LeBron James Will Get His Own Building On The Nike Campus
"LeBron James leaves the game, with 15 seconds left, after inbounding the ball."
"[Sami Khedira] ""Cristiano Ronaldo is an example for all sportsmen, like LeBron James in basketball or Tom Brady in American football. Older players are a great motivator for the younger ones."""
[Windhorst] Patrick Beverley reportedly gloated to LeBron James about Kawhi Leonard signing
[Joe Noga] Lebron James talks about declining a $10 million check from Reebok at age 18.
"In the NBA Finals, go ahead or game tying shots with :24 left on the clock Dirk Nowitzki 2-3 (67%) Stephen Curry 2-4 (50%) Kobe Bryant 1-2 (50%) Kevin Durant 0-1 (0%) LeBron James 0-6 (0%) Russell Westbrook, James Harden, Kawhi Leonard, Kyrie Irving : 0 FGA in this situation"
Jason Kidds' Defense against LeBron James in the 2011 NBA Finals
Bronny James smoking a blunt....what would lebron think if he sees this
Jaren Jackson Jr. hits the step back 3 over Lebron James to ice the game
"[NBA] Lebron James, In His 16th Season was the Highest 4th Quarter PPG Scorer for the 2018-19 Regular Season when James Harden Averaged 36.1ppg"
Lebron James vs Paul Pierce: Legendary Duel in Game 7 ECSF 2008
Dwyane Wade LeBron James dunk party vs New York Knicks
[UNINTERRUPTED] LeBron James introduces the Glass Helmet Project: a symbol of empowerment for the person and human under the helmet.
LeBron James' playoffs statistics vs. The Celtics
LeBron James' company's request to trademark 'Taco Tuesday' denied
"One of my all time favorite games. Christmas Day, Prime Tracy McGrady vs Rookie Lebron James, if you haven’t seen it before, then treat yourself and watch this..."
How many former NBA players has said LeBron James is the GOAT?
LeBron James Blocks Jimmy Butler Then Hits Game Winner on Him
Dwyane Wade stuffs Lebron James
LeBron James dunking at age 18
Kyle Kuzma pushes LeBron James to play some defense
"[ESPN FC] LeBron James Or Lionel Messi, Who's More Important To Their Team?"
LeBron James Surprises I Promie School Student | Heart of Surprise
"[Charania] NBA informed teams of a $125M salary cap in summer of 2021 -- when LeBron James, Kawhi Leonard, Giannis Antetokounmpo and Paul George are potential free agents."
LeBron James getting sniped multiple times
"[Complex] Although Jordan’s sneaker annual earnings at $130 million which dwarfs Lebron James' $32 million, that may not always be the case. His Nike “lifetime” deal that’s expected to earn him over a billion dollars over time."
"Kevin Harlan with the best call in the history of the the NBA - ""LeBron James with no regard for human life!"""
"LeBron James is trying to trademark “Taco Tuesday” for his podcast, not the phrase."
"Lebron quotes after GETTING GOLD in the Olympics: ""We knew it wasn't going to be easy. We didn't want it easy,"" James said. ""A lot of teams have won gold easy. We didn't want it that way. We're a competitive team and we love when it gets tight. That's when our will and determination kind of shows.“"
My favorite duo of all time. Dwyane Wade To LeBron James Alley Oop's (Compilation)
[OC] How good is LeBron James really?
LeBron James JUMPS OVER John Lucas III for the easy oop
"Top 3 stories on front page of NY Times: Largest recorded Atlantic Hurricane makes landfall; Violent Protests continue in Hong Kong; Does LeBron James have a right to ""taco tuesday?"""
LeBron James has finally followed bald mamba on instagram
"[James Jackson] We saw players like LeBron, KD, and Kawhi do it...and people hated them for it too. Now, AB could start the player empowerment movement in the NFL and what’s sick is if the pattern continues, this results in a championship for the Patriots"
Non-LA West teams: who would you put on LeBron James or Kawhi Leonard for a playoff series?
"The 2013 Defensive Player of the Year Award was very much up for grabs - Kendrick Perkins endorsed teammate Serge Ibaka, Manu Ginobli endorsed teammate Tim Duncan, LeBron James endorsed LeBron James"
Would you rather have LeBron James &amp; Shaq or Tim Duncan &amp; Kobe Bryant
"With Tony Parker retiring, LeBron James is the only remaining active player who played in the 2007 NBA finals."
"PSG star Kylian Mbappe brought LeBron James a special gift from his native France, in a bottle of wine that was harvested in LeBron’s birth year of 1984. James shared the bottle on his instagram: ""Thank you @k.mabappe WOW! #BirthYear"""
LeBron James To Kyle Korver (Compilation) 2016-17 Season!
[Pope]There are 45 distinct classes of trademarks. LeBron James purpose to use a Taco Tuesday mark is wholly different than say Taco John or any other restaurant. NO ONE would confuse LeBron social media videos or a podcast enjoying Taco Tuesday w/ a specific restaurant selling tacos.
LeBron James stuffs Jason Richardson 360 Dunk Attempt
Spurs guard DeJounte Murray working out in LA with several Lakers players including LeBron James and Anthony Davis at the Lakers training facility.
LeBron James proudly shows off photo of Stone Cold on his flip phone
LeBron James discards of Patty Mills
Lebron James with the old LA Lakers squad ; Josh Hart doesn't seem happy at all (jk)
Throwback to Lebron James' monster dunk on Ilysova
"One of my all time favorite games. Christmas Day, Prime Tracy McGrady vs Rookie Lebron James, if you haven’t seen it before, then treat yourself and watch this..."
"LeBron James hits back-to-back clutch threes vs. the Celtics - Game 6, ECF, 2018"
Lebron James is listed on Wikipedia's list of fast food restaurant chains
So I met Lebron James yesterday!
"Who is a better career defender, Kobe Bryant or LeBron James?"
I’ll see you in court Lebron “King” James. Taco Tuesday for the win!
How unsafe would the world be if Lebron James had Steph Curry's ability to shoot the Three?
Lebron James Tries To Copyright 'Taco Tuesday' 🤡
Fun Fact - LeBron James did not lose a game 7 throughout the 2010s
Lebron James wearing the Finnish coat of arms on his ig story
[LeBron James] Fools The Entire Lakers Team with No-Look Pass! Cavaliers vs Lakers.
Is this man the next LeBron James? What do you think his ceiling is?
"Andre Iguodala asked: Who's tougher to guard, Kawhi Leonard or LeBron James? ""Kobe"""
Warriors fan talking smack to Lebron James.
[LeBron James] Happy Born Day @kobebryant aka Black 🐍!!!! #Legend #Icon #Goat Laker Nation Stand Up 🙌🏾
Lakers forward LeBron James hitting the gym this offseason
LeBron James has always had unhealthy centers or bigs in his team
Joel Embiid chasedown block on Lebron James
[OC] LeBron James Resumé
"LeBron James hits back-to-back clutch threes vs. the Celtics - Game 6, ECF, 2018"
Lebron James signed jersey he gave to Stephen Curry in college.
Lebron James Mix
"Top 3 stories on front page of NY Times: Largest recorded Atlantic Hurricane makes landfall; Violent Protests continue in Hong Kong; Does LeBron James have a right to ""taco tuesday?"""
"LEBRON JAMES, kid gets concussion"
"Max Kellerman on Lebron: ""It's called selling out. It's very easy to take a stand when there is low to no cost. When there is a real price to pay, then who will stand up? Mohammad Ali did. Not Lebron James"""
LeBron James no longer King James for Hong Kong protesters - AP News
SI: LeBron James Argues NBA Needs to Address China Issue Before Players
South Park Mocks Lebron James (Comparison)
"Out of all of the NBA-affiliated people to comment on the China situation, Joe Tsai and Lebron James have been the only ones to negatively portray Morey as being uneducated and say that he was wrong to post the tweet. Lebron James is the only player who's been against Morey."
"In 2007, Cleveland Cavaliers’ Ira Newble recently wrote an open letter criticizing China’s role in the Darfur genocide; While most of Newble’s teammates signed the letter, only two did not: Damon Jones and LeBron James."
[Highlight] Donovan Mitchell rejects LeBron James from behind then gets the slam on the other end
"According to ESPN's Dave McMenamin, LeBron James spoke up in the meeting with Adam Silver in China and suggested that there would be ""league recourse"" had a player tweeted the same thing"
"Three years ago, a Tencent commentator (official Chinese partner of NBA) called LeBron ""Ape James"" on air and nothing happened to him. No official NBA statement, no apology"
"Anthony Davis: 'It Feels Good' to Share Load with LeBron James, Lakers Teammates"
"[Feigen] Rockets -- D'Antoni, Harden, Chandler, Sefolosha -- passed on responding to LeBron James' comments on Daryl Morey's Hong Kong tweet and the fallout. Harden: ""At this point, I’m focused on what we’ve got here in this locker room, focused on getting better every single day."""
"[Stadium] The NBA has installed new rules for teams to verify official player heights, now without shoes. Here are the new heights for Dwight Howard, Anthony Davis, LeBron James, Kevin Durant and Klay Thompson, according to our NBA Insider @ShamsCharania"
[LeBron James] Man these LA 🔥 aren’t no joke. Had to emergency evacuate my house and I’ve been driving around with my family trying to get rooms. No luck so far! 🤦🏾‍♂️
[Highlight] Anthony Davis goes way up for the LeBron James lob
[Highlight] LeBron James finishes with 15 points and 8 assists in 18 minutes
"Shannon Sharpe: ""Other than defending, I don't think Kawhi can do anything better than LeBron James""."
"Rihanna shouts out ""LeBron"" and James Corden maybe says little too much while singing along during the 4th quarter game break!"
Hong Kong Protesters Wearing LeBron James Masks at Recent Protests
[McMenamin] Frank Vogel says Anthony Davis And LeBron James should be a go in the preseason opener in GSW on Saturday.
"[Ben Golliver] Lakers’ LeBron James on Troy Daniels (four three-pointers in win over Jazz): “His nickname is layup. Every time he shoots a three, it’s a layup.”"
"Actual LeBron James quote, when asked about the China situation: ""I feel like I talked about it yesterday. I tweeted out responses to people not understanding my knowledge and where it came from with my brain and learning from the situation. I'm talking about it now. I won't talk about it again."""
"Hong Kong protesters trample, burn LeBron James jersey: 'People are angry'"
LeBron James on opening loss to Clippers: “It’s the first game. The NBA is back so everyone wants to have the narrative of a rivalry game and a huge test. Both teams are not who they want to be. ... It’s not a rivalry.”
[Thinking Basketball] Why LeBron James is peaking as a passer
"Skip Bayless: ""I give Anthony Davis, on a scale of 1-10 for a shot of winning MVP, a 1. AD's record in New Orleans was sub .500, his playoff record was 5-8. He does not know this spotlight. He doesn't know how hot that light will get in Hollywood playing alongside LeBron James."""
"Giannis Antetokounmpo joins LeBron James, Russell Westbrook and Elfrid Payton as the only active players to record triple-double in season-opener"
"[HoopCentral] Lakers Starters tonight; Avery Bradley, Danny Green, LeBron James, Anthony Davis, JaVale McGee"
(video) LeBron and Damian Lilliard (and Javale) dunk back to back to back to back for James' first points as a Laker
Lebron James Harden (Lebron James and James Harden) is the best 2 man/3 names combo in the NBA
Tracy McGrady: Kawhi Leonard is better than LeBron James | The Jump
"LeBron James On Playing with Anthony Davis, Full Interview | 2019 NBA Media Day"
"Khalilah Ali: ""LeBron James is not a Muhammad Ali. You have to stay [the] course when it comes to human, respect, human rights, human liberty.”"
[Highlight] Kevin Harlan was right about LeBron James
"[FreeDawkins] LeBron James Full Highlights - 32 Pts, 10 Asts, 7 Reb!"
LeBron James hitting Joe Harris with style and grace
"[McMenamin] Lakers previous listed heights on the left, new official heights for 2019-20 (without sneakers) on the right. LeBron James ⬆️; Anthony Davis, Kyle Kuzma, Dwight Howard, DeMarcus Cousins, Kentavious Caldwell-Pope, Quinn Cook, Jared Dudley ⬇️"
"If LeBron James never reach the Western Conference Finals, will it have a big impact on his legacy?"
(Full Conversation) Gavin Newsom signs California's 'Fair Pay to Play Act' with LeBron James &amp; Mav Carter | THE SHOP
"1998-2019 Playoffs RAPM: 1. LeBron James, 1. Draymond Green, 3. Manu Ginobili, 4. David Robinson, 5. Kawhi Leonard, 6. Joel Embiid*, 7. Tim Duncan, 8. Kevin Durant, 9. Kevin Garnett, 10. Steph Curry"
"LeBron James Full Highlights 2019.10.16 Lakers vs Warriors - 18 Pts, 11 Asts!"
LeBron James Sounds a Lot Like Chinese Propaganda in Critique of “Misinformed” Pro-Democracy Tweet
[O’Conner] LeBron James Has One More Jordan Rule to Follow
Charles Barkley is right that Kawhi is better than LeBron James - Marc J. Spears | First Take
An activist holds a photo depicting LeBron James as Mao Zedong outside Staples Center
LeBron James shows love for the great Boston Celtics legend Larry Bird
Lebron James (and other top athletes) sleep 10 hours a day
Charles Barkley defends LeBron James' China stance: 'He had to look out for his business'
LeBron James Criticizes Daryl Morey And Then Receives Boisterous Backlash For His Comments
"LeBron James is now listed 6'9"" by the Lakers"
"[Video] Eric Cartman quoting LeBron James during the episode ""Let Them Eat Goo"""
"Max Kellerman on LeBron James: ""When there's a real price to pay for taking a stand, then who will stand up? Muhammad Ali, in this case not LeBron James"""
"People's Daily (official newspaper of China) support Lebron James and mock US in their weibo (China's Twitter): ""Basketball teaches us what is 'Double Standard'""."
[Spears] LeBron James says he and his Lakers teammates didn’t have enough information to comment on situation in China.
"Stephen A. rips LeBron James: No aggression, no offense! | First Take"
"People's Daily (official newspaper of China) support Lebron James and mock US in their weibo (China's Twitter): ""Basketball teaches us what is 'Double Standard'"". Translation in comments."
"ESPN: In a closed door meeting, LeBron James pressured Adam Silver to punish Rockets GM for his pro-Hong Kong tweet"
"[Lane] : Jared Dudley on committing hard fouls: ""Any flagrant foul LeBron James needs just give me the $20k fine. It's on. Anyone touches Anthony Davis or LeBron James, that's part of my job here...you gotta have that, that's not my role, but you stand for your guys."""
LeBron James pressured Adam Silver to punish Rockets GM Daryl Morey for controversial tweet
NBA star LeBron James reportedly pressured the NBA to punish the Rockets’ General Manager Daryl Morey after he tweeted support for Hong Kong.
Lebron James finishes with 32 points 10 assist 7 rebounds as the Lakers defeats Utah 95-84
Lebron James says Kobe Bryant is the best player twice
Lebron James checks out with 32/10/7 playing 31 minutes
"The Chinese government has detained around one million Uighurs Muslims in re-education camps, which face multiple allegations of torture. They’re definitely having a harder week than LeBron James"
"[Spears] LeBron James was referring to the ramifications of Daryl Morey’s tweet on China and the events it unleashed when the Lakers star said the Rockets GM was misinformed, a source told @TheUndefeated."
"[McMenamin] While league sources confirm the NBA would have bent the rules to allow for LeBron James to swap his jersey number with AD without meeting the deadline to file the paperwork a year ahead of time, Nike intervened."
[LeBron James] - -Injustice Anywhere Is A Threat To Justice Everywhere- Our Lives Begin To End The Day We Become Silent About Things That Matter- (2018)
"[Charania] Reporting on @TheAthletic: Inside the chaotic week for Lakers, Nets and NBA amid China conflict — including spirited dialogue between Adam Silver and the players, and a LeBron James-led players-only meeting among both teams."
LeBron James Questioned Adam Silver Over Lack Of Punishment For Daryl Morey’s China Tweet
Lebron James has a record of 1-5 in NBA games played in China
"LeBron James vs Anthony Davis Full Duel 2018.12.21 - AD With 30, LeBron With 22-14-12!"
"Lebron James Is ""More Than an Athlete"" Until It's Bad for Business"
"[Spectrum] Anthony Davis: ""I joked with him at halftime, I said it's the first time in a while I could have 5 points and we're up 30."" on playing alongside Lebron James"
"The Uighurs, China, and the lucrative hypocrisy of LeBron James and the NBA"
Report: NBA star LeBron James reportedly pressured the NBA to punish the Rockets’ General Manager Daryl Morey after he tweeted pro-freedom support for Hong Kong.
"LeBron James NBA Season Opener 10 Years Ago vs BiG3 Celtics - 38 Pts, 8 Asts, 4 Blks! | FreeDawkins"
"According to NBA trainer Rob McClanaghan on the latest Woj Pod, Derrick Rose refused to go and recruit LeBron James in 2010 free agency"
How will the China National Team featuring LeBron James do in the upcoming Olympics?
"[Cheng] The early reception to LeBron James' comments were overwhelmingly positive online in China. “That’s why we love you,” said one user on the Twitter-like Weibo service, who called James “the spokesman of the NBA’s diplomacy department.”"
LeBron James pressured Adam Silver to punish Rockets GM Daryl Morey for controversial tweet
"[LeBron James, 2018] “#wewillnotshutupanddribble”"
Esteemed sports commentator Rob Parker - LeBron James Is Selfish and All About The Money
[Steven Cheung] The @nba has updated LeBron James' team photo.
"Opinion: It's time for LeBron James to speak out on China, regardless of Nike ties"
LeBron James' criticism of Hong Kong tweet from Daryl Morey receives backlash on social media
Watch Lebron James listen to Kobe Bryant as he drops great points on China
"Hong Kong Protestors on LeBron James: ""He Supports Totalitarianism?"""
LeBron James pressured Adam Silver to punish Rockets GM Daryl Morey for controversial tweet
Lebron James takes questions about China
LeBron James grilled Adam Silver on whether Rockets GM would be disciplined over Hong Kong tweet
"Stephen A. rips LeBron James: No aggression, no offense! | First Take"
"[Deadspin] LeBron James Made His Choice On The NBA And China, And He Chose LeBron"
"[Beer] RJ Barrett, at 19 years and 131 days, is the youngest player in NBA history to score more than 20 points in his first career NBA game. Previous record holders were LeBron James (19 years, 303 days) and Anthony Davis (19 years, 234 days)"
[LeBron James] My team and this league just went through a difficult week. I think people need to understand what a tweet or statement can do to others. And I believe nobody stopped and considered what would happen. Could have waited a week to send it.
