"LeBron James' School Crushing Expectations, Huge Gains In Test Scores"
"In honor of this first class A-List, whose on your fantasy roster, fiction or otherwise, to partner up with Lebron James in Slam Dunk 2."
TIL the Orlando Magic are the only team in the East that LeBron James has never beaten in the playoffs.
Lebron James is toxic and his fans are gullible
"The last player to have as many PTS, AST, REB, BLKS, STLS + shoot over 50% as Ben Simmons did this season, was 17'-'18 LeBron James. (if you disregard BLKS, '81-'82 Magic Johnson joins the list)"
"LeBron James responds to Charles Barkley’s comment, “LeBron James, come into the studio. You ain’t got nothing to do. The playoffs started yesterday [and] you’ve got free time.”"
"Ric Bucher with the blazing hot take on LeBron's options (brought to him by a ""GM""): The Bucks could trade for LeBron James to keep Giannis in Milwaukee"
LeBron James very first interview
Aaron Baynes has more 3pt FG's then Lebron James in this years NBA Playoffs.
"In the 2017 NBA Finals, Kyrie Irving took more shots than Lebron James, in every game."
What LeBron James is doing during the NBA playoffs
Lebron James' 'Million Dollar Mile' Might Not Last One Season
"Since you started to follow NBA, who has been the most hyped up prospect since LeBron James?"
According to @TheAthleticNBA Most HATED players in the ##NBA 1. LeBron James 78.1% 2. Jimmy butler 9.9% 3. Boogie 5.0% 4. Trae Young 4.7% 5. Draymond Green 2.3% No KD votes for most hated player
Would the Lakers have made the playoffs if they had James Harden this year instead of LeBron James?
A reminder that LeBron James is a pretty good person
What impressed Warren Buffett when he first met LeBron James—and it wasn't his basketball skills
Is it time to say James Harden is better than LeBron?
LeBron James' I Promise School sees 'extraordinary' test score improvement after first year
Lebron's* handbook for coaching Lebron James
Why Lebron James is the best
This is How LeBron James Just RUINED his NBA Legacy
"[Discussion] LeBron James holds the highest streak of double-digit points in consecutive games IN NBA HISTORY (thanks for the enlightenment, Jxmy)"
"Forget the Lakers, LeBron James is having trouble recruiting players for ‘Space Jam 2,’ reports say"
Stop the madness: Lebron James would not be a good TNT commentator
Would LeBron James lose any endorsement deals if he officially changed his name to LeDong?
"[Charania] NBA All-NBA: First team: Stephen Curry, James Harden, Giannis Antetokounmpo, Nikola Jokic, Paul George. Second team: Damian Lillard, Kevin Durant, Joel Embiid, Kawhi Leonard, Kyrie Irving. Third team: Russell Westbrook, Blake Griffin, LeBron James, Rudy Gobert, Kemba Walker."
"Scottie Pippen on Draymond Green calling himself the best defender ever: ""He's more of a great team defender than an individual defender ... He's not the guy you put on your best player, so how can he consider himself the best defender ever? ... I never saw him guard LeBron James [in the Finals]."""
"[Feldman] Adam Silver: LeBron James leaving East hurts TV ratings, NBA could start West Coast games earlier"
Stephen Curry joins LeBron James (2009) as the only players to score 35+ points in the first three games of a conference finals series
"Chris Broussard - ""Kawhi's even-keeled nature has settled the Raptors down. This is a team we've seen lack poise, get shook at the presence of LeBron James. Kawhi certainly wouldn't be shook by seeing LeBron. ... Kawhi is rubbing off on these guys."""
Remember: Memphis also won the second pick in the LeBron James draft lottery
"With his 15th All-NBA Selection, LeBron James ties Kobe Bryant, Tim Duncan, and Kareem Abdul-Jabbar for the most All-NBA selections of all time."
"LeBron James reportedly happy in Los Angeles despite Lakers dysfunction, wants to play in city for the rest of his career"
[Windhorst] LeBron James has reportedly been in contact with at least two star NBA players about joining the Los Angeles Lakers this summer: Kawhi Leonard and Jimmy Butler
LeBron James was working out in Lakers practice facility at 4 a.m.
[Markazi] LeBron James is in attendance for Frank Vogel's press conference.
LeBron James partners with Walmart to fight hunger and promote education
"Stephen A.: ""We're talking about a box office dude, a potential mega-star, a sky walker, think about it: when have the NY Knicks had that?.. Where's the Lebron James, the Michael Jordans, the Kobes - d@mn it we didn't even have Harold Miner!"""
"[Givony] Talen Horton-Tucker and Darius Bazley working out at the Klutch Sports Pro Day in Los Angeles. Pat Riley, Eric Spoelstra, Rob Pelinka, Dave Griffin, Sean Marks, RC Buford, Donnie Nelson, Darius Garland, LeBron James Jr and Sr and many others in the building."
Max Kellerman and James Harden are the new Skip and Lebron
LeBron James Explains his weird love for candles. He also lit candles in road game locker rooms.
Fun Fact: There were 82 'first-time' champions in LeBron James' 8 consecutive NBA Finals appearances (2011-2018)
"16 Years ago today, the Cleveland Cavaliers won the lottery and proceeded to select Lebron James with the No. 1 pick"
"LeBron James 2012 ECF Game 6 at Celtics - 45 Pts, 15 Rebs, 5 Ast"
"The Lakers now have LeBron James, Brandon Ingram, Lonzo Ball, Kyle Kuzma, Josh Hart, the #4 overall pick and 40M in cap space"
"Is this official NBA Video Rulebook outdated? Because wouldn't the video explanation here for the Travel foul called on Lebron James, make almost all modern layups a travel violation?"
LeBron James advances to his 9th consecutive NBA Finals Appearance
LeBron James CRAZY MVP Offense Highlights 2008/2009 - INCREDIBLE Plays! (720p HD)
Adam Silver: League Ratings Fell After LeBron James Moved West
"Warriors' streak best since 60s Celtics. They join the 1960s Boston Celtics (10 total) as the only groups to do so in league history, outlasting both the LeBron James-led Miami Heat (2011-14) &amp; Cavs (2015-18), along with Larry Bird's Celtics (1984-87) and the Showtime LA Lakers Lakers (1982-85)."
"Report: Sons of LeBron James, Dwyane Wade to team up at L.A. prep school"
"2018-19 All-NBA Teams: James Harden, Giannis Unanimous First-Team Selections, LeBron James Makes Third Team"
[IG Likes] LeBron James likes a post of Kyrie Irving in a Lakers jersey
"10 years ago today, in a moment I believe brought many new fans to the NBA, LeBron James hit the improbable buzzer beating 3 against the Orlando Magic to tie the series 1-1."
"Golden State without Kevin Durant over the last three seasons: 32-10, LeBron James teams without him in his 16 year career: 32-66."
"[Warriors PR] Per @EliasSports, Draymond Green is the fifth player in NBA history to record a triple-double in at least three consecutive playoff series in a single postseason, joining Wilt Chamberlain, Magic Johnson (four times), Rajon Rondo and LeBron James."
Warriors vs Raptors is the first NBA Finals since 2006 in which there is no LeBron James or LA Lakers
Don’t you ever forget the day LeBron James murdered the entire LA Lakers team
"Cleveland Cavaliers Owner Dan Gilbert talks coaches, front office, LeBron James and Kyrie Irving"
"Cavaliers owner Dan Gilbert on LeBron James: 'It all revolves around the sun, which is him'"
Lebron James didn’t come on Inside the NBA
[Lebron James] #4 👀 Beautiful.
The first team All-NBA the last time LeBron James didn't make it in 2006-2007
Have these play offs been better or worse with the absence of Lebron James
[Detrick] Tanking is dead! Long live the ethical teams who shut down Anthony Davis and LeBron James.
Lebron James Challenges 14 Year Old In 3 Point Shooting Competition
[Micah Adams] Kawhi Leonard’s scoring average has gone up from the regular season to the playoffs every single year he’s made it. Michael Jordan can’t say that. Neither can LeBron James. Or Kobe Bryant. Or Kevin Durant. Or Wilt Chamberlain. Or Kareem Abdul-Jabbar. Or Larry Bird.
LeBron James Trickery
"[Schultz] A source close to #LeBron tells me that #Kawhi Leonard reached out to James, telling him he very much wanted to play together. They spoke about Kawhi's lockdown defensive ability, which would alleviate pressure off of LeBron."
Skip Bayless &amp; 34% of NBA fans polled in 2015 said that a 52 year old Michael Jordan could beat Lebron James in a one-on-one in 2015
"I miss Lebron James, particularly playoff Lebron, the best version of Lebron"
Lebron James Vincent St Mary puzzel with basketball cards
What would a hybrid between Lebron James and Jason Richardson average?
The last time Kawhi Leonard was in the finals he beat Lebron James and the Miami Heat 2x Champ on the verge of a 3-Peat. He now faces Kevin Durant’s Golden State Warriors 2x Champ on the verge of a 3-Peat.
"Forget The Next LeBron, Andrew Wiggins May Not Be The Next James Posey"
This LeBron James interview demonstrates just how valuable losing an NBA Finals can be. The greatness of LeBron we witnessed the last few years wouldn't be possible if Dirk and the Mavs hadn't given him such a humbling loss.
Snoop dog special ft Lebron 'King' James
Lebron James JR social media video might get him in hot water
"[Throwback Hoops] In 2006, Kobe Bryant names his Dream Team to win a championship with: PG LeBron James SG Dwyane Wade SF Kobe Bryant PF Nowitzki/Garnett/Duncan C Shaquille O’Neal"
BRONNY GOT NO CHILL!! Lebron James Jr Goes on profanity filled rant!!
DEBATE: Why Stephen Curry will never be Kobe Bryant or Lebron James
Can Lebron James (has 3 rings) be better than Jordan if he goes to the CBA and wins 3 rings there?
Lebron James &gt; Michael Jordan
Kawhi Leonard is the first player in 20 years to score 7 35 point games in the NBA playoffs. The only other player to do that is Lebron James
Lebron James Best Highliths!!!
"OTD one year ago: ""LeBron James CRAZY Full Game 7 Highlights vs Celtics 2018 Playoffs ECF - 35 Pts, 15 Reb, LeTHANOS"""
"OC: every nba finals since 1980 has featured at least one of Kareem, Magic, Bird, Moses Malone, Hakeem, Isaiah Thomas, Michael Jordan, Scottie Pippen, Tim Duncan, Derek Fisher, Dirk Novitski, Paul Pierce, Lebron James, or Jordan Bell"
[LeBron James]: “Today’s date in 2003......🤷🏾‍♂️... #TheKidfromAKRON👑”
[The Onion] Depressed LeBron James Realizes That At His Age Copernicus Was Developing Theory Of Heliocentrism
How impressive is Steph Curry beating Lebron James 3 times in the Finals?
"Honest question - Has there been another player who has beaten as many potential first ballot HOFers in the finals as Lebron James? (durant, harden, westbrook, tim duncan, Kawhi, poppovich, possibly parker/ginobli, steph, klay)"
"LeBron James smoking cigars with Russell Westbrook, Chris Paul &amp; MORE!"
Kobe seems at peace about not having a son and rightfully so but imagine if these two get together and have kids. Their children would have the genes of both Lebron James and Kobe Bryant. Damn!
Let’s add fuel to the fire: LeBron James likes video on Instagram of Kyrie hitting a 1-legged stepback fade-away 3 when they were on the Cavs
"Lebron James has beat the following potential first ballot HOFers in the finals (KD, Harden, Russ, Tim Duncan, Kawhi, Poppovich, possibly parker/ginobli, Steph, Klay)...has any other player beat more first ballot HOFers in the finals? Honest question"
Someone other than LeBron James has officially won the Eastern Conference Finals.
"Chris - ""Kawhi's even-keeled nature has settled the Raptors down. This is a team we've seen lack poise, get shook at the presence of LeBron James. Kawhi certainly wouldn't be shook by seeing LeBron. ... Kawhi is rubbing off on these guys."""
"POLL: Y for yes, N for No. Do you believe Lebron James was on PEDs from the Biogenesis Clinic."
"LeBron James ""Told him about a certain switch I can hit when needed and he didn’t believe me. Well he found out the hard way!"""
LeBron James on Instagram: “Today’s date in 2003......🤷🏾‍♂️... #TheKidfromAKRON👑”
RUMOR: Lakers may trade Lebron James for Zion Williams
Networks Brace For Conference Finals Without LeBron James
If kawhi leonard gets raptors a ring tonight will he be considered better than Lebron James
"In response to Klay Thompson's argument that making 5 straight Finals ""takes more than just a couple All-NBA guys"": Lebron James"
Lakers Trade Rumors: Kawhi Leonard Prefers Clippers to Joining LeBron James
Lebron James was down 0-2 in the 2007 eastern conference finals against the Detroit Pistons. Cavs proceeded to win the next 4 games.
Where did LeBron James rank as a player each year?
[Serious] If you’re Lebron James what do you do?
Tonight will be the first NBA Finals game without LeBron James since June 17th 2010
Imagine hating LeBron James
Trade LeBron James+4th pick for the #1 pick
How a Ben Simmons-for-LeBron James trade could work
Is Giannis Antekdidqwkdwq better than Lebron James?
Steph Curry v. Lebron James
[Detrick] Tanking is dead! Long live the ethical teams who shut down Anthony Davis and LeBron James! Accelerationist take: flattened odds encourage grotesque tanking from borderline playoff teams to the extent that entire lottery system gets overhauled
Is it safe to say Kawhi Leonard has surpassed Lebron James?
LeBron James 2012-13 Season Highlights
LeBron James Hate...
"NBA free agency: LeBron James has started recruiting Kawhi Leonard and Jimmy Butler to Lakers, report says"
[Windhorst] LeBron James has reportedly been in contact with at least two star NBA players about joining the Los Angeles Lakers this summer: Kawhi Leonard and Jimmy Butler.
Lakers didn’t sign LeBron James to contend
LeBron James is finals bound.
LeBron James
Is Kwahi Leonard on the brink of surpassing Lebron James as the superstar of NBA
The Rockets should trade James Harden for Lebron James-Will Cain/Max Kellerman| First Take
Jayson Tatum dunks on LeBron James in the Eastern Conference Finals in his rookie year
"LeBron James EPiC Performance 2012 ECF Game 6 at Celtics - 45 Pts, 15 Rebs, 5 Dimes, LEGEND!"
"""Lebron James! AT THE BUZZER!"""
[Highlight] Steph Curry eurosteps LeBron James (2018 NBA Finals) (Colorized)
Tyson Chandler hard screen on LeBron James
What are the chances the Lakers could trade for Chris Paul and Kevin Love to go with Anthony Davis and Lebron James ?
"Kawhi Leonard’s 732 points in the 2019 NBA playoffs was good enough for the 3rd most points scored in a single playoff run, trailing only Michael Jordan (759 points -‘92) and LeBron James (748 points - ‘18). He is also the only player amongst the top 12 to get there on fewer than 500 FGAs"
LeBron James has already played the 6th most minutes in NBA history. He needs less than 1000 minutes to pass Kobe for 3rd all time.
"There were twelve players last season who debuted in 2003 or earlier. One of those was LeBron James, who ended the season with a BPM of 8.1. The other eleven players combined for a BPM of -38.0."
Discussion: Is there a bot that gilds posts that mention LeBron James?
Lebron James with no regard for HUMAN LIFE!
[Serious] LeBron James backwards is semaJ norBeL.
What if Lebron James was a bust?
"LeBron James: How he actually played on the left, how LeBron thought he played on the right."
The LeBron James headband timeline
LeBron James is quite good at the sport of basketball
[Serious] LeBron James backwards is semaJ norBeL
lebron james
lebron james
"[Charania] Sources: Space Jam 2, starring LeBron James, is expected to feature key roles for Damian Lillard, Anthony Davis and Klay Thompson and WNBA stars Diana Taurasi and Nneka Ogwumike. Several more NBA and WNBA players, including Chiney Ogwumike, are expected to play roles in film."
"LeBron James on the Warriors after Game 6 of the 2016 NBA Finals: ""They fucked up. Mentally and physically. I'm telling you, they fucked up."""
LeBron James has a shot at retiring with 42069 points.
"Despite being on the same team in the same calendar year 3 times, LeBron James and Luol Deng have never played together"
"[DePaula] The Space Jam 2 workout court for players is set up at NBA superfan Jimmy Goldstein’s house in LA, featuring LeBron James’ logo."
"Six years ago, after winning his second straight Finals and Finals MVP, LeBron James celebrates in the locker room and says to the media, ""I don't wanna talk to y'all anymore. Leave me alone. Get the fuck out of my face. I'll see y'all at the podium."""
LeBron James Jr. gets his first dunk of the AAU season + bonus poster attempt!
Lebron James has the best career Plus/Minus and it's not really even close.
Lebron James glides through the air in Cleveland!
Lebron James hits the fadeaway 3 against the Wizards to tie the game
LeBron James averaged 35/7/5 on 60% TS and Gilbert Arenas averaged 34/5/5 on 60%TS in a 6 game series.
"LeBron James and Dwyane Wade mocked Dirk Nowitzki for being sick, then proceeded to lose 3 straight games and lose the 2011 NBA Finals"
"[Murray] LeBron James finished 12th in MVP voting. Receiving one vote, which was for 5th place. The lowest finish of his career."
Lebron James insane dunk after the whistle
[Markazi] Mark Cuban smiled when I asked him about LeBron James and Anthony Davis on the Lakers. “I just hope history repeats itself with the Lakers and their dream teams.”
"7 years ago today, the Miami Heat defeated the Oklahoma City Thunder 121-106 in Game 5, winning the NBA Finals 4-1. It was the first title for LeBron James, who was named Finals MVP, and the second for the Miami Heat."
"[McMenamin] Talen Horton-Tucker says he didn’t work out for the Lakers and didn’t even meet with them at the combine before being picked by them tonight. As a fellow Klutch Sports client he says he’s already met with LeBron James and Anthony Davis, however."
Tracy McGrady (41 Points 11 Assists) vs Rookie LeBron James (34 Points 6 Assists) Christmas Day 2003
"For approximately the same 2019 cap hit, you could have the top five picks in the NBA draft ($39.7m) or LeBron James ($37.4m). Who would you rather?"
Lebron James' gives a touching speech and has strong words following racist act at L.A. home
Lebron James is in the game.
[Serious] Questions about LeBron James Jr
"[McMenamin] Talen Horton-Tucker says he didn’t work out for the Lakers and didn’t even meet with them at the combine before being picked by them tonight. As a fellow Klutch Sports client he says he’s already met with LeBron James and Anthony Davis, however."
Rare photos of LeBron James biological father.
[Markazi] Kyle Korver was reading “Showboat: The Life of Kobe Bryant” while playing in the NBA Finals with LeBron James.
"[McMenamin] ""Talen Horton-Tucker says he didn’t work out for the Lakers and didn’t even meet with them at the combine before being picked by them tonight. As a fellow Klutch Sports client he says he’s already met with LeBron James and Anthony Davis, however."""
"Who is the greatest attacker of the basket in NBA history. I would assume Lebron James and Michael Jordan would be pretty easy answers, so how about a list comprised of attackers outside of these two?"
"[Lee] Might be the most incredible stat about NBA draft: Only 4 No. 1 picks in lottery era have won titles with their original teams - David Robinson, Tim Duncan, LeBron James &amp; Kyrie Irving. And think about the winding road needed for those guys to do it as teammates, 8-10 years apart"
[Markazi] Kyle Korver was reading “Showboat: The Life of Kobe Bryant” while playing in the NBA Finaks alongside LeBron James.
18 year old LeBron James hits 5 straight full court shots
Lebron James in 2013: They sleeping on Ben McLemore. Just watch
Is LeBron James the best Lakers player to never make a Western Conference playoff game?
Zion is the best prospect since LeBron James - Stephen A. | First Take
Kobe Bryant is better than Michael Jordan and LeBron James. Here's why
Lakers new draftee Thorton Tucker old tweet about his new teammate LeBron James resurfaces.
LeBron James and Brow together in NBA
A more of a [TOMT] post: A website that addresses the Michael Jordan vs LeBron James finals and playoff success respectively.
Tracy McGrady (41 Points 11 Assists) vs Rookie LeBron James (34 Points 6 Assists) Christmas Day 2003
[Lebron James] Man this really just hit me! I’m really shooting Space Jam 2!! This is so surreal and doesn’t even make sense to me! Where I come from man and what I saw growing up this doesn’t add up to me! 🤦🏾‍♂️! I’m truly grateful and beyond blessed. This is CRAZINESS.
Do you think LeBron James will ever become the consensus GOAT player in NBA history?
LeBron James and Dwyane Wade go on a 19-4 comeback run to advance to 2011 NBA Finals
"Would you rather have prime Lebron James* on your team, or would you rather have prime Dirk**?"
"Talen Horton-Tucker says he didn’t work out for the Lakers and didn’t even meet with them at the combine before being picked by them tonight. As a fellow Klutch Sports client he says he’s already met with LeBron James and Anthony Davis, however."
Lebron James: Skip Bayless Listen to this
Who would be better to start a team with today: LeBron James or Josh Jackson?
LeBron James Locks Up Jrue Holiday Leading To A Dagger One-footed 3 Pointer
"[Marc Stein] LeBron James missed the playoffs for the first time in 14 years. Two days after the season ends, LeBron finds out he will be partnered by the best teammate (Anthony Davis) he's ever had and, really, the ideal sidekick."
[Palmer] You get one player next 10 years: LeBron James or Andrew Wiggins?
Is Prime Kobe Bryant the only top 20 player ever LeBron James ever up against in his career?
Lebron James and Zion Williamson 16 years apart
[Talen Horton Tucker] 😭Doc Rivers And Austin Are The First Father And Son👬Being With The Same Team💯Since Delonte West🏀And Lebron James😂
Lebron James Deepest Shot on Every NBA Team!
Why does LeBron James look like somebody’s grandma 😂😭
"Since you cant answer me back, here I say this: LeBron James is the greater than Michael Jordan"
"D’Angelo named Bill Russell, Michael Jordan, Anthony Davis and LeBron James for Dream Starting Five when he entered the league 4 years ago."
"[Woj] During negotiations with LeBron, Pelinka asked LeBron “No trade clause?” To which LeBron agreed. However Pelinka meant “there will be no ‘trade clause’” and has traded LeBron James to the Guangdong ducks and will use cap space to sign brook lopez and Adam Morrison"
Is Prime Kobe Bryant the only top 20 player ever LeBron James had to face in his career?
"If LeBron had the same stats than James Harden this season, do you think he would win the MVP over Giannis without a doubt?"
NBA Trade rumours: Lakers eying Kawhi Leonard after LeBron James and Anthony Davis
How many 5-year-old basketball players could Lebron James take 1 v x?
The shady side of LeBron James
[Serious] At what age will Bronny James surpass LeBron as a basketball player?
Could a team of LeBron James clones beat a team of Carmelo Anthony clones playing 4v5?
Lebron James showing stupid hops in Chicago
Would LeBron James reach 8 straight NBA Finals if he played in the West?
Can Lebron James Become a Future HoF?
Zion is the best prospect since LeBron James - Stephen A. | First Take
"Unpopular Opinion: LeBron James isn't in the Top 5 of All-Time, and winning a championship with the Lakers won't change that."
Who says no: LeBron James for Pat McCaw?
Do you think LeBron James surpassed Michael Jordan after his 2016 ring?
"For their rookie seasons only, would you take Luka Doncic or LeBron James?"
Lebron James in clutch situations in the Finals.
"According to sources, Lebron James doesn’t ever tip | Below the Belt Podcast"
Why Lebron James and KD
LeBron James for Lonzo Ball. Straight up. Who says no?
Is ‘Space Jam 2’ a Way for LeBron James to Skirt the Salary Cap?
[Haynes] Sources: LeBron James giving Anthony Davis the No. 23
"[Amick] With the Lakers now expected to land a Kawhi Leonard meeting, a source tells @TheAthletic that LeBron James AND Anthony Davis are planning on being part of the formal pitch."
LeBron James steps over Tyronn Lue
[LeBron James] ⁶🙏🏾
LeBron James “I don’t believe I’ve ever played for a superteam”
[Wojnarowski] Jared Dudley was determined to play with LeBron James and Anthony Davis on the Lakers. He recruited them.
"[Charania] Free agent Troy Daniels has agreed to a one-year, $2.1M with the Lakers, agent Mark Bartelstein of Priority Sports tells @TheAthleticNBA @Stadium. Daniels gives the Lakers an elite shooter to pair with LeBron James and Anthony Davis and does not affect the team’s cap space."
"Fun Fact: Ben Simmons joined LeBron James and Oscar Robertson this past season as the only players to post 2500 points, 1000 rebounds and 1000 assists in their first 2 NBA seasons"
"[MacMahon] LeBron James' lone fifth-place vote for MVP came from the NBA.com fan vote, not a media member."
"[Ganguli] Magic Johnson has been saying since the day he stepped down that he would still be part of the Lakers free agent recruiting efforts. Am also told that LeBron James and Anthony Davis plan to meet with Kawhi Leonard, taking a hands-on approach to try to complete their team."
Sources: LeBron James giving Anthony Davis the No. 23
Chris Bosh reunites with LeBron James on set of 'Space Jam' sequel
LeBron James In Disbelief After Alex Caruso's Dunk! Warriors vs Lakers
"Ever since LeBron James posted his ""TAAAAACOOOOO TUUUUUEEESDAY!"" video, everything has gone right for him and the Lakers"
"[Oram] A few Lakers vets are on hand for summer league practice, including Kyle Kuzma, Lance Stephenson and the man without a number, LeBron James."
Hypothetical: You wake up one day with size and basketball skill of Lebron James. The NBA Draft is a month away. What do you do to get drafted?
"LeBron James Carries D-League Team to the Finals - 2007 ECF vs Pistons, 48 Pts, Scores Last 25 Pts!"
