LeBron James passes Michael Jordan on the all-time scoring list | SSN
Kemba Walker is now 0-28 against LeBron James
"Rajon Rondo: ""Most of y'all have made a career out of discussing LeBron James, and y'all can't pay the man some respect."""
LeBron James with the major putback slam on Kuzma's miss - ESPN
"Trae Young is the first rookie since LeBron James to have a 40+ PTS, 10+ AST game"
"last night on 21 possessions guarding LeBron James, Patrick Beverly (listed at 6'1) held LeBron scoreless."
Does LeBron James deserve some blame for Celtics struggles?
Andre Iguodala replaces Lebron James as VP of NBPA.
"LeBron James leaves the game with 15 seconds left, after inbounding the ball - not happy at all!"
"[Azarly] Don’t look now, but after a night when the #Lakers lose to the #Grizzlies and the #Clippers win again to inch closer to a playoff spot, the LeBron James Nike poster is getting taken down just outside of Staples Center on the walls of L.A. Live at 1:30 A.M."
LeBron James is starting his 15th straight All-Star game which is the most in NBA history
LeBron James thinks the Lakers really need Lonzo Ball to come back. The Lakers have been the 4th worst defensive team in the NBA since Ball went down dropped from 7th defensive efficiency with Ball.
[SBnation] Zion Williamson’s agent could be a race between Jay Z’s Roc Nation and LeBron James’ Klutch Sports
"Chris Mannix, senior NBA writer at SI: ""LeBron James absolutely wanted coach Erik Spoelstra fired during his 1st year in Miami"", compares Luke Walton's current job security to Spo's"
Lebron James tonight: 33/6/10 on 13-24 shooting and 4-9 from 3. +/- of +2 in 37 minutes.
Charles Barkley extends an invitation to LeBron James to be a host during the first weekend of the NBA Playoffs since 'he'll have some free time'
LeBron James has not won in New Orleans since... March 29th 2013
Lebron James clutch defense leads to his wild dagger 3 (full sequence)
Paul George with a stepback triple and Dwyane Wade lobs it off the backboard for LeBron James! - TNT
Lebron James double clutch dunk
"[Passan] For some context on how incredible the response in Philadelphia has been to the Bryce Harper signing: In the first 24 hours after the launch of his jersey, according to @Fanatics, Harper's No. 3 sold more than LeBron James' Lakers jersey did the first day."
Kyrie Irving lobs it to LeBron James late in the fourth - TNT
[Pincus] 'He Killed the Chemistry': LeBron James Isn't Blameless During Lakers' Struggles
"[Ganguli] Luke Walton said they only had eight bodies in practice today. In addition to the guys on the injury report they held Josh Hart, Rajon Rondo and LeBron James out of practice."
Lebron James is a bad leader.
"[McMenamin] LeBron James passed Andre Miller tonight for 10th on the all-time in assists list with 8,525 and counting. He is the only player in league history to rank in the top 10 in both assists and scoring (5th)."
"That's Trae Young's third 30 point, 10 assist game of the season. The only other rookies to have done that 3 or more times: Oscar Robertson, LeBron James, Michael Jordan and Steph Curry."
[Skip Bayless] It happened AGAIN: LeBron James just missed two huge late free throws that could've made it a one-possession game. He has always been a liability at the late-game FT line. And some ppl actually claim he's better than Michael Jordan. Laughable. Blasphemous.
LeBron James stays in first place with most all-time wins as All-Star Team Captain
LeBron James with the dunk and-one - ESPN
LeBron James Full Highlights 2019.02.27 Lakers vs Pelicans - 33 Pts 10 Asts CLUTCH! FreeDawkins - Streamable
"Fun Fact: LeBron James' career high of 61 points came against the Charlotte Hornets, hometown team of Michael Jordan. Michael Jordan's career high of 69 points came against the Cleveland Cavaliers, hometown team of LeBron James."
"Lebron James full highlights vs Rockets | 29 PTS, 11 REB 6 AST | FreeDawkins"
"Tonight, the LeBron-James-led Lakers lost to the Memphis Grizzlies. On Saturday, the Lebron James-less Cavaliers beat the Memphis Grizzlies."
LeBron James is 40 points away from overtaking Michael Jordan in the all time scoring list for the 4th place
Which player was/is better at age 34: Kobe Bryant or LeBron James?
"With LeBron James becoming the only player to rank top 10 all-time in both Points and Assists, which player has created the most points in NBA history?"
Lebron James on what’s the correlation between sports &amp; music. “Rappers want be ballers and ballers want to be rappers.”
James (Harden) hits the step-back 3 over (LeBron) James
"Despite the addition of LeBron James since last season, the Los Angeles Lakers have only one more win after 64 games played."
LeBron James since returning from injury is averaging a triple double - 25.4/10.1/10.4 on 55.8% TS
"[Oram] LeBron James, who is typically the first player to address media following a game, has not yet spoken. Media has been in the locker room for more than 20 minutes. Much of the team has showered, dressed and headed to the bus."
"Kyrie Irving exclusive interview on Celtics' struggles, LeBron James, free agency buzz | The Jump"
"Jay Williams: “Magic needs to shut LeBron James down. He needs to take it away from LeBron, because LeBron’s pride will want him to play...you have to be able to compartmentalize that if you’re Magic Johnson, and say, ‘OK, LeBron, sit down, I don’t need you to get injured … sit down, get healthy.'"""
"[OC] LeBron James, Jimmy Butler, and the Dangers of a New Daddy"
Is Lebron James Even playing Defense? | LeBron's Defense Breakdown | FreeDawkins
"The last time the Warriors lost on a buzzer beater was January 23, 2009 when LeBron James hit a 19-footer"
"Lebron James only needs 6,077 point to pass Kareem."
The Lakers lost the 35th game last night. The last time LeBron James lost 35 games in a season was in 2007-08.
[Bayless] It happened AGAIN: LeBron James just missed two huge late free throws that could've made it a one-possession game. He has always been a liability at the late-game FT line. And some ppl actually claim he's better than Michael Jordan. Laughable. Blasphemous.
"LeBron James could score 3,625 points over his next three games and Michael Jordan would still be the all-time leader in points-per-game"
"[Oram] Any frustration by Lebron James here seems to be in response to the question and the reporter asking it. The reporter was me. I thought he was pretty clearly rejecting the notion that the race for the playoffs is a distraction, not calling out his teammates for being distracted."
Lebron James ties Michael Jordan for the 4th all-time leading scorer in NBA history with this shot
I don't quite understand Lebron James approach this year with the Lakers young core.
Playoff Mode? LeBron James and the Lakers Are Failing to Activate
This will be the first season since 07-08' where a Lebron James-led team will have less than 50 wins (outside of the lockout shortened 11-12' season)
"LeBron James will finish this year with more career 25+ PPG seasons (15), than Larry Bird, Dirk Nowitzki, and Tracy McGrady combined (14)"
LeBron James passes Kobe Bryant for 5th on the all-time Field Goals Made list!
"[McMenamin] At halftime with Team LeBron trailing, LeBron James asked Coach Mike Malone if him and his teammates could leave the locker room to watch the J. Cole concert. ""I'll let you go watch the J. Cole concert if you all get your ass back on transition (in the second half),"" Malone said"
"[ESPN Stats &amp; Info] LeBron James missed 2 FTs with 12 secs left in OT and the Lakers up 1. In the final 15 seconds of the 4th qtr/OT, LeBron is 10-21 (48%) on FTs in one-score games since the start of last season. That's the worst FT pct of any player with at least 10 FTA in those situations."
LeBron James has Never Beaten the Pelicans in New Orleans
Trae Young becomes the 2nd rookie of All Time with a 30+ points 10 ast and 10+ free throws a game. Joining Lebron James
"LeBron James 'killed' Lakers' chemistry, league executive says"
Lebron ''The L-Train'' James Tonight: 27/8/6 on 9-19 shooting and 1-6 from 3. +/- of -13 in 42 minutes.
[Request] Lebron James airballing a 3 pointer with 20 seconds to go vs Grizzlies
LakerFilmRoom: LeBron James and the veteran Lakers need to look in the mirror
LeBron James throws the ball off the back of the backboard and forces a turnover
"[McMenamin] At halftime with Team LeBron trailing, LeBron James asked Coach Mike Malone if him and his teammates could leave the locker room to watch the J. Cole concert. ""I'll let you go watch the J. Cole concert if you all get your ass back on transition (in the second half),"" Malone said"
[Reminder] LeBron James is only 40 points away from passing Michael Jordan for 4th place on the NBA's All-time scoring list.
LeBron James frustrated as Los Angeles Clippers hand Lakers third straight loss
[Clip Request] Anthony Davis smiles after LeBron James hits an insane three to possibly seal the win for the Lakers.
"[Haynes] Lakers star LeBron James to Yahoo Sports on teams thinking he’s a defensive liability, here’s his challenge: “Come on with it.”"
LeBron James-Inspired Play 'King James' to Debut in Los Angeles in 2020
Lebron James Tonight: 27/8/6 on 9-19 shooting and 1-6 from 3. +/- of -13 in 42 minutes.
"LeBron James: The last few years, everyone's so accustomed to the losses that I'm just not accustomed to."
A talk with LeBron James convinced Nike’s cofounder to approve the Kaepernick ad
[OC] Ranking player's career +/- against LeBron James in the postseason
Fun fact of the day: Ed Davis was the leading Laker for win share in 2014-15 with a total of 6.3. LeBron James is the leading Laker this season with 6.3.
[Boston Celtics] Kyrie Irving lobs it up for LeBron James!
"Tonight, the LeBron-James-led Lakers lost to the Memphis Grizzlies. On Saturday, the Lebron James-less Cavaliers beat the Memphis Grizzlies."
"[Plaschke] Lebron James passing Michael Jordan was the most underwhelming piece of history I've witnessed at Staples Center. By both the ceremony and the fans, both relatively understated, he was treated like a visiting player..which, face it, he still is"
"[Dan Devine] No Matter What LeBron James Says, Lakers’ Issues Not Just About Comfort"
[Golliver] Hornets owner Michael Jordan issues brief statement on LeBron James passing him on the NBA’s all-time scoring list: “I want to congratulate LeBron on achieving another great milestone during his amazing career.”
LeBron James: Lakers 'afraid to be uncomfortable' | NBA Sound
"Lebron James explains ""2 points is not just 2 points"""
Great photo of Anthony Davis and Lebron James in the locker room
"[Bayless] If I could put Patrick Beverly's motor in Lebron James, I'd have the next Michael Jordan"
20-year-old LeBron James 1st All Star Game! Full Highlights at 2005 All Star Game
LeBron James is 13 points away from passing Michael Jordan for 4th on the All Time Scoring list.
LeBron James: 'I don't believe in pressure' | NBA Sound
Random stat: DeMar DeRozan has a 3-1 record against LeBron James this season while averaging 33/9/9
"Lebron James and Brandon Ingram beat Houston at home with a combined 56 points, 24 rebounds, and 7 assists on 19/39 from the field!"
LeBron James has high praise for Zion Williamson and talks GOAT conversation
"Magic Johnson confirms LeBron James helped orchestrate Rondo, McGee, Stephenson deals"
[Adam Fromal] LeBron James vs Giannis Antetokounmpo throughout their careers in Rolling Player Rating
"LeBron James Highlights vs Bucks - 31 Pts, 10 Ast 7 Reb"
Did Lebron James change his shot since recent injury?
Charles Barkley invites LeBron James on TNT's 'Inside the NBA' for the playoffs
Lebron James Dancing During Lakers Practice
[Bayless] It's really a shame LeBron James never had the courage to participate in at least one NBA Slam Dunk Contest. Not even one. His fans deserved one.
"[Ganguli] Rich Paul, who also represents LeBron James, has not given the Pelicans a list of preferred destinations, but he will inform interested teams whether Davis would sign an extension with them."
Octavia Spencer Says LeBron James Helped Her Secure Appropriate Pay For Their Upcoming Madam C.J. Walker Netflix Series
"[The Crossover] LeBron James has no issue with his coach, but his camp reportedly want to see a change on the Lakers' sideline"
LeBron James Explains Why He’s Already ‘Greatest Player Of All Time’
"Harden is one of only 6 players in NBA history to score at least 35 PPG for at least 8 consecutive games. If his streak continues tonight against the Warriors, he will match LeBron James’ personal record of 9 games."
Danny Ainge: LeBron James May Be Taking 'Donald Trump Approach' with GOAT Remark
"When Kevin Durant said the media has a bias for LeBron James, this is what he meant (from NBA Countdown, Jan. 2, 2019)"
"[Ahmed] Why play for the Lakers? LeBron James got more votes than Russell Westbrook &amp; Paul George COMBINED. Also, Kuzma got more votes than Lowry + Lonzo made the list, too. This may as well be a #Lakers advert: Play for the Lakers &amp; you’re automatically in the #AllStar discussion."
[Charania] Lakers' LeBron James (groin) will be re-evaluated in one week.
"In the 2011 Finals, Lebron James scored 5, 2, 2, 0, 2 points in the 4th quarter from Game 1-5 respectively."
"Last night, James Harden joined Wilt, Kobe, MJ, &amp; LeBron as the only players in NBA history to score 35 points or more in at least 9 straight games."
"LeBron James on Twitter: ""So what really is “in the shooting motion” rule?!?!? Asking for a friend @OfficialNBARefs 🤔"""
Rich Paul: LeBron James will miss at least the next two games for the Los Angeles Lakers
Kyrie explains why he called LeBron James after finally understanding what being a leader is all about
Kyrie Irving Apologized to LeBron James for His Attitude in Cleveland
I finally met LeBron James!
LeBron James has faced an MVP(s) everytime during his 9 Finals appearances between 6 MVPs w/ total of 13 faceoffs.
[King] Kyrie Irving said he called LeBron James and apologized. Said sometimes getting the most out of your group is not the easiest thing.
LeBron James and Giannis captain NBA All-Star teams as starters are revealed
[Shams] Lebron James return is looming..there’s optimism that hopefully he’ll be able to play within the next week
"After being named an All-Star for the 15th time, LeBron James now only trails Kobe Bryant (18) &amp; Kareem Abdul-Jabbar (19) in All-Star selections"
LeBron James famously has the stat line of 27/7/7 associated with him; do any other players have a stat line synonymous with them?
LeBron James has a 58-18 record when recording a Triple-Double (76.3 win%). James Harden has a 34-7 record when recording a Triple-Double (82.9 win%).
"[NY Knicks PR] Kevin Knox is the sixth youngest player in NBA history to score at least 30 points. Kobe Bryant, Devin Booker, Kevin Durant, Jaren Jackson and LeBron James were younger. (Basketball reference)."
Lakers should keep LeBron James out ‘as long as possible’ - Paul Pierce | NBA Countdown
"LeBron James now holds the record for most All-star fan votes in a season with 3,770,807, beating Dwight Howard's 2009 record of 3,150,181."
Bleacher Report Article. Is Luka Doncic Having a Better Rookie Season Than LeBron James Did? (They say maybe)
I have a theory about Lebron James injury and looking for some feedback...
"Which team would win? Smush Parker, James Harden, Michael Jordan, Mark Madsen and Kwame Brown vs Chucky Atkins, Kobe Bean Bryant, Lebron James, Horace Grant and Dickey Simpkins?"
Carmelo Anthony’s ideal landing spot is with LeBron James and Lakers - Stephen A. | First Take
Lebron James Career Game Highs vs. Every NBA Team [OC]
Lebron James Gets Roasted
LeBron James Feels Embarrassed When The Lakers Lose To The Cavs!
How lucky are we as NBA fans to have the chance to watch the Greatest basketball player of all time Lebron James
LeBron James Feels Embarrassed When The Lakers Lose To The Cavs
[Serious] Where would you rank Lebron James as a player/asset in potential trade discussions? Who would you rank ahead of him?
"NBA injury report: Return timeline, updates, impact for LeBron James, Chris Paul, Clint Capela, other injured stars as of yesterday"
LeBron James’ move West has likely caused NBA ratings to slip
"Meanwhile, the Los Angeles Lakers continue to be without LeBron James as the star forward deals."
Could Lebron James miss All-NBA 1st Team this year?
Skip and Shannon disagree on LeBron James calling himself the GOAT
I Posted A Video Of KD hugging and congratulating an adult with down syndrome and got downvoted if it was LeBron James I would have gotten 100's of upvotes smh
Hypothetical Trade:Lakers trade Lebron James and Lonzo Ball to Oklahoma City Thunder.
How high is the ceiling for Lebron James?
Can Mikey Willams and Bronny James beat Lebron and the lakers?
'It Was a Lot for Me to Figure Out': Kyrie Irving on Playing With LeBron James
"[McMenamin] The Lakers say LeBron James’ groin injury continues to heal. He’s been cleared to increase on-court basketball activity. The next update on his status will be provided a week from today, meaning he will miss at least three more games (@ UTA, CLE, CHI)."
"James Harden is on track to join MJ, LeBron, Bird, Magic, Kareem, Wilt, Russell, West, Duncan, and KD as the only players with four top-2 MVP finishes"
LeBron James injury crisis: Lakers suffer devastating blow with major update | Other | Sport
"LeBron James in attendance for Rams-Cowboys, has field-level suite"
Noted Cowboys fan LeBron James visits the LA Rams locker room after the Rams beat the Cowboys in the playoffs
"Lebron james sons hoop mix tape ""kings blood"""
Can we now class James harden up there with Michael Jordan and Lebron James
[ESPN] Luka Doncic is the youngest player with at least 25 points and 10 assists since LeBron James in 2004.
"At this rate, Lebron James might miss All-NBA 1st AND 2nd team."
Tonight Klay Thompson moved ahead of LeBron James and Steve Nash on the all-time 3pm list
[Shams Charania] Lebron James return is looming..there’s optimism that hopefully he’ll be able to return within the next week
"According to NBA.com's tracking data, Nikola Jokic has a higher average on court speed then Anthony Davis, Blake Griffen, Lebron James, and more."
"LeBron James has averaged 27/7/7 over his career, yet has never recorded a game with 27/7/7 as his final stat line. However, only 34 players EVER have recorded a 27/7/7 line in a single game."
Would the Mavs trade Dirk if it meant getting LeBron James?
[Lebron James] Halftime tweet: Well deserved!!! 👏🏾🙏🏾‼️‼️‼️‼️@carmeloanthony
[Charania] 2019 West All-Star starters: Golden State’s Stephen Curry Houston’s James Harden Lakers’ LeBron James (captain) Golden State’s Kevin Durant Oklahoma City’s Paul George
Anthony Davis' favourite player growing up was........LeBron James.
Is Luka Doncic Having a Better Rookie Season Than LeBron James Did?
NBA Cares: LeBron James
[Lebron James] Almost that time again! I’ve missed you so damn much! 😤🦁 🗣🤯#BeenACagedAngryLion. #striveforgreatness🚀 #jamesgang👑
Lakers fan sitting in the rafters manage to get LeBron James to acknowledge them
Google shows Klay Thompson's dad as Lebron James
The Lebron James System: Elephant In The Room
Lamar Odom shares how Lebron James inspired his comeback to basketball.
Lebron James is incredible
Lebron James to start tonight!
Lebron James back tonight
Skip Bayless: LeBron James doesn’t have Tom Brady’s competitiveness or intangibles | NFL | UNDISPUTED
Sources: LeBron James to return Thursday night against Clippers
GOING NUCLEAR: PELICANS should ask the FBI to investigate Rich Paul and Lebron James
"Sources say Michael Beasley called Luke Walton, “a goddamn cracker” before spitting at him. Several other Lakers, including LeBron James, started laughing at Walton, who ran out of the locker room crying."
"[Serious] If you were an NBA GM, would you rather a player who can turn garbage into gold or a player that can turn gold into diamonds? Lebron James vs Kobe and Jordan"
Something to think of: This year can potentially be the first since 2006 that there will not be a player named LeBron James or Kobe Bryant in the Finals
Most points scored in the 1st half by notable rookies: - Luka Doncic: 28 tonight - LeBron James: 20 - Kevin Durant: 24 - Carmelo Anthony: 24 - Damian Lillard: 25 - Blake Griffin: 28 - Kyrie Irving: 21 - Steph Curry: 20 - Kristaps Porzingis: 20 - Dwyane Wade: 19 - Trae Young: 21
Luka Doncic only needs 1 point in his next game to become the second fastest player to reach 1000 points in NBA history. LeBron James is the only player to reach 1000 points in his first 49 games. Luka Doncic can do it in 50 games.
CMV: Kobe Bryant is better than LeBron James at basketball
"LeBron James discusses in Boston: ""I've heard a couple athletes say, 'You expect that when you go to Boston.' """
LeBron James breaks silence on that Kyrie Irving phone call and the latest Celtics-Knicks intrigue
Michael Jordan vs Lebron James - Who is better? (Based off teammates with MVP votes only)
"If PIPM is supposed to be the new golden advanced stats, why does Lebron James perform so poorly using it?"
"Fist All Star Returns : LeBron James and Giannis leading their respective conferences, rookie Luka Doncic currently second in the West frontcourt"
"""You Not The King, You Can't Even Shoot!"" - Stephon Marbury DESTROYS Lebron James' GOAT Comment"
"[Sherman] Updated MVP odds: James Harden 7/4, Giannis Antetokounmpo 5/2, LeBron James 9/2, Anthony Davis 6/1"
"James Harden has now outplayed LeBron James, Stephen Curry, Kevin Durant, Russel Westbrook, Paul George and Anthony Davis in less than 2 weeks"
"Jarrett Allen Blocking Blake Griffin, Lebron James, Giannis and Anthony Davis"
Lebron James does NOT have a No Trade Clause
Since Lebron James injury. Kyle Kuzma is shooting .404 and .222 from 3.
Could Luka Doncic reach LeBron James levels?
[Markazi] Lebron James visiting the Rams Locker Room after their win earning them a trip to the NFL NFC Championship Game
Lebron James-led teams have won at least 45 games each year since 2004-05 when the Cavs won 42 - do you think the streak will continue this year?
Who’s more athletic? 18 year old Lebron James or Zion Williamson
"LeBron James replied to his fan about his return: ""Be back soon kid. 🙏🏻👑"""
Has James Harden surpassed Lebron James as the best player in the game today?
LeBron James Feels Embarrassed When The Lakers Lose To The Cavs
"[Wojnarowski] Lakers are sitting out LeBron James for the rest of the season, team says."
[Highlight] Mario Hezonja locks down LeBron James for the win!
"Ty Lue called LeBron James out for his passivity, turnovers and defense on Draymond Green during halftime of Game 7 of the 2016 NBA Finals"
Kemba Walker is now 0-28 against LeBron James.
"[Kubatko] Giannis Antetokounmpo will become just the fourth player in NBA history to lead a 60-win team in points per game, rebounds per game, and assists per game. The others are Wilt Chamberlain (2x), LeBron James (2x), and Larry Bird."
"Kemba Walker (0-27) has not won any single game against LeBron James. Tonight, the Charlotte Hornets are 2-point road favorites over the Los Angeles Lakers."
Lebron James currently at 500/1 odds to coach lakers next season
[Davis] LeBron James will reportedly have a full basketball court built on set of 'Space Jam 2' so he can train while filming
"When asked who is the best ever, NBA players answered: Michael Jordan (73%), LeBron James (11.9%), Kobe Bryant (10.6%)"
[LeBron James] Believe me! Promise #LakerNation the spell won't last much longer! I swear. The marathon continues!
"[Zarett] Lakers’ Lonzo Ball on playing with LeBron James: 'It was a dream come true for me. Watching him my whole life, it was everything I thought it would be. He's not only a great basketball player but a great person. I looked at him like a big brother.'"
Lebron James goes 4-15 in the 4th quarter vs Knicks
"[Wojnarowski] Magic Johnson and Rob Pelinka visited with LeBron James and agent Rich Paul on Saturday, league sources tell ESPN. Johnson offered no indication that he was on the brink of bailing on the Lakers, sources said."
[Stein] LeBron James tells @joevardon below that he will not play for Team USA at the World Cup in China this summer but says he has not ruled out teaming up with Coach Gregg Popovich for the 2020 Olympics in Tokyo … which would be his fourth Summer Games.
"Three teenagers in NBA history have put up 37+ points and 9+ assists in a game: LeBron James, Kevin Durant, and Anfernee Simons."
Clyde Frazier Says LeBron James 'Doesn't Really Care'; Isn't Part of Lakers
"Lakers Rumors: Rajon Rondo organized players-only meeting to push back on LeBron James for poor body language, he agreed to try and be better about it"
"Bleacher Report: Kawhi Leonard Reportedly Doesn't Want to Join Lakers, Play with LeBron James"
"[Rovell] Stephen Curry has joined LeBron James and Kevin Durant as NBA players who are executive producers. ABC has picked up a 10-episode mini-golf competition produced by Stephen Curry called “Holey Moley,” a 10-episode mini-golf competition with Curry, Rob Riggle, &amp; Joe Tessitore."
[Charania] Lakers‘ LeBron James will sit tonight against Detroit due to load management.
[Esnaashari] Lou Williams is now tied for third best player in the league at scoring during the fourth quarter. The only players ahead of him are James Harden and LeBron James.
LeBron James tonight: 29/11/11
"[Tim Reynolds] And if you missed it last night, LeBron James passed Kobe Bryant for No. 3 on the NBA's all-time scoring list when using both regular season AND playoff games. Kareem is No. 1, Karl Malone No. 2, and now LeBron."
[Ganguli] LeBron James will not play tonight due to a sore left groin.
