"Kevin Durant: ""Well, finally someone picked me number one"" Blazers Twitter: Our bad"
"[Spears] Pregame Celtics-Warriors, Kevin Durant punched a ball into the air that hit a fan in the face. KD profusely apologized, brought the fan to the locker room later, signed some shoes."
Kevin Durant feints Giannis followed by the dunk
"Kevin Durant on Clint Capela saying Houston is a better team than the Warriors: “You hear that from guys like Capela, who’s usually catching the ball or laying it up from CP or Harden. His job is not as hard. I mean when your job is that hard you don’t say shit like that.”"
Kevin Durant is now the NBA's leading shot blocker at 2.27 BPG
"Kevin Durant fires back at Charles Barkley: ""I've never spent more than two minutes with Charles. He doesn't know me from the pack of powdered donuts he had this morning."""
[Bontemps] Kevin Durant apologized profusely for how he acted last night after going back and watching calls. Said he was a “jerk” and will accept whatever he gets from the league.
"[Slater] Kevin Durant asked the first thing he thought about when he read LeBron report: ""Bullshit."""
[Rovell] Kevin Durant has donated $3M to the University of Texas to support Texas Basketball &amp; the Center for Sports Leadership &amp; Innovation. Two areas will be named for Durant including the men’s basketball facilities (The Kevin Durant Basketball Facility for Men).
"If Victor Oladipo (2013) makes the 2018 All-Star Team, he will be the first #2 overall pick to do so since Kevin Durant (2007)"
"Kevin Durant sinks a jumper to reach the 20,000 point mark for his career."
If Every NBA Team That Blew a 3-1 Playoffs Lead Pulled A Kevin Durant
"Kevin Durant moves up to #1 in the NBA.com MVP ladder, LeBron down to #4"
"Stephen Curry congratulates Kevin Durant for reaching 20,000 points."
Kevin Durant swishes the mid range jump shot to extend the lead to three points with 25 seconds remaining in the fourth
[Haynes] Golden State forward Kevin Durant (calf strain) will not play tonight at Houston.
"When Kevin Durant is ON and Steph Curry is OFF, the Warriors have a +5.4 net rating. With Steph ON and KD OFF, the Warriors have a +21.2 net rating. MVP."
Kevin Durant: Michael Beasley isn’t crazy for comparing himself to LeBron
"[Feldman] Reported All-Star draft order, from Kevin Durant (No. 1) to Klay Thompson (No. 9)"
Kevin Durant is 1% away on FT% from joining the 50-40-90 club for the second time of his career.
[Rachel Nichols] Kevin Durant tells @anthonyVslater he doesn’t want to be an all-star captain &amp; have to pick the team. Steph Curry says he’d be happy to do it.
"Kevin Durant TS% &amp; eFG% vs Players with 20,000 NBA Points Scored"
"Kevin Durant postgame on Team Lebron: ""Finally someone picked me No. 1"""
"If Kevin Durant scores 25 points against the Clippers tonight, he will become the 2nd youngest player ever to reach 20,000 points."
[Haynes] Kevin Durant will miss his third consecutive game tonight with a right calf strain. Golden State will host Denver.
Kevin Durant rushes to contest Robin Lopez' dunk but remembers what happened to Jordan Bell
"[Amick] Kevin Durant gets $15k fine from NBA for his postgame comments about refs after the Knicks game, I’m told."
Kevin Durant with a sweet scoop lay up between 2 defenders
Kevin Durant threads the needle to Iguodala in transition
"Players averaging at least 22pts, 7 rebounds, and 5 assists this season: Lebron James, Kevin Durant, Russell Westbrook, Demarcus Cousins, and Blake Griffin"
"PSA: Kevin Durant Is 25 Points Away From Reaching The 20,000 Point Milestone."
"On his return from injury Kevin Durant finished the game with 40 points on unreal 77/86/75 shooting, garnering a total of 20,015 points in his NBA career—the 2nd youngest player to reach the 20,000 point mark."
"All-Star Milestones: First picks from '14 and '15 draft, and first selection of a number 2 pick since Kevin Durant"
"Kevin Durant Triple-Double 2018.01.25 vs TWolves - 28 Pts, 11 Asts, 10 Rebs, 2 Blks!"
[Spears] Warriors forward Kevin Durant (calf) is probable against the Clippers tomorrow.
Kevin Durant Thinks The Refs Are In Their Feelings Regarding The Beef With NBA Players.
Marv Albert calling Draymond Green 'Kevin Durant'
[Haynes] Kevin Durant upon hearing about James Harden’s historical evening: “Damn. Goodness gracious.”
"[Karalla] Dirk Nowitzki is scoring 1.098 points per possession this season. That ranks ahead of Klay Thompson, James Harden, Kevin Durant, Kyrie Irving, and LeBron James."
"[Haynes] Kevin Durant on the cold showers: “Man, they got to do something in The Q. Somebody call ‘Bron.” Apparently there’s no hot water at the Q"
Draymond Green is wrong: Kevin Durant shouldn’t win defensive player of the year
[ESPN] Warriors have now won 22 of last 23 games Kevin Durant has missed dating back to last season (including playoffs)
"4 years ago today, Kevin Durant dropped a career-high 54 points, against none other than, the Golden State Warriors."
Kevin Durant on his tense interactions with referee James Williams
Kevin Durant is the second youngest player in NBA history to score 20005 career points
Kevin Durant loses his shoe but finds Green for the and-one layup
"[Warriors PR] Injury report for tomorrow at LAC: Omri Casspi (mid back strain), Stephen Curry (sprained right ankle), Draymond Green (right knee soreness), Andre Iguodala (left knee soreness) &amp; David West (sprained right ankle) are probable. Kevin Durant (right calf strain) is questionable."
"As HS freshman, Karl-Anthony Towns interviews Kevin Durant"
[Yahoo] Kevin Durant is ready for his next chapter
Kevin Durant donates $3 million to University of Texas
Leaked video of Kevin Durant explaining why he joined the warriors
"Kevin Durant on Clint Capela saying Houston is a better team than the Warriors: “You hear that from guys like Capela, who’s usually catching the ball or laying it up from CP or Harden. His job is not as hard. I mean when your job is that hard you don’t say shit like that.”"
How bad was Kevin Durant during his infamous slump in 2012?
LeBron James and Kevin Durant combine to make LeKrev Durames
If Kevin Durant was Captain instead of Steph Curry
Taj Gibson takes Kevin Durant to school in the post
"Kevin Durant Full Highlights Warriors vs Kings (2018.02.02) - 33 Pts, 6-7 3PT 6 Ast, DAGGER!"
"Unlocked Article from the Athletic: As Kevin Durant closes in on 20,000 points, he reflects on the shots, moves and hot streaks that got him here"
"If Michael Beasley (2008) makes the 2018 All-Star Team, he will be the first #2 overall pick to do so since Kevin Durant (2007)"
Kevin Durant has tattooed a snake on his wrist
[Haynes] Kevin Durant and Giannis Antetokounmpo are the leading vote getters in each conference in the first fan ballots returns.
"Kevin Durant said he felt like ref James Williams, who tossed him, was targeting him after getting his “feelings hurt” in the first half"
Kevin Durant and Draymond Green comment on Curry’s all-star selection process.
[Haynes] The expectation is that Kevin Durant will be on a minutes restriction tonight.
"If you took Kevin Durant and put him on the Orlando Magic today, what do you think their record would be at the end of the season?"
Three small forwards in the @NBA have scored 10+ points in every game that they have played this season: LeBron James (37) Kevin Durant (32) AARON GORDON (29)
"[NBA.com/Stats] Marquese Chriss: Joins Kobe Bryant, Kevin Durant &amp; LeBron James as the only players in @NBAHistory with 100 three-pointers, blocks &amp; steals before turning 21. #SunsAt50"
Drake gets Steph Curry and Kevin Durant tattoos on his arm
"[Haynes] After Golden State defeats Cleveland, LeBron James seeks out only Kevin Durant for an embrace before heading to the locker room."
"Kevin Durant has serious intentions of purchasing an NBA team after his playing career ends, league sources tell @ChrisBHaynes."
[Kevin Durant IG] My Next Chapter (with LeBron)
Can LeBron James or Kevin Durant break Kareem’s all time points record?
"Last night, Kevin Durant dished out a career high 14 assists in the Warriors 123-114 win over the Knicks."
"[WATCH] LeBron James makes Kevin Durant his new victim, chases him down and swats his layup attempt"
"Kevin Durant: I 'Never Envisioned' Reaching 20,000 Points in NBA Career [BleacherReport]"
Kevin Durant pulls up from Steph Curry range
"[Deadspin] Kevin Durant Says He Got Ejected Because Ref Had An ""Attitude"" And Was ""In His Feelings"""
Kevin Durant posted this to his Instagram story after being drafted by LeBron
Why does Kevin Durant look like he's constantly slipping/falling?
Kevin Durant calls ‘bulls**t’ reports of LeBron James considering Golden State Warriors
Kevin Durant strikes again
[Bleacher Report] Kevin Durant Apologized to Referee James Williams: 'I Was Being an Assh--e'
"Kevin Durant hits the bucket to become the second-youngest player to reach 20,000 points"
Stop calling Kevin durant a snake
"[Kevin Durant] Breaking Down Top HS Players Part 2 | KD on Jahvon Quinerly, Shareef O’Neal &amp; More"
"[Adams] Kevin Durant has 4 ejections. In Rasheed Wallace's infamous 2000-01 season in which he set a NBA record with 41 technical fouls, a record which will probably never be broken, he had 2 ejections at this point in the season. Sheed didn't pick up his 4th until February 15th."
[Spears] Warriors forward Kevin Durant was fined $15K for criticism of the referees.
He was supposed to be the next Kevin Durant...
"Kevin Durant had reached 20,000 career points"
"Kevin Durant hits 20,000 career points"
Kevin Durant leads the league in blocks per game - 2.3
Kevin Durant Hilariously Calls Out LeBron James
"On Inside the NBA, Charles Barkley said Kevin Durant has become the front runner for MVP"
Kevin Durant Best Plays of His Career
Kevin Durant is an underrated passer/playmaker
"OAKLAND-Calif. --- Kevin Durant had a memorable Thursday. That because He was hit with a $15,000 fine for public criticism of an official."
Kevin Durant with the 'Next Chapter' meme on his Instagram
Kevin Durant is ready for his next chapter
Kevin Durant ejected
Kevin Durant suspended for 5 games. Wtf??
[The Washington Post] Kevin Durant invests 10 million dollars to help disadvantaged youth attend college and get launched into life.
"[Slater] Kevin Durant: ""Well actually....I want to wait to see who wins the championship and whoever wins that, that's who I'm going to sign with"""
Kevin Durant calls out Sportscenter for lying.
"[Haynes] Golden State Warriors will celebrate their championship in D.C. today by touring the African American Museum with students from Seat Pleasant, the hometown of Kevin Durant."
Fun fact: Chris Bosh makes more money than Kevin Durant
Kevin Durant was never MVP... According to Scholastic
"Kevin Durant, Russell Westbrook &amp; James Harden 91 Pts Combined 2012.03.07 vs Suns - 3x30!"
[Highlight] LeBron is fired up after the referees call the out-of-bounds on Kevin Durant
"[Wolstat] LeBron said it was great to reunite with Kyrie Irving and sang his praises. Kyle Lowry also discussed the two reuniting, and Kevin Durant/Russell Westbrook coming together again: ""At the end of the day, we are all competitors, but it’s still a real tight brotherhood,"" Lowry said."
[NBA Instagram] Russell Westbrook and Kevin Durant share a moment
"[Slater] Will Kevin Durant, potential free agent this summer, 100 percent be back with the Warriors next season? ""Yeah,"" he tells @TheAthleticSF"
Kevin Durant on Critics of Steve Kerr Letting Players Coach: 'Who Gives a S--t?'
"Kevin Durant took his sneakers off and gave them to Moses Brown after they couldn't find a pair of his new releases that fit Brown; Brown is a 7' 2"" high school senior committed to UCLA"
"(Lee) Kevin Durant on not letting Steph Curry get off a 3-pt shot at the end of the game. ""That was great defense by myself."" Then he patted himself on the back"
Kevin Durant basically went 60/50/90 for the month of February
"Why is it that Stephen Curry was widely seen as the 2nd best player in the world after '16, but ever since Kevin Durant joined GSW he's somehow better?"
Team LeBron's Russell Westbrook and Kevin Durant joke around before NBA All Star Game.
[Connor Letourneau] Kevin Durant calls Thunder’s Andre Roberson ‘probably the best’ defender in NBA
[Horne] Russell Westbrook said he and Kevin Durant at All-Star are communicating: “All the other stuff is irrelevant. Just keeping it cool. Talking when we need to.”
Kevin Durant has 12 technical fouls this season. When he reaches 16 he will receive a suspension.
"Kevin Durant says NBA players' salaries shouldn't be made public because it's making parents and athletes ""crazy."""
"[Golliver] LeBron James reveals his Team LeBron starter picks, in order: Kevin Durant, Anthony Davis, Kyrie Irving and DeMarcus Cousins."
Kevin Durant on Joel Embiid: He is going to take over this league once I’m done
Kevin Durant with an extended answer about why the Warriors can't just play beautiful basketball all the time
"In the 1989-90 season, Hakeem Olajuwon had 37 games with 5 or more blocks. Anthony Davis, Joel Embiid, Deandre Jordan, Myles Turner, Kevin Durant, Hassan Whiteside, and Rudy Gober combine for just 20 games with 5+ blocks this season"
Kevin Durant with the crossover hesi stepback jimbo over Beasly
"[Highkin] Kevin Durant: ""Everybody just loves to hate on the Warriors"""
"Players averaging at least 19 PPG on at least 50% from the field: Karl-Anthony Towns, Anthony Davis, Giannis Antetokounmpo, LeBron James, Kevin Durant, TJ Warren"
Kevin Durant 40th All Time in Scoring
Kevin Durant asked about the quiet fan atmosphere tonight
Kevin Durant threatens Stephen Curry on Instagram/s 😀
[Greg Swartz] Isaiah Thomas is shooting 35.5% overall and 23.2% from 3 with a usage rate higher than Kevin Durant. Thats a dangerous combination.
"[Kennedy] Kevin Durant and Apple are making a scripted TV show about his journey as a basketball phenom and the world of AAU basketball. Those involved with the show hope it can be a basketball version of ""Friday Night Lights."" The show is called ""Swagger."""
"Kevin Durant Full Highlights Warriors vs Trail Blazers (2018.02.14) - 50 POINTS, Team HIGH!"
"Kevin Durant:""The money is not important to me. I’ve made so much over my career. But I do know that I want to be here, I love playing here.”"
Kevin Durant Walks On Air in Slow Motion
Backpicks GOAT: #26 Kevin Durant
Kevin Durant x LeBron James x Cari Champion | ROLLING WITH THE CHAMPION
"[Steinberg] Kevin Durant on the suggestion that the Wiz are better without John Wall: ""Yeah, that’s from a bunch of people that don’t understand basketball."""
"Barack Obama: ""People gave Durant a hard time for joining the Warriors, but the truth is is that it worked bc both Kevin but probably even more importantly Steph and Klay and Draymond, they're team-first guys."""
LeBron and Kevin Durant
"[Laker Film Room] When Kevin Durant left his agent (Aaron Goodwin), he left him for...Rob Pelinka.Wanna guess who Isaiah Thomas' agent is? There might be history behind the hostile ""he's not coming off of the bench"" text that Goodwin sent."
"Kevin Durant on tanking: ""I get it"""
"Russell Westbrook vs Kevin Durant EPiC Duel 2018.02.06 - KD With 33, Russ With 34!"
JaVale McGee and Kevin Durant last year were just 1 of 4 sets of teammates in NBA history to both finish a season with a PER of at least 25.
"[Spears] Thunder forward Carmelo Anthony said his run-in with Draymond Green was ""nothing"" and he told Kevin Durant that he was happy about ""what he was doing for the kids in PG (Prince George) County."""
"Kevin Durant joins Steph Curry, Russell Westbrook, and George Gervin as players with 5 50 point games. Only 12 players have hit the 50 mark more than 5 times."
[Serious] Who is a better scorer: Kobe Bryant or Kevin Durant?
Kevin Durant 78 points away from passing Pau Gasol for 39th All Time
Kevin Durant averages only 1.4 more Rebs than Steph Curry
Kevin Hart + Draymond Green on Kevin Durant to Golden State | Cold as Balls | Laugh Out Loud Network
Fox News’s Laura Ingraham to LeBron James and Kevin Durant: ‘Shut up and dribble’
"[NBA Official] Replay Review (1:16, Q4, ASG): While the ball clearly struck Joel Embiid’s foot, it was inconclusive as to whether or not the ball hit Kevin Durant’s leg before rolling out of bounds. Therefore, the ruling on the floor (out off of Durant) stood."
Kevin Durant Shows Off Amusing Dance Moves As Draymond Peeps (VS Brooklyn)
"[Jeff Zillgitt] LeBron James revealed his first four picks to fill out starting lineup for NBA All-Star Game: Kevin Durant, Anthony Davis, Kyrie Irving, DeMarcus Cousins"
Kevin Durant x LeBron James x Cari Champion | ROLLING WITH THE CHAMPION
"In February Kevin Durant averaged 27.6ppg on 60,6/53,4/89,3 shooting splits. A TS% of 74,9"
"[Horne] Kevin Durant on the craziest dunk he's ever seen, says it's Russell Westbrook: ""This 6-3 guy I used to play with a couple years ago, his athleticism was off the charts. I think he plays in OKC."""
"Kevin ""Steve Jobs"" Durant finally has a nickname after 11 years in the league"
Kenny Smith: Kevin Durant and Chris Paul trades 'just made everybody worse' | First Take | ESPN
Kevin Durant Dances On Ian Mahinmi For The 2
"Devin Booker becomes 3rd-youngest player in NBA history to score 4,000 points, behind LeBron James and Kevin Durant."
Fox News’s Laura Ingraham to LeBron James and Kevin Durant: ‘Shut up and dribble’
"Former Teammates Russell Westbrook and Kevin Durant combine for 67 points, while Thunder forward Paul George drops 38 himself"
Swap James Harden and Kevin Durant. Who would you favour in a 7 game series: The Warriors or the Rockets?
"LeBron James, Kevin Durant, and Steph Curry are #1, #2, and #3 in the NBA in FG% on drives this season"
Rapaport: The Trailer (featuring Kevin Durant)
Kevin Durant and Michael Beasley walk down memory lane in exclusive sit-down interview | ESPN
Do Kevin Durant and Steph Curry finish their primes on the same team?
"Career Game Score Comparison: Michael Jordan, LeBron James, Kevin Durant"
Carmelo Anthony and Kevin Durant get in each other’s grills during Thunder-Warriors | ESPN
"Laura Ingraham says LeBronJames and Kevin Durant should ""shut up and dribble"" and leave political comments to people who didn't leave high school a year early."
Kevin Durant halftime 19 points 7/12 shooting 2 rebounds 3 threes
Kevin Durant is willing to give the warriors another discount if needed this summer
Michael Beasley says Kevin Durant 'was my first real friend' back in Maryland | ESPN
[UNINTERRUPTED] Rolling With The Champion | LeBron James &amp; Kevin Durant
"[Haynes] Kevin Durant says he's over questions about him and Thunder: ""I got a question: why do you care so much"""
"ALL-ROUND SCORER: Kevin Durant is shooting...75% from 0-3ft, 53,4% from 3-10ft, 50,3% from 10-16ft, 49,7% from 16&lt;3, 42.3 % from 3"
"If Kevin Durant slept with Ayesha Curry, what would the ramifications be?"
"In the 1989-90 season, Hakeem Olajuwon had 37 games with 5 or more blocks. Anthony Davis, Joel Embiid, Deandre Jordan, Myles Turner, Kevin Durant, Hassan Whiteside, and Rudy Gobert combine for just 20 games with 5+ blocks"
Kevin Durant Walks On Air in Slow Motion (Slow Mo Guys- Super Slow Show)
"Kevin Durant dropped 50pts/7rbs/6asts/2blks last night, and his highlight video was being downvoted...."
Why do people think Stephen Curry is better than Kevin Durant?
kevin durant was an emo kid
Who is the better player? Kevin Durant or Kevin Garnett?
"Tonight, Golden State's Kevin Durant scored 50 points in a losing effort against Portland. What's the highest single game point total in NBA history that came in a losing effort?"
Kevin Durant reached out to Andre Roberson after injury; calls him the best defender in the league
Why Stephen Curry is BETTER than Kevin Durant
Why Stephen Curry is BETTER than Kevin Durant
Russell Westbrook and Kevin Durant Are Both Averaging 25.5 Points Per Game
Kevin Durant as a 21 yr old averaged over 30pts per game
"Kevin Durant UNREAL 45/13/9 GSW vs OKC, CLUTCH!! Full Highlights"
"Career wise, Kevin Durant is better than Carmelo Anthony in almost every aspect."
If Kevin Durant scores 4 points in his next game he will pass Mitch Richmond on the all time points scored list to be 44th
"Which one of Giannis, AD, Lebron, or Kevin Durant will not make the All NBA First Team?"
Kevin Durant does postgame interview for NBC Sports Bay Area half nude.
Is Kevin Durant a velociraptor?
Kevin Durant has his first 50 point games as a Warrior
Kevin Durant was Never MVP... According to Scholastic
Does anyone lose a shoe mid-play as often as Kevin Durant?
"Kevin Durant to Isaiah Thomas: ""Get yo' ass up."""
Not sure if anybody knows but Chris Bosh is being paid more right now than Kevin Durant.
"[Spears] LeBron James, Stephen Curry, Kevin Durant, James Harden and Russell Westbrook highlight a star studded list of 35 NBA players selected for the 2018-20 USA Men’s National Team pool. Warriors All-Stars are on team.Davis, Griffin, Wall, Cousins, DeRozan, Irving, Dame, Kawhi. No Melo"
[Haynes] Kevin Durant has been tossed from the game with 2.4 seconds left in the second quarter.
"Rudy Gobert blocks Kevin Durant, leads the break, and throws the alley-oop to Jae Crowder"
"[Slater] (Warriors) Starters tonight: Quinn Cook, Nick Young, Kevin Durant, Kevon Looney, Zaza Pachulia."
"Kevin Durant has more ejections this year, than the other 11 years of his career combined"
"[Jonathan Abrams] 'Those Kids Aren't Getting Educated': Kevin Durant says coaches are just like daycare owners. JJ Redick blames the system for being a form of racial control. With the NCAA plagued by scandal, B/R Mag takes an in-depth look at the state of the one-and-done."
Kevin Durant UNREAL CLUTCH Show 2018.3.8 Golden State Warriors vs Spurs - 37-11-4 | FreeDawkins
"[ESPN] Kevin Durant to decline player option, restructure deal with Warriors"
Kevin Durant enjoys answering question about why his shoes keep coming off
"Steve Kerr on the Kevin Durant ejection: ""Said the magic word."""
Kevin Durant and the Warriors defense since Draymond's DPOY comment.
A look at the impact of Steph Curry and Kevin Durant on each other and on their teammates
"Kevin Durant on the challenges of reforming the offense without Steph Curry: ""Steph is the system here"""
[NBC Sports] Kevin Durant on advanced stats: “I don’t like analytics at all”
Kevin Durant 39th ALL Time on the Scoring List
[Warriors PR] Kevin Durant(right rib soreness) is questionable vs. Sacramento
"[Kevin Durant] ""The day before he had 60, Klay just missed practice. We called him, called him, called him, but he didn't come... and then he dropped 60."""
"""It's hard to win when teams load up against you"" - Kevin Durant"
Kevin Durant pushes Patty Mills from his space
"[Medina] Kevin Durant when informed Steve Kerr didn't think the Warriors cared: ""I thought we cared tonight. We cared. Last few games, we cared. They played better basketball than us. They came out with a better strategy. They were more aggressive than us."""
Kevin Durant says Klay Thompson ditched practice the day before he dropped 60 points
"While discussing this year's Rookie of the Year race, Kevin Durant says 76ers benefited from Embiid and Simmons missing their initial seasons before playing"
[Road Trippin’: NBA] Isiah Thomas: “The one guy that would give us tremendous problems would probably be Kevin Durant.”
"Kevin Durant on the injury-riddled 7-10 finish: ""I just feel like there was so much movement in our lineups. We let that take a toll on us a bit when we should've just pushed through it...Killed the morale."""
The Bill Simmons Podcast - Kevin Durant Returns | Part One
Why does Kevin Durant keep doing Bill Simmons podcast?
[Abrams] Kevin Durant compares NCAA coaches to daycare owners
"[Slater] Steph Curry probable for tomorrow. The other three All-Stars won't play. Klay Thompson and Kevin Durant healing. Draymond Green still sore, likely to practice Saturday, play Sunday."
Kevin Durant Maliciously Destroys Child With Basketball
"JaVale McGee's Parking Lot Chronicles Episode 10: Kevin Durant &amp; ""Guest"" Andre Iguodala"
Kevin Durant says Westbrook should be All NBA 1st team if Steph isnt eligable due to not enough games played
Lonzo Ball is now shooting 30.2% from beyond the arc this season. This would rank him as #102 out of the 111 players who attempted 200+ long-balls in their rookie season... slightly AHEAD of LeBron James and Kevin Durant.
"Kevin Durant has had more injuries in his past 2 years, than his entire 10 years in the NBA combined."
Kevin Durant 19 points away from passing George Gervin for 38 All Time
[Fan Art Friday] Kevin Durant and Tre Maddox prior to the ejection.
"[Anthony Slater] Kevin Durant on the challenges of reforming the offense without Steph Curry: ""Steph is the system here"" (Video)"
Kevin Durant and Donovan Mitchell are having incredibly similar rookie seasons.
"Kevin Durant has now been ejected an NBA-high 5 times this season, highest since Rasheed Wallace with 7 in 2000-01."
"Kevin Durant is having his 10th 25 PPG season, joining just 9 other players in history to do so."
"50/40/80 Club this year : Kevin Durant, KAT, Otto Porter Jr, Darren Collison, Jonas Valanciunas"
Kevin Durant | Breaking Down Top HS Players Part 3
Kevin Durant has now been ejected an NBA-high 5 times this season. The only player with more over the last 25 seasons is Rasheed Wallace (7 in 1999-00 and 2000-01).
Kevin Durant out two weeks with injury
Steve Kerr blasts Warriors’ effort in blowout; Kevin Durant disagrees
"[Haynes] Golden State forward Kevin Durant plans to decline player option and become unrestricted free-agent to restructure contract, league sources tell ESPN."
"[BR]Kevin Durant, Draymond Green Likely to Return from Injuries vs. Bucks, Says Kerr"
