"Marcus Smart finishes the season with a higher 3 point percentage than Kevin Durant, Chris Paul, Kyle Lowry and Devin Booker"
"Kevin Durant turns his ankle, heads straight to locker room."
Kerr says Kevin Durant is 'doubtful' for showdown in OKC
[Knuckleheads] Kevin Durant comments on the OK3:
Chris Bosh: Miami Super Team 'Put Pressure' on Kevin Durant to Join Warriors
"[Slater] Kevin Durant down for a few seconds, looked like he twisted his right ankle on that leap pass. Going right to the locker room."
[Slater] Steve Kerr said Kevin Durant will very likely return on Monday in San Antonio. Just wanted to give his ankle a couple more days of rest.
Kevin Durant and Quinn Cook shows off their favourite restaurant and recording studio
"Over the past 11 games, Kevin Durant has attempted only 12.2 shots per game. He's also averaging 7.3 assists per game over this stretch."
"[Anthony Slater] Listed as out for the Warriors tonight in Memphis: Steph Curry, Draymond Green, DeMarcus Cousins, Shaun Livingston. Listed as questionable: Kevin Durant, Klay Thompson."
DeMarcus Cousins will re-sign with the Warriors if Kevin Durant leaves - Jalen Rose
"Kevin Durant will be at Apple's 'services' event today (10AM PDT) for his 'Swagger' series, about his early life, for Apple"
Kevin Durant might be the last mid-range superstar
"[Warriors PR] Injury update for tonight's game at New Orleans: Andrew Bogut (rest), Kevin Durant (flu), Andre Iguodala (left toe soreness), Damian Jones (left pectoral surgery) and Klay Thompson (right knee soreness) are out."
[Anthony Slater] Andre Iguodala also won’t play tonight in San Antonio. Getting a tooth extracted later today. Kevin Durant will return.
"Kevin Durant Full Highlights 2019.04.04 Warriors vs Lakers - 15 Pts, 8 Asts, 6 Rebs! | FreeDawkins"
"Kevin Durant through January 15: 55 2P%, 37 3P%, 63 TS%. Durant since January 15: 63 2P%, 30 3P%, 62.3 TS%"
"[Warriors PR] Injury report for tomorrow night's game at New Orleans: Andrew Bogut (rest), Kevin Durant (rest), Andre Iguodala (left toe soreness) and Damian Jones (left pectoral surgery"
"Kevin Durant, Kyrie Irving aren’t ‘tough enough’ for Knicks glory: Barkley"
Kevin Durant is 26th all-time in points scored in the regular season for the Golden State Warriors.
CBS Studios &amp; Imagine TV are casting SIX teens to play series regulars in Kevin Durant produced drama series! Based on his life coming up through AAU
Kevin Durant outranks James Harden as the NBA’s most unstoppable player – Stephen A. | First Take
Kevin Durant Calls Out Announcers On Instagram
"Ric Bucher on KD to the Knicks: ""From everything I've heard, it's done""....""Kevin Durant has never been fully embraced by the Warriors faithful...It's still Steph's team"""
[Maniatt] Highest TS% Seasons for players with a USG% of 30+ (min. 65 games): 1. 66.9% - Curry (2015-2016) 2. 64.9% - LeBron James (2013-2014) 3. 64.3% - Giannis Antetokounmpo (2018-2019)* 4. 64.0% - LeBron James (2012-2013) 5. 64.0% - Kevin Durant (2017-2018)
"Someone asked Kevin Durant when he’s coming to the Knicks. KD, smiling: “Never.”"
Kevin Durant Delivers Pizza to Fans
"Kevin Durant is still the second best player in the league, right?"
"Since January 1st, 42 players have attempted more than 60 Pull-up 3s. Giannis Antetokounmpo ranks 16th, shooting 36.1%. Notable Rankings: 1st - DJ Augustin (43.2%) T-8th - Trae Young (38.4%) 25th - Kemba Walker (35.0%) 38th - Kevin Durant (27.2%) 41st - LeBron James (23.3%)"
"[Letourneau] Kevin Durant on whether Klay Thompson is an All-Defensive Team player: “Yeah, but the people that vote on that don’t really know the game.”"
Who's the better scorer right now: James Harden or Kevin Durant?
James Harden has the ball in his hands more on average than Giannis and Kevin Durant combined
What superstar's game age well? Aside from Kevin Durant supposedly
Kevin Durant Calls Out Announcers On Instagram
"[Haynes] Draymond Green fined $35,000, Stephen Curry fined $25,000 and Kevin Durant dined $15,000 for their parts in criticizing an official."
"[Cohen] Enes Kanter joins the Thunder, Kevin Durant is shut down. Kanter gets more minutes. Enes Kanter joins the Knicks, Kristaps Porzingis tears his ACL. Kanter gets more minutes. Enes Kanter joins the Blazers, Jusuf Nurkic blows out his leg. Kanter gets more minutes. STOP THIS MAN"
"Scottie Pippen on Kevin Durant leaving Warriors for Knicks in summer 2019: ""I'm not buying none of this. Why would KD even leave? What's the point? He's gonna be the highest-paid player on the team, he's winning. I think KD left OKC to find happiness. And he's found happiness."""
"Serious question: Where do you think Kevin Durant should sign? Try to put yourself in his shoes and provide an unbiased answer that incorporates empathy (remember, he’s a human being) and strategic thinking."
Kevin Durant has become the ultimate basketball player [Ringer]
"Kevin Durant Full Highlights 2019.03.23 Mavs vs Warriors - 25 Pts, 5 Reb..."
The New York Media Isn't Actually More Intense than What Kevin Durant Already Faces With Warriors
"[Charania] The NBA has fined three Golden State Warriors: Draymond Green, $35,000 for social media comments on officiating; Stephen Curry, $25,000 for statements on officiating; and Kevin Durant, $15,000 for criticism of officiating."
"LeBron James, Kevin Durant, and Stephen Curry absolutely dominated the 2016-17 NBA playoffs"
"[Undisputed] ""LeBron James is averaging more points, more rebounds, more assists than Kevin Durant — who might be the most skilled player at his size in NBA history. ... KD is having an unbelievable season, but it's still not better than LeBron's."" — @ShannonSharpe"
[Murdock] Steve Kerr on Kevin Durant: “The game is easy for Kevin. I don’t think there’s ever been anybody that’s as skilled at his size in the history of the league.”
Interesting news: D’Angelo Russell will give Kevin Durant a tour of Brooklyn as part of a segment in KD’s show
[Serious] What does it mean when people say Kevin Durant has moved his business to NY? What specific business?
"For Kevin Durant to be the GOAT, what would he need to do?"
"[Bondy] ""It’s hardly groundbreaking at this point, but throughout this season I’ve asked several NBA executives, agents, scouts, assistant coaches about Kevin Durant. Most believe he’s headed to the Knicks."""
Do you think Kevin Durant is a elite defender and passer?
[CMV] We under appreciate the feats of James Harden and Russell Westbrook because they're not as good as their former teammate Kevin Durant.
Would Kevin Durant reach his full potential as GOAT SF if he finally fills out.
"Can Kevin Durant even join the Thunder? And if so, how likely would it be?"
"Steph Curry is better than Kevin Durant offensively, CHANGE MY MIND!"
Latest Nike Ad for Kevin Durant
Today marks the anniversary of St. Patrick driving Kevin Durant from Ireland.
"Kevin Durant ran into a fan in the hotel elevator, and it led to a surpr..."
Kevin Durant Delivering Pizza to Fans
"Stephen Curry was more fun to watch before Kevin Durant joined the Warriors, change my mind."
"Video: Kevin Durant, LeBron James have private conversation during Lakers-Warriors"
"Draymond Green On Kevin Durant Free Agency: 'If He Go, He Go'"
Kevin Durant is OUT tomorrow vs HOU
Seeking SIX basketball playing teens to play series regulars in Kevin Durant produced drama series based on his story coming up through AAU
Stephen Curry Gets Surprised By Kevin Durant After Warriors beat The Thunder!
Kevin Durant signs with Golden State (2016)
"The long 2 is dead, right? Not for Kevin Durant"
[Slater] Update from Warriors shootaround: Kevin Durant will not play tonight in OKC.
Why Kevin Durant should sign with the Brooklyn Nets
"Start, Bench, Cut - Kevin Durant, James Harden, LBJ"
"Scottie Pippen on Kevin Durant leaving Warriors for Knicks in summer 2019: ""I'm not buying none of this. Why would KD even leave? What's the point? He's gonna be the highest-paid player on the team, he's winning. I think he left OKC to find happiness. And He's found happiness."""
Kevin Durant in the Womb
"[Post Game Thread] The Golden State Warriors (4-2) eliminate the Houston Rockets (2-4) yet again, 118-113, to advance to the Conference Finals despite the absence of Kevin Durant"
[Steve Nash] Kevin Durant’s 38 pts in the half of a playoff game are 3 more than steve nash’s 35 in 2005 vs Dallas. It’s not nearly as impressive though because there are more possessions in today’s game. And because Kevin Durant is taller and better at basketball.
"[Post Game Thread] The Houston Rockets defeat the Golden State Warriors, 112-108, behind Harden's 38 points to level the series 2-2, despite the continued brilliance of Kevin Durant"
"10 months ago Kevin Durant told CJ McCollum, ""Don't worry about what goes on at the top of things."" Now they will meet in the Western Conference Finals."
Kevin Durant and Steph Curry both miss the game tying 3 | TNT
"[Murdock] Kevin Durant and JaMychal Green’s technical fouls have been rescinded, per the NBA. Durant now has just two techs in the postseason."
The Oklahoma City Thunder haven't won a road playoff game in the 3 years since Kevin Durant left.
"Kevin ""i'm Kevin Durant"" with the level 9 difficulty fade-away"
Kevin Durant has 38 points at halftime. The second most in a half in NBA playoff history!
[Ting] Guy Fieri says he will do whatever it takes to keep Kevin Durant in the Bay Area
[ESPN] Duke freshman Zion Williamson is the John R. Wooden Award Men’s Player of the Year. He joins Kevin Durant and Anthony Davis as the only freshmen to take home the award.
Kevin Durant is cleared for takeoff
"[Shelburne] Kevin Durant is out for at least Game 1 of the WCF, source tells ESPN. He’s not being re-evaluated until Thursday so it’s “unlikely “ he plays Game 2 either."
Patrick Beverley and Lou Williams post game interview on stopping Kevin Durant
"[Kawakami] ""Steve Kerr just told me that it’s incredibly unlikely that Kevin Durant will play in Game 6."""
Kevin Durant: “I’ve been in the league 12 years. I’m 30. I don’t need to show nobody nothing at this point.”
[Charania] “I’m told that if the Knicks get the #1 pick they will shift their focus to a potential deal for Anthony Davis...There might not be a better deal out there than the Knicks. That would arm them in free agency with Anthony Davis [to sway] star players like Kyrie Irving and Kevin Durant”
"[Post Game Thread] The Golden State Warriors (2-1) defeat the Los Angeles Clippers (1-2), 132-105, behind 38 points from Kevin Durant"
"Tony Allen explains why Pat Bev is having success guarding Kevin Durant: ""One thing that hurts those tall guys is crowded space"""
Patrick Beverley mocking Kevin Durant after Durant flopped his way into the foul.
Kevin Durant and JaMychal Green receive Technical fouls to the dismay of both.
Rockets’ P.J. Tucker: ‘I’m living my dream right now guarding Kevin Durant’
Kevin Durant has 50 points on 82% TS
"For the first time in NBA history, two opposing players are each averaging 35+ ppg in a playoff series (Kevin Durant and James Harden)"
"[Spears] Kevin Durant: “Yo, just watch the game. Just focus on the game and stop nitpicking, because it is a beautiful game going on out there. What can I do right now? I can’t sign a paper. I got to do the most important thing, and that is play. And that is what we should be focusing on.”"
Kevin Durant finishes round 1 averaging 35 PPG on 57/40/95 splits
"Joel Embiid joins Kevin Durant as the only players in the past 10 years to record 30+ PTS, 10+ TRB, and 5+ BLK in a playoff game."
"[Kevin Durant] Going to Golden State:: ""I knew coming here,"" he said. ""But I wanted to be a part of this so bad, I didn't give a f--k. Same with LeBron"
"Kevin Durant after game 2: ""I love how we stayed poised. We only were able to do that because what we went through in the first series."""
"[Slater] Kevin Durant: “Let’s just be real, it was a perfect storm for the Clippers last game. We came out with shitty energy at the start. I mean, I wouldn’t say shitty, but a little bit relaxed than the two games before.”"
[The Athletic] The Clippers’ best recruiting pitch for Kevin Durant is right in front of him.
"Kevin ""Pat Bev is in his head"" Durant finishes series averaging 35/5.3/5.3 and 1.5stls/1.2blks on 62/40/95 shooting"
"[Greif] Warriors making a change to starting lineup: Stephen Curry, Shaun Livingston, Klay Thompson, Kevin Durant, and Draymond Green."
[Warriors PR] Kevin Durant (right calf strain) will not return to tonight's game.
"OKC are 3-10 in the playoffs since Kevin Durant left in 2016. In those 13 games, Russell Westbrook is 136/350 from the field (38.9%)"
"[Stein] If the Warriors can't manufacture a win tonight minus Kevin Durant in Game 6 at Houston, it will mark the first time in 21 playoff series that Golden State has failed to win a road game"
"Patrick Beverley's response to holding Kevin Durant to 8 shot attempts and 9 turnovers: ""What do you think? Be Pat"""
"Kevin Durant in the playoffs before joining Golden State: 36 pp100, 56% TS; After Joining Golden State: 39 pp100, 65% TS"
[Get Up] Kevin Durant says Tony Allen is the best defender he went up against
"Kevin Durant on playoff matchup against the Clippers: ""We got our work cut out for us"""
Kevin Durant in the first three quarters tonight: 38/4/7 on 14/23 shooting
Kevin Durant is 2nd among active players with 58 playoff games of 30+ points. First place is LeBron James with 110.
"Steve Kerr post game: ""He said it yesterday; he's Kevin Durant, he showed everyone who Kevin Durant is"""
"Kevin Durant: ""i'm just goin in.. i'm leaving my follow through up a little longer"""
[Berman] There’s already a Knicks’ TV plan forming around Kevin Durant
A couple of reasons why Kevin Durant will resign with the Warriors this offseason.
Kevin Durant finishes game 6 against the Clippers with 50 points on 15/26 shooting!
"With guys who have run at least 100 isolations, Brandon Ingram ranks second in scoring frequency at 50.7%. Thats ahead of guys like Kawhi Leonord and Kevin Durant."
[Feigen] Warriors announce that the MRI on Kevin Durant confirmed the diagnosis of a strained calf and that he will not make the trip to Houston for Game 6. He will be reevaluated next week.
"""If we want to get this 3-peat, we desperately need him back. He's our best player.” - Klay Thompson on Kevin Durant."
Kevin Durant games with 8 or fewer shot attempts in 27+ minutes played: 1st 967 career games: 4x. Last 11 games: 5x
In both games so far both Kevin Durant and Patrick Beverly have been disqualified before the end of regulation.
Kevin Durant Passes Dwyane Wade for 10th on the all time Playoff scoring list.
Kevin Durant becomes the 6th player in NBA history to have consecutive 45-point games in the postseason
"For the first time in his career, Kevin Durant had more turnovers (9) than shot attempts (8) last night."
"[NBC Sports] Kevin O'Connor: ""(Kyrie Irving is) most likely to stay with the Boston Celtics. They're going to be in the running for Anthony Davis. Durant is going to consider the Knicks still, but I wouldn't rule out the Clippers or the Nets for that matter."""
Basketball at San Quentin State Prison is no idle pastime in “Q Ball.” Executive produced by Kevin Durant.
"[ESPN] Embiid has two games with at least 30 pts, 10 reb and 5 blk this postseason. The rest of the NBA has one such game over the last 10 postseasons (Kevin Durant in 2017 Finals)."
[Feigen] Rockets' Iman Shumpert concerned if he caused injury on play Kevin Durant was hurt
"Kevin Durant Full Highlights 2019 WCR1 Game 3 Warriors vs Clippers - 38 Pts, 7 Asts, in 3 Quarters! 🔥👀"
Patrick Beverley on Kevin Durant: 'I hope' he's in my conference after free agency | The Jump
Patrick Beverley and Lou Williams on guarding Kevin Durant
"If Kevin Durant maintains his playoff production this year, he’ll essentially tie Jerry West for 3rd Highest playoff PPG in NBA history at 29.1 PPG."
"Kevin Durant has made more midrange shots this postseason than the Bucks and Rockets, combined."
"Kevin Durant has 38 points at the half, the 2nd most points in a half in NBA playoff game history"
"Kevin Durant says he hasn't changed his game from a scorer to a distributor, or passed up shots recently. He's following the plays that coach Steve Kerr have been drawing up"
Patrick Beverly and Kevin Durant have both been ejected
Kevin Durant surpasses his Playoff Career High with 45 points with 2 minutes left in the game
"[Slater] Warriors leave Houston a little banged up. Kevin Durant had his right elbow worked on postgame, left with it in a compression sleeve. Andre Iguodala iced left knee, limped out of arena. KD said ""I'm fine."" Iguodala told me it was a little hyperextension."
"Kevin Durant Full Highlights in 2019 WCSF Game 1 Warriors vs Rockets - 35 Pts, 5 Rebs! | FreeDawkins"
[Slater] Kevin Durant limping pretty badly on his left leg. Going to the locker room. What a disaster quarter for the Warriors.
Draymond Green and Kevin Durant make a successful connection
"[Allie Laforce] Kevin Durant to have MRI tomorrow, will decide whether or not he travels with the team after MRI results"
Kevin Durant out to Stephen Curry and he finishes the reverse layup plus the contact - TNT
[Charania] Kevin Durant has suffered a right calf strain.
Kevin Durant Lower Leg/Calf Injury - TNT
"[Beer] The Warriors are 26-1 in the last 27 games they have played without Kevin Durant, but with Steph Curry in the lineup."
"Kevin Durant Full Highlights 2019 WCR1 Game 1 Warriors vs Clippers - 23 Pts, EJECTED! | FreeDawkins"
Kevin Durant on 50-point night: Felt like I could’ve made more shots | 2019 NBA Playoffs
Kevin Durant with the deeep three + the harm from Clipper's Gallinari
"[Puccio] Sources have told me marquee free agents like Kevin Durant, Kawhi Leonard &amp; Tobias Harris will consider Brooklyn when making a decision this summer."
[SNY] Kevin Durant is selling his Malibu home
"[OC] Kawhi Leonard has out-performed Kevin Durant in the 2019 playoffs, and it's not close"
[Warriors PR]Kevin Durant (right calf strain) will not return to tonight's game.
"Kevin Durant Full Highlights in 2019 WCSF Game 3 Rockets vs Warriors - 46 Pts, 6 Asts! | FreeDawkins"
[Nash] Kevin Durant’s 38 pts in the half of a playoff game are 3 more than steve nash’s 35 in 2005 vs Dallas. It’s not nearly as impressive though because there are more possessions in today’s game. And because Kevin Durant is taller and better at basketball.
[Haynes] Kevin Durant suffered a right calf strain and will not return.
"NBA playoffs scores, highlights: Kevin Durant scores 50 points as Warriors close out Clippers with Game 6 win"
I don't see Kevin Durant and Kyrie Irving fitting as teammates - Isiah Thomas
10-0 Run by Kevin Durant to put the Warriors up 1 in the 4th!
"With Kevin Durant on an Absolute Scoring Tear this Playoffs, What does he need to do to beat Michael Jordan's All Time Single Season Playoff Record of 759 Points?"
Kevin Durant is hurt. The 2019 NBA title hangs in the balance
He's Kevin Durant Compilation
"[Perez] Kevin Durant 2019 Playoff Scoring Average Before ""im Kevin Durant, you know who i am"": 22.0 PPG Kevin Durant 2019 Playoff Scoring Average After ""im Kevin Durant, you know who i am"": 38.3 PPG"
Kevin Durant Rumors: 'Recent Sense' Star Could Re-Think Leaving Warriors in FA
"[Anthony Slater] Kevin Durant strained his calf last season. Missed seven days, three games."
Patrick Beverley draws an offensive foul call from Kevin Durant
Kevin Durant laughed at CJ McCollum for thinking they could contend with the best of the West. Now they are both in the same place.
[Rob Perez] The spectrum of what just happened to Kevin Durant ranges from he's fine he'll be back out there in 5 minutes to the next decade of the NBA may have just changed shape before our eyes.
"ESPN reporter trys to bait KD. Kevin Durant, who has known James Harden a long time, doesn’t see any problem with how Harden plays"
[Charania] Warriors All-Star Kevin Durant has underwent surgery to repair a ruptured Achilles tendon.
"[Charania] NBA All-NBA: First team: Stephen Curry, James Harden, Giannis Antetokounmpo, Nikola Jokic, Paul George. Second team: Damian Lillard, Kevin Durant, Joel Embiid, Kawhi Leonard, Kyrie Irving. Third team: Russell Westbrook, Blake Griffin, LeBron James, Rudy Gobert, Kemba Walker."
"[Haynes] Kevin Durant will be cleared to practice today, league sources tell Yahoo Sports."
[Charania] Kevin Durant has an Achilles injury
[Letourneau] Kevin Durant has officially been ruled out of Game 1. DeMarcus Cousins is questionable.
Fan sends Kevin Durant flowers as apology for Canada's actions
"[Wojnarowski] Even if Warriors are able to keep Klay Thompson and Kevin Durant in free agency, it'll be a fight to reach playoffs in the Western Conference. Thompson's ACL rehab could take him into February or March -- and Durant likely misses entire season. Devastating turn of events"
[Windhorst on ESPN] Raptors say OG Anunoby will be available tonight. They were holding him back just in case they needed him to guard Kevin Durant
"Just last week the Warriors sat Klay Thompson for game 3 against his will, and people are really saying the organization pushed Kevin Durant to come back early?"
"[Bleacher Report] Post-Achilles Kevin Durant might not be Kevin Durant again, according to a doctor and a trainer: ""He's not going to be an 82-game-a-year guy.”"
[Charania] Kevin Durant (calf) has been listed as questionable for Game 5 of NBA Finals on Monday night.
"Zach Lowe: ""In defense of the Rockets, at least they're trying to beat the Warriors. All these other teams are like eh, we're going to build our young team...The Rockets actually tried and by the way, the Warriors have been extended past five games by two teams since they got Kevin Durant..."""
"[Charles Barkley] ""The Warriors ain't got no chance of winning without Kevin Durant... they're not going to beat the Rockets without KD, and they're not gonna beat Portland"""
Kevin Durant yells a not-so-nice word on national TV
"Report: Warriors star Kevin Durant struggled during practice, still isn't ready to play"
Pat Beverley Tries to Lure Kevin Durant to LA | Game Of Zones S6E8 (FINALE)
[Vardon] Kerr just now: Kevin Durant won’t play Sunday.
"[Haynes] Golden State star Kevin Durant will travel with the team to Toronto, a league source tells Yahoo Sports."
"[Kennedy] Bob Myers in tears, defends KD: ""Kevin Durant loves to play basketball and the people that questioned whether he wanted to get back to this team were WRONG. He's one of the most misunderstood people. He's a good teammate. He's a good person. It's not fair. I'm lucky to know him."""
Is Kevin Durant missing the finals the least amount of sympathy a player has ever received for missing time in the final round.
Respect to Kevin Durant
"[Charania] Golden State’s Kevin Durant is traveling to New York for doctor evaluations on his injured right Achilles tendon, league sources tell @TheAthleticNBA @Stadium"
[Kendrick Perkins] Where shall I start? 1- I’m the only one that picked Toronto to win tonight! 2- @RealSkipBayless I like bottled Diet Coke! 3-GS needs KEVIN DURANT! 4-The media will find a way to protect Steph Curry “Golden Child”! Kawhi J and The Wild African made me proud tonight! Oh Canada!
"Kevin Durant to Draymond Green after the game: ""Finals? ... They do not wanna to go there ..."""
Kevin Durant on why he stays arguing on social media: 'I'm qualified'
Kevin Durant finishes the 2019 finals with a TS% of 93.5
"Windhorst: ""Here's what I do know. Durant just isn't ready. His body isn't ready. The trainers don't believe it. He doesn't believe it. He tried to do some stuff in practice yesterday. It didn't work. There was frustration all around and from Kevin about it. Steve Kerr is frustrated about it too."""
"[Slater] Steve Kerr says the training staff isn't yet comfortable putting Kevin Durant in a game. The scrimmage, which Kerr discussed yesterday, won't happen today, Kerr now says. It's getting pretty late for KD..."
[Goodwill] Kevin Durant listed a game time decision. Went through shootaround and is now receiving treatment.
Draymond Green: 'Very Idiotic' to Think Warriors Better Without Kevin Durant
"There are 8 players who've made 5 All-Star games in the last 5 years: LeBron James, Kevin Durant, Stephen Curry, Anthony Davis, Russell Westbrook, James Harden, Klay Thompson AND Kyle Lowry"
"[Stein] The Warriors entered The Finals loosely targeting a Game 5 return for Kevin Durant from the strained right calf that sidelined him May 8. But with Steve Kerr saying that Durant is ""ramping up"" his workouts, perhaps Friday night's Game 4 (on June 7) is still in play"
The fact that it took a career-jeopardizing injury for people to turn around on Kevin Durant proves how fickle and flawed sports fandom really is.
"Kevin Durant just followed Lonzo, Kuzma, Ingram, and Lebrons Wife on Instagram."
Kevin Durant blasts a Warriors fan on Instagram after Game 3 win
"[O'Connor] Imagine Kevin Durant being listed as questionable, down 3-1 in Game 5 of the NBA Finals, and then not playing. What a tease that’d be. KD has to be playing"
"[Slater] Steve Kerr says Kevin Durant still has yet to be cleared for full contact, but “feasible” he could play in a game after only one practice."
Kevin Durant walking out to Warriors shoot around
"[WSJ] Kevin Durant is “100 percent undecided” on where he’s playing next, his manager @RichKleiman says at The #WSJFuture Of Everything Festival. “He really doesn’t know, and I really don’t know.”"
Charles Barkley when KD got injured during game 5 against the Rockets : “The Warriors have no chance of winning without Kevin Durant. This series or any other series.”
