"[Wojnarowski] Kevin Durant is planning March 20 return to OKC for jersey retirement ceremony for Nick Collison. Durant tells ESPN: ""It's about time for us to let go of all that extra stuff, and just come together - especially around this time, because it's Nick."""
"[Miller] ""I piled on Kevin Durant when he first made that move, I thought it was a sucker move, but I understand it and I understand why he did it. He's right. I don't think they would have ever won a championship... (cont)"
"PSA: Brian Windhorst has A LOT to say regarding Kyrie Irving, Kevin Durant, and Anthony Davis (link inside). A lot of the info includes insights from players camps and Knicks trade rationale is discussed."
Stephen A. Smith: The Nets can offer Kevin Durant a brighter future than the Knicks
"Luka Doncic has more all star votes than Kevin Durant, Paul George, and Anthony Davis."
A different angle on the controversial Kevin Durant play shows that he actually was in bounds
Kevin Durant definitely not out of line
"Woj-“Ugly scene just now in the Warriors locker room. Draymond Green punched Kevin Durant in the face and said, ""YOU F*CKIN MAMA'S BOY YOU SHOT US OUT THE GAME!!!"". Durant is now crying, sources tell ESPN"
"Kevin Durant reaches 30,000-minute milestone and becomes the second youngest player to score 22,000 career points"
Pre-GSW Kevin Durant vs. James Harden in the postseason: A statistical comparison
Kevin Durant mixtape
"[Complex Sports] Derrick Rose has more All-Star fan votes than Kevin Durant, James Harden, Russell Westbrook, Anthony Davis, and Paul George"
"When Kevin Durant said the media has a bias for LeBron James, this is what he meant (from NBA Countdown, Jan. 2, 2019)"
[Serious] Had Paul George been better than Kevin Durant this year?
"Pascal Siakam on the Lowe Post on who’s the toughest player to guard: “For me, the hardest, the toughest is KD.... Lebron can get to the rim but if he’s not hitting shots, it’s easier to guard him. But Kevin Durant can shoot over you, he’s skilled, he can pull up from 30.”"
"[Shiller] Steve Kerr on the bad 3rd quarter: “I don’t know if Kevin Durant touched the ball for about 5-6 minutes. That can’t happen. We’ve got to do a better job of getting him the ball.” KD only had 12 shots through the first 34 minutes, which helps explain 7 shots over the final 3:35..."
Kevin Durant aka Slim Reaper - Art/Design
"[Mark Medina]Kevin Durant (22,197) surpassed Clyde Drexler (22,195) for 31st play on the NBA's all-time scoring list."
Kevin Durant Theory
Kevin Durant launches @DurantCenter in hometown of Prince George’s County. @KDTrey5 @collegetrack https://youtu.be/MLfHj4RthDI
Kevin Durant or Anthony Davis?
How much longer can Kevin Durant hold on to his hair
"The Golden State Warriors (30-14) blows out the Denver Nuggets (29-14) 140-109 as they take number 1 seed in the West behind a combined 89 points from Kevin Durant, Klay Thompson and Stephen Curry."
[Medina] Kevin Durant on if this was a statement win: “No. I think they know who we are.”
"Happy 8th Anniversary to the Kevin Durant ""Bathwater"" Tweet!"
"[NY Knicks PR] Kevin Knox is the sixth youngest player in NBA history to score at least 30 points. Kobe Bryant, Devin Booker, Kevin Durant, Jaren Jackson and LeBron James were younger. (Basketball reference)."
Kevin Durant passes Clyde Drexler for 31st on the all time scoring List
"If Kevin Durant joins the Lakers and they trade for AD in the Offseason How many rings can LBJ, KD and AD win?"
"Is Kevin Durant jealous, ignorant or stupid?"
"Kevin Durant against the Wizards: 21 points, 5 assists, and 3 blocks"
"Have Kevin Durant, Steph Curry, Russell Westbrook, and James Harden raised the bar for what is considered an MVP season as far as scoring goes?"
"These playoffs Kevin Durant could face Westbrook, then Harden, then Ibaka, especially if they started today."
[Vorkunov] Asked Kevin Durant what he thinks of all these questions basically trying to divine whether he wants to go to the Knicks or not. Figured it's better to strip away the subtext.
What players in the league wouldn't be traded for 22 year old Kevin Durant?
Chatty Kevin Durant has plenty to say about the Knicks
[Bondy] Chatty Kevin Durant has plenty to say about the Knicks
Kevin Durant and his scoring streak title.
Relationship Between Steph and Kevin Durant
James Harden has only 12 more made FG this year than Kevin Durant. Harden is scoring 36.2 PPG while Durant scores 27.8 PPG.
Kevin Durant is planning March 20 return to OKC for jersey retirement ceremony for Nick Collison.
(NewsOK) Kevin Durant wants to attend Nick Collison Night but is only trying to boost his own image
[Charania] 2019 West All-Star starters: Golden State’s Stephen Curry Houston’s James Harden Lakers’ LeBron James (captain) Golden State’s Kevin Durant Oklahoma City’s Paul George
B.I. body + Kuzmas brain + Lonzos defense + Harts heart = Kevin Durant
[Mannix] Big picture: The Knicks have to be convinced they are going to land Kevin Durant this summer ... and are clearing the room so KD can sell someone on playing with him.
Kevin durant still doesn't have a child
"Maybe the most embarrassing 27 seconds of commentary ever. Mark Jackson and Jeff van Gundy ""analyze"" Kevin Durant ""throwing"" the ball and getting a technical foul."
What's most valuable achivement(s) for Kevin Durant? NBA FMVPs 2017 &amp; 2018 or regular season MVP from 2014?
Kevin Durant gives rapper Lil Tracy advise
Most points scored in the 1st half by notable rookies: - Luka Doncic: 28 tonight - LeBron James: 20 - Kevin Durant: 24 - Carmelo Anthony: 24 - Damian Lillard: 25 - Blake Griffin: 28 - Kyrie Irving: 21 - Steph Curry: 20 - Kristaps Porzingis: 20 - Dwyane Wade: 19 - Trae Young: 21
Do you guys think Kevin Durant will get a farewell tour like Kobe or D Wade?
"[Anthony Slater] Kevin Durant knew he was way out of bounds on that late save, wasn’t surprised the call was missed: “The refs were missing a lot tonight.”"
Is James Harden a better offensive player than Kevin Durant?
The refs when Kevin Durant was diving for the ball
"James Harden has now outplayed LeBron James, Stephen Curry, Kevin Durant, Russel Westbrook, Paul George and Anthony Davis in less than 2 weeks"
Kevin durant was 2-13 in overtime and 4th quarter
The Kings PA announcer said Kevin Durant has an “infectious disease” and his reaction was hilarious.
"Lost in the narratives about Klay and Draymond being bad from deep, Kevin Durant is shooting the worst he's shot from 3 since 2011"
Kevin Durant Bird Box Challenge via @maxisnicee
"[Anthony Slater]:Steve Kerr said Kevin Durant changed up a couple plays in the huddle late tonight, suggested to flip spots with Steph Curry so Steph could get the ball"
Did anyone get fined for the Kevin Durant out-of-bounds play ref criticism?
[Greenstein] 'That wasn't inadvertent': Bulls' Bobby Portis believes Warriors superstar Kevin Durant purposely injured his elbow
James Harden is currently averaging 34.2 PPG. That is a whole 2 PPG above any other active player’s highest scoring season with Kevin Durant 32.0 PPG
"[NBC Sports] Kevin Durant, Steve Kerr prove democracy can work in NBA in Warriors' win"
"Kevin Durant at the half: 20 points, 6 assists on 8-10 from the field and 4-6 from 3 in 18 minutes"
The Golden State Warriors arguably played the best half of basketball that they've ever played since acquiring Kevin Durant and are only up 19 to a injury plagued Denver Nuggets.
Poll Question: Would your organizations fans be more excited/hype to acquire Lebron James or Kevin Durant?
Kevin Durant Makes Fun of Denver Nuggets' Coach Michael Malone After Ste...
Kevin Durant via Twitter: @Ant_Wright shutup f*g boi i only went to college for a year and didnt pay attention in class at oak hill lol
"Kevin ""The Snake"" Durant was right all along about Billy Donovan"
Kevin Durant aka Slim Reaper - Art/Design
[Thompson] Kevin Durant has 'no clue' about Knicks speculation
Lakers TRADE NEWS: Lakers could TRADE Anthony Davis and Bradley Beal to make way for sensational Kevin Durant in the Summer.
[Colin Cowherd] Paul George is reduced to catch Westbrook's wide open airball 3 at the end of the game. This is why Kevin Durant left.
"[The Herd] Colin - ""Westbrook insisted on taking the last two shots with 3s last night, one of them being an airball. Paul George, who is an elite 3-pt shooter, was reduced to catching his airball last night. This is why Kevin Durant left"""
[Slater] Kevin Durant on Klay Thompson’s recent hot stretch: “It’s not like we looking at his hand saying: ‘We missed you.’”
NY Daily News: Chatty Kevin Durant has plenty to say about the Knicks
What if: Kevin Durant ended his carreer having won 6 titles
Harden puts on some crazy dribble and hits a tough three right over Kevin Durant!
"The Kings PA announcer says Kevin Durant has an ""infectious disease"". KD is dumbfounded."
Paul George better than Kevin Durant this season?
"Best college freshman ever: Zion Williamson, Carmelo Anthony or Kevin Durant? | College GameDay"
"Kevin Durant was the same draft class as Al Horford, Corey Brewer, and Marc Gasol."
"2019 West All-Star starters: Golden State’s Stephen Curry, Houston’s James Harden, Lakers’ LeBron James (captain), Golden State’s Kevin Durant, Oklahoma City’s Paul George"
Kevin Durant Signing w/ the Knicks just crashed and burned
Do you guys think Kevin Durant will get a farewell tour like Kobe or D Wade?
"In the 2015-2016 regular season, Kevin Durant played 72 games, he failed to reach 20 points just once (Injured in the 2nd quarter)"
TBT All Kevin Durant game winners and clutch shots for OKC Thunder
How would you compare Draymond Green and Shawn Marion? Also Joe Johnson vs Klay Thompson and Amare Stoudamire with Kevin Durant?
"Steph Curry, Klay Thompson, Kevin Durant, and Draymond Green shot a combined 5-26 from three. They also shot a combined 21-25 from two point range"
"[Slater] Kevin Durant: “Its AD wanting to play basketball somewhere. It’s not like the president shutting down the government."""
[theScore] Kevin Durant says AD asking for a trade isn't 'that serious...it's not like the president shutting down the government.'
Imagine how much better the NBA would be right now if Kevin Durant &amp; DeMarcus Cousins went to literally any other team besides Golden State.
Kevin Durant likes Instagram pic discussing Kyrie leaving Celtics
"Scott Perry drafted kevin durant. Wow,!!! Just feeling a lot more better now"
"Who is a better player to start a team with, Stephen Curry or Kevin Durant?"
Kevin Durant asked about Anthony Davis’ trade request and to what extent players talk about NBA news: “AD wants to play somewhere else. It’s not like the president shutting down the government.”
"Luc Mbah a Moute in Western Conference Finals 3 FG Allowed on 37 Matchups against Stephen Curry, Klay Thompson, and Kevin Durant"
"Im calling it Now,,, Kevin Durant to the Thunder come July"
"After the refs missed Kevin Durant being way out of bounds while saving the ball, almost costing the Rockets in OT, what are some similar cases of huge missed calls?"
That Was Out Of Bounds (BT ft. Kevin Durant)
Kevin Durant drinks Gatorade through towel and leaves commentators bewildered
[Sports Illustrated] Report: Warriors 'Have No Idea' If Kevin Durant Will Re-Sign in Offseason
Does Nike know something we don’t regarding Kevin Durant? His Warriors jerseys are now 75% off when added to cart.
"Malcolm Brogdon is currently on pace to become the 8th member of the 50-40-90 club. He would join Steph Curry, Kevin Durant, Larry Bird, Steve Nash, Dirk, Mark Price, and Reggie Miller."
Kevin Durant wins the 2019 ASG MVP presented by Adam Silver - TNT
"@ColinCowherd: ""I don't see [Kevin Durant] leaving Golden State. Do you? @sam_amick: ""Right now, I do... His people have gone around the league and talked in pretty alarming terms about the New York possibility. That's why we're talking about it so much."""
"One year ago, Kevin Durant said that Kyrie Irving is better than Allen Iverson. This week KD said that the Team LeBron starters are the top 5 players in the league. Does KD think Kyrie is better than Steph Curry?"
Kevin Durant With A Hard Slam Over Bagley
Kevin Durant : “I don’t believe I’m better than anyone. But I don’t believe anyone is better than me.”
"[SF Chronicle] Kevin Durant: ""The NBA is never going to fulfill me"""
[Slater] Kevin Durant asked about people who think he’ll leave Warriors: “That’s on them. I’ll figure it out once we get to that point.
"Kyrie Irving caught on video saying ""two max slots, it’s time"" to Kevin Durant"
Kevin Durant compares Jonathan Isaac to Giannis and Anthony Davis
"""Chris Paul will attack Steph Curry. P. J. Tucker will get up into Kevin Durant. ... This means something. The Rockets believe they can beat the Golden State Warriors."" — Shannon Sharpe"
Kevin Durant vs Kyrie Irving INTENSE 1-on-1
Something that surprised me: Kevin Love is just three weeks older than Kevin Durant
Kevin Durant with the ninja cosplay
Kevin Durant with the fancy dribbles and the stepback 3 to end the half
Kevin Durant wins the 2019 ASG MVP presented by Adam Silver - TNT
"Kevin Durant still considers the Celtics to be a team ""at the top"""
[Medina] Kevin Durant when told by @timkawakami that Steve Kerr wants his team to play with more anger. Durant: “I thought we play with joy?”
Kevin Durant - SWAGGER Basketball-themed Drama on CBS
"[Slater] Kevin Durant asked about any concern regarding the Draymond Green ankle sprain: “I mean, he’ll be back for the playoffs. That’s the only thing we worry about here, right?”"
"[Orlando Magic] Kevin Durant on players with similar length and skill set: ""I come along, then Anthony Davis, then Giannis Antetokounmpo, then you got Jonathan Isaac, the young guy in Orlando."""
Who is the best player comparison for Kevin Durant?
(Video): Kyrie Irving talks about his video with Kevin Durant: “This is crazy”
Embiid and Kevin Durant exchange?
Guys I think Kevin Durant is signing with the Memphis Grizzlies
[ESPN] Kevin Durant will keep trying to rack up accolades after All-Star Game MVP | NBA All-Star 2019
[Medina] Kevin Durant on player comparisons: “I don’t believe I’m better than anyone. But I don’t believe anyone is better than me.”
[RealGM] Kristaps Porzingis would welcome playing with Kevin Durant on the Dallas Mavericks.
"Back in June, Kevin Durant said he could see himself retiring by the time he's 35 years old"
More impressive season: Kevin Durant in 2014 vs James Harden 2019?
Do you like Kevin Durant?
Why has the consensus changed for Kevin Durant being better than Steph Curry? What things do you feel KD is unquestionably better at?
[Slater] Kevin Durant asked about Kerr saying the team needed to play with more anger: “I thought we moved off joy. Now anger? I disagree with that one.”
Kevin Durant has super heated exchange with reporter after being asked about New York Knicks - “who are you?”
"With the first pick in the 2019 NBA All-Star Draft, LeBron James selects Kevin Durant from the Golden State Warriors | TNT"
"[Bondy] I have to say, Kevin Durant was cordial and accommodating with New York reporters when we asked him about his free agency last month."
"[Brandon Pope] Kevin Durant, who created fake social media accounts to argue with 14 year olds, tells a member of the media to “grow up” for asking free agency questions"
Kevin Durant Post Game Press Conference (3:30)
Kevin Durant was right
"Kevin Durant heated exchange with Media: ""I got nothing to do with The Knicks, I don't know who traded Porzingis, they got nothing to do with me""... ""Grow up!""....""So?! Who are you?! Why do I gotta to talk you?"""
Kevin Durant Walks Out on Media After Knicks Free Agency Questions (via NBCSWarriors)
"Here are the only 5 players this season with A grades in our One on One, Finishing, and Playmaking metrics: Kevin Durant Pascal Siakam LeBron James Bradley Beal Blake Griffin. It looks like Siakam has a bright future."
"Bruno Caboclo ""The Brazilian Kevin Durant"" with 16 points on 6-9 (3-5 from 3), 5 rebounds and an assist in a 117-95 loss for the Grizzlies against the OKC Thunder!"
"Give the New York Knicks credit, they are pulling out all the stops in their pursuit of Kevin Durant"
"In tonights game against the Miami Heat, Kevin Durant, Klay Thompson, and Steph curry finish with a combined 93 points."
Kevin Durant ties it up with a three
The Warriors Need Kevin Durant More Than He Needs Them
Golden State Warriors star Kevin Durant is focused on building a future after basketball
"In tonights win against the Miami Heat, Kevin Durant finishes with 39 points, 6 rebounds, and 4 assists on 16/24 shooting. Combined with Klay Thompsons 29 points, and Steph Currys 25, the three combine for 93."
"Kevin Durant is moving his company ""Thirty Five Ventures"" to a NYC office."
[ESPN - Ramona Shelburn] How Kevin Durant made himself into a mogul
Who in the league plays the best defense on Kevin Durant?
"Malcolm Brogdon On Pace To Do Something Only Stephen Curry, Kevin Durant Have Done Recently"
Is Paul George better than Kevin Durant at any point in OKC?
"[Royce White] ""There’s only six legitimate point forwards in the ENTIRE WORLD. LeBron James, Ben Simmons, Giannis Antetokounmpo, Kevin Durant, Luka Doncic, and Me."""
"Even in an r/music post about the Foo Fighters and Pearl Jam, Kevin Durant can't escape his reputation"
Kevin Durant on Twitter
[King] Here's the full exchange Kyrie Irving had with reporters about that video with Kevin Durant:
"Kevin Durant commented on a Barstool video referring to him as a snake ""Whoever wrote this caption is a hoe"", and immediately deleted it."
[Basketball Reference] Kevin Durant is on pace for his 9th season with a PER of 25+. He'd be the 6th player in NBA history to do that 9+ times
Kevin Durant 2018-2019 Nba Season Mix!!
[Slater] Kevin Durant asked about Kerr saying the team needed to play with more anger: “I thought we moved off joy. Now anger? I disagree with that one.”
"Throwback: Kevin Durant 54 Pts, Career-High. EASY MONEY SNIPER MODE!"
Kevin Durant tells Josh Hart to “Stop flopping” as both get technical fouls
[Twitter] Kevin Durant likes Twitter Posts about Warriors fans' reactions to him leaving this summer
"Klay Thompson appears unaffected with free-agency speculation, but what about Kevin Durant?"
[Letourneau] Kevin Durant didn’t talk at shootaround today. We’re now on Day 9 of him not speaking publicly. Will be interesting to see whether he talks postgame tonight.
Amin says that the Knicks should feel ‘pretty good’ about Kevin Durant coming this summer | The Jump
Kevin Hart + Draymond Green on Kevin Durant to Golden State | Cold as Balls | Laugh Out Loud Network
Kevon Looney was projected to be Kevin Durant-like 5 years ago
[Letourneau] Kevin Durant didn’t talk at shootaround today. We’re now on Day 9 of him not speaking publicly. Will be interesting to see whether he talks postgame tonight.
"in terms of individual accomplishments outside of championships, Kevin Durant is the third best of player of the original OKC big 3 right now. Russ is legit about to average a triple double for the third time in a row, man is a god and Harden playing like a repeat MVP right now. Thoughts?"
What is the ceiling if this Brooklyn roster stays intact and adds Kevin Durant
"Does the fact that Anthony Davis, Kyrie Irving, and Kevin Durant being signed to Nike make them more likely to team up?"
[ESPN] GM Bob Myers says Kevin Durant free-agency talk not hurting Warriors
"Here are the only 5 players this season with A grades in our One on One, Finishing, and Playmaking metrics: Kevin Durant Pascal Siakam LeBron James Bradley Beal Blake Griffin. It looks like Siakam has a bright future."
The Knicks are so terrible the only thing left to sell Kevin Durant on is the chance to save the franchise - NY Daily News
Can Kevin Durant redeem himself by leaving gsw and leading his own team similar to how lebron redeemed himself after leaving Miami
Kevin Durant is signing with the Knicks
"Kevin Durant walks out of presser, after being asked what he deems to be a bland question."
"[ESPN] Video: This is the full 2:50 of Kevin Durant addressing why he hasn't been talking to the media lately: ""I just don't trust none of y'all."""
"Marcus Smart has a higher 3P% this season than Kevin Durant, James Harden, Kawhi Leonard, Josh Richardson, Lou Williams, Damian Lillard, Jamal Murray, Otto Porter Jr., Bradley Beal, Devin Booker, Donovan Mitchell, Joe Ingles, and Kemba Walker."
Kevin Durant played 49 minutes?🤔
"[Post Game Thread] The Golden State Warriors (40-15) defeat the Miami Heat (25-29) 120 to 118. Kevin Durant, Klay Thompson, and Steph Curry combine for 93."
[Medina] Kevin Durant upset with the media and the free agency talk
Kevin Durant is angry that reporters ask him about free agency instead of team-related questions. He's then asked a question about team play and gets up and leaves
Newly Released: Draymond Green reflects on his fight with Kevin Durant and how that affected the team and how he has changed as a person. Amazing interview that shows a different side of Draymond!
"Kevin Durant: ""I got nothing to do with the Knicks. I don't know who traded Porzingis. That got nothing to do with me. I'm trying to play basketball."""
Kevin Durant is absolutely lethal from the midrange this season
"Kevin Durant is shooting over 50% from the field for the 7th Straight season. Last time he failed to so was in 2011-2012 (FG% was 49,6%)"
Russell Westbrook's averages since Kevin Durant left the Thunder
"NBA Stars Tinder Profiles! Stephen Curry, James Harden, Kevin Durant + More!"
Kevin Durant Knew This About Lebron James The Whole Time
Kevin Durant has the most unique pregame warmup in the NBA
"According to The Athletic, if Kevin Durant were to leave the Golden State Warriors, “he would do so to escape the shadow of Stephen Curry.”"
Am I able to say this? Top 3 scorers(able go score without flopping and ref baiting) in the league are 1. Kevin Durant 2.Zach Lavine 3. D'Angelo Russell
Stephen Curry missed his last 8 shots before his last second dunk. Kevin Durant went 4/4 in the fourth quarter for 11 points.
Karl-Anthony Towns with a massive dunk over the fearful faced Kevin Durant
Kevin Durant dead ball fouls KAT with .5 left in a tie game
Fun fact: Blake Griffin is shooting more threes and a better % from three than Kevin Durant.
Kevin Durant against the Grizzlies tonight: 28 points on 12/13 shooting
"[Haynes] Draymond Green fined $35,000, Stephen Curry fined $25,000 and Kevin Durant fined $15,000 for their parts in criticizing an official."
[Lemoncelli] Kevin Durant ‘Gutted’ By Death Of Cliff Dixon: Plans To Dedicate Remainder Of NBA Season To His Friend
Kevin Durant over the past 2 games has missed a total of 2 shots.
Kevin Durant on resting/load managing for the playoffs: “What else we gotta do? I ain’t got nothing else to do w/my life at this point but play ball.
"Fun Fact: James Harden has as many 50 point games in his career as Steph Curry, Kevin Durant and Russell Westbrook combined"
"Three teenagers in NBA history have put up 37+ points and 9+ assists in a game: LeBron James, Kevin Durant, and Anfernee Simons."
"[Connor Letourneau] Kevin Durant will play tonight against the Pacers grieving the death of his close friend Cliff Dixon, who was shot and killed Thursday morning outside of an Atlanta bar."
"[Rovell] Stephen Curry has joined LeBron James and Kevin Durant as NBA players who are executive producers. ABC has picked up a 10-episode mini-golf competition produced by Stephen Curry called “Holey Moley,” a 10-episode mini-golf competition with Curry, Rob Riggle, &amp; Joe Tessitore."
[Slater] Update from Warriors shootaround: Kevin Durant will not play tonight in OKC.
[OC] Kevin Durant and Steph Curry's Totally Normal And Not Completely Unfair Shot Charts
[New York Post] D'Angelo Russell to give Kevin Durant grand tour of Brooklyn
"[OC] Giannis Antetokounmpo is 1st in the league in Plus Minus with 568, +32 over 2nd - Kevin Durant"
Kevin Durant finishes the night with 21/3/9 on 69% shooting
"[Lowe] In late June 2016, just days after winning one of the most thrilling and historically significant NBA Finals in history, David Griffin, then the Cleveland Cavaliers' GM, gathered his staff and gave them a directive: Explore ways to get Kevin Durant."
"[Buha] Kevin Durant on Landry Shamet: ""He's an amazing young player and I think he will be a force in this league for a while, especially the way he plays. Credit to him that we had to switch our game plan up for him. I tried to take on the challenge of just chasing him around and using my length."""
"This golden moment when Russell Westbrook, James Harden and Kevin Durant whirl the Thunder crowd into a frenzy"
"[Poole] Draymond Green's 35K fine was bigger than those of Stephen Curry (25K) and Kevin Durant (15K) because Dray utilized social media, per NBA sheriff Kiki VanDeWeghe."
Kevin Durant listed his Top 5 All-Time 1. MJ 2. Kobe 3. Shaq 4. Hakeem 5. Magic
"Kevin Durant is on his 8th straight season with 60%+ TS, the longest active streak amongst players averaging 1+ 3PA"
Kevin Durant had a career-low of 5 Field Goal Attempts during tonight's game vs. Charlotte Hornets
Rajon Rondo Is Shooting Better From Three Than Kevin Durant This Season
Kevin Durant with a quiet:+23 with 26/4/6 on 66.7%
D’Angelo Russell will give Kevin Durant a tour of Brooklyn as part of a segment in KD’s show
"If James Harden finishes 2nd in this year's MVP race, he'll tie Michael Jordan, Lebron James and Kevin Durant with the 3rd most MVP runner-ups in history with 3."
Dwyane Wade sends Thoughts and Prayers to Kevin Durant After a Terrible Tragedy
